1438501,"第二次来，还书，借书。 

借书的这边安检很严，食物不许带进去，糖也不行，我看着有位女士掏出了兜里的费列罗巧克力。不知道如果是低血糖的人需要随身备糖是不是会被特许带进去。 

对于查询系统还是不太熟悉，哪位大神比较熟悉的话欢迎指点。
比如这本《虚无的十字架》，显示中文图书借阅区有，但是没有位置，也没法儿找。
比如这本丰子恺先生的书，我查到了，有人借走了，想预约，但是却不知道要点哪里。
整体上，还没有找到查询系统的筛选功能，如果找一本书，会出来很多结果，但我只想看，当时可以借阅的，然而并没有找到，所以只能一页一页地去翻。",/Date(1543974496000+0800)/,0
282916233,文化人的天堂，去国图要预约，氛围很好,/Date(1613282543000+0800)/,0
3272780,世界最好的图书馆之一，馆藏图书丰富。,/Date(1611670910000+0800)/,0
238706009,国家图书馆位于北京，很大也很好。,/Date(1611532698000+0800)/,0
14368479,必须承认国家图书馆真的太大了，而且里面不定期讲座对所有人开放，讲座类型丰富，有时间可以过来听！而且有存包的地方，文创产品也很多！,/Date(1575387148000+0800)/,1
2038425,这里到底是国家级的图书馆了，到处都是各种的高大上，这是任何其它的图书馆所不能比拟的。这样子的地方当然来打卡的人也是超多的。不过还是一定要来一次的,/Date(1561194554000+0800)/,2
48100066,"一个国家希望起于教育、文学、艺术、科学。
今日被震撼、全是过来提升自己……
只有自己变得优秀才能吸引更优秀的人……
太想学习了",/Date(1572628970000+0800)/,1
4282945,经常来这里看书，每次都背一个迪卡侬小背包，放件衣服、伞、纸巾什么的，安检没出过问题。可是今天突然拿起我的包看了看，说超过A4纸大小的包都不让带进去。看了周围没有A4纸，无法测量，虽然我自己目测包的上半部比A4纸窄，但无法证明，只好下楼去存了包，手上拿着衣服（里面冷气太足需备件长袖）和伞重新回来安检进入。以前来了多次也没拦过，这次进来后注意了下其他人带进来的包，发现很多都比我的包大，怎么安检的？怎么进来的？安检居然也有歧视行为！,/Date(1527655134000+0800)/,5
616685,知识的海洋，环境优雅，非常干净，也有很多植被，让人感觉很在这里赏书很舒服。这里藏书很丰富，足足带上一天完全可以。,/Date(1450933174000+0800)/,7
96543375,要说性价比高非国家图书馆莫数，图书馆正门上去都是看书的地方，正门往北再往西有一栋楼，是借书的中文馆。想要借中文书的话就去正门上去二楼右手边先充100块钱押金，然后才能去北边儿楼借书一次可借三本，每次一个月可续借一个月。,/Date(1527646203000+0800)/,2
258573419,在知识的海洋里畅游，时间过得有意义,/Date(1578648114000+0800)/,0
41955490,为了一本书来，却爱上了整个图书馆。,/Date(1527484727000+0800)/,0
39105257,和紫竹院隔着一条河，里面藏书很多很多，空间很大很大，可随时办卡借书，很方便快捷。在图书馆下面南北两侧经常办展览，还有音乐厅和电影院，电影院的电影票很便宜，只有一大一小两个厅，设备稍显陈旧,/Date(1499432239000+0800)/,2
59130118,是北京最大的银杏林，一眼望不到底的83万余棵银杏树，绝对让你震撼。漫步在银杏林，百米银杏林所折射出的大美之感跃然心头，这是一个人物摄影的绝佳之处。,/Date(1480525756000+0800)/,4
25063734,国家图书馆分为一期和二期，二期的建筑仿佛一本书一样，里面有很大的阅览室挑空，环境优美,/Date(1447846861000+0800)/,1
1489999,交通方便，四号线和九号线都能到。有存包的地方，这个很方便。看介绍，这藏书真不是一般的多！侧楼是儿童图书馆，需要一名大人陪同进去。一楼是低龄儿童用书，二楼是大童用书。正馆13岁以下的孩子不能进去。不过里面的气氛特别好，绝对让你沉浸在书的海洋中。,/Date(1486137858000+0800)/,1
1532332,唯一的缺点是不能带自己的书进去 不过里面资源真的太多了 环境也好,/Date(1449420253000+0800)/,2
194043646,真的很不错，去过多次，环境很好，很安静，也很干净，是一个真正能够静下心来看书的地方，图书藏量也是相当的大，有好几个馆，满足你各种看书的需求,/Date(1555768961000+0800)/,2
48368171,有时间应该一去的地方，既有自然景色，更多的是文化氛围浓厚,/Date(1509886395000+0800)/,0
34164222,交通便利，地铁就走国图这一站，非常方便。可以免费看书，登记身份证就可以了,/Date(1475596237000+0800)/,7
101947377,值得一去！淡淡的书卷味，下沉式的阅览室，在这里，所有人都会自觉降低自己说话的声音或不做声，生怕打扰了那一片因专注看书的宁静。,/Date(1501303290000+0800)/,0
101332016,虽然不在北京生活，但还是逗的办了张馆卡，很多很多人安静的在看书做自己的事，很舒服，喝水也很方便，还有沙发可以休息，来北京旅游印象最深刻的一个地方,/Date(1499734429000+0800)/,3
102785630,中国国家图书馆位于北京市中关村南大街33号，与海淀区白石桥高粱河、紫竹院公园相邻。是国家总书库，国家书目中心，国家古籍保护中心；是世界最大、最先进的国家图书馆之一。国家图书馆面积大，书籍多，环境好。,/Date(1554346359000+0800)/,0
4968885,藏书丰富，服务态度好。还有专门的儿童区。可是感觉儿童区的书还是偏少，偏幼儿。可惜全国其他地区人民享受不到这种服务。什么时候各个城市图书馆差距小点就好了。,/Date(1472286239000+0800)/,2
3797320,是亚洲规模最大的图书馆，居世界国家图书馆第三位。开放时间周一至周五9:00-21:00、周六至周日9:00-17:00。这里有很多古籍，如著名的《永乐大典》、《四库全书》等举不胜举。,/Date(1490487607000+0800)/,0
47428474,北京出差，专门抽了点时间来，简直太值得来了！呆了一下午没够呀！,/Date(1474470704000+0800)/,0
24145879,国家图书馆，是书海，是智力集中营，分门别类一应俱全。很多人都说，现在都看电子书了，谁还看那个书。个人认为，图书馆的作用是鼓励人们养成阅读的习惯。电子书很多时候，都不是在认真读书,/Date(1484842758000+0800)/,0
116961042,办会员卡，进去之后书很多，可以借书，很方便，而且还经常举办活动，非常有趣，自习室也很安静。,/Date(1582899201000+0800)/,0
87258570,中国国家图书馆总馆位于中关村南大街33号，古籍馆西城区文津街7号，现有南区、北区、少年儿童馆、古籍馆、国图音乐厅等，截至2012年底馆藏文献已达3119万册（件）。,/Date(1501069727000+0800)/,0
37316095,号称亚洲第一的图书馆，整体大气宽博，只要你想找的书基本都有库藏，真是很强大，环境也很不错，大家都能安静看书，唯一不方便是许多分馆不允许带包进入。,/Date(1496063100000+0800)/,1
54433533,具有浓厚的历史文化气息，可观光可学习，不错的人文景观,/Date(1462536231000+0800)/,1
168187879,国图建筑恢宏霸气，馆藏图书丰富。每天从此经过，但好久没有进去了，记得毕业前，为了写论文经常在这里查资料。昨天带孩子感受国图书海墨香，求知若渴的氛围。,/Date(1528580467000+0800)/,0
24714090,北京国家图书馆，位于北京海淀区中关村大街上，地铁，公交320.运通105.运通106，332特4等有国家图馆站。这里还有个博物馆。值得来读书参观。,/Date(1566867077000+0800)/,0
47528298,国家图书馆，特别是少儿阅览室，里面的书籍特别齐全，孩子很喜欢看。,/Date(1579770784000+0800)/,0
251820979,很不错 书籍很多 挺漂亮的 另外环净优美 适合广大学生和青年读者阅读浏览,/Date(1573914412000+0800)/,0
35446243,书的海洋，知识的宝库，交通方便，方便读者大众，坐着地铁四号线直达。也实现了网上借阅，只不过还没有试过。,/Date(1455524391000+0800)/,2
7437625,这个社会需要读书，图书馆是读书最好的去处，给自己点时间，去看看书吧。有钱的买书，没钱的借书，国图看书靠谱，交通还算便利，推介大伙看书去。,/Date(1499959124000+0800)/,0
62573136,周一闭馆！！！信息更新太慢啦！！！,/Date(1468809901000+0800)/,5
9456948,带孩子来看牙的等待时间太漫长了，不如先带孩子来国家图书馆看看，这里有专门的儿童阅览区，非常干净，安静。不过孩子有点小，不是很有耐心。,/Date(1484351584000+0800)/,0
31193234,这里的书最全，很多找不到的书，外地人千里之外来寻书。这几年国图修建的很大很新，看书的桌椅和空间非常多，基本都有座，还可以带电脑去。,/Date(1472503083000+0800)/,0
4398101,第一次去的时候被震撼到了，是一个学习查资料的好地方，但是座位不太好找,/Date(1520550359000+0800)/,3
5990745,国家图书馆是亚洲规模最大、世界第三大的图书馆，足足有28万平方米！图书馆的各个区域都是用玻璃来分隔的，书柜集中在中间，场面很震撼,/Date(1512958775000+0800)/,0
103318417,国家图书馆，值得带孩子去看一看，很壮观，很大很大,/Date(1501760432000+0800)/,2
80272203,到底是首都，图书馆大气，气氛很好，是学习的好地方，能去这里的知识海洋遨游一番，绝对值，书籍很齐全，环境安静幽雅，图书管理也很好。,/Date(1486716755000+0800)/,0
3070944,办卡免费，借书不知道要不要钱，还没借过，环境很好，很安静，有很多座位,/Date(1482830753000+0800)/,5
82467875,中国国家图书馆，更确切地说是国家图书馆的分馆——国家典籍博物馆，无意间发现的好去处，也是这次北京之行收获最大的地方。展厅很丰富,/Date(1505437574000+0800)/,0
69647446,国家级图书馆，现在还开设了国家典籍博物馆，不仅可以看书还可以参观博物馆，很适合爱看书的人，只是需要存包。,/Date(1572957731000+0800)/,1
16560507,以前是北京图书馆，后来改成国家图书馆！非常棒！进去参观过一次！里面安静，高级，很多藏书都有。而且还有很多座位提供给我们看书。,/Date(1566951862000+0800)/,0
69647446,国家级的图书馆～馆藏丰富～还有一个国家典籍博物馆可参观～还有不定期的各种讲座～很值得参观～看书也很好～,/Date(1562028055000+0800)/,1
20970275,中国最全的善本苦，在这个纸质书越来越少的时代，去去可以静心凝神,/Date(1483600499000+0800)/,3
50079156,值得一去，就是空间小，人多了得做到地上看,/Date(1578432287000+0800)/,0
82467875,国字号的图书馆，当然值得去了。交通便利，门口就有公交，地铁。环境舒适，是个静心的好去处。平时在这里可以看看书，查查资料。,/Date(1513732458000+0800)/,0
2624052,时间充裕时可以到这里体验下，阅读、学习、发呆、写作和思考人生等等，只要不影响到别人即可！环境很好，安静无扰，免费，喜欢！,/Date(1512959618000+0800)/,0
8280636,书香门弟，外表庄严肃静其实里面很大很壮观，读者很多，本应该安静学习的地方怎么能成为景点呢？真的需要静下心来好好看看书吧。,/Date(1508027636000+0800)/,0
38320854,去国图很方便，国图是地铁4号线和9号线的换乘站，名字就叫国家图书馆。这里的馆藏书多到数不清，当然，进国图是不可以带包的。,/Date(1486517560000+0800)/,0
4582490,到这里查阅资料能够查阅到很全面，非常安静,/Date(1449645821000+0800)/,0
6072486,暑假开始了，有孩子的家长可以带孩子来之里即看书了，还可以避暑，有孩子的活动区，真是个不错的选择。,/Date(1563411943000+0800)/,1
599550,去看看建筑，去看看书吧，很不错。,/Date(1575934158000+0800)/,0
28297455,非常好的经历，我下次还会再来的,/Date(1577322711000+0800)/,0
20970275,中国最大最全的图书馆，也是最多单本的存储地之一。,/Date(1498917928000+0800)/,3
119100598,到书的海洋，充满书香的味道，感觉特好，非常喜欢,/Date(1504955023000+0800)/,3
82467875,中国国家图书馆，更确切地说是国家图书馆的分馆——国家典籍博物馆，建筑宏伟，大气壮观，内部也很宽阔、舒适。,/Date(1526173104000+0800)/,0
154839392,免费开放的，四层，里面藏书特别的多，周末不知道去哪玩了，又不想宅在家，来这里安静的看会书真是不错的选择！,/Date(1512880200000+0800)/,0
498971,很久没去了  藏书真是太多,/Date(1583276217000+0800)/,0
1086992,图书种类繁多，环境优美，区域划分清晰，应有尽有，楼宇造型也美。,/Date(1456627449000+0800)/,0
38030833,里面很大，有各种学科各个方面的书，好多珍贵资料可以查阅拷贝影印版，环境很好，周围吃饭饮水也很方便,/Date(1527321187000+0800)/,0
66870644,被藏书量所震撼，更是被一位70多岁的老人在翻阅大词典而敬佩他们，敬佩知识。,/Date(1507301718000+0800)/,1
771362,国家图书馆是在中关村南大街，可以免费看书。还有一个小的电影院，价格实惠。,/Date(1569889153000+0800)/,1
8046725,国家级的图书馆，整体钢结构。真正的高大上，凭二代身份证免费进阅览室，参观一下是极好的！！！,/Date(1504158037000+0800)/,0
26282159,国家图书馆位于海淀，这里书的种类太多，喜欢看书的小朋友，趁着放假，来这里也是学习的好地方。,/Date(1471048746000+0800)/,0
50359082,图书馆的规模很大，里面人很多，有点闷，里面的藏书很多，还有wifi信号，非常方便大家读书。,/Date(1465364517000+0800)/,0
39144197,不愧为国字头的，非常气魄，关键是里面的书的数量，面全，两个字浩瀚！,/Date(1561793011000+0800)/,1
6067839,国图阅览室可以办卡或凭身份证入内，只是不能带书包和水。里面有饮水处。可以来自习或者看书，氛围还是很好的。从前也有自习室，不知道现在是否还开放了，也是要早去才能有座位。,/Date(1492316412000+0800)/,0
29747210,国家图书馆位于海淀区，这里的书特别多，科技的，医学的，太多了，喜欢看书的一定要来这里。,/Date(1471823382000+0800)/,0
15532342,非常赞的图书馆，新馆的设计很有特色，在里面看书真的是一种享受，完全沉浸在书的海洋。,/Date(1568284379000+0800)/,0
44116483,有个少儿馆，图书量很大，可以一位家长带个孩子，免票，带证件就可以。宝宝很喜欢这里,/Date(1511877759000+0800)/,0
65071825,这个地方非常好，内容非常的丰富，建议你去,/Date(1504151106000+0800)/,2
65652026,就感觉是好大好大的图书馆。里面藏书无数，既伎不看书，就参观参观，也需要很久。,/Date(1507268211000+0800)/,0
6995753,作为高手的国家图书馆。非常有名来北京，其实真的所有的旅游者都应该来国图看看。,/Date(1499096165000+0800)/,0
43790891,这是春天海棠花开，馆内各处花开灿烂。,/Date(1462769994000+0800)/,0
36276463,干净整洁，氛围好，书真的是太多了,/Date(1517975919000+0800)/,2
29659718,位于中关村，地铁有一站。地理位置优越，环境很好，关键是外观设计非常漂亮！,/Date(1513402578000+0800)/,0
,非常好，书很多，内容很足粑粑麻麻,/Date(1459840277000+0800)/,0
111512431,国家图书馆建筑气派，装备现代，是读万本书的好地方！,/Date(1526978798000+0800)/,1
112462802,现代化图书馆，有南北两个馆，书籍收藏丰富，数字化管理，非常值得来看看！,/Date(1514214117000+0800)/,0
15308905,不错的，篮球场地还是挺好的。,/Date(1459822640000+0800)/,0
84651483,琴棋书画诗酒茶花，在这里都有，或者欣赏或者学习,/Date(1562050011000+0800)/,1
49702924,国字号，不是盖的，特点是大而全，缺点是专业性弱，当然这是不可避免的,/Date(1489545153000+0800)/,0
101001103,亚洲最大的图书馆和网上数字图书馆，环境好，藏书和各种文献比较全。,/Date(1556770306000+0800)/,0
47528298,安静的地方，适合静心看书。假期亲子好去处！,/Date(1563682887000+0800)/,1
21826893,这里值得大家去，带上孩子可以去他的博物馆里面可以玩古代的游戏。,/Date(1517633261000+0800)/,0
152707998,内部真的特别好看！！有一个像香港TVB演的那种法庭的座位 很喜欢,/Date(1510360403000+0800)/,0
79408604,超级大，不能带行李进去，可以寄存，进去前要安检，好幸福，好多书,/Date(1487491474000+0800)/,0
168187879,四通八达的交通，丰富的藏书，整洁的环境，周末经常有各类展览。,/Date(1522838595000+0800)/,0
83770724,很高大上。里面的书太多了。进去要保持安静。里面很多人在看书。,/Date(1501592154000+0800)/,0
25035034,很赞，超级赞。如果，可借图书的每册，如果更多一些就更好了。,/Date(1456312473000+0800)/,0
1552616,学生时代很多作业和论文都是在这里完成的，大阅览室非常有氛围,/Date(1449310394000+0800)/,0
58063001,感觉太好了，1973的超长5层图书馆，南馆外文文献阅览室,/Date(1572105293000+0800)/,0
197777054,图书馆很多，附近还有人民大学和其他几个大学。学习氛围浓厚,/Date(1567737633000+0800)/,0
2671333,知识的天堂，周末的好去处，累了也可以逛逛旁边的紫竹院公园,/Date(1558692166000+0800)/,0
67531329,里面安静，宽敞明亮，环境特别好，。，,/Date(1505207635000+0800)/,1
59559857,国家图书馆还不错的，有时间绝对可以去看看书，充点电，呵呵,/Date(1503730609000+0800)/,0
83770724,里面太壮观了。里面看书的人也很多。很安静。打车去也方便。,/Date(1498966201000+0800)/,0
86796503,是一个很适合学习的地方 安静 书籍很多,/Date(1502583484000+0800)/,1
101001103,国家图书馆是国内最大最全面资料和藏书最多的图书馆。,/Date(1566539340000+0800)/,0
111512431,很现代化，很气派，是闲暇时间，博览群书的好地方！,/Date(1557964615000+0800)/,0
168295976,是亚洲规模最大的图书馆，居世界国家图书馆第三位。,/Date(1523529045000+0800)/,0
104806569,有非常丰富的馆藏，交通便利，来这里看书非常有氛围,/Date(1513843989000+0800)/,0
7362778,图书精美，收藏品众多，想要增长见识的朋友值得一逛,/Date(1506039899000+0800)/,0
85390477,很漂亮，建筑设计也很有特点，不愧是国家图书馆啊！,/Date(1496019292000+0800)/,0
25265453,书籍的汇总，知识的海洋，安静的氛围，安心的学习。,/Date(1456673873000+0800)/,0
17524332,国家图书馆在魏公村附近，建筑非常大，藏书非常多,/Date(1572263349000+0800)/,0
34022235,高端大气的图书馆，藏书很多，人很多，很有秩序！,/Date(1570508096000+0800)/,0
6112680,安静，各种资料应有尽有，非常适合自习，写作业。,/Date(1570321297000+0800)/,0
5490788,国图新馆很棒，不看书去逛逛感受下氛围都是极好的,/Date(1518742019000+0800)/,0
7491854,可以去办看上这些嗯现在这个社会嗯爱读书的人很少,/Date(1497108768000+0800)/,0
474354,知识的海洋！各种资料都能查到，实在是学习圣地！,/Date(1477024982000+0800)/,0
26672732,景色很好，安静读书的好地方，有时间可以再来。,/Date(1571429612000+0800)/,0
55528222,学习读书的好地方  这里的人都在汲取营养 无论大小,/Date(1565321372000+0800)/,0
4638623,图书馆的建筑挺醒目，里面环境不错，比较安静。,/Date(1555410304000+0800)/,0
21829562,很棒的地方，知识的海洋，希望自己学到更多知识,/Date(1514067756000+0800)/,0
73672599,中关村最的的图书馆，分为好几层，可以办借书证,/Date(1483598511000+0800)/,0
47528298,国家图书馆藏书非常丰富，静心阅读的好地方。,/Date(1571793397000+0800)/,0
63679835,学习，看书，静心，的好地方，有时间可以去！,/Date(1565742716000+0800)/,0
4638623,环境很好，就是停车不方便 ，坐地铁还算可以。,/Date(1545634199000+0800)/,0
175337477,你想找的，你想读的书本，每个行业尽在其中。,/Date(1534458645000+0800)/,0
110170815,非常壮观，带孩子一呆就是一天，舍不得离开！,/Date(1520726221000+0800)/,0
1126396,以前都是在网上看看，这次国庆见到实体了哈哈,/Date(1510975447000+0800)/,0
16560507,人很多，办了个借书卡，一次可以借3本书。,/Date(1575611433000+0800)/,0
197777054,国家图书馆藏书多的不行。看书的人也不少，,/Date(1570171003000+0800)/,0
4638623,建的非常好，很气派，但是没有进去的冲动。,/Date(1530683973000+0800)/,0
111403479,如果说中南海是心脏，那国家图书馆就是思想,/Date(1521043154000+0800)/,0
20381142,国家图书馆值得读书人去，那里什么书都有。,/Date(1483681896000+0800)/,0
1517435,很大，里边又很多馆，经常有文化交流活动。,/Date(1475927535000+0800)/,0
4253503,不错，中国最大的图书馆，书籍文物收藏全。,/Date(1466128674000+0800)/,0
3086274,这里面有好多好多的书哇！太多的书了啊！,/Date(1574381903000+0800)/,0
8110635,环境优雅，文化气息浓厚，实是学习好去处,/Date(1574120127000+0800)/,0
42929436,亚洲最大的图书馆     110岁的国家图书馆。,/Date(1566307926000+0800)/,0
78030243,中国最大的图书馆，同时也是世界最大的。,/Date(1564636751000+0800)/,0
1524233,很大很全藏书的图书馆，不愧是国家图书馆,/Date(1518454565000+0800)/,0
320690,学习知识的好地方，安静，舒适适宜学习。,/Date(1510192879000+0800)/,0
12128091,图书馆很庞大，去过几次，就事太麻烦了。,/Date(1498016134000+0800)/,0
6038656,满地都是看书的人，让人积极向上！很好！,/Date(1496579145000+0800)/,0
195612074,国家图书馆在魏公村附近，图书馆非常大,/Date(1557324012000+0800)/,0
1572603,里面的空间很大，好几层，有好多藏书。,/Date(1518404518000+0800)/,0
1365472,免费办卡，图书馆分好几处，里面很大,/Date(1544918263000+0800)/,0
19054864,非常有气派，非常有格调，有中国韵味,/Date(1524411569000+0800)/,0
17185937,建筑规模壮观，干净舒适，藏书齐全。,/Date(1514552963000+0800)/,0
35844198,坐地铁非常方便，很大气，值的一去！,/Date(1511589889000+0800)/,0
1984165,北京著名的图书馆，人很多，图书很多,/Date(1510973454000+0800)/,0
524095,环境很棒、在这里看看书也是很享受的,/Date(1501375939000+0800)/,0
17807593,到北京后的第一个常点，环境不错。,/Date(1559699708000+0800)/,0
158801593,舒适人类进步的阶梯，此言不虚啊。,/Date(1522133288000+0800)/,0
,真是高大上，藏书丰富，建筑庄严。,/Date(1492727824000+0800)/,0
49702924,国字号，值得这个称号。读者很多。,/Date(1487113529000+0800)/,0
36256627,国图，非常好，以前学生时代经常去,/Date(1474107060000+0800)/,0
498971,百科全书的大书库 什么都有  很方便,/Date(1574685246000+0800)/,0
209847097,很喜欢，而且离得近，氛围非常棒,/Date(1571392655000+0800)/,0
21826893,非常好的地方，适合呆上一整天。,/Date(1526605791000+0800)/,0
5539897,建筑非常有特色，值得去看一看。,/Date(1525090070000+0800)/,0
408756,环境好，有儿童馆，咖啡厅非常好,/Date(1508204806000+0800)/,0
26443975,国内最大图书馆，馆藏极其丰富。,/Date(1498128524000+0800)/,0
49702924,国图，不负国家二个字，全免费，,/Date(1491229243000+0800)/,0
49721166,少儿馆值得一去和借阅区都可以去,/Date(1460874936000+0800)/,0
27269125,已经是第三次入住了，总体还行，走道上有图书供取阅，唯一不爽的是不含早餐,/Date(1460590713000+0800)/,0
159545909,国字号的图书馆，当然值得去了。交通便利，门口就有公交，地铁。环境舒适，是个静心的好去处。平时在这里可以看看书,/Date(1516518000000+0800)/,0
116961042,图书馆很大，环境很好，书籍也很多，里面也有很多讲座。,/Date(1524995522000+0800)/,2
7654664,值得一去，环境非常好，位置也方便，地铁直接到！,/Date(1465713500000+0800)/,0
223288249,书方向和种类都挺齐全的。不错。,/Date(1574757633000+0800)/,0
6715205,外观很现代，里面更大气，凭身份证免费，书包要存包，周末人很多。,/Date(1458133407000+0800)/,0
13283878,里面的书有好多好多啊，喜欢读书的话办了借书证就可以看个够啊,/Date(1488379849000+0800)/,0
44974149,空间好大呀，书的种类超级多，坐下来，看着书，特别有气氛。,/Date(1509668164000+0800)/,0
117942991,全国最大的图书馆！宏伟大气，布局合理！真是知识的海洋！,/Date(1572171847000+0800)/,0
