101008141,外观设计非常好看，有气势，图书种类繁多，知识的宝库。,/Date(1625568338000+0800)/,0
186247143,书籍的海洋，文化气息十分浓郁，十足的体验感。,/Date(1645584103000+0800)/,0
62421688,图书馆面积很大，书也很全，自习室也很好，,/Date(1625577436000+0800)/,0
19997422,感受知识的力量！书很全，多带孩子们看书去,/Date(1614660941000+0800)/,0
32564041,"今天下午在国家图书馆综合楼进行了《心连广宇&amp;#183;志在苍穹—人类太空探索与中国航天之路》课程最后一讲“人类太空探索前景—勾画宏伟蓝图”的公开课的讲授，庞之浩老师为我们介绍了运载火箭和航天器的发展前景，以及由此带来的各种深空探测的可能性，包括载人登火星、建造月球基地、实现太空旅游等，同时介绍我国航天事业未来发展的重点和方向。庞之浩老师是中国空间技术研究院研究员，神州传媒公司首席科学传播顾问，还有其他头衔，此处不做一一陈述。
       讲课图文并茂，深入浅出。在最后的观众提问环节，我问了第一个问题：“关于太空旅游，对于普通工薪阶层来说，此生是否有实现的可能？”庞老师回答；“目前到太空旅游的费用是一亿美元左右，如果太空电梯在本世纪末研制成功，每个游客的费用可以降低到二百美元。”我一听，本世纪末，我已经120多岁了，据说人类的寿命理论上最长可以活到150岁，看来要好好保养身体，争取有生之年到太空去旅游。
       随着电影《流浪地球》的热映，引起了太空热，使人们看到了一个广袤无际的宇宙，让我们意识到不要再纠结于日常琐事，可以把目光放的长远一点，想一想如果哪天地球毁灭了，人类该何去何从？要未雨绸缪，提前考虑开发其他星球，也要珍惜当下的幸福生活。
      感谢国图给读者提供了这么好的与专家面对面交流的机会，希望以后多多举办类似活动。",/Date(1558105225000+0800)/,6
26208996,国家图书馆在宽阔明亮的大街上，进入参观需要走一定的程序。国家图书馆新馆宏伟大气，装修里渗透出一股浓浓的书香气息。沿街是中央民族大学、北京理工大学、北京外国语大学、中国人民大学，建在高等学府区域，不仅能物尽其用，也方便高校学子查阅资料学习知识。,/Date(1527589894000+0800)/,6
28421403,值得去，很大，设施齐全，安静，适合学习,/Date(1626479832000+0800)/,0
428140,国图少儿馆。书不少，环境也还好，然而真的有点吵…一时感慨，界限感和公德心的培养真不是一朝一夕一代人可以养成。所幸现在学校已经开始重视礼仪和行为教育，相信孩子们长大了有机会见到一个更为有礼有节的社会。,/Date(1475214349000+0800)/,25
2166710,国内图书品种最多的图书馆，书的海洋。,/Date(1632106705000+0800)/,0
264600734,特别有知识的地方，要提前预约的。,/Date(1633733571000+0800)/,0
19997422,读书夏令营，进行中了，放娃看书,/Date(1627314164000+0800)/,0
67076989,凭二代身份证免费办理图书证，三年激活一次，可以在全国范围享受电子数据库。国家图书馆活动很多，有很多主题展览，相当不错。有饮水器和纸杯，很贴心。,/Date(1493634891000+0800)/,12
240536865,疫情期间需要预约才能进入，前身是清宣统元年七月二十五日（1909年9月9日），清政府批准军机大臣、学部尚书张之洞的奏请，筹建京师图书馆（国家图书馆前身），调内阁大库、翰林院、国子监南学书，以及文津阁《四库全书》、敦煌劫余遗书作为基本馆藏。京师图书馆成立后，缪荃荪首任监督。,/Date(1609816477000+0800)/,1
11619827,其实我觉得就是一个普通的图书馆也没什么可参观的，而且疫情期间更是各种麻烦还需要预约,/Date(1620357092000+0800)/,0
1529681,"有同学前两年去北京，发了一组朋友圈的照片，说是国家图书馆，当时印象非常深刻的就是这个超大的的阅览室，从二楼往下看，那个气势可以称得上是非常宏伟、壮观，不过，这么大场地，倒是非常安静的。

实际上这个是在国家博物馆的北区，是单独的一栋房子，和少儿图书馆在一起的。",/Date(1565965935000+0800)/,4
32564041,"今天在国图影院举行了《纪念梅兰芳、周信芳诞辰125周年系列讲座》，主讲人：萧润增，对话嘉宾：林瑞康。
         萧润增作为周信芳亲传弟子，讲述了在中国戏曲学校的经历，以及与周信芳学戏的感受，以及教授麒派艺术的体会。
         不要刻意学习老师，究竟怎么学？要摸索，不要在外形上着力模仿，要了解老师的精神。不局限于坐念唱打，要做到随心所欲，那是厚
积薄发的结果。周信芳创造出自己独特的声腔，嗓音不足，但是让观众忘记了嗓音的不足之处，而是把观众吸引进戏里，做到寓教于乐，让观众在戏里学到东西，没有怪声叫好，让观众的心平静下来，只是在出场和演到精彩时，观众潮水般的掌声由强到弱，修炼到了一定的境界，从身法、手法、眼法口传心授，就像电影《姿三四郎》那句老师对弟子所说的话：“悟性，就在你的脚下。”
         周信芳一生演了600多个角色，720多部戏，演了2万多个场次，负荷已达到生命极限。
      讲座过程中放了一场周信芳在1961年拍摄的电影《跑城》片段，看似随意，实则难度很大，一个演员有三重身份，一个是自己本人，一个是角色，一个是演完后对角色的反思。所有动作不离一个圆，和中国的易经文化相吻合，萧老对周老的动作进行现场表演解读。
         最让我感动的是萧老说的“我经常问自己，我真的学到了吗？”谦虚的美德在萧老身上体现的淋漓尽致。
       今年是国家图书馆建馆110周年，也是梅兰芳、周信芳诞辰125周年，感谢国家图书馆举办的非遗系列活动，让我们学到了许多国粹，更好的传承了中华文化。",/Date(1559881586000+0800)/,4
6759576,"长与阅读相伴，润泽精彩人生 
        ---恰逢花开，最是书香能致远


世上无人人必读的书，只有在某时某地，某种环境，和生命中的某一个时期必读的书。

读书没有合宜的时间和地点。一个人读书必须出其自然，才能够彻底享受读书的乐趣。",/Date(1554863642000+0800)/,4
21826893,这里是全亚洲最大的图书馆，里面环境非常好，各种图书方面的服务也都有。可以带着孩子周末来看看绘本和其他书籍，儿童馆还有小人书可以看。,/Date(1518489079000+0800)/,7
4282945,很大气宏伟的建筑群，与国家典籍博物馆相连与同一大院，分成人馆和少年儿童馆，可以凭身体证或读者证免费进入。藏书板其丰富，读书的人也很多。有配套的图书馆食堂，及品诺咖啡厅，都在院内，很方便。,/Date(1521255862000+0800)/,6
32564041,国家图书馆电影厅，目前正在举办经典电影展映，观众可以在官网上免费领票。今天看的是电影《人生》，该片根据著名作家路遥的同名小说改编而成，导演吴天明，由西安电影制片厂进行拍摄。描写了高中毕业生高加林与农村大字不识的姑娘刘巧珍的爱情悲剧。高加林为了追求理想的生活，而与巧珍分手，与有共同语言的白富美黄亚萍欲共结连理，却被亚萍的男朋友的母亲告发工作手续不合法而丢了工作重新回到农村。不愧是经典，在影片首映后45年再次看到这部老电影，仍然为剧中人物精彩的表演而惊叹，我几乎是留着眼泪看完了全片。巧珍就是真善美的化身，德顺爷爷说高加林丢了像金子一样珍贵的巧珍。当高加林重新回到农村，巧珍的大姐想要羞辱高加林时，巧珍加以阻拦，她说她心疼高加林，如果大姐羞辱高加林，那就是往她自己的心上划了一刀。爱的最高境界是什么？那就是心疼，从最初加林的教师工作被大队书记的儿子顶替，巧珍就心疼加林，到支持加林到城里工作，她也是心疼加林在村里不得志，到她去城里看工作的加林，给他钱，还是心疼他生活的不易，到最后加林丢了工作，回到农村，他还是心疼加林的失落。加林尽管和亚萍有共同语言，尽管亚萍能给他带来更好的发展空间，他在感情上还是更喜欢巧珍，尽管她没文化。我想这就是真善美的魅力吧！当巧珍告诉加林他家里的老母猪下了12个猪仔，第二天死了1个，再过一天又死了1个，加林不说话，只顾去看书。其实从这时起巧珍已经意识到她和加林有巨大的鸿沟，尽管她后来让妹妹教她认字，她还是赶不上加林的脚步，她在加林面前爱的卑微，爱的没有自我，后来出嫁时她告诉她妹妹她就是喜欢读书人。我想这就是爱情的魅力吧！人总是喜欢自己没有的东西，西葫芦配南瓜总是让人不甘心。不同年龄段看同样的故事会有不同的感悟。我当年看路遥的小说时还在上初中二年级，当时只觉得高加林是个陈世美。现在已经46岁了，经历了恋爱、婚姻，角色也是由单纯的女儿变成妻子、母亲、儿媳，对这部作品有了更深的感悟。感谢国图给了人们这个免费重温经典的机会。希望以后多多举办这样弘扬文学经典的活动。,/Date(1555998812000+0800)/,3
49765674,目前是亚洲最大图书馆，交通便利，出门即是公交站和地铁站口。位置也很好，在海淀区的中关村南大街。图书馆分南北两个馆，中间有个书店，里面全是折扣正品书。北面是国家典籍博物馆，进入时超过A4纸的大包是不能进入的，有免费寄存处！里面装修气派，感觉空间空旷浪费！南面是阅读借阅区，找一些文献资料、阅读书籍必去的地方！,/Date(1496710793000+0800)/,9
3305214,北京国家图书馆非常棒的一个地方。是一个学习知识，开拓视野的好去处。免费进入，场地很大，图书很全，不少人花上一整天在里面学习，从电梯上俯视阅览室，气势非常的壮观，堪称“网红照片”。,/Date(1564801221000+0800)/,4
418444,环境优美，树木、草地挺多。有收费的停车场。图书非常全，现在都是自助借还书机，特别方便。室内外都非常干净，草地总有人浇水，维护的很好。,/Date(1445429093000+0800)/,18
6183249,"适合来熏陶一下气息,地铁可到,方便, 免费寄包

回字形的阅览室太有气势了. 不办图书卡,在公共区域也可免费参观. 

配套的餐饮挺便宜,但是质量有待提高. 

带孩子来特比适合",/Date(1494333951000+0800)/,21
219059253,位于北京海淀区中国国家图书馆，建筑面积28万平方米，分南区、北区及古藉保护中心。与紫竹院公园相邻，环境优美，具有5000多个座位，相当舒适，居世界图书馆第三位。重要的是为人们免费书房。,/Date(1555636224000+0800)/,3
76314063,"《牺牲》：“绝美的风景，多在奇险的山川；绝壮的音乐，多是悲凉的韵调；高尚的生活，常在壮烈的牺牲中。”
中国最大的图书馆吧，建筑本身就是艺术，设计感超强。好像有人说过，如果天堂有具体的样子 那应该是图书馆的模样吧。谢谢国图，让我遇见天堂的样子～～",/Date(1580040091000+0800)/,2
2427590,进门需要存包，免费存包，存包地点5点关门。现在正在展览的安徒生插画作品展，门市价90，团购价70，这个展览不算太大，共两个展厅，里面有7个盖章的地方，可以盖7个不同的印章，这一点对小朋友比较有吸引力。,/Date(1508662253000+0800)/,16
3349672,今天晚上从国家图书馆路过，猛然发现已经有几年没进去了，回味前些年，几乎每天都来，还记得在图书馆正门口，旗杆下，有个小小的石碑，上刻着&amp;quot;老山焦土埋藏地，&amp;quot;几个字，现在早已没有了，看着在里面读书的人，我在想我们不仅要用知识武装自己，更重要的是不要忘记当年浴血奋战的烈士，忘了历史读在多的书还有何意义，国图原名北京图书馆，是亚洲最大的图书馆，藏书列全世界前几名，里面很人性化，饮水机咖啡厅，快餐店应用尽有，书桌和座椅非常舒适，坐一天都不觉得累，在走廊中还有沙发，许多人坐在上面往往是没多久就呼呼大睡，可想而知沙发太舒服了，国图二期从外观看像一本书，里面是下沉式阅览室，像国外某大学的图书馆，采光效果很好，设计完美，读者不用走太远，就可以去别的阅览室，整个图书馆特别安静，连人们说话都小声说，生怕打扰了别人，不管什么时间里面都坐的满满的，找一个位子都难，而且进阅览室只用刷身份证，没有其他的条件，唯一限制是不能带水和食品进入，如果有时间在这里看看书，也是不错的选择。,/Date(1490877523000+0800)/,16
58698855,图书馆老馆去的多，建了新馆之后去的就少了，新馆确实大气不少，不过老馆更有那种文化氛围。曲径通幽中去找一本上了年代的书来看，别有一番风味,/Date(1490838551000+0800)/,9
3797320,国家图书馆的儿童馆。这里非常好。对小朋友来说非常好，对成人来说也很有意义。到这里来一趟成书，受受教育非常的不错。特别是对小孩培养读书的习惯非常的好。,/Date(1496473964000+0800)/,17
21826893,这里非常值得大家去，里面可以借阅图书也可以在里面呆上一天看书，氛围特别好，办张卡需要你交100块钱，不多的钱可以办到很多事情，带孩子去看绘本也很不错，不过，如果是大人自己去就不能进去啦！,/Date(1516855447000+0800)/,6
23434541,国家图书馆很漂亮，可借书，可在里面阅读，旁边是紫竹院公园东门，,/Date(1610241452000+0800)/,2
23340368,国家图书馆坐落在海淀，可谓是全国文化氛围最浓厚的宝地。 附近还有很多知名大学，以及科研院所。国图是个非常不错的自习场所，无论白天黑夜，都比较容易给人带来灵感，特别是在下沉式的阅览大厅！,/Date(1461553378000+0800)/,12
167953434,"中国国家图书馆号称中国最气派的书房，也是中国最上档次的图书馆了。国家图书馆作为本人来北京的第一个国子号目的地感觉还是很棒的。
国图由北区、南区、艺术中心、典藏博物馆组织，还经常有讲座活动。
其中开放时间：北馆周一至周五9:00-21:00，周六至周日9:00-17:00（周末开放时间相对短点），南馆和其他馆都是下午5点就会闭馆了。进馆的话背包需要寄存，给个取包条码出来时可取回。
进馆的话需要安检，然后要出示身份证或者读者卡。
入北馆就可以感受国家图书馆的气派了，这里还可以免费办理读者卡，很方便。",/Date(1559332139000+0800)/,1
86126683,国家图书馆！传说中的古籍馆位于北海西岸，中南海北门正对面，原是民国时的北平图书馆，并非真正的古建筑，但气场强大到无以复加，确能当得起中国的国图范儿。听说此地收藏了大量古籍旧书，慕名前来一看，好吧这本书也实在太旧了…,/Date(1509888754000+0800)/,5
203236889,国家图书馆从4楼看很震撼，读书的好去处，很安静书香气息很浓，推荐大家去看看，来体会一下傲游书海的感觉，周围交通方便，一个人静心的好地方,/Date(1557133429000+0800)/,4
28297455,这里非常值得去，是一个知识的殿堂，是人类灵魂的集散地，宏伟大气，不但卓越,/Date(1602551364000+0800)/,1
67652856,国图很大，分为南区和北区。南区主要为外文书籍，敦煌文献等，北区为中文书籍。中国典籍博物馆也在国土范围内，环境很不错，偶尔还有讲座可以听听。入门记得寄包不然安检会拒绝你进去。,/Date(1533391170000+0800)/,2
16398021,颇有美国大学图书馆的感觉，现在高层往下望，每层都有很多人坐在那里看书，或穿行于书架中，更有人坐在地上看书。来这里人变得纯粹了,/Date(1446047771000+0800)/,10
1438501,"心心念了有一个月的地方，想看看它的下挖
式设计，感受一下大家一起读书学习的氛围。
&amp;#160;
新馆在北面一些，一摞台阶走上去才可以进。拾级而上，旁边就有服务员站着，态度很好地指路。
&amp;#160;
进去先自助办了一张卡，很便捷，自助机上二代身份证一刷就得，输入一电话，卡片就出来了。如果要外借图书，那就中文图书100押金，外文图书1000押金。这里有不足：只能现金支付，搁平时出门不带钱包，我今天就办不成这个借书卡了。而且，就在我后来查找图书的时候，有人过来找我要钱，给她现金，然后微信付钱给我。
&amp;#160;
借书的系统也不是太好用，下次我找个时间宽绰的机会再研究一下，如果还是解决不了今天遇到的问题，我再写出来。
&amp;#160;
停车也是一大难事。路边收费第一小时10块，之后15每小时。地铁倒是很方便，出来就是。",/Date(1540942229000+0800)/,0
36067788,回酒店的路上去了趟国家图书馆。国家图书馆那叫一个高大上！逛了半天连一楼一半都没参观完。没看见想象中的书架林立，也没看见如饥似渴读书的学者，只看见一间间办公室里埋头整理各种图书的工作人员。想到他们的工作承载了国家与民族的文化传承，不由得肃然起敬。一个多小时后才终于看见一个大厅，一排排书架整齐地排列，有人或专心阅读或反复找寻。馆外的国图书店又深又长，各种书籍3-6折，孩子去的旁边的少儿图书馆，也许是暑假的缘故吧，管理员都是小孩子。,/Date(1530221949000+0800)/,2
21826893,这里值得大家去，里面的环境非常好，主要是氛围特别好，带上孩子来这里看看书，是大多数这边的家长的选择，要么去自习室。也很好！这里有个借书的地方，每次一张卡最多可以借三张，门口有个自助还书的机器，过节的时候或者周末，这个机器就不开了。,/Date(1517951624000+0800)/,4
4597745,以前写论文常去的场所，国家图书馆旁边目前正在施工，应该是城市快轨项目，市政工程，古银杏树也被工地包围了不知道还在不在，反正在门口就觉得电钻声音吵人，建议借书，馆内阅读复习功课什么的如非必要暂时不要考虑了。,/Date(1479544851000+0800)/,13
96543375,这个周末我去看了一下，在典藏馆有好几个展览正在进行，就在南边，大家可以去看看。如果要借书的话，那么就押100块钱借中文，1000块钱借英文版，中文图书可以借三本书，英文图书一月可以借8本书。,/Date(1520165194000+0800)/,4
22869588,里面的书真的是巨量，各种各类的书都有。办一张图书卡后，进出都很方便。,/Date(1588136898000+0800)/,0
47528298,国家博物馆里面的藏书齐全，特别是少儿阅览室，很适合带孩子一起阅读。,/Date(1587702399000+0800)/,0
20970275,中国最好的图书馆，是中国善本最全的图书馆，我有幸进去看过书很舒服的，很安静适合去静静心，也适合去安安心，人总是要有点追求。太浮躁了，不好。,/Date(1490431633000+0800)/,6
24280509,国家图书馆很棒的设施场馆点赞，很多演出都在这里演出,/Date(1603537534000+0800)/,0
3272780,新馆很气派，设施齐全且现代，体现我华夏文明传承,/Date(1593680938000+0800)/,0
6387417,文化气息浓厚，在这里一下就能踏下心来好好看书～,/Date(1591934588000+0800)/,0
1853736,图书的海洋，知识的宝库，能踏实看书的地方。,/Date(1587735479000+0800)/,0
23754951,国图四号线出口就是，非常大藏书非常全面.以前家就住在附近。办的年卡周末经常去看书.现在比以前现代化多了.条件也好的多.有时间也是会去看看书.,/Date(1560315802000+0800)/,5
177077196,不亏是国家级的图书馆。藏书特别多啊。,/Date(1603252303000+0800)/,0
66276410,很棒的图书馆，馆藏很丰富，值得一去。,/Date(1600819282000+0800)/,0
157926583,书非常多，环境好，现在需要预约。,/Date(1605747757000+0800)/,0
235461,非常好非常棒！！应该多来这里！！,/Date(1593554263000+0800)/,0
28913310,在紫竹院公园旁，非常不错的大楼,/Date(1614591209000+0800)/,0
4655720,面积很大的图书馆，交通很方便呢,/Date(1604934229000+0800)/,0
4655720,占地面积很大，里面藏书也很多！,/Date(1585230410000+0800)/,0
942148,景色不错 藏书超多 性价比超高,/Date(1596681530000+0800)/,0
4282945,中国国家图书馆古籍馆，在景山公园和北海公园附近，大门古香古色，不对外作参观开放，仅做为查找特定资料使用。门口的守卫很友善，会让你进去拍照再出来。,/Date(1506484496000+0800)/,4
,中国国家图书馆是世界十大最美图书馆之一，馆藏书籍3119万册，建筑面积为28万平方米，是亚洲规模最大的图书馆，居世界国家图书馆第三位。值得一游。,/Date(1501766060000+0800)/,4
13502727,分为几个馆，南馆北馆和典籍藏书馆是最大的，还有少儿馆和艺术馆等在南北馆之间，后面还有咖啡食品。典籍藏书馆有展览，可以在门口看看再确定去哪个展厅参观。北馆最大，很多人看书，分了很多层，书都是国家级的，很多在普通图书馆都看不到，对研究古籍和中文的同学很有用。,/Date(1527130578000+0800)/,1
116713105,中国国家图书馆位于北京市中关村南大街，总建筑面积28万平方米，图书馆分为总馆南区、总馆北区和古籍馆，是世界最大、最先进的国家图书馆之一！,/Date(1578474334000+0800)/,0
214640,去五塔寺路过这里，非常不错，这里据说图书资料极多，有些文物我们是无法看到的，但普通阅读还是很不错的，对大众开放的学习场所。,/Date(1513726906000+0800)/,4
36218441,图书馆已经有上百年的历史了，不仅可以看书，里面还有博物馆可以参观，交通方便，凭身份证进入，里面很安静，素质还真的很高，周末要不早点，否则找个空位也不容易，里面藏书很多，有不少古典书籍，，设施齐全，也很人性化，里面不允许带食物，不定期有各种讲过，借阅方便，氛围很好，可以去感受一下那种遨游书海的氛围，心无旁骛的那种。,/Date(1573567445000+0800)/,2
107705551,"南馆在南边超级偏僻的拐角里，按顺序往北依次是典籍博物馆，国图艺术馆，少年儿童馆，最后是北馆
整个面积非常大
南馆17点就闭馆了，北馆可以21点
但是还要看是否周一，是否遇上国家法定节假日等，出行前一定要网上查一下或者打个电话问一下
超过A4纸的包需要寄存，门口很方便，进入带身份证，可以免费办读者卡",/Date(1538991090000+0800)/,2
50415533,国家图书馆在维也纳国际酒店后门，与海淀区白石桥高粱河、紫竹院公园相邻。是国家总书库，国家书目中心，国家古籍保护中心；是世界最大、最先进的国家图书馆之一。,/Date(1539612548000+0800)/,2
218178504,国家图书馆是中国的最大的图书馆，曾被评为“八十年代北京十大建筑”榜首，包括日报、古籍、音视频和儿童读物等多种多样的类别，此外推出的数字图书馆移动阅读平台可以提供随时随地随身的阅读体验。,/Date(1579995353000+0800)/,0
36640221,不愧称为国家图书馆。设施的建设无可挑剔，书籍的收藏汗牛充栋。再加上极度的寂静，那就成为了爱好学习与向往书海的人们的乌托邦吧！,/Date(1474640733000+0800)/,7
80569141,管理的很到位，可以随意进出，有免费水，冬暖夏凉，藏书看上去很多，词典工具书还有类似年鉴的行业书籍很多，读者不算多，好多人占着软椅在睡觉。说实在话，在网络信息时代，图书馆盖的这么奢侈没有必要了，维护费也很昂贵。,/Date(1527547240000+0800)/,3
1821349,带孩子去国家图书馆，多少年没去了，发现有了少儿馆，挺不错。初八之前17:00关门，之后是21:00。少儿馆是上下两层，下层针对年纪较小的儿童，比较吵闹一点，上层适合稍大的孩子。,/Date(1485996632000+0800)/,4
38954937,如果你是在北京常住，一定要去，这里面的书很全，方方面面，可以研究写论文的好地方，你可以借阅，借还书都非常方便。我看到了我最爱的暮光之城,/Date(1525224956000+0800)/,0
39620557,北京最大的图书馆，馆藏全，阅读感舒适，是很好的去处,/Date(1610638523000+0800)/,0
,书目种类繁多，地理位置优越，是个读书休闲好去处,/Date(1599646655000+0800)/,0
