3434705,这里环境很好，安静，干净整洁，藏书丰富，适合来这里看看,/Date(1501420421000+0800)/,0
16560507,特别好，去过一次。特别安静。就是想去看书没找到座位,/Date(1556246884000+0800)/,0
89746640,看过书很舒服的，很安静适合去静静心，也适合去安安心,/Date(1493893887000+0800)/,0
33330183,国土很大，大学的时候写论文在国图借阅过参考书,/Date(1519395687000+0800)/,0
33827357,挺好的，主楼的设施很先进，而且设计的也好看。,/Date(1499071339000+0800)/,0
224427064,国图里有很多地方可以拍到寂静优美的午后风景,/Date(1556629663000+0800)/,0
951244,非常值得去的地方，修身养性、陶冶情操,/Date(1466562456000+0800)/,0
35240601,规模很大，书籍齐全，文化氛围浓厚。,/Date(1492600796000+0800)/,0
67881227,很多书很是壮观。环境优雅安静。,/Date(1475503370000+0800)/,0
88180519,图书馆超级大，在这里有好多书籍，很厚很贵的书在这里做功课就行。,/Date(1505702627000+0800)/,0
13403583,特别大的图书馆，什么书都有。可惜我不爱看书。,/Date(1476402547000+0800)/,0
