15269564,还挺好玩的，很方便，有雪有桃花有自由跑来跑去的动物。,/Date(1523162473000+0800)/,0
2658904,开车游玩效果好，随时停车，近距离观察动物，非常不错！,/Date(1519086832000+0800)/,0
12419154,非常好的景点，特别是小动物近距离与人接触，非常的温馨,/Date(1515965034000+0800)/,0
120843999,一次不错的游玩，野生动物园的动物就是不一样，个个肥硕,/Date(1512956267000+0800)/,0
106165365,猛兽区乐趣少了好多，动物们全被电网围起来了。和小马小鹿的互动很好，孩子们很开心！但出门收费太堵了，将近30分钟没有动地儿，交通很乱！,/Date(1507153638000+0800)/,0
38242670,温顺动物去的马和梅花鹿很热情，孩子孩子玩的很开心呀！,/Date(1500986465000+0800)/,0
41954445,还行吧，出事后，感觉不到野生动物的气氛，凶猛动物很少,/Date(1498188017000+0800)/,0
109206873,订票很方便，现场换票简单，公园不错，马来熊看的很清楚,/Date(1496638571000+0800)/,0
91818972,很不错的感觉，玩了大概两个小时左右，小动物们都很友爱,/Date(1494418851000+0800)/,0
25968745,带上小朋友玩很有趣呢，有一次是跟我家人跟我外甥去的，,/Date(1476208442000+0800)/,0
3389909,坐景区的车游览，心里感觉踏实，可以看到动物优闲状态。,/Date(1472518138000+0800)/,0
4295079,去了很多次，散养动物区孩子们喜欢，还有就是看猴子。,/Date(1578753843000+0800)/,0
27924837,门票价格合适，挺不错的，开车进去60，动物表演60,/Date(1568454892000+0800)/,0
22386837,感觉比大兴的更野生。但环境没有大兴的好。荒山野岭。,/Date(1557789950000+0800)/,0
962778,去的时侯有些冷，出了事故后太保守，猛兽离的太远了，按理说人家非要作死下车，动物园应该免责。,/Date(1553673999000+0800)/,2
184123945,每年都去，孩子喂动物，老年不免票不如北京野生动物园,/Date(1544959682000+0800)/,0
76653488,很可惜动物不能像原先那么自由了， 但是 动物都很健康！,/Date(1541925887000+0800)/,0
189187284,确实值得一去的地方，喜欢动物，亲近大自然的可以去～,/Date(1538161547000+0800)/,0
68556232,还可以！！！！！！！！！！！！,/Date(1534080272000+0800)/,1
62410398,玩的很开心，小孩兴趣很高，玩一天，与大自然亲近接触,/Date(1531545811000+0800)/,0
181563461,带着儿子玩得很好，这是我们第二次玩了，自驾游很实惠,/Date(1529465140000+0800)/,0
176961500,下次来还从这买票，物有所值。就是天冷还没有热带动物,/Date(1526645195000+0800)/,0
16414150,还可以吧，开车进去看不到太多散养动物，一般般的感觉,/Date(1520809784000+0800)/,0
27819608,带孩子去的好地方，可以近距离接触动物，但要注意安全,/Date(1511347251000+0800)/,0
3824900,"景区的管理很一般，动物有的很精神，有的萎靡不振，嗯，管理者的水平还不是很高，服务意识不是很强。小孩子们喜欢，大人就没有什么兴趣啦
",/Date(1501334303000+0800)/,0
60082291,孩子玩的很开心。后半区的，孔雀，马，鹿，都很好玩。,/Date(1498615332000+0800)/,0
109158159,不错，尤其后面那种可以开车喂各种动物的感觉非常好！,/Date(1493797695000+0800)/,0
109109520,很美好的一天，空气清新，小动物温顺可爱，孩子很喜欢,/Date(1491318846000+0800)/,0
82907150,总体还是不错的，这个季节还是冷点，孩子们玩的很高兴,/Date(1491306576000+0800)/,0
8700151,老虎好厉害，，不敢吵架，不敢下车！脾气瞬间变好了！,/Date(1477008707000+0800)/,0
71432106,很不错，就是轮胎被老虎咬烂了，猛兽区不推荐一直停着,/Date(1475481240000+0800)/,4
4826167,自驾进去很好玩，里面很大，走路太辛苦了，开车很舒服，想停下来多玩会也没问题，路上会遇到马和鹿，它们会追着你的车要吃的，一点都不怕人,/Date(1447979659000+0800)/,0
7542292,工行********************世界,/Date(1569659357000+0800)/,0
94544856,不错，很方便，进去坐车，看动物，很不错，里面很大,/Date(1568016577000+0800)/,0
7047156,开车进去还是比较爽的，好多动物都围起来了有点遗憾,/Date(1560256390000+0800)/,0
28948430,还行吧，孔雀好好多，在携程买票方便快捷，价格低!,/Date(1560235833000+0800)/,0
226568890,非常享受这个过程，挺好的。家庭出游可以考虑考虑！,/Date(1558277072000+0800)/,0
21980249,自从出事以后动物都被电网围起来了，靠近不了。猛兽区感觉也少了很多，看到的也都趴着不动。只有喂猴子、大象、矮马、鹿、孔雀依旧有趣。,/Date(1556351121000+0800)/,0
66379416,开车的话一定要带蔬菜去玩，很多小动物在出口处等着,/Date(1555247310000+0800)/,0
38943195,这个非常推荐，特别是开车自驾进入园区那叫一个刺激,/Date(1549720775000+0800)/,0
5367323,不错，遗憾的是老虎吃人事件后，老虎被电网挡起来了,/Date(1548946338000+0800)/,0
5333815,自驾野生动物园，动物自由自在，比一般动物园更有趣,/Date(1536152091000+0800)/,0
5450322,跟团去的，时间比较仓促，而且下雨了，但还是很满足,/Date(1524453770000+0800)/,0
164710495,很不错，孩子非常喜欢，天还有点冷，动物没有全出来,/Date(1519208192000+0800)/,0
1584310,取得时候距老虎咬人有段日子了，猛兽被隔了层层铁网，感觉跟普通动物园差不多了。基本上野生动物园的特色也就没有了，遗憾没能在之前来玩,/Date(1511230592000+0800)/,0
71030364,非常期待下次会更好！还会去的，小朋友玩的很开心！,/Date(1507554732000+0800)/,0
5774928,好不错，就是很大，走路的要走很久，开车就方便很多,/Date(1507537609000+0800)/,0
107245744,建议带孩子去还是开车进去 因为电瓶车要走好远才能坐,/Date(1506333073000+0800)/,0
37306625,亲子游很不错。花车巡游及水车巡游很棒。孩子很开心,/Date(1502201113000+0800)/,0
87273077,非常好！           ,/Date(1493261386000+0800)/,2
54297608,孩子很开心，换票业很方便。自己开车进的，也算方便,/Date(1492735938000+0800)/,0
79885297,里面感觉很不错，带着紧张激动的心情参观野生动物区,/Date(1491726178000+0800)/,0
101140493,动物很多，环境不错，服务也挺好，下次有机会还得去,/Date(1491374348000+0800)/,0
1517435,和刚开业那几年比，动物越来越少，不过还是挺好玩。,/Date(1474108257000+0800)/,0
37089725,很棒很赞动物有点少...Emmmmmmmmmm,/Date(1563628461000+0800)/,0
3167965,去过，还行 ，驾车走不错。园区挺大，但种类不算多,/Date(1557906338000+0800)/,0
6462408,猛兽区可以开车，温和动物区可以下车，孩子很开心,/Date(1551272657000+0800)/,0
62734321,和我爱的人一起去的真好，有她的陪伴，去哪都不远,/Date(1538391195000+0800)/,0
197963543,让孩子们认识动物还可以和零距离接触，很有意义。,/Date(1537840022000+0800)/,0
2575084,方便快捷，取票方便，但是不太多动物，不值票价。,/Date(1529166774000+0800)/,0
111893696,去过几个野生动物园了，还是这家最好。一定要自驾,/Date(1507646134000+0800)/,0
64836710,很早以前去过，爬完长城逛过野生动物园，还不错。,/Date(1504284535000+0800)/,0
3061492,宝宝玩得很好，老虎，熊，还有很多散养的温顺动物,/Date(1502503189000+0800)/,0
31943887,特别好，感觉亲子出行会很好，自家看动物近距离看,/Date(1501335183000+0800)/,0
107562463,还算是可以吧，猛兽区已经隔离了，不能太近距离看,/Date(1500819195000+0800)/,0
88363766,感觉很真实，很好，下次还要去，而且推荐大家去。,/Date(1498275373000+0800)/,0
83742175,很好。票价比售票处便宜，而且不用排队。很方便。,/Date(1495441413000+0800)/,0
89374318,好              方便,/Date(1492768044000+0800)/,2
94604318,我们是开车进去的，一辆车60元，感觉动物偏少。,/Date(1492407625000+0800)/,0
109121551,非常棒！非常喜欢白虎，大象(喂它食物会谢谢你),/Date(1491971570000+0800)/,0
88040473,不错不错，带儿子去的，就是半路儿子睡着了，哈哈,/Date(1491827348000+0800)/,0
2282724,还不错，看到了鼎鼎大名的白虎。其他猛兽就是可遇不可求了，狮子还行，都躲在树荫下面。儿子的最爱是大象和长颈鹿，可惜都不吃胡萝卜。,/Date(1491742502000+0800)/,0
48797335,除了今天有点冷，狮子就看到一只外，别的都挺好的,/Date(1490514773000+0800)/,0
23264391,亲子最好的地方，车开进去，多带点火腿肠喂棕熊哦,/Date(1466116918000+0800)/,0
4907777,走的有点远，只收现金，不太任性化。其他很好。,/Date(1573725567000+0800)/,0
16010197,很不错，动物很多，散养区可以和动物一起互动。,/Date(1563544728000+0800)/,0
33602267,还好吧，可以自驾车观赏  因为是做飞机去的，只能等园内大巴车，等了半个小时出发  差不多全程15分钟  可以作为八达岭动物园做一天安排。,/Date(1552371115000+0800)/,0
192291455,一家人去的，能跟动物亲蜜接触，适合小朋友玩。,/Date(1538900161000+0800)/,0
70380426,动物种类不多，猛兽区开车一会就没了，也不让靠近，相当于开车绕笼子转，不是很有意思，还不如北京动物园好玩。,/Date(1525582623000+0800)/,1
114078225,差点把电子门票当垃圾扔了，幸亏自己多想了一下,/Date(1523237735000+0800)/,0
167031431,方便，快捷，不错动物少点儿，差点儿被野猴掌掴,/Date(1520783051000+0800)/,0
19968690,携程上订票比较方便，可是去的当天下雨了，下了园区的大巴车就去看动物表演，出来路上的电瓶车没有把游客送到最外面，淋了一场大雨。,/Date(1510648310000+0800)/,0
152984752,多快好省，给5颗星，比现场购票便宜很多，超值,/Date(1509950273000+0800)/,0
49794912,挺好玩的，就是没看到狼，狮子老虎大多都在睡觉,/Date(1508774037000+0800)/,0
61110610,还可以，就是去的时候是中午，猛兽区动物睡着了,/Date(1503291707000+0800)/,0
26337076,很漂亮的一个地方 适合自驾游。带孩子去的好地方,/Date(1502864836000+0800)/,0
88122999,在猛兽区，看到的动物很少，可能都躲起来了。与国内其他野生动物园相比，盛名之下 其实难副,/Date(1501365552000+0800)/,0
7940192,还行吧 一般般 最后快出门的时候 野生猴子有点吓人,/Date(1496575042000+0800)/,0
1203288,春天了，动物们都出来了，带孩子去玩的，不错。,/Date(1492907151000+0800)/,0
36232883,人不算多，开车游也不累，老虎都用电网围起来了,/Date(1492085950000+0800)/,0
41174694,不错啊，携程买的电子门票，非常好用，还便宜。,/Date(1491448314000+0800)/,0
24442138,园里很大，开车进去的，安全性很不错的，里面都有电网保护，散养的马很是招人喜欢，把头伸进车窗要食物吃，有机会还会带宝宝来玩的。,/Date(1491145259000+0800)/,0
87566316,挺好的，特别好玩，就是这天气去老虎没什么精神,/Date(1491136859000+0800)/,0
90464714,非常方便，值得购买，今天野生动物园里面人很多,/Date(1491135292000+0800)/,0
32590051,动物有野性，环境自然，人与动物亲近的最好环境,/Date(1473702626000+0800)/,0
28296289,哈哈*****************哈哈,/Date(1569806420000+0800)/,0
112139011,非常棒的一次体验，不虚此行，真的很有意义！,/Date(1565169298000+0800)/,0
15521731,方便快捷，冬天去的，天冷，动物都不咋爱出来,/Date(1550323595000+0800)/,0
86861963,最好玩的是喂小马和小鹿，就在身边，很开心。,/Date(1538397560000+0800)/,0
120745312,工作人员态度简直是冷到冰渣，换票指示没有，进去什么也不说一顿推荐铁笼车，然而完全没有必要坐那个，猛兽离车老远了，都隔离开了，往回走的小交通也没必要买，走路反而有点意思，温顺动物区挺好,/Date(1535365164000+0800)/,1
161621959,去时赶上下血了，景色非常美，动物也都出来了,/Date(1535345589000+0800)/,0
153077264,很棒的动物园与动物的互动很多 而且动物园很大,/Date(1524624560000+0800)/,0
19644635,不错，值得一去。环境挺好，可与动物亲密接触,/Date(1523457666000+0800)/,0
37362748,温顺动物区可以下车喂食，孩子玩儿的非常开心,/Date(1500465965000+0800)/,0
5036286,动物种类很多，环境也不错，服务态度也不错！,/Date(1494816568000+0800)/,0
61195414,玩的很开心。带孩子去的。就是累了点。值得去,/Date(1493907395000+0800)/,0
42297528,散养区没多少动物，倒是后面的温顺动物区蛮好,/Date(1493469391000+0800)/,0
1265060,很多种动物，包括猛虎，千万不能在那里下车。,/Date(1469597356000+0800)/,0
4033037,指示牌特别不清晰，被人拦下来要我们停车，我们说我们去野生动物园，以前可以开进去的，回答现在都坐摆渡车。于是把车停到停车场，下来排队，冰天雪地，从停车场走过去发现那是去八达岭长城的摆渡，于是又回到停车场掏了10元停车费，继续往上走。电子票不能直接进，排队换了票，进去，野兽都没有，只能看笼子里的。,/Date(1644037218000+0800)/,0
186723679,最**的一次消费，影响了整个逛动物园的心情，没有那本事就不要买这类体验票，全程一步一停了快，自动挡车还好点，手动挡能开废了，80%坡道起步。再说里面动物，就看见一个老虎还不动弹不知道真假，还有几只熊。对了一进门有2野猪🐗。我就奇怪了。既然开车进里面看的动物还在笼子里，和外面看有什么区别?,/Date(1633497844000+0800)/,0
318508058,整个园区的风格可以用荒凉来形容，和广州长隆野生动物园完全不是一个概念。动物种类少，野生猛兽要隔着好几层好几十米观看，羊驼骆驼兔子仓鼠矮马可以喂，想喂兔子仓鼠子还得在园区里再交三十块钱，开了那么远车又是门票又是进车费，只是专去帮动物园喂饱他们的动物，不值票价，去一次就够够的了,/Date(1627696797000+0800)/,0
279621646,"这个点评是要投诉万程旅行，点评总是屏蔽，没办法，只能在其他地方点评。
从下单到取消不到5个小时，就要扣50%的费用，有碰到这样的平台吗？
情况是这样的：
7月18日晚10：12下的单，两大两小，另一个身高不超一米二，电话咨询让全部买票，19日凌晨三点孩子感冒发烧，于3点凌晨发短信告知导游孩子感冒不能参加19日一日游，导游回信已知晓。
19日上午给商家A打电话，如孩子退烧考虑日期，最好是退订，麻烦给解决方案，19日中午告知A商家孩子没退烧，麻烦尽快给解决方案，说下午给我电话，没等到电话，我打电话过去，A言语中他做不了主，告知另一个电话，打电话给B，B告知当天不能解决问题，让明天下午3点在打电话，20日打电话告知已发信息给其他人，说等回话，6点给回话，结果没等到电话，晚7点打电话没接，一直也没人来电处理，等于这几个人在踢皮球。
没办法情况下，抱着希望给携程打电话，没想到携程是最让人寒心，说考虑您孩子发烧，只扣50%的费用，好像不发烧就得扣全款。一直不给予解决问题。",/Date(1627049000000+0800)/,0
257844250,这个动物园太差劲了，说好的野生动物园动物也是圈住的，动物很少根本看不着，动物品种也很少，看了点鸡鸭鹅，进去费劲还很费劲，太不值，是看过的动物园里最差的一个，绝对不推荐来性价比低，有待改进，景色一般，可玩性低，,/Date(1620897936000+0800)/,0
29592804,上一次去野生动物园还是小时候了，回归童年,/Date(1566746701000+0800)/,0
8544707,这一年多来好多了，现在比以前安全了很多。,/Date(1566114517000+0800)/,0
38574895,非常好的体验！！！！！！！！！！！！！！,/Date(1564037937000+0800)/,0
167718837,女朋友觉得蛮开心的，就是从s2线过来太累,/Date(1560014649000+0800)/,0
70593447,挺好的，要是好好弄弄还有很大潜力做的更好,/Date(1544366458000+0800)/,0
152585731,我们是自驾游，里面的动物一多半都在睡觉，,/Date(1536281547000+0800)/,0
37511252,和朋友一起带着孩子去的，孩子玩的很开心！,/Date(1533476932000+0800)/,0
91805879,开车去的，动物没有原来多了，很是懒羊羊的,/Date(1531892618000+0800)/,0
156683796,很好玩，下次再去，孩子喜欢。玩的东西很多,/Date(1529444647000+0800)/,0
45141089,总体来说是值得一去的全家游好去处，能看到很多动物，与动物、大自然亲密接触。如果安全性得到保障的情况下，能与野生动物更亲密接触感受会更好点。公共设施需要再完善，例如对于老幼病残弱这类群体的关怀，以及怎么应对节假日人流密度高的问题。,/Date(1525151518000+0800)/,0
110609509,首先，节假日人山人海的，人多动物少，八达岭野生动物园比大兴的野生动物园动物少很多，格局也不好。所有的动物喂食都要另收费，就连小兔子猪进去要交二十块钱，给一袋食物里面有三四根胡萝卜还是切开的细细的条。坑人啊！里面几乎没有可喂食的温顺动物，跟大兴比差别不是一般的大。只有一个亮点就是孔雀是散养的，不怕人，小孩可以近距离接触到。三点半出园在停车场堵到八点才出了停车场，太可怕了，这个地方的交通，到现在也没明白,/Date(1519525043000+0800)/,0
164652661,地方挺大的，自己开车进去的，带孩子还可以,/Date(1519185369000+0800)/,0
74041466,整体来说还是非常满意的，有机会还会再去。,/Date(1517382345000+0800)/,0
30691239,景区堵车太厉害了，早上从9点多退房从北京出发，下午两点多才到，距离景区大约2公里的路走了一个多小时，好不容易排到了动物园大门口，因为车多，工作人员指挥我往下山路开从另一个门进，但沿路标识不是很醒目，搞得我错过门口，到下面又不让掉头。再绕回大门口根本不可能了，因为实在堵车太厉害，只有把车放山下停车场走很远进动物园，做大巴车进园，只能走马观花了，返程电瓶车站太远了，又没有显著标识，让我好一通找。总得来说风景很好，动物也不少，只是景区管理相对落后，堵车绝不仅仅是车多，和景区道路建设和管理关系很大。,/Date(1507471866000+0800)/,0
150278607,不错，方便快捷。环境不错，游玩也很开心。,/Date(1507368201000+0800)/,0
80096251,中秋那天去的。30公里的路程来回用了5个小时。公园紧挨着八达岭长城，节假日人山人海，千万别去。从动物园出来时，村里自己设了收费亭，每车10元说是停车费。我进动物园是自驾车进去的已经交了60元自驾游园费，为什么出来还要交停车费？！设卡收费堵了大批车排了40分钟才出村子。哎，这小农意识真是要命！搞旅游不能一锤子买卖，交通滞留乱收费，下次谁还去呀！,/Date(1507348090000+0800)/,0
107288063,携程买票方便快捷，节约时间成本，非常好！,/Date(1507297711000+0800)/,0
149014657,取票方便入园快动物不是很多草食动物很亲人,/Date(1507034897000+0800)/,0
33876078,挺好的，周日人也比较少，建议和长城一块玩,/Date(1506238987000+0800)/,0
46160311,猛兽类离的元了，其他都挺好，开车有时堵车,/Date(1503561545000+0800)/,0
23349795,很好，玩的不错。开车进去近距离接触动物们,/Date(1502100157000+0800)/,0
111539332,感觉不错，非常好，不虚此行，孩子很高兴。,/Date(1501899985000+0800)/,0
8754303,希望有更多的优惠，把老虎别用铁丝网关起来,/Date(1501604271000+0800)/,0
2838502,成交迅速便捷，省去了排队购票的时间，满意,/Date(1500967892000+0800)/,0
56713708,几年前去过，印象很好。这次再去完全毁印象了。首先开车游不光要交车票钱，还要交停车场钱，其实根本没用停车场。停车场管理人员不管你是去古长城还是动物世界，全都往古长城停车场引导。售票处强制游客购买保险。车子在园区内受动物损坏园区不赔，但如果你撞死动物，你懂的。老虎自从去年咬人后被电网隔离，狮子没隔离。豹馆里放的是老虎和母狮子，估计是能生出小豹子来，嗯一定可以的。之前每种动物都有介绍牌，现在有没有，随缘。对了，以前豹馆里还有一只黑豹，现在可能是养死了，改种树了。,/Date(1500813071000+0800)/,0
97117053,取票方便，只是没有汽车入门票，需要另购。,/Date(1500087137000+0800)/,0
7983239,就是天气热的时候玩，不太好，最好阴雨天去,/Date(1496445376000+0800)/,0
11576429,自驾车游玩很不错，就是动物园设施老旧了点,/Date(1496062618000+0800)/,0
93036561,玩的开心，动物不少，老虎狮子也不少，就是,/Date(1494974283000+0800)/,0
90612751,堵，各种堵，人多的不行，不能挑节假日去。,/Date(1493559966000+0800)/,0
6877957,"地方很大，猛兽区现在电网隔离，有点失落
",/Date(1493518163000+0800)/,0
42247971,就是猛兽区有点意思，但是也就走马观花看了一圈，其他温和动物更没啥好看的。总体来说动物少，很一般，但是山的景色还是不错的。,/Date(1493471253000+0800)/,0
35544203,周末去的人比较多，在公园里面车排长队，动物都不出来了。为了安全整修以后围起了电网，动物都不敢下来了，所以能看到的动物很少，也没有它们围绕在车周围的感觉了。所以总体来说有点失望的。在携程提前一天订票每人80，原价是90，如果开车另付60。,/Date(1492476051000+0800)/,0
88383559,管理规范，就是太严了，动物下的不敢出来了,/Date(1491971583000+0800)/,0
87858992,总体来说还是不错的，虽然喜欢走路，但是觉得还是开车进去好，因为可以走那儿停哪儿。,/Date(1491826976000+0800)/,0
109106825,带宝宝去的，宝宝很开心，小动物也很亲近人,/Date(1491278804000+0800)/,0
9371435,非常便捷的取票，方便，带小朋友玩得很开心,/Date(1491208328000+0800)/,0
19634137,好，挺好的人也不多，就是老虎没原来好看了,/Date(1489066125000+0800)/,0
7139694,自打园里老虎吃人事件发生后，游人少多了！,/Date(1482324100000+0800)/,0
69160266,猛兽区散养的老虎狮子都不动，狼没有看到，熊特别配合。温顺区有一处散养的马和梅花鹿好，长颈鹿也好。没有去过的倒是值得一看。,/Date(1474062105000+0800)/,0
1031800,园子挺大，但是感觉有的动物养的不太健康，瘦瘦的看着还挺让人心疼。可以近距离和动物接触，但是大家一定要遵守制度，安全第一。,/Date(1471084563000+0800)/,0
14726169,猛兽区的狮子老虎这些动物只有在早上天不热的时候才能看见一两只，等到十点左右天热起来了就基本看不见了。猛兽区好玩的就是喂熊，黑熊会抱拳讨好你，问你要吃的，小熊会围着你的车问你要。我们当时靠着右车门在喂食，过了一会听见一阵敲玻璃的声音，回头一看原来是有只熊在左车门看没人喂它在敲玻璃提醒我们。动物园整体动物种类不是很多。另外一处有意思的地方是喂食散养的马和鹿。整个行程基本两三个小时就玩完了。所以觉得还是买周三的特价票去玩比较划算。,/Date(1466229341000+0800)/,0
5613855,在长城底下，所以去长城玩的玩的话很方便,/Date(1574950913000+0800)/,0
247033008,很好玩，就是太热，狮子老虎都躲着睡觉在,/Date(1570191224000+0800)/,0
95196581,不错不错，不建议步行，开车自驾更有意思,/Date(1569289331000+0800)/,0
2109897,哈哈哈哈哈哈哈哈哈哈，哈哈哈哈哈哈哈哈,/Date(1563180877000+0800)/,0
206155320,五一劳动节去的人很多，带孩子去看动物。孩子很高兴。动物园还可以。动物都是大多数常在电视上能看到的动物。总体来说还可以。,/Date(1561188898000+0800)/,0
31808539,在这里买门票便宜、快捷，方便，谢谢服务,/Date(1557044782000+0800)/,0
119750571,相对门票较贵，里面的动物也不多，不太值,/Date(1554555827000+0800)/,0
5016204,不错，就是冬天去天气太冷了，太荒凉了。,/Date(1551428263000+0800)/,0
215007403,这个季节动物也休息，不过孩子玩的很高兴,/Date(1550817891000+0800)/,0
86440695,很不错，孩子很喜欢，特别是猛兽区的动物,/Date(1531110018000+0800)/,0
5683368,野生动物不少，挺安全的，认准路线一日游,/Date(1521439488000+0800)/,0
21826893,这里的动物已经算比较全的。野性也十足。,/Date(1520953798000+0800)/,0
109124825,购票很方便，孩子喂了小动物，玩的很高兴,/Date(1519792306000+0800)/,0
92132970,带孩子去的，自驾好去处，而且体验非常好,/Date(1519729096000+0800)/,0
