14170522,感觉越来越差了，开车进去参观的，赶紧很泥泞，环境不好。,/Date(1634560167000+0800)/,0
81366855,景区不大 人也不太多 总体来说还凑合 喜欢动物的可以去看看 ,/Date(1625908141000+0800)/,0
555385,几次事故以后，猛兽区区都看不到一只了，一点意思都没有,/Date(1643426265000+0800)/,0
28572500,来到动物园自驾看看老虎，狮子，然后在温顺动物区喂喂小鹿，大鹅，是北京城北不二的无接触亲子乐园,/Date(1590452035000+0800)/,0
78652576,非常满意的一次旅途，人流量不大，很愉快，适合带宝宝去,/Date(1587975582000+0800)/,0
390626744,跟去北京动物园没什么太大区别，除了可以开车，很失望,/Date(1665207511000+0800)/,0
58525865,动物，特别是老虎，狮子等都是懒洋洋的，给肉都不起来,/Date(1630434535000+0800)/,0
49720093,网上买了票还要去窗口换票，多此一举，去的路上一路畅通，好家伙，进了动物园堵车三小时，服了,/Date(1626747993000+0800)/,2
41588443,名副其实的野生动物园，猛兽区看到的动物有点少。,/Date(1623632212000+0800)/,0
34770281,对这次旅行评价，个人觉得可以用三个字来表达：不值得。如果非要再加一个字的话，我觉得是：非常不值得！唉！有点郁闷了，都不识数了！,/Date(1620078521000+0800)/,0
39620557,地方很大，动物活性不错，猛兽区给人一种狂野之感,/Date(1615388350000+0800)/,0
17935224,挺好的，医护免费，第3次打卡。虽然没有大兴动物园好玩，但是胜在价格合理，骑一次马20。,/Date(1606814299000+0800)/,0
50740711,没有以前自驾有趣，动物都隔离开了，包括孔雀～,/Date(1629191304000+0800)/,0
106236057,真心不咋地，野生动物园的动物也是在笼子里……,/Date(1623623922000+0800)/,0
7158397,不太推荐，动物少，离得很远，自驾乐趣没有。。,/Date(1623133855000+0800)/,0
272219270,只能自驾 如果没有车还得租车 两个小时二百块钱 不想开车还得给司机和车都买票 太坑了 大老远去了被坑了350 再也不想去了 还有动物不出来,/Date(1615123702000+0800)/,0
270740657,一家人一起 带上孩子可以玩一整天 给小动物喂食是孩子们的最爱 适合各个年龄段游玩  一家人都不会闷 放暑假去刚刚好 和长城很近可以一起看看,/Date(1595775161000+0800)/,0
236658,门票已经不便宜了，里面各种饲料单要钱，各种馆单收，各种娱乐项目单收费。动物们基本圈的老远，不如北京动物园，大兴野生动物园。,/Date(1629473169000+0800)/,0
531275,每年必去的地方，小孩子每次去都开心的不得了，每次都很尽兴的，每次都去买动物娃娃，也有碰碰车之类的小朋友游乐设施的，停车方便,/Date(1614146013000+0800)/,0
232384778,景色不错，有趣好玩，值得推荐，带孩子去挺好玩的，孩子很喜欢😘，值得带孩子去玩玩儿,/Date(1601901322000+0800)/,0
2672865,动物看你，自己体会吧,/Date(1632131995000+0800)/,1
3145066,第一次来北京野生动物园，整体感觉不错👍,/Date(1624401353000+0800)/,0
153016926,挺好的，景色不错，感受到大自然的身临其境,/Date(1618105331000+0800)/,0
236718220,带孩子去体验很好，自驾去感觉可以玩一天！自带了胡萝卜和黄瓜，小羊和狗熊都喜欢吃，有的狗熊还会作揖，超级可爱！景区也有卖食品喂食小动物的，我们喂了大象和长颈鹿，小朋友开心的不行，出园的路上还有各种小马小鹿在路边，可以近距离的接触，孩子开心的和他们道别，总之很开心的一次出游,/Date(1599014184000+0800)/,0
216713752,早就听说，八达岭的野生动物园比较好，至少可以和比较多的小动物亲密接触，今天来了，还真是！猛兽区很短，感觉只有那么三四种猛兽，大部分还是可以下车游玩的路段。今天带孩子喂小动物，骆驼和斑马吃的最温柔，而且是最近距离的，大象也不错，就是只喂了五根爆米花。长颈鹿的劲头最大！扯着树枝吃，小孩儿都说拽的手疼[em]e106[/em]我也试了，确实比较有力量。小鹿，大黑熊，狼，都是离得稍微有点远，得把胳膊伸的超直才能喂到。喂大黑熊很有意思，大黑熊它会坐在那里，还会张开嘴，等着你把食物投进去[em]e120[/em]，总体感觉，不错。,/Date(1591504536000+0800)/,0
26853476,"我在农村，没网没WIFI，为了赞你这条发文，我走了几十公里的山路来到镇上，脚上磨起了许多豆大的水泡，鞋子也开胶了。本来想把家里的苞谷卖掉几十斤，在镇上坐车到城里的网吧赞你这条说说的，无奈天公不作美，今年收成不好，种的粮食只够家里吃，所以我只好在镇上的砖窑里打工，挣足路费。从砖窑搬一块砖到拖拉机上只给一分钱，为了100块的车费，我搬了一万块砖，十个手指头都磨出了鲜血，为了省下车费，我没贴云南白药创可贴，让血液自然凝结。之后拿到搬砖钱，我坐上了从镇上开往城里的汽车。来到网吧，一摸兜里，***，没有三块钱的上网费了，少搬了300块砖。我只好在大街上四处奔走，守望着那些喝矿泉水的人们，当他们将矿泉水瓶从手中抛出的那一刹那，我就像守门员扑球般扑去了，生怕矿泉水瓶被别人抢去了，我赞你的说说又晚上那么一秒钟，你理解我迫不及待赞你这条说说的心情么？历尽千辛万苦，我终于收集到60个珍贵的矿泉水瓶子，拿到废品收购站换了3块钱的网费，来到网吧，终于赞上了你这条文章。

 

",/Date(1590564871000+0800)/,0
83178627,动物太少了，各方面不及大兴野生动物园。,/Date(1632143430000+0800)/,0
13052127,开车走完全程比大兴原始很多 中途有下车点,/Date(1627429292000+0800)/,0
284096348,写的是野生动物园，实际上动物全被圈在笼子里，写的不允许喂食，工作人员带头将很多动物未必能吃的东西扔到笼子里，喂动物吃，,/Date(1625809773000+0800)/,0
29439517,还可以，可以开车进去转一圈，能看到老虎,/Date(1623732312000+0800)/,0
87843762,车子收费很便宜。大兴野生动物园是200,/Date(1619374787000+0800)/,0
55093191,自驾开车还可以，动物不太多，也不活泼,/Date(1627456683000+0800)/,0
5242625,疫情过后带孩子游玩。虽然有雨，但是下车时正好停了，只能自驾，动物虽然不活跃，但好在可以喂一下小鹿、小马、小羊等，孩子们玩的不亦乐乎，总体满意，下午到了人少。,/Date(1595886492000+0800)/,0
8242414,自驾进入园区，指示牌清楚，非常方便,/Date(1629637253000+0800)/,0
87324433,早上九点到的动物园，开车入园车辆不是很多，大约十点半左右园内有些拥堵了，以为是山区坡有些抖，很刺激，，小朋友更喜欢温顺动物区，自带了蔬菜喂小动物，园内小矮马很是温顺，可以触摸,/Date(1491282475000+0800)/,9
22965490,车可以开进去，可惜离动物太远了,/Date(1629211557000+0800)/,0
31493726,整体环境差了一些，路不平车不好开，但喂动物的环节孩子喜欢的不要不要的！,/Date(1594713919000+0800)/,0
310668602,动物太少，黑熊应该是有抑郁症,/Date(1619705922000+0800)/,0
3922827,第二次去了 还是比较值得去的,/Date(1627821652000+0800)/,0
2433523,管理不咋样，野生动物没看见几只，儿童游乐场倒是一大片，部分汽车随意停放，总体体验太差，真不如大兴野生动物园,/Date(1625488510000+0800)/,0
24785326,动物没有那么多了 性价比一般,/Date(1620110555000+0800)/,0
14233548,去了三次，一次比一次体验感差。应该也是和之前老虎咬人有关系。之前是动物看人，现在和北京动物园差不多了。😂,/Date(1606014343000+0800)/,0
54735995,赶上十一了 入园前排队 有些久 线上买票还要到现场换票 有些麻烦 起他还好。,/Date(1601962733000+0800)/,0
19310848,挺好的，动物不少，走起孔雀开屏，非常漂亮。挺好的，动物不少，走起孔雀开屏，非常漂亮。挺好的，动物不少，走起孔雀开屏，非常漂亮。,/Date(1588461215000+0800)/,1
185421883,开车进去的没看到什么动物,/Date(1633446463000+0800)/,0
1486844,天气有点冷 动物活跃度不高,/Date(1623112887000+0800)/,0
108561939,自驾猛兽区路线关闭，绕行。白花钱开车进去了没什么意思！性价比低，,/Date(1620029002000+0800)/,0
31206448,一般吧，进不到几只动物。,/Date(1615565595000+0800)/,0
204290794,票价可以接受，里边的动物整体来说比较少，而且基本上都是圈起来的。,/Date(1604190941000+0800)/,0
156424964,非常不错，全程自架，温顺动物区还可以投喂，下次有机会还会再来的！,/Date(1603505527000+0800)/,0
531275,八达岭野生动物园还是很不错的呢，可以开车全程游览观光的，导览很清晰地，现在不用担心猛兽近距离接触的危险了，因为那件事以后都增加了围栏电网，也有工作车辆管理，非常安全,/Date(1588697393000+0800)/,1
48835956,还不错挺好的，支持一下,/Date(1621390780000+0800)/,0
162709634,每个男人都有一颗要登上长城的心，每个已婚男人都有带自己媳妇去八达岭野生动物园碰碰运气的小心思，哈哈哈这个千万别被我媳妇看到哦，要不然会被打死的,/Date(1518569194000+0800)/,32
89554245,带孩子值得一看去，温顺的动物孩子很喜欢，唯一的缺点就是大部分的的动物都关起来了，没法亲密接触！个人觉得还是喜欢以前的野生动物园！把动物都关起来就不叫野生动物园了！,/Date(1492914476000+0800)/,9
27518720,一般一般，没大兴的好,/Date(1634910990000+0800)/,0
106562991,带孩子去，感觉还不错，孩子玩的也开心，觉得热带动物馆不值得，很小一块，还没看就出去了，一米二以上的孩子应该半价，比较合理,/Date(1599919074000+0800)/,1
33746948,喜欢和动物互动的非常建议来，而且自驾进来！自驾进来！我们没有经验，步行进来的，走出去的时候累死了！自驾和步行路线都是一致的，而且可能是因为这个动物园建得比较早，不像后来的动物园一样会特别紧凑，所以会走一阵子才会有下一类动物，很累！多带胡萝卜，大白菜，信我吧…在小马和梅花鹿放养区你会找到乐趣的！除了年久失修，道路对步行不友好，物价偏高（一根树杈十块钱）之外其他都还好，还是建议带小朋友的来玩的，不过记得准备好驱虫措施，我就在马和梅花鹿那里被像苍蝇一样的虫子咬了，很疼啊,/Date(1596212751000+0800)/,1
14233548,"可以说实话嘛？
从八达岭野生动物园营业开始，我们去过三趟，这次的体验感受是最差的。猛兽区的动物们全被圈在笼子里面，游客下车后去看笼子里的动物。请问那么野生动物园和北京动物园有什么区别呢……
开到最后是孔雀，珍珠鸡什么的，倒是三两只的在外面走着。
我们是5.2去的，感觉人比动物多。其实去过家离延庆不远的，去八达岭野生动物园玩儿玩儿还行，门票也不贵。不过像我们驱车两个小时开过去的，再遇上堵车，就着实有些不划算了。
不过八达岭野生动物园的工作人员我还是要点赞的，尽职尽责且非常有耐心的解答游客问题。并且考虑到了五一期间，出游的家庭比较多，所以工作人员也增多了。",/Date(1588976393000+0800)/,1
18167243,我们是早上八点一开门就去的，人还算比较少，但有些动物也并没有放出来，差不多九点半左右，所有动物才都出来，现在这些凶猛动物都加了护栏，最多也就扔个苹果过去，趴窗户要吃的是没可能了，自驾的话小车，门票60，保险5元一人，到了温顺区动物胡萝卜黄瓜都是动物的最爱，尽量不要招惹一群马和鹿如果一下都过来也是挺恐怖的，我家车就被马磕掉了点漆，如果带小孩还是喂在护栏里圈着的温顺动物比较安全,/Date(1522033638000+0800)/,3
240235371,感觉动物太少  看点少,/Date(1635818109000+0800)/,0
87257911,两只狮子的虎园，一只大象的象馆。可以开车参观的猛兽区就是两只睡着的老虎。就像上市公司上市前的业绩。,/Date(1619279760000+0800)/,0
531275,非常方便去的动物园，有特色有变化有趣好玩，餐饮不多不过能吃饱喝足就行了。最最棒的依然是孔雀🦚！,/Date(1598010630000+0800)/,0
34828885,很荒凉了，动物都被圈养了，而且种类少了，一点都不景气了，很多地方都荒了，人气很低，不太值得去,/Date(1627739576000+0800)/,0
332639292,感觉动物们都灰蒙蒙的掉毛严重，景色也不太好，就是孩子们可以喂食，但也都是额外消费，建议自驾游,/Date(1623647548000+0800)/,0
249449291,八达岭野生动物园是不少自驾游的游客心中的向往目的地，可分为猛兽区和温顺动物区。在猛兽区可从车上近距离看老虎、狮子等猛兽，温顺动物区可喂猴子、大象、长颈鹿、斑马等温顺的动物。,/Date(1587367602000+0800)/,0
111832943,一路下来也没看到多少猛兽，有几只狮子🦁️、老虎🐯躺在地上也不知道是睡着了还是生病了🥺，一路就是在开车上山和下山中度过，路上还很拥挤！绿区的动物也都是各动物园常见的！,/Date(1602116177000+0800)/,0
22517376,值得推荐，体验很好，园子人不算多，游玩很舒服，一个单独收费的萌宠乐园非常不值，票价20，很失败，除此之外非常好，猛兽观赏感十足，食草动物互动体验很好，非常适合带孩子游玩。,/Date(1599223207000+0800)/,0
51490408,整体还不错 不过感觉和大兴野生动物园环境差距有些大 ,/Date(1598287513000+0800)/,0
531275,私营的，维护的很不错了呀，20年间去过多次了，最爱那里的孔雀🦚太美了，希望大家爱护动物,/Date(1605971238000+0800)/,0
264740836,开车进去方便的很...疫情期间人少33333333333333333333333333333333333333333333,/Date(1588383774000+0800)/,0
160630981,开车自驾进去，没有以前的那种自由感了，老虎狮子的都有电网隔着，他们也都躲在树荫背对着游客。失去了野生的感觉了。提前从网上订的成人票和汽车票，带着孩子和老人一起，老人半价票两张，兑票时候有一个窗口说要******，我说买票时候我已经在网上登记过了，又返回车里拿票，其实完全可以再检票的时候******核对一下。我回去拿完***回来，又换了一个窗口……结果没要***。大象就一只，长颈鹿也够不到……老虎两只趴山上背对着我们，狮子没看到……原来黑熊啥的也都在外面。动物也怪不容易的。出了猛兽区之后，就是有儿童玩的那个旋转木马，小火车，挖掘机……三项70块，单项30。我是觉得这样的游乐设施为什么要存在在动物园。我来看动物的……拿这个吸引小孩的注意力，没少赚😂,/Date(1591110604000+0800)/,0
165010459,"爱护动物，保护环境！
经过多次检查才入园
室外活动适合这个期间！
但是需求提前带一些食物
很多动物也很饿的样子，猴子不知道怎么了",/Date(1587199678000+0800)/,0
7886796,八达岭野生动物世界在八达岭长城旁边，是中国最大的山地动物园，有老虎狮子等动物，可以在车里近距离观看，记住要听从注意事项，不要下车。动物园的动物都好悠闲，闲着踱步！我是属老虎的，所以看到老虎格外的亲切！门票90元人民币，学生老年人半价！可以欣赏到长颈鹿、斑马、羚羊，澳洲的袋鼠，还有中国的国宝熊猫、金丝猴、朱鹮、金毛扭角羚等。,/Date(1552981844000+0800)/,0
110609509,节假日千万不能去，太堵了，八达岭野生动物园比起大兴野生动物园差的远了，动物少的可怜，温顺的动物能喂食的也不多，兔子和猪都要另收二十的门票。出了野生动物园出来在停车场就堵了四个半小时，这个地方的交通太奇葩了，去野生动物园还得去大兴的野生动物园。,/Date(1519525639000+0800)/,8
164841762,春节长假带父母孩子出游，首选八达岭，离家更近，开车很快就到了！景区门票很好买，携程旅行网提供了很多方便！景区看动物跟以前不一样了，都有了防护措施，景区内的工作车也多了！大型猛兽区既能看到动物，又能保证安全措施，很人性化，温顺动物是最能打动小朋友的，可以近距离接触到，此次游玩非常开心！,/Date(1519283405000+0800)/,0
5900042,十多年没来了，那时还是二十出头小姑娘，进来各种兴奋，这回带着娃来，换娃各种好奇。初冬，头天延庆下了第一场雪，下雪不冷化雪冷，今天阳光明媚也只有零下5度，幸好坐车里啊！九点就进园，绕了两圈车才多起来。遗憾的是知名事件搞的老虎被圈住。温顺区的珍珠鸡、小鹿还是最吸引娃的。太冷没下车，但小鹿争着往车窗里伸脑袋也挺逗。回到大门口游览车那里，发现一堆猴也挺有意思，不凶，就站那儿抬头等你掏吃的。,/Date(1511738564000+0800)/,0
112776978,对比了一下北京的动物园，最终选择了八达岭野生动物园，猛兽区的紧张期待与刺激，温顺区与动物们的零距离接触，我们是自驾进入，非常满意园所这么人性化的规则安排，真的是不虚此行，孩子四岁了，一回到家就急着跟老人讲述所见所闻，长知识的同时锻炼了口才，对园里各种动物都有她自己的理解,/Date(1502285495000+0800)/,0
91005818,总体来说还不错，自驾游去的。抓拍到了很多好玩的瞬间，如果再大点就好了。早上十点从家出发，不到十二点到的，换票的时间比较长，因为现买票只能是现金。除了不能下车、开窗的地几乎没有停留外，能步行的地方都溜达了，还吃了顿饭（因为没吃早餐），看着价格还不算太贵，结果量着实少得可以，都是限量迷你版，如果不是很饿，真心不会在那吃的。不到两点就返回了，也算是尽兴吧，毕竟拍了很多有趣的照片！,/Date(1494077073000+0800)/,4
39448655,不错的一次旅行，开车去的带着女朋友，去的有点早了，猛兽区的动物好像都没睡醒呢，不太活跃，到了温顺区的时候，感觉小动物们都饿疯了，竟然敢拦路，哈哈。带去的蔬菜水果严重不足，建议去的时候多带一些动物们爱吃的蔬菜水果,/Date(1493915534000+0800)/,0
89040629,七点半从家出发，历时一个半小时，九点到达目的地，八达岭野生动物园！经过漫长的车程，终于到了，好激动的说。从携程上提前订的票，在售票口直接拿票走人，排队的人不多，速度很快。自驾要再买60元的自驾票。拿票后直接进园，先到猛兽区，门口就有三只大白虎，瞬间提起兴致来了，继续往前走，来到一个可以下车观看的猛兽区——关在笼子的黑熊和白虎，好多人喂食物，最好玩的是，有个黑熊见有人喂吃的，还给作揖，不过也觉得动物们好可怜。继续前进，看见几只老虎懒洋洋的在山坡上躺着，都隔上了电网，所以老虎也都不敢下来了。再往前走有个孩子门玩的游乐场，还挺大，还有可以骑的骆驼，山羊，马，当然都是收费的。继续走，好多斑马和长颈鹿，好多人拿着东西再喂，幸亏准备的胡萝卜比较多。继续前进，来到散放区，鸡啊，孔雀啊，还有马和鹿看见有车来，就凑近要吃的，都不怕人的，真的超级适合带孩子来体验一下，不过我们走到这都太累了，没下车，就在车喂了点食物。两点出园回家。整体感觉不错，等孩子大点可以再来一次。,/Date(1492991468000+0800)/,0
109127263,公园很大，很有野生动物园的感觉。建议做玻璃的大巴车就行，铁笼子的还要加15元车票。动物们非常喜欢吃我们带的苹果和肉松面包，玉米圈他们都吃腻了。猛兽区的老虎狮子还是很威武的，个头相当大。非常喜欢的一次游玩。,/Date(1492391839000+0800)/,0
79424928,换票很方便的，如果车进去买个车票就行了60，熊熊很可爱 我们自驾去的 里面还有白孔雀要十元才能进去看 其实没有必要因为在往前走就有放养的孔雀 可以自己带一些黄瓜去  自驾真的是猛兽区不要开窗 我们前面的车偷偷开窗喂熊 你堵的别人不能走不说自己也不安全啊  千万不要  可以带一点黄瓜喂马和鹿很可爱会一直追你,/Date(1491716236000+0800)/,0
79681690,整体感觉不错，景区秩序和节奏安排得比较合理，各种动物都很活泼，比北京动物园都关在笼子里有意思多了。只是从高速上经过时的路标不是很明显，导致第一次开过了，只能多开了50公里绕回来，另外就是自驾车主加塞太严重了。,/Date(1491704237000+0800)/,0
86029130,终于看到了传说中的老虎，真的不像新闻上说的，其实都比较温顺，如果不是主动招惹，按照工作人员指示，真的是一次刺激的体验，园区很大，尤其到了温顺动物区，感觉置身大自然中，和小动物亲密接触，孩子很喜欢，绝对是1-2日游的首选。,/Date(1491265540000+0800)/,0
78989331,"携程上提前一天预定了票～很方便取票～
清明节的第一天去的动物园，我们是去朱辛庄地铁站坐的880公交，到八达岭站下车，问一下工作人员，很快就能走到动物园门口啦～
大巴游览是免费的，网车15块钱一个人，网车的视觉效果比较好～带着通过了猛兽区～
然后下车走路返回，途径很多温顺动物区～挺好的～
唯一的一点就是网车司机，总是在有老虎?黑熊旁边的时候，开的可快了?",/Date(1491196015000+0800)/,0
18822256,携程票价80，到售票口换票，再加购自驾车费60和保险每人5元。野性的老虎都被拦在电网外和困在笼子里了，人的下车错误造成了他们的二度不自由，很尴尬。。。猴山与北京动物园类似，象馆只有两头圈养的，长劲鹿,/Date(1502377496000+0800)/,0
8571390,都在笼子里。还好有一群鸡和有几头鹿挡路，感觉是野生动物园。不然真是太无聊了。,/Date(1643078901000+0800)/,0
64898729,失望，动物们都被铁丝网隔开了，开车进去还有什么意义呢，这样还不如去北京动物园,/Date(1625394775000+0800)/,0
48681736,跟大兴野生动物园差远了，根本就没有看到几个动物，里面居然还有很大一片游乐场,/Date(1621175307000+0800)/,0
15290127,还可以，没事可以和家人一起溜达溜达,/Date(1610611566000+0800)/,0
555385,出事故以后，加装了电网。等于隔开了。这样这是什么的就不如大兴的好了。猛兽几乎没看到，会开车转一圈。花了三百多块钱。,/Date(1590993457000+0800)/,0
50474592,还可以哦，就是开车的人会有点累。,/Date(1599272084000+0800)/,0
9088265,可以开车逛…还是挺不错的，虽然里面很大，但不是很累！可以看的动物有很多！,/Date(1595041445000+0800)/,0
249404528,真的体验一般 ，可能是路上开车进去开车好无聊╮（╯＿╰）╭总之体验不好。,/Date(1621902896000+0800)/,0
301918621,真不错(≧∇≦*)好(✪▽✪）,/Date(1613458083000+0800)/,0
28762055,有趣好玩，体验很好，值得推荐，,/Date(1597736250000+0800)/,0
22414452,非常不错，适合带小朋友出去玩。景色不错，值得推荐，有趣好玩，体验很好，,/Date(1596969043000+0800)/,0
79761954,不错的体验旅程，里面特别大，野兽区的老虎狮子还有野猪豹子，不能下车观看，进出车必须过关口，巧的是遇见黑熊，老虎都在决斗，可震撼了。。大象长颈鹿的可以接触，不错的旅行。以后有机会还带朋友来玩。,/Date(1491272319000+0800)/,0
204402569,"五一去的，人比动物多，猛兽区基本就没有啥动物了，
可玩性低，
有待改进，",/Date(1621127199000+0800)/,0
38000439,第一次来八达岭野生动物园～感觉一般般～心心念念想看的动物都没有看到～长颈鹿啊、大象啊～都没有～动物种类少了一些～不过也有值得看的亮点～就是大熊和老虎、数量很多～精神状态也比其他动物园的要好,/Date(1589559277000+0800)/,0
52641452,没有自己开车去很遗憾，坐大巴逛的猛兽区，又步行往回游览看小动物～路程很远，很多地方没逛到，就坐了一段电瓶车～园很老旧，但是可以和动物近距离接触这一点很好，孩子很高兴～希望以后能弄的更好些～,/Date(1557925039000+0800)/,0
97341839,动物也不怎么欢快带孩子去的，建议秋天去，可能夏天太热了都躲在阴凉处,/Date(1632899795000+0800)/,0
52051920,北京八达岭野生动物园很好看。分为猛兽区和温和动物区。猛兽区安全防护很好，不要下车即可。温和动物区可以和各种各样的动物亲密接触。,/Date(1506822944000+0800)/,3
