19202322,老虎很懒，离得远，有些失望。话说真有开窗下车的冲动啊但为了自己和动物的安全还是守规矩好。园里提供的胡萝卜小动物不爱吃，自己带的洋白菜油菜，猪羊鹿都爱吃。拿多少都不嫌多。危险的动物都离的远，只要守规矩，毫无危险。,/Date(1503296162000+0800)/,0
100960550,第二次来了，这次是带孩子来的，孩子一岁半了，首先取票还是很方便的，但猛兽区的体验不如上次了，或许是因为自打上次动物园出事后重新整改了，感觉离老虎狮子远了很多，跟去普通动物园没啥区别了。后来的喂小马喂梅花鹿还是很好玩的。,/Date(1503276580000+0800)/,0
111020050,在门口换门票，连同汽车的票也缴费了，在门口还要单独买一份保险，一个人五元，但是因为工作人员和疏忽，没给汽车的入场券，折腾回去，她开始说我弄丢了，结果我在车里没找到，回去找售票员，她算了半天，结果说，她没给。真气人。动物园里，猛兽区，就没看见动物，都在笼子里就狮子看到两只，猴山里面猴子不少，在入口处也有，不过真的会抢东西，记得不要穿红色的衣服，一个小朋友就是穿红裤子，让猴子抓住大腿咬，还好没咬坏。整个野生动物园，开算可以，孩子觉得还行。,/Date(1501752728000+0800)/,0
839883,大热天的开车十分方便，除了猛兽区不能下车，其他区域可自行决定下车，边走边玩也不累,/Date(1500283171000+0800)/,0
95418036,一般，坐的铁网观光车进去，15块一个人，过了猛兽区就把人都放下去，此车是单程，回程要自己走回去，或者再坐他们的电瓶车回去，做电瓶车还是15块钱一个人，而且态度不太好，电瓶车车子开的蛮快的，遇到温顺的动物也不会减速或者给大家提示，直接加油过去，体验太差。如果自己走出去，带孩子的最起码要走一个半小时以上，路程很长，而且是有上坡等，动物园是在类似于小山上。里面动物也不是很多，觉得和我们当地动物园没啥区别。以后不会再去！,/Date(1496957437000+0800)/,2
81192131,猛兽区车多很堵。sun bear 好可爱！老虎坡上老虎在?，野生的狮子高大威猛！离开猛兽区就能够和动物们近距离互动了，出了狮子老虎和黑豹，还有大象，长颈鹿，鸵鸟等。,/Date(1496715556000+0800)/,2
90783750,不错玩的挺好就是有点累人，孩子玩的很开心,/Date(1493619387000+0800)/,0
7185080,售票区的2.3.4窗口可以兑换网购门票，自驾进入需要再单花60元。猛兽区增加了电网，赶上中午，老虎狮子们都在睡觉，没意思。温顺动物区，从鸵鸟区开始，就可以喂它们蔬菜啦！带了洗干净的胡萝卜和黄瓜段，结果还是不够，大家都太能吃了！最后的最后，三只骆驼争先恐后把头探进车窗，张着大嘴瓜分了一袋原麦山丘的面包。。吓慌我了哈哈哈！,/Date(1492250694000+0800)/,0
13081013,取票非常方便，不用排长队，但是最想吐槽的是八达岭野生动物园，管理混乱，环境差，道路破旧，动物超级少，整个动物园动物加起来连十种动物都没有，猛禽区的动物不超出五种，所谓温顺区的动物大多是猪羊之类，并且被圈起来单独收费，很失望，一点都不像野生动物园，连小县城的动物园都不如,/Date(1491576423000+0800)/,0
87396599,第一次带娃来野生动物园，总体感觉还不错，节奏可以自己控制，比较适合带孩子。猛兽区随处可见醒目的安全提示标语和工作车，可见动物园工作充分呀！不知道是不是阴天的缘故没看到狼和东北虎，很遗憾，但是喂老虎吃肉真的好过瘾啊哈哈！小广场的碰碰车成为今天的黑马，娃兴致大增玩了两次！天伦之乐啊！之后的长臂猿真是飞檐走壁身手矫捷出其不意高潮迭起啊！梅花鹿很温顺，可惜那会娃困了没能互动，后边喂孔雀还是很愉快，噢忘说了娃直到最后还意犹未尽的是喂猴子，猴山的猴子很多，也很活泼，娃喂了提前准备好的西红柿和萝卜，不亦乐乎啊！在这里想说一下直接喂带包装零食的游客，你考虑过猴子的感受吗？你有环保意识吗？全程还是比较愉快，有机会再来，就是一车60贵了点，嗯,/Date(1491304767000+0800)/,0
86493029,老虎伤人事件后，一只挺想来看看那只老虎，进去看了半天，也没看出来是谁咬的（哈哈，开个玩笑哈）。公园感觉一般，动物种类比北京动物园少多了。还有就是好几处挂出猴会如何如何的牌子，但是最终也没看见一直猴。可以一游，如果期望值小一点，可能感觉会更好。顺便谴责一下，有些游客素质太低，竟然用比拳头还大的石头像关着动物的地方扔！公园应加强管理，对这样的人罚款一千！,/Date(1490935662000+0800)/,4
73275622,和女朋友去玩的 停车场设计的不太合理 长城的停车场 和动物园的停车场划分的不够明确 跟着一堆车排队上坡 发现是开车进动物园参观的 开始不太想自己驾车进去 但是那天去的有点晚了 就只好在买票开车进去了 自驾游还是不错的 最后快出去的时候 看到几匹小马 还喂了它们 总体评价还是不错的,/Date(1476331863000+0800)/,0
70854454,我们是重开后领着孩子去的。这次还是有新的变化，起码凶猛动物区都用网隔开了，除了两个熊的区域。老虎狮子大多都在笼子里！可以买肉自己喂，园子里牛肉十元一块，好贵，如果可以的话，可以自己从家带些，再带个一米五的长棍子！这样就可以顺利的喂动物了！接着走就进去了休闲区，这附近有猴子，大象，等都可以去看，饿了也可以在这边吃饭。过了休闲区就是温顺动物区，有禽类，还有鹿，马等，可以下车自己和动物亲密接触，提醒，景区蔬菜包十元一包，好少，最好自带。和温顺动物接触时不要伤害动物或者激怒动物！！,/Date(1476079464000+0800)/,0
109017512,自驾车进去的，挺好的，也不会累，开到温顺动物区可以让孩子去喂食，还有很多散养的动物，喂食梅花鹿很有意思，还有很多散养的孔雀，只不过这个时节孔雀正是脱毛的时候，都没剩几根了，说是过年的时候正是它漂亮的时候。,/Date(1475713158000+0800)/,0
38354606,取票很方便，由于是下午去的，天气也比较热，大部分动物都在睡觉。铁笼车要另外收费，每人15元，儿童票价相同。返程电瓶车也是要自费，每人15元，过1米3的儿童票价无优惠！小兔子园每人10元，还免费送一袋胡萝卜，可以带孩子去玩会！兔子超可爱！长颈鹿真的很漂亮。,/Date(1467724252000+0800)/,0
12759542,还不错，天气虽冷，但孩子的激情很澎湃……,/Date(1450794823000+0800)/,0
555385,几乎看不见什么大型动物，一点都不好玩。,/Date(1604100981000+0800)/,0
274402955,在北京居然有这么便宜的地方。性价比很高,/Date(1598411022000+0800)/,0
170307224,挺好玩的，就是天气有点冷，下次还会再来,/Date(1522991085000+0800)/,0
150025708,大家玩的挺开心的，尤其是宝宝，玩的很开心，大家都觉得挺好的。之前一直想来八达岭动物园，今天终于实现了，整体上还是不错的,/Date(1507206215000+0800)/,0
35844981,中午到的，猛兽区的动物可能太困了都在睡觉，食草动物还是超级活跃的，最好自备一些黄瓜苹果胡萝卜，除了自己吃还可以喂喂动物,/Date(1494229579000+0800)/,0
89404806,今天周六，本来说带孩子去北京动物园，后来临时改变开车来八达岭野生动物世界，门票比门口售票便宜10快钱，自己开车游玩单加60，总体来说还可以，只要孩子高兴就行。,/Date(1492848920000+0800)/,2
828511,"平时去很好玩，可以近距离看猛兽、喂动物，但节假日……除了看人就是看车，动物都吃饱了，根本不看人，但总得来说，非节假日值得推荐，尤其是有亲子
如果不开车，园内有大巴，按时或按人发，不过没有自己开车自在",/Date(1491275592000+0800)/,0
249493434,动物很少，种类也不多，感觉都要饿死了,/Date(1600989355000+0800)/,0
153274638,啊~~~慕名而来，网红地，还可以吧~,/Date(1537594596000+0800)/,0
75086441,总体上还是很好的，孩子们都玩的很开心,/Date(1533189579000+0800)/,0
12120689,自驾的 感觉自驾非常适合八达岭野生动物园 先进入猛兽区 猛兽区有个可以下车观赏的区域 可以喂棕熊吃蔬菜 那里还有老虎和狼 可以自带蔬菜喂食 再继续就到了散养区域 之后到中转区 那边有餐厅 还有小朋友可以玩儿的电动游戏,/Date(1507464325000+0800)/,0
8718172,没有十全十美的吧！虽然说是野生动物园，对于野做的还是不够突出，没有想象中的特色，多少有点失望，在舟劳顿挫了2个小时后,/Date(1501338772000+0800)/,0
149993806,很大，动物种类也多，去的人也很多。,/Date(1507428311000+0800)/,0
43224816,很不错，有种与大自然融为一体的感觉,/Date(1493542802000+0800)/,0
80703630,不错，取票方便。野生动物园很大，仔细转的话可以一整天，温顺动物区印象最深的是小鹿矮马和孔雀，凶猛动物区的老虎很精神，跟圈养的北京动物园的精神面貌完全不同。还有孔雀活的也很滋润哈！推荐！值得一去！,/Date(1491799820000+0800)/,0
64560428,山花刚要开，景色不错，见到猛兽不多，放养区新增防护网等安全防护措施，很安全,/Date(1491774411000+0800)/,0
44746745,太破败了，哎，一手好牌打的稀巴烂,/Date(1591167967000+0800)/,0
164310102,挺好的，动物挺多的，人也多，哈哈,/Date(1519103846000+0800)/,0
87983044,这个动物园我带孩子去过，非常喜欢,/Date(1517189086000+0800)/,2
201342378,亲子还是不错的，孩子玩的挺开心,/Date(1601177377000+0800)/,0
273617451,到处都围起来了，所以不好玩儿！,/Date(1597772662000+0800)/,0
172408689,有趣好玩，体验很好，景色不错，,/Date(1591609155000+0800)/,0
8215030,与小动物们近距离接触 感觉很新鲜,/Date(1518860076000+0800)/,2
22107252,可以和动物亲密接触，孩子很喜欢,/Date(1505031681000+0800)/,0
87146957,比较大，动物不少，东北虎最霸气,/Date(1491134839000+0800)/,2
155158171,之前点评过，象园不让喂胡萝卜，大象比以前瘦了，饲养员太差劲，为了挣钱卖什么玉米棒给大象吃，那玩意能吃饱?差评,/Date(1596511076000+0800)/,0
6893367,携程买的票比较方便快捷，猛兽区的动物都比较懒散，温顺动物区是小朋友的最爱，下次再去一定记得多带些蔬菜喂动物。,/Date(1446369008000+0800)/,0
171632120,一点意思也没有，还强制买保险。看不到啥猛兽，觉得下次去大兴的看看。,/Date(1633335405000+0800)/,0
27725484,有点萧条，可能是冬天的缘故,/Date(1606656102000+0800)/,0
10600162,体验不佳，景色一般，性价比低，可玩性低，网上买的车进去票，换票还需要购买保险，车上人员一个人579826元,/Date(1601823466000+0800)/,0
25063908,设施相对落后，游览车太脏了,/Date(1598072283000+0800)/,0
74401300,大型动物都被铁丝网隔离，安全是安全了，但完全没有了野生的味道，和西直门动物园毫无区别，跑那么远去就不划算了,/Date(1595318769000+0800)/,0
264826392,人比较多，动物不如去年多。,/Date(1588338384000+0800)/,0
101736952,八大岭野生动物园挨着八达岭长城是北京著名的动物园，也是最大的动员。,/Date(1506654327000+0800)/,0
90433026,五一期间去的，车多人多，里面的猛兽区动物明显减少，但是更适合带小孩子去了，里面的温顺动物区可以喂食，还不错,/Date(1493637164000+0800)/,4
281822104,设施陈旧，景色一般，挺累,/Date(1606494232000+0800)/,0
9135119,动物不算太多，感觉一般般,/Date(1603592921000+0800)/,0
3234817,还是不错的 可以和大熊互动,/Date(1601976742000+0800)/,0
206736,总体来说没有大兴野生动物园好，动物比较少，笼子车也不能接触到动物，好的一点是有小动物区孩子可以喂食给它们,/Date(1557106575000+0800)/,0
38057522,可能因为上次出事，猛兽区都是被铁栅栏围起来的，老虎，狮子都是无精打采躺在里面，两栖馆10块钱真的很坑，前后十米不到，感兴趣可以去北京动物园两栖动物馆看，比这好百倍。,/Date(1525613183000+0800)/,1
56813076,动物都是之前看过的，仔细看这些动物还是挺有趣的，节假日人不是很多,/Date(1507380254000+0800)/,0
149261653,总体来说不错，不过现在猛兽区都用电网隔离开了，没有想象的感觉了！,/Date(1506915755000+0800)/,0
93513358,在网上订票取票非常方便，可是八达岭野生动物园太差，管理混乱环境差，道路损坏严重不整修，动物少，里面有私人圈养动物额外收门票，不像动物园，很奇怪门票的收入都去哪里了，基本的维护都没有做到,/Date(1491578334000+0800)/,0
35426795,体验一般，没有大兴的好,/Date(1604152972000+0800)/,0
1641355,体验很好，可以带蔬菜。,/Date(1598246014000+0800)/,0
49915010,动物确实太少了，现在的大行动物又都被电网挡在了里面，很没啥意思了！去一次看看就得了，还特别的臭，孩子喂喂小动物还可以点吧！,/Date(1566746023000+0800)/,1
2637604,自驾车的票需要在售票窗口买，还需要买保险。老人可以凭证享受半价优惠，不需要在网上团票。园区还是比较大的，动物们状态也不错，带孩子去还是可以的。,/Date(1496498119000+0800)/,4
64570837,野生动物园管理严格猛兽区安装了电网，温顺区适合孩子亲近小动物.,/Date(1491528705000+0800)/,0
64453213,上午爬了长城，下午来到八达岭野生动物园。我们开车进去的，这样玩得不累。在温顺动物区，孩子玩得很开心，可以给动物喂食。特别是散养的动物，像珍珍鸡，孔雀，小马，可以近距离接触，非常有趣。,/Date(1491189573000+0800)/,0
113077184,里面动物好少，人也少,/Date(1607607319000+0800)/,0
7565480,太单调，运营有问题。,/Date(1601825978000+0800)/,0
245350723,值得推荐，体验很好，,/Date(1599092753000+0800)/,0
119435710,景色不错，有趣好玩，,/Date(1598461757000+0800)/,0
272128772,值得推荐，景色不错，,/Date(1597045338000+0800)/,0
60256677,有趣好玩，景色不错，,/Date(1596985121000+0800)/,0
84119377,体验很好，有趣好玩，,/Date(1595565340000+0800)/,0
8248834,景色一般，可玩性低，,/Date(1592983005000+0800)/,0
11911041,一般般吧，动物比较少,/Date(1592018249000+0800)/,0
90157389, 太破，环境不怎么样,/Date(1591521214000+0800)/,0
192064734,下午去的，猛兽区还不错，结果遇上暴雨，温顺区动物都回家了，总的来说还不错，走路回去也不远，值得去一次,/Date(1564165197000+0800)/,0
77185451,本来要去北京野生动物园的，由于时间原因订了距自己更近一些的八达岭野生动物园，总体体验还不错，可以在车里近距离观看，动物都很悠闲，闲着踱步，猛兽区不能下车的地方，动物也都有栅栏围着，,/Date(1554893785000+0800)/,0
92815247,挺好，动物很亲近，但是以前的动物表演没有了，而且里面没有大狗熊扒车门了，故此减一分。这个地方有点远。,/Date(1529759018000+0800)/,0
149737048,虽然天公不作美，到动物园时下起了雨，不过宝宝还是很开心出来玩,/Date(1507047469000+0800)/,0
109115195,在网上订票取票非常方便，可是八达岭野生动物园太差，管理混乱环境差，道路损坏严重不整修，动物少，里面有私人圈养动物额外收门票，不像动物园，很奇怪门票的收入都去哪里了，基本的维护都没有,/Date(1491577785000+0800)/,0
87313172,这里很不错，有老虎、狮子、狼、黑豹等猛兽，还有很多适合孩子喂养的小动物！节假日期间，孩子很多，很热闹,/Date(1491274618000+0800)/,0
109100770,感觉动物种类好少。老虎被隔离了，感觉没有真实得感觉。希望改进,/Date(1491113947000+0800)/,0
206143113,一般般 不建议特别去,/Date(1610081277000+0800)/,0
2100512,一般吧 ，没有特别的,/Date(1606792509000+0800)/,0
852830,用的京津冀旅游一卡通，自驾车进入每车交60元。前一天刚下过雪，刚好看到雪中的动物们，也别有趣味。不知道是不是因为冬天的缘故，动物不是很多，而且都在电网里，拍照很不方便，如果是单买票的话，觉得不太值。,/Date(1575333166000+0800)/,1
47355586,一个可以开车进去的景区，因为冬天的原因，动物不怎么爱出来。,/Date(1560745516000+0800)/,0
88305243,周一人不算多，动物天热不爱动，可以喂自带的胡萝卜，孩子喜欢,/Date(1502104829000+0800)/,0
85197690,带孩子玩了一天，很充实的一天。园内环境不错，建议开私家车自驾游，走走停停可以休息，玩一整天也不觉得太累。携程订票价格全网最低，而且换票也快。很满意的一次亲子游，与动物的亲密接触。,/Date(1491188535000+0800)/,0
109099565,草食动物园特别好玩。一定要多带胡萝卜和黄瓜。很满意。我们没开车来。全程也没坐车，溜达着玩也特别好。,/Date(1491035841000+0800)/,2
212735284,特别好特别好值得******************************************************特别好值得去,/Date(1573962316000+0800)/,0
6070832,第一次来野生动物园，但可能因为之前的事故，嗯，导致比较凶猛的动物都关在了铁丝网后。但比较坚实的是一些比较温顺的小动物厄，比如梅花鹿呀，马呀，可以与人亲密接触。小朋友都比较喜欢。,/Date(1565097954000+0800)/,0
15697060,真的不如以前，地方大！动物的品种太少了！而且里面收费项目繁多，华而不实！但是来了，就想全看完！俗话说哦的“上当一回”,/Date(1528448921000+0800)/,1
51574880,猛兽区的猛兽已经关在笼子里了，虽缺乏趣味性，但安全隐患小了。各种动物种类不是太多，但基本款都有，适合自驾游的朋友。各区都能喂动物还是挺好玩的，比较适合孩子玩。饲料价格也能接受。,/Date(1497238133000+0800)/,2
94051753,这里是一个周末全家出游的好去处，空气好，动物多种多样，还能自己亲自体验喂养，真是乐趣颇多。在山里空气特别的好，而且下高速就到实在很方便。,/Date(1495499679000+0800)/,2
37076116,感觉不错，自驾游，车开进园里，按照提示游览，观看，可以喂食动物，但是动物种类不如北京动物园多，离长城很近，清明节假期去的，人也不是太多，,/Date(1491386100000+0800)/,0
87013831,一点儿都没劲。所有的动物全都是圈起来的。之前在媒体上看到还挺期待的，结果我和儿子也是都很失望。,/Date(1603689160000+0800)/,0
32049944,这个动物世界建的时间太久了，所以总体上显得有点破旧，而且前几年出过事，所以动物感觉少了，估计就去这一次，以后还是去新一点的动物乐园吧！,/Date(1576225429000+0800)/,0
37922978,不错平日去的没那么多人，正好是阴天不晒，孩子玩的很开心,/Date(1561030303000+0800)/,0
46662972,现在的野生动物园没有以前好了，动物都被圈起来了，不是随意可以走动的了。估计都是先期咬人事件闹得，反正没什么意思了。,/Date(1533810208000+0800)/,1
118289877,没想象中的好，可能是出事之后，都加了电网，野兽区动物们都失去了意义，不太爽，温顺区倒是不错，不过动物不太多，大象太臭了，都不打扫么？有机会还是去北野看看吧，貌似那里改的不错了,/Date(1505052788000+0800)/,0
51164540,八达岭野生动物园动物种类较多，散养区管理规范，值得推荐,/Date(1500810281000+0800)/,0
83222024,好玩 小动物们很可爱 带了很多蔬菜但是被动物们深深嫌弃了 感觉下午晚点儿去猛兽区它们出来的可能性更大,/Date(1491893669000+0800)/,0
109075017,这里有白虎，狮子、狼等野生动物，也有小朋友喜欢的小型动物，节假日期间小朋友很多，值得带孩子来玩,/Date(1491275111000+0800)/,2
46498975,挺有意思!挺大的，夏天来应该更好！,/Date(1490529936000+0800)/,3
616685,北京非常有名的动物园之一，天气好的时候，经常全家人一起来游玩，特别是小孩子，到了这里极其开心。这个的野生动物很多，还可以开车观赏动物。,/Date(1450881829000+0800)/,2
165122660,没有以前好玩了，表演馆也取消了，猛兽们都拦在电网外。,/Date(1519446648000+0800)/,0
3712990,网上订票便宜还快捷，我们选择了坐统一的游览车进行猛兽区游览，在动物那里停留的时间简短，还是自驾游览好，就是私家车车子排队到动物身边也不容易，老虎狮子比较懒散，熊还挺活跃的。,/Date(1504139064000+0800)/,0
3462613,周五去的 人不多 孩子玩得很高兴 这个动物园还是自驾最合适,/Date(1501484633000+0800)/,0
109151289,五一节车真心多，为啥老虎都被电网关起来，狮子可以散养,/Date(1493609303000+0800)/,0
106354439,游玩那天车多人多，不过环境还可以，动物再多点就更好了,/Date(1491441738000+0800)/,0
261543,野生动物园很不错，宝宝很开心，小马抢吃宝宝手里的食物,/Date(1491214525000+0800)/,0
602117,环境不错，也很干净卫生！交通挺便利！开车也很顺！一般出行最好早点出发！价格还可以！此次来，游人少一点，但我觉得带孩子来还可以！小朋友看到动物很兴奋！动物园管理也更加严格了！,/Date(1488070640000+0800)/,0
44239096,周末带着家人自驾游，很不错，交通方便，看到了还多小朋友在图画书上的小动物，很欣喜，值得一游。,/Date(1448159213000+0800)/,0
5515944,现在看来一般，确实很多地方都很破旧，动物也懒洋洋的，没有什么互动娱乐，票价很贵，觉得不值。,/Date(1587873540000+0800)/,0
4056708,去之前以为可以看到很多动物，去了让人感觉非常失望，没有什么猛兽出没，看到的都是温顺的小动物：鹿，马，骆驼，孔雀，珍珠鸡，猴还关在玻璃房里，动物太少了。,/Date(1556942049000+0800)/,1
92333475,近距离观看老虎，和鹿亲密接触。,/Date(1530964474000+0800)/,1
98868369,感觉还不错，就是动物品种数量少些，硬件设施有些旧。,/Date(1499091696000+0800)/,0
75325446,今天去车少人也少 总体来说还算不错 不过感觉动物不太多 ,/Date(1491474400000+0800)/,0
79420269,动物有点少，猛兽区隔离后不如以前了，其他还可以。,/Date(1540475757000+0800)/,0
6041350,自驾很有趣，就是猛兽区全被圈起来了，感觉很遗憾！,/Date(1507470443000+0800)/,0
109127452,非常棒的一次游玩，动物非常可爱，喜欢和人亲近，早晨买了好多菜喂他们吃，下次带孩子一起去。,/Date(1492397629000+0800)/,0
86377767,虽然路途远点，但孩子玩的很开心！工作日去人不多！,/Date(1490795693000+0800)/,0
537547,动物不算多，动物园也不大，包车额外给师傅点费用可以直接开进去，可以近距离喂马体验还不错,/Date(1583053600000+0800)/,0
1305945,坐游览车我就看见三种野生动物，一只老虎，几只黑熊，坐游览车单买的票，这个缆车真心不值，散养区还行，有梅花鹿马孔雀，比较有意思。,/Date(1566725143000+0800)/,0
84704889,原来比现在好，猛兽区加了电网，不能靠近动物了！,/Date(1524387068000+0800)/,0
31012195,冬天萧条，但是有动物孩子们就兴奋，可以带车买票进去，买了胡萝卜和白菜在车上拉着，很不错,/Date(1519699768000+0800)/,0
3005757,第一次去，感觉非常棒，特别没想到的是还可以喂老虎，可能因为之前咬人事件，猛兽区的老虎区，老虎都被电网圈起来了，有点小遗憾，不过如此近距离看见这些猛兽还是很兴奋的。哈哈,/Date(1492941608000+0800)/,0
87142915,挺不错的，就是节假日人有点多，动物没有那么多，总体来说假期带孩子出去玩，是个不错的选择,/Date(1491226173000+0800)/,0
11909211,八达岭现在真的没啥好玩的了，动物老化，气味难闻，东北虎也没看见，带孩子去的，感觉太一般了。回来路上五环堵车3小时，还不如去秦皇岛野生动物园玩。。,/Date(1554274324000+0800)/,1
76565713,携程上团购很合适，早上去9点半到达动物园，验票很方便不用排队，狮子老虎只能远远地观看。全是电网，可能是老虎咬人事件 园区也怕了,/Date(1491829291000+0800)/,0
37886201,挺好的，除了小假期人超多外，期待人少时，重游,/Date(1491464767000+0800)/,0
79324378,猛兽都圈在电网围成很小的区域内，太遗憾了，感觉就是个没那么挤的常规动物园体验不佳，,/Date(1602495194000+0800)/,0
