57412240,儿童超过90厘米需要买票，小孩子进去看热闹，影视明星，体育明星，歌星她们都不知道。,/Date(1675722709000+0800)/,1
294769015,北方唯一一座杜莎夫人蜡像馆，值得我们去看一次。,/Date(1676935534000+0800)/,0
186893708,在步行街上，出地铁一会到，挺不错，孩子自费69做了ar体验，票价太贵了，两孩子两大人花了五百多,/Date(1674563149000+0800)/,0
386243323,本来只是和来北京出差的朋友一起逛逛前门，走着走着发现杜莎夫人蜡像馆原来在这，很多年前就想来看，结果今天就走到这了，来都来了，必须要进去看看了,/Date(1672627945000+0800)/,1
65498569,北京前门步行街上的一座蜡像馆。,/Date(1679985152000+0800)/,0
8239763,人物惟妙惟肖，很有趣,/Date(1674901821000+0800)/,0
256301258,非常好的游览体验，住在附近开门就去，没人随便拍照，印章打卡，赞赞赞！！！,/Date(1676695295000+0800)/,1
432085406,蜡像做的非常逼真，有几个不是特别像本人，其他都很像！现在去基本没有什么游客，我好像包场了，服务很周到！体验感受很好！满意！以后有机会要带我女儿来看看！,/Date(1666707768000+0800)/,0
54201949,不错 没去过的可以看看,/Date(1675604809000+0800)/,0
16627266,蜡像种类多，比例逼真，值得一看,/Date(1667281913000+0800)/,0
7439183,"不错啊。好棒啊。
推介 啊。 
哈哈哈哈哈哈
真的不错哦哦哦哦
特别棒的。
哈哈哈姐姐啊
人不多
特别好玩。哈哈哈姐姐啊哈哈",/Date(1667716989000+0800)/,0
477456,北京杜莎夫人蜡像馆在北京前门大街，和很多景点在一块，蜡像馆里的国内影视、体育、演艺明星挺多的，不过么蜡像逼真度还是有差异的，观光逛逛性价比还行吧。,/Date(1663473191000+0800)/,0
394601572,还行吧，多是娱乐明星，希望增加一些科学领域的人物。,/Date(1676691932000+0800)/,2
14484704,"【景色】
【趣味】
【性价比】👍",/Date(1662647588000+0800)/,0
49862772,我们是从国家博物馆直接走去杜莎夫人蜡像馆的，杜莎夫人蜡像馆就在前门大街里面，走进去一会就到了，里面蜡像涉及范围很广，但是感觉蜡像有点少呀，逛了一会就逛完了不过其实还好，因为有好多喜欢的，嘿嘿,/Date(1453822090000+0800)/,65
188206708,北京杜莎夫人蜡像馆，是年轻人打卡必去之地，可以摆各种造型，有各囯家的领导人，奥巴马，默克尔，还有名演员，成龙，周冬雨，，李冰冰，有体育健将，姚明，有网络大伽，李彦宏。京剧名角，梅兰芳！！,/Date(1618843236000+0800)/,1
7275544,里面三层，分不同主题内容，带着家人一起来这里玩，拍拍照，和自己喜欢的人物合影！蜡像很逼真！赞👍其中二层还有一个卡丁车环节，非常不错，妈妈快70岁首次接触，玩后很高兴，工作人员Super王很心细、耐心的给老人讲解、介绍怎么操作，很好的体验！,/Date(1623934566000+0800)/,4
77543026,整体来说不错，网上订票，便宜又方便蜡像比较逼真，从楼上开始，个人觉得开始看的卷福，英国女皇，琅琊榜，威廉凯特都很逼真，但是往后有一点虎头蛇尾，像姚晨孙俪邓超什么的没有刚开始的蜡像做的好。整体参观了大约半小时左右,/Date(1487767206000+0800)/,32
162165340,蜡像很逼真，带小朋友去见识见识,/Date(1673128284000+0800)/,0
68072183,人比较多，但是提前买好票还是比较方便，工作人员的服务态度也不错，热情周到。见到了喜欢的明星蜡像，比较丰富，分类也清晰，参观起来很方便,/Date(1477729889000+0800)/,52
11641359,半价85一个人，很合算，总体来说还可以，外国明星做的像，中国的都差点，都不是特别像，环境挺好的，还有道具供拍照使用，奥巴马有那个电话拿起来还说话吓我一跳！还有想知道明星的真实身高就去蜡像馆吧，百分百真人蜡像1：1……哈哈，通过对比黄教主在175左右！！！,/Date(1475055688000+0800)/,83
2524451,就在前门大街，地铁很方便，疫情期间人不多，方便拍照，门口有游览指引的小册子，按行进标识就很方便了，大多蜡像还是很逼真的，除了蜡像馆前门现在规划的不错，值得四处转转。,/Date(1646751146000+0800)/,0
298823037,据说是中国四大杜莎夫人蜡像馆，在前门大街附近，有政治人物，体坛明星，说相声的各种人物。有的很逼真，全价票还是比较贵。我是用京津冀一卡通来的。整体感觉还是很不错的。,/Date(1627561043000+0800)/,2
162165340,还行吧，没看过蜡像馆，所以去看一下，觉得还行吧！但是小朋友还收费有点儿过了！而且收费不便宜呢！里面的人物有点儿少，不是太多！,/Date(1660391968000+0800)/,1
2991166,北京杜莎夫人蜡像馆位于坐拥悠久的前门大街，北京最繁华的商区之一。蜡像馆内面积不是很大，蜡像逼真，游客可以拍照，但是很有意思。,/Date(1655433828000+0800)/,3
272657461,很值得去的值得地方，里面有很多明星的蜡像，可以随便合影拍照，有的还有对应的服装，自己穿上拍照，平常接触不到真明星，和蜡像拍个照也是可以的。性价比高，总体超赞，有趣好玩，景色不错，,/Date(1624093735000+0800)/,0
111098890,里面太好玩了 做手蜡的闫研小姐姐特别有耐心 还比较细致 做到了满意的手腊 小朋友特别高兴！ 还会再来的！,/Date(1660301506000+0800)/,0
21256510,作为追星族，还是值得去的，明星很多。而且，里面还有互动游戏的，我特别喜欢跟张艺兴的互动，很有意思的哦！明星很多哈！小孩也很喜欢，有她最喜欢的花花。期待送一张花花的签名照给我哈,/Date(1633686350000+0800)/,0
206008873,还是很不错的，比较逼真的蜡像,/Date(1658023265000+0800)/,1
191625167,我去的时候，人不多，随便照，不用担心会有闲杂人入镜，谈不上娱乐，只是去欣赏，馆里的工作人员超nice ，因为我是一个人去的，工作人员很热心的帮我拍照，在这里表示感谢,/Date(1659058490000+0800)/,0
26134886,北京杜莎夫人蜡像馆位于前门大街，北京最繁华的商区之一。蜡像馆内面积不是很大，但是很有意思。去过很多地方的杜莎夫人蜡像馆，北京的还是很特别。,/Date(1639893563000+0800)/,1
250397235,很不错哦，是个近距离接触明星们的机会，至少可以看个立体的，虽然是假人，但还是会惊叹，哇，他居然这么瘦，哇，她居然这么高，也挺好玩的,/Date(1627752135000+0800)/,0
100858191,挺好有意思的，孩子有点害怕，但不影响游览下去的兴趣，还有很多服装可以配合拍照，就是差一点就走错了，指示有些欠缺，总是值得一游！,/Date(1627250437000+0800)/,0
29978042,进门看到郭德纲蜡像，嘿！真像.看了半天感叹这手艺可真赞，亲眼所见没想到蜡像会做的这么像，感觉怪怪的🤨，有机会去上海的看看,/Date(1619876230000+0800)/,0
191743376,"蜡像馆是由蜡制雕塑家杜莎夫人建立的，杜莎夫人蜡像馆是全世界水平最高的蜡像馆之一，有众多世界名人的蜡像，其中恐怖屋最为出名。

全球旅游景点运营商默林娱乐集团宣布与中国领先的商业地产开发商SOHO中国缔结一项重要战略伙伴关系，双方将把默林集团众多标志性的国际品牌引入北京，并以定于2014年开幕的北京杜莎夫人蜡像馆为首个引入的品牌。",/Date(1644055709000+0800)/,0
2477797,"Madame Tussauds is in charge of many places, and the characters inside are vivid. Although it is said to be debut, there are still many gods. Is a good place, after all, is also a place for.",/Date(1610263986000+0800)/,2
89895834,还不错 华晨宇在弄胖点就更好了,/Date(1625437334000+0800)/,2
314979210,不错，值得一看，推荐，点赞！水平比较高，很像，有点意思，顶上。,/Date(1627728474000+0800)/,0
273011261,带孩子去的，有的还是很逼真的，不错,/Date(1625874111000+0800)/,1
283660305,里面有好多我喜欢的明星，像成龙，黄家驹，杨幂，梅西等，里面的服务员也很热情，我是一个人去的里面服务员还一路帮助我拍照，下次还会去的,/Date(1646753288000+0800)/,0
252468369,不错挺好玩的666666,/Date(1631004978000+0800)/,1
156318593,为了看二哥王力宏，只有北京站才有，成功打卡。,/Date(1619314608000+0800)/,0
45611922,很好，非常好，提前预订还是非常方便的，景区各项设施非常完善，玩的非常开心呢，工作人员很热情，是个很好的体验，下次还再来！,/Date(1659832073000+0800)/,0
1117346,疫情期间，这里管理严格，游客比较少了。,/Date(1646529419000+0800)/,0
733888,很漂亮的地方，蜡像特别逼真，值得一去,/Date(1654937763000+0800)/,0
1117346,现在这里实行流量控制，游客比较少了。,/Date(1651302794000+0800)/,0
46302037,蜡像很逼真，是拍照打卡的好地方。,/Date(1660968078000+0800)/,0
284635873,非常不错👍👍👍👍值得期待,/Date(1650767117000+0800)/,0
46302037,很有意思的地方，好多名人的蜡像，拍照的好地方，可以进距离的观看，和自己喜欢的明星照相很有意思的，感觉没有上海的杜莎夫人蜡像馆大，也是值得一看的。,/Date(1630438503000+0800)/,0
19641466,杜莎夫人蜡像馆在北京，上海都有，杜莎夫人于1835年在伦敦建立了第一家杜莎夫人蜡像馆，杜莎夫人制作做蜡像的工艺非常精湛，很值得去看看。,/Date(1641548474000+0800)/,0
252415738,有趣好玩，总体超赞，性价比高，景色不错，,/Date(1620122346000+0800)/,0
272877586,"蜡像馆不大。真的感叹蜡像制作者的技艺之高深，连表情都能拿捏得惟妙惟肖。
蜡像的摆设的设计和编排感觉不是那么的好，也许是场馆太小的缘故。蜡像人物的选择上也觉得有些不尽人意的地方，娱乐圈的色彩过于隆重。",/Date(1627365526000+0800)/,0
190127654,很好，腊像很多，很真实，拍了好多像！,/Date(1620108309000+0800)/,0
39157437,孩子主要是来看关晓彤的，满意。,/Date(1627452680000+0800)/,0
178153517,疫情期间不方便随时去香港的话，可以在北京找到杜莎夫人蜡像馆看看。这里的蜡像做得很逼真，很适合慢慢拍照哦。,/Date(1644716994000+0800)/,0
197152373,周一进到里边就我一个人，感觉有点特别啊，哈哈哈，好多蜡像盯着的感觉，可惜没有高以翔。,/Date(1620661048000+0800)/,1
252356668,非常棒，蜡像做得很逼真，晚上带孩子去的，人少随便合影，体验非常好，孩子还可以体验F1赛车VR，很开心，强烈推荐大家去！！,/Date(1633740715000+0800)/,0
105034118,上周日带孩子去的杜莎夫人蜡像馆，很早就听说过，这次特意带孩子来玩玩，场馆还挺大的，蜡像差不多有70多位，在三层有做蜡手的地方，给孩子做了一个，白雪小姐姐特别有耐心，一边做一边给我们讲解蜡手的制作过程，服务很热情，点赞👍，全程玩下来差不多有2个小时，闺女玩的很尽兴，有机会的话会介绍给朋友过来玩,/Date(1606744695000+0800)/,0
175052693,杜莎夫人蜡像馆是法国一位杰出的艺术家，以制作蜡像而闻名，蜡像馆是由蜡制雕塑家杜莎夫人于1835年在伦敦贝克街建立，展示唯妙唯俏的名人蜡像使游人有机会与心目中的英雄零距离互动。,/Date(1612525909000+0800)/,1
185437092,特别好，蜡像做得太逼真了，震撼！,/Date(1659613080000+0800)/,0
6508139,北京杜莎夫人蜡像馆，蜡像馆当中有很多名人的蜡像，真的可以以假乱真来称谓。,/Date(1629551870000+0800)/,0
163949107,在前门大街内，里面不算大，但是环境比较幽静，人也不多，可以静静地在里面呆上半天，里面有很多的椅子供休息，比较人性化，蜡像比较逼真，里面有个做手膜的，比较有意思，推荐大家体验,/Date(1600094927000+0800)/,1
162165340,第一次去看蜡像，以前没去的时候去心心念念，现在真看到了，觉得还是很精致的！各种人物的表情，动作，神态都很到位！,/Date(1671086428000+0800)/,0
27698867,进去出来5分钟。收费太高,/Date(1677136759000+0800)/,0
27228310,非常值得一去啊，孩子们很喜欢，正好在步行街，可以一起逛逛,/Date(1626074433000+0800)/,0
87595545,挺好的。很逼真。门口的保安很有意思。,/Date(1625670412000+0800)/,1
50664375,名人像想看的还是很逼真的。可以合照，一个个很有意思。,/Date(1620888195000+0800)/,0
230220356,"最喜欢白敬亭，围着小白拍拍拍，都不想离开…………………………
……………………………………………………………………………………………………………………………………………………",/Date(1602165137000+0800)/,0
28427292,话说，看着还是有点瘆得慌的。。,/Date(1626737047000+0800)/,1
493029,名人像看着还是很逼真的。可以合照诶，很有意思。,/Date(1620888194000+0800)/,0
9029435,清水出芙蓉，天然去雕饰皎皎兮似轻云之蔽月，飘飘兮若回风之流雪你有点像天上的月亮，也像那闪烁的星星，可惜我不是诗人，否则，当写一万首诗来形容你的样貌你有点像天上的月亮，也像那闪烁的星星，可惜我不是诗人，否则，当写一万首诗来形容你的样貌你有点像天上的月亮，也像那闪烁的星星，可惜我不是诗人，否则，当写一万首诗来形容你的样貌你有点像天上的月亮，也像那闪烁的星星，可惜我不是诗人，否则，当写一万首诗来形容你的样貌你有点像天上的月亮，也像那闪烁的星星，可惜我不是诗人，否则，当写一万首诗来形容你的样貌你有点像天上的月亮，也像那闪烁的星星，可惜我不是诗人，否则，当写一万首诗来形容你的样貌,/Date(1621813931000+0800)/,0
251576481,携程上买便宜，但是总体性比价一般，个人觉得比较贵，里面有灯芯哈，很惊艳，跟真人一样，惟妙惟肖，家里老人喜欢照相，觉得很值,/Date(1618892489000+0800)/,0
34706777,头一次去蜡像馆，也不知道能看什么。去了才发现，人还不少，多数都是年轻人，还有不少带孩子一起来的游客。蜡像也是各行各业中外都有。政治家，知名企业家，大多数都是演艺明星。进来的游客都是冲着和蜡人照相来的。每个蜡像旁边都有小道具专门提供给游客，用于和蜡像合影造气氛。有些知名的明星蜡像旁边，排队照相的人更多，比如奥巴马、鹿晗，都设计了专门的场景，工作人员给游客拍照后，在出口处，可以交钱取照片。,/Date(1502732121000+0800)/,29
94847193,"是一个人去的，很早就想来了，一直没时间
门票有三个档次，其实应该是一样的，我买的是豪华因为学生证150元，可以免费做手蜡不过底座需要10元或20元，还有另外的选择拍照，10点开门买票，很快就逛完了，不过有点失落没有看到鹿晗，不过有莱奥纳多，总体还是挺好的",/Date(1498631359000+0800)/,18
169800002,比想象的小，但是家人还是感觉很开心，与明星近距离接触，有点儿意思，有机会我也去,/Date(1659256857000+0800)/,0
733888,漂亮，蜡像像真的一样，特别适合拍照,/Date(1614831785000+0800)/,0
201979593,北京杜莎夫人蜡像馆是值得一去的。,/Date(1644594239000+0800)/,0
75329313,【景色】很多名人蜡像，可以看看,/Date(1644766533000+0800)/,0
212285577,北京杜莎夫人蜡像馆非常的漂亮。,/Date(1643471627000+0800)/,0
205074108,点个赞再说吧，还是很不错的地方,/Date(1638584119000+0800)/,0
40316223,很值得，居然有本尼！！！热播的白浅也在！！！在里面的时间过得很快！值得真的值得，可惜的就是网络票没有手册。位置很好找，工作人员很耐心，想到其他零点一提网络购票就嫌弃的眼神……真心寒。十分推荐,/Date(1491048400000+0800)/,29
272372852,如果有喜欢的可以去，如果徘徊在想去和不想去的……建议网上看看图就行,/Date(1653118481000+0800)/,0
290362838,今天和姐们儿去杜莎玩，晚上的时候有特惠票，因怕特惠的票价有所区别所以问了一句，前台的姑娘白雪很细致为我们介绍了一下票价，并告诉我们没有区别很放心的买了两张联票，并告诉我们另一个馆的位置，服务很好，玩的也很开心！,/Date(1606746071000+0800)/,3
114456064,这次逛杜莎夫人蜡像馆的感受很好 ，尤其是见到了我们艺兴，真的好真实，感觉就像是见到了真人一样，非常激动\(≧▽≦)/哦，其他的大咖也很像，感觉就是开了一个大趴体似的，以后还会来的哦。,/Date(1506927406000+0800)/,14
49159640,一个小时就游览完了，票价有些贵了，就在前门大街上，顺便去还凑合，专门去用不着。,/Date(1626497317000+0800)/,1
55048544,挺好玩的   和真人大小一样 怀着对明星身高的好奇心去玩了一圈,/Date(1641688639000+0800)/,0
316713559,挺值得一去的，特别大，里面好多明星都非常逼真，很不错。,/Date(1633079966000+0800)/,0
41030940,蜡像不够多，但是很值得来.林丹做的不像，其他还可以.老舍做得好，还有鹿晗，黄晓明，去过上海的地方，蜡像比这里多，今天没有见着范冰冰，不知道为啥？总的来说还是很喜欢的地方。,/Date(1471938173000+0800)/,18
304939166,挺好的，人也很少，有一种特别真实的红毯感觉,/Date(1616569210000+0800)/,0
167036616,总体超赞，有趣好玩，,/Date(1617532519000+0800)/,1
13996154,因为没去过香港的杜莎夫人，所以知道北京杜莎夫人开馆了，就迫不及待。14年的门票大概是170，我和小弟两个人去的。小弟刚高考完，凭学生证是半价。里面好像是3层，地方不是很大。一般连拍照在逛，3个小时最多。我拍了不少照片。感觉还行。如果没去过值得去看看。,/Date(1463816160000+0800)/,24
17553133,杜莎夫人蜡像共有三层，相比上海的国内明星不是很多，但是每个都拍完照逛完时也累的不行了，像是甄嬛，周杰伦做的很不像，国外的明星做的比国内像，还有我最爱的卷福。每个蜡像都可以随便拍照，唯独奥巴马不行，奥巴马旁边有工作人员，他给我们说免费拍照，我们就拍了几张，然后给我们一个小票告诉我们去二楼取照片，我们去取照片时又告知我们七十一张，我觉得既然要钱的话给我们说免费拍照不就是个幌子吗？,/Date(1445910658000+0800)/,46
176433801,第一次逛蜡像馆，人物都很逼真，很新鲜很有趣，圆了和众多名人的合影，感觉很好！,/Date(1621221152000+0800)/,0
40766083,蜡像数量不少，看上去挺逼真，大部分蜡像还有专属的背景音乐，地方不是太大，慢慢逛一小时也足够了，另外，约翰尼德普有介绍，有照片，但是没找到蜡像，不知为何,/Date(1617360432000+0800)/,0
251138836,总体超赞，最近人好少啊，感觉被我们两个人包场了，最后的工作人员超坏站那一动不动，我还以为是假的，结果突然活过来说了句你好，，，，，吓死我了！性价比高，景色不错，有趣好玩，,/Date(1604410411000+0800)/,1
87608671,学生票还是比较合适的，好开心的样子～虽然是自己一个人去的但还是感觉非常棒，内部蜡像很多，去的时候人不多，不需要排队，灯光景色非常好ヽ(⌐■㉨■)ノ♪♬,/Date(1516625001000+0800)/,12
274033823,有趣好玩，非常好玩，里面明星还挺多的，可以和喜欢的明星拍照！很出片！,/Date(1619958371000+0800)/,0
4462705,有趣好玩，但是交通并不便利，开车需要停很远，下车后交通指示基本没有,/Date(1620023447000+0800)/,0
47521099,玩了一个小时。特别棒。有几个不太想。赵本山最像！哈哈。特别开心。性价比也比较高。地方好找。就是没有返程，到三楼以后想回二楼看看，也去不了。东西落在了二楼。服务特别好。帮我们找了回来。开心,/Date(1449754850000+0800)/,19
15163161,除了规模小了点，其他挺好,/Date(1657110956000+0800)/,0
233371413,北京杜莎夫人蜡像馆真的不错，蜡像制作逼真，场馆很大。工作人员MAX全程陪同孩子讲解和拍照，服务特别周到。,/Date(1595995869000+0800)/,2
96993838,有很多明星，我妈说这么没有刘德华，其实没有，国外的明星普遍逼真一些，中国的部分逼真，赵丽颖的脸好小哦，不知道是不是测的她最瘦的时候，郭德纲太矮了,/Date(1497278453000+0800)/,20
185697026,从携程上预定的票，非常棒棒哒蜡像馆，适合拍照，值得推荐给大家！,/Date(1628829640000+0800)/,0
204288154,"贵，值，人不多，有序！
值得推荐，
有趣好玩，
体验很好，
好多内容值得一去！不后悔。
地下一层到地上三层，可看的内容非常多，体验感强👍，小孩很高兴！",/Date(1602631613000+0800)/,0
1835310,北京杜莎夫人蜡像馆，位于北京前门大街。里面各种当红明星，有的做的非常好，很逼真，有的做的简直弱爆了，怎么看都不像，比如周董的。毕竟票价这么贵，慢慢逛慢慢拍照，别着急，玩透了再出来。那会科比还在，留个纪念吧。,/Date(1584200723000+0800)/,3
209621344,买的联票、总体感觉少了一些震撼的效果，觉得蜡像也不是很多，和大城小象买的联票、感觉要比蜡像馆震撼人心、但是整条街还是可以逛一逛，能体现老北京的韵味、饿了的话千万不要去庆丰包子家吃饭，不好吃，包子还只有套餐、人多没办法点包子、其他的饭主要是不好吃、因为在整条街就吃了这一家、所以不知道哪家饭店的饭好吃。,/Date(1549618480000+0800)/,7
188206708,北京杜莎夫人蜡像馆，就在北京前卫步行街上。规模比我想像的小。但是人像很传神。,/Date(1603032704000+0800)/,1
85358411,很好的拍照地方，本来以为可能不会那么大，明星也不会太多，可是去了真心很好啊，里面可看的挺多的，外面还有甜馨儿去看的时候的视频，很好很好携程上买票也特别划算，关键是很不错很逼真呀,/Date(1507365094000+0800)/,15
232483073,持准考证享优惠，被惊喜到了👍,/Date(1624151674000+0800)/,1
101790474,首先位置特别好找。其次工作人员服务态度很好。很有礼貌。然后里面的各个蜡像都很逼真。还有互动区。各行各业的佼佼者都在里面。很值得一去,/Date(1505472950000+0800)/,30
13921119,非常值得去。可以与偶像近距离接触，还有互动项目。,/Date(1626015185000+0800)/,0
39981107,里面的人物造型特别好看，值得一去，人物也很多，环境特别好，人物形象特别逼真，还有很好玩的游戏，生动有趣，等有赵丽颖了，我还要来！,/Date(1492261901000+0800)/,12
19554217,面积很大，三层，分几个板块，好东西大部分做的很好，个别觉得不是很像，也许是我没见过真人，和媒体照片有点差别，很喜欢这里，票价小贵,/Date(1486056601000+0800)/,22
226302992,携程定的两张票，相比店内买便宜很多，蜡像馆拍照还是挺有意思的，总的三层楼，蜡像数量也不少，整体上还是不错的，主要是女朋友喜欢，,/Date(1620315620000+0800)/,0
80931034,很好玩，分几个主题，人物一比一很形象，值得一看。在大栅栏步行街里，参观完还可以逛逛。,/Date(1601913311000+0800)/,0
218591485,非常好玩 孩子玩的很开心,/Date(1626396048000+0800)/,1
116961042,门票着实的不便宜，不过里面还是挺有特色的。,/Date(1622809203000+0800)/,0
51657386,很炫酷的地方，可以近距离看到“明星”！哈哈哈，有些特别像，有些不是很像，不过很有趣，有兴趣的小伙伴儿可以去看下，特别逗趣！,/Date(1501432465000+0800)/,24
26770588,地方不是很大，里面有普京，奥巴马，成龙，张艺谋，冯小刚，郭德纲，黄晓明，甄子丹，周杰伦，杰克逊，科比，梅西，姚明，赫本等。,/Date(1449383954000+0800)/,12
98247232,这是我第二次去杜莎夫人蜡像馆，第一次去的是上海的，感觉比上海的杜莎小了很多，所以趣味性也就少了很多，整体上感觉一般般吧。,/Date(1633824869000+0800)/,0
173078863,昨天带孩子去了杜莎，里面设备设施都很好孩子玩的很开心都快玩疯了不愿意出来，在三层蜡手台还制作了蜡手孩子的手膜，服务员白雪很贴心一直指导孩子，让孩子放松，很有耐心！做出来的成果很漂亮，孩子特别喜欢，还询问了中国的明星是在这里制作的么，白雪小姑娘说都是在国外做好后运送的所在的场馆，这才知道原来制作蜡像成本这么费，也难怪人家的门票贵点了！,/Date(1606745314000+0800)/,0
