53109226,"记录一下北京杜莎夫人蜡像馆
看着展览，真的为你骄傲。
2012-2109年满满的兴意。
写下对你的心里话，我心中的实力音乐人张艺兴。
只要你好好的，开开心心的，平安健康。
兴迷对你的祝福都是对你的爱。
对了我和姐妹一起跳了解忧嘚瑟
would you be my honey？
我们陪你一起驶向大航海时代。",/Date(1565001972000+0800)/,15
968726,八错八错八错八错八错八错八错八错八错吧,/Date(1640181573000+0800)/,0
201979593,这里的蜡像做的特别精致，跟真人一样。,/Date(1635505174000+0800)/,0
116961042,做的都很逼真，就是门票稍微有点贵了，,/Date(1618995687000+0800)/,0
80931034,很好玩，人物一比一很形象，值得一看，在前门步行街里，出来后还可以逛逛步行街。,/Date(1601913636000+0800)/,0
212285577,这里的蜡像和真人一模一样，很精致。,/Date(1635498941000+0800)/,0
266004510,还是不错的地方，点个赞再说吧……,/Date(1639356312000+0800)/,0
204910300,和奥巴马先生交谈的很开心🤣🤣,/Date(1630144765000+0800)/,0
67652172,为了艺兴去的，非常的有趣，门口有很多艺兴的宣传，制作了艺兴同款手膜，有点烫姿势不太标准【笑】，张大佬真的很帅很白，一辈子不脱饭，1007张艺兴生日快乐。,/Date(1507361034000+0800)/,25
230195368,很好 之前觉得贵 这次用的携程的卡,/Date(1627109413000+0800)/,0
209123313,有趣好玩，总体超赞，性价比高，,/Date(1621697534000+0800)/,0
88182587,体验很好，值得推荐，有趣好玩，,/Date(1601558307000+0800)/,2
85343624,清明节来这儿的人超级多，排队取票花了半小时，还是建议平时的时候来。只有三个楼层有蜡像，逛了一个小时左右也就出来了，蜡像数目有点少。没来过的可以看看，有蜡像制作过程的介绍。,/Date(1491204213000+0800)/,7
8384685,服务很赞，但蜡像分布不均，地下一层和三层的蜡像还有各种场景搭配，第二层的蜡像就没有了，而且第二层的蜡像太多了，几乎不到2米就有一个蜡像放在那里，小朋友太多的话，容易在打闹时撞到，望改进~~,/Date(1494384526000+0800)/,6
158424391,不错，刚进去孩子有些怕怕,/Date(1631247149000+0800)/,0
2270259,挺好的！孩子们玩的很开心,/Date(1617615935000+0800)/,0
57823217,没有想象中惊讶，因为一致很期待，杜莎夫人蜡像馆在前门大街里，很好找，虽然蜡像人数少，但是制作的很逼真，外国蜡像居多。门票有些贵，网上套票也就便宜几十块钱。逛完蜡像馆倒是还能逛逛前门大街,/Date(1493907247000+0800)/,15
53944676,拍照打卡点，场地不大。,/Date(1627701645000+0800)/,0
109935272,总体来说还是挺不错的。,/Date(1625471758000+0800)/,0
308578672,可能是第二次来的原因，没有了第一次的惊喜，就是想带孩子再去做个蜡手，交了两百多的门票，蜡手是单独收费的,/Date(1616238377000+0800)/,0
44801192,非常好，人少，体验好,/Date(1636355633000+0800)/,0
24263664,还可以吧，带孩子一起,/Date(1631775872000+0800)/,0
241354295,不错，人物多，值得去,/Date(1623808500000+0800)/,0
328617113,有趣好玩，总体超赞，,/Date(1622630962000+0800)/,0
120209086,有趣好玩，总体超赞，,/Date(1620198800000+0800)/,0
92827976,非常非常非常非常不错,/Date(1618734490000+0800)/,0
204833748,"今天上午十点逛的故宫和恭王府，差不多到下午三点转完，顶着大太阳挺不容易的。😑😑本来是想回住的地方，但太早了车费贵不舍得😂😂所以到杜莎夫人蜡像馆逛了逛。原本就是奔着蜡像馆去的，谁知道喝不起奶茶的我根本不晓得蜡像馆就在北京坊里边。
【趣味】",/Date(1599021505000+0800)/,1
167482531,终于看到了心心念念的艺兴，特别赞，有工作人员帮忙拍照，有艺兴的新专辑namanana的mv特别喜欢特别酷，还有和艺兴互动的大屏幕，我还录像了嘿嘿嘿，和艺兴本人还是蛮像的，就是感觉他眉毛好浅，可以加深一下哈哈哈哈哈哈,/Date(1554099345000+0800)/,7
281728015,就在前门大街上，内容不多，半小时就逛完了，最后门卫有惊喜～,/Date(1619010329000+0800)/,0
188206708,蜡像馆，位于前门大街，名人，名演员，国家领导人都是顶顶的,/Date(1611063922000+0800)/,0
111126883,位置是在前门大街 因为五一期间人比较多，所以走马观花的看了一遍，也是慕名而来，总体感觉还可以 ,/Date(1620400775000+0800)/,0
84509995,趁着今天艺兴生日，去蜡像馆看了艺兴~和本人好像啊！！好帅！！去的比较早，人不是很多，很适合拍照啊~ 大表姐的蜡像也好棒！气场两米八~作为国庆游玩的最后一站还是挺有意思的！,/Date(1507382214000+0800)/,15
3000366,今天来到蜡像馆游玩感觉国内的明星做的差点，国外的较像，到三层有个服务员mya热情的回答了我们问题，出门口的“蜡像”可真是逗死了[呲牙]整体游玩不错,/Date(1606557938000+0800)/,1
312405770,北京和上海都有杜莎夫人蜡像馆，两家的票价基本一样，但上海的馆比北京的馆几乎大一倍。,/Date(1622874075000+0800)/,0
87150948,明星的蜡像都很逼真！！我和几个小伙伴玩的也特别开心！！而且还有三生三世十里桃花的姑姑简直是太美了！这一百多花的还真值！！希望以后有更多的中国人入驻杜莎夫人蜡像馆！,/Date(1491142481000+0800)/,6
30835471,位置位于前门步行街是个繁华的商业街非常的有北京特色位置很好找，蜡像特别多制作非常的精美网上购票和门店购票都非常方便，可以现场制作手模也设置了很多互动的拍照区，也会有专门的工作人员给拍照，去看蜡像是奔着来京旅游的张杰二号来的，非常感谢杜莎夫人蜡像馆不用再让我千里迢迢的去重庆了，悄悄告诉你们套票非常划算！,/Date(1560770553000+0800)/,8
40179617,前几日来到杜莎夫人蜡像馆，看到了自己喜欢的明星，服务员孟薛 特别的热情帮忙拍照！让我们游玩的很开心,/Date(1606736108000+0800)/,1
44631082,到北京出差，带家人一起游览了下，非常不错的一个地方！慢悠悠的玩了半天，推荐！,/Date(1589373008000+0800)/,0
55932589,朋友推荐去蜡像馆参观，果然蜡像做的栩栩如生。看到可以做蜡手很新鲜便做了一个，和做蜡手姓孟的女孩很投缘，制作的也很专业，好评！下次会带朋友一起参观。~~,/Date(1606665871000+0800)/,0
74204551,杜莎夫人蜡像馆一直是一个很热门的景点，但是大陆的门店人物太少，政治人物一个都看不到，有点不过瘾，如果要拍带劲的照片，还是需要到境外,/Date(1577267923000+0800)/,3
64764191,杜莎夫人蜡像馆真的很棒，尚雯婕，鹿晗，周杰伦，邓超，成龙，黄晓明，杨幂等明星。奥巴马，杨利伟，贝克汉姆的等伟人，总统，球星，公主王子等，就是价格略贵。,/Date(1471342470000+0800)/,25
81334174,孩子一直想来参观，这次趁着孩子放假，终于圆了这个梦！从外面看门面不大，进去以后真是内有乾坤，每个蜡像做的都是栩栩如生，来了一次和众多明星的近距离接触，拿起相机全程拍照留念。但是作为一个展览馆式的景点，门票价格确实有点小贵了。,/Date(1556841948000+0800)/,3
35968810,3月8日，我单位组织全体女职工赴北京杜莎夫人蜡像馆参观。通过对蜡像馆内中国精神、领袖魅力、音乐精灵、体育巨星等8个主题展区的参观，使全体女职工跨越时间界限，真切感受各个时期名人所处的时代、事件，体验东西方传统文化与现代艺术的碰撞与交融，是一次激动人心的奇异旅程，我们女职工在那里度过了一个快乐，温馨的节日。第一次零距离接触历史名人们，明星们，大家都争相与他们合影留念，感觉非常棒！蜡像馆十点准时开门，在携程上订票要比现场便宜20元，地点就在前门大街独一处北面一点，非常好找，交通方便，参观时间大概一个半小时左右，快点不到一个小时也可结束，我已经推荐给我的朋友们了！,/Date(1520578591000+0800)/,3
206637207,陪弟弟妹妹一起去玩，北京的杜莎不算大，人很多，所以会有点挤，建议在人少的时候去玩。   票价比较贵，希望可以为学生改善一点,/Date(1593342777000+0800)/,1
159234211,挺值得去的，尤其是一些喜欢一股名人的朋友，️️能有机会和个照，但本来以为有三尊Michael像的，多少还是有点小失落，但总体来讲还是好的,/Date(1515665971000+0800)/,6
225845387,带孩子比较合适，馆小如果不拍照半个小时都不用就出来了,/Date(1602076255000+0800)/,2
41014710,还不错，各种大咖啥的，都挺逼真的，就是价格贵了些。,/Date(1615866058000+0800)/,0
226290424,不错，很多很像的，感觉挺喜欢，和上海的差不多，倒是学生证可以优惠不少，大学生们可以冲一冲的,/Date(1593624670000+0800)/,0
84675876,在前门步行街上。周一人很少，街上安静；周围极少的铺子开了门，才能避寒。馆内有点吵，一段一段配合着蜡像主题的音乐没完，喜静的人慎选。,/Date(1515406118000+0800)/,18
188206708,北京杜莎夫人蜡像馆，能找准每一个人传神的地方，放大。起到了传神的目的值得推荐，体验很好，,/Date(1603033689000+0800)/,0
107569994,闲来无事和姐们吃完饭，蜡像馆溜达了一圈，还挺好玩的，服务员姐姐服务的非常周到，开心🥳,/Date(1606664807000+0800)/,0
281509235,不错，唯一遗憾的是周董出去巡展了，没看到😄,/Date(1601739469000+0800)/,0
17325618,前两天来北京旅游 特意去的前门的蜡像馆 。做拉手的小姐姐白雪真的好有耐心。做得好漂亮。,/Date(1606744413000+0800)/,0
344895933,套票性价比很高，景区互动***味性都很不错,/Date(1643193864000+0800)/,0
968726,北京杜莎夫人蜡像馆，是继上海杜莎夫人蜡像馆、香港杜莎夫人蜡像馆、武汉杜莎夫人蜡像馆之后，中国第四家杜莎夫人蜡像馆。该馆于2014年5月29日正式开幕剪彩，于2014年5月31日正式对外开放观看，位于北京市东城区前门大街步行街8号。该馆在5月29日开幕剪彩仪式上，也曝光了首批入驻该馆的名人，包括:鹿晗、杨幂、李小龙、黄家驹、迈克尔&amp;#183;杰克逊、奥黛丽&amp;#183;赫本、张国荣、周杰伦、吴奇隆、科比、黄晓明、冯小刚、孙俪、刘嘉玲、杨澜、威廉王子与凯特王妃、奥巴马、普京、玛丽莲&amp;#183;梦露、约翰尼&amp;#183;德普、布拉德&amp;#183;皮特、丹尼尔&amp;#183;克雷格、博尔特、李彦宏、尚雯婕、成龙、杜莎夫人、郭德纲、范冰冰、姚晨、张艺兴、刘涛、陈伟霆、白敬亭等各行各界中外名人。,/Date(1587092365000+0800)/,0
1085255,在前门大街闲逛的时候，竟然无意中发现了杜莎夫人蜡像馆，原来我只知道上海和香港各有一家杜莎夫人蜡像馆，我倒是只去过上海的杜莎夫人蜡像馆。北京在这一家多了中国精神的展示区，里面有很多奥运冠军，我想这应该是北京杜莎夫人蜡像馆的特色吧。,/Date(1572428445000+0800)/,6
86696209,携程买的票，进门直接兑票，会赠送一本书，可以留作纪念。关于蜡像，有的是真像，有的真不像，个人觉得黄渤渤哥和艺兴的真的很像，艺兴的迷妹可以来这里好好合合影啦。还有英女王，赫本，赵本山，小李子等等都还是很像的，杨洋杨幂的也不错哦，参观的时候会发现凯特王妃真的很漂亮，以前在电视上可能没仔细看。还有t台上的大表姐真的好有气场。孙俪，周杰伦，张国荣，赵丽颖的就真的很不像了。还有鹿晗和他的邮筒，看到很多妹子在合影，他的没有很像，不过也还可以的，有附照片。看其他的评价有看到吴亦凡的，不过我们去的时候没看到，貌似有很多会有变动吧。感觉蜡像有点少，还没逛过隐就没了，票价减到一半应该更合理。,/Date(1517929830000+0800)/,16
75686910,整体效果不错，性价比高，网上订票要便宜，地理位置也较方便，坐地铁下车步行十几分钟，顺便连逛街。从楼上开始，分不同区域，不同行业的明星，做的都很逼真，整体参观大约一个小时左右。大部分都是年轻人，带着小孩去的挺多，都是冲着照相来的，每个照相的区域比较宽场，比较合理化。,/Date(1507594741000+0800)/,4
114418803,超级想来，这次陪妈妈来北京玩终于来看我们家鹿晗了，超级开心，网上门票需要两个小时候才能用这是我不能接受的一点，少一点时间也可以，哈哈哈哈，蜡像都挺逼真的，而且数量超级多，地方也很好找，就在前门大街，有兴趣的人可以选购哦。,/Date(1503466755000+0800)/,2
6508139,北京杜莎夫人蜡像馆当中陈列着很多名人，有古今中外的，有现代近代的跟蜡像合影，真的区分不容易，哪个是真人哪个是拉线了？,/Date(1602292658000+0800)/,0
205074108,一般般吧，反正不便宜，可以看看的,/Date(1630644843000+0800)/,0
1923594,蜡像馆的位置方便易找，馆内人物形象栩栩如生，看照片吧；但是趣味性的游戏少。个人认为性价比不高，属于那类没看过蜡像的可以去看看的地方。,/Date(1495860509000+0800)/,9
266004510,还可以吧，可以去看看的，点个赞,/Date(1631237003000+0800)/,0
272868415,还原度70%－80%吧！性价比低，因为鹿晗去的，真心是不像😂😂😂,/Date(1604273800000+0800)/,0
111640115,来北京最期待的就是蜡像馆，今天非常热，可是里面温度很清凉，转了一大圈，收获满满，都是明星同款，只是没有我最爱的薛之谦，希望赶紧到来，到时候再带着家人去,/Date(1501944038000+0800)/,4
88561445,还可以，就是没有更新太多,/Date(1621087179000+0800)/,0
38582581,一般般，地方不大，蜡像还算逼真，但是不多，也没什么有趣的玩法，一会儿就走完了，整体性价比不高有待改进，,/Date(1623574536000+0800)/,0
40309837,蜡像逼真，环境灵动！,/Date(1627693798000+0800)/,0
84246759,景色不错，有趣好玩，,/Date(1620019420000+0800)/,0
227556421,"从很早就知道杜莎夫人蜡像馆了，一直没有机会，这次来北京，打听到北京新开了一家杜莎夫人蜡像馆，在前门大街，就专门来这买票参观了。
总体来说，虽然性价比一般（主要是票太贵了），但总体参观感受还是很棒的，而且这种感受是其他景点都无法替代的",/Date(1576679096000+0800)/,1
3360157,携程订票很方便，不过两小时后取钱之前得算好时间，而且是两小时按秒算的取钱，我们没有考虑周全，就在前门逛了逛，也不算浪费了时间。过年期间人少，一小时就够与所有喜欢的明星拍照了，值得一去。68购的学生票，值了，哈哈,/Date(1518952917000+0800)/,1
105912337,推荐大家在携程上买票啊~~便宜很多，而且特别有意思，人也不多，拍照圣地，蜡像还是比较逼真的，而且名人也很多，逛完可以在前门大街游玩，很有趣。,/Date(1504276633000+0800)/,4
94009000,出了国博就来这了，本着鹿晗来的本山大叔做得巨像！还有些外国明星也是超级像！去了一次真是流连忘返呢。,/Date(1495460919000+0800)/,6
63667813,北京杜莎夫人蜡像馆位于前门大街。馆内陈列了部分国家首脑人物，中外演艺明星和体育明星等60多尊蜡像。蜡像馆内人物维妙维肖，栩栩如生。游客可以触摸蜡像，可以拥抱蜡像，可以和蜡像合影。,/Date(1478477853000+0800)/,2
24559977,去过其他杜莎夫人蜡像馆，门票不便宜，地方也比较小，趣味度和互动的设备非常少，小朋友不太感兴趣。,/Date(1626686162000+0800)/,0
225374904,冬天很适合这种室内娱乐，地铁前门下车位置也很好找。前台白雪服务态度不错。性价比高可玩性挺高。,/Date(1606745210000+0800)/,0
1129212,北京杜莎夫人蜡像馆一家非常不错的蜡像馆，馆内有许多国内外名人及影视和体育名人的1:1的蜡像，形象逼真，唯妙唯悄，来北京打卡之地。,/Date(1577627968000+0800)/,0
100070575,对于男性同胞来说值不值得去，取决于你陪的那个姑娘喜不喜欢这里，她喜欢就值得。唯一让我感到遗憾就是没有张学友的蜡像，学友粉在这里,/Date(1515407733000+0800)/,6
290360510,这种内室的展真的超适合冬天来看。  位置也很好找。 前台的白雪，热情服务 。人物也很逼真。,/Date(1606744768000+0800)/,0
153429122,"买的通票二百多块钱，大城小像、蜡像馆、前门大街，一起都逛了，上午九点出门到下午三点就逛结束了，正好迎着阳光的时段暖洋洋的，临春节腊月二十六，很热闹，有春节气氛，孩子很多，建议大家去玩，前门地铁站出来走五分钟就到。
雷佳音的蜡像好有喜感啊，喜欢。",/Date(1579509521000+0800)/,0
36218441,跟其他蜡像馆也是大同小异，里面的人不是很多，交通方便，就是场馆还真的是有点少，门票一般贵吧，还好工作人员的服务态度还不错，都会说主动帮忙拍照，里面有运动员，明星，政治人物等等，人物做得很逼真，一些很细微的方面也注意到，可以和自己心心念念的明星来个亲密接触，这个可是很兴奋的喔，可以好好地留个纪念。,/Date(1572786887000+0800)/,4
71214865,携程上购票比现场买票便宜，不过要买完过两小时才能用，最近蜡像馆有两人同行一人免单的优惠政策。蜡像馆就在前门大街上，挺好找的，离地铁前门站和珠市口站都挺近的。里面的蜡像很逼真，就是小鲜肉有点少啊，要是能增加一些小鲜肉就好了，大概走走拍拍40分钟就能逛完了。,/Date(1517381064000+0800)/,0
104240002,在携程上看到本来觉得门票有点贵，但和门市价比起来便宜很多了，蜡像大部分感觉挺像的，最像的要数本山大叔和美猴王了，一些蜡像旁边还有合影用的道具，要是种类再多些就更好了，慢慢悠悠在里面转了两个小时，也很值了。,/Date(1517133366000+0800)/,0
91515711,"非常开心的一次旅程，提前在app上预定了门票，现场很快就入场了，很方便快捷。
早就知道蜡像馆里很好玩，可是一直都没有机会来，这次趁着十月一的假期终于如约而至。
节假日人肯定少不了，对于这一点早就有心理准备，不过也没有人山人海那么离谱，其实人多点玩还是挺有意思的。
里面的蜡像很逼真，甚至你不经意回头会以为是游客，哈哈哈
见到了一直喜欢的明星蜡像，据说身高体重什么的都是按照真实的样子仿制的，甚至能看到腋下毛
评论后还能返现真的很实惠，以后出游都要提前在网上订好！",/Date(1507372278000+0800)/,2
99629876,"真的超级赞，就是我们去的时候是在11点左右，人有点多。感觉大部分都是很逼真的。其实最主要的是去看张艺兴，真的超级像。还有三层鹿晗有一个壁咚的场景也超级棒。刘雯走秀的那个也超有感觉。
一层进去之后好多都是伟人，有老舍，梅艳芳，张艺谋，杨利伟，李彦宏，好多好多。然后就是坐电梯上三层，三层主要是音乐区，影视区，还有武打的甄子丹，成龙大哥，李小龙。音乐区，周董那个不太像，其他的都很逼真。二层就是一些名人，时尚区很有看头，可以自己拍出大片的感觉。
总的来说很值得一去",/Date(1507296899000+0800)/,0
112501456,网上订票有优惠，但是行程有变退了。第二天到现场买的票，大人180、小孩110，够贵的。名人蜡像做工都是不错的，个别服装劣质了些。共三层，几十个人物。就是看着拍拍照，互动性、趣味性差了点。进去一次看看就可以了。,/Date(1503316121000+0800)/,6
104956611,"杜莎夫人蜡像馆 给人很震撼的感受，将人像做的如此逼真，令人佩服！从地下一层到三楼，再到二楼，不同的场景变换随着音乐一起变换，让人走进一个主题便立即融入进去。蜡像旁的中英双语简介也让人能够在欣赏蜡像的同时得到更多关于人物的认识，很好！
Madame tussauds is very impressive, and the portrait is so lifelike, it is admirable! From the ground floor to the third floor, then to the second floor, the different scene transformation changes with music, so that the person enters a theme and immediately melts into it. The Chinese and English bilingual synopsis of the waxworks also allows people to appreciate wax figures and learn more about the characters. Good!",/Date(1500615656000+0800)/,0
53582903,特别棒，和朋友定的学生票，在网上预定要两个小时之后再去，所以要提前预定啦，去了才知道所以就先去故宫逛一圈啦，在馆中中途手机没有电了还有可以免费充电的地方真是一级棒！还有！蜡像馆里的WiFi真的好快！开始的时候照了几百张手机内存不够了还好wifi快都上传到百度云盘里了，然后清空手机继续照哈哈！在蜡像馆里待了三个小时，快闭馆才出来哈哈，没有看到鹿晗的蜡像有点小遗憾，赵丽颖太太太美了！好评！！,/Date(1495503432000+0800)/,2
89529919,北京杜莎夫人蜡像馆是继香港、上海、武汉后在中国开设的第四个场馆。2014年5月底落成在前门大街，蜡像馆相对上海的目前蜡像数量还不够多，展出有40余尊名人蜡像，按电影、体育、领袖、音乐等8个主题区分类展示，其中“中国精神”展区是北京馆独有的，最新的一尊蜡像是今年4月29日由六小龄童饰演的孙悟空“美猴王”蜡像展出，这是杜莎百年历史中神话形象的首次入驻。蜡像馆开放时间为10:00至21:00，晚上7点后就不卖票了，最好是5、6点后去，2小时参观已非常足够，室内游览白天或晚上去区别不大，出来还可在前门大街逛下和吃饭。很适合拍照。,/Date(1492876653000+0800)/,4
50402020,非常值得去的地方。 一开始俩个小伙伴还在犹豫去不去。当我们觉得进去玩儿的时候那就撒欢了根本都搂不住了。 刚开始进去的时候会有点害怕， 因为实在都是太逼真的蜡像，而且你不知道下一刻会出现什么。 走一会儿就会好一点。 再之后就是搂不住了。 里面非常的好玩儿。 到最后竟然会累。 场馆很大。人物也非常多。 内容非常精彩。,/Date(1459833295000+0800)/,2
96597028,在前门大街上，位置还是比较显眼的，提前网上订票比较实惠，里面却还是很有意思的,/Date(1598436955000+0800)/,0
97337042,好多喜欢的明星蜡像都在里面，制作很逼真，还可以试穿衣服拍照；有兴趣的朋友还可以现场制作属于自己的蜡像模型，二楼还有伴手礼，喜欢的，就搬一座奥斯卡小金人回家吧,/Date(1497921425000+0800)/,4
86345488,国际名人，社会焦点人物，这里都有，蜡像馆也是个艺术馆。,/Date(1608823067000+0800)/,1
9057278,值得一去，不错。拍照也很棒。各路大神不说全部，很多都齐了，和奥巴马拍照的地方很赞，取照片价格略贵，好玩，也无所谓了。边上的大城小像也挺好玩，做的很精致，进去就是一部千年历史。,/Date(1538574879000+0800)/,1
182449802,"赫本、朱莉、梦露、GAGA、温斯莱特，大美女很多！
德普、小贝、小李子、皮特、谢耳朵，总有一款是你喜欢的！
很喜欢卷福！刘涛像很逼真！印象深刻的是杜莎夫人像！
游玩不累，又能带给人新鲜感，值得一去！",/Date(1532829036000+0800)/,0
12164423,地方不大，世界人物多，中国人物少，有的挺像的，有点意思，价格也不贵，网上订票便宜，要提前2小时，我去的时候人不多，不用跟团去，就是前门，顺道可以转下前门,/Date(1497753783000+0800)/,2
172561529,北京最好的腊相馆，名人非常多。,/Date(1605107161000+0800)/,2
96597028,地点在前门大街上，还是比较好找的，蜡像比较多，基本都有，适合拍照打卡,/Date(1606866441000+0800)/,0
230346104,没有意思啊，有很多的明星，跟历史人物呢，惟妙惟肖，不错的一个蜡像馆。,/Date(1591840797000+0800)/,0
68503114,来北京别的地方可以不去，但这里必须必须必须去。主要是为了看我大SHE。各种名人明星，中国的外国的。真的很真，真到我不敢摸。很好很棒很喜欢。还做了一只我自己的手，胖胖哒。,/Date(1478677831000+0800)/,3
53231857,门票价格不便宜，有许多中外明星的蜡像可观看，从前门大街进入没多远就是蜡像馆，地方不大，里面的游客不多，外面的拍照的人不少。有机会进去看看也不错。,/Date(1491731912000+0800)/,4
9088265,在前门大街里，很惊艳，很逼真，还有动态真人模拟动画可以拍照,/Date(1595041645000+0800)/,0
