118031524,非常棒的一次体验！到了门口，直接拨打前一天给我发送通知短信的电话，工作人员就在门口候着，带领我进入，都很顺利。进入之后指示图也非常清晰，很热门的蜡像还有专门的工作人员负责拍照哦～,/Date(1543146209000+0800)/,0
87947819,里面的蜡像做的很像，和真人一模一样大部分！没有和偶像近距离接触过，和蜡像拍个照还是不错的！浏览的时间短点，也就半个小时,/Date(1491780043000+0800)/,3
6508139,蜡像馆里面有很多栩栩如生的蜡像，如同真人一般，特别有趣。,/Date(1593562736000+0800)/,0
111823565,很好！！一直想去蜡像馆，这次趁假期终于去了，蜡像做的很逼真。见到了我心心念念的四爷(&gt;_&lt;) 还有艺兴哈哈 开心！网上买票便宜还方便，不错！,/Date(1507902667000+0800)/,2
106835742,"很棒很棒很棒很棒很棒很棒
【景色】
【趣味】
【性价比】高",/Date(1605934973000+0800)/,0
24910701,值得看看。有点老气了，现在人们对它的兴趣没那么高了。,/Date(1587531797000+0800)/,0
5305526,非常棒的一次体验。是一个拍照玩的好地方。在里面玩的很开心。杜莎夫人蜡像馆绝对是一个有内涵的地方。以后还会再来玩。,/Date(1560191705000+0800)/,3
46005685,值得去，蜡像非常逼真，而且还有体感游戏，超级逗，还能做腊手，适合情侣去玩,/Date(1448516502000+0800)/,1
331984466,蜡像有个别的不太像，体验感一般，门票150感觉不值,/Date(1627373039000+0800)/,0
115873503,第一次去蜡像馆，人物塑造的都很逼真，学生票98一人还挺值得的，人物很多馆场挺大的，当然最重要的就是拍拍拍啦，总之很满意的一次游玩！,/Date(1504355823000+0800)/,2
170925981,蜡像真的各行各业各种名人都有，很喜欢去蜡像馆拍照，所以去了有蜡像馆的城市，都会去看看的！北京的蜡像馆也很逼真的！去了要多拍照啊！,/Date(1579254969000+0800)/,0
309236402,还好叭，感觉就是看一看而已，可能这方面造诣不高,/Date(1624858706000+0800)/,0
41869468,蜡像馆很好找，蜡像做的很好，很逼真！值得一去！,/Date(1445340276000+0800)/,2
59691162,去两次了、很好玩、多了几个新的蜡像、互动的道具也有增多、环境也很好、这次是带老人去的、玩的很开心、多些能休息的设备就更好了、,/Date(1584061886000+0800)/,0
38478630,景点就在前门大街，里面很凉快，很多很多名人，孩子非常的喜欢。蜡像馆不大，分为三层区域参观。我特别喜欢孙俪那个，做的甄嬛传里面的形象。值得去玩！,/Date(1566738214000+0800)/,1
182817346,杜莎夫人蜡像馆是我去北京的第一站，还偶遇陈伟霆，别提多开心了，里面杨幂，周冬雨，刘涛等美女都美极了，不过邓超，鹿晗等男士自己感稍逊一筹，还有就是前台售票小哥很帅气,/Date(1531097704000+0800)/,4
44749960,很不错，大多很逼真，也很有意思，可以随意拍照，各个领域的明星。就是里边东西超级贵。,/Date(1446037687000+0800)/,2
15430341,可玩性低，有待改进，景色一般，性价比低，,/Date(1616336890000+0800)/,0
121000060,只能说一般般吧，看了也没啥特别的感觉！！！！！！！！！！！！！！！！！！！！！！！！！！！！！！！！！！！！！！！！！！,/Date(1594098719000+0800)/,0
158098400,蜡像也是各行各业中外都有。政治家，知名企业家，大多数都是演艺明星。进来的游客都是冲着和蜡人照相来的。每个蜡像旁边都有小道具专门提供给游客，用于和蜡像合影造气氛。有些知名的明星蜡像旁边，排队照相的人更多，比如奥巴马、鹿晗，都设计了专门的场景，工作人员给游客拍照后，在出口处，可以交钱取照片。,/Date(1517440574000+0800)/,0
68913784,蜡像有的非常逼真，小部分则明显粗糙，不知何故？孩子玩儿的很兴奋，平时不爱照相，在那里主动要求照相，拍了很多。网上订票，两小时后才可取票，我们去了才想着从网上买票，等不及了，一大人一小孩270，网上228。供大家参考。,/Date(1488199917000+0800)/,6
40760352,个人是很喜欢的，只是门票感觉稍贵了些，不过既然出来玩了，不差那点钱，开心就好！,/Date(1519391045000+0800)/,4
343086960,很多有意思的明星蜡像，很适合拍照打卡,/Date(1645193063000+0800)/,0
197683921,"带孩子去的，还不错
【性价比】
【趣味】",/Date(1591685294000+0800)/,0
195413297,特别好玩，非常形象生动有趣。推荐一下,/Date(1590023299000+0800)/,0
59264123,带着家人去的，大家都很开心。推荐,/Date(1607787836000+0800)/,0
11811417,工作人员孟薛服务态度很好很热情,/Date(1606739107000+0800)/,0
968726,这地方还不错哦，值得去玩一玩呢,/Date(1595000604000+0800)/,0
77437683,挺好的啊漂亮工作人员态度也很好,/Date(1593903169000+0800)/,0
87104187,挺好的，做的都挺真实的，到个别明星，里面有工作人员还会给拍照，有3层，一楼三楼好多蜡像明星，二楼可以选照片，还有纪念品，最后到乔布斯蜡像就结束哦了。,/Date(1491376965000+0800)/,0
69249756,位置很醒目，前门大街上，共三层楼可以参观，蜡像比例1:1还原，大部分都非常逼真，有种真人就在你身边的感觉，可供大家留念拍照，就是门票有点小贵……,/Date(1502474871000+0800)/,2
230078706,人特别多，排队N小时！,/Date(1588848460000+0800)/,0
12925551,不仅为中外游客提供了与世界级明星们的零距离互动体验，还融入了北京当地的传统特色，充分体现了中西方文化与现代艺术的完美交融 。,/Date(1564062550000+0800)/,1
982051,挺好玩的，正好赶上一个周六的下午，人也不是很多，可以随意照相，也不用排队，蜡像做的很逼真，不少蜡像旁边还有可供拍照的道具。,/Date(1512347616000+0800)/,1
117901260,如果有自己特喜欢的idle 建议去一下，我去的时候很幸运，门票好像100左右，当时提前2小时在网上订150，到现场之后，前台说当天门票优惠，然后帮我网上退票，现场买票，总之，还是很开心,/Date(1510965657000+0800)/,2
54265939,去过上海的杜莎夫人蜡像馆，据说每个地方的蜡像都不一样，看到了鹿晗和张艺兴的蜡像，很开心，还留了照片。可能是淡季人较少，可以随意照相，感觉不错。,/Date(1509188028000+0800)/,0
119078100,感觉还是很值得一去的，蜡像做的很逼真，并且场景很丰富，也有很多好玩的游戏。还可以打印照片，总之留下了很好的印象。以后等李易峰入驻一定要再去一次,/Date(1506991902000+0800)/,0
231542439,杜莎夫人蜡像馆还好吧，但是没有上海的那个杜莎夫人蜡像馆人物多，鹿晗不像，成龙不像，杨幂不在，没有香港四大天王，除此之外还不错吧。郭德纲 ，李冰冰，赵丽颖，黄渤，刘涛，奥黛丽赫本，博尔特，乔布斯，皮特，迈克杰克逊很像。,/Date(1564380776000+0800)/,1
158203856,有一些蜡像没看到不知道是没开放还是没逛到，里面就是一条路线不会重复走这点很好，网上订票要两个小时以后才可以用，所以要记得提前订，人就一般的多但是拍照还是蛮困难，因为都要合影，里面可以做手模，应该是一百多的样子，真的觉得做的还是很细致，因为眼睛皮肤什么的很有感觉的，但有些还是会很明显觉得不像真人，哈哈,/Date(1525259172000+0800)/,1
91246768,为了杨洋买的票 馆里蜡像挺多的 不过多数都是外国人 外国人的蜡像做的都比较好 中国人可能是因为五官不够立体的原因 都挺一言难尽的 成功见到了杨洋超满意的,/Date(1500736707000+0800)/,0
89139195,总体来说场馆还是挺大的，在里边一路拍照，蜡像的还原度也很高，好多蜡像旁边还有道具可以使用，不错的体验,/Date(1492009480000+0800)/,2
92656773,我是周一去的，人不多，哈哈哈哈哈哈哈所以有机会和我爱豆大拍特拍啦！场馆很干净，服务人员态度也特别好，会询问需不需要拍照。体验不错，建议去。,/Date(1512456430000+0800)/,0
101344639,非常好，可以莱昂纳多蜡像在维护，就是奔着他去的非常好，可以莱昂纳多蜡像在维护，就是奔着他去的非常好，可以莱昂纳多蜡像在维护，就是奔着他去的,/Date(1499319427000+0800)/,4
57139190,到了北京是一个很不错的地方，一定要去看看杜莎蜡像馆里的蜡像,/Date(1463904434000+0800)/,4
5622901,第一次去蜡像馆，还是可以的，和各路明星合影，电视明星，体育明星，外国明星等等，上图自己看，游览的过程很快乐，没去过的朋友可以考虑去游玩！,/Date(1564483174000+0800)/,0
149625981,特别好玩，人都很活的一样，那眼珠做的简直太逼真了，真的是超值，我跟每个人物都合影了一张，哈哈哈哈,/Date(1507007990000+0800)/,2
106336939,我是下午去的，到那兑换票就进去了，蜡像很不错，只是感觉有点少还没看过瘾就出来了，很值得去的地方。,/Date(1500624707000+0800)/,2
51060105,第二次去。新增很多新蜡像。虽然没看到小骨。但是看到张PD高兴。好评，好评！,/Date(1524566152000+0800)/,3
78480274,北京杜莎蜡像馆位于前门大街，交通比较方便，室内蜡像不是很多，比较少，但是蜡像做的都还可以，建议实地看下，感觉不同！,/Date(1490766140000+0800)/,1
45601736,太像了，太美了，里面还是值得年轻人去见识见识，不只是为明星，也为蜡像制作这种工艺去见识见识，黄渤、周冬雨还有国外的人物做的超级逼真。,/Date(1578744856000+0800)/,0
185234554,从进去到出来一共用了大概一个多小时吧，里面的蜡像做的都很逼真，就是赶上节假日人比较多，拍照都要排队，总体来说还是不错的，推荐去参观！,/Date(1534084427000+0800)/,0
78010739,非常好玩非常有趣不用排队周末人也不多 鹿晗和奥巴马有专门设置了合照区有工作人员帮照相！很真实的蜡像 东方神起也很帅 总之是开心的一天www,/Date(1511162603000+0800)/,0
190677228,就在前门附近，里面不大。还好有三层，个人觉得并不是太像。不过，我也没有见过真人，也是电视里见过，趣味性还是可以。没有去过可以去一次。不过，不会再去第二次了。性价比也一般。,/Date(1535300254000+0800)/,0
78862247,总体来说还是比较满意的，去了好几个地方，孩子最喜欢这个地方，还说这个地方来对了，孩子可以喜欢的明星拍照。下次来北京还要来这个地方。,/Date(1518086640000+0800)/,0
243507244,里面会有很多明星，其中有很多和真人没什么区别，有一些蜡像和真人还是有一定差距，不过也非常真实了，值得去看一下，前提是经济还可以哦,/Date(1574556758000+0800)/,0
83351520,坐地铁去很方便，里面的蜡像不少。都是按真人的比例塑形的。乔帮主好高，毛发皮肤做得细致。还有房地产业大亨潘石屹，惟妙惟肖。梅西在灯光下太逼真了。吴奇隆就逊色些不是特别像。,/Date(1560143311000+0800)/,2
40432268,还行吧！过年回北京家里，孩子突然提出要去的，提前携程购票有优惠。三层，稍微感觉小一些，估计平时游客不会太多。,/Date(1550566815000+0800)/,1
67543720,整体感受还是很不错的。自己来逛的杜莎蜡像馆，蜡像分布在四层楼，很逼真，很适合拍照。不过还是建议两人或两人以上来，能更方便的拍照。,/Date(1545053357000+0800)/,0
