104837895,空气好，环境好，周末人多，早点去。场地很大，滑雪用具还行，服务态度好。每年冬天都去，想找教练也很方便。,/Date(1566267210000+0800)/,0
2403096,价格优惠，方便快捷，雪场有专人接待，很好！作为北京老牌明星雪场，南山滑雪场一直保持着不错的服务水准！,/Date(1577975937000+0800)/,0
58287452,，坐的交通车，周二还有优惠，很方便，非常好玩，教练教的也很细心，里面的餐饮消费价格合适，体验感非常好,/Date(1554390633000+0800)/,0
4735273,南山滑雪场算是北京专业级的滑雪场，雪道比较多，维护也比较好。我们几乎每年冬季都去,/Date(1513390399000+0800)/,3
8110635,京华最好的滑雪场了，没有之一。雪道比较丰富，练习最好选择。,/Date(1579855904000+0800)/,0
98912471,冬天必去的滑雪场，单板更富有挑战性，摔倒了也没关系，雪很厚实不怕疼，餐厅有很多吃的，价格也很合理，停车场门票10元不限时，北京最好的滑雪场,/Date(1549549697000+0800)/,0
154532279,算是北京市内最好的雪场之一吧，雪道开的早，技巧区也有不少，毕竟一分钱一分货，再想玩的更好就崇礼吧,/Date(1513674772000+0800)/,0
66130776,各种级别滑道一定可以找到适合的。,/Date(1519045755000+0800)/,1
49264745,很方便  通过北京银行信用卡还免了100  就是周末人多 而且 感觉里边吃的挺贵的 建议自己带吃的  不过雪质真的特别好  已经买了第二个星期的票了 接着去,/Date(1454408666000+0800)/,0
170314092,滑雪场很大，玩的很开心，原本以为会很冷，但是玩起来很舒服。下次还会再来玩的，里面有餐厅，有热水，吃饭也很方便，卫生间有扶手很贴心。,/Date(1578112901000+0800)/,0
17305228,服务很好吧，餐馆不咋的！其他都好，去晚了玩了四个小时，小孩子不乐意走,/Date(1577367153000+0800)/,1
39626277,非常大的雪场，儿童场，初级场，中级场，高级场，全部具备。管理不错，玩得尽兴。以后会再去。,/Date(1549698190000+0800)/,0
3281896,还行，入场有点堵，上午雪还好，下午***，其它还行,/Date(1518865922000+0800)/,0
97335214,只能说，人实在太多了，而且外面指挥车辆的工作人员以及卖票的工作人员，态度实在是太差了！！,/Date(1514879137000+0800)/,10
183073076,上午人不多，滑雪感受好，携程买票比现场便宜，还免20元门票。可惜前一天夜场玩得太累，第二天订了全天确没怎么玩，建议买4小时的票,/Date(1549881203000+0800)/,0
162366566,南山滑雪场真是不错，玩的挺嗨，过瘾，时间充裕，感谢店家的服务，五分,/Date(1517823183000+0800)/,3
16840548,高档的滑雪场 从服务到环境 还有雪场设施都是一级棒 ,/Date(1516711165000+0800)/,2
22943277,年年都来，明年继续！！！！！！！！！！！！！,/Date(1548939460000+0800)/,0
163140764,今年第二次购买了，真心不错，雪道还多，平时去人还不多，吃的也不贵，吃的还好，非常棒！,/Date(1518352355000+0800)/,2
95381604,雪有点化了，不是特别硬实，但玩的还是很开心,/Date(1551998472000+0800)/,0
45718272,这是一家非常大的滑雪场，大到可以不用考虑服务，顾客感受，每个工作人员都非常强势，说说为什么差评吧，第一滑雪过程中工作人员几乎用训斥的语气，还有我看到有的孩子请了教练，教练对没有请教练的孩子倒在身边也不会搭把手，当然不是我的孩子这是我看到的。再说说导致写差评的决定性问题，在门口孩子要买烤肠和阿萨姆奶茶，被服务人员给点成了杯装的，我们要返程了不方便拿散装的那种，然后服务人员非常生气的大喊给你退你等15分钟，然后一脚把门踢开了，看到他这样的态度我说那都退了吧，另外的工作人员告诉我不用在这里等，可以原路退款，所以就走了，然后就没有退款了。,/Date(1643929468000+0800)/,2
937255,总体印象不错，场地大，环境好。孩子哪怕不滑雪在里头也有其他儿童项目能玩的很开心，这点给南山一个赞！工作人员态度多数也挺好。但请最高级别教练员，除了正常缴纳费用外，还得私下再给教练额外费用，这点在教练服务点咨询费用时前台的工作人员就有提出还有这部分额外单独给教练的费用。不知这是否为该行业的潜规则。如果非得收取这部分额外的费用，建议还是明码标价的好。否则总归觉得有些别扭。教练教的好，学者有收获，给点额外感谢费用也在情理之中，但给了一百感谢后，教练觉得你给少了，还得让你再加一百这种做法总归还是觉得心里有些别扭的，希望能加强制度管理和完善，非得收这部分费用，明码标价广而告之，自愿选择为妥。,/Date(1579705979000+0800)/,0
2698818,"除了价格贵没毛病，想下次不是节日的时候再去，南山滑雪场挺好的，还请了教练，当晚住宿北京，挺好的票务，挺好的票务
除了价格贵没毛病，想下次不是节日的时候再去，南山滑雪场挺好的，还请了教练，当晚住宿北京，挺好的票务，挺好的票务",/Date(1563944497000+0800)/,0
2808936,"前后两天分别在渔阳和南山滑了两天雪，因为渔阳的链接找不到了，就在这里一并点评下。
先说结论，假如再到北京来滑雪，在渔阳和南山之间会保留南山，然后再换换怀北，一路上试过去。
渔阳雪场比较单调（平行的五六条），高中低难度划分比较明确，中级道难度基本没有变化，滑多了容易腻；
南山的雪道数量多，长度长，有比较多的转弯，中级道开始一段会比较陡，可玩性会比较强，而且雪道分布比较开，转转几根雪道就用不少时间，南山一天滑不够。
南山的餐饮服务内容比较多，另外有夜场，这个比较有利一点，但现在还是没有搞明白携程的全天票能不能滑夜场。

就这样。",/Date(1547452047000+0800)/,0
45141089,雪场在密云，距离三元桥大概80公里左右，开车1个小时的路程，走京承高速道路宽敞，非常顺~也有雪场大巴可以选择，往返每人45元（详情见官网）。听雪友说这里是离北京市区最近的，设施最完善的，雪道种类最丰富的，占地面积最大的滑雪场了。第一次去就被这里丰富的雪道吸引住了！初中高级道，每种都有很多条，并且每条之间还有一些岔口，可以随意搭配自行选择下滑路线，适合各种水平的人练习各种滑雪技巧，不会很快就觉得腻，很有乐趣。需要注意的是，为了安全起见，有些初级道只能滑单板，有些初级道只能滑双板，而中级道开始就可以混滑了。官网或官微提前一天预订，可以享受优惠价格（周一到周五每人185一天，周末每人295一天），跟一些团购网站价格一样，并且还省去了团购后等待代理商确认、出票之类的各种麻烦，如有特殊情况，提前一天也可取消预订（具体见官网）。停车场很大，5块钱不限时。一般女生可能滑半天4个小时就会累，但体力好的男生，滑一天可能都意犹未尽。雪具和雪服成色还不错。场内有咖啡店，还有卖烤羊肉串的，累了可以小憩一下补充体力。如有需要也可以请教练，有一对一和一对多的方式可选择。如果不去崇礼，我觉得这里算是离市区最方便的撒欢地点了，赶上天气好还能看个日落：）滑雪是高危险运动，开始前一定要留出时间充分热身，拉伸关节，避免运动损伤。雪场有巡视的急救员，但受伤严重的话最近的就是去县医院，尤其要注意当天的最后几趟，不要着急，临走前体力、反应速度会是最差的时候，最容易受伤。,/Date(1525451896000+0800)/,4
24613277,不是在换票的地方换   而是给一个联系人打电话   有两个号码，最开始打来打去没人接，终于接通以后，告诉在一个门口等着，大概等了15分钟才见到人，而且还要等游客多了一起进去，花费了比较长的时间。但是滑雪来南山是没错的,/Date(1524014411000+0800)/,0
7549350,雪道很多，适合各种级别的人，初级雪道也不错，在教练的带领下，只一上午，下午就可以自己上魔毯在初级雪道上滑行了，非常开心。,/Date(1523853744000+0800)/,0
27573812,工作日周一去的，人超级多，携程订票，也不是到了出示码就能进。进门排队，找教练没有，亏了和老公两个人一起带孩子去的，我带孩子换衣服、领装备，老公在教练处排队等教练！最后运气还不错，找了个跟我儿子年龄相仿的小姑娘拼了一个教练，孩子有伴玩儿的更开心！确实存在教练要小费的情况，不过教练也确实辛苦，一直没吃饭，这个看个人意愿吧。,/Date(1521808327000+0800)/,0
2630248,很多滑雪场的雪票是官方在售，而南山是个代理，而且南山从宾馆到教练感觉各个人都可以代理票，至少在售票方面管理就很混乱。比如，我定的雪场里面的酒店，明明我都住在里面了，还要跑出来买票在进去滑雪，我钱花了，却没有买到方便，这体验就不好。,/Date(1517833684000+0800)/,4
119210498,因为是周四去的，所以人不算多，感觉雪场很开阔。一直在初级道练习，雪道够宽。雪场里的工作人员还是都挺友善的，只要有需要帮忙，都会和善地帮忙，感觉随和，不错。重点是这里用餐的地方很不错!室内室外都有，室内布置整洁，不糊弄，餐吧的饮食品种比较适合雪场，虽然贵点但分量足够大，在这样的雪场算很好了。和北京周边有些雪场相比，感觉很不错。下次还会选这里。,/Date(1516885440000+0800)/,0
14665182,雪道不错    单双版分的明确   中初级道玩着也很好        雪道不错    单双版分的明确   中初级道玩着也很好    雪道不错    单双版分的明确   中初级道玩着也很好,/Date(1516005369000+0800)/,0
8496072,风景如画！老少皆宜，空气很好！适合度假！,/Date(1452007721000+0800)/,0
37995639,北京最早最好的滑雪场之一，价格较高，离北京城里很近，去的人很多！一到放假人山人海，最好平时去！要不只能人挤人的滑雪了！,/Date(1582555139000+0800)/,0
161861786,很不错，赛道齐全，很适合我这样的新手，无奈元旦假期人多，上坡需要排队时间长点。,/Date(1546402558000+0800)/,0
71975457,在密云城区附近，交通方便，雪道也很好,/Date(1578060887000+0800)/,0
66908688,冬天去的，现在才想起点评，总而言之我觉得设备设施设备比较安全，人员服务比较制度和标准的一家滑雪场。儿子去了，我放心。,/Date(1556963440000+0800)/,0
22880180,非常划算！订票简单！入场也十分方便！,/Date(1515741117000+0800)/,0
53999194,很好雪很好滑的也行服务也不错下次还去,/Date(1514529132000+0800)/,0
7475654,带孩子去玩！就是订了一天的！非说不行给我们换成半天的票！挺愚昧的！南山滑雪城不是第一次去！还没遇到过这种情况！接待员就说没有一天的票非要退给我们现金！你说大老远的过去总不能白跑！好多客人只好忍了！,/Date(1445778524000+0800)/,0
34857339,很棒！值得去 北京附近也就这家能去了,/Date(1581472175000+0800)/,0
8110635,雪道非常丰富，北京地区首选滑雪场。,/Date(1580572366000+0800)/,0
34948640,挺好玩的，设施齐全，安全性高，周一到周五去人比较少，周末节假日应该人比较多,/Date(1578371671000+0800)/,0
24897474,还可以，带孩子去的，孩子玩的很开心,/Date(1531311089000+0800)/,0
5990745,南山滑雪场位于密云区城正南方，占地面积4000余亩，是集滑雪滑水滑草滑道以及滑翔等动感旅游项目为一体的四季度假村。,/Date(1519057818000+0800)/,0
45377927,北京最好的滑雪场，最起码个人是这样认为的，一分价钱一分货，软硬件设施都属一流。每年冬天的滑雪活动我只会选择南山。,/Date(1554855261000+0800)/,0
76028675,北京地区很好的雪场了，滑道种类数量都很多，停车方便，吃饭方便，滑雪价格较贵，但是服务还不错，夜场也开放，体验不错,/Date(1550905819000+0800)/,0
54336987,玩遍北京各大滑雪场，南山的雪质最好，雪道可玩性好，交通也方便。当然人也多,/Date(1550384942000+0800)/,0
246671188,宰猪 但是景点大 注意事项 不要被宰,/Date(1609684640000+0800)/,0
34517523,算离北京近还比较好的滑雪场了。,/Date(1507123940000+0800)/,4
89960148,玩的很开心，人很多，天气不错！,/Date(1488447885000+0800)/,0
91042479,玩儿的很开心，环境非常好，服务态度也很好！给孩子还请了一个教练教滑雪，教练服务态度也很好，孩子很快就学会了,/Date(1564556586000+0800)/,0
65932360,这个订单特别靠谱，官网必须提前一天订才有优惠，这个当天早上订就是优惠价，特别好，进门还有专人接待，非常好！,/Date(1545735170000+0800)/,0
6783762,滑雪场雪质一般，天气好，雪道10多条，教练真心一般，一直在说他们挣的钱少，很多教练要收小费等等，真心挺烦。,/Date(1518506548000+0800)/,0
37995639,北京最早最具规模的滑雪场，雪道设计合理经常有各种高手来滑雪，时不时还能看到表演！只是现在滑雪价格都不菲！,/Date(1574553933000+0800)/,0
1507576,特别好玩儿，你要是不会的话，没关系，那里有许多帅哥美女教练啊……,/Date(1548222286000+0800)/,0
163140764,今年第三次购买了，真是方便快捷啊！联系人小柴带着办理，很快，只是要带每人400元的押金。比崇礼便宜太多！,/Date(1518421417000+0800)/,0
189198032,不太适合新手，人太多了,/Date(1601343501000+0800)/,0
72110189,太好了，每年都会计划去一次的！太好了，每年都会计划去一次的！太好了，每年都会计划去一次的！哈哈哈哈哈。,/Date(1568727316000+0800)/,0
163202894,南山滑雪，缔造快乐人生，雪场各种初级、中级雪道，总有一条适合你,/Date(1549900572000+0800)/,0
1809204,这是北京城里最大的滑雪场了吧？雪道超多，各种难度都有，设施齐全，价格也比较合理，离市区远点但交通方便。,/Date(1517532901000+0800)/,0
60718644,滑雪教练很耐心细心 雪质好 就是巴士设点不好找 早上绕了很大很大一圈 等找到时刚开走...,/Date(1485593773000+0800)/,1
53728463,人有点多哈，尤其周末,/Date(1577628518000+0800)/,0
1809204,好好**********************************************好好,/Date(1570409317000+0800)/,0
3987555,南方人第一次见到怎么大的雪场，雪场环境还不错，就是没有特别暖和的地方。去的话还是要多穿点衣服。^_^,/Date(1554253644000+0800)/,0
3384682,很好的雪场****去过很多年********务也都很到位。教练比去年认真负责任的多了。。。。。。。。,/Date(1550837951000+0800)/,0
206406263,南山滑雪場很大 我在聖誕那一天去要為會很多人 但是原來還好！享受,/Date(1545744879000+0800)/,0
47579373,第一次去滑雪，没有对比过其他滑雪场，总体感觉挺好的。自己的这套滑雪服挺干净的，也没有异味，滑雪鞋挺硬的，有点膈到脚，滑完小腿部分有碰伤，可能是没掌握用力技巧。总体来说还是挺好玩的。,/Date(1518505982000+0800)/,0
4829130,不错，进门每人十元门票钱给接待的，每人交400押金就可以自由玩啦。下次还会买的。,/Date(1486826836000+0800)/,1
215336455,带两个孩子游耍一整天，环境设施都比较好，今年还特意找了教练教单板，孩子们玩嗨了！一定找时间再去。,/Date(1550135393000+0800)/,0
4041865,北京最好的。感觉很不错，大初一的人最少，路上车开得快，教练费用不便宜，但大过年的都不容易，挺值得,/Date(1549402902000+0800)/,0
82953267,还不错，挺好玩的。性价比很高.玩得老开心了。有机会还去。,/Date(1487606300000+0800)/,2
74721336,场子很大很专业，雪道很多，配套设施也很齐全，适合专业人士，新手去不能体会众多乐趣，性价比就不高了,/Date(1459949089000+0800)/,0
51498656,很好玩，地方也很大。也很刺激，很爽。五个字:好的不得了！,/Date(1456104973000+0800)/,2
169977417,早上没有赶上，但是回来的时候比较晚，导游也等我们了，特别好特别好，非常赞，很棒的滑雪很棒的导游,/Date(1578386134000+0800)/,0
893690,以前去过几次了，再来的体验还是挺好的，以后应该还会来。。。。。。。。。。。。。。。。。。。。。,/Date(1556036447000+0800)/,0
94144778,不建议节假日去，人超多，领装备的大厅明显不够用要排好久的队，不过滑雪场还是很大的，各种赛道都有,/Date(1546312679000+0800)/,0
71498522,玩的很爽，不过还是要注意安全，量力而行，在那里可以租用各种装备，有各种滑道，适合各种年龄段的人,/Date(1502347123000+0800)/,0
616685,非常不错的滑雪场，值得推荐，雪道很多也很平整，适合各类人群，约上朋友一起来滑雪，也是一种享受。,/Date(1451019592000+0800)/,0
2336099,比自己现场买票要省不少，也很简单的方式，就是到了售票处的门口，给等候的打电话，然后一起带进去,/Date(1549627791000+0800)/,0
87946861,雪场很大，配套设施成熟，很舒服。租的衣服味道大了点。,/Date(1549379856000+0800)/,0
3828238,早点去，人很少。下午人就开始多了,/Date(1546954596000+0800)/,1
154741627,试营业期间开放雪道较少，玩的不够尽兴，但是性价比真的很高，而且南山雪场的雪质还不错，下次有活动可以考虑再去一次的,/Date(1511880243000+0800)/,1
22968330,建议增加自带板的门票价格。。。。,/Date(1481184023000+0800)/,3
2352717,可玩的雪道比较多，就是上山顶滑道需要刷卡挺多余的。,/Date(1549679608000+0800)/,0
4300263,人不是很多，雪道齐全，雪道雪面平滑，最近还会再去！,/Date(1549616737000+0800)/,0
29651104,价格合理，不滑雪可以购买普通门票，玩得很尽兴，建议初次滑雪可以请教练，可以减少摔跤和受伤。,/Date(1536166872000+0800)/,0
49264745,雪道多 厂子大  不过人也多 地点很好走 正在考虑明年办季卡,/Date(1454386760000+0800)/,2
4154453,北京的雪场中，算漂亮的的了，雪道多，适合各种水平。应该还会再去的。预订有优惠，班车也方便。,/Date(1450703039000+0800)/,0
160898753,雪场大，雪道多，雪场內消费比其他(軍都山)高，教练贵好多又不專業，孩子说只是陪滑冇教甚麽，最后又讨要红包，滑可以去，學就不好了。,/Date(1549874307000+0800)/,2
67775561,非常棒的滑雪场！！！！滑雪爱好者天堂，吃的也不贵,/Date(1522717884000+0800)/,0
159431011,晚上九点出发，十二点到，玩了四个小时，没玩爽，希望有时间再去，场地很大，教练也很好，喜欢,/Date(1515803463000+0800)/,0
29234267,本计划玩一晚上！因为孩子太喜欢玩！最后玩了一天,/Date(1579217466000+0800)/,0
61703008,环境整体不错，人很多，价格不便宜，雪具租用很方便。给孩子请的教练很热心，周到，很满意。,/Date(1533694611000+0800)/,0
250417846,导游贴心认真，认真讲解，服务好，服务好，服务好！重要的事情说三遍,/Date(1579335413000+0800)/,1
54417771,很好，地理位置超级好，而且前台小姐姐小哥哥都很亲切，早出晚归都会打招呼。房间很干净。,/Date(1576243067000+0800)/,0
183913978,一如既往的好，从零基础学的，到现在单双板自由切换，上最高的山也没问题，南山，成就你！,/Date(1551323661000+0800)/,0
27240754,贵了一点，不过还是有贵的价值。北京周围最好的,/Date(1549815560000+0800)/,0
92432074,玩的挺开心的，就是入场的时候等待的时间有点长,/Date(1516264380000+0800)/,0
1662611,"携程門口取票的安排非常混亂, 排好了隊的派票的時間又混亂起來, 一球人的弄了大半個小時。",/Date(1514867514000+0800)/,0
6624591,预定很顺利，进到雪场也方便。携程很靠谱。南山滑雪场性价比不错，离市区不远，价格实惠,/Date(1549462127000+0800)/,0
30196979,节日去人太多 今年去发现周围有改变整顿 挺好的,/Date(1515157187000+0800)/,2
56729424,和小孩还有另一家人一起玩，玩的非常好。滑雪场真大，就是吃饭太贵而且一般。希望改进。,/Date(1453689154000+0800)/,0
46346613,南山滑雪场是北京最大的滑雪场，设施齐全，就是夜场开放时间太晚，建议5点 半开始夜场,/Date(1547180294000+0800)/,0
155247400,第一次来南山滑雪场。感觉很好。管理很好。雪道，雪质都很不错。,/Date(1544916629000+0800)/,1
111337466,雪道全开了，人也还行，不算太多，滑得很爽,/Date(1514526787000+0800)/,0
7409935,周末去南山就是煮饺子，好在携程的票便宜一百，要是每周都有就好了，还是很值的，给赞,/Date(1449623607000+0800)/,0
3828238,工作日早点去，人很少，雪刚压完，非常好,/Date(1575875017000+0800)/,0
19306263,雪场很好 携程订票并没有便宜 不是很方便 不如直接关注雪场公共微信号 价格便宜领票方便,/Date(1466659961000+0800)/,0
1935207,雪不错，适合提高滑雪技术，设施配套好,/Date(1578229699000+0800)/,0
101425420,滑雪一时爽，摔了个屁墩到现在半年了还没好，大家注意安全啊,/Date(1564103887000+0800)/,1
36288228,去的那天人不算多 还不错 带孩子玩的很好,/Date(1550109023000+0800)/,0
13417816,非常棒！第一次体验滑雪，场子很大，很多区域。大年初七，人也不是很拥挤的状态。,/Date(1550016211000+0800)/,0
14244635,雪场不错，玩了一天，虽然请了单板教练，但还是找不到感觉，要之后自己练习了。,/Date(1578711515000+0800)/,0
507283,北京很不错的滑雪场，就是教练太少了,/Date(1550753145000+0800)/,0
23349092,还行，就是去之前，学习一下就好了，那里也有教练，不过花钱的啦！总体来说不错，建议要去的，尽量早一点去，不然玩不尽兴,/Date(1549061648000+0800)/,0
35979534,好多年前去过的，确实是这么多滑雪场中最好的，雪道多，设置也合理，总之不错。,/Date(1517042937000+0800)/,0
14096365,景区干净大气  玩的挺好 导游人也挺好,/Date(1575102099000+0800)/,0
13678181,儿子很喜欢滑雪，网上预订很方便。,/Date(1552192215000+0800)/,0
5744257,说实话，一碗方便面20元就有点堵心。场地还是可以的，但是开始没有一句话注意事项和讲解，全部都要私教才可以……也就是收费。冬天不用租那个防护镜费钱没意义！,/Date(1549672681000+0800)/,0
203019889,一如既往的好 就是周末下午人有点多,/Date(1547942582000+0800)/,0
26044644,整体感觉很好 雪道非常多 教练也很好,/Date(1547617676000+0800)/,0
10767042,交通方便，设备齐全，教练很专业。,/Date(1519635352000+0800)/,0
6909760,场地不错，但是鞋，板，衣服太旧了,/Date(1519351116000+0800)/,0
24723396,不错的滑雪场非常值得去玩还会再去,/Date(1517955613000+0800)/,2
45812235,南山雪场很不错，一定会有下一次。,/Date(1515811819000+0800)/,0
81864193,是北京比较好的滑雪场了！值得推荐,/Date(1515045406000+0800)/,0
21017815,玩得很尽兴 南山可能是北京最好的滑雪场了吧 雪道很多 无论什么水平都能滑得开心,/Date(1513255745000+0800)/,0
35240601,滑雪道较好，空气清新，值得去玩。,/Date(1479910842000+0800)/,6
1103001,初学滑雪者，小朋友的开心乐园。,/Date(1578060038000+0800)/,0
3671213,专业滑雪场啊，去滑了高级，后来一路从上面滚下来的，哭死啊，滑的机会太少,/Date(1561133711000+0800)/,0
3057742,还不错，有时间没去玩了，跟不上变化。雪场的雪差点，一冬天没下雪的缘故吧,/Date(1520474345000+0800)/,0
115975582,愉快的一天，感觉南山滑雪场最棒,/Date(1517752900000+0800)/,0
54182745,管理规范。划道多，有索道可以去山上，还是蛮惊险的。北京本地人来玩的也很多。门票只要20。其余的钱都是租划具的钱,/Date(1517666880000+0800)/,0
155950003,滑雪还是可以的，但是人太多，各种排队加起来近两个小时才开始滑。教练很负责，态度也不错。总的来说如果没有不爽的排队过程和乌央乌央的人群，其他还是可以的。,/Date(1515554650000+0800)/,0
507283,不错，就是有点贵 教练太少了。,/Date(1549799365000+0800)/,0
92101133,雪场不错，各种雪道都有，初级雪道长度也还不错，特别满意的一次滑雪体验,/Date(1514550601000+0800)/,0
184247537,和同学约了南山滑雪⛷️幸运的是今年下过两场雪❄️质很松软 感觉好安全,/Date(1578365935000+0800)/,0
