393483236,"总体来讲很棒的，当然和其他地方的自然雪❄️比如新潟，長野没法比，在不下雪的内陆北京还能滑雪⛷️，我觉得值得四分，虽然是人工雪，但感觉上和自然雪也差不多了太多。过年假期的原因人很多，稍微有点拥挤。

雪道不是很多，就几条，不过对于初学者练手足够用了，中级以上稍微有点欲求不满吧。小孩玩的也挺充实，有大的气球滑梯，小的滑梯。我的孩子们都比较大了，就带他们滑雪了。 

午饭也有好几家店，有烧串鸡翅🦑鱿鱼，薯条，☕️热饮，也有汉堡，露天座位，室内座位也比较齐全

总体价格还算合理，看个人经济状况。
如果住在北京近郊，很推荐去体验一次",/Date(1674727040000+0800)/,1
47967050,携程上买的票很方便，到南山在自助机器扫码直接领取滑雪卡。南山环境、设备和场地很好。雪具有点老，特别是鞋有味。我是开车去的，停车方便，当天人不多所以车位好找。南山教练很专业，特别用心，建议大家带着教练好好学。然后，里面的食堂也不错，东西的价格比较合理。整体体验很不错，一定会再来。,/Date(1676212546000+0800)/,0
48774214,"太方便了，国贸站上车。报个团解决了交通的大问题。

导游推荐的租雪服店也是滑雪场最近的，滑雪场里面的雪服不好看，孩子不喜欢，外面店的孩子满意。
雪场电子化很快捷，回想在自己城市滑雪场反复试雪鞋雪板真的痛苦。南山的按码数在不同的柜台领雪鞋雪板，一次穿上，再也不会掉。",/Date(1674989805000+0800)/,0
7846643,每年的冬季都会来南山滑雪🎿，不论从雪场的环境还是配套设施来说可以算是不出京滑雪的最好场所！携程订票方便验票便捷.雪具大厅敞亮，用餐的地方多，可选择性强！早场和晚场的面条雪滑着很舒服！人多也是真的！,/Date(1675315800000+0800)/,0
34852609,南山滑雪度假村占地面积4000余亩，拥有华北区最大的滑雪场--南山滑雪度假村，其单板滑雪教练均拥有ASA奥地利单板协会核发的国际单板滑雪教练证书,/Date(1679701148000+0800)/,8
378348612,环境很棒，我是订午场+夜场，夜场的滑雪场超美的，然后因为第一次所以请了教练，17号教练也非常和善与专业，非常好玩的滑雪场，拍了好多照片，超棒的，以后再到北京一定再来，棒极了,/Date(1674835192000+0800)/,0
95339337,北京南山滑雪度假村位于首都近郊东北方向密云区，距城区正南方约3公里，距北京市望和桥62公里。是北京近郊的一座可以在驾车60分钟到达的大中型滑雪场。该滑雪场占地面积4000余亩，是北京及华北地区唯一集滑雪、滑道、攀冰等动感休闲,/Date(1671029610000+0800)/,2
420525529,雪场很大，雪道花样多。还有缆车可以做，不过感觉做了缆车才不枉费花的💰。可以租雪服拍照，眼镜，雪盔等等，有双板也有单板～,/Date(1677727947000+0800)/,0
1117707,"这么标准化的产品，选哪个平台很重要？
携程出票快，信息准确，执行力强。
我朋友临时有事不能来，携程退款流程非常痛快。另一个在某导航软件上就退得磨磨唧唧，首页写着随时退过期退，点进详情页又写着售出不退不换请您理解。。。居然还让雪场的人给我朋友打电话！
还是携程放心。",/Date(1673487141000+0800)/,0
35248761,大型又全面的滑雪场，根据水平设置了初高级滑雪场，有缆车、电梯，送至高处滑雪。餐饮配套较好，价格还比较正常。门票含雪具，押金400元一套。雪服是在大门外一家新开的店了租的，j周围有很多租赁商店，景区内也有，价格30-200不等，景区内储藏柜是10元一次，扫描租赁。自我感觉对于初次滑雪或菜鸟级的来说，这个滑雪场有点浪费，毕竟近500元的价格，也只能在初级场地玩玩，这个滑雪场更适合高级选手哈皮。景区里都是收费教练，没有网上说专业指导，收费挺高，一小时200-300之间，根据学员人数。景区有很大的停车场，免费。,/Date(1674713632000+0800)/,1
69741389,"跟着教练在初级道学滑雪⛷️。景区全部都电子化了，熟悉流程的话非常的方便。而且工作人员都很客气，交流无障碍。
中午从市区过来，直接去朝阳站坐高铁，对于我这种离朝阳站相对较近的人而言，算非常方便了，从密云站打车到滑雪场基本也就10块钱左右。
目前这个雪季人不是很多，滑起来很畅快，舒适度一流。",/Date(1671368341000+0800)/,3
25142286,3号去的，人不多，孩子玩儿的很开心，教练也很好找，记得去年来的时候人多到教练都请不到，人不多，雪挺好，不过怕孩子累着，不到4个小时就出来回家了，来回4个小时，为了孩子开心4个小时，也值得了。,/Date(1673015608000+0800)/,1
79797784,孩子期末考完，来这里滑雪，学习了单板。南山真的是北京最好的滑雪场之一了，服务也不错，管理规范，雪质量也好。孩子在这里滑过一次后，就不想再去北京的其他雪场滑雪，相比去河北滑雪，这里还是方便一些。如果能错开周末，平时滑雪更好。傍晚坐在雪场看夕阳西下，也很美。希望这里的餐厅多一些不辣的简餐。,/Date(1676073579000+0800)/,0
270842276,"整体体验感不错 第一次会有点手忙脚乱很正常
1.雪鞋雪具包含在门票里，取票的时候需要交💰400/人的押金，去服务台刷卡领取装备（根据自己鞋码去对应的窗口）。
2.进去以后刷卡进入魔毯，吃饭也是刷卡消费（饮料10钱/瓶，建议买个主食就行）。
2.雪服头盔啥的可以在外面的店里租，🌹服务很好，款式也还比较多。
3.里面的存取柜扫码使用，10块钱／5个小时，💰押金100块钱。
4.一定注意安全，如果在魔毯上摔跤了不要慌，工作人员会停下魔毯把你扶起来的（问就是已经摔过了😅）
5.出去的时候别忘了退卡退押金❤
祝⛷滑雪愉快！",/Date(1674284143000+0800)/,2
82981674,雪场特别大适合各类雪友，住在雪场旁边村子里住着很舒服。【南山悦民宿】,/Date(1674140811000+0800)/,0
270960763,玩的很不错，这次导游和车站也给了我很大的帮助，非常的感谢。这趟车是在9点从芍药居站发车，下午4点半从南山滑雪场往回走，大约是1个小时的车程，很愉快的一段时光。,/Date(1676345562000+0800)/,3
269920035,"4小时滑雪加往返班车，领队查查很细心，提醒事项都会发文字通知，我们当天是9点出发，10点左右到南山的，返回是下午16点左右，所以4小时的票完全足够。天气预报说会下雨，但是当天下了雪！Lucky！听说还是南山的第三场雪。
雪场附近挺多租雪服的，头盔雪镜外套手套一身下来100左右。雪场计时是从你开始领第一件雪具开始，就算到时间了也只是不能上魔毯和缆车，但可以在里面玩。虽然是周六，但是当天的南山人也没有很多（大概是初级道人不多叭），遇到的雪场大爷人都挺好的，第一次滑雪的我上魔毯都是大爷扶上去的(&gt;﹏&lt;)",/Date(1676893898000+0800)/,0
25036588,"下午场+夜场比较合适，中间休息一个多小时吃饭，拍照，晚上滑人不多
教练也很好找",/Date(1675302690000+0800)/,0
1990297,人多，雪具差，怪不得大家都自带雪具，我得鞋一个没鞋垫，一高一低，孩子的鞋一开始没内胆，换了一双，后来板换了五、六块，雪具太差了，那么贵的门票就不能更新一下雪具么，滑的没心情,/Date(1673695833000+0800)/,1
179635266,今年更衣室和餐饮不同程度的硬件升级了挺好，可惜缆车还是依旧，求求南山了，升级一下缆车运力，搞大点或者搞箱子，单板排队和四个人挤着吊着太痛苦了,/Date(1675093579000+0800)/,0
4158826,雪不错，配套餐饮也很好，味道不错也不贵，下午人山人海，教练收费比较合理，123号教练专业，负责任，因材施教，点个赞，携程的价格很实惠,/Date(1674883480000+0800)/,0
58841754,于导很专业很细心👍，中间我的进门卡找不到了还很认真负责帮我找，雪场专业大区域分的很细，满足了一家老小的各种情况需求，期待下次再来。👍👍👍,/Date(1673966743000+0800)/,1
449675,我之前都在新疆滑雪，北京滑雪这是第一次，就找了网评最高的滑雪场（除了延庆国家高山滑雪场）。我的雪具没带过来，租的雪鞋和雪板，雪鞋质量差、陈旧，雪板就是玩具板，轻和薄；雪场太小（据说北京最大😅），高级道太短，缆车速度慢，这是我的初步感觉。公园还是不错的，比一般的雪场好，这个是亮点。配套服务还不错。雪道虽说有26条，都很短，加起来还不如一些雪场一条道的长度。雪场适合初中级滑雪场和雪上技巧玩家。,/Date(1677456843000+0800)/,0
85791491,领队跳跳非常棒！热心负责任的北京大妞，本以为这么简单的一日游行程领队不太会管，没想到依旧非常负责的解答各种问题，感觉得出是真心喜欢这份工作，非常有激情，棒棒哒！,/Date(1674539292000+0800)/,0
55007992,雪场不错，但没想到工作日人也这么多，有个缆车还一直不开，但总体上滑爽了，毕竟因为口罩原因已经两三年没滑了,/Date(1672302135000+0800)/,0
4570274,在携程上选择南山滑雪一日游，市区接送加上门票，服务很好！,/Date(1676900387000+0800)/,0
163202894,每年滑雪必去的雪场，一个滑雪季要滑很多次，一般都是白天场，这是第一次感受南山夜场，人也确实很多，雪场雪质很好，适合各级滑雪爱好者,/Date(1676859506000+0800)/,0
6001091,"雪场可玩性高 雪道丰富 很适合初中级玩家 还有丰富的公园
停车场免费停车
雪场租借的装备较破 可自带装备 教练么现在很抢手，因为人实在太多了",/Date(1673505939000+0800)/,0
82147293,导游很好，工作单位。王导棒棒。必须五星好评！,/Date(1675327189000+0800)/,0
34533213,离市区不堵车的话开车大概一小时左右。中级道适合练习。建议工作日去，人少一点，价格也便宜很多。可以在停车场旁边的学具店租雪具。,/Date(1672666539000+0800)/,0
180002646,很大的一个滑雪长场，又大又多滑道选择，超好玩。那你的教练又耐心又细心的教导孩子。,/Date(1675132617000+0800)/,0
26474864,整体体验是不错的，如果有心过来滑雪也可以，小朋友基本学习一两个小时就可以滑双板儿童区了，不玩的话也可以花点钱租个轮胎也挺乐呵，胜在离北京城区近，1小时左右，价格的话，人均几百块，教练一对三的，170一个小时每人。,/Date(1674112805000+0800)/,0
54388367,指定地点集合上车 还是挺方便的 回程一路睡回来😂导游跳跳个性开朗，气氛担当。,/Date(1676278838000+0800)/,0
296064739,停车免费，缆车免费，免费热水，环境优美，卫生间特别干净，雪道也特别多，携程平日门票210，有点小贵，但是吴超所值,/Date(1672402649000+0800)/,0
69741389,南山目前已经开了3条双板初级教学道，一条是儿童专用的。另外两条就随意了，坡很缓，而且雪非常的不错，画起来很舒服，有一条特别的宽，非常适合初学者练习转弯。,/Date(1672154264000+0800)/,0
470849359,雪道设置的不错，冰雪世界的盛情,/Date(1675087876000+0800)/,0
328358040,总共有三种进阶坡道，对新手也非常友好，不用担心第一次去没有装备，场内场外有很多可以直接租借的地方，雪场里也提供租借，可以说是设备相当齐全的雪场了,/Date(1673618400000+0800)/,0
1257967,reasonable price and easy to access， we enjoy the whole day！,/Date(1674829971000+0800)/,0
40187445,玩得很开心，初，中，高级滑道都有，导游小查介绍得很详细。,/Date(1674746315000+0800)/,0
150784998,趣味性较强，场内有人会教你怎么滑（需要另外付费），教学内容较为简单，建议去之前先学习一下如何滑雪,/Date(1674733989000+0800)/,0
4009893,超棒的一次滑雪，小孩初次玩也玩得意犹未尽。雪场有教练教学，初次玩请教练可以节省时间玩得更尽兴。,/Date(1674635992000+0800)/,0
35228147,1.滑雪场挺大，各种滑道很多，适合不同水平的玩；2.里面双板单板都有，想拍照租衣也很方便；3. 餐厅比较全，基本上都能找到合适的。就是教练一般，有些水。,/Date(1674042886000+0800)/,1
24318285,南方人对滑雪感到很新奇！小孩玩得很开心！交通也很便捷，直达大巴车预约方便，雪场领取装备都很方便。去了两趟，有机会明年再去！,/Date(1675832894000+0800)/,0
2743514,不错，每年都去，性价比高的一个滑雪圣地，离北京市里近，交通方便，现在开发的不错,/Date(1678015802000+0800)/,0
10392395,"滑雪场的儿童区的那个人零分，态度超级凶
要保障安全，要注重态度，对儿童对客户负责",/Date(1675001693000+0800)/,0
257865796,"挺好玩的滑雪
第一次学最好请教练或者让会的朋友教你
教练收费最好找人拼单会比较优惠",/Date(1673886977000+0800)/,0
9456948,这是个好地方，滑雪场不是很大，但是适合初学者，好多小朋友在这里玩滑雪，各种摔屁股蹲儿的样子好可爱！,/Date(1670317573000+0800)/,1
2607451,导游小哥哥人很好，行程合理。来回很方便，上车地点也很方便，小哥哥颜值也高哈,/Date(1676104384000+0800)/,0
410075579,滑雪场很大，难度高低都可，查查导游很好，态度很好，介绍详细，想滑雪的快来吧,/Date(1673595075000+0800)/,0
5240046,雪的质量好，雪橇好玩，餐饮不错，初中高级道一应俱全，还有多个儿童练习区。,/Date(1675350051000+0800)/,0
4571066,给查查五星好评，热心、细致、负责,/Date(1674721619000+0800)/,0
195120707,第一次去滑雪，整体挺好的。新手还是要做足准备，我实在没准备啥连滑板都不会穿，后来只能找了个一对一教练，还是挺贵的。导游小朱服务很棒，有事响应很及时👍,/Date(1675524828000+0800)/,0
442208,趁着工作日去的，人不多就是体验感好，我主要在两个中级道滑，锻炼水平。,/Date(1678068306000+0800)/,0
35324170,雪季一直在这里滑，非常喜欢。,/Date(1677656038000+0800)/,0
60147073,"雪场有各类场地,适应不同人群需求。我们请的滑雪教练也不错，非常耐心。",/Date(1676547382000+0800)/,0
214472861,认真负责还幽默风趣的好导游。,/Date(1672819897000+0800)/,0
2743514,每年必来的打卡地，值得推荐，距离城里也很近，配套设施不错，挺好的,/Date(1674612875000+0800)/,0
169827709,很不错的体验，导游小哥哥也很不错，很有耐心，很幽默风趣。。。。,/Date(1675343496000+0800)/,0
155886728,雪场坡道很好，孩子很喜欢，吃饭的店也多味道也很好，下次还会去。,/Date(1674749430000+0800)/,0
86266666,设施完善，非周末去，滑雪人员不是很多，里面饭菜价格还算合理！,/Date(1674912371000+0800)/,0
42187013,2003年开始，几乎每年都来，最值得推荐的滑雪场。,/Date(1676884427000+0800)/,0
49101398,今天中级道人较多。天气不算冷，阴天，滑雪不用雪镜正合适。总体感觉不错。,/Date(1673617459000+0800)/,1
6001091,"南山大食堂吃的乱丰富，睡醒先来吃一顿再开始一天的滑行。幸福感满满。
缆车速度慢排队长，可以在山上选择魔毯刷短距离的道，也很有乐趣。",/Date(1675921487000+0800)/,0
13149379,挺好的 大人孩子都很开心 雪场内设施齐备 服务周到 赞,/Date(1675508201000+0800)/,0
111489708,要早一些进去，晚了人多，挤成一团，板踩着板,/Date(1675121896000+0800)/,0
471027696,好玩没得说，缺点是人多，但也没什么办法。,/Date(1680406824000+0800)/,0
28448825,不虚此行吧 主要是查查特别棒 特别负责 点个赞,/Date(1676794889000+0800)/,0
474841733,不会滑雪可别做缆车到山顶，从那划下来要命,/Date(1675317659000+0800)/,0
202429805,"到南山滑雪场公众号订票，夜场+往返大巴合计290+58元，比携程便宜太多
我踩坑了，在携程订了夜场一日游，当天上午才告诉我不能成团，要我改到第二天出行。但我第二天又有行程了，无法更改。所以自己打了个顺风车110元于下午3点多到达雪场，才发现夜场要6点半才能进去，白白冷风中吹了3个小时坐等（公众号有下午场+夜场票。但是携程没有），然后到处问返程车，才知道公众号可以订，而且一看往返才58",/Date(1674033474000+0800)/,2
851163,坐大巴有导游查*，提醒了很多重要事项。雪场设施很完备，教练讲得很好，两小时下来大人孩子在儿童障碍道上都能滑好了。带孩子四小时玩的刚刚好，还没玩够，有机会再来。,/Date(1675933061000+0800)/,0
117787868,导游会提醒新手注意事项，给一些意见，赞,/Date(1675522524000+0800)/,0
3985719,去的时候人很多很多，整个行程感觉还不错,/Date(1675301984000+0800)/,0
72672068,雪场很大，雪道雪质很好，配套设施齐全,/Date(1679498873000+0800)/,0
229389603,挺好，整体还是很不错的，玩得很开心,/Date(1675209520000+0800)/,0
459611701,行程紧凑，发车准时，滑雪体验很棒！,/Date(1672622469000+0800)/,0
476310252,导游渣渣非常负责，服务态度非常好,/Date(1676620865000+0800)/,0
28932029,很不错的一个地方，可以去试试看吧,/Date(1674662059000+0800)/,0
215543447,滑雪场很大，设备先进，很好,/Date(1676207304000+0800)/,0
470970791,大致不错，就是回程只有一站,/Date(1674635631000+0800)/,0
306619580,"北京周边比较好的滑雪场了，不过平日去更合适，省却排队的烦恼。初级道非常友好，对于初学着练习很好，魔毯运力足够。
中级道的缆车也不太排队，还会继续去！",/Date(1673437180000+0800)/,0
245124780,超级棒 雪道种类多 餐厅好吃,/Date(1676860115000+0800)/,0
482962559,导游查查很热心，好评！,/Date(1676537231000+0800)/,0
332554602,旅程很顺利，导游很周到,/Date(1675521902000+0800)/,0
332642126,小朱服务态度好！很好玩,/Date(1675521592000+0800)/,0
1657566,代人购票，感觉还好。,/Date(1680671530000+0800)/,0
379858005,行程紧凑，安排合理。,/Date(1675522190000+0800)/,0
182828760,雪道很棒，值得推荐。,/Date(1674979316000+0800)/,0
304794434,"【景色】雪景真美
【趣味】
【趣味】滑雪真爽",/Date(1671151260000+0800)/,1
42792067,愉快的旅程，超级好的导游，强调了很多安全提醒👍,/Date(1672302071000+0800)/,0
405471307,同行的查导游很热心，很负责，同时也很风趣，初次滑雪或是初到南山的朋友能得到很大的帮助,/Date(1675996289000+0800)/,0
235538660,玩的很开心，小查很热情，有机会还要来,/Date(1673339994000+0800)/,0
65498569,密云城边上不远，高速过去挺方便。,/Date(1673257523000+0800)/,0
304794434,"【景色】雪景真美
【趣味】滑雪真爽",/Date(1669594976000+0800)/,0
468012469,领队非常好，很负责（赞）！！！,/Date(1674030272000+0800)/,0
61873528,雪道比较多，人也比较多。玩得还行，请个教练是有必要的，下次再来。,/Date(1676073348000+0800)/,0
116198668,查查导游服务好，值得推荐,/Date(1673338723000+0800)/,0
478460528,非常开心的体验呀，导游小姐姐很贴心，推荐推荐，期待下次啦,/Date(1675519799000+0800)/,0
48699049,带孩子去还不错 雪场还行不太大 设施都够 评价稍晚 去年寒假去的,/Date(1674354561000+0800)/,0
198976331,第一次去，人不算多，山上的初级小s道还不错，适合初学者,/Date(1671983947000+0800)/,0
59360759,南山雪场的雪道比较多，有很多选择，玩得很开心。,/Date(1674178572000+0800)/,0
55401948,非常好，人也不多，玩的开心，领队人好又暖心,/Date(1672389908000+0800)/,0
5854975,方便快捷，人很多但管理還算有秩序。,/Date(1675505465000+0800)/,0
148863040,司机哥哥人超好！服务特别特别好,/Date(1673101760000+0800)/,0
68643572,"真是太大了，玩的真过瘾
就是坐缆车排队
有机会还会去
我是从山东去的呢",/Date(1674185241000+0800)/,0
4451461,南山是本人第一个二刷的滑雪场，设施和专业程度确实在北京属于领先。,/Date(1673341079000+0800)/,0
205234175,小王导游非常棒，行程满意,/Date(1672559299000+0800)/,0
4096460,今天去了西中级道，很好玩，好像也是最长的雪道吧,/Date(1673245040000+0800)/,0
2743514,不错，硬件好，重新维护了，人气爆棚，值得推荐,/Date(1673149541000+0800)/,0
251270891,小王导游真不错，提醒安排妥当，很好很好,/Date(1672559313000+0800)/,0
18882351,整体还是挺大的就是没有适合的中级道要么太猛，要么太初级，不高不低中级没合适的,/Date(1676589085000+0800)/,0
206601976,这个行程超级棒！！导游非常不错！！！,/Date(1673099386000+0800)/,0
67420368,南山雪场应该是北京雪场雪最好的了吧,/Date(1674046007000+0800)/,0
289736753,领队很认真负责，车也是准时准点出发,/Date(1672394999000+0800)/,0
77414539,冬奥会时去南山滑雪场，恰逢谷爱凌夺金，当时确认感觉到体育精神的感染性，雪场很多滑道，适合各类人群，俩孩子也在初级道学会了的基本下坡动作，以后有就会还回去。,/Date(1664196849000+0800)/,0
238273704,借雪具处大叔服务态度极差，体验感极差！建议适当培训！给北京人丢脸！,/Date(1675766102000+0800)/,0
331073637,领导跳跳很好，讲解很详细～,/Date(1673855713000+0800)/,0
459614961,总体还可以，没遇到什么坑,/Date(1673241336000+0800)/,0
165226708,小王导游很棒！非常满意！,/Date(1672559271000+0800)/,0
94625107,领队人很好，出发很准时！,/Date(1672301576000+0800)/,0
3310810,好好好好好好好好好好,/Date(1673934067000+0800)/,0
69388016,管雪具的服务员们服务态度极差。滑雪场是还好。,/Date(1674944353000+0800)/,0
2903531,第一次去南山，以前都去的张家口。雪场关闭前最后三天去的，除了温度太高雪化了冰场太滑摔个半死，其他都ok◦°˚\☺️/˚°◦,/Date(1661537223000+0800)/,0
21958175,"南山滑雪场据说是北京最好最专业的滑雪场，我和孩子都感觉挺好。
今年不让出京，一个雪季都泡在了南山，因为它的租赁单板还比较新，雪质挺好，摔了没有那么疼。雪道比较丰富，滑行感也不错，夜场灯也很亮。雪场各个饭馆的饭菜都很好吃，烤肠和烤鱼丸最好吃。
南山的滑雪教练真不行啊，我和孩子们试过好几位，雪季初他们还接受一对一，春节以后只接受一对三以上，就想同样的时间多赚点钱呗。而且雪场的教练专门挑第一次去的新手教课，轻松好忽悠吧，我们第一次就被忽悠了。每次教课时间都不满，差个5-10分钟就下课，号称再来一趟时间来不及，无非就是着急去接新活。授课水平就更想吐槽了，只碰到过一位靠谱的教练，其它的都是越讲越糊涂，水平太差了。反正找了三次以后再也不请南山雪场的教练了。
对了，南山有个最贴心的地方，就是它有加热可换塑料袋的马桶垫，每个卫生间都挺干净，阿姨一直在打扫，这点很靠谱，很重要。
如果问我明年去哪里滑雪，北京必须去南山啊！",/Date(1645894623000+0800)/,4
67420368,北京的滑雪场南山还不错，每年冬天都会带孩子去好多趟，今年依然还会再去,/Date(1665028940000+0800)/,0
17793100,第一次南山滑雪，安排的还算有条理，服务人员也很专业。下次可以再来,/Date(1661394574000+0800)/,0
47248816,北京市区最好的滑雪场，所以最大的缺点就是人多,/Date(1662213458000+0800)/,0
49566365,"优点：离北京近，服务不错，雪道还行
缺点：人多，现在部分停车场不由分说不让停，里面的餐厅开始明显敷衍
周末人多",/Date(1663833509000+0800)/,0
262565190,去年去的，真心不错，做都游巴士去的我们一行三人，到店后马上联系对接人，办理入园手续，很快就办好了，滑雪用具按需要领取，租个柜子放包包即可，人不多，缆车等一会才来，其他还好。玩的非常尽兴。,/Date(1628057770000+0800)/,2
171367543,赶上最后一天，明天就停业了。南山真好，之前都不好约票。人太多。今天人少，都不怎么用排队，并且终于上了中级道。😃再见冬雪❄️,/Date(1646298504000+0800)/,0
182239661,棒棒棒，二宝学会了滑雪，渴了喝个咖啡和矿泉水，就是矿泉水有点小贵，饿了吃个套餐，味道好吃😋，雪质也好，雪鞋也不臭不湿，硬件服务也好👌👌👌，雪服即好看也干净，适🈴️初学者，***,/Date(1659184222000+0800)/,0
