262602413,"❀元旦假期，跟着&amp;#128652;都游巴士&amp;#128652;打卡慕田峪长城！
集文化遗产、万里长城、说走就走、最美秋色、不到长城非好汉于一身的可能就是#慕田峪长城#了！也可能是我对其情有独钟吧~这次虽然没能赶上秋天，但是冬天更加萧瑟的长城似乎更有魅力！反正我们是玩的很开心！
&amp;#128308;最新攻略！！！
&amp;#128652;交通：强烈推荐都游巴士直通车！这个是在亮马桥C口发车一站直达慕田峪长城的，特别方便，运营的很成熟到了慕田峪连摆渡车都不用坐，大巴车直接就能开进去，又省了一笔钱哈哈哈~而且都游巴士还有独立的休息区和餐厅，还能享受超优惠的价格，味道好价格又实惠，完全不用担心吃饭的问题！
&amp;#127915;门票：慕田峪长城的门票是40元/人，学生或者老人持有效证件还可以享受优惠价格，这个不清楚的话完全可以在都游巴士直接预订车费加门票的套餐，他们全都可以搞定，或者在路上的时候再让导游帮忙买票，非常方便。
✌我的行程安排：➡提前一天预订了都游巴士直通车，今天就直接到上车点就好了。到的比较早，看到附近有kfc，就进去吃了个早餐为今天蓄力。(*^▽^*)➡一站长城，大概是1个小时，我们就到了长城脚下啦。在这里上了个卫生间。我们就坐着原巴士继续上山。（不用排队坐景区摆渡车的感觉为今天的满足加了十分！）
➡在停车场步行到山上检票口的这200米，有个中华梦石城 。很好奇“梦石城“是什么呢？于是回来百度了下：它荟萃全国奇石二万多方，是“中国奇石收藏家”的活动基地。
➡这次主要是来爬长城，不想耗费体力在爬山上。于是我们就坐了缆车上来。这次很幸运的遇到了西藏第十七世活佛坐过的缆车，还有外国首脑坐过的哦，这个就是碰碰运气啦！
➡没过几分钟，我们就到了14号烽火台，正式的长城之旅这就要开始了！穿过一个小口，就可以开始爬了，往西走就是20号最高烽火台了，往东走就是数字小的烽火台，千万不要走错啦！
➡在这里就能看到远方的山上的字，那就是“忠于毛主席”了。大家都在这拍照留念。接下来就能看到留着多国语言的涂鸦墙了。大家都到此一游了，这也是唯一一个长城官方允许涂鸦的地方了。不过大家还是尽量游就好了，莫留痕。
➡一路走过来，人少是真的没话说。就爱这样的长城，宠他！明朝是最后一个大修长城的朝代，今天人们所看到的长城多是此时修筑。慢慢向上爬，身体也越来越热。所以穿衣服时候也要注意哦。虽然是冬天也不用穿太多！
再上一些美图吧~长城还是要自己来的哦，亲身经历的慕田峪长城的冬天，会是你不会忘的记忆！",/Date(1609827198000+0800)/,213
262602459,北京2020年的第一场雪，也是我第一次来爬长城，果然是国家5A级风景区！&amp;#128652;&amp;#128652;&amp;#128652;交通：提前一天在网上订的都游巴士的大巴车，这个很方便，就是往返的大巴，不用跟团走。第二天直接到集合点集合就行了。⏲⏲⏲慕田峪长城最美的时候应该是秋天，看网上其他人发的满山红叶的图片很好看，很可惜这次没有赶上，到了冬天才来。&amp;#128170;&amp;#128170;&amp;#128170;推荐路线：直接购买缆车往返的套票，直接坐到14号烽火台，再自己爬14-20号烽火台，这一段爬起来比较有意思。如果想爬的更多一点，可以买索道和滑道的套票，这是到6号烽火台的，尤其是滑道，滑过的人都说好玩！这次我没有体验，下次来一定要试试！20号烽火台就是最高的位置了，最后那一层的台阶尤其难爬，坡度特别大，非常有挑战性，如果有老人或者很小的小朋友，最好就不要尝试最后一段了哦,/Date(1609206936000+0800)/,178
262595198,第一次来北京怎么能不爬长城，做了攻略选择了慕田峪，因为人没那么多！报了个一日游的团，其实也不算是一日游，就是往返的大巴和门票服务，非常适合我这种不想跟着团走交通又不方便的&amp;#128514;正好赶上红叶节，特意坐着缆车上去的，风景特别好，非常壮观，就是人比我想象的多一点，车上导游姐姐说因为慕田峪长城最好看的季节就是秋天，又正好是红叶节，所以人比较多。缆车直接到了16号烽火台，对于我这种第一次爬长城还带着老人的非常合适，因为到20号烽火台很近了，一路上走走停停拍拍照很快就到了，不累人，路也好走，只有最后一个比较陡，建议带一点小零食，累了还能补充一下体力。,/Date(1609126316000+0800)/,73
262595092,"第一次来北京的朋友，故宫天安门那是必打卡的地方，长城也是其中一个~但长城有八达岭长城、箭扣长城、居庸关长城、慕田峪长城，为什么选慕田峪长城，作为一个爬过N次长城的爱好者，在这里和大家分享一下我的一些经验和攻略~
&amp;#128204;重点内容速览
1、目的地：慕田峪长城（位于 怀柔 ）。
2、怎么去：乘坐都游巴士，一站直达慕田峪长城。
3、怎么玩：乘坐英国前总统乘坐过的箱式缆车（这个缆车随机的，看运气），到14号敌楼。14-20号敌楼是慕田峪长城的精华线路。
这里你会途径的景点：慕田峪长城5A景区景点石、涂鸦墙（唯一一个可以让游客涂鸦的长城段）、非诚勿扰二取景地、“忠于毛主席”的字在山上、开放段最高点20号敌楼、未开放长城。
4、玩多久：建议平均游玩2-3小时，根据个人体力决定。
5、怎么吃：建议带一些零食和水在长城上补充体力。
下来以后在都游巴士专属用餐区就餐，还可以享受25元一位的5折优惠，菜品丰富菜量大，味道也很好。
❓长城之中，为什么选慕田峪？
居庸关VS慕田峪长城：居庸关是新修的，距离短。推荐慕田峪长城
箭扣长城VS慕田峪长城：箭扣长城建于奇峰断崖之上，山势险要。不建议和家人老人小孩去爬。推荐慕田峪长城。
八达岭长城VS慕田峪长城：两个长城都是精华段，但在旺季八达岭人挤人，无景可言。推荐慕田峪长城。
每段长城都有其精华和可取的点，但综合比较，优先推荐慕田峪长城。",/Date(1609124261000+0800)/,75
262594949,"&amp;#128512;想必大家都知道八达岭长城，因为什么呢？
都知道人太多了，尤其各大假期，真的是人挤人，上了长城真的是一点旅游体验没有，鞋都容易挤丢了，还容易发生事故，八达岭八个翁城口旺季最多的时候80000多人。
&amp;#128512;那慕田峪怎么样呢？
慕田峪一共开放20个烽火台，旅游旺季的时候会达到20000多人，一看数字想必大家就知道差距了，而且慕田峪长城开放距离长，更容易将人流分散开，根本不会造成八达岭那种“壮观”场面。在游览时间充裕的情况下，还可以游览20号烽火台之后的“野长城箭扣”风景。
这次坐着全网好评最多的都游巴士来了趟慕田峪长城，真的不虚此行呀，非常的震撼。也要给都游巴士的工作人员点赞，我们是在都游巴士公众号上定的，很快就有人联系我们，一路也非常顺畅，到了慕田峪长城，玩的很开心，拍了很多美美的照片，下来就在他们的用餐区吃的饭，我们还可以享受半价优惠，25元一位吃的超级好！开心~~&amp;#183;",/Date(1608801107000+0800)/,51
262594958,"慕田峪长城成为“网红长城”，不是浪得虚名！去了一趟慕田峪长城，就喜欢上它了！不到长城非好汉去，不过想当“聪明的好汉”，就选择慕田峪长城吧！综合指数高。每个人都能找到自己喜欢的一盘菜！
&amp;#127807;喜欢美景的，慕田峪长城秀美之最，真不是浪得虚名，外国总统爱来的地方，想必肯定差不了。
&amp;#127807;喜欢清净的，慕田峪长城人不多，不用让你顶着别人的屁股爬长城。
&amp;#127807;喜欢徒步的，开放20个烽火台，足足是八达岭长城的两倍！
&amp;#127807;喜欢古迹的，慕田峪长城不是那种“修复一新”的长城，保留了很美的“原生态”！
&amp;#127807;喜欢拍照的，14号敌楼（非诚勿扰拍摄地），20号敌楼（好汉坡），21-23号敌楼（野长城），绝对让你惊艳！
&amp;#127853;我的线路安排：
早7点乘坐“都游巴士”从亮马桥地铁站C口出发~~~
约8：30到达慕田峪长城~~~ 
乘坐缆车至14号敌楼~~~
非诚勿扰拍摄地打卡~~~ 
徒步从14号至第20号敌楼（好汉坡）登顶（1小时30分钟）~~~~
20号-23号敌楼，打卡慕田峪野长城（1小时）~~~
折返回至14号敌楼下山（1.5小时）~~~ 
都游巴士专属用餐区就餐，可以享受半价优惠哟~25元一位很划算（1小时） ~~~
下午2:30乘坐都游巴士回北京。~~~
全程长城游览时间大约4小时。",/Date(1608799782000+0800)/,49
262594939,这是我第二次爬慕田峪长城啦！登万里长城，做英雄好汉”对于每一位来北京观光的游客， 自然是少不了的重头戏。“ 北京爬长城”，妇孺皆知。然而“应该去哪一段长城”，则是一个学问。慕田峪长城，被世界权威旅游论坛评为“ 中国排名首位的万里长城”，在 北京诸段长城之中，享有“秀美之最”的美誉。深秋是造访慕田峪长城的最佳时节。层林浸染，枫叶起舞。对比八达岭的拥挤和过渡商业化，慕田峪长城则更显示出一份长城的古朴和安静，让人能够更多的感受到长城的历史沧桑。据考证，慕田峪长城在北齐年间就已经存在。在明朝，慕田峪长城得到了三次修建。第一次在明初由朱元璋手下大将徐达来督建，第二次是永乐年间建了慕田峪关，最后在隆庆年间对慕田峪长城进行了修建。这次选了一个好评最高的都游巴士直通车，在都游巴士公众号定的。他们的服务已经做到极致了，往返直通车、快速购买门票缆车票，免乘摆渡车，长城上有自己的都游巴士休息区，专门服务都游巴士的客人。这么良心的直通车值得更多人看到。主要是太方便了。,/Date(1608795055000+0800)/,45
262594954,&amp;#128205;位置：北京慕田峪长城位于北京市怀柔区，距离北京市中心70多公里，是我国AAAAA级风景区。&amp;#128663;交通：慕田峪长城没有直达的公交车，坐公交的话需要到怀柔倒车，在交通上不是很方便，现在有了都游巴士直通车就方便了很多，亮马桥地铁站发车，一站直达慕田峪长城，连摆渡车都不用坐，直接开上山上停车场，每天发两班车，在都游巴士同名公众号就可以预定。❄景点：非诚勿扰2拍摄地点；正关台；大角楼；历史遗留下来的界碑；还有没有修缮过的古长城。现在虽然是冬季，慕田峪长城的风景依然十分壮阔，比起夏季的秀美，现在更加庄严了几分。,/Date(1608792533000+0800)/,44
262606679,第一次来北京玩，就想着一定要爬长城！做了很多攻略最后选择了慕田峪，果然没有让我失望！虽然已经过了夏秋两个季节，也看不到红叶了，但整体还是非常壮观，我是坐都游巴士直通车去的，听车上导游说每年到了冬季去爬长城的人就会少很多，果然是这样。下次可以赶在夏天来，应该会更美,/Date(1608690830000+0800)/,36
261393855,"真没想到！冬天打卡北京，竟然还能偶遇“ 北京 蓝” 北京 的天气真的好好好好

在 北京 的第四天去了慕田峪长城，在去的之前一直纠结要去八达岭长城还是慕田峪长城，后来看到有人推荐去慕田峪长城，人少还可以看到长城的壮丽，最后还是决定去了慕田峪长城。
❤交通：预定了巴士达Busda，我是在前一天晚上十一点多的时候才预定的，竟然早上8点和10点的都可以选，为了睡会懒觉，选择了早上10点的班，刚预定完客服电话就打过来了，客服超级好人，还提醒我要穿多穿衣服，天冷，出地铁站之前先去趟卫生间，记得穿舒适的鞋子，第二天在和平西桥地铁站B出口，看到绿马甲的工作人员过去询问就可以安排上车
⏰时间：因为人不多，大家都到的比较早，不到10点就发车了，大约在11:05的时候就到达了景区，一路畅通没有堵车～
💰费用：预约巴士达Busda往返车费80元/人，单程40元/人；景区门票40元/人；缆车往返120元/人，摆渡车票免费赠送
🙋导游：巴士达Busda的跟车导游真的超级棒，一路上给我们介绍长城的历史，下车后帮我们买门票与缆车票，给我们留足了时间在长城上游玩，下来后还在停车场等待我们，在回来的路上给我们介绍 北京 的各种美食
⛰️长城：我们选择的是乘坐缆车到14号烽火台，再从14号烽火台走到20号烽火台，时间大概花费了一个半钟，一路走走拍拍，下来的时候大概花费了一个小时
缆车🚠：缆车没有排队，我们是两个人就坐了一个车厢～。PS：可以选择乘坐索道上滑道下的方式，票价也是一样，但是只能到6号烽火台，然后再从6号爬到20号，会有点远，但是可以欣赏到更多美景呢
但是要记得带点补充能量的吃的啦，山上的东西好贵。
一路上的人真的很少很少，随便都能拍出很好看的照片，壮观景象。
以后有机会一定还会再去！这个季节的长城还是有点苍凉，争取以后夏天还要来一次。",/Date(1607393639000+0800)/,16
198128069,"八达岭长城在长城中最有名，在准备来 北京前还真不知道慕田峪长城，不过看了一些攻略普遍认为八达岭长城人太多而慕田峪长城人少景美，于是便选择游玩慕田峪这段长城。去慕田峪长城的直通车巴士达在和平西桥地铁站发车，宾馆就选在和平西桥地铁站附近，毕竟是要赶八点的早班车不要距离太远，巴士达还有中班车10点的，我们想早点过去就选了早班车。
我们到地铁站，很快就上车了。每辆车设有一名导游，服务讲解，帮忙买门票、缆车票，介绍慕田峪长城的游玩攻略和一些注意事项，时间过得很快，不知不觉就到长城了。一路 上高 速，大概1小时5分钟到的。导游把所有人带到景区休息区休息，然后买好票发给大家，直接去坐摆渡车即可，5小时都是自由时间了。步行十分钟到缆车下站,要求大家下午两点钟集合，可以去旁边的农家餐馆吃饭，三点发车。
 
慕田峪长城商业街有很多餐厅，有汉堡王、翼松楼餐厅、馅老满等等，用餐还是很方便的。对了，巴士达的客人有专属折扣的，这点很不错，我们是去吃的馅老满，推荐胡萝卜馅的水饺，很好吃。
 
慕田峪长城冬天人还是不多，到处都可以拍到高清大片，雪落在长城上还是颇有一番韵味的。
 
还遇到了长城原遗址炮筒，像在诉说着些很久以前的故事
 
一路往上走，14-17号敌楼还是坡度比较缓，游览起来较舒适。
 
坐缆车到14号敌楼，就能看到这个5A级景区的石头，很多游客会在这里合影拍照。
 
还有非诚勿扰二的取景拍摄地，果断打卡!
 
游览差不多了，我们就坐缆车下来了，想起毛主席的诗：
北国风光，千里冰封，万里雪飘。 
望长城内外，惟余莽莽；大河上下，顿失滔滔。 
山舞银蛇，原驰蜡象，欲与天公试比高。 
好一种豪迈之情，冬 天长 城确实依然震撼！
回程在车上，导游给我们介绍了 北京 好吃的几处，同时也介绍了下车点的附近交通方式，非常舒服的一次长城之旅。巴士达这个直通车也确实很棒，往返直达，下次来还会选择。
有机会一定要去次慕田峪长城，值得！",/Date(1606790387000+0800)/,21
49798281,"初冬赏雪—慕田峪长城
【景点攻略】仙境慕田峪长城
详细地址：北京市怀柔区渤海镇慕田峪村
 🚗交通攻略：选择巴士达Busda直通车，地铁五号线和平西桥站B出口集合登车，中途不停车，一站直达慕田峪小镇。 
🕙开放时间：07:30~17:30
 💰门票价格：40.00元
 🌟亮点特色：三种登山方式，①徒步，②缆车往返14号烽火台，③索道上6号烽火台，下乘可选择索道或者滑道，biu~biu~ 

小Tips：北京的初冬，气候稍寒，慕田峪长城赶第一场初雪，阳光明媚，仙气依存，是为中外游客所追捧的“银雪北京”。赶个周末，赏雪佳境。",/Date(1606448367000+0800)/,33
211424042,慕田峪长城美腻美腻的景色，来一次都不够，10.00的巴士达Busda直通车方便快捷，长城上吃了美美的汉堡王，🍔，巴士达客人还有折扣，美哉美哉，吃饱喝足，开爬，直到夕阳西下，在雪中前行，忘却了所有的烦恼和忧愁，慕田峪的风景四季如画，有过了冬日的初雪，期待着春日的暖风下次还来！,/Date(1606266681000+0800)/,44
268830508,"金秋🍁坐巴士达Busda🚌打卡慕田峪长城！❤

又到了一年一度的金秋时节，老舍先生说，北平之秋就是人间的天堂，也许比天堂更繁荣一点呢！

秋天的慕田峪长城是五彩缤纷，树叶黄了，枫叶红了🍁，五色群山掩映着蜿蜒在山巅上的长城，更显得有韵味。

中秋前后是北京最美丽的时候。天气正好不冷不热，天高云淡，秋风送爽！

慕田峪长城有巴士达Busda直达，对于我们这种爱溜达的人非常友好，省时间，纯玩无推销，运气好还碰到了好看的导游小哥哥，吼吼，开心

以往秋季都是去香山公园赏红叶，今年计划去慕田峪长城。香山人真的太多了，每次也没看到太美的景，就是跟着人流溜达一圈。

这次慕田峪之行比想象中的更好，订的巴士达Busda早班车去的，8点准时发车，下午两点多开始回程了，车比较多，满一车就走一波人，一点不耽误，点赞点赞！！！下午回程的时候其实景区人还挺多了，还好订的早班。

长城上已经硕果累累了，颜色还没有太突出，估计还没到最美的时候，但已经能看到清晰的色块了，非常美腻。登高俯瞰的感觉简直不要太棒呆！

来慕田峪长城赏秋绝对是明智之选！",/Date(1606264103000+0800)/,34
268824110,"大家都知道不到长城非好汉的八达岭长城，但是慕田峪长城鲜为人知，因为大家认为交通不便，而且知名度低，所以一直冷落了这段长城。慕田峪长城位于北京市怀柔区，始建于南北朝时期-北齐，明初徐达在原有长城遗址的基础上修建完成。有“万里长城慕田峪独秀”的美称。
 
交通：前往景区的直通车，巴士达Busda

发车地点：和平西桥地铁站B口，车程1小时。
 
登城方式：
1. 徒步：慕田峪与八达岭不同，慕田峪需要爬一段比较陡的山才能真正的登上长城，而八达岭不用爬山。大概用时1小时才能看到长城，对体力和耐心都是一个极大的挑战呢。
2. 缆车：直接缆车到第14号烽火台，然后从14开始向终点开路，是最省心省力的一种方式，老少皆宜。当然也可以买个单程的缆车和一个单程的滑道，缆车上去到14烽火台，然后下来走到6号烽火台滑滑道下来，非常非常好玩。

爬完长城去翼松楼餐厅吃一顿，喝个啤酒🍺，美哉。
 
注意事项：
1. 务必穿运动鞋，不要穿高跟鞋凉鞋，不然脚会痛。
2. 夏天务必注意防晒，长城上面没有什么阴凉的地方，很热。
3. 坐摆渡直接到登城口，可以节省很多时间。",/Date(1600320485000+0800)/,42
268829845,家里神兽放暑假了，带她来北京玩。想着让她看看长城，感受下。在八达岭和慕田峪中对比了下，最终选择了慕田峪，看大家都说要平缓一些。从慕田峪官网看到推荐的巴士达Busda直达车，来回才80块。 还是比较划算的。让人没想到的是80块竟然有这样的优质服务：刚提交订单，巴士达Busda工作人员就马上发短信打电话告知第二天上车时间和游玩注意事项，让人感觉很贴心。 今天到上车约定地点，正好是地铁口，很方便，而且是一辆很新的宇通50+大巴。现在是疫情期间，只有20来位游客，老板也是赔钱赚吆喝，我们一帮人也是赚了大便宜了。导游也没有因为人少就降低服务，一路上不辞辛苦的讲解。👍👍 到了景区门口，导游亲自去给我们买票，我们几个是免票的。 这里绿化真的很好，周围山峦叠嶂，烟雾缭绕。古长城保存的更完好，修葺痕迹更少。这可能也是吸引外国友人的最主要原因。 慕田峪长城有索道至6号烽火台，缆车到14号烽火台，滑道可由6号下山。整个慕田峪长城供可游玩的是1到20号烽火台，这里没有烽火戏诸侯，但也是一楼一景，各不相同。 我们是坐缆车往返的，大人120块钱，小朋友1.4以下的是半价。带着小孩子的还是建议坐缆车🚡的。,/Date(1595237419000+0800)/,38
268831103,"终于对慕田峪拔草了，不容易。想着慕田峪一游蠢蠢欲动的心已久，之前因为疫情一直不太敢出，加上来回倒腾公交车，不想动弹。
 
最近疫情好多了，便和家人一起决定去看看。我们乘坐的是赞巴士直通车，发车点在和平西桥地铁站B口，大约1个小时10分钟到达长城景区。车上没有几个人，大家都自觉带口罩，上车前测体温，查健康码。我们直接在车上订的门票，这样还可以省去摆渡车钱，赞巴士的随车工作人员张宇很热情，很认真地给我们介绍怎么游长城。车上1小时，一直在讲，穿插小故事，也是很棒了。


我们乘坐的缆车，几分钟就到了14号烽火台。上到长城14号烽火台，美景就豁然到达眼前。何其壮观秀丽；加上温度适宜，游客不多，这次登长城的体验很不错。 接下来，一路向西直奔20号烽火台（最高点），幸好平常有跑步，体力还跟得上，全程没怎么停，到了20号烽火台，就被景区用墙拦住了，不让继续前行了，因为时间够，本来想去野长城看看，但是路被堵上了，也有人爬过去，但是我这不太行，单程差不多不到2个小时，然后原路返回，还去8号烽火台逛了逛，没体力了，就回到14号去坐缆车下山。 比八达岭少好多人呢~爬到山顶真是考验意志力啊！。",/Date(1594957107000+0800)/,36
11751013,"图一二三是金山岭长城，18年跑金山岭马拉松的时候
图四是黄花城水长城
图五六是八达岭长城
图七八九是慕田峪长城
先前也去过司马台长城，但是照片不知道放哪了～

各有各的特点，去每一个都不会让你遗憾而归～


💋第一次打卡长城建议还是选择慕田峪

首先人少，比八达岭人少太多了。
其次慕田峪相对八达岭的险峻来说，更秀气一些～爬起来简单，对于老幼都适合～
而且有缆车🚡有滑道都比较方便～
慕田峪就是19-20烽火台比较陡一些，其余都比较缓～
再就是慕田峪长城交通方便，和平西桥地铁站B口，有赞巴士直通车每天发车，比较方便，一小时十分钟就到景区，长城给5小时游玩，丝毫不耽误时间。

金山岭和黄花城说实话不太方便～但是金山岭爬起来刺激啊，嘿嘿～我还是最喜欢金山岭长城，就是金山岭长城已经属于河北，旅途较远～

黄花城水长城，顾名思义，水边～别有一番韵味～

司马台长城因为跟古北水镇挨在一起，所以也是比较好，但是额烽火台只有10个我记得，只有慕田峪的一半～

不管去哪，记得涂防晒啊，不然跟我这种紫外线过敏的，直接崩了～",/Date(1593587042000+0800)/,39
262585098,🚌巴士达Busda直通车去长城，慕田峪长城闻名中外，百闻不如一见，有幸亲自体验了一番，慕田峪长城风景以秀美著称，不是亲眼所见不知慕田峪之美。清晨怀着激动的心情来到和平西桥地铁站，🚌巴士达Busda直通车发车地点，一列整齐的首汽大巴车，好帅气的样子，刚想上车看到穿绿色马甲的工作人员，量量体温，看看健康码，这就扫码登车了。一路上有说有笑很快就到长城了，这个车离高速特别近，很方便，到了长城不用自己去买票，据说跟景区直接对接，反正票到手挺快的，拿着票二话不说，长城我来啦！坐上摆渡车，坐上缆车就直奔长城14号敌楼，登上长城的那一刻，那就是梦想成真的感觉，太棒👍了！,/Date(1592959270000+0800)/,17
