262602908,没踩雷，的确人少！但是我们已经错过了最美的时候了，没关系，明年再来！坐都游巴士直通车去的，听了导游小哥哥的建议选择了缆车上下，还挺轻松的，不是很累完全可以接受，打卡成功！,/Date(1609322318000+0800)/,16
306651999,之前去过八达岭，这次选择慕田峪，不错，人不多，体验感很好。集散中心的巴士很方便，推荐选择,/Date(1661237813000+0800)/,0
48315952,真是来值了，景区人少，景美～北京旅游集散中心的车很方便了～前门站上车，一站到景区内 车内导游还可以帮助买票 推荐的滑索孩子超级喜欢～,/Date(1657782914000+0800)/,0
86031643,"北京旅游集散中心,导游服务很好的，特别热情周到。",/Date(1646465373000+0800)/,0
328090285,所谓“不到长城非好汉”，来到北京就必须得到长城走一圈。在赞巴士上定的慕田峪长城，来回➕摆渡车➕门票，一共120元，性价比很不错。,/Date(1633940932000+0800)/,0
156056203,去慕田峪长城，提前在网上订的慕巴士，车直达长城超级方便，而且省心，人挺少的风景也很好👍家人玩的很开心，开心的旅途，特别表扬一下慕巴士小周服务特别好，有问题也很热心的帮忙解决，人太好了👍,/Date(1633933738000+0800)/,1
12769986,不到长城非好汉，今天终于带儿子爬长城做好汉!携程上购票方便，到景区不用取票，直接扫码进入。摆渡车，缆车（还坐的特没谱夫妇坐过的），登长城，一气呵成。,/Date(1628654592000+0800)/,1
198584649,北京旅游集散中心，车方便快捷，20票价很便宜，丁导服务态度很好，介绍很详细，慕田峪长城值得推荐！可以坐索道或者缆车上下，非常棒！,/Date(1626497511000+0800)/,0
228785897,乘坐赞巴士前往慕田峪。全程贴心服务，为游客考虑周到。有专用的休息区，全程无其他购物。推荐,/Date(1626330268000+0800)/,0
190435782,赞巴士服务周到，提供全面旅游信息和旅游线路，帮忙购票，让我们来慕田峪长城之游超方便。而且，下山有休息区，有儿童阅读区，确实很赞！,/Date(1624945111000+0800)/,0
324811411,赞巴士🚌真的很赞 完全没有隐形消费 帮着买票 虽然下雨了但是丝毫不影响美景 随车人员很nice 全程很负责 摆渡也很方便总之很满意推荐推荐,/Date(1623221252000+0800)/,0
288950537,"慕田峪长城太美了，真值清明假期，山上杏花遍野！
去就选乘赞巴士吧！方便，服务贼好，有耐心！",/Date(1617521278000+0800)/,6
373060794,很好，长城上的风温暖凉爽，非常舒服，有一种云雾缭绕的感觉，美丽，只可惜是冬天，山上光秃秃的，不过有一种壮美的感觉，希望下次再来,/Date(1641537436000+0800)/,0
113664888,赞巴士很棒，全程无购物，导游小哥哥小姐姐服务很好，很难忘的一次长城之旅，离开北京的最后一站，很愉快，下次来还会继续选择赞巴士。,/Date(1626423203000+0800)/,0
308137485,"许导很认真负责 我打了好几个电话 都认真回答 不嫌烦 很欣慰
说来的车也来接了 就很安心 
长城很好玩 推荐先爬1-6号楼 天很好
北京旅游集散中心",/Date(1625817170000+0800)/,0
113866827,慕田峪长城风景很美，人也很少，喜欢刺激的可以使用索道上滑道下。出行选择赞巴士的，消费透明，上车即高速，1小时左右就能到，很赞！,/Date(1620204179000+0800)/,0
387491487,北京旅游集散中心，车费往返40元，又方便又给力，一站直达景区，服务也很好！推荐推荐哦,/Date(1646469889000+0800)/,0
92668082,北京旅游集散中心很靠谱大巴车很方便导游很热情很贴心很棒的一次旅行,/Date(1631088537000+0800)/,3
20032323,北京旅游集散中心在前门地铁站台附近上车方便，往返40块价格实惠划算，不浪费周转时间，直达景区入口，不排队。丁导热情周到。推荐,/Date(1627890474000+0800)/,0
151285478,今天带女儿乘坐赞巴士来打卡慕田峪长城，赞巴士服务周到，讲解详细，体验感很好。游览长城的天气小雨有雾，很凉爽，像是来到了仙境。,/Date(1624600123000+0800)/,0
294391787,北京集散旅游中心线路合理，服务热情，好评！,/Date(1660372771000+0800)/,0
415584099,旅游车挺方便，在芍药居地铁站集合。直接到山脚下，节约不少时间。慕田峪长城景色不错。,/Date(1660201398000+0800)/,0
345163784,北京旅游集散中心的旅游大巴特别舒服，导游小姐姐讲解全面，内容生动有趣，慕田峪长城景色非常美，值得游览。非常推荐慕田峪长城！,/Date(1658472322000+0800)/,0
326910977,北京旅游集散中心直达车，很方便，出行体验好，直达检票口，推荐！,/Date(1649489191000+0800)/,1
42125466,北京旅游集散中心，直达车很方便快捷，导游服务态度超好，值得推荐,/Date(1649146547000+0800)/,1
11436511,北京旅游集散中心大巴车特别棒～ ！一站直达服务超级棒 ！慕田峪本身很值得一览，有了大巴车 让你跟美丽的景色的接触更加轻松和方便！,/Date(1635145280000+0800)/,0
63049192,慕田峪长城风景很好，我在北京游客集散中心前门那里直接乘车，40往返，往返车批次发班，随到随走，中间还经停水立方，很方便。导游讲解很热情，车上还可以买门票和缆车票。,/Date(1633332806000+0800)/,0
173246673,慕名已久的长城终于来啦！新的体验，好玩！就是下雨了游玩时间减少了，其他都很满意。预约了赞巴士，过来很方便，导游也很贴心👍,/Date(1633253786000+0800)/,0
80399797,预定的赞巴士，一站直达，带着父母二老出来很省心，车程不累，到了景区也没有多余的消费这些烦心事，重要的是慕田峪长城景色一绝！,/Date(1633250049000+0800)/,0
348001177,预订的赞巴士，会有专门的客服人员联系，地铁集合，来回接送，还可以赠送摆渡车。全程服务特别有耐心，点赞！游长城，就找赞巴士。,/Date(1627706684000+0800)/,0
273366400,赞巴士非常不错、一路的讲解到位、服务周到。工作人员很细心。结束了一天的行程，打到回府。希望下次有机会再来的话还是选赞巴士。,/Date(1626423046000+0800)/,0
343117084,北京旅游集散中心车很方便，不用换成摆渡车，丁导服务水平更是值得一赞，强烈推荐！点赞,/Date(1626415760000+0800)/,0
119529345,赞巴士很体贴，提前一晚打电话通知，导游也热情负责，全程没有购物，有专有休息站，可以租拐杖和接热水，长城路线也介绍全面，很赞,/Date(1626330311000+0800)/,0
16250099,"慕田峪长城5A级风景区，人少又好玩，缆车上去，滑道下来很刺激,最后爬上20号敌楼到终点！不错很好，下次再来！大家很喜欢！！",/Date(1625207132000+0800)/,0
335175764,北京旅游集散中心价格不贵，往返都有导游沿路讲解，到景区后出现任何问题还帮忙解决！很贴心的一段旅程，建议去长城选择集散中心！,/Date(1624259606000+0800)/,0
84157819,"景色不错，有趣好玩，性价比高，总体超赞，景色宜人，交通便利，服务很好，值得一游

景区最高点也有卖冰棍的，卖水的，卖纪念品的。",/Date(1623630750000+0800)/,0
82366707,玩的非常开心，慕巴士服务也非常到位，全程比较省心，第一次游玩的可以选择，爬完长城可以在慕巴士据点歇息。,/Date(1619500738000+0800)/,1
186702162,国家级5A景区，山景风光无限，层峦叠嶂，绿树环抱，尤其是秋季是这里最靓丽的季节，加上雄伟壮观的长城，构成一道靓丽的风景线。,/Date(1614688953000+0800)/,0
418583021,可以现场买门票，但是注意明信片门票可以选择打印照片，有25，9块9，不打印三种价位。目前仅开放至20号敌楼。17~18号敌楼和20号敌楼有商贩。景区提供免费WiFi，网速只有几兆。爬长城的过程中有很多虫，有几率可以见到蛇。山脚下大多数商店都处于关门状态，长城雪糕建议在步行街临近出口处购买，雪糕越靠外越便宜。缆车上站还有付费望远镜。步行街有一家汉堡王还在营业，由于该餐厅是景区餐厅，导致优惠券无法使用，但会员可以积分。容易饿的建议提前买些汉堡垫底，景区汉堡王价格在30~50价位不等，性价比不高。,/Date(1661169993000+0800)/,0
90584670,周六突然想去长城玩一下，晚上看了看慕田峪的攻略，于是在携程定了周日早上的往返交通专线票，省去了其他公共交通换乘的麻烦，很方便。早上九点前门出发下午三点半返程。车上工作人员王老师很热情，耐心讲解购票方法和游行路线，圆满完成了长城打卡的目标。,/Date(1661068011000+0800)/,0
13064549,"北京慕田峪长城，是历史的见证。在历史的长河中，它曾是抵御外敌的屏障。而在现在的太平盛世，和谐社会当中，是有着历史底蕴的风景名胜区。时光荏苒，长城仍在，静静地诉说着它的前世今生！
【景色】雄伟壮观
【趣味】十分有趣
【性价比】非常高",/Date(1647590581000+0800)/,0
192890312,"秋天的到来，
漫山红叶映衬着蜿蜒的城墙放眼远眺，
美如一幅绚丽多彩的油画~不到长城非好汉，
不来慕田峪会留遗憾！
推荐北京旅游集散中心直通车，
看过升旗的朋友直接走到前门大栅栏旁就看到了。
车子直接到达景区无需换乘摆渡车，
还有免费存包处和服务区",/Date(1642582848000+0800)/,2
334961775,慕田峪长城是一个和八达岭长城不大一样的体验，人少，精致。尤其值得一提的是，非常推荐，性价比高，服务很好，体验很棒，微信搜索北京旅游集散中心的公众号购买的一北京旅游集散中心直通车一往返车费40元，服务特别好,/Date(1642232965000+0800)/,2
150355847,这个周末过得太充实了，和闺蜜一起坐着大巴车来到了期盼已久的慕田峪长城，正好赶上了下雪，虽然有点小冷，但也是值得，景色太美了，像幅画一样！另外说下，这个大巴车很方便，就在前门步行街路口，车费每人40管往返，到达景区不用再换乘摆渡车，我是索道上，滑道下，自己爬了6号到1号敌楼，刺激！,/Date(1641717294000+0800)/,2
192890312,慕田峪长城比起八达岭长城的人山人海，这里人少！在这里，你可以很轻松就拍出背后无人入境的美照。由于慕田峪长城距北京市区73公里，选择一日游会让你的行程更加轻松。曾经英国首相梅杰，美国的前总统克林顿等多位外国首脑等曾到慕田峪游玩，可能都知道这里足够清静。慕田峪长城，就是电影《非诚勿扰2》里葛优向舒淇求婚的地方。🎉🎉心动了吧！👉赶紧前门集散中心直通车，车程一个多小时就到了，👍全程无购物，往返车费40元太便宜了，走起🎈🎈,/Date(1637843836000+0800)/,2
163066573,作为居住在北京的外地人，慕田峪真没少去，带家人带朋友每年至少去一次。以前开车太累、还限号。这下好了，北京旅游集散中心慕田峪直通车，前门、芍药居都有站点。早上8:30时间刚刚好去慕田峪，一站直达，无需换乘景区摆渡，很方便。爬完一天既锻炼身体还能放松心情。又是活力满满的一天,/Date(1637648742000+0800)/,2
333792360,"慕田峪行程安排很合理,车费往返40便宜，早上七点半到达前门 c 口的集散中心,直接找车牌号就行。路上导游很详细地讲了具体行程和路线,推荐了几个方案,最后选择了缆车上下。爬长城的过程中不断的感谢自己没选另外一个路线,不然体力还真的跟不上。最累的是登上20号敌的时候,很陡的台阶。很满意的一次行程",/Date(1637315363000+0800)/,2
9311136,睡到自然醒十点在芍药居地铁站上车，太适合我这个懒人了。北京集散中心这个车太方便了，回程下车的地方就是鸟巢水立方，打卡走起,/Date(1634625398000+0800)/,0
150355847,今天出来旅游乘坐北京旅游集散中心直达车，就在前门大栅拦步行街路口，特别好找，车身有慕田峪直通车字样，40元往返车费，门票摆渡滑道车上可以购买，比网上还便宜5块钱，最重要直接可以到景区，不用下车换乘，另外他们还可以免费提供寄存行李服务，还有热水提供，休息区，服务很到位，回程时间也自由，推荐大家选择！很正规没有隐形消费,/Date(1634541459000+0800)/,0
2991166,北京的慕田峪长城-----位于北京市怀柔区境内，距北京城区73公里。其历史悠久，文化灿烂，在中外享有“万里长城，慕田峪独秀”的美誉。景区内山峦叠嶂，植被覆盖率达90%以上。慕田峪长城全长5400米，是中国最长的长城，也是著名的北京十六景之一，国家AAAAA级旅游区。非常值得一去。,/Date(1633993235000+0800)/,2
363032875,这次爬慕田峪长城感受非常好，尽管天降毛毛细雨，长城上有雾，可是我还是走完了全程。同车的司机师傅和小许导游非常认真负责，一路讲解非常详细。一站式服务又方便又快捷，北京旅游集散中心非常好，回去会推荐给我的朋友们。,/Date(1633767071000+0800)/,0
348437558,来慕田峪长城可以来前门乘坐北京旅游集散中心，票价合适，可以直到慕田峪长城，十分方便快捷！慕田峪长城也很美啊啊啊啊非常喜欢,/Date(1627890791000+0800)/,0
6853808,门口也有自助的买票机器，也有二维码贴在那里也可以扫码买票，和携程的价格都是一样的。因为携程上有我的信息，所以我到了门口自助买票机，还是通过携程买了，因为方便。直接刷身份证就可以进去。门票不包括缆车，缆车120元需要另外买的。,/Date(1626265042000+0800)/,0
189283473,我是乘坐旅行集散中心来的，旅途中的风景都优美，小姐姐讲解很好，人也很漂亮，她是008号导游，司机师傅开车很稳，谢谢再见！,/Date(1624434627000+0800)/,0
29677835,以前曾经去过慕田峪，那时是没有摆渡车这个说法的。现在景区大门向外挪了3公里，便使得大部分人都要做往返30元的摆渡车。这点让人觉得坑。我们买的是连摆渡车和缆车一起的票，结果刚从摆渡车站出去就有个索道，搞得我们以为就那地方，结果被告知非一家公司。还需再往上爬好一段才能到缆车乘车点。好吧，继续走，标识不清晰，害我们一顿好找。但到了长城这些所有不愉快都烟消云散了，因为慕田峪长城确实很美，比八达岭要陡峭，登上去后心旷神怡。人也不是很多，所以感觉还是非常不错的。,/Date(1622422830000+0800)/,0
219338553,本来去北京爬长城是要去八达岭长城的但是没有提前买票预约，结果五一去了之后没票了预约不了了，只好选择慕田峪长城，不过也还不错，导游说慕田峪长城其实比八达岭好玩，因为开放了20个烽火台，八达岭没有这多，1-14号有缆车可以做，15-20就必须到步行爬了，爬到最后一个20号烽火台爬好汉坡已经累的不行了，最后上20号台的时候楼梯只能容纳1人通行，坡度得有60-70度了，大部分人上去都是手脚爬着上的，因为太陡了，下来的时候腿抖。总体来说玩的不错，,/Date(1622177539000+0800)/,0
88572933,风景漂亮，爬着也不累，很壮观，慕巴士安排合适，小周服务周到。,/Date(1622104182000+0800)/,1
317229510,全程体验很好，导游介绍很细，车上买的***车票，门票，缆车票，很方便，比网上预定还便宜，***去看看，人少，拍照好排，体验好,/Date(1622014514000+0800)/,0
262606883,京城之旅之慕田峪长城。第一次去北京玩，肯定要去爬一爬长城。之前一直在想爬八达岭还是慕田峪。之后问了北京的朋友说建议去慕田峪长城，不会让我失望的。听了他的建议就来了慕田峪长城，坐都游巴士过来的，也是朋友推荐。到了长城玩了滑道和缆车，站在长城的高处眺望崇山峻岭，在感叹的同时也深感中华文明之伟大！,/Date(1610350215000+0800)/,10
262606896,几次去北京都没有去长城，这次特地留了一天，选择了怀柔的慕田峪，没有什么别的原因，就是人少。朋友推荐坐都游巴士过去的，在亮马桥地铁站发车，一个小时多点到达，路上不堵车。我们是先在汉堡王吃了点东西才开始爬的，在午后阳光下登顶，天气很好，没有雾，一览无余，台阶会有些陡，但不算很难爬，爬完顶后缆车下去，算是挑战完了~,/Date(1610348483000+0800)/,12
262606843,交通：长城离市区较远，公共交通不便，根据网上的了解，选择了都游巴士，往返还是比较方便的。景点：由于带了老人，选择了比较节省体力的缆车上下，但即使坐缆车，爬到最后的烽火台也很累了。这次来没有赶上红叶季，还是有点遗憾的,/Date(1610345824000+0800)/,12
262606876,第一次来北京爬的还是著名的八达岭长城，之前以为只有那个长城，后来才知道万里长城是真的长，爬过的只是其中一段，这次初冬，打算再爬一次，做了做攻略才发现人少景美的长城其实是慕田峪，果断的定了个一日游套餐，是在都游巴士定的，也是在攻略里查到的几种去慕田峪的方式之一。到了才知道原来这里还是葛优和舒淇主演的非诚勿扰取景的地方，整体走一圈，虽然没有红叶绿叶可看了，但还是觉得风景很震撼，个人认为比八达岭长城要更值得去。,/Date(1610344439000+0800)/,14
262606874,我们选择了爬慕田峪长城，因为之前爬过八达岭，感觉人太多，这次就带孩子换到慕田峪长城，这里基本上都是外国团队来的多，国内游客也不少，但是还是没有八达岭人多。我们坐&amp;#128663;都游巴士去的，直接在车上买了往返滑道的票，上山索道送到6号口，剩下的就是自己爬了，有一段路特别窄，只能容下一个人过，而且18-20这一段路比较长，要走好远。整个下来接近2个小时左右把，孩子挺兴奋的，不到长城非好汉，到了长城腿发软&amp;#128514;旅游真是个体力活啊！,/Date(1610343578000+0800)/,14
262606760,交通：在亮马桥坐&amp;#128652;都游巴士可直达慕田峪长城脚下，车上会有导游给你介绍一些长城的信息，会推荐你几种爬长城的路线。我去的当天天气比较好，阳关很足，但是风也很大，边被吹边出汗&amp;#128514;下来坐的是滑车，100元一趟，嗖嗖嗖的就下去了，特别好玩，来了一定要体验一番，下次还想去！,/Date(1610096557000+0800)/,13
262606653,有机会一定要来体验一下，不累而且风景很震撼，古人真的是太厉害了！大家可以坐&amp;#128663;都游巴士直通车来，价格不贵很实惠，而且是包来回的，门票缆车票也可以一起搞定。车上有一个导游跟着走，一路上介绍了沿途的风景和有关长城的要点，告诉大家如何选择怎么爬长城，大概需要多少时间，爬长城的难度还有路线等，非常详尽。❗注意！现在北京爬长城，一定是要有绿码的！如果是爱运动的年轻人可以直接爬上去，如果是带了老人孩子，建议买缆车上下，虽然价格不便宜，但是还是超值的,/Date(1610089680000+0800)/,20
262607274,到北京就必须去长城&amp;#128512;，都说不到长城非好汉，今天我就做回女汉子&amp;#128513;&amp;#128513;&amp;#128513;从亮马桥C口坐都游巴士过去的，车程大概1个多小时，现在是淡季人不多，坐缆车上去的，本来想着坐滑道下来，结果滑道没有开&amp;#128557;&amp;#128557;&amp;#128557;，缆车坐到14号烽火台，后面就自己走上去的，但还可以不是很累，风景虽然没法跟秋天比，但是冬天也有冬天的感觉,/Date(1609829648000+0800)/,12
295321257,"乘坐的慕巴士直通车到的慕田峪长城，景区人不多，适合这个季节去游览，昨天去的慕巴士东四十条坐车，很专业很好找，出地铁50米就是大巴车。
         车里很干净，也会有随车讲解员，中英双语讲解长城故事。一切游览攻略，注意事项都讲的很清楚，并且帮大家订购了套票，价格很优惠，我们选择索道游览。长城上真的是包场，人好少啊，还有哥们小猫，据说是长城的守护者。看到沧桑雄伟的万里长城真的被震撼了，一次很好的体验感。
        总之慕田峪长城值得推荐，慕巴士直通车收藏了。",/Date(1609405501000+0800)/,4
262603005,上个月工作日去的慕田峪长城，果然工作日加上疫情的影响，去长城的人数锐减，空旷的长城更加雄伟壮观，而且也更加适合拍照。我是在  都游巴士  订的市区往返慕田峪的大巴，比较省时省力，11点左右到达目的地，领队提前在车上就帮忙买好了门票和往返缆车票。缆车单程大约5-10分钟，到达14号敌楼，，然后往上爬到最高处是20号敌楼，算上边爬边休息边拍照，这样往返下来大约是四个半小时，我体力一般加上拍照花了很长时间，所以耗时较长。11月的慕田峪长城已经没有什么红叶了，所以建议大家趁早去。,/Date(1609399651000+0800)/,12
262602979,虽然是北京人但是第一次来慕田峪长城，小时候只去过八达岭，印象中就是人山人海，担心慕田峪的人也多，特意提前了几天预定了都游巴士的大巴车，最早一班车去的，几乎没什么人。可能是因为天气太冷了吧，我去的时候是11月底了，基本上已经没有树叶了，但是好在天气给力，非常适合爬长城。虽然气温挺低的但是爬起来一点也不冷。返程的车停在了鸟巢附近，顺便就留念几张直接坐地铁回家了。一天时间玩的很开心，时间安排也非常合理，推荐。,/Date(1609391541000+0800)/,13
262602951,上次去北京登顶了八达岭长城，这次听说慕田峪人少景色更美就来这里了，提前预定了都游巴士直通车，在东直门地铁站C口坐的7点发的那一班，1个小时多点就到了。可以选择徒步登长城，或缆车到14号敌楼，或者索道到6号敌楼。因为都想体验一下，就选择缆车上到14号，再爬到20号，再走到6号坐滑道下来，这样是每人200元，因为缆车和滑道不是一家的所以不能按照往返120的价格买。北京已经进入初冬了，天气还是挺凉的，一定要注意保暖。回程的车大概是1点多发车的，时间还蛮充足的。,/Date(1609386751000+0800)/,13
262602974,俗话说，不到长城非好汉，慕田峪还是值得一去的，景色不错，冬天应该是没有其他季节更好看了，但是胜在人少，做好保暖措施也是可以来看一看的。去景区推荐都游巴士，来回比较方便，每天发两班车，到了点就走，到长城以后是自由游览，也就是不用跟团，挺好的，时间也充足，蛮划算的。,/Date(1609381456000+0800)/,12
262602892,以前总觉得爬长城人很多也很无趣，这次听了朋友的推荐，来到了慕田峪长城，跟想象中的完全不一样。我们是坐都游巴士来的，提前一天晚上才定下来的行程，好在都游巴士工作人员响应很快，第二天顺利出游！冬天算是淡季了，人比想象的要少很多，一点也不拥挤。我们选择的是索道上，滑道下，不得不说，滑道真是太好玩了，小朋友玩了一次还要再玩。站在长城上看这大好河山，真是让人赞叹祖国的美好！,/Date(1609377525000+0800)/,12
262602885,不到长城非好汉，哈哈，来北京必须要爬一次长城。据说慕田峪长城的人不多，所以就报了&amp;#128652;都游巴士一日游的团，来这边爬了。我们是坐缆车上去的，这边的长城不是很长，不过还是蛮陡峭的，爬的那天天气超好，风和日丽的，从长城望出去风景特别棒！,/Date(1609319467000+0800)/,16
262602833,因为一句“不到长城非好汉”，来一次北京就必须给安排上！交通：在亮马桥坐都游巴士过来非常方便，不用换乘摆渡车，领队还会负责买票，省心！推荐玩法：坐索道上去再坐滑道下来，这样靠自己爬的部分比较长，但是滑道超刺激！还有一种就是缆车上缆车下，这样爬的路程短，比较省力气。我是坐滑道下去的，你们就看自己选择啦！,/Date(1609318582000+0800)/,18
262601276,疫情期间，没有什么人来爬长城。环境非常好，古话说不到长城非好汉，如今到了长城才觉得古代人的智慧和建筑能力真是令人叹为观止。提前做了攻略坐都游巴士直通车去的，不用坐景区摆渡车，比较方便。冬天天气很冷，既然来爬长城建议还是靠自己爬，一是爬起来身上就暖和了，二是自己爬才比较有意义吧。这次体验非常好，希望有机会再来。,/Date(1609317756000+0800)/,17
