35587085,今天从市区的东四十条乘坐慕巴士，相比八达岭的雄奇，慕田峪显得更加古朴了一些，相比八达岭的人多，慕田峪显得人少了许多。今天车上工作人员小强服务很好。很详细的给我们介绍了慕田峪长城的特点和玩法，最主要的今天赶上下小雪，能够遇到长城的雪景，这个是很难得的。千里冰封，万里雪飘，引无数英雄竞折腰！雪中的长城令人惊奇！,/Date(1675929287000+0800)/,10
361564893,一片大美的慕田峪长城，我们从东四十条地铁站坐慕巴士过去的，起初打算用脚走完这段长城的，听完车上小强哥讲解攻略后，才知道长城距离地面是有很长距离的，主要是难得请假的工作日，错峰出来玩，一定不能错过景区的招牌地标，正关台古建筑，还可以看到炮台。长城人烟稀少，小强哥也提供很优质的服务，会推荐朋友来玩。,/Date(1675406726000+0800)/,24
2541733,今天去慕田峪长城，东四十条地铁旁边坐慕巴士来的。到景区后小强同学接待的。给我们讲了东西线攻略，难得错峰旅游，真的没有排队这个词了。带着老人孩子，玩的很尽兴。价格优惠一站直达，《慕巴士》开车一个多小时就到慕田峪长城。很便捷。强子导游说的一口京腔儿！很有亲和力，人很随和。清晰的介绍长城的游玩我和孩子都玩的很尽兴。值得信赖。,/Date(1675231958000+0800)/,43
375638601,最慕巴士去的，小强哥特专业特热情，为大家科普如何不踩坑游北京，我该带本本子记下来的哈哈。教程好的爬到20完全没问题，最最方便的一次旅行。以前不是购物就是有隐藏消费。慕巴士真实做到了为客户着想。介绍景点，到了帮客户购票，无手续费，送摆渡车，负责地看着所有客户都坐上索道，没有任何购物和隐藏费用，如此帮客户省钱省事，真是刷了我对报团旅游的三观。对老人小孩态度都非常好。真的是人美嘴甜负责任。代表老婆五星推荐。,/Date(1675231266000+0800)/,21
243926962,"今天我坐着慕巴士来到慕田峪长城，刘东伟导游一路接待，介绍了长城的历史，游长城的路线，长城的高度，讲解风趣幽默，大家听得都很认真，刘导游也十分负责，从到达指定地点到长城山脚，都很耐心的解说。今天的慕田峪长城，人很少，景色很优美，令人流连忘返。从第17号烽火楼到20号烽火楼，这段路
是最陡的，最后一条好汉坡更是艰难，但我们都顺利的爬上去了。站在第20号烽火台向下俯瞰，祖国的大好河山，甚是壮阔。",/Date(1675152098000+0800)/,41
102305055,慕巴士整体服务非常满意，尤其是导游小强哥很认真热情的对待游客的需求。乘坐慕巴士，预订之后前两天会有工作人员电话确认，车费在车上付。能给游客一些实惠，首先能免掉景区的摆渡车票，价值15块钱，另外有专门慕巴士游客中心，免费寄存并且可以休息，整体游玩体验非常棒！,/Date(1674800452000+0800)/,28
429390359,第一次乘坐慕巴士，来到慕田峪长城。现在气温虽然有点低，但是天气很好，爬长城很舒服😊，工作人员强哥也很负责的指导，他们还有休息室，我下来早了可以休息，喝茶水。长城很美，人也很好，尤其古老的万里长城太动人了。,/Date(1674798331000+0800)/,37
13134961,去慕田峪长城游玩是我一个小愿望，早上10点乘坐东四十条站的慕巴士直通车来打卡这段长城。车上工作人员小强哥非常幽默诙谐，讲解了各种攻略和注意事项，让我们避免了盲玩，非常优质的服务。到景区还下起了小雪，爬长城时人很少，这里的长城登上去就感觉到古人能够完成这样的壮举，真是太令人钦佩了！果然不虚此行。,/Date(1675931001000+0800)/,9
405897113,今天在东四十条乘坐慕巴士，相比八达岭的雄奇，慕田峪显得更加古朴了一些，相比八达岭的人多，慕田峪显得人少了许多。今天车上工作人员小强服务很好。很详细的给我们介绍了慕田峪长城的特点和玩法，最主要的今天赶上下小雪，能够遇到长城的雪景，这个是很难得的。千里冰封，万里雪飘，引无数英雄竞折腰！雪中的长城令人感叹！,/Date(1675928659000+0800)/,9
17174287,今天带着孩子从东四十条坐慕巴士来慕田峪。一开始担心不方便。但是出乎意料。红马甲导游小强同学帮我们解决了很多问题，尤其长城的游玩方式和不能错过的打卡胜地。本来想体验滑道，下雪为了游客安全，景区滑道关闭。不过等价换来的是长城的美丽雪景，这个真是可遇不可求，挺完美的一次旅行，给慕巴士小强点赞。,/Date(1675924806000+0800)/,9
153526311,去慕田峪有直达巴士叫慕巴士，可以关注微信公众号慕巴士里面有详细路线攻略介绍很详细。有早上8:00 10:00发车，下午3:00  18:00返樘。车上导游有很详细的讲解，也很贴心。我坐的车导游叫小强，很不错。   慕田峪长城分东西两段，我爬的是西段。坐摆渡车然后走到北检票口（本人觉得步行北检票口这段路比长城上难走）。如果爬西段要在下缆车后左转上一台阶到平台上会看到“忠于毛主席”四个大字。爬14峰火台到17峰火台就可以，相对于八达岭长城这个很好爬，很平坦。景色也很美，随便一处拍照都是美景。主要是人特别少。,/Date(1674796976000+0800)/,9
18035618,临时决定的说走就走的旅行，这是第四次来北京却是第一次来慕田峪长城，乘坐慕巴士，本次由刘东伟导游为大家服务，非常棒！车上可以直接购买景区的所有门票，很方便。今天景区人少，东西线一起走完，真好！,/Date(1675152204000+0800)/,45
326926872,抓住假期的尾巴带小朋友游北京。提前一天预定了从东四十条坐慕巴士来慕田峪，一开始担心不方便，但工作人员小强帮我们解决了很多疑惑，介绍了长城的游玩方式和不能错过的打卡胜地。本来想体验滑道，下雪为了游客安全，景区滑道关闭。不过等价换来的是长城的美丽雪景，和小朋友一起雪中坐缆车，浪漫到家啦。,/Date(1675928391000+0800)/,7
478819330,慕田峪长城，风景秀丽，游客少，游览体验度超级赞！！！一直在攻略上看了很多关于慕巴士直通车的信息，有幸体验了一次，车上介绍讲解，最后到景区后的协助购票，都安排的妥妥的。确实特别方便，物超所值！早前去慕田峪不方便，需要转几趟公交车，时间间隔久，路上会占用很多时间，现在有直通车“慕巴士”，市区出发一个多小时就到景区了，点赞点赞！,/Date(1675846406000+0800)/,11
478045923,这次来北京计划去慕田峪长城，在网上找到了慕巴士，早上在瑞士公寓出发，去程导游小强向我们耐心介绍了长城的历史，慕田峪景区的游玩攻略，同时替游客提前订购门票并提醒游客在爬长城时的注意事项。因为是工作日出行，景区呈现“包场”的现象，这个真是让人出乎意料，没想到来了一场长城包场的旅行。,/Date(1675418428000+0800)/,6
120711675,今天玩的很开心。长城很古老天很蓝，东四十条地铁站上车的，慕巴士的小强服务很好， “万里长城，慕田峪独秀”，因为是错峰驴友，人比较少，好拍照，长城西段可以拍到巅峰的景色。“天高云淡，望断南飞雁。不到长城非好汉，屈指行程二万”，带着小孩子真正体验了一次伟人足迹踏过的地方。,/Date(1675412918000+0800)/,33
214306606,很棒的旅程，景色壮美自然，可能因为距离市区稍远，所以游客比较少，乘坐慕巴士非常方便，导游强哥带团很棒，20号敌楼是好汉坡，非常抖，近观一下没有亲自爬,/Date(1675064842000+0800)/,7
55827076,趁着工作闲暇，这次坐慕巴士去了一次慕田峪长城，慕田峪的风景确实让人心向往之，而且人少的长城，游览体验度也要更高一些，车上工作人员小强很努力，说话让人听着舒服。介绍了长城历史和景区的玩法。让我们在抵达长城之前就已经有了自己喜欢的游览方式。而且今天遇到了长城上下小雪，滑道虽然没有坐成，但是古老的正关台确实是让人震惊。,/Date(1675929575000+0800)/,6
400165840,终于来了，终于等来了…  今天我就来跟大家分享一下，慕田峪长城的游玩攻略。  首先去往慕田峪长城的交通，可乘坐景区专线-慕巴士。  集合点：地铁2号线 东四十条地铁站 C出口 往东100米 瑞士公寓。  ⏰集合时间：分早班8⃣点和午班10点两个班次出发。  到景区后，游玩攻略：  乘坐慕巴士一站直达慕田峪停车场，大约用时1.5小时左右。  下车后，可随导游至慕巴士游客中稍作休整。  然后步行2-3分钟到达摆渡车乘车点，排队乘坐大约7-8分钟到达检票口（注：一定要选择景区摆渡车，可以节省体力直达检票口，如果商家自己开上去，则还需要步行20分钟才能到达检票口）。  进了景区，有三种游览方法：  ①步行登城‍♂。此种方式比较耗费体力，可边走边游览，轻松游玩，注意时间安排。  ②选择缆车往返，乘坐缆车可直达慕田峪14号烽火台。从14号烽火台往登顶20号楼方向攀登，平均用时2.5-3小时左右，途中可经过著名网红打卡点：&lt;非诚勿扰&gt;拍摄地，涂鸦墙等。  ③比较适合年轻人的方式-索道上山，滑道下山。索道是上乘到6号楼，可从6号往两个方向攀登，如果想登高望远可往上到20号楼，如果想看一下著名打卡点：4号楼-正关台；1号楼-大角楼；可以往下方的1号楼攀登。最后都要重新原路返回6号烽火台，乘坐滑道下山。着重说下滑道：它是一辆可单人，也可双人乘坐的贴地滑行工具，速度可由自己控制，乘坐滑道，可以享受风驰电掣的感觉。  一天的游览，慕巴士给了足足5小时自由游玩时间，各种方式游览都可以满足，如果提前下山，也可以乘坐摆渡车返回到慕巴士游客中心休息，这里提供免费的茶水和小食，为游客解决了很多后顾之忧。  ❤Tips：①长城修建在山间，道路崎岖不平，一定要选择适合的鞋子，建议运动鞋为主。  ②长城位于远郊区，景色秀美，出行一定要保证手机电量⚡，可多带一块充电宝，将美景永远保留在照片中。  ③景区里也有格式中西快餐，慕巴士游客中心还提供简餐，丰俭由人，非常方便。,/Date(1674976659000+0800)/,28
287148632,"2023年1月17日今天乘坐慕巴士直通车来到了慕田峪长城游览，由于是提前有朋友介绍的，所以很方便就找到了东四十条发车点。
        为什么选择慕田峪长城呢？当时也是纠结很久，看到网上很多评论和广告，主要是第一次来旅游怕踩雷，由于之前有朋友来过慕田峪长城，就是坐的慕巴士直通车所以踏实多了，确实没有失望。
         慕巴士直通车全程配备随车工作人员老牛向导，中英文双语解说，介绍景区概况。巴士干净舒适，一人一座，直达景区中途不停车。到达景区以后慕巴士游客中心提供免费行李寄存服务，免费休息区。游览时间以巴士到达景区为准留够5小时游览时间。车票80元每人，0-3岁免费，3-10岁半价40元。慕巴士直通车赠送每位乘客15元摆渡车票。在慕巴士这里也可以代订景区门票，缆车票等，有特殊优惠证件的可以使用。
     路上很快一个半小时就到达了，而且今天景区人不多包场，缆车也很新据说是今年新安装的。特别有意思的是长城上的猫咪很多，而且很可爱不怕人，孩子们玩的很开心，无论是景色还是服务都很好。一次不错的体验，5个小时的游览时间足够了，对于平时不怎么运动的选手爬到好汉坡都绰绰有余。
      总结一下，慕田峪长城还是值得来的，景色好，人也不多。慕巴士直通车很方便，服务都很好，旅游体验感超棒！",/Date(1673936717000+0800)/,11
64450398,北京下雪了，下雪的长城可遇不可求！没有人山人海，没有排队等览车，只有飘渺若仙境，只有沧桑如穿越。这次游玩选择了慕巴士，本想着只是往返坐车方便，没想到服务也周道。有导游的介绍，对慕田峪长城的历史和文化了解更多了。整体感觉很好。,/Date(1676191458000+0800)/,3
75161598,今天坐慕巴士到达慕田峪长城之旅真是太棒啦！天气非常棒，阳光灿烂，晴空万里，而且长城上人也不多，从15烽火台到20烽火台，轻轻松松！慕巴士也特别棒，车子很舒适，一路畅通无阻来到长城登山口，热情的张导给我们详细的介绍着登长城的注意事项，让我少走了很多弯路，而且还跟我们分享着北京游玩的攻略！非常的棒的一次旅行！,/Date(1675661785000+0800)/,3
479266731,今天从东四十条地铁站，搭乘慕巴士去慕田峪观光。最大的好处是啥也不用管了，预约，买票什么的，都有人给你办理，还送了景区摆渡车票。车上小强导游说话幽默风趣，给我们讲了长城的历史和玩法。我们全家人都坐索道到6号敌楼，打卡了地标最大烽火台正关台。我们和小朋友都很喜欢。孩子爸爸还带孩子乘坐缆车爬了西段，看到了非诚勿扰电影拍摄的15号敌楼。人少就是好，不排队玩的很开心。,/Date(1675583427000+0800)/,3
167594484,慕田峪长城名不虚传，景色秀丽，虽然还没到最好的十月中下旬，据说10月份遍山红叶，甚是美丽。不过胜在人少不拥挤，有足够的时间和空间感受历史和文化，也是不虚此行。慕巴士的一站式服务很棒，市区集合方便，老张很有礼貌，非常客气，业务熟练，讲解到位，购票体验也很流畅，一路上对团友们非常照顾，幕巴士之家还有很多免费的服务真是非常的贴心。点个五星赞。来慕田峪游长城，推荐慕巴士,/Date(1677908426000+0800)/,2
77799640,早上10点带着老婆和小朋友乘坐慕巴士，去慕田峪长城。一天下来玩的很高兴，站在长城上，可以感受到长城的雄伟壮观，尤其那种沧桑感。仿佛古时候将军在这里指挥士兵的场景，会浮现在脑海中。慕巴士的服务很棒，随车工作人员小强一口京腔给细致的介绍了景区的玩法和各长城的差别。值得纪念的一次出行。,/Date(1676190605000+0800)/,2
477640609,早上乘坐慕巴士从东四十条去慕田峪长城，起初是打算用脚走完这段长城的，听了车上小强同学绘声绘色的讲解后，才明白这段长城每一个烽火台都是在山顶上，并非其它段长城从地面开始慢慢升高。加上今天赶上了难得的雪中长城，也是不枉此行了。慕巴士在景区还有独立的休息室，提供免费热茶和免费行李寄存，值得推荐的一个良心公里。,/Date(1675930609000+0800)/,6
35077879,"今天带着孩子自己来慕田峪。一开始很怕不方便。但是呢出乎意料。红马甲导游帮我们解决了很多问题。很方便。到了长城 确实看到慕田峪的秀美。人不多。很精致。
慕田峪长城是很美，因为长城上人山人海的照片都出自八达岭长城太吓人了！另外慕田峪长城的景色丝毫不逊色.。植被覆盖率高，拍照片好看，这里还是电影非诚勿扰的取景地。
相对于八达岭和居庸关等长城，慕田峪长城显得非常低调，游客也更少。慕田峪长城开放了全长5.4公里，体力一般的游客建议缆车往返，这样能省不少体力爬长城。不用担心找不到地方拍没有游客的游客照，因游客稀少，你可以尽情的摆拍。",/Date(1675496333000+0800)/,4
203419099,刚刚去过的，大角楼，正关台，天梯，一步一景。慕田峪景区配套完善，适合所有长城爱好者，敌楼、烽火台矩阵式排列， 孔、洞、门及墙体原始风貌依存，期待的冬雪一直没来，伙伴来北京可以去慕田峪长城。坐【赞巴士】非常方便，还赠送很多礼物和附加服务。门票缆车都有折扣，摆渡车也是送的。大家玩的都很开心。推荐,/Date(1672811600000+0800)/,11
12847907,今天坐慕巴士到达慕田峪长城之旅真是太棒啦！天气非常棒，阳光灿烂，晴空万里，而且长城上人也不多，从15烽火台到20烽火台，轻轻松松！慕巴士也特别棒，车子很舒适，一路畅通无阻来到长城登山口，热情的张导给我们详细的介绍着登长城的注意事项，让我少走了很多弯路。特别推荐一下幕巴士之家的好汉书又精美又实惠，老人孩子都非常的喜欢。感谢幕巴士,/Date(1677905620000+0800)/,1
483797276,到北京出来玩，带孩子去爬长城看看。预定慕巴士车票，坐的是早上10点班去的慕田峪。随车导游小强讲解风趣诙谐。而慕田峪风景确实好看。人也不多，游览体验度很好。虽然是短暂的工作闲暇时间，但是这次坐慕巴士非常顺心。,/Date(1676788929000+0800)/,1
56587577,来到了北京，带娃儿去爬长城当好汉！预约了慕巴士车票，坐的是早上10点班去的慕田峪。车上小强哥讲解幽默风趣。而且慕田峪风景确实好看。人是真的少，游览体验度很不错。虽然是短暂的工作闲暇时间，游客少的北京玩的是真不错。,/Date(1676788694000+0800)/,1
102242746,今天早上7点50分到达东四十条瑞士公寓门口，8点就准时出发了，九点左右就到达目的地，路上导游老张讲解也非常不错！门票是套票包括的，另外还让慕巴士代买了缆车票，双程140元，3分钟到长城。对了，通过坐慕巴士还省去了景区坐摆渡车的费用呢，真好！！景区自由活动5小时，14点半准时回程了，点对点的接送服务真贴心！幕巴士确实很方便,/Date(1676702849000+0800)/,1
341403650,"早就听闻慕田峪长城的名声，今日有幸来此一游，感觉还是物有所值，故简单评价记录一下，并希望能给他人做个参考。
一、交通方式以及门票
从网上搜到到慕田峪有直达的慕巴士，没想到服务意外的周到，可以包含往返车票以及摆渡车票，并且在车上工作人员就会根据个人需要帮忙将门票以及缆车、索道等票提前预订，工作人员的讲解也非常到位，景区也有慕巴士之家可以停留休息。
二、登城方式
根据个人需要，可以选择步行登城，南检票口可以选择索道上，索道或者滑道下，北检票口可以选择缆车上下。
三、游玩路径
大致可以分为东中西三段，从南检票口上向东走即为西段，从北检票口上即为东段，其余为中断，东段较为简单好爬，西段最后的一段路程颇陡，如果在冬季选择爬长城，建议带上一副手套，如果体力较好，每一段往返用时约在一小时至一个半小时之间。",/Date(1676531093000+0800)/,1
338130380,这次和家人从南方来北京，一定要看看网红的慕田峪长城！而全程体验确实值得推荐！忙碌的一早对于第一次来慕田峪的我们显得特别忙碌，但慕巴士的工作人员却让我们踏实了很多！到了东四十条出口后右手边一百米处热情的红马甲工作人员就像你迎来！特别是导游老张非常的热情耐心帮你解答问题下回还要选慕巴士。,/Date(1676102705000+0800)/,1
168948889,"Mubus we took today was very clean, the boarding point was easy to find, and the journey was very pleasant. Mr. Fred, the guide, politely and enthusiastically introduced the tour route and the precautions for the Great Wall. They also helped us buy tickets for the cable car, and soon everyone boarded the Great Wall. The cable car was very necessary to help everyone, but it would take a long time to climb after getting off the cable car, so it was not so easy to see the beautiful scenery of the Great Wall, and it required a certain amount of physical strength. The guide will introduce the history and story of the Great Wall along the way. There is plenty of time for sightseeing. The only regret is that there is no bathroom nearby. In short, today is an unforgettable day. If you want to visit the Great Wall in Beijing, Mubus is the right choice.",/Date(1674049816000+0800)/,7
458218715,"美美哒的吃个早餐🍛，做好汉一定得吃饱，7: 30 坐车，🚇地铁五号线和平西桥🅱️口集合，赞巴士直通车去慕田峪长城简单方便，提前一天定好票就好。摆渡车免费送🆓，车上买个缆车🚠轻松上山!开心❤
开启长城打卡模式👉🏻
❣️4号敌楼，一进去满满的涂鸦，在慕田峪长城14号敌台西侧北铺房，以及5号和10号敌楼，都可以供游客涂鸦，记得出发前带着彩笔来留下你对长城的心情吧
❣️14号敌台边上的观景平台，可打卡长城碑观慕田峪全景。
❣️15号敌台，非诚勿扰 2的取景地。在电影《非诚勿扰2》 里，葛优饰演的男主秦奋向舒淇饰演的女主笑笑夕阳下求爱的地方，见证爱情💑的敌楼哦，天气好的话还可瞭望北京国贸 CBD。
❣️11号敌楼，难得的长城外支城。慕田峪长城是一个内外支城并存的长城，支城，即是主长城之外根据战事需要顺山势又节外生枝修出的长城。11号敌楼就是这个特殊的存在，它从主长城中分出，顺山势节
外生枝修出的一小段长城，很有特色。
❣️4号敌台，正关台，少见的三座敌台并矗一台的奇特关台。正关台由三座敌楼并立，为长城建筑史上罕见，长40米，宽30米，高20米，为上下两层，底层相通，有室多间，可用于国粮、屯兵。从垛口望长城内外，视野极为开阔。
❣️1号敌台大角楼。大角楼位于慕田峪关东侧的制高点，视野开阔，长城内外尽收眼底，现编名慕字一台，是慕田峪长城著名景观之一。一条向西与八达岭相连；一条向东，与古北口相连;一条向南，为内支城。因从长城任何一个角度看，都似一个城角，故名大角楼。
万里长城中唯慕田峪独秀，也是我最喜欢的长城❤，旅游逐步恢复，大家也赶快出来走走吧",/Date(1673659973000+0800)/,7
236798359,爬长城还是不要太相信自己，后悔没有听赞巴士小姐姐的建议，坐缆车，最终选了缆车上去，坐滑道下来的。从缆车下来是14号烽火台，通过努力我怕到了20号烽火台的最高点，高处不胜寒啊，下来的时候，，腿都软了，走到14号烽火台的时候，看着小伙伴们都结束战斗，坐着缆车下山，心里五味杂陈，好在滑道很好玩，刺激，下回再来，我就坐索道和滑道，爬一半就行了了,/Date(1673633735000+0800)/,7
149923689,第一次乘坐慕巴士去慕田峪长城，工作人员小强全程跟踪体贴服务，赶上难遇的雨雪天气，体验了一次不一样的长城之旅，超完美的一次体验，同时提醒各位旅客尽量穿防滑鞋，我们全家都摔跟头了😁,/Date(1676187063000+0800)/,2
239111,今天来了比较小众一点的慕田峪长城，比起八达岭，人少很多，交通选择的慕巴士，非常方便，导游强哥的服务也非常好👍👍👍车上就直接办理了东、西两区的隧道滑道和缆车，玩的很爽，爸爸妈妈很开心。,/Date(1677829539000+0800)/,1
290619271,错峰出行的优势就是人少，又恰遇雪景，玩的非常尽兴。有慕巴士的小强哥详细耐心的引导讲解，不走弯路，全程顺意。不用操心车程，门票和各种索道票务，慕巴士真的方便，值得推荐！,/Date(1676187183000+0800)/,2
216870195,带着娃和老人来北京，长城肯定是要去下的，但怕景点人多，选择了相对没那么知名的慕田峪长城。小程序搜到了慕巴士，一早还能订到10点的大巴，就出发了。大巴上可以购买门票和索道缆车门票，跟车的小强和一位小姐姐服务也很好，而且因为同车有几位外国友人，跟车人员的口语交流很好(✪▽✪)长城其实爬起来还是需要体力的，随身物品少带，吃饭什么的，慕巴士现在有自助餐，性价比都还不错，后续有出游的家庭可以参考，对了，还可以做纪念证书，且用玻璃裱起来的，倒是没想到,/Date(1679819798000+0800)/,0
212881764,风景很好，人也不是很多，相比八达岭长城，黄花城长城可以玩的项目更多，可以乘游船、快艇，有缆车，现在又是春暖花开的季节，漫山的杏花很美，水很绿，磁滑道体验很不一样，慕巴士很方便，导游小姐姐温柔漂亮，介绍的很全，喜欢自然风光的强推！,/Date(1679814108000+0800)/,0
