13229991,安检严格，母亲随身带的小水果刀被查了，其他地方的安检都没查到过。六一早上去看升旗，还看到一群学校统一组织的从邢台连夜坐车来看升旗的初中生，升旗前对面观礼台貌似也有学生。仪仗队在前军乐队在后，演奏着歌唱祖国出现，正如大家所说，看仪仗队军乐队如同在看蚂蚁，看不太清，即使这样也无法破坏应有的庄严和骄傲，原来升旗到顶，军乐队演奏了3遍国歌，自己唱两遍到第三遍基本就没人一起唱了。北京的清晨很美,/Date(1496585813000+0800)/,5
30555712,"去天安门，刚好碰到降旗仪式，非常威严，
1，天安门对于65岁以上老人，带上身份证免费看，60岁半价5元，
2，东西尽量少带，否则存包还要收费～～
3，打火机也不能带进入，安全第一。",/Date(1458644462000+0800)/,8
1076189,新中国最伟大的十项建筑，设计完美,/Date(1614443581000+0800)/,3
1058241,天安门城楼是中国古代最壮丽的城楼之一。以杰出的建筑艺术和特殊的政治地位为世人所瞩目，是国家的象征，是代表了整个中华人民共和国的形象。,/Date(1468466965000+0800)/,4
14186056,这地方全世界都知道吧，举世瞩目的地方，开国大典的主席台。城楼平时可以上的，应该上去看看。,/Date(1590243908000+0800)/,0
26933070,国庆节后跟几个朋友一起进行了参观，由于参观人太多，需排队存包和排队进入，城楼上也是游客人挨人，但秩序还不错，参观时间不到一小时。在购票时附带买了网络讲解，但实地参观时都没用上，链接操作太麻烦，感觉这个钱花的有些冤！,/Date(1581552275000+0800)/,4
2286259,天安门城楼正对天安门广场，是新中国的象征。城楼前五座金水桥横跨金水河，是登上城楼的必经之路。城楼可以参观，但映像中时常有保护性维护而关闭。城楼原是紫禁城的一座城门，因此其在古代有防御的功能，城楼背后有各式火炮。城楼上的建筑基本保持原貌，木质结构，雕梁画栋、卯榫构成。,/Date(1517132927000+0800)/,4
1786853,在长安街南侧，北京城的传统中轴线上，座落着世界上最大的广场——天安门广场，广场中心为人民英雄纪念碑，继续向南穿过毛主席纪念堂就到了正阳门，也就是人们常说的前门。广场的西侧是人民大会堂，东侧是国家博物馆。在广场的对面，长安街的北侧即是天安门城楼，城楼下是波光粼粼的金水河。每天的清晨和傍晚，天安门广场都会举行隆重严肃的升降旗仪式，对于初到北京的人来说，观看一场升降旗仪式是必不可少的一件事。,/Date(1502253044000+0800)/,4
3918512,北京和中国的中心， 雄伟宏大有气魄，看到天安门总会浮想联翩心潮澎湃，庄严伟大的天安门是所有中国人向往的地方， 这里交通四通八达，有公交有地铁，来这里最好乘坐公共交通工具，开车不太好停，要走一段路，。天安门旁边还有纪念堂 人民大会堂 历史博物馆 中山公园 劳动人民文化宫公园 前门 大栅栏 王府井 国家大剧院 英雄纪念碑 天安门广场 故宫 筒子河 ，这些地方很近，都可以一次都参观，来北京必到天安门，看看毛主席像看升旗，感受一下爱国主义教育，我爱北京 我爱天安门！,/Date(1495589100000+0800)/,4
4025914,2009年带爸妈来北京玩，算是第一次带他们出来自助游，北京对那个时代的人来说非常特别，具有从骨子里透露出的崇拜和向往，爸妈玩得很开心！老爸老妈早上一早4、5点去天安门看升国旗，登城楼，晚上还看天安门夜景，满意而归！,/Date(1447650105000+0800)/,4
109788652,世界最大的广场，每天的升旗和降旗仪式是每个人最期待的事情，也是世界独一无二的。,/Date(1583709337000+0800)/,0
45149161,"天安门城楼位于天安门广场北端，城楼前面金水桥全都用汉白玉石制成真漂亮！天安门楼气
势宏伟，吊挂的大红灯笼鲜艳夺目！站在城楼上让人感到庄严感！祝福祖国繁荣昌盛！",/Date(1483369781000+0800)/,24
32590051,天安门城楼是共和国的象征，来到天安门广场，是天安门城楼合影是几代人的梦想。随着涌动的人流，我离天安门城楼越来越近，并穿过天安门城楼的门洞，来到端门广场前。,/Date(1501887545000+0800)/,2
32590051,天安门城楼是皇宫前三门的首道大门，是共和国的象征，天安门城楼更是作为了国徽的一部分。天安门城楼是举行国家重大仪式的地方，开国大典，各种阅兵领导人均在出席。,/Date(1501595468000+0800)/,2
54581407,很不错。值得一来 学习参观的好地方,/Date(1613964227000+0800)/,2
25063734,天安门城楼无论白天还是晚上都阻挡不了他雄伟的气质。两旁延伸的红墙一到晚上打开灯光也有很棒的效果。进入广场是需要安检的，排队一直都很长。正对天安门的广场十分宽阔，而城楼本身进去就是故宫的方向。,/Date(1527503835000+0800)/,2
32590051,雄伟的天安门，广阔的广场。登上天安门是我儿时的梦想，今终得以实现。票价不贵，只有十五元。只是买票和登城各需排队十五分钟，登城楼一望，心情豁然开朗，值了,/Date(1502148950000+0800)/,2
230346104,我非常喜欢那里每年阅兵的时候想去都去不了呢，只能平时人少的时候才能去,/Date(1591840698000+0800)/,0
581091,我爱北京天安门，小时候最耳熟能详的一首儿歌。北京来过很多次，天安门城楼也不是第一次看到，但每一次都还是有无限的感叹，敬仰，崇敬。城楼威武庄严神圣。,/Date(1512040865000+0800)/,2
192376924,老北京皇城的正门，也是现存唯一一座皇城门，现在更多的是一种象征。,/Date(1586021941000+0800)/,0
100088186,一定要去看看，感受一下城楼上往下看的视野，回有不一样的心情！,/Date(1586350425000+0800)/,0
166350312,天安门上面的风景还是不错的，可以体验开国大典的感觉，就是安检比较麻烦还不让带包，存包还得另收费，而且要上去就是爬楼梯，轮椅等就得抬着上去很不方便。进去还要经过电子设备安检以及人工安检和搜身，打火机不许带上去，搜到就没收，比飞机安检严格到处都能看到便衣武警，安全感爆棚的地段。,/Date(1523190062000+0800)/,3
7345634,端午节的时候去的，要去故宫，就要先从天安门城楼下面穿过去。我们到了天安门东地铁站，出来过了排队安检，能远远的看到天安门城楼，然后从地下通道到马路对面。天安门城楼，威武雄壮，高高悬挂着毛主席的相片，觉得很有民族自豪感。,/Date(1496405726000+0800)/,3
897521,"站在北京天安门的城楼上，向南可以俯瞰天安门广场和正阳门，向北就可以看到端门。
过了端门就是故宫博物院的午门，这一条线就是北京最著名的中轴线。",/Date(1488163991000+0800)/,2
43441552,到北京必去的地方，如果有的话可以起早去看升国旗仪式，然后到纪念堂看毛爷爷，然后去故宫博物院，这三个都在一条中轴线上，可以安排在一天看完，如果不想在景点吃东西，就自己背上水和午饭。,/Date(1445040613000+0800)/,4
86345488,中华人民共和国成立的地方，党的象征地，政治地位不可撼动。,/Date(1608822809000+0800)/,0
4207619,天安门城楼就在广场前面，前面车水马龙，是来北京旅游必来的一个地方，可以上到城楼上去参观，门票是15元，可以感受一下伟人当年的气势和情怀。,/Date(1480565609000+0800)/,16
48326391,淡季，成人票15元，登上去还是相当超值的，但是可逛区域不多。里面有一些纪念意义的照片和文字解说。,/Date(1451741718000+0800)/,4
73390970,"天安门城楼位于天安门广场，与人民英雄纪念碑相对，旁边是人民大会堂，国家博物馆，前面是长安大街。

天安门城楼是新中国成立的见证，也是中国的形象，外观来看，红色的城楼庄严大方。来北京必须看的地方。",/Date(1521694195000+0800)/,3
12858473,以前在北京上班时。。经常会来这里玩。。。这次来是带老爸出来看看我们中国的首都。。。肯定要来这里照片。。留念一下吧。。白天感觉不错啦。。,/Date(1497787550000+0800)/,2
225052469,站在天安门城楼，视线非常好，感觉也超棒，值得去看看。,/Date(1590240105000+0800)/,0
4886727,哎呀，最近看的电影，我和我的祖国啊，然后再对比一下这个天安门的这个城门楼子，就给人感觉整体来说这边还真的是挺不错，看上去还是那么的庄严肃穆，挺有感觉的。,/Date(1579883755000+0800)/,1
18118132,作为中国人，从小就念北京天安门，很多人都想着去一次，特别是年纪大的。天安门城楼太有名了，五一前夕来此人真是多到爆，排队，排队……然后匆匆通过城楼，连停下来拍照都不方便。外面广场拍照比较方便。,/Date(1557243972000+0800)/,1
64286369,北京天安门城楼是我们大家非常向往的地方！建筑宏伟，是我们的前辈留下的智慧的结晶，巨幅毛主席画像悬挂在中央，开国大典的盛况历历在目！,/Date(1506546247000+0800)/,2
5695761,个人觉得在底下看一看就好。爬上去也并没有你们想象的那样开阔的景色。而且上城楼的安检特别严格。基本上就是空着双手进去。上城楼也特别耽误进故宫的时间。如果你是一早过去的话，还不如趁早进故宫参观。,/Date(1503233398000+0800)/,3
18596584,1949年，毛主席登上天安门城楼，庄严地宣告‘中华人民共和国成立了’，让所有的中国人都知道了这个地方。现在，天安门城楼开放了，必须要登上去，体验一下多次在中国伟大的时刻。,/Date(1455275690000+0800)/,6
26370255,会当凌绝顶，一览众山小。这里是全国人民瞩目的地方,/Date(1592931152000+0800)/,0
74464872,年纪较大的人心中很神圣、向往的地方，记得八十年代中期第一次看见天安门，心情特激动的呢，这大概是年轻人体会不到的。今年的国庆花坛特别漂亮、大气、喜庆。,/Date(1542253367000+0800)/,1
4207619,天安门城楼晚上是不开放的，不过有灯光，所以远看的夜景很漂亮，是北京旅游不可错过的经典，可以感受一下祖国的繁荣昌盛，会有一种骄傲感,/Date(1482894625000+0800)/,14
36221678,成人15，学生5元。门票不贵，就是要排队买票，然后排队存包，然后排队安检，最后才能上城楼。虽然很麻烦，不过个人觉得很值得，毕竟能站到天安门城楼上挥挥手，是中国人的骄傲！,/Date(1477226376000+0800)/,4
17553133,订的路线去故宫需要穿过天安门，人非常多，这天天气很不错，白云蓝天的，天安门广场非常威严。,/Date(1445911094000+0800)/,0
53126869,神圣而庄严的地方，举行重大国事活动时的观礼台。,/Date(1608688618000+0800)/,0
50517738,孩子启蒙教育的最佳选择，爱国教育应该从小抓起。,/Date(1588971809000+0800)/,0
1726151,对于一代人来说，天安门城楼是一个神圣的标注，而且，长期以来培养出的爱国情结，足够让我们依靠着走下去。这张照片拍得很有艺术之感。,/Date(1583491989000+0800)/,2
47218726,给孩子带来更多知识、我们伟大祖国的繁荣昌盛！,/Date(1594049932000+0800)/,0
34084592,位于北京市中心，面对的天安门广场是世界最大的城市广场。天安门有着六百年的历史了，至今仍是国家大典的不二举行地方，那古典庄重也确是别地无法替代的。,/Date(1578538255000+0800)/,3
32590051,穿过天安门城楼的门洞，从天安门西侧拾阶而上，就登上了向往已久的天安门城楼。“雄伟的天安门，广阔的广场”，这首歌在我心中激荡。,/Date(1504507558000+0800)/,2
212904908,世界瞩目的景观，世界的中心，国家的心脏。,/Date(1610666636000+0800)/,0
19271555,北京天安门，一直想来是地方，现在终于来了,/Date(1610458284000+0800)/,0
1317534,不知道现在多少钱，2000年前登上去过！,/Date(1607413360000+0800)/,0
1853736,国庆节之后，爸妈凭老年卡排队登城楼参观。,/Date(1589859607000+0800)/,0
701144,这可是祖国的象征，好几次来北京，都没有错过。鲜红色的城楼，虽然不高大，但气势很足，尤其是“世界人民大团结万岁”这句话，充分展现中华民族的智慧和包容。现在不开放登楼，据说2019年5月再恢复，游客只能外观或经金水桥穿过门洞前往故宫。,/Date(1546184777000+0800)/,0
3223733,伟大首都天安门，从小唱着这歌长大，每次路过天安门时都会凝视城楼，想像当年毛泽东宣布新中国成立的场景。天安门以前是紫禁城的最外城楼，明清两代北京皇城的正门，始建于明朝永乐十五年（1417年），最初名“承天门”，寓“承天启运、受命于天”之意。设计者为明代御用建筑匠师蒯祥。清朝顺治八年（1651年）更名为天安门。由城台和城楼两部分组成，有汉白玉石的须弥座，总高34.7米。天安门城楼长66米、宽37米。城台下有券门五阙，中间的券门最大，位于北京皇城中轴线上，过去只有皇帝才可以由此出入。正中门洞上方悬挂着毛泽东画像，两边分别是“中华人民共和国万岁”和“世界人民大团结万岁”的大幅标语。现在平民百姓也能在开放日登楼远眺。,/Date(1519882646000+0800)/,4
4282945,天安门周边景区的核心地标建筑。来北京旅游的必逛项目。在长安街北侧，进故宫的首道门。与其相对的长安街南侧一大片广场，即是天安门广场。可以付费登上天安门城楼观景，但因为城楼不高，登顶也比在外面看到的强不了多少，所以没必要登楼。,/Date(1502610831000+0800)/,2
40415993,晚上游览了天安门广场夜景，灯光映照下比白天多了几分妩媚、梦幻，少了些许严肃、硬朗。不断播放的优美、雄壮的爱国歌曲响彻夜空，大屏幕上则反复放影着建国60周年阅兵式与群众联欢晚会，吸引了众游人在外围观赏（晚上广场不能内进）。,/Date(1481769505000+0800)/,6
32339350,每年都会有五十六个民族聚集在这里庆祝。,/Date(1610437884000+0800)/,0
6540969,登上天安门城楼，看看一览众山小的感觉。,/Date(1593917010000+0800)/,0
53355887,白天去了，晚上又路过拍了一张夜景，供大家选择是白天去还是晚上去。白天可以登楼，但是查的很严，上去之前要过安检，尤其男士，会摸一摸兜什么的。,/Date(1577892754000+0800)/,1
250794144,"【景色】美丽壮观
【趣味】首都著名景点",/Date(1603756525000+0800)/,0
75770667,登上城楼，观看天安门，景色尽收眼底。,/Date(1598486349000+0800)/,0
116301465,特别恢宏大气，特别好，是国家的象征！,/Date(1585382936000+0800)/,0
83710901,景色壮观，趣味十足，性价比非常好！,/Date(1611811255000+0800)/,0
4655720,雄伟壮观的祖国精神象征，北京第一景,/Date(1605706236000+0800)/,0
161677329,中午十二点之前上去看过，登高远眺！,/Date(1590386824000+0800)/,0
238506821,登上了城楼，感觉自己也是领导了。,/Date(1584697090000+0800)/,0
48100066,朝来夕去，还没来得及去天安门朝拜。帝都天很蓝，也很干净，干净得可以席地而坐。我想每个中国人来到这里，都会非常激动吧，也就是像我一样。,/Date(1576849153000+0800)/,1
212904908,庄严，雄伟的天安门，世界的中心,/Date(1599126485000+0800)/,0
1480477,到了北京一定会去的地方，首都的城市地标。它离火车站不是很远，交通挺方便的。这次是晚上去的，月色下的天安门也依然雄伟壮观。一早的升旗仪式也会有很多人来。,/Date(1465439393000+0800)/,4
30889617,城楼是需要收费，门票不贵，15块钱好像，但也不能阻挡我的热情，每次来北京都要来的地方，说不清的感觉，很宏伟壮观的建筑，大气磅礴，看到毛主席的像都忍不住要热泪盈眶，今天的幸福生活来之不易啊。,/Date(1455594918000+0800)/,4
97221766,来当地旅游天安门一直是游人如织的，非常宏伟，以前在电视里看，亲眼看到，的确震撼，登上城楼可以一览城市美景，整体次序很有序。,/Date(1577904682000+0800)/,3
746075,走过天安门和护城河，就是天安门城楼了。这边是不需要买门票的可以直接参观。假期的时候过来的满满的都是人群。如果想要参观故宫的话建议提前网上订票。,/Date(1508122681000+0800)/,2
807540,人超多，先要安检，然后进去。去故宫走南门要经过的地方，看起来庄严肃穆，也许小学课本里总是出现，看到有点小激动。不过今天不能登城楼，没有上去。,/Date(1539426638000+0800)/,0
24877033,"买票、寄包、安检，程序挺多，看看还不错。
就是参观城楼后，不能从南面出来去天安门广场，必须往北一直走到午门前面那里出来。",/Date(1499506396000+0800)/,3
52266936,天安门广场是中华人民共和国阅兵仪式的场所，升国旗，奏国歌，庄严肃穆，毛主席头像高高悬挂，看着我们的民族，我们的国家繁荣昌盛，是不得不去的地方,/Date(1496489170000+0800)/,4
26582421,真正的标志，真正的中国的中心，心中向往地方，只要来北京，有空的话，总归尽量拐过去看一下天安门，这个中国的标志。没有别的想法，就是一种感觉,/Date(1517437675000+0800)/,2
1890911,我爱北京天安门，北京天安门上太阳升，中国的首都，首都的心脏，下过雪的北京天安门显得更加庄严肃穆，更加让人震撼心动，美丽北京美丽天安门。,/Date(1570935643000+0800)/,0
150356115,比我想象中的还要大还要雄伟，站在这里，一种民族的自豪感和归属感油然而生，这种感觉比在其他地方更为强烈，真的很赞，虽然人很多，但推荐大家来一次，来感受一下，还有，兵哥哥真的好帅,/Date(1527227277000+0800)/,0
26771753,80年去过北京，98年来深圳路过北京，相片是14年回东北特意走北京，到天安门广场转转，看看还是不是当年的北京，记得80年第一次去北京当时的心情，永远记忆犹新！和我小的时候想象的北京一点都不一样！,/Date(1522160828000+0800)/,3
13083342,视野旷广，带儿子感受一下首都，看看对面的英雄纪念碑，铭记历史！展望未来！,/Date(1598860060000+0800)/,1
965225,到北京，天安门城楼必须登上去参观一下。毕竟新中国成立以来重要政治活动都在这里。感受一下很有必要。值得一去的。那里去的人还是很多的，年长的占多数。在上面能看到天安门广场全景。,/Date(1506070297000+0800)/,4
27462006,每一次从天安门山经过，都怀着无比崇敬的心情，无论站在哪个角度，毛主席的眼睛都注视着大家，愿伟大祖国越来越繁荣，愿各族人民越来越幸福！,/Date(1470583596000+0800)/,6
32590051,天安门是北京皇城的南大门，她和端门、午门共同构成了威严皇城的三大门。天安门城楼是国家的标志和象征之一，在国微上就有天安门的图象。,/Date(1554161591000+0800)/,0
2106434,天安门的夜景也很美，白天可以登城楼俯看天安门广场全景。晚上广场人少，灯光效果很赞，观赏夜景的好机会，推荐晚上去看城楼的夜景。,/Date(1519915562000+0800)/,2
112260810,爸妈一定要去，在最后一天还急急忙忙打的去了，排了很长的队，不过结果是满意的，老爸说幸好来了，没有遗憾，城楼上俯瞰天安门广场，视野开阔，心旷神怡,/Date(1502884091000+0800)/,3
245352365,"天安门城楼非常大气，庄严肃穆，广场真是一个大！来北京游玩的伙伴记住这个地方是毕来的,它是北京的中心。来到天安门广场除了看英雄纪念碑,看人民大会堂是外,一定不能错过升旗仪式,但是一定要提前在网上查看升旗的时间,因为冬天与夏天的升旗时间是不一样的！",/Date(1571710478000+0800)/,0
25683622,来来回回过了三次安检，第一次要去存包，第二次去换票，第三次顺利通过，进了天安门单向通行，换票时绕了一大圈，中山公园南门取票，导航带到了南门要穿过中山公园，好吧，三块钱买了张中山公园，天啊，穿过中山公园，我还能怎么说呢,/Date(1570748661000+0800)/,2
25466528,"登上城楼站在这里看到广场上的五星红旗心里有一股激动的感觉。
参观当年的会客厅。里面有一个很大的国徽还有一面国旗。还有图文展览。
好想在这里大喊一声“同志们辛苦啦” ！！胆子小忍住了。

【票价】15元
【时间】8:30-16:30
【小贴士】虽然进入天安门广场区域需要安检外，登城楼不仅需要安检，大包小包需要寄存。售票旁有偿寄存柜。还有就是城楼里不能拍照！

虽然没特地来看夜景，但晚上坐公交路过这里，夜景也很美～",/Date(1569904047000+0800)/,0
76892892,在长安街南侧，北京城的传统中轴线上，座落着世界上最大的广场——天安门广场，广场中心为人民英雄纪念碑，继续向南穿过毛主席纪念堂就到了正阳门，也就是人们常说的前门。,/Date(1510903913000+0800)/,2
4840103,天安门是明清两代北京皇城的正门，始建于明朝永乐十五年（1417年），最初名“承天门”，寓“承天启运、受命于天”之意。设计者为明代御用建筑匠师蒯祥。清朝顺治八年（1651年）更名为天安门。由城台和城楼两部分组成，有汉白玉石的须弥座，总高34.7米。天安门城楼长66米、宽37米。城台下有券门五阙，中间的券门最大，位于北京皇城中轴线上，过去只有皇帝才可以由此出入。,/Date(1475641285000+0800)/,2
12775301,每个中国人都有去北京瞻仰天安门的梦想，二十几年过去了，没钱有时间，有钱没时间，今年六月终于成行。达到北京时候已是晚上，匆忙打的去了一趟天安门，北京的哥很热情，兼职导游了，坐在车上环绕天安门一圈，确实有种神圣感油然而生。,/Date(1474507792000+0800)/,4
40415993,晚上继续暴走天安门广场赏夜景，美得无语啊！在京住了4晚，终于在这最后一晚才能从百忙中抽空去逛夜街，俺容易嘛？！今天全天暴走，累并快乐着啊！记得俺5年前来时幸遇蓝天无际，天安门广场是相当美的！如今面对严重灰霾笼罩，俺只能匆匆一逛。,/Date(1471103107000+0800)/,4
418444,天安门城楼位于中华人民共和国首都北京中心的天安门广场北端，面临长安街。楼前挂有毛泽东的画像和“中华人民共和国万岁 世界人民大团结万岁”。对面是天安门广场以及人民英雄纪念碑、毛主席纪念堂、人民大会堂、中国国家博物馆。是中国古代最壮丽的城楼之一。以杰出的建筑艺术和特殊的政治地位为世人所瞩目。1949年10月1日，毛泽东主席在这里庄严宣告：“中华人民共和国中央人民政府今天成立了！”，并亲自按动电钮升起第一面五星红旗，天安门城楼图案出现在中华人民共和国国徽，成为中华人民共和国的象征。从小学校就爱组织来天安门广场看升级。上城楼要收费。,/Date(1470637450000+0800)/,4
44568665,"日期：2016.04.28星期四天气：晴转阵雨目的地：天安门城楼吃完晚饭，从王府井大街步行到天安门城楼，途中下起小雨，幸好是阵雨，沿着长安街走上来，看到很多武警巡逻，安保工作相当到位。在灯光的照射下，天安门夜景确实宏伟，忍不住拍了很多照片，留下作纪念。",/Date(1461860422000+0800)/,4
51381310,"从前门到天安门城楼，要经过天安门广场，进入广场的安检十分严，建议大家随身携带身份证，不要被拒绝进入影响心情哦~【天安门城楼】毛主席1949解放新中国的宣言就是在天安门城楼上发布的！庄严肃穆的天安门城楼近年才开始对外开放，所以来到这里一定要上城楼（门票15元 学生5元）看看呀~
站在城楼上，心中不免感慨激昂，金水河、天安门广场尽收眼底，还可远眺国家博物馆、人民大会堂
天安门城楼安检极严，购完票后需要存包（需支付3~5元），（任何大包小包不允许带上城楼，只可携带证件门票手机）",/Date(1455966602000+0800)/,8
255493831,天安门城楼，不开车的时候路过就能仔细欣赏了，最好有机会散散步。各种感情很容易就交织在一起了，小时候的记忆，感叹建筑的宏伟，缅怀历史...,/Date(1579104437000+0800)/,1
683287,每次来北京都要来看一看天安门，百看不厌，雄伟壮观，相信在全国人民心中都占据着最重要的神圣位置，是党中央和国家的象征，看天安门真令人激动。,/Date(1516198154000+0800)/,3
