74043757,十一带孩子来八大处，孩子强烈要求座滑索，我本来有点怕，没想到超乎想象的好玩，我买的是索道上滑道下的套票，先说索道上，全程时间比我想象的要长不少，风景也很不错，感觉性价比很高，然后从索道下来就可以去座滑道了，滑行速度可以自己调节，我先开始有点害怕就把速度控制的很慢，结果很快就发现其实一点也不危险，还是速度快一点更好玩刺激，十几二十分钟的路程感觉很快就过去了，按儿子的话说就是太好玩了下次还要来。,/Date(1507010178000+0800)/,0
47896786,最喜欢八大处公园的滑道，滑道全程很长，非常过瘾！我和儿子乃至全家都玩过好多次叻，全家玩得其乐融融欢乐开怀。索道也很长，上山索道下山滑道是最完美的组合，徒步上山不建议，因为太累了，我们走了10分之一就放弃了，最后还是用索道，这不是钱不钱的事儿，真心担心老人小孩子累出个好歹。山顶景色也比较美，可以纵观北京城，前提是沒雾霾的天气情况下喔,/Date(1498955285000+0800)/,2
17706906,八大处公园内寺庙众多，佛教文化景点非常多。这里有佛牙舍利展出，每天来这里朝拜的游人众多而且，这里的自然风光也很不错，现在有中国茶文化的展出。公园内的茶社很多，可以喝茶，吃饭和休息。一处到七处在一条游览路线上，八处则在另一条路线上。,/Date(1497479276000+0800)/,2
216045611,并不是冲着风景去的 佛教圣地 带上一颗虔诚的心 爬上顶 然后做滑车下来 体验还是不错的 ,/Date(1598344141000+0800)/,0
2714674,今年八大处宣传给力，人太多了，初一是祈福高峰，排队进场就转了10大圈，各处都香火旺盛，据说很灵哦！,/Date(1518874916000+0800)/,1
1145140,我们自行爬到山顶，坐滑轨下山。前面的游客总是停下来拍照，所以导致我们后面的人根本没有感受到速度的体验。所以不建议游人多的时候玩这个项目。而且兑换电子票的机器不能扫码，只能手动输入购票码，不太方便。,/Date(1568791250000+0800)/,0
7051662,这次不光把前七处转了，也去第八处逛了一圈，这个时节天气刚刚暖和，也没有蚊虫叮咬，挺适合户外活动的。特别好玩，爬山的时候用了差不多两个小时到山顶，下山坐索道只需要二十分钟而且很安全，一点都不危险。,/Date(1504764960000+0800)/,0
150802837,滑倒很好玩，自由控制速度。老人小孩都能玩不错。公交也很方便。就是太晒了。,/Date(1599125642000+0800)/,0
18427262,值得推荐，有趣好玩，体验很好，,/Date(1598108232000+0800)/,0
6995753,周末了，北京人才去这些地方。其实很多外地人都不知道在这里有中国仅存的活压供水。所以。很隐蔽。每逢祭祀的时候。都会有单独的祭拜。远比法门寺。要低调的多。,/Date(1511186983000+0800)/,2
6995753,你想想不到，八大处，居然有中国乃至世界唯一一颗。佛牙骨舍利的保存。说实话。很正经。远比。法门寺的舍利更令人震惊，因为她是低调的。,/Date(1496583310000+0800)/,3
48618034,滑道第一次玩，人少的时候好玩，挺刺激的。过桥的那段最酷了有趣好玩，,/Date(1603004073000+0800)/,0
205644178,孩子就喜欢玩八大处滑道。来了好几次了。挺好玩，山青爬爬山锻炼身体。,/Date(1599393701000+0800)/,0
105525095,非常好有趣好玩，景色不错，,/Date(1589947962000+0800)/,0
97221766,这个公园挺不错的，里面还有一个塔，有点历史年代了，而且慕名而来人很多，香火旺盛，周边绿树掩映，环境也挺雅致，有片刻宁静的感觉。,/Date(1579034447000+0800)/,1
207716453,八座建在山上的古寺。不是非常热门的旅游景点，如果时间充裕可以去看一看。2014年之后，景区变得越来越商业化了，以至于有些失去了本该有的历史及文化底蕴。总之，此处更适合本地人爬山健身之用。,/Date(1577340646000+0800)/,0
2324481,今日，随意走走，竟然恰巧赶上灵光寺佛牙舍利塔开放，很是惊喜，虔诚参观了佛牙舍利，为亲人祈福。不过除了灵光寺，大悲寺外，个人觉得其他景点人工痕迹过重,/Date(1495801183000+0800)/,2
24316362,门票10元，很多人特意前来烧香，香火很旺，爬山还可以坐索道或滑道,/Date(1599369331000+0800)/,0
190840705,值得推荐，体验很好，位置很方便，八大处景色不错，滑道很好玩，推荐,/Date(1598925343000+0800)/,0
85036874,疫情现在好很多～爬山呼吸新鲜空气是很不错的选择～大家一起爬山吧～,/Date(1596631207000+0800)/,0
24797139,离家非常近的公园，只是平时不在公园年卡范围内，需要收费，今年七十年大庆，免费不免票，早上七点左右就到了公园门口，人不是很多，领了票，就向上爬山了,/Date(1569917207000+0800)/,0
93701296,北京八大处公园景色优美，植物茂盛。灵光寺供奉着珍贵的佛舍利宝塔，来灵光寺烧香礼佛，祈福的市民和游客很多。登山游览，散步健身。,/Date(1544145690000+0800)/,1
63157487,八大处公园俗称八大处，因有八座古刹而得名，位于北京西山风景区国家AAAA级景区，是一座历史悠久，风水宜人的山地佛教寺庙园林。,/Date(1542537231000+0800)/,1
171247919,体验很好，价格合适，比较有趣的是坐滑道。但是滑道需要单独付费。,/Date(1601948909000+0800)/,0
2329021,北京八大处公园也是北京看红叶、赏秋的好地方。交通便利，游客没有香山公园那么多，也有上山缆车，还有一条下山滑道。同样都是观赏北京的大西山风景区。,/Date(1540625827000+0800)/,0
589217,北京八大处公园在石景山区，风景如画，门票15元，人不多，可以俯视北京城，内有八个相对集中的风景地，有寺庙和儿童乐园，性价比较高，秋天登高好去处,/Date(1474274520000+0800)/,2
8700246,信仰的神圣之地，真的看到好多虔诚的信徒，净化心灵洗涤心灵的地方，超赞！就是天气好热体力不够…没有都去到,/Date(1469420299000+0800)/,0
38828816,值得推荐，景色不错，体验很好，有趣好玩，,/Date(1595594248000+0800)/,1
57896971,景色不错，有趣好玩，,/Date(1590358276000+0800)/,0
156084770,感觉很好，很幽静，孩子喜欢上坡路。缆车孩子也喜欢，没坐滑道，怕危险。带孩子去玩是不错的选择，人不多。,/Date(1556256843000+0800)/,0
87844409,八大处”即：参谋、副官、秘书、政务、军务、军医、军需、军法等八个处，公园位于北京市著名西山风景区南麓，为国家AAAA级景区，是由西山余脉翠微山、平坡山、卢师山所环抱。园中八座古刹最早建于隋末唐初，历经宋元明清历代修建而成。其中灵光、长安、大悲、香界、证果五寺均为皇帝敕建。灵光寺辽招仙塔中曾供奉释迦牟尼佛牙舍利，1900年毁于八国联军炮火，建国后经周恩来总理批准新建佛牙舍利塔。但在2000年发现明代摩崖石刻则以八大处第九处轰动京城，吸引着石刻爱好者和众多的佛教信徒。八大处公园还是京郊最适宜登山的地点之一，千年的历史文化沉淀，丰富珍贵的自然资源，“三山环抱”而形成的特有小气候，以及不高不低的山势，使八大处公园成为京城百姓登山健身的首选之地。,/Date(1525605523000+0800)/,1
36407598,记得当年还在清华大学，曾和同学们一起骑车郊游。有熟悉路线的同学说：我知道有条路线可以插进去，不用买门票，不过安静一点，不许说话不许笑，快！于是拼命忍着笑，猫腰低头在一片丛林中快步穿插。如今，八大处的风景想不起太多，但是学生时代的情怀仍萦绕心间。,/Date(1468282773000+0800)/,9
185573859,很好玩，可以自己控制速度，每隔一段都有工作人员，感觉放心。,/Date(1602127013000+0800)/,0
44710938,来这里的人多是拜佛祈福，我是带孩子坐缆车和滑福斯特滑道。晴天拍出了大片的效果。滑倒速度快到被工作人员敲打提醒，儿子一个劲儿地说太刺激了！,/Date(1601533790000+0800)/,0
91286523,值得推荐，有趣好玩，景色不错，体验很好，滑道非常值得一玩,/Date(1596874436000+0800)/,0
23663303,赶上初一十五烧香的人会很多，中国园林茶博会时很热闹，索道上山很惬意，下山的滑道最爽小孩子都喜欢。,/Date(1463988526000+0800)/,0
3350048,西山八大处自明清以来就在京师直隶非常有名，自香山里八大处有八大名刹。也验证了足骨名山僧占多的谚语。己亥年春节这里的山门开处，大和尚恭迎。满眼佛寺氛围。好。,/Date(1549550852000+0800)/,1
19731082,灵光寺有佛祖的牙舍利，有一千多年的历史，值得有信仰的人去。再往上，是一些适合僧、尼修身养性的地方，房子盖得好，周围绿化也好，装修也好。,/Date(1508065342000+0800)/,2
23202021,不错，闺女最喜欢的滑道，有事没事就去滑一次，次次过瘾！不过就是春天人太多车太多了，每次排队进停车场都需要一个多小时，下次试试公交出行吧,/Date(1490669736000+0800)/,0
1410673,富斯特滑倒挺好玩的，距离长，时间久，孩子玩得开心。,/Date(1613566059000+0800)/,0
182959899,滑道还是很好玩的，很不错，也挺长的！孩子很喜欢😍,/Date(1601863004000+0800)/,0
4304899,就为了滑道而去的。景色不错，体验很好，值得推荐，,/Date(1599965012000+0800)/,0
119613012,人不多，风景不错，财神殿对面的素斋问道不错还很便宜。挺好的一次行程。,/Date(1557125244000+0800)/,1
93701296,八大处公园是北京西边著名的景点，灵光寺香火很旺，烧香礼佛的游客众多。景区内空气不错，绿树成荫。一只猫慵懒的在晒太阳，不时有游客从身边走过，非常有趣。,/Date(1541496177000+0800)/,1
102785630,八大处公园位于北京市著名西山风景区南麓，是建国后首批北京市重点文物保护单位，是一座历史悠久、盛名远播、风水宜人的山地佛教寺庙园林。公园年票不能使用，门票是十块钱一张。,/Date(1553401958000+0800)/,0
5575628,景区景色不错！体验很好，景色不错，值得推荐，,/Date(1601610481000+0800)/,0
1819139,位置很方便，八大处景色不错，滑道很好玩，推荐,/Date(1598924272000+0800)/,0
1723995,平日去滑道不用排队，除了滑道没有太多可玩儿的,/Date(1598184362000+0800)/,0
7167267,带孩子很好玩，尤其是下滑滑道，孩子玩的很开心,/Date(1598070498000+0800)/,0
24809454,自从去了一次，就喜欢上了，好风光的八大处，还有颜值超高卖萌无限的猫猫们，♥️♥️♥️,/Date(1577067608000+0800)/,0
4507117,一早去上香顺道爬山转转，景色没的说，就是没到一个庙宇，管理人员都会出来销售供灯供香，礼佛之地一下就布满了世俗气。市场经济可以理解，但是得分场合吧,/Date(1571756511000+0800)/,1
153718078,有趣好玩，是总体超赞，性价比高，景色不错，,/Date(1613140075000+0800)/,0
231229088,淡季，不拥挤，人少，走走拜拜佛。特别好🙏,/Date(1607588639000+0800)/,0
56951925,玩的不错，通票方变，就是缆车赶上山风挺吓人,/Date(1593506035000+0800)/,0
2119188,景色不错，总体超赞，性价比高，有趣好玩，,/Date(1611895668000+0800)/,0
222114259,总体超赞，性价比高，有趣好玩，景色不错，,/Date(1610541287000+0800)/,0
61323754,性价比高，有趣好玩，景色不错，总体超赞，,/Date(1608878827000+0800)/,0
107435482,有趣好玩，景色不错，总体超赞，性价比高，,/Date(1606816269000+0800)/,0
6218758,周末爬山好地方，节日千万不要去，全是人！,/Date(1602688668000+0800)/,0
29799359,有趣好玩，值得推荐，体验很好，景色不错，,/Date(1600063533000+0800)/,0
276253766,有趣好玩，景色不错，值得推荐，体验很好，,/Date(1599975584000+0800)/,0
87105313,值得推荐，体验很好，有趣好玩，景色不错，,/Date(1598083896000+0800)/,0
189872629,景色不错，值得推荐，体验很好，有趣好玩，,/Date(1596793440000+0800)/,0
3882274,值得推荐，景色不错，有趣好玩，体验很好，,/Date(1595383495000+0800)/,0
179730017,值得推荐，景色不错，有趣好玩，体验很好，,/Date(1592321667000+0800)/,0
3819587,景色不错，有趣好玩，体验很好，值得推荐，,/Date(1590831174000+0800)/,0
392840,爬爬山呼吸呼吸新鲜空气，八大处是个好去处。缆车滑道小孩子也比较喜欢。爬山上去锻炼锻炼身体，坐滑道下来是个不错的选择，喜欢,/Date(1589279184000+0800)/,0
93701296,北京西山八大处公园是北京西边著名的风景区，很多市民和游客前来登山游览，散步休闲健身，烧香祈福。景区的风景优美，绿树成荫。,/Date(1543454848000+0800)/,0
218178504,八大处公园寺庙历史悠久，香火旺盛，其中灵光寺内供奉着一颗佛牙舍利，古朴庄严的寺庙园林十分静美，还有很多银杏、枫树等，每逢秋季来此散步观景、登山拜佛都十分不错。,/Date(1580084462000+0800)/,0
79447289,周末没事爬山锻炼一下，三个小时上下山，人还是挺多的，去的时候叶子还没完全变黄，感觉比香山的叶子好看。寺庙很庄严，很多人在烧香，好的一点就是不会有人缠着你买香。,/Date(1574875674000+0800)/,0
19997422,公园很大，适合锻练！开春了，多运动！,/Date(1613718639000+0800)/,0
38687511,体验很好，滑道很有特色，非常值得体验,/Date(1602664811000+0800)/,0
2122002,京西著名的佛教寺院公园，经常回去转转。公园人不是很多，赶上初一和十五会人多一些，而且中午还有免费斋饭，每年佛诞日期间，舍利塔一般都会对外开放，那时候人很多。,/Date(1482076531000+0800)/,8
41994146,体验不错，整体服务到位，娱乐性强,/Date(1613127772000+0800)/,0
39249585,很喜欢的公园，环境优美，也很干净,/Date(1604327836000+0800)/,0
102813272,说有趣好玩，景色不错，值得推荐，,/Date(1598615636000+0800)/,0
30976505,爬山上去，坐滑道下山，孩子很开心,/Date(1597804562000+0800)/,0
118448172,携程出票快，而且价格便宜，超满意,/Date(1590670677000+0800)/,0
93701296,八大处公园，一处长安寺，二处灵光寺，三处三山庵，四处大悲寺，五处龙泉寺，六处香界寺，七处宝珠洞，八处证果寺。二处灵光寺建于唐代，寺内供奉着一颗佛牙舍利。,/Date(1580690926000+0800)/,0
152357213,这里景色美丽动人，性价比很实惠。,/Date(1520139789000+0800)/,2
249759032,性价比高，景色不错，总体超赞，,/Date(1610873611000+0800)/,0
6974617,有趣好玩，景色不错，总体超赞，,/Date(1608401272000+0800)/,0
91286523,景色不错，体验很好，有趣好玩，,/Date(1602643012000+0800)/,0
4766269,值得推荐，体验很好，有趣好玩，,/Date(1598757285000+0800)/,0
1821356,值得推荐，景色不错，有趣好玩，,/Date(1598238568000+0800)/,0
56584296,就是为了体验滑道来的，挺爽的！,/Date(1596880270000+0800)/,0
194103756,景色不错，体验很好，有趣好玩，,/Date(1595519476000+0800)/,0
6072764,北京的佛教圣地，很多佛塔，很多佛教建筑，可以来烧香礼佛，可以来散散心，可以坐缆车上去，不用爬山了，然后走下来。,/Date(1446811546000+0800)/,4
5529307,非常好，玩了两遍，还是没过瘾,/Date(1598958016000+0800)/,0
849234,"周末建议一早出发，七点钟进公园的话停车不用排队，不然不好停车。
门票10块，索道60，滑道80。滑道比较好玩，建议步行上山后坐滑道下来，节假日滑道排队比较严重，建议早去。",/Date(1570603603000+0800)/,1
37723776,滑车非常有趣啊，值得体验。,/Date(1602086343000+0800)/,0
6909335,哈哈哈哈哈哈哈哈好好好好好,/Date(1589597642000+0800)/,0
1348211,主要是来玩滑梯，孩子很喜欢,/Date(1588552097000+0800)/,0
78224261,非常不错，孩子玩了好几遍。,/Date(1587274501000+0800)/,0
16744576,爬山健身好去处，设施完善,/Date(1601869361000+0800)/,0
185348198,一趟下来，感觉不是很过瘾,/Date(1600770371000+0800)/,0
24613277,滑道很好玩儿  一定要试试,/Date(1596355914000+0800)/,0
93701296,京西的八大处公园是市民烧香祈福，散步，登山，休闲健身的著名景点。公园路上一只慵懒的猫很可爱，眯着眼懒洋洋的晒太阳，非常有趣。引得很多游客在拍照。,/Date(1543881749000+0800)/,0
33114246,有趣好玩，就是价格略贵,/Date(1606399631000+0800)/,0
82294468,性价比高，u有趣好玩，,/Date(1605496130000+0800)/,0
238697067,滑道很刺激，孩子很喜欢,/Date(1602186395000+0800)/,0
256779742,悠闲的旅行。。。。。。,/Date(1602049339000+0800)/,0
19390434,炒鸡喜欢滑道，下次还要去。疫情时间去的，室内的基本上都没开，有一个庙开了，很灵验。下回再去。值得推荐，,/Date(1601949469000+0800)/,0
79007946,孩子特别喜欢富斯特滑道,/Date(1597800804000+0800)/,0
53545707,环境非常不错，值得一去,/Date(1591440641000+0800)/,0
86052531,一定要玩那个滑道，超爽的，之前一直怕速度快不敢玩，实际速度完全可控，周围都是青山绿草，滑下去很开心😃,/Date(1590714111000+0800)/,0
223831929,有趣好玩，景色不错，,/Date(1612278191000+0800)/,0
172210959,景色不错，性价比高，,/Date(1605434547000+0800)/,0
209847018,值得一去，风景优美。,/Date(1602204666000+0800)/,0
48671402,出票快，比现场优惠。,/Date(1599103760000+0800)/,0
49146572,值得推荐，景色不错，,/Date(1596794873000+0800)/,0
24652385,景色不错，体验很好，,/Date(1595751135000+0800)/,0
18179455,体验很好，景色不错，,/Date(1595121477000+0800)/,0
205835503,值得推荐，景色不错，,/Date(1594909865000+0800)/,0
209587949,值得推荐，体验很好，,/Date(1594825699000+0800)/,0
115293716,体验很好，值得推荐，,/Date(1594822127000+0800)/,0
246759256,景色不错，值得推荐，,/Date(1593135800000+0800)/,0
177084256,值得推荐，景色不错，,/Date(1590832096000+0800)/,0
14194939,景色不错，有趣好玩，,/Date(1590794608000+0800)/,0
241773222,不错，因为疫情人很少,/Date(1589009468000+0800)/,0
59023792,"滑道大众点评最划算！滑道大众点评最划算！滑道大众点评最划算！！重要的事情说三遍。
停车真是一件难题，停车场爆满，我们停在了山下，20元一辆小车不限时，步行需要大概一刻钟就能到售票处。
安检形同虚设毫无意义。入口查打火机，山顶上就是吃着泡面吸着烟的游客。
进门后会有一条风俗街，印象深的是有***活动，卖的格瓦斯没少兑水，太太太难喝了。",/Date(1570348078000+0800)/,1
4186116,位于北京西郊，与香山等同属西山山脉，公园内因分布有八处寺庙而得名，寺庙都有相当的历史，可见此地人杰地灵，所以自然环境特别好。园区特别大，想一天逛完几乎不可能。一般只逛灵光寺等几个主要景点。园内修有健身步道，门票也便宜，很适合休闲游玩。,/Date(1550233021000+0800)/,3
42689386,元旦参加长跑比赛过来的，虽然是冬天，但是沿途的冬景没有很凄凉萧瑟，很好，更多的是静谧清幽，门票是10元钱，我们是跑赛，门票费用包含在里面了,/Date(1546413089000+0800)/,0
100163424,八大处公园越来越漂亮，很值得去的地方！,/Date(1507463366000+0800)/,1
1934095,佛教圣地八大处，正好赶上要四月初八佛祖诞辰日，虔诚的信徒在做法事。各处都在布置和装扮，干净整洁。因为很多殿不开放，只能在殿外表达心意了。,/Date(1558320776000+0800)/,0
199334065,自然风光，森林资源丰富，景区门票价格便宜，适合休闲登山。,/Date(1538631533000+0800)/,0
7490432,滑道很刺激，孩子一路尖叫着下来了。人多的时候没意思要控制节凑。孩子一路上给我挣着控制操纵杆。,/Date(1444974384000+0800)/,2
1853736,秋天的北京，天高气爽，周末约上三五好友一起去京西八大处公园登高赏秋。门票不贵，但公园内大有乾坤，无论是植物还是园林布置都很有特色。,/Date(1472894622000+0800)/,2
194085594,不知道是因为疫情期间还是其他原因，所有殿都没开，只能沿着大路走，不过滑道挺好的，值得一试,/Date(1588663460000+0800)/,0
17295727,风景优美，古刹梵音，香烟缭绕。寂可听禅，净可清心,/Date(1468912991000+0800)/,0
93701296,自然风光不错，四季风景如画，植被丰富，峰峦叠翠，春季山上杏花、桃花、迎春等鲜花盛开，景色优美。八座古刹星罗棋布分布在三山之中。,/Date(1555897365000+0800)/,2
54035987,值得一游这里不但能拜佛烧香还能爬山很不错的地方,/Date(1474864200000+0800)/,0
62861829,不错，山不算高，拜佛的好去处，运气好还有法事。,/Date(1474756200000+0800)/,0
19797950,听朋友提起过八大处，很久没去过了，就抽休假的时间出来溜溜，个人感觉不错，山不是很高，适度的运动也放松身心，有机会多出去走走，那句话咋说的，读万卷书不如行万里路~~~~,/Date(1469676665000+0800)/,2
184484179,人山人海，现在是冬季很美，如果是夏季会更美。,/Date(1549466527000+0800)/,0
27827992,虽然离家很近，都是很少去了，这几次进去也是从西山森林公园溜达过去的，单纯的公园里面没什么好玩儿的，烧香拜佛的人比较多。作为登山健身的地方还不错。,/Date(1526019484000+0800)/,3
6512149,八个寺庙组成的景区，依山而建，错落有致，空气非常好，下着小雨登山，不会感觉很热，而且人少很静，非常好的一次体验，有机会再来。,/Date(1524305105000+0800)/,0
43987374,近城上香，休闲的好地方。干净，有序。可以爬，也可以缆车上下。可放松心情，亲近大自然。,/Date(1445872168000+0800)/,0
46896978,滑道很好玩，没有危险性，每一段都有工作人员,/Date(1603156892000+0800)/,0
4989602,"1、如果去八大处非初一十五建议7点半能到，停车场有位置。10元停一次。不要看“八大处车位已满的显示屏”24小时都那么显示。如果9点才到，那就别进去了，估计没有2个小时，车进不去。
2、八大处适合带小朋友，3岁的小宝和我上山时坐的?。10岁的老大和她爸选择的爬山，听说也挺累，但爷两个从2处灵光寺走到7处宝珠洞用了1个多小时。感觉也挺好。
3、下山的滑道真的要坐。1岁多的小宝宝只要能坐得住，就行。很安全。好玩。我家小的3岁，一直在帮我操纵。玩的高兴极了！
4、携程订票真是太便利了，15分钟生效。兑票就在售票处旁。超简单！
5、景点里的东西不贵。凉皮、泡面10元，煮汤面15。可接受。2处旁有个露天的儿童游乐园。充气城堡、小火车都是20元。只要不晒，玩玩挺好。

6、综上所述，周末带孩子玩玩，或者年轻人散心。我觉得去八大处挺好的。别带婴儿车，上山有的地方有台阶，不方便。",/Date(1491261147000+0800)/,2
4035480,国庆第二天去的，人没那么多。公园里上香拜佛和爬山都很好，国庆期间还有各种活动。公园门口等车的人很多，走一小段在八大处南站有个109专线，不用挨挤坐到苹果园地铁站。可以在山上尝一下素餐，不贵。山上的茶社很多，是山泉水泡茶。第一次来，从南门进来只逛了45678这几个处，需要一天的时间把八个处都逛了。总之是个很舒适的景点。,/Date(1475449981000+0800)/,2
17640926,一直喜欢来这里，人比香山少，景色比香山美,/Date(1450101765000+0800)/,2
93701296,国庆假期，来到北京八大处公园游玩的市民很多 ，北京的秋天温度舒适，非常适宜户外活动，公园游览。公园内植物茂盛，空气清新。,/Date(1538552749000+0800)/,0
17413696,八大处二处灵光寺，虔诚祈福！相信福报！,/Date(1531813639000+0800)/,0
4997477,非常好玩的北京景点，不算很热门，缆车，滑道都没怎么排队，滑道绝对一大特色。尽量避开初一十五这样的大日子，人会相对少点,/Date(1560499169000+0800)/,0
2343472,景色很美，山里空气也好，交通也方便，山脚下居然可以叫到优步！网上订票取票也方便，就是建议以后和故宫一样，网上订票直接刷身份证就好了，否则失去方便的意义了就！,/Date(1469981662000+0800)/,4
182877032,"形成不错原价120 上索道下滑到
上去的时候俯瞰***丽 值得花钱坐索道 下来做的富斯特 在做的时候大家一定要注意 让年轻人先走 让老人小孩后走 一般人在中间 这样稳妥",/Date(1573827662000+0800)/,0
165445512,公园很大，很多地方逛，有八大处。,/Date(1525216271000+0800)/,0
