20529448,北京八大处公园在北京的还是有比较大的名气的，位于北京西山的八大处不仅有古老的寺庙还有优雅的环境，十二景观闻名遐迩，尤其是佛牙舍利塔海内外举世闻名，影响很大。现在交通也非常发达，到八大处很方便。,/Date(1675469413000+0800)/,0
20529448,八大处的灵光寺供奉有佛牙舍利，这里的香火非常旺，来降香的人非常多，管理处为了控制客流，不让自己点香，香直接投入到香炉中，佛殿前也撤掉了供跪拜的垫子，号召大家鞠躬，点灯的香客也很多，场面宏大。,/Date(1674518727000+0800)/,5
67741433,"也许是今年北京人气最旺的庙会，人真的太多了。
春节庙会期间老年卡不能用，所有人都需要购买门票，成人门票十元，优惠票五元。
开车去的很拥堵， 按照指引，停在了地下停车场，地下停车场按时收费停了两个多小时，交了12元。",/Date(1674621845000+0800)/,0
796077,门票10元，八处八个寺庙，边爬山边拜佛，不累。中间很多茶舍，喝茶晒太阳很舒服😌,/Date(1678327700000+0800)/,1
217487102,八大处公园是由西山余脉翠微山、平坡山、卢师山所环抱，三山形似座椅，八座古刹星罗棋布分布在三山之中，自然天成的“十二景观”更是闻名遐尔，古人即赞曰“三山如华屋，八刹如屋中古董，十二景则如屋外花园”又有云“香山之美在于人工，八大处之美在于天然，其天然之美又有过于西山诸胜。,/Date(1668086785000+0800)/,2
12326844,很悠闲的一个公园，爬山也不累，溜达溜达就到山顶了，老少皆宜的一个好去处,/Date(1677231446000+0800)/,0
153855449,在网上购买过很多次，很方便很便捷，携程很赞！下次还会继续在携程上购买。现场购买排队人比较多，扫码的话也还行，但是会比较拥挤。直接刷身份证很方便。,/Date(1679187164000+0800)/,0
14275480,春节期间去的，人特别多，上香礼佛的香火旺盛，年年都来，非常灵验，今年加了庙会，更好了，停车越来越友好便利，交通管理到位，几乎解决了堵车问题。,/Date(1675048926000+0800)/,0
81867395,八大处是好地方，北京的山不多，有多个寺庙的山更不多！,/Date(1680499079000+0800)/,0
8758643,正月初六来八大处公园，新春庙会很不错，赶到了最后一天，真是人山人海，锣鼓喧天啊，吃的玩的啥都有，疫情之后，人间烟火气又回来了,/Date(1675256937000+0800)/,0
217487102,因为疫情的原因，八大处公园里面的二处灵光寺在关闭1年多的时间，终于在8月28日开放，八大处公园因二处灵光寺供奉世间罕存的释迦牟尼灵牙舍利而驰名海内外，近年来灵光寺内先后修建的《般诺波罗密多心经》墙，500罗汉浮雕与佛牙舍利形成了佛法僧一体的圆满。,/Date(1662086198000+0800)/,0
86261583,秋日的八大处公园非常美，银杏的落叶很美，站在山顶俯瞰北京城，可以看到望京。工作日去的，人也不是特别多，爬山不是很累，大概一个小时就能到山顶,/Date(1669716479000+0800)/,1
24838653,清雅，幽静，仙气飘飘。,/Date(1677129941000+0800)/,0
38211491,正月十五出去的！人好多，不过是值得去的！,/Date(1678258681000+0800)/,0
233134699,八大处有一处魁星阁，十分灵验，一般去求学业事业都可以助你一臂之力，一般来讲，景区是五点开始闭园，有时忘记会到五点半。不太建议晚上去拜神，会有其他东西出没。我当时去的时候，魁星阁还是在财神庙旁边儿那一侧的,/Date(1677770369000+0800)/,0
66063241,八大处公园去过多次，非常不错，环境清幽，比较安静，是旅游的好去处,/Date(1674813150000+0800)/,0
25698049,总体感觉还可以，山还挺高的，可以坐索道下山，门票也比较便宜，只需要十块钱，并且在携程上购买非常方便，交通也还可以。景区一进门有很多小店,/Date(1672730686000+0800)/,0
68808629,爬山很舒服，几个寺庙非常值得逛逛，历史感厚重 感觉很好，向大家推荐，就是停车得停到很远的地方，得走10多分钟才能到景区大门，希望能优化,/Date(1677318824000+0800)/,0
1147426,距离市区近，交通方便，景区比较分散，体验度比较好。自然人文景观相辅相成，树木年轮和第四纪冰川等的科普展板介绍很有特色，适合各类人群。,/Date(1675297929000+0800)/,0
45079803,八大处公园位于西山风景区，是由西山余脉翠微山、平坡山、卢师山所环抱，三山形似座椅，八座古刹星罗棋布分布在三山之中，自然天成的“十二景观”更是闻名遐尔。,/Date(1662646806000+0800)/,3
196837749,八大处公园是国家AAAA级旅游景区，北京市首批重点文物保护单位，北京市精品公园，位于北京西山风景区南麓。八大处公园为太行余脉翠微山、平坡山、卢师山所环抱。方圆253公顷，最高峰海拔464米，植被覆盖率97.4%。冬季山暖风和，夏季凉爽宜人。,/Date(1662821120000+0800)/,0
14186056,网上购票很方便，在公园门口扫码就可以，即买即用。现在公园里有荷花很漂亮，爬虎头山不累，但是到山顶看风景很漂亮，而且还可以玩滑道。就是有几处的寺院暂时没有开放，另外新修的停车场离公园太远了些。,/Date(1662223838000+0800)/,0
489346887,临近西山，空气特别好，适合单位组织登山活动，每处风景各不同。,/Date(1679890862000+0800)/,0
489346887,八大处在北京西边，空气特别清新，慢慢登山，品位每一处。,/Date(1680694587000+0800)/,0
5321178,很方便 头条晚上定的票 出票很快 预定完就可以出票 到了地点 扫码进 很顺畅 不用再去买票了 确实方便 快捷 门口人很多 大部分都是在扫码支付的 直接进就行了,/Date(1674969776000+0800)/,0
21911290,游玩订票选择携程，方便，快捷，安全。每次都是顺利出行。出票快，价格优惠。携程门票包含全国很多景点，不用等候，强力推荐携程。,/Date(1679314458000+0800)/,0
2217591,西山脚下，风景秀丽，还有索道，孩子很喜欢。玩的内容也很多，人也很多，停车场要等位。其他的中规中矩，多带点水，上山补水很重要,/Date(1676948918000+0800)/,0
25698049,门票便宜，附近交通也比较方便，就是第八处距离前七处比较远，人们都很少去。第七处还在维修，不知道什么时候开放，宝珠洞没进去,/Date(1672730812000+0800)/,0
34052658,北京八大路，小遛很不错，大家来的吗,/Date(1676645258000+0800)/,0
335649266,个人觉得景色不错，设施安全，配套设施齐全，适合与家人一起游玩，索道和滑道适合孩子，休闲娱乐好去处！原创冰淇淋口感不错，喜欢吃的可以尝尝味道。,/Date(1664189975000+0800)/,0
65394035,公园很大，适合溜娃，不过我们没有爬到山顶，直接就奔着滑道去，山顶上还有好多橡果，掉了一地、孩子们捡着玩、超长的滑道可以看山里的景色,/Date(1662269428000+0800)/,0
38920044,八大处以爬上为主，面积很大，山很美，可以俯瞰整个北京城，中国尊和电视塔🗼清晰可见，公园走起来不是很难，道路修的非常好，适合去玩。,/Date(1661591118000+0800)/,0
16406513,每年都去八大处，基本都是缆车上山，滑道下山，风景不错，适合去吸氧。其实很适合慢慢走上去的，边走边看风景。可以直接眺望中央电视塔。,/Date(1666921819000+0800)/,0
65394035,周末爬个山，赏个美景，真的很惬意，不过一定提前出发，景点路线实在的态度堵，在车里的孩子们都没耐心了，也适合这个季节去爬山不冷不热,/Date(1662036174000+0800)/,0
65394035,也许我们那天去的，是初一，人超级的多，什么项目都排大队，车堵的更不甭提了，要是想去还真得提前早点去，一是不会堵车，二是不会排队,/Date(1661837005000+0800)/,0
3146912,北京的八大处公园位于北京西部的燕山山脉，距离香山非常近，八大处有佛寺，有舍利塔，很多游客来此游山，锻炼。周末好去处。,/Date(1674141244000+0800)/,0
55478519,最好平日去，周末去如果前面有小孩或者比较肉的，你能急死，下午走都比呀滑得快,/Date(1678090960000+0800)/,0
2991166,北京八大处公园，为国家AAAA级景区，是一座历史悠久、盛名远播、风水宜人的山地佛教寺庙园林。八大处公园灵光寺因供奉世间罕存的释迦牟尼灵牙舍利而驰名海内外。,/Date(1667206805000+0800)/,4
4312662,非常不错的地方，就是初一十五人太多,/Date(1662775996000+0800)/,0
2991166,八大处公园位于北京市著名西山风景区南麓，为国家AAAA级景区，是一座历史悠久、盛名远播、风水宜人的山地佛教寺庙园林。八大处公园冬季山暖风和，夏季凉爽宜人。土质肥沃、植被丰富。,/Date(1662447256000+0800)/,3
65394035,现在天气凉快了，还想去，八大处，爬个山，玩个水，还能看见小手术，山上树下掉了一地的小橡子果、可是有一天千万别赶到初初一十五再去，因为烧香拜佛的人多,/Date(1662762172000+0800)/,0
28913310,大年初七去的八大处公园，在灵光寺拜佛，非常有意义的一天，不错😊,/Date(1674967760000+0800)/,0
53317102,非常方便！并且出票很快,/Date(1679722375000+0800)/,0
262900873,很好的一次旅游 ，交通方便，值得来一趟，购物也是非常的愉快!,/Date(1679035940000+0800)/,0
65394035,主要是带着孩子们去玩滑车，人是超级的多，排着大队也要等着滑，真希望八大处工作人员能对工作上岗上线,/Date(1661612291000+0800)/,0
79425573,滑道很好玩 可以自己控制速度 个人感觉比坐缆车下山有趣多了,/Date(1674430699000+0800)/,0
465750,30年没有去过的地方，只依稀记得突突的山，和满山的野花,/Date(1674399939000+0800)/,0
12081515,疫情期间没什么人，本来去转塔，可是没开，有点遗憾。,/Date(1680731892000+0800)/,0
38319883,索道有点老旧，时间久了正常。整体体验不错。,/Date(1677246938000+0800)/,0
201460270,很好很不错很好很不错。,/Date(1676002103000+0800)/,1
95290236,节假日人很多～～，停车场早早就满了，要走上去，山下有交通疏导～～缆车人不多，滑道人比较多～～，缆车有小风扇～～，风光比较好,/Date(1674646099000+0800)/,0
447258751,元旦去的好冷，巨冷，冷到要撅过去了，没有啥可以可以取暖到地方，风景开阔，人很多，有卖香的30块24根，50块48根，二处开了，三处四处没开，没有爬上去，别的就不知道开门没有了。冬天来建议大家做好保暖。,/Date(1673101513000+0800)/,0
286032166,大家来的话，开车提前来，要不然不好停车,/Date(1677577689000+0800)/,0
241911409,观自在菩萨。愿度一切苦厄。阿弥陀佛。,/Date(1679908472000+0800)/,0
24797139,八大处公园小巧别致非常漂亮值得一看,/Date(1675173743000+0800)/,0
159036853,景色不错，爬到山顶坐了缆车下来的,/Date(1680311294000+0800)/,0
46168956,天气好时景色很好，园内设施很完善,/Date(1677246372000+0800)/,0
385614080,因过竹院逢僧话，偷的浮生半日闲。,/Date(1676686622000+0800)/,0
238990250,值得一去，春暖花开的时节会再去。,/Date(1674891485000+0800)/,0
173984282,多次来这里 但停车场到景点有些远,/Date(1677233643000+0800)/,0
678030,园内设施齐全，春秋季去比较好。,/Date(1676652564000+0800)/,0
3046695,上到了顶人太多了，只能再爬下来,/Date(1675753877000+0800)/,0
78794623,为了逛庙会去的，都是小吃还不错,/Date(1674476854000+0800)/,0
412535242,登山时携带登山杖，斜坡较多。,/Date(1679210025000+0800)/,0
241895242,春天爬爬山，走走路，太适合了,/Date(1678091711000+0800)/,0
4368081,去了好几次的公园，家人喜欢,/Date(1674485416000+0800)/,0
3869389,去的二处灵光寺 进园方便！,/Date(1680482444000+0800)/,0
8300419,建议滑道下去 滑道就是人多,/Date(1675134709000+0800)/,0
179685679,空气超好，令人心旷神怡,/Date(1677658155000+0800)/,0
262444485,很好玩！坐小车下来很棒,/Date(1674314237000+0800)/,0
351816814,人很多，春节氛围很好,/Date(1674622074000+0800)/,0
15121998,中秋假期第二天，一个人来八大处转转，别说，人还挺多的！八大处好像重新装修了？感觉比以前好了很多……,/Date(1663017526000+0800)/,0
35961526,离家很近的公园，没有逛公园里面。带孩子一路跑跑停停，不到两小时到达山顶，本想做滑道下来，可是天公不作美，要下雨了，滑道暂停，选择做缆车下山，快出公园门口，下起大雨😁,/Date(1664885488000+0800)/,0
48353244,孩子爬山很起劲，玩的也很开心，唯一美中不足遗憾的是灵光寺不开门，只能远远瞻仰下佛牙舍利塔便心又不舍的向上其他几处去游玩了。,/Date(1673866101000+0800)/,0
65394035,现在的八大处片片橡树秋叶，橡子果美了一地，美了一季、带上家人，带上孩子们，去玩吧！,/Date(1662966231000+0800)/,0
29623885,为了去庙会买的票 日子终于慢慢恢复到疫情前的样子了 庙会的物价又涨了 顺便爬爬山 挺好的,/Date(1676520950000+0800)/,0
272043606,我们是2022年11月5日上午9:30到达的八大处公园  那天天气很好没有大风 阳光明媚。可能是到的早的原因游客不多我们买的缆车票上山没有排队 缆车可以坐2大1小 运行的较慢 有20分钟吧不确定就能到宝珠洞附近 对于带着小宝宝的朋友很友好。下山可以选择缆车 还有滑道。就是坐缆车最好别带着孩子的推车山顶是台阶 推车不方便下。美中不足是没什么红叶🍁 可能本就是少吧  喜欢爬山🧗的朋友可以随便爬 哈哈哈 等我们要离开时 大概12点吧 游客就多起来了   缆车也开始排队了。天气好的时候去玩玩挺好的。,/Date(1667782586000+0800)/,0
630966,非常棒。夏天特别的凉快。是纳凉的好地方,/Date(1674097069000+0800)/,0
7042574,北京近郊难得的好去处，有有风景有信仰,/Date(1669377699000+0800)/,0
12081515,疫情期间人少，安静，本来打算去转塔，可是关闭了，随便逛了一下，有时间再去吧,/Date(1679033543000+0800)/,0
65498569,北京西山南端的佛教古刹著名景点,/Date(1669526940000+0800)/,0
14186056,"有一阵儿没来八大处了，因为这地方主要是烧香，如果论爬山，这里高度不如香炉峰，如果想看景儿，又远不如西山和香山丰富，而喜欢摄影的话显然去颐和园和园明园更好取景，这里的特点就是寺院多、香火旺，要是不为烧香自然也就没有太多来这里的需求，尤其是小孩儿就更不会对这里有太多兴趣。但八达处也有一个特别能吸引小孩儿的地方，就是山上的富斯特滑道，今天就是特意带孩子来滑滑道，好久不滑孩子还一直惦记着，想滑。也好，孩子平时也不怎么爱运动，为了滑滑道总得先爬到虎头山上吧，正好锻炼锻炼。
        现在公园门口跟以前大不一样了，原来大门外没几步就是嘈杂至极的小马路，那条路就没有不堵车的时候，别提多乱了，好处是大门旁边就有个小停车场，只要来得早就可以把车停进去；现在不一样了，大门周边好大的范围都给封起来了，停车场修在一公里多以外的地方，挺大的两个停车场，里面还有好多充电桩，停车一次收费20，这样倒是不用赶着特别早来了，就是走得太远，看别人说是有接驳车，但根本没看见。八大处周边在盖楼，还有庄园、酒店一类的，这倒是好风水、好景观，也好赚钱吧。
        公园里有好几座寺院，现在有几座正在修缮，不开放，来烧香的人会受影响，不过在寺院外面倒也还有可以烧香的地方，只要虔诚总会有办法。公园一进门右手边的池塘里荷花正在花期，虽然花不多但开得正盛，水面还有不少乌龟估计是放生的，也有几只小鸭子在悠闲地划水。大门一直走到头就是索道站，这里的缆车五颜六色很漂亮，不过索道距离不长，而且说实话虎头山这小山也没啥风景，还不如走上去活动活动筋骨。上山每次都爱走中华精印谷，山谷里很清凉，还有小溪野趣，更可以边走边欣赏各个朝代的印章，边走边看没多久就到半山腰了。再往上的路发现新修了木栈道，也可能不是新修的，毕竟我们已经好一阵儿没来过了，这段也不远，用不了十分钟就到关帝庙了，索道站、滑道站就在这里。
        这个滑道吧，还是人少的时候有意思，最好是一早就来，赶第一拨儿发车，一路上可以滑得特别刺激。要是来晚了，前面好多车，再有不少上岁数又带小孩儿的，快一点儿就害怕，恨不得一路拉着刹车，那这体验感可就大打折扣了。
        滑道下来直走就可以出公园大门了，玩这一趟连爬山带滑道用了也就两个小时不到吧，滑道一人一百，又买点儿吃喝，花了得有四百多，锻炼效果倒是不错，另外风景也看了，挺好。",/Date(1662136150000+0800)/,5
1160809,庙会去的 就那样吧 没有小时候的感觉了 全是磨刀霍霍的商贩 嗯,/Date(1677092400000+0800)/,0
209776680,有事没事儿去八大处爬爬山，锻炼身体，修养身心~,/Date(1675422983000+0800)/,0
179631467,不错，真不错，园内非常好，非常干净，各各庙也非常干净，服务也非常好,/Date(1672939007000+0800)/,0
25018558,离家很近的一个公园，没事的时候就喜欢来这做做，这里的香火很旺。,/Date(1673449398000+0800)/,0
188238617,一路赏美景，还抓到了好多小昆虫，寓教于乐,/Date(1662901523000+0800)/,1
1279443,八大处的香火是出了名的旺，可爬山可缆车可滑道，清凉静心，山间和朋友品茶食素，大隐于市就是如此吧,/Date(1665717797000+0800)/,0
18370792,山林中穿行还真是挺爽的，感觉没多久就到山脚下了。。。缆车上去出来就能看到，只是排队有些多，前面有人中途停止拍照，工作人员也不管理，后半程堵车中滑完的,/Date(1661675878000+0800)/,1
392598899,不错出游玩耍的地方，风景很好，而且玩游的地点和可玩性很高。景区吃的叶不贵还有很多特色小吃。景区的周围还有其他景区，交通便利。,/Date(1668132133000+0800)/,0
35546121,本来是爬山的景点，现在成了佛教徒的圣地。,/Date(1662528574000+0800)/,2
1514505,八大处公园位于北京市著名西山风景区南麓，为国家AAAA级景区，是建国后首批北京市重点文物保护单位，是一座历史悠久、盛名远播、风水宜人的山地佛教寺庙园林。八大处公园是由西山余脉翠微山、平坡山、卢师山所环抱，三山形似座椅，八座古刹星罗棋布分布在三山之中，自然天成的“十二景观”更是闻名遐尔，古人即赞曰“三山如华屋，八刹如屋中古董，十二景则如屋外花园”又有云“香山之美在于人工，八大处之美在于天然，其天然之美又有过于西山诸胜。八大处公园因二处灵光寺供奉世间罕存的释迦牟尼灵牙舍利而驰名海内外，近年来灵光寺内先后修建的《般诺波罗密多心经》墙，500罗汉浮雕与佛牙舍利形成了佛法僧一体的圆满。八座古刹中最古老寺庙是八处证果寺，建于隋末唐初，历经宋元明清历代修建而成，最大的寺庙是康熙、乾隆的帝王行宫香界寺。八大处公园虽以八座古刹而得名，但在2000年发现明代摩崖石刻则以八大处第九处轰动京城，吸引着石刻爱好者和众多的佛教信徒。,/Date(1644917992000+0800)/,8
108993222,"因为从小就学习生活在八大处山脚下，对八大处公园有格外的情感，那时候上学的体育课就是跑山，跑到山顶再跑下来25分钟算及格，不知道上上下下摸索出多少不同的线路来。每年秋天有重阳登山节和红叶的时候，我们都是第一个知道的。上小学的时候这里就有当时号称亚洲第一长的富思特滑道，可惜那个时候没钱，一直没有机会坐，这次带着家里人一起来玩，赶紧弥补一下小时候的遗憾。

八大处正常是从公园正门进，最著名的二处灵光寺和佛牙舍利塔就离正门不远，但我更喜欢把车开到八大处的后山顶，从后门进入公园，这里登高望远，视野很好，而且带着老人少去了爬山的辛苦。后门进去不远就是座落在山顶的七处宝珠洞，从这里的观景台山下往还能清楚的看到我的小学。而且这里离滑道的起点很近，直接买票带着家里老人体验了一下童年乐趣，别看现在这个滑道已经不是亚洲最长，但是从上到下依然滑了10多分钟，滑道的终点就在山脚下了，再买个缆车票回到山顶，很是方便。（我在滑道缓慢的时候拍了视频，正常这样是不允许的，大家不要学我）

八大处作为近郊的一个天然氧吧公园，无论从距离、价格、登山难度上都很亲民，交通很方便，如果开车的话，走周末周末可能会堵一些，建议提前找个地方停车走过来，或者直接开到山上，导航定位“陈家沟”，从后门进园。",/Date(1629459882000+0800)/,10
48947867,赶上庙会最后一天，实话实说，和疫情前的水平比还有差距，不过相信会越来越好吧,/Date(1675158710000+0800)/,0
3110903,在哪里的服务真实两极分化，好的特别好，就比如最顶上的寺庙很好！然而在中间位置里面有个敲钟的寺庙，大家谨慎为好！,/Date(1673015328000+0800)/,0
235653029,八大处公园非常漂亮值得一看不错,/Date(1672323522000+0800)/,0
17636559,登高，赏秋，拜佛于一体！不错！,/Date(1666577017000+0800)/,0
1126860,使用方便，不用兑换可以直接用,/Date(1670972704000+0800)/,0
4926180,初一过来上香，人多，不好停车,/Date(1661849572000+0800)/,0
315862572,交通便利，去过好几次。,/Date(1672303013000+0800)/,0
8290706,无敌了，疫情期间都不开,/Date(1670736142000+0800)/,0
88603546,都开放了，而且翻修了，体验感不错，就是滑道又涨价了，一百一人了,/Date(1663468920000+0800)/,0
164479925,一般吧，出去溜达溜达,/Date(1670456222000+0800)/,0
28913310,每年必去八大处公园的灵光寺，已经三年没有对外开放了！,/Date(1665928653000+0800)/,0
3631893,缆车比较长，坐了将近半小时，一路向上，省去了爬山的辛苦。下山滑道人多，排队挺长的，走路下山。路比较缓和，不是太费力，周末人比较多。,/Date(1663849570000+0800)/,0
2463914,只能说滑道还可以，算不上多好，携程订的滑道票还得去换票，比如刷码，刷身份证不好吗，还有就是滑道旁工作人员啥也不管，好多岁数大的中途停下，一点也不刺激，还容易出事故，都差点撞到一起，真有撞到的，体验一次得啦,/Date(1664964664000+0800)/,0
415621,西山八大处，山清水秀，我们乘坐缆车上下山比较轻松，在缆车上可以俯看二处灵光寺，在山顶可以看北京城。是个休闲游玩的好去处。,/Date(1661490265000+0800)/,0
4829184,"📍详细地址：八大处位于北京西山著名风景区南麓，距市中心16公里。

🚗交通攻略：适合自驾，南门外有停车场，每次停车20元。

🕙开放时间：06:00-18:00。

💰门票价格：成人10元，超过1.2米儿童5元。

🌟亮点特色：八大处始建于隋唐至明清时期，因山中有八座古刹而得名。一处是长安寺，目前没有开放。二处灵光寺，因为供奉世间罕存的释迦牟尼佛灵牙舍利而闻名。三处是三山庵。四处是大悲寺，殿内有十八罗汉雕像。五处是龙泉庵。六处是香界寺，为八大处的主寺，正殿供奉大佛三尊。七处宝珠洞，是八大处中山势最高的一处，这里有一座乾隆题字的牌坊。八处是证果寺，与另外七处不在一起。

📌小Tips：公园里基本上是台阶和坡路，路比较好走，建议穿运动鞋，可以从下往上把前七处边走边参观，2-3小时。到达山顶可以坐滑道（80元每位）下山，或者坐缆车（60元单程每位）。滑道高峰时间可能会排队，但是滑下来还是很有趣的，小朋友尤其喜欢。",/Date(1635317141000+0800)/,6
925679,北京八大处公园名气很大，似乎游人不多，也许是现代人难以静下心来体悟这里的妙处。来过几次，非常喜欢这个公园。如果不忙，这里可以徜徉一整天。这里有北方的山光，有地位颇高的寺庙，，还有深厚的文化积淀，梵音缭绕中，允许你的心境融入其中……,/Date(1614994392000+0800)/,6
192376924,一共八座皇家寺庙，自然与人文融为一体,/Date(1666195090000+0800)/,0
716975,山不是很高，适合老人孩子玩，香火很旺,/Date(1662002288000+0800)/,0
164479925,总体来说还不错的，无聊的时候可以去,/Date(1672801698000+0800)/,0
