2156086,"八大处公园，在北京西山风景区南麓，为4A级景区，是一座历史悠久的山地佛教寺庙园林。
八大处由西山余脉翠微山、平坡山、卢师山环抱，三山形似座椅，八座古刹星罗棋布分布在三山之中，自然天成“十二景观”。古人曾赞它：“三山如华屋，八刹如屋中古董，十二景则如屋外花园”。
八大处因二处灵光寺供奉释迦牟尼灵牙舍利而驰名海内外。近年来灵光寺内先后修建的《般诺波罗密多心经》墙，500罗汉浮雕与佛牙舍利形成了佛法僧一体的圆满。
八大处中最古老寺庙是八处证果寺，建于隋末唐初，历经宋元明清历代修建而成。
最大的寺庙则是康熙、乾隆的帝王行宫香界寺。八大处公园虽以八座古刹而得名，2000年发现的明代摩崖石刻则曾经轰动京城，吸引着石刻爱好者。",/Date(1596615069000+0800)/,2
75646189,八大处公园在北京西山，是民间的佛教圣地,/Date(1655364013000+0800)/,0
28236001,集休闲娱乐健身为一体，外加空气新鲜,/Date(1661121972000+0800)/,0
390576695,风景优美，气候宜人，佛家圣地，适合郊游度假，游玩观赏，值得推荐👍👍👍,/Date(1658107567000+0800)/,0
218650244,非常不错的地方，就是节假日人太多。,/Date(1655426041000+0800)/,0
4613789,北京八大处公园景色秀丽，空气新鲜。,/Date(1652536612000+0800)/,0
249915482,不错的地方，适合周末全家一起出行！,/Date(1645963699000+0800)/,0
82648901,跟着一大群人去的，打酱油了。。。,/Date(1648727273000+0800)/,0
37037481,霜降这天去的，坐的公交车。在离公园一公里处有免费摆渡车。八大处挺好爬的，我们到了七处，看到很多拜佛的，据说香火很盛。节假日就不要玩滑道了，人真是太多了。,/Date(1634991067000+0800)/,0
2147345,一家子还是在春节期间去的。不错。,/Date(1619696364000+0800)/,0
716975,山不是很高，香火很旺，仙气飘飘,/Date(1661128623000+0800)/,0
28236001,闲时踏青，健体强身，心身放松！,/Date(1653104176000+0800)/,0
200985547,八大处凭网购票扫码入园。景区外停车场改建不能停车，自驾车停在入山牌楼西侧停车场，牌楼处有景区免费摆渡车到门口。,/Date(1635151617000+0800)/,0
183563191,超级值得。不枉此行。有生之荣幸,/Date(1617803855000+0800)/,0
237676928,爬了山虽然累，但是心情不错的,/Date(1649373296000+0800)/,2
391762204,滑道太可怕了！清明节期间去的，购票排队，滑道排队！从下午一点一直排到了五点才滑下来！要不是因为买了票不能退，这么半天走下来都够了。并且排队真的是人挨人，完全没有疫情防控可谈。,/Date(1650022402000+0800)/,0
222807600,这里的景点都不错，值得看的就是八达处的二处灵光寺里的佛牙舍利塔，还有特别有灵性的招仙塔。,/Date(1632616527000+0800)/,2
43584507,位置离家很近，开车不到20分钟的路程，每次去都会兑换使用，***很多，出票速度也很快，兑换比较方便，一次愉快的购物体验,/Date(1629916271000+0800)/,0
20264430,带着我家两小只一起去玩的，我们每人都玩了两回，而且最小那只2岁。我们在平日一个特别早的时候去的，先爬上山，然后坐小车下来，我开车非常慢，以至于后面的人追上我，都想超车了，哈哈哈，但是我带着娃，开着肯定想更安全嘛。总体来说很好玩啦，很多老爷子老太太也玩！有趣好玩，,/Date(1623722428000+0800)/,0
36595844,"八大处公园是由西山余脉翠微山、平坡山、卢师山所环抱，三山形似座椅，
八大处公园因二处灵光寺供奉世间罕存的释迦牟尼灵牙舍利而驰名海内外，近年来灵光寺内先后修建的《般诺波罗密多心经》墙，500罗汉浮雕与佛牙舍利形成了佛法僧一体的圆满。八座古刹中最古老寺庙是八处证果寺，建于隋末唐初，历经宋元明清历代修建而成。八大处公园虽以八座古刹而得名。",/Date(1587651699000+0800)/,2
37808965,每次八大处 都是我静心的时候 到达二处 跪拜佛祖菩萨 心里很舒畅,/Date(1658617277000+0800)/,1
131769,挺方便的。验票很快，不用排队。滑道和缆车值得带家人去体验一下。蛮有趣的。,/Date(1645933992000+0800)/,0
181880173,八大处公园是被翠微、平坡、卢师三山环抱寺庙群，景色不输香山。其中二处灵光寺存有世界仅存两棵释迦牟尼佛牙舍利之一，四处香界寺曾经最为辉煌的寺庙，八处证果寺是建造最早的寺庙。,/Date(1587817030000+0800)/,1
112462802,北京西郊外有个西山，西山南麓是八大处公园，这里的树木茂盛，有个古塔，值得看看，可以登山感受公园的风光，这里的香火旺盛，确实不错！,/Date(1591757438000+0800)/,5
48239885,传说中的有求必应，果然灵验。景色也非常好，是周末家庭旅游的好去处,/Date(1660572545000+0800)/,0
265330017,八大处烧香据说比较灵 来这儿替妈妈许愿希望父母身体安康，快乐永相随,/Date(1657539172000+0800)/,0
96097455,愿佛祖保佑，所求皆成，姻缘天定，身体健康，万事如意，心想事成。,/Date(1660529754000+0800)/,0
8445353,这地方香火挺旺，每一处都有工作人员让你购买点灯，顿时感觉多了几分俗气。浑然天成，虽经多次修葺，依山而建历史悠久的的寺庙确实值得边爬山边看一看。最喜欢的是第八处，刻着“曲径通幽处”的青石又古又文艺，很符合我的口味。秘摩崖也是巧夺天工，天然形成的屋檐让你感到被大自然庇佑，很想在里面沏一壶茶，吹吹微风，品品茗茶。看完其他处最后来这里参观时已经有些爬不动坡了。最想吐槽的是如果不按原路返回，而走下山路的话没有阶梯，为了方便走车，整个都是坡道，很累，很伤膝盖。我每天跑五公里的人回家后都小腿疼，劝大家还是原路返回走台阶路吧。,/Date(1609478033000+0800)/,1
1652716,"八大处的富思特滑道又称“旱地雪橇”，是我国修建的第一条滑道。它依平坡山势而建，全长1700米，共设有50多个弯道，高低落差240米，打破了奥地利一条1527米滑道的记录成为世界第一。
这里的滑道工具是一辆可以控制速度的旱地滑板车，操作很简单，大人孩子都喜欢。",/Date(1602047972000+0800)/,1
36595844,八大处公园位于北京市西山风景区南麓，为国家AAAA级景区，最著名的是舍利子和山上滑道。自然天成的“十二景观”更是闻名遐尔，古人即赞曰“三山如华屋，八刹如屋中古董，十二景则如屋外花园”又有云“香山之美在于人工，八大处之美在于天然，其天然之美又有过于西山诸胜。八大处公园因二处灵光寺供奉世间罕存的释迦牟尼灵牙舍利而驰名海内外。,/Date(1596768606000+0800)/,1
66374706,5月9日去的，人不算太多，门口不用排队，刷购票二维码就直接进去了。不用验证身份证，只是买票的时候填了身份证，感觉防控还是有漏洞。索道和滑道都开放了，之前不知道滑道是什么，买的索道票，后来看到滑道了很想滑，下次再去。携程买票能比现场便宜几块钱。,/Date(1589098780000+0800)/,1
235653029,八大处公园登高祈福的好地方，人很多,/Date(1654347365000+0800)/,1
35965642,八大处 秋景太美太漂亮，看美景的最佳时机，黄叶、红叶，五彩缤纷，美极了，就像进入童话故事里的世界，趣味性，性价比超高的，棒棒的。,/Date(1603856370000+0800)/,0
102785630,八大处公园，是北京比较著名的景区，也是离着市里比较近的一个公园了。公园历史悠久，景色美如画，是风水宜人的佛教寺庙园林。这边的山路比较平缓，没有很陡的地方，老人和孩子都可以来这里爬爬山。,/Date(1613526129000+0800)/,1
1744375,八大处已再无幽静和历史感！十年后再到这里，俨然已经是完全的烧香拜佛之地了，沿途就看到3个财神庙。不知是否十一缘故，停车场到大门将近一公里，对老人太不友好。最高处的景点维修不开放没有任何告知，登高无望远之处。龙泉茶社的猴魁新茶不错👍,/Date(1664870339000+0800)/,0
235653029,八大处公园在北京石景山区，是一家4A景区,/Date(1654945859000+0800)/,0
8705584,八大处由西山余脉翠微山、虎头山、卢师山所环抱，三山形似座椅，八座古刹星罗棋布分布在三山之中，自然天成的“十二景观”更是闻名遐尔，古人即赞曰“三山如华屋，八刹如屋中古董，十二景则如屋外花园”又有云“香山之美在于人工，八大处之美在于天然，其天然之美又有过于西山诸胜。八大处公园因二处灵光寺供奉世间罕存的释迦牟尼佛灵牙舍利而驰名海内外，近年来灵光寺内先后修建的《般若波罗密多心经》墙，500罗汉浮雕与佛牙舍利形成了佛法僧一体的圆满,/Date(1588430687000+0800)/,2
2677309,缆车上山轻松很多，票价比现场买便宜2元,/Date(1660530009000+0800)/,0
1834839,人太多了，从停车场到景区大门得走半小时,/Date(1647745613000+0800)/,0
74011233,八大处公园位于北京石景山区，不错的地方，公园里寺庙很多，保存的很好，推荐来看看,/Date(1640446999000+0800)/,0
24797139,八大处公园小巧别致，非常漂亮值得一看,/Date(1657839883000+0800)/,0
24797139,八大处公园在北京石景山区，著名景点,/Date(1646912821000+0800)/,0
313810868,缆车滑道不能用。早点说啊。。。。,/Date(1651585813000+0800)/,0
24316362,性价比很高的公园，门票十元，可以爬上山或者坐缆车，下山建议做滑道，很刺激,/Date(1640482342000+0800)/,0
195612074,北京很不错的一个公园，门票也不贵,/Date(1629905432000+0800)/,2
35299796,八大处公园京西佛教圣地，香火旺盛，内有八处精致景点，有时间建议去看看…,/Date(1641332801000+0800)/,0
24395793,爬山就为了玩滑道，比较过瘾呢。,/Date(1620197298000+0800)/,0
179631467,真不错，是烧香拜佛的好地方,/Date(1651375581000+0800)/,0
153643650,疫情期间很多殿都不能进去。,/Date(1649063156000+0800)/,0
35299796,八大处公园京西佛教圣地。环境优美，香火旺盛，有时间值得去感受一下！,/Date(1633214691000+0800)/,0
68724711,据说这里的寺庙都很有名，可能是比较古朴的感觉，然后历史也比较悠久，个人还是很喜欢这种风格和style，最热闹的时候是每年春节的时候，大家新年祈福。,/Date(1588572574000+0800)/,0
40121619,很好的一个公园，就是停车不方便，排队要很久。,/Date(1635423263000+0800)/,1
17510310,很好的公园，合适走走。,/Date(1658382600000+0800)/,0
384488253,遗憾的是灵光寺没有开。,/Date(1645259918000+0800)/,0
52238993,滑道在七处，爬上去大概40分钟，爬的高滑的远，整个滑道还挺长的，就是人太多，前面有一个慢的，后面都得压着，速度上不去，如果放开速度，还是很快的，很好玩儿，孩子喜欢,/Date(1613785538000+0800)/,1
203572669,"【景色】美丽，京西好去处
【趣味】处处为景",/Date(1637756863000+0800)/,1
7658625,西山八大处公园，北京最美的景色之一，尤其是夏秋季节，非常漂亮,/Date(1636892672000+0800)/,0
28427292,疫情期间一处四处都没开，周末缆车滑道人太多了，不过滑道很好玩,/Date(1629560077000+0800)/,0
24316362,西山有名的佛教公园，山不算高，可以爬上去，下山可以体验滑道,/Date(1632607970000+0800)/,0
26683970,虽然灵光寺没开门，但祈福的人还是很多，从停车场出来，牌楼往前一点就有免费摆渡车，非常贴心，祝大家虎年大吉，财源广进！,/Date(1644389485000+0800)/,1
11769230,和父母去玩儿了一趟，父母年纪较大，担心上山下山时体力不支，所以选择了索道上山，滑车下山的方式，非常方便。而且景点也比较集中，不是很累。,/Date(1616404553000+0800)/,0
156424964,风来雾走，蓝天白云，八大处山顶看北京城，因为疫情提倡就地过年，所以在帝都旅游最不佳季节，体验了旅游旺季的人潮人海，不过风景还是不错的。,/Date(1613398253000+0800)/,0
38568194,去了还想去的地方，留下美好回忆！,/Date(1630338503000+0800)/,1
63709039,人太多，排队两个小时，坐三分钟还有两分钟堵车走不动,/Date(1677669550000+0800)/,0
364648400,环境优美，很值得一去的地方，就是有点可惜，佛舍弟塔维修，暂停开放了，没有看到世界上仅存的释迦摩尼佛的两颗佛牙的之一，不过都挺好了！,/Date(1641211801000+0800)/,0
17524332,从下边爬到顶峰也没用多长时间，做滑道下来简直太爽了,/Date(1630286186000+0800)/,0
24316362,京西人比较少的景点，可以爬山，还能做滑道，很有意思,/Date(1624624698000+0800)/,0
30853330,环境整体不错，设施齐全，也很符合防疫标准，不错,/Date(1634231491000+0800)/,0
28913310,八大处公园的灵光寺一直没有开门，在门外拜一拜,/Date(1623324954000+0800)/,0
737018,缆车到站不停不减速，除非你是老年人，即使是孩子也得跟着缆车跑着上，很容易磕到碰到！,/Date(1661254245000+0800)/,0
2280174,门口走了一大段，没有摆渡车，进去以后没有坐上滑索，很遗憾，专程来做的，疫情影响关了,/Date(1659182765000+0800)/,0
47000713,特别好的一个景点，登高望远，踏青非常合适！,/Date(1644916832000+0800)/,0
73672599,北京郊区的一个公园，分为7处和八处，很不错,/Date(1629387443000+0800)/,0
217487102,昨天的天气格外晴朗，到八大处和香山公园，以及植物园的游人多呀，可以说是停车排队2小时，进山门一个小时，等候乘坐滑道2小时。,/Date(1613979715000+0800)/,0
223681281,。地方好的游出子亲个一是处大八，之总。激刺瘾过常非道滑，来下道滑坐以可的激刺欢喜，山上车览坐处一从以可，吧痒的然天是就木树的山满，美优色景园公,/Date(1590223435000+0800)/,1
28913310,每年都去一次的八大处公园，灵光寺非常不错,/Date(1639569349000+0800)/,0
192376924,此处因有八座寺庙而得名，过去属于皇家禁地,/Date(1627413962000+0800)/,0
3719384,公园很不错，爬爬山也不累，索道特别不错么,/Date(1626768316000+0800)/,0
26668609,老市属公园，景色好，没去八处，3小时上山到七处下来，感觉轻松,/Date(1618033058000+0800)/,1
3165121,春节后出行，八大处的很多寺庙处于关闭状态，也就爬爬山，上面的几处倒是开放着，环境还是不错的，很多年没来了，变化还是挺大的,/Date(1617583881000+0800)/,0
52238993,十一期间去，不用预约，网上直接购票即可，进门摸摸寿星头，二处烧香拜佛，顺着山路一直走，七处就可以坐缆车或者滑道下去了，滑道还挺长，就是人太多了，排了将近一小时才坐上，缆车就没什么人了，下山在二处吃的素斋，味道还不错，就是不便宜,/Date(1602069157000+0800)/,0
47896786,最喜欢八大处公园的滑道，滑道全程很长，非常过瘾！我和儿子乃至全家都玩过好多次叻，全家玩得其乐融融欢乐开怀。索道也很长，上山索道下山滑道是最完美的组合，徒步上山不建议，因为太累了，我们走了10分之一就放弃了，最后还是用索道，这不是钱不钱的事儿，真心担心老人小孩子累出个好歹。山顶景色也比较美，可以纵观北京城，前提是沒雾霾的天气情况下喔,/Date(1498955395000+0800)/,14
50695342,八大处公园，北京的八大处，登山的地方。,/Date(1637981680000+0800)/,0
40121619,不错啊，每年都会过去，就是停车很麻烦。,/Date(1619522752000+0800)/,0
37393645,朝拜圣地，释迦摩尼舍利塔，听说很灵验。,/Date(1617785877000+0800)/,0
102785630,八大处公园，是北京的一个老的公园了。,/Date(1622455685000+0800)/,0
322875754,以前去过，现在还在怀念，好想再去看看,/Date(1619854977000+0800)/,0
73672599,很喜欢玩这里的滑道，距离长，速度快,/Date(1629859350000+0800)/,0
716975,离家很近的公园，周末爬山，快乐无比,/Date(1629024674000+0800)/,0
35299796,佛门圣地香火旺，值得一去的好地方！,/Date(1624827469000+0800)/,0
116032136,八大处改扩建了很多，更喜欢老建筑。,/Date(1615606769000+0800)/,0
56183558,性价比很高的景点，下次还会再来。,/Date(1640140107000+0800)/,0
28236001,交通还算便利，爬山可以锻炼身体！,/Date(1637110619000+0800)/,0
28236001,运动，休闲，日光浴，享受又健康！,/Date(1636872091000+0800)/,0
28913310,京西八大处公园非常不错，棒棒的！,/Date(1631704977000+0800)/,0
7139694,很不错的一个公园，最好玩的是滑道,/Date(1629901323000+0800)/,0
716975,家门口的公园，爬山遛早儿的好地方,/Date(1625998160000+0800)/,0
78030243,老公园了，很不错的锻炼身体的地方,/Date(1623815544000+0800)/,0
716975,秋天登山的好去处，山不高很好爬,/Date(1635285357000+0800)/,0
17524332,八大处公园的福斯特滑道值得一玩,/Date(1629677144000+0800)/,0
40121619,非常好的一个地方，适合逛一逛。,/Date(1627456444000+0800)/,0
28427292,很喜欢的公园，年轻时经常来逛。,/Date(1626225436000+0800)/,0
78030243,挺不错的公园，周末去逛逛挺不错,/Date(1625277237000+0800)/,0
10354091,春季爬山的好去处，值得去逛逛逛,/Date(1615882467000+0800)/,0
40026357,香火旺盛 景色很美 年年都去 好,/Date(1617759327000+0800)/,0
602117,八大处的《二十四孝图》。&amp;quot;孝&amp;quot;是儒家伦理思想的核心，是千百年来中国社会维系家庭关系的道德准则，“孝道”是我中华民族传统文化之精髓。佛教圣地----八大处，更应传承中华美德，阿弥陀佛,/Date(1493697793000+0800)/,9
32660520,八大处是一处非常适合休闲散步的地方，山不算很高，很容易就爬上了山顶，还能看看风景，并且有小朋友非常喜欢坐的滑道和索道，乐趣多多，很是不错。,/Date(1593066167000+0800)/,0
223681281,带孩子坐缆车上的山，从缆车往下看是漫山的树木，感觉心情舒畅。坐滑道下的山，孩子非常喜欢往下冲的感觉，好玩、刺激，但是一定要注意安全。,/Date(1590302379000+0800)/,0
12742111,秋天到了，来这里登山吧，欣赏彩叶缤纷，硕果累累。,/Date(1600902076000+0800)/,0
26741106,性价比挺高的，下山时候买的票，发现可以做往返。还是携程优惠力度大，单程往返一个价。纵然是60元单程就缆车里程来讲也是性价比挺高,/Date(1613208908000+0800)/,2
330213754,现在八大处修的挺好，各处环境不错，卫生干净,/Date(1660898618000+0800)/,0
112462802,八大处公园环境不错，位于西山山麓！这个公园树木很茂盛，秋季去的，感觉不错，公园有很多古典的楼阁，有古佛塔等，非常值得逛逛！,/Date(1589273172000+0800)/,0
237381997,八大处所在的翠微山，风景就很好，远山近水，轻烟薄雾，感觉挺美,/Date(1629861960000+0800)/,1
113196369,没有雾霾的北京，美的不要不要的，给一点小建议吧，首先说交通，真的很方便，没有想象中的那么堵。早上9点半到的八大处公园，全程腿着走，从一处到七处，然后在腿着走下来，用了查不到4个半小时(带着我六十岁的老娘)，所以，大家可以平衡下自己的体力，给纠结要不要做缆车下来的小伙伴一点参考。,/Date(1537710450000+0800)/,8
103852735,八大处始建于隋唐至明清时期，因山中有八座古刹而得名，是北京香火十分鼎盛的寺庙。,/Date(1627308256000+0800)/,0
38568194,很久没有去过八大处了，疫情之下重游八大处，感觉景色优美，空气清新，心情舒畅！,/Date(1592225652000+0800)/,0
198104002,不错，不错，价格也实惠，有机会再去,/Date(1655769297000+0800)/,0
211146795,这次是和朋友一起去的，帮朋友在携程上买的票，真是又方便又省事，非常不错哦。,/Date(1642921660000+0800)/,0
15703964,因为疫情又有点反弹，有屋顶的基本都不开放，看看自然风光也是很不错的，今天不是初一 十五 所以没有上香的人，基本是游人，人不是很多挺好的。,/Date(1635330885000+0800)/,1
158759073,每逢初一、十五，主要有时间肯定会去拜佛。去寺庙好好洗礼一下自己的心灵。,/Date(1629378346000+0800)/,0
366094960,人太多了，且没有公交车直达。,/Date(1646544873000+0800)/,0
28913310,八大处公园票价实惠，缆车比较长，本来想坐滑道，结果没开，缆车也行😁,/Date(1615087364000+0800)/,0
3719384,第一次去，真的不错，缆车景色优美，滑道也特别有意思，还会再去，携程购买比现场便宜，赞一个,/Date(1596369288000+0800)/,1
257273348,游玩感觉不错，人不多,/Date(1658930209000+0800)/,0
96227225,八大处所在的翠微山，风景就很好，远山近水，轻烟薄雾，感觉挺美,/Date(1629436942000+0800)/,0
188907836,索道景色不错，但是要看您的需求了，因为索道终点八处欢喜地景点单一，要是直接上来没什么好逛的。第一种最省心玩法，坐索道上坐滑道下，不费体力节省时间。第二种索道上步行下。第三种步行上山滑道下山。看个人身体素质了。,/Date(1614569609000+0800)/,1
50826816,选择国庆期间出游八大处，停车场排队爆满，如果不是选择一早去的话可以停在附近的停车场，门口扫码进入到景区很方便，果断去坐缆车上去，为了玩滑道下山，很多带孩子的家庭，感觉家长比娃娃们还开心哈哈，下次还会再来,/Date(1602109864000+0800)/,1
165059539,早上刚下过雨，八点才停，问了滑道售票处，滑道没有开，应该在中午能开，所以我们几个人决定爬上山顶，到了停车场，没有堵车，等了一辆车就有车位了，太阳也出来了，有点热，换了票进了八大处，前五处还是很好爬的，都是缓坡，台阶不太多，六处以后就都是台阶了，爬着有点吃力，景色还是很好的，我们走走停停爬了一个半小时，因为主要就是奔着滑道来的，开始还是想坐缆车上去的，又省时又省力，到了山顶，人不多，从携程上买的票，出票的速度很快，携程上比现场便宜两元，从网上购票机上换成纸质票就可以玩滑道了，我们用了12分钟，滑到了山下，好长的一个大滑梯啊！,/Date(1598310186000+0800)/,1
32249262,每年来好几次，散步，祈福，北京后花园一样的存在，爱了。,/Date(1616231151000+0800)/,0
5158298,门票10元，相对其他寺院而言，性价比高，里面风景也很好,/Date(1615598789000+0800)/,0
19390434,滑倒特别赞，稀饭，好想再去。约起来,/Date(1597895913000+0800)/,1
278193942,人多的时候下滑需要等的时间比较久，其他都还不错。,/Date(1623658439000+0800)/,0
3063924,第一次去了八处，还行，又从二处上到七处，人不少。,/Date(1618995309000+0800)/,0
111159497,第一次来八大处景区也是第一次做了滑道，感觉还不错～一开始还有点担心，后来发现大一点的小朋友也可以自己坐，可以自己控制速度，感觉很安全，就是人比较多化着滑着容易堵车哈哈哈,/Date(1610598665000+0800)/,0
24797139,八大处公园在西五环，隶属石景山区，是一个4A级景区。八大处的福斯特滑道很有名，玩起来很刺激。七处最高，登高望远，能看到北京的全貌,/Date(1598518511000+0800)/,0
41161680,非常好用，便捷！景色不错，有趣好玩，性价比高，,/Date(1619593292000+0800)/,0
47272622,周一下雪的时候去的，人不多，别有一番风味。有鸽子。雪天路滑，踩不稳。受疫情影响，有几个寺庙不开。停车场不限市场统一收费20元。,/Date(1611387526000+0800)/,0
555385,北方的山多有寺院、八大处几处都是皇帝来过的。,/Date(1639030765000+0800)/,0
5660253,非常方便，价格实惠，假期期间爬山的好去处，缆车上去的，半山腰可以俯瞰市里的风景，玩滑道的人特别多，人多滑不起来，孩子玩的非常开心，下次还会再来。,/Date(1588412295000+0800)/,1
743875,这个公园比较大，主要就是登山，绿化很棒啊。,/Date(1643900926000+0800)/,0
48434151,环境清幽，古柏参天，绿树成荫，泉水叮咚，是郊游的好地方。下山的滑道也非常值得一试！,/Date(1587310014000+0800)/,0
189750871,"八大处公园位于石景山的西北角，交通非常方便，下了公交车走几步路就到了。最有名的当属二处，有一座佛牙舍利塔。公园里景色很美，漫步在林荫道下，呼吸着清新的空气，心情非常舒畅。公园外是车水马龙，而公园里确是十分幽静。可以说，这里是一个市民休闲散步的好去处。
【景色】",/Date(1613436418000+0800)/,0
