21875946,作为中国实质性的标志建筑，能看得到的太局限，不过还是建议逛一下。,/Date(1449779102000+0800)/,2
52220297,不太长，人很少，拍照很好，去的时候天气很好，拍照很漂亮，景色美,/Date(1457145538000+0800)/,2
209900556,很不错的一个地方，来了好几次了，不同季节不同景色，从西边爬比较陡人也多，从东边爬比较缓人也少，体力好的可以东西两边都爬！,/Date(1578489892000+0800)/,1
36218441,居庸关绝对没有八达岭人多，就是知名度稍稍地低了一点，景点也偏少了一些，但是却可以真正做到游长城，路真的一点不好走，坡度，台阶也是挺高的，有点险要，可以带上爬山仗，水和食物都是补充能量的，反正也是尽自己的能力了，景色不错，没有人挤人的情况，环境干净，乱涂乱画也少一些，走走停停，算是要把目标征服，但是难度太大了，只能原路返回。,/Date(1573130946000+0800)/,1
13903508,蛮不错的，非常雄伟！国庆人也不是很多！带儿子体验了把不到长城非好汉的感觉！小男子汉全程狂爬！非常开心与兴奋！累并快乐着！,/Date(1507302307000+0800)/,1
265025333,带朋友出去带朋友旅行很不错的选择爬山，心情很好，景色很美。,/Date(1590033544000+0800)/,0
16634379,居庸关长城雄壮，爬起来也不累，并且景色很好，视野也开阔。,/Date(1586090192000+0800)/,0
3446384,秋天是很好的旅游季节，居庸关长城景色美，有人也很少，整个线路形成环线，大概需要3小时左右，有些地段特别险峻，很有挑战性！回来就向朋友推荐,/Date(1571888105000+0800)/,0
238024248,不错，真心不错有趣好玩，性价比高，总体超赞，景色不错，,/Date(1606494724000+0800)/,0
19737671,人不多 险峻陡 我走了东边又走了西边环线 陡的地方我是手脚并用的 喜欢刺激和不喜欢人太多的朋友可以选择,/Date(1564137877000+0800)/,0
5384725,居庸关长城比八达岭长城人少一些 景色也不差的 可以去看看,/Date(1587266896000+0800)/,0
55811334,相比八达岭人少却更陡峭，我从居庸关及云台石碑处攀登，速度快了点，到八号敌楼累得差点儿晕倒，嘴唇发白，欲速则不达，只好下来了。景色堪称绝岭雄风，停车免费，大气，推荐长城首选。,/Date(1502378858000+0800)/,2
31848719,居庸关险峻壮丽，台阶很陡峭。虽然没有八达岭那么壮观雄伟，但是人也相对较少，居庸关长城是一个环线，没有回头路，走一圈下来估计要三个小时左右，山势高低起伏，跑起来还是非常累的。,/Date(1466495599000+0800)/,4
5384725,北京的八达岭长城之外的又一条长城 居庸关长城感觉不错,/Date(1608260857000+0800)/,0
112462802,居庸关长城也是非常经典的长城段，从北京出发去了居庸关，看到了天下第一关的牌坊，感受居庸关长城的雄伟，蜿蜒曲折地盘踞在崇山峻岭之间！,/Date(1568819931000+0800)/,0
44563990,"居庸关长城人少，景美！
长城蜿蜒柔美，巾帼不让须眉",/Date(1601705630000+0800)/,0
105564828,比八达岭人少多了，还难爬，值得一去。就是也蛮远的,/Date(1600735371000+0800)/,0
13705259,乘坐北京公交一线去八达岭长城时路过居庸关长城，也是在群山间蜿蜒曲折的一段长城，准备下次再来北京时去爬，但貌似北京的公交都到八达岭,/Date(1548772619000+0800)/,0
49908565,长城太长啦！我最多走了3个烽火台就走不动了，有些路很陡，要注意安全！,/Date(1510183236000+0800)/,1
1700808,感觉比八达岭长城好多了。八达岭全是人，根本感觉不到长城本身的存在，居庸关长城很安静，很古老，很苍茫，很伟大。,/Date(1444991369000+0800)/,3
19257804,总体感受很好，值得推荐！但建议留足点体力，可发现不同的“长城”，同时强烈建议：自由行！,/Date(1511868797000+0800)/,0
3533411,路过过很多次，第一次进去，很值得一去，因开发得早，设施完善，自然风光和人文景观很棒。,/Date(1512377747000+0800)/,0
389065,赶在小长假之后去，人少，清静，，配套设施一应俱全，有吃有纪念品，价格还好，啤酒30，大部分饮料6块，烤肠5块，老外都很友善。,/Date(1493916292000+0800)/,2
217640588,好爬的长城，适合老年人，两个小时就能爬完。,/Date(1600662586000+0800)/,0
112748698,本来想去八达岭长城的，没开，去了居庸关长城，很值得，有的地方非常陡峭，是个锻炼意志力的好去处，在携程上面订还有优惠，很值！,/Date(1502729518000+0800)/,0
112217262,景色是真的美，值得一去，居庸叠翠如此可见。,/Date(1502535655000+0800)/,2
29970175,居庸叠翠是老北京八大景之一，这次去的时候是冬天，草木枯黄，但更显得这座关隘雄伟肃杀，两边的长城非常陡峭，上下都要手脚并用。,/Date(1493993247000+0800)/,2
495054,比八达岭陡峭，去的时候刚好人不多，爬的很爽,/Date(1459996063000+0800)/,2
219810002,总体超赞，性价比高，景色不错，有趣好玩，,/Date(1603503753000+0800)/,0
6803986,值得推荐，景色不错，体验很好，有趣好玩，,/Date(1603173717000+0800)/,0
186023566,有趣好玩，体验很好，值得推荐，景色不错，,/Date(1602078598000+0800)/,0
30042139,景色不错，有趣好玩，值得推荐，体验很好，,/Date(1598834326000+0800)/,0
4777289,有趣好玩，景色不错，体验很好，值得推荐，,/Date(1594223762000+0800)/,0
39520401,体验很好，有趣好玩，景色不错，值得推荐，,/Date(1593511205000+0800)/,0
14825559,其实挺方便的，居庸关的人比八达岭少多拉，,/Date(1590672823000+0800)/,0
47888586,"居庸关，是京北长城沿线上的著名古关城，“天下九塞”之一，“太行八陉”之八，国家级文物保护单位。

关城所在的峡谷，属太行余脉军都山地，西山夹峙，下有巨涧，悬崖峭壁，地形极为险要。居庸关与紫荆关、倒马关、固关并称明朝京西四大名关，其中居庸关、紫荆关、倒马关又称内三关。

居庸关是四大重要关卡之一，有南口，居庸关，上关和八达岭。",/Date(1583456379000+0800)/,0
25258734,很不错啊，凉爽，过年的时候去的没有什么人，很雄伟很壮观，祖国爱你(*￣3￣)╭♡,/Date(1559992967000+0800)/,0
162053443,又是一天长城游，完全是磨练人的意志的好景点，虽然累，可是也锻炼了身体，值得一游。,/Date(1518874013000+0800)/,0
19535541,外地人游北京大都选择八达岭长城，因为N多年前去过，所以这次选择人少又有挑战自我的居庸关长城。我觉得坐919路再倒879路公交人太多了而且还慢，应选择乘坐地铁到昌平西山口下，然后再坐公交车到居庸关长城。居庸叠翠西长城陡峭，东长城绵长，全程爬起来得需要体力和毅力了，带上足够的水来一场挑战自我的攀爬运动吧！,/Date(1507289701000+0800)/,0
2464612,始建于秦代、驰名于金代、复建于明代的居庸关长城因其险峻的地势、险要的位置而名满天下。而今遗世独立的关城不仅靠着“居庸叠翠”的壮美风光跻身“燕京八景”，而且它深厚的历史积淀和人类文化史上的典型意义早在上个世纪九十年代初便被联合国教科文组织关注，最终作为万里长城的精华被列入世界遗产名录。最为难能可贵的是，相对于八达岭长城摩肩接踵的地狱级游览模式，此地虽也游人络绎，却不至拥挤，堪为五洲四海倾慕长城人士的首选之所！,/Date(1493645992000+0800)/,2
214640,居庸关就在眼前，看不出雄伟，八达岭高速直接穿过去，看来在当年的地理位置是比较重要的，只是现在的发达弱化了它的险要。顺利上城，关内造型结构，都与山海关差不多，该有的都有了，只是没有山海关那样的庞大，周围风景感觉秀美。,/Date(1490479055000+0800)/,0
194761,去的那天有雾，下了点小雨，基本没多少游客，不拥挤，感觉很好。台阶高低不同，爬起来还是挺累的。长城巍峨壮观，真是佩服古人。,/Date(1472338822000+0800)/,0
35446243,风景不错，全程走下来差不多三个半小时，西长城险峻，东长城平缓。探险的年轻人可以走西长城，带小孩和老人建议从东长城旅游。 不过让人不理解的是景区对携程的客户明显比同城的客户要懒散缓慢的多。而且费用携程比同程的贵了五元！,/Date(1448859833000+0800)/,4
58610481,可惜风太大，没有登太高，景色不错人也少,/Date(1613469845000+0800)/,0
25465261,疫情防控➕工作日，这才是长城的大美时光,/Date(1601019656000+0800)/,0
4197622,人不多，还不错。没有索道，但是也不用爬很高。在携程上预定还是很方便的，一直用携程十几年，从网页开始到现在用app，从来没有失望，希望能越做越好，加强用户体验。,/Date(1568314934000+0800)/,0
2180963,离北京市区最近的长城，虽然坡度比较陡，但人少，风景也不错，还有古迹云台～推荐～,/Date(1462551990000+0800)/,0
3877103,不到长城飞好汉，台阶是真高，爬得好累,/Date(1599572525000+0800)/,0
227916786,疫情防控期间，门口保安不戴口罩，面对游客吐痰，很没有素质，居庸关景区管理处应对此恶劣现象进行整改,/Date(1595083649000+0800)/,1
80319779,感谢推荐此处！古老的长城，威严的城楼，沉淀着厚重的历史，远眺对面绵延山峦，山上长城蜿蜒盘旋，山下一列火车呼啸穿过，动与静的遥相呼应，历史与现代的完美结合，呈现一幅立体的北国风光！好心情好风景～～～,/Date(1571087993000+0800)/,0
35965642,居庸关长城感觉非常不错，挑战了自己，爬长城虽然很累很累，但是还是觉得很开心，有一种成就感，趣味性强，爬得不想爬的时候，鼓励自己坚持下来。,/Date(1565656025000+0800)/,1
110913348,蓝天白云，景美人少，开往夏天的列车，景色很赞，且没有八达岭的拥挤，值得游玩。,/Date(1561997354000+0800)/,0
393383,天气很好！人不多，居庸关长城比较陡，带孩子没法爬完全程，但是算是成为了好汉！,/Date(1538489243000+0800)/,0
1466766,山势雄威，比其他几处长城都要伟岸。,/Date(1601358446000+0800)/,0
38469292,锻炼身体毅力和感叹历史长河的角度来说值得一去。没有电瓶车，没有缆车，没有乌泱乌泱的游客，必须一步一步“爬&amp;quot;上去，我觉得这才是真正的好汉（女汉子）,/Date(1564313400000+0800)/,0
55648080,居庸关以雄伟而文明，比八达岭长城要陡，居庸关的名气不如八达岭，但也因此没有那么多的游客，如果想爬到最高的烽火台，需要几个小时的时间，体力好的人可以试试看。,/Date(1463041316000+0800)/,2
3758913,去往八达岭长城会经过的一个古代长城关口，没有八达岭出名，但是也很值得一去！,/Date(1451446395000+0800)/,2
6118515,非常不错的地方，值得一去的地方。,/Date(1614210441000+0800)/,0
852830,居庸关有好两个停车场，都很方便登长城，走一圈的话，需要多半天，要自带午饭，如果是半圈，两三个小时就够了，难度不大，小孩子应该也可以。,/Date(1574405626000+0800)/,1
6180706,几个朋友一起去的，大家都兴致很高，爬的我累死，但没一个朋友说不愿意的话。,/Date(1501682320000+0800)/,0
53457660,有趣好玩，景色不错，总体超赞，,/Date(1608952631000+0800)/,0
20716288,登高的好去处，空气好景色不错。,/Date(1599980122000+0800)/,0
98165945,值得推荐，景色不错，有趣好玩，,/Date(1598157583000+0800)/,0
11841432,景色不错，体验很好， 购票方便,/Date(1598150488000+0800)/,0
74944658,体验很好，值得推荐，景色不错，,/Date(1598013996000+0800)/,0
150562985,体验很好，值得推荐，有趣好玩，,/Date(1597982516000+0800)/,0
258096503,体验很好，景色不错，有趣好玩，,/Date(1594356542000+0800)/,0
136594085,有趣好玩，景色不错，体验很好，,/Date(1592010966000+0800)/,0
10391315,体验很好，景色不错，值得推荐，,/Date(1591456092000+0800)/,0
1047744,居庸关长城离北京比较近，八达岭高速边上，未出高速，还挺不错的，游玩之后可以继续往延庆县走，如果爬到顶，游玩时间可能有点长，挺累的。,/Date(1579348834000+0800)/,1
229000866,这里人不多，风景宜人，全程一圈需要3个小时左右，很多人都是只走一半，,/Date(1567697173000+0800)/,0
40543150,适合锻炼孩子毅力的，最高点值得攀爬，交通较多年前很方便了，最新最近最方便的交通为昌20路，给未来几天在北京的朋友一点提示，879离开景点入口一公里，沿着京藏线走吧，很偏，拉活的黑车不能信。,/Date(1565438514000+0800)/,0
18052867,和正常卖票一个窗口，正价35，还是便宜不少。取票挺方便，景色也不错。,/Date(1490539250000+0800)/,0
71785119,门票40，封闭的，可以转一圈，北山缓，南山陡峭，攀爬可以根据自身体力决定，山顶有卫生间，缺点，里面不能洗漱，山脚下有城隍庙，山神庙等昌68终点站。919慢车，872路过,/Date(1482272966000+0800)/,3
95409551,雄伟壮观，坚持下来就是胜利,/Date(1613562763000+0800)/,0
274756500,景色不错，就是自己体力不行,/Date(1598709552000+0800)/,0
29079479,疫情一半不开，进门爬半死。,/Date(1593269602000+0800)/,0
38469292,真要爬长城，千万别去八达岭，人山人海不说，还有缆车啥子影响登长城的情绪。居庸关长城，景美，人少，票价低。登长城的感觉超好，当然，说爬长城更恰当哦！,/Date(1572433757000+0800)/,0
168295976,居庸关长城建在一条长达15公里的山谷间，两旁山峦重叠，树木葱郁，山花烂漫，景色瑰丽，远在800年前的金代，就被列为燕京八景之一，称为“居庸叠翠”。,/Date(1530220505000+0800)/,0
11754785,还不错，经常去景色不错，,/Date(1613389665000+0800)/,0
283859633,有点险，但依旧很nice,/Date(1606715539000+0800)/,0
207739201,"长城，大概都是一个样子。想爬上去，但是累。景色就是那么个样。爬了一下也就走了。
还是山下的云台有些意思。",/Date(1600732863000+0800)/,0
32431712,天下第一雄关值得推荐，,/Date(1597501217000+0800)/,0
35693999,景色美，人少～有点难爬,/Date(1594278744000+0800)/,0
30020218,推荐，今年就靠北京游了,/Date(1593139145000+0800)/,0
205479826,居庸关是长城沿线上的著名关城，被称为长城三大关城之一，沿山而建，城楼上挂有“天下第一雄关”的匾额。攀爬长城到最上面的烽火台一般需要两三个小时。,/Date(1579479183000+0800)/,0
238017355,不错。感觉非常 非常的棒！下次来北京还来这里玩，并携带象家人哟！,/Date(1565733128000+0800)/,0
13062102,携程订票很方便快捷还有优惠，到景点直接刷身份证入园，淡季人很少游玩儿很尽兴，不错。,/Date(1518270612000+0800)/,1
61098185,那一次给我留下了深刻的印象，是我在北京醉最快乐的旅游景点之一！,/Date(1468722682000+0800)/,0
35945770,景色不错，总体超赞，,/Date(1612834283000+0800)/,0
13743717,有趣好玩，景色不错，,/Date(1607678539000+0800)/,0
5238124,景色不错，总体超赞，,/Date(1604100398000+0800)/,0
280688871,值得一游，下次再去。,/Date(1604029211000+0800)/,0
30220114,景色不错，值得推荐，,/Date(1602128257000+0800)/,0
208446970,太棒了可以看看大自然,/Date(1601945442000+0800)/,0
100076993,体验很好，景色不错，,/Date(1600836993000+0800)/,0
201254097,值得推荐，体验很好，,/Date(1600071093000+0800)/,0
115986100,值得推荐，景色不错，,/Date(1598961262000+0800)/,0
155833570,非常不错的景色不错，,/Date(1596444213000+0800)/,0
19303343,体验很好，锻炼身体。,/Date(1596202880000+0800)/,0
36693668,景色不错，值得推荐，,/Date(1595382020000+0800)/,0
53637460,人少，出着太阳下着雨,/Date(1591592512000+0800)/,0
16311309,很好，半天的时间足够了，景色也很好。台阶有的地方比较抖，还可以。景区也比较干净卫生，人不多，秩序很好,/Date(1566376872000+0800)/,0
25555065,这长城最大的好处就是它是一个环形 无论从哪登城 都可以转一整圈 不用走回头路 而且人还比八达岭少 所以强烈推荐,/Date(1559264172000+0800)/,0
55059585,城墙上爬满了青苔。这就是夏天的味道吧。属于你我的长城的回忆。此段多为带外国人来游览的路段。但也不比其他长城段逊色。长城记载着中国古代的历史与文化，是世界文明的一部分。我很自豪，中国曾经有这么文明的文化。有这么先进的防御系统。,/Date(1540183025000+0800)/,1
55059585,感觉这一段长城并不是大家所熟知和攀爬的。但是人也不少，每次都是人头攒动。青青子衿，悠悠我心。夏天去的时候感觉整个长城脚下都是碧绿的。看起来十分养眼，心情也不知觉大好起来。长城的途中看到城墙上被刻了很多字。石缝里已经生出青苔了。,/Date(1536138748000+0800)/,1
35182370,八达岭根本上不去，人山人海，果断掉头直接去了居庸关，这里人少很多，不论是拍照还是看长城，这里比八达岭好太多了，毕竟人少，真的没必要去堵人！,/Date(1570263434000+0800)/,0
40543080,不到长城好汉，我是女汉子，不过我佩服那些小孩子，我真心觉得我不太适合爬这个运动，第二天全身腰酸背痛,/Date(1445873375000+0800)/,0
17545778,亲临其境好似穿越，古人的智慧是我们永远学习榜样！每一个台阶都凝聚着先人们勤劳善良的汗水！每一个瞭望台都展现着先人们聪明智慧的结晶！每一块砖瓦、条石都代表着先人保家卫国的决心！,/Date(1522375352000+0800)/,0
105614578,很壮观，西区陡，东区长，各有所长吧，都走下来有点费劲,/Date(1549015739000+0800)/,0
4345832,很好，没什么人，爬上去爬下来都考验人，不会比八达岭差,/Date(1538744414000+0800)/,0
169004161,居庸关还是挺漂亮的，值得去一趟，我爬的东面，挺陡峭的，越爬风景越漂亮，4月这个天气去爬非常舒服，不会感觉特别热，,/Date(1523180325000+0800)/,1
61910924,天下第一雄关居庸关！进去有分开两边，一边高一些，一边矮一些，合起来正好一圈。时间关系爬了短的一边，人不是很多，也有好汉石，感觉挺好。唯一的略微遗憾是那天有雾霾，朦胧美了！,/Date(1572485081000+0800)/,0
22743314,冬天登高没有点毅力真不行哈哈，居庸关长城离市区比较近，台阶比较陡，登山难度有点大，全称都走一遍不容易。不太适合老人和太小小盆友。,/Date(1550720167000+0800)/,0
1703667,购买、使用都很方便，居庸关人不多，游玩体验较好。,/Date(1537062394000+0800)/,0
81969239,不到长城非好汉，古代广大劳动人民智慧和创造力！,/Date(1515549936000+0800)/,0
1047744,八达岭长城人太多了，很喜欢来这个居庸关长城，但登起来，可真需要些体力，西侧很陡峭，我没上到顶，估计站在高处的感觉应该很不错。,/Date(1577843334000+0800)/,0
64075650,惊险刺激，真正体会到，不到长城非好汉。这句话,/Date(1489923955000+0800)/,0
381284,不错，拿票方便，就是有点小，西边的坡太陡，去的时候有点冷，冻死了。后来爬了南边的，很平坦，没什么坡，建议一开始就爬南边的。,/Date(1579272998000+0800)/,0
113131001,景区不错，虽然没有八达岭知名，别有一番韵味,/Date(1576914490000+0800)/,0
3511733,到北京旅游一定要去下，长城不到长城非好汉，只是现在感觉北京真的是太热了，去爬长城还有点辛苦，好在今天太阳不大的话要晒黑了。,/Date(1562330159000+0800)/,0
4260283,居庸关长城这里虽然没有别的几个长城名气那么想啊，来这里玩的人还是不少的，这里小型的旅行团来的比较的多刚从绝绝味有点坑的。,/Date(1576903802000+0800)/,0
10553161,扫码进很方便，下午去的，人不多，没有风，长城上面的景色很美。,/Date(1573187770000+0800)/,1
14661625,八达岭长城的票没有买到，临时改到这里，暑假到北京旅游的人多，票最好先买，不过在那边车辆调度不行，让游客一直等，加上遇到一些插队不讲理的人，真的打折扣。风景还是很棒的，那边厕所里面自来水可以直接喝，是山泉水，我们也是当地的一个大哥跟我们说了，喝一口真清凉,/Date(1562954938000+0800)/,0
212619941,看到长城真的觉得太壮观了，竟然能爬上好汉坡超级开心，整个长城拍起来实在很壮观，虽然人很多，但还是可以拍到漂亮的长城与风景,/Date(1555650609000+0800)/,0
77184507,如果有时间我会经常来长城转转，因为现在的生活和自身健康脱节了，爬次长城才能体会到人的的意志力是如何锻炼的，生活虽然方便快捷了，但是把本性的东西给丢掉了，可是看到那些嘴里喊着一定要爬上去的孩子们，自己觉得来长城值得了,/Date(1500169945000+0800)/,0
13774998,景色诱人，领略了燕京八景之一的风采，让人心服口服，冬天来的，游客较少，收获颇多,/Date(1456732375000+0800)/,0
2979184,太美了，值得一去，险峻雄伟，与众不同,/Date(1535712740000+0800)/,0
3926062,不到长城非好汉，终于明白此话的意思了，爬了一次长城，第二天，腿肚子酸胀的不行的，长城是真的要爬的，都不能说是登，爬到半山腰，就不敢在往上了，实在太陡峭了呢！,/Date(1445919340000+0800)/,0
,边游玩观光同时也锻炼身体还是不错哟,/Date(1497062308000+0800)/,0
2870544,有山有水，不错，比八达岭有意思。,/Date(1602121822000+0800)/,2
97770263,长城很壮观，风景很美，不虚此行。,/Date(1497259604000+0800)/,0
1491799,整体还不错吧，比八达岭逊色一点，但是也爬的累死，疫情期间没有全部开放。,/Date(1591414072000+0800)/,0
30939020,相比八达岭长城人更少，推荐。。,/Date(1542078098000+0800)/,0
45149161,居庸关长城是万里长城的重要组成部分。是长城上著名的关城。设立居庸关，始自于春秋战国时期，汉朝时关城已初具规模。早在金，明年间即以”居庸叠翠”著称于世。,/Date(1479180773000+0800)/,2
2560909,八达岭长城世界奇迹之一，但是去过偶觉得绝对没有之一，有的是历史的见证和在当时人力的强大，很壮观雄伟，去的时间不对，坐着缆车往下看到的就是光秃秃哈哈哈,/Date(1485518320000+0800)/,2
88561382,虽然是正月，长城人还是很多啊，天气非常寒冷，下来的时候腿都在发抖。,/Date(1549540995000+0800)/,0
6876869,今天在换票处顺利换了票，直接进入检票口了。游览了西山，一个“险”字概论，用了2小时爬完，一共游览4小时。,/Date(1517836821000+0800)/,0
3307437,居庸关长城建在长达15公里的山谷间，距离八达岭长城20公里，地形险要。门票45元，春季来最好，满山的桃花和杏花。冬天风大，很冷，不建议来旅游。,/Date(1477987249000+0800)/,2
525602,价格不贵，9月初，景点没什么人，倒是碰到好几个老外，左右两边长城，可以看到火车经过很漂亮，从一边进去不走回头路大概3个多小时可以爬完整个景区,/Date(1568774354000+0800)/,0
78088418,不错，人也少，只是必须东西线都游完才能回到原点，如果只去东线或西线就只能走好大一段路才能回原停车场。,/Date(1534135784000+0800)/,0
61159960,到了北京肯定得去长城啊，然后能去两个手机啊，去年暑假去了北京，到北京肯定得去长城勒，饿不到长城非好汉，到了长城还是有一点遗憾的，太多人了，人山人海的，全看人头了。应该选一个没那么多人的时间去那里的话关会更有劲儿。,/Date(1528037872000+0800)/,1
39389293,居庸关长城起始的地方很多，算起来有3，4个方向，两边各有个山顶，先登的矮的那个，到头发现对面的山峰比登的的高，于是又登高的，看到高的有连续几十蹬四十厘米高的台阶，想到了介绍说的要量力而行，主要也是前面费了不少体力，腿脚有些酸麻，高的山峰就只登了一半，但不影响总体体验，景色很好，和八达岭比各有特色，值得此行。,/Date(1508515839000+0800)/,1
85993056,居庸关长城，是京北长城沿线上的著名古关城，国家级文物保护单位。北京旅游局评定的国家AAAA级景区。长城建在一条长达15公里的山谷间，两旁山峦重叠，树木葱郁，山花烂漫，景色瑰丽，远在800年前的金代，就被列为燕京八景之一，称为“居庸叠翠”。,/Date(1492744318000+0800)/,1
221144457,十一长假去的，游客不少，天气不错，景色秀丽，长城气势恢弘,/Date(1606932014000+0800)/,0
