32051454,全家出动，高高的电梯，最高处还可以看看北京的夜景，难忘非常。,/Date(1491637317000+0800)/,0
96726106,不错，换票很方便。室外观景台的望远镜是免费的。能看到玉渊潭。,/Date(1491184463000+0800)/,0
58683129,不错不错，很好用，电子票您能直接进，需要到售票处兑换成实物票,/Date(1490954946000+0800)/,0
5496152,俯瞰整个北京的最佳地点，还可以顺便去塔下面的海底世界玩一玩。,/Date(1486552145000+0800)/,0
10663239,带着表弟参观，临时买票就能用，很方便，人也不多，体验的不少,/Date(1580269560000+0800)/,0
159518309,还行吧，买的时候一定记得带上那个新闻联播照片不然里面老贵了,/Date(1517319510000+0800)/,0
18732411,"去的时候是冬天，小孩子冻得不敢出来！不过到屋子里就好多了
",/Date(1515387736000+0800)/,0
109130640,总体还不错，建议非晴天天气，票价便宜点，晴天时这个票价值得,/Date(1492588606000+0800)/,0
72013060,黄昏去的，雾霾较重，没了登高望远的乐趣。建议天朗气清时再去，晚上较冷不宜久呆。,/Date(1482590360000+0800)/,1
92193209,中央广播电视塔建的很有特色，个人认为还是值得参观一下的。,/Date(1544908579000+0800)/,0
168028611,很开心。就是天气不太好，看不太清楚。,/Date(1521526528000+0800)/,1
29659718,雄伟壮观的建筑，远远就可以一目了然，很有特色，值得一游。,/Date(1513557535000+0800)/,0
58753229,地方不太大，就是顶部好看些。二楼的文化参观感觉没什么意思,/Date(1491468536000+0800)/,0
4897388,不错 爸妈都很满意 地标性建筑 唯一美中不足 有霾 并没有办法 ..,/Date(1490340338000+0800)/,0
185098,蓝天白云的时候去看看，感觉会非常好。,/Date(1473616299000+0800)/,1
51644153,风景的确不错，但是周边高楼也多了，没有了一览众山小的感觉,/Date(1456354290000+0800)/,0
20550340,性价比低，可玩性低，景色一般，没什么好玩的，广州的广州塔都比它好玩的多，建议没去过的高塔，可以去欣赏一下景色，还是可以看到北京的夜景的,/Date(1621261630000+0800)/,0
35033840,带孩子感受一下，以前去过一次，要是我自己不好再去了，不值得去两次的地方。海洋馆很一般，连孩子都不喜欢看，逛逛就出来了，没有停下来慢慢看,/Date(1565657238000+0800)/,0
8484939,帮老人买的票，感觉不错就是当天是雾霾天远眺什么也看不见,/Date(1544441241000+0800)/,0
165797330,挺好，真好在400多米上看北京漂亮,/Date(1540443722000+0800)/,1
669751,不错值得一去，登高望远的好去处，携程网上订票方便快捷。,/Date(1534622218000+0800)/,0
102785630,登高望远的好地方，上来可以观光，还可以去旋转餐厅吃饭。,/Date(1526088408000+0800)/,0
96097889,随定随用，动物园出来直接订票去的中央电视塔，方便快捷！,/Date(1518912830000+0800)/,0
108481693,电梯真快，一会的功夫，就升到百八十米的高度，孩子惊讶。,/Date(1517620012000+0800)/,0
3550145,挺好的！我觉得两层最好玩，底下的看看也能学习到东西……,/Date(1514895606000+0800)/,0
12742111,中央电视广播塔，位于西三环旁边，没有上海东方明珠壮观！,/Date(1512261552000+0800)/,0
50331090,值得一去，看北京夜景很美丽，壮观！,/Date(1508320659000+0800)/,1
4112566,这里是北京很著名的景点，顶层有旋转餐厅，地下有海洋馆。,/Date(1499390655000+0800)/,0
87637402,值得去的地方，气势高大宏伟，不错！,/Date(1496295365000+0800)/,1
4112566,这里算是不错的旅游景点，顶层有旋转餐厅，下面有水族馆。,/Date(1486512183000+0800)/,0
57020357,中央电视塔上方有一个旋转餐厅，坐在那可以俯瞰北京城。,/Date(1572445493000+0800)/,0
4897279,天气不好，看的不够远！！！！！！,/Date(1540647965000+0800)/,1
181216523,俯观北京，感觉很好，遗憾的是雾霾天气，没留下照片留念,/Date(1534230298000+0800)/,0
48401167,不仅便宜，而且方便、省力。很赞。,/Date(1528493810000+0800)/,1
171944622,风景很好，广场很大。可以顺便游览海底世界和玉渊潭公园,/Date(1524440484000+0800)/,0
157898981,当天去的时候大雾，如果在晴天阳光灿烂的天气去，会更好,/Date(1519808209000+0800)/,0
46315657,下次一定中午去，吃自助就顺带海洋馆的票，比单买合适。,/Date(1518957715000+0800)/,0
4956133,都挺好的，登高望远，好好好好好好,/Date(1513992544000+0800)/,1
108048598,很好不错，可以欣赏下，晚上更美，,/Date(1502034846000+0800)/,1
201073170,哈哈，怎么也得去一趟我们大首都的电视塔吧。还不错…,/Date(1580270624000+0800)/,0
33400031,实话，就是个高塔，不是因为孩子要上，我是不会上的。,/Date(1566362166000+0800)/,0
20590110,虽然设施比较旧但是都挺好的，可以看到玉渊潭公园全景,/Date(1561361598000+0800)/,0
15929250,天气很好，看了日落夜景，就是上面风很大，需要多穿点,/Date(1557068138000+0800)/,0
81388850,一般般吧，父母去的时候，天空有些雾霾看的不是很远。,/Date(1548337644000+0800)/,0
75148232,视野很广，也挺漂亮，但是里面的冰淇淋真心不怎么好。,/Date(1547879929000+0800)/,0
12948785,跟爱人一起去了，感觉电梯很快，在塔顶可以看见北京城,/Date(1544804109000+0800)/,0
5235957,挺好玩的。不恐高的话建议去转转,/Date(1537322740000+0800)/,1
111890249,不错。如果天气好，就好了！！！,/Date(1536508430000+0800)/,1
93657620,宏伟壮观景色秀丽风光旖旎，大气,/Date(1536456375000+0800)/,1
7601438,非常方便，今天人业很少。但空气质量一般，看的不太远,/Date(1530892098000+0800)/,0
33822646,很棒，就是一上去就被人围着问要不要照相，有点煞风景,/Date(1525183297000+0800)/,0
849068,人不多  服务很好  洗手间也比较干净  下次去看夜景 一定很美,/Date(1519442124000+0800)/,0
36128178,值得去的地方，很有观赏价值的！,/Date(1516195648000+0800)/,1
84930921,第二次去，这次邀约小朋友一起，还可以吧，取暖好去处,/Date(1513299233000+0800)/,0
627651,还好吧，比起东方明珠总感觉少了点什么。性价比不高。,/Date(1510444485000+0800)/,2
107018317,很值得一去得地方，交通也很便利,/Date(1509758989000+0800)/,1
73327711,第一次感受还是不错的！晴天的时候在塔上能看见鸟巢。,/Date(1506073014000+0800)/,0
215237292,在网上买好票直接景区大门刷身份证进去就行，很方便,/Date(1562244989000+0800)/,0
38546986,第一次登塔，感觉还不错，就是除了观景没什么可玩的,/Date(1553338130000+0800)/,0
50397198,带老人去的，感受一下首都风光，去首都的必要一站。,/Date(1525220215000+0800)/,0
7411346,很不错，大名鼎鼎的央视哦，第一次有机会看到真面目,/Date(1518094403000+0800)/,0
7491854,就在玉渊潭公园的旁边天气好的话可以看到北京的全景,/Date(1496504611000+0800)/,0
6225322,近距离感受中央电视台，周一人不多，能很好的去参观,/Date(1492416558000+0800)/,0
11452558,地理位置优越，远眺窗外风景优美，北京比较知名建筑,/Date(1490023665000+0800)/,0
102534714,其实最美的还是晚上在地面向上看，上去以后往下看其实并没有太大的感受！人特别多，拥挤排队。三处景点很快就看完了。网上买票便宜些。,/Date(1565523573000+0800)/,0
14062942,风大，晴天能看的比较远，8.1湖看的挺明显的。,/Date(1561263196000+0800)/,0
38065326,方便快捷，比现场买票便宜，建议大家从网上购票。,/Date(1533999214000+0800)/,0
25225348,当天天气一般，能见度不够高，总体感觉还是不错。,/Date(1531706590000+0800)/,0
111512431,不恐高的人可以去一趟，别忘记一定要找个好天儿！,/Date(1522575975000+0800)/,0
,北京不像上海，没有高楼大厦。此塔不敌东方明珠！,/Date(1517442609000+0800)/,0
120094249,登高望远，领率了北京的全貌。北京的夜景不错哈！,/Date(1511097323000+0800)/,0
900569,周六来的，人很少～登高远眺～有雾霾所以能见度低,/Date(1509782402000+0800)/,0
30197920,站得高看得远，可惜我们去的时候雾太大了，还冷。,/Date(1493687613000+0800)/,0
85606342,正好遇上雾霾啥也看不到，但是里面消费不？贵挺好,/Date(1491199075000+0800)/,0
4112566,广播电视发射塔，上面有旋转餐厅，底下有水族馆。,/Date(1481154606000+0800)/,0
102280702,携程票价很合适，比现场便宜好多，闺女玩的开心,/Date(1570171280000+0800)/,0
160913577,在高处看紫禁城，来北京玩的话可以去体验一下。没想到上面的风那么大，上面有望远镜可以眺望远处，还可以大喊测试自己的肺活量有多大,/Date(1563417935000+0800)/,0
200111032,可以，夜晚很美123456789012358,/Date(1557228639000+0800)/,0
1085431,不错不错不错不错不错吧吃粑粑吃不错不错不错吧,/Date(1544091009000+0800)/,0
38947015,方便快捷，网上购票后几分钟就可以使用，好评。,/Date(1539245410000+0800)/,0
8123075,不得不表扬一下携程，竟然还给我优惠了20元！,/Date(1534583313000+0800)/,0
24518298,买的联票，非常方便，价格实惠。付款后马上能用,/Date(1522929264000+0800)/,0
3728640,景色独特，环境优美，离玉渊潭和海底世界很近。,/Date(1520897257000+0800)/,0
158683782,值得一去！感觉非常不错！,/Date(1517581440000+0800)/,1
59970478,很快捷，当时买当时出票，还可预约当天的，完美,/Date(1516703024000+0800)/,0
5990745,晴日上塔，登高望远，四周景物尽收眼底，很爽。,/Date(1508390717000+0800)/,0
102844640,很好，风景特别好，就是没有什么玩的，俯视北京,/Date(1501507329000+0800)/,0
104973070,孩子孩子玩的很开心也长知识。门票价格可以接受,/Date(1501223515000+0800)/,0
6995753,以前北京的最高峰。现在早就被超过。有中国樽了,/Date(1500213062000+0800)/,0
21119218,中央电视塔非常值得浏览，学到很多知识，开阔了眼界，看到了很多电视制作的场景，还有孩子们喜欢的游戏和抽奖环节，女儿玩得很开心！,/Date(1483073897000+0800)/,0
47110849,生日在里面吃了自助餐，味道不错！环境不错！,/Date(1557603211000+0800)/,0
210127641,还不错，比现场便宜了5元。经典太高，太刺激,/Date(1549885104000+0800)/,0
202044620,北京的夜景很壮观，工作人员的服务态度很好。,/Date(1544608791000+0800)/,0
41689042,气势恢宏，感觉不错啊！就是路牌指引太少啦！,/Date(1519353766000+0800)/,0
14413849,值得一去 全世界都可以路过 每天的新闻不能路过,/Date(1511057356000+0800)/,0
10640445,非常漂亮，带老人们去的第二次，看看北京全景,/Date(1510543814000+0800)/,0
43013170,电视塔非常壮观，体验主播的工作更是非常开心,/Date(1507272184000+0800)/,0
115003697,虽然有点小雨，但是感觉很好，孩子玩的很高兴,/Date(1503058625000+0800)/,0
,去观景台看北京城，真的很高，还有旋转餐厅。,/Date(1490287010000+0800)/,0
119928189,很多次了不错不错不错不错不错不错不错不算,/Date(1579396114000+0800)/,0
795762,附近吃饭的地方太少了，景色不错，湖光山色,/Date(1567677352000+0800)/,0
181201413,北京的全貌都能看到，挺好的，值得体验一下,/Date(1566461313000+0800)/,0
60521732,还不错，一直没去过，下次要等天气好再去了,/Date(1561505492000+0800)/,0
222149612,不错，建议傍晚来看，可以看见落日，很美！,/Date(1559129322000+0800)/,0
12365848,还是挺不错的，家人反响挺不错，后面还会来,/Date(1556805650000+0800)/,0
8587962,带着老人孩子一起去的，很有意义，值得推荐,/Date(1552455907000+0800)/,0
80177397,北京最高塔，壮观可惜没吃上旋转餐有点遗憾,/Date(1548523686000+0800)/,0
177939996,很好携程定票方便应该多走走多看看各地风景,/Date(1546854004000+0800)/,0
164491077,流程自由，长了下见识，主要带爸妈过来看看,/Date(1542443917000+0800)/,0
192669642,堪称完美！非常满意！堪称完美！非常满意！,/Date(1540027110000+0800)/,0
3705799,高大上的景点，关键是旋转餐厅太好了，喜欢,/Date(1533458227000+0800)/,0
68287642,"就是为了让孩子去看看，里面真没什么值得看的东西了。感觉好多年都没什么变化，娱乐项目大多是要单独收费的。
旋转餐厅已经单独划出来了，游览路线上是看不到餐厅具体情况的，只能看到门口。
去的那天刚好雾霾，登高望远的计划也没太实现。
还好，孩子还算高兴。",/Date(1526010680000+0800)/,0
13217618,一览无余，天气好看的远。高速电梯，稳快。,/Date(1522752473000+0800)/,0
150008864,全家人去的北京电视塔，能见主持工作的地方,/Date(1519019332000+0800)/,2
28136784,很好，晚上上去的，能略微早一点就更完美了,/Date(1516332269000+0800)/,0
4142262,在塔下天还是很晴朗，但从高处看雾霾还是很严重啊，不过这个周末人不多，还是玩的很好,/Date(1512793215000+0800)/,0
31593008,值得一游  服务态度很好  朋友们有时间就去玩玩,/Date(1507463242000+0800)/,0
1612010,门口卖票的好多，可以买便宜点的，管理欠缺,/Date(1499056184000+0800)/,0
1059984,带宝宝去玩。可惜天气不好，什么也看不见。,/Date(1493563678000+0800)/,0
4112566,在顶层餐厅可以俯视整个北京的市容，不错。,/Date(1482103172000+0800)/,0
70896726,在玉渊潭公园划船就看见了，挺好的，没上去,/Date(1475337597000+0800)/,0
30812271,值得去哦！推荐去北京的带孩子可以去看看,/Date(1572229406000+0800)/,0
204009917,上面风很大，晚上去俯瞰一下还是挺有趣。,/Date(1567528851000+0800)/,0
214009758,能看到很远。观景不错。电梯速度真快呢。,/Date(1565504602000+0800)/,0
44933710,最好白天上去玩，视野远 ，夜景没有白天好,/Date(1564547023000+0800)/,0
176683081,不错，会推荐朋友过来的，网上订方便多了,/Date(1564300689000+0800)/,0
56183558,北京天气好，看哪儿都清楚，上边很凉快。,/Date(1560075593000+0800)/,0
163424236,很好 很靓丽 照了张照片 花了点银子 就是这样,/Date(1549807130000+0800)/,0
19614428,上面视野很好还有望远镜可以看，值得一游,/Date(1545710705000+0800)/,0
51188804,体验一下，还不错，参观只三层，登高体验,/Date(1544011594000+0800)/,0
76150705,不打死你你都不想不喜欢喜欢棒棒哒回电话,/Date(1531403902000+0800)/,0
182819742,不错，值得选择，我们晚上去的夜景超级棒,/Date(1530262784000+0800)/,0
69595085,好棒，很高，看蓝天白云很棒，值得来看看,/Date(1530084402000+0800)/,0
7397216,登顶能够看到全北京，而且有免费的望远镜,/Date(1525786471000+0800)/,0
62027361,大老远跑去了，就是想让孩子和老人去看看。在网上看好有老人票和学生票的，结果到后售票处不承认。让看了网上的订票须知，人家就是两个字-没有。说什么人家说的算。没办法只好又买了两张全价票，让人心里不舒服。,/Date(1502459232000+0800)/,0
48450711,带着孩子去很高孩子很喜欢！不错下次还去,/Date(1493453583000+0800)/,0
5707734,玩的还不错，很好看，值得去，赞一个? ，,/Date(1493278914000+0800)/,0
57664697,挺值得去的，俯瞰北京夜景，就是全是雾霾,/Date(1484668516000+0800)/,0
4112566,经常来大塔旁边的职工运动中心打羽毛球。,/Date(1479943811000+0800)/,0
9128256,上面有个旋转餐厅据说不错，有机会去试试,/Date(1467336500000+0800)/,0
250855616,俯看京城美景，尽收眼底，真的很壮观！,/Date(1573086038000+0800)/,0
238702242,登上中央电视塔观看北京全景感觉不错。,/Date(1566437045000+0800)/,0
101366414,很适合带孩子去，可以全方位观看北京。,/Date(1566306993000+0800)/,0
235173275,哈哈哈哈哈哈哈哈哈哈哈哈哈哈哈哈哈哈,/Date(1564799874000+0800)/,0
118621750,好天气上去感觉很爽！鸟瞰整个北京城！,/Date(1563088846000+0800)/,0
79598958,北京城的制高点，天气好的时候风景不错,/Date(1556420669000+0800)/,0
3728640,登高看景特别难得的风景，离玉渊潭很近,/Date(1556146792000+0800)/,0
,******************,/Date(1551935711000+0800)/,0
23315807,登高望远，省5块钱，天气不好忘不出去,/Date(1551535400000+0800)/,0
148483531,很好，预定方便而且便宜，支持携程网。,/Date(1549182761000+0800)/,0
174420928,这是非常值得一来的地方！绝对不虚此行,/Date(1543839023000+0800)/,0
96734954,带孩子去玩，还不错，有观光台，大喇叭,/Date(1543074279000+0800)/,0
568504,有雾天气不要去，视线不好，上面看不见,/Date(1542804991000+0800)/,0
189189222,很能开阔视野，俯瞰北京城，一个字，爽,/Date(1535891074000+0800)/,0
38761250,第一次去，还真挺高的，就是天气差了点,/Date(1523715130000+0800)/,0
164781851,很不错，居高临下。可惜去的那天有点霾,/Date(1519637672000+0800)/,0
8987345,很好，照片很棒，爷孙俩合影值得纪念，,/Date(1519037908000+0800)/,0
116555465,感觉还不错，主要是风很大。注意别感冒,/Date(1514136205000+0800)/,0
153219349,不错，以后有机会再去，适合一家人出游,/Date(1511614071000+0800)/,0
153459169,不错，携程网真快，优惠。玩儿的开心。,/Date(1510642151000+0800)/,0
91666562,非常好，能看到故宫，里面的消费区不贵,/Date(1508404812000+0800)/,0
1647062,还不错还不错还不错还不错，需要好天气,/Date(1507154934000+0800)/,0
5883863,方便快捷，停车也方便。不错的一次游玩,/Date(1506867307000+0800)/,0
50231515,非常有意义的，孩子也很激动，值得推荐,/Date(1503203967000+0800)/,0
44081563,"上238,拍吧。相片ps的。风马很时",/Date(1502624839000+0800)/,0
55630777,便宜方便快捷，就是电视塔没得玩不咋样,/Date(1495361446000+0800)/,0
18699353,非常开心的家庭游，登高望远俯视北京。,/Date(1493646553000+0800)/,0
75817858,特别的过瘾，下次还要去看看，领票方便,/Date(1493362881000+0800)/,0
85935409,好开心，楼上的自助餐好快乐，还能拍照,/Date(1491200568000+0800)/,0
88710640,带孩子玩一下还值得一去，今天天气不错,/Date(1490508232000+0800)/,0
1257644,站在这里，看到了整个京城的美丽景致。,/Date(1469724148000+0800)/,0
202933016,高处看到的夜景很美，北京城夜色迷人,/Date(1570928488000+0800)/,0
196163267,还不错。。。。。。。。。。。。。。,/Date(1565015791000+0800)/,0
3041273,不错能看到全北京夜景，建议晚上去看,/Date(1564210776000+0800)/,0
176500984,谢谢！挺好的，值得一去！总体超赞！,/Date(1563885662000+0800)/,0
165599740,可以看到整个城市北京城，讲解很详细,/Date(1554755617000+0800)/,0
31187333,简单快捷，不用换票，入口直接使用，,/Date(1554073542000+0800)/,0
3448615,不错，得选一个好的天气，才能看得远,/Date(1551925456000+0800)/,0
95305577,冷好在有军大衣提供，领略北京夜景赞,/Date(1547344602000+0800)/,0
53973765,还行吧，晴天来就好了，晚上晴天最好,/Date(1530023033000+0800)/,0
26986344,不错，俯瞰北京城夜景，很有的感觉！,/Date(1520186599000+0800)/,0
164281812,挺不错的，好高呀，可以看到北京城。,/Date(1519010278000+0800)/,0
103475928,很好，可以看到天安门广场！风很大！,/Date(1513251347000+0800)/,0
155137175,非常好玩，华灯炫彩。下次有时间再来,/Date(1512292428000+0800)/,0
35844198,景点很不错，收费便高，标志性景点，,/Date(1511658198000+0800)/,0
80042731,北京的夜景还是不错的，下次考虑再来,/Date(1509781112000+0800)/,0
35169003,带孩子去的还行吧！孩子玩的很高兴。,/Date(1503767952000+0800)/,0
44610692,站在高点可以一览整个北京城 视野开阔,/Date(1500131854000+0800)/,0
4924697,换票方便 好评 相信携程 一直在携程订票 ,/Date(1490496642000+0800)/,0
3044390,登上塔顶，一览北京美景，值得一游！,/Date(1470761358000+0800)/,0
253880934,还不错 登高望远 **买票很方便,/Date(1580097562000+0800)/,0
215629076,景色不错，站的高看得远。值得一去,/Date(1575023489000+0800)/,0
28574827,其实多来点附加的参观项目会更好。,/Date(1570524509000+0800)/,0
237469363,是一次不错的体验和选择，值得游玩,/Date(1570251143000+0800)/,0
222176419,挺好的！挺好的！挺好的！挺好的！,/Date(1570246109000+0800)/,0
4572789,挺好的挺好的挺好的！！！！！！！,/Date(1570157822000+0800)/,0
235052413,非常好，实现伟大中国梦，中国加油,/Date(1570106085000+0800)/,0
29964546,值得一看，只是塔身灯光没有完全秀,/Date(1569138190000+0800)/,0
232402294,好，好，好，好，好，好，非常好！,/Date(1568450077000+0800)/,0
3728640,值得一看的地方，周围景色独一无二,/Date(1567991826000+0800)/,0
172102802,每天都能看见的，感觉夜景很好看啊,/Date(1567987774000+0800)/,0
32337648,北京之行，最美景点，孩子非常喜欢,/Date(1564889288000+0800)/,0
409332,即下即用，还便宜一点，挺方便的。,/Date(1564723937000+0800)/,0
118621750,带着孩子跟老妈来的，天气特别好！,/Date(1562320878000+0800)/,0
564324,晴天里风光无限好，还是值得拥有。,/Date(1562232647000+0800)/,0
172102802,风景很不错，周围很多景点可以玩了,/Date(1558139045000+0800)/,0
17797251,非常好，值得一去，物超所值，呵呵,/Date(1551271664000+0800)/,0
18826184,购买便宜，其实方便还是最主要的。,/Date(1551201420000+0800)/,0
780596,非常不错，值得一看中国首都风景，,/Date(1550416805000+0800)/,0
174420928,这是非常值得一看的地方，太棒了！,/Date(1543674582000+0800)/,0
70389376,我大首都得广播电台就是好。去看看,/Date(1539426552000+0800)/,0
45195541,可以看日落，可以看星空闪烁的夜景,/Date(1537885588000+0800)/,0
151776983,取票快速方便，适合带亲戚朋友游玩,/Date(1535586301000+0800)/,0
12767492,挺好的，景色相当美，感觉很不错。,/Date(1533100872000+0800)/,0
35072427,和爸爸一起来的，很好玩，爸爸喜欢,/Date(1532043174000+0800)/,0
13579216,非常好玩，孩子很喜欢，视野开阔。,/Date(1523959844000+0800)/,0
36256627,值得一去看看，旁边还有海底世界。,/Date(1520341037000+0800)/,0
54609196,很喜欢一家人去的，还照了相，推荐,/Date(1519354371000+0800)/,0
1451622,很好，非常喜欢在北京高塔上看风景,/Date(1515474480000+0800)/,0
111517805,高，实在是高！坐电梯耳朵不舒服。,/Date(1513484043000+0800)/,0
27884996,不错的体验，购票方便，兑换速度。,/Date(1512460265000+0800)/,0
34258817,很好风景   尤其现在11月空气比较好,/Date(1510404521000+0800)/,0
34526549,还可以吧，大北京就这个价。服务好,/Date(1507502807000+0800)/,0
88137478,视野开阔，服务态度很好，心灵震撼,/Date(1507184513000+0800)/,0
60533263,高处鸟瞰北京美景，值得回味，挺爽,/Date(1505141527000+0800)/,0
79486009,非常非常满意，登高望远，心情不错,/Date(1502796536000+0800)/,0
17126710,玩的很开心，有携程还是比较方便的,/Date(1499839574000+0800)/,0
14726997,好评，很满意，很方便，就是人多。,/Date(1492773165000+0800)/,0
87380767,和室友一起去的，晚上夜景很好看啊,/Date(1491317582000+0800)/,0
10461486,景色超级美！全北京城尽收眼底呀！,/Date(1490973315000+0800)/,0
20920374,带孩子感受了下高度，孩子挺开心的,/Date(1490412330000+0800)/,0
804440,天气晴朗的时候很漂亮，能看到国贸,/Date(1485561691000+0800)/,0
74502054,能看到北京全景，晚上景色也很美！,/Date(1480215393000+0800)/,0
35366153,来了三次了，孩子就想做这个电梯,/Date(1576015325000+0800)/,0
26567672,晚上去的，可以看到很美的夜景。,/Date(1573309115000+0800)/,0
98791002,总体还行，灯光秀还是比较震撼的,/Date(1570626416000+0800)/,0
87693142,第二次去了，看风景依然很不错的,/Date(1570407903000+0800)/,0
42279657,和家人一起去的。来北京打卡第点,/Date(1570290197000+0800)/,0
212069936,国庆期间，还可以，就是人太多啦,/Date(1570057816000+0800)/,0
90443223,非常好，很棒，都好，一切都好！,/Date(1568802513000+0800)/,0
171942693,周边环境很好，值得一看的好地方,/Date(1568037273000+0800)/,0
161554541,很好！还是很方便！好好！好……,/Date(1567860860000+0800)/,0
1651680,方便快捷，风景独特，值得一去。,/Date(1567485477000+0800)/,0
238702242,登上中央电视塔观看北京确实不错,/Date(1566437233000+0800)/,0
224342045,不错。。。。。。。。。。。。！,/Date(1566194697000+0800)/,0
85331679,挺有性价比的，比现场买划算多了,/Date(1565911568000+0800)/,0
11397948,值得一去的地方 但一定要看好天气,/Date(1564133901000+0800)/,0
