,uid,comment,date,like,sorce,#服务方面#cnt,#导游方面#cnt,#人流方面#cnt,#景色方面#cnt,#价格方面#cnt,#饮食方面#cnt,#娱乐方面#cnt,#儿童方面#cnt,#设施方面#cnt
498,31955072.0,今冬一直没有雨水， 空气干燥。这次突如其来的雪虽然让脱掉冬装的人们又重新拾起了厚厚的棉服，但雪后人们纷纷走出家门来到奥森公园健步或呼吸雪后的空气。,/Date(1522998091000+0800)/,2,4.283,0,0,0,1,0,0,0,0,0
499,18959891.0,奥林匹克公园位于北京市朝阳区，因举办08年奥运而诞生。从南到北分布着鸟巢、水立方、文体中心、森林公园三个园区。体现了科技、绿色、人文三大理念。交通发达、空间开敞、绿地环绕、环境优美。,/Date(1557720401000+0800)/,2,4.286,0,0,0,3,0,0,0,0,0
500,496801.0,免费的大公园，上周去的，景色正好，满地的小花太漂亮了，树上也都是花。空气也很好，要是没有杨絮就完美了！,/Date(1462106370000+0800)/,2,4.286,0,0,0,2,0,0,0,0,0
501,31059698.0,疫情严重，但奥森一直开着。也算为附近想锻炼身体的居民，做了大贡献。看看拔地而起，插入云霄的奥运火炬，也算吸收点正能量。北园人少，建议去北园。,/Date(1580813251000+0800)/,0,3.904,0,0,0,0,0,0,0,0,0
502,31059698.0,奥森我经常来，但到总有外地旅游的游客迷路。有几个要点：奥森分为南园和北园，如果约在景区见面，一定说清南园还是北园。想看火炬的，走“南园南门”,/Date(1579399863000+0800)/,0,-4.385,0,0,0,0,0,0,0,0,0
503,4448986.0,"北京奥森公园分南园和北园，面积非常非常大，这里基本上包含了所有北京公园植物的种类。这里春天包含了其他公园的所有花卉，迎春，碧桃，玉兰，榆叶梅等等，夏季，有荷花，向日葵。秋天枫叶，银杏，黄栌，芦苇等一个都不少。

公园植入了塑胶跑道，非常有弹性，每天在公园里跑步的人络绎不绝。

这里任何季节，节假日都不会拥挤。

公园免费，地铁8号线直达。",/Date(1575309623000+0800)/,1,4.286,0,0,0,6,0,0,0,0,0
504,36218441.0,奥运场所必定去打卡，鸟巢，水立方，也是旅行团必去的地方之一，交通方便，地铁8号线就到，就是标示不够清楚，绿树成荫，场地开阔，就是风有点大，不进去馆内是不需要收取门票，白天和晚上的对比，就是两个不同世界，夜景很漂亮，很值得去看看。,/Date(1572877288000+0800)/,1,4.176,0,0,0,1,1,0,0,0,0
505,109506777.0,奥林匹克公园是著名景区，不只是在北京，应该在全国人民心中是一个特别的所在，因为这里有水立方，有鸟巢，有国家体育馆，有体育强国梦。除了体育中心，这里还有森林公园，风情很美，值得一去。,/Date(1570459273000+0800)/,0,4.286,0,0,0,2,0,0,0,0,0
506,7886796.0,北京奥林匹克公园是2008年北京奥运会和残奥会的奥运公园，环境非常好，面积很大。是外地游客必来的地方，可以买票参观鸟巢和水立方。鸟巢的门票价格：成人普通门票：50元/人。鸟巢、水立方两馆联票：80/人，老人学生等特殊群体半价！除了这几个景点，公园其他部分都是免费开放！,/Date(1552919251000+0800)/,1,4.043,0,0,0,4,3,0,0,0,0
507,814188.0,奥林匹克森林公园现在成了首都人民休闲健身的好地方。南园和北园都有健身步道，各五公里总长10公里。天天都有许多爱好跑步健走的人在这里锻炼。园里绿化好，花草树木多，也有小河流水，挺好！,/Date(1488680438000+0800)/,2,4.286,0,0,0,1,0,0,0,0,0
508,4592641.0,奥林匹克森林公园的秋天很美，太阳下很热，但是阴凉处特别凉快，所以很适合徒步走，小虫子也少了，但是大家还是要做好防护。周末人多，错峰出游吧！,/Date(1503547689000+0800)/,2,4.285,0,0,1,1,0,0,0,0,0
509,19751113.0,去年冬天的去北京旅游的时候去了奥林匹克公园，整个园区比较大，由于刚下过雪的缘故，到处都是白茫茫的，再配上蓝蓝的天空，真是一道美丽的风景线。,/Date(1497418446000+0800)/,4,3.726,0,0,0,2,0,0,0,0,0
510,103704474.0,北城的奥林匹克森林公园的南门景色很美，晚霞已经落山。秋风起，来公园走10公里的人就非常多了。公园门口的花色彩斑斓。南面的观光塔也很漂亮。,/Date(1536284939000+0800)/,0,4.286,0,0,0,4,0,0,0,0,0
511,103704474.0,春天的奥林匹克公园绿草茵茵，公园中也有很安静的角落。有许多可供休息的长椅。有水流，有林荫大道。还有现代化的建筑。有些新建的大厦非常漂亮。,/Date(1525823719000+0800)/,0,4.285,0,0,0,2,0,0,0,0,1
512,4592641.0,最近天气凉爽，所以喜欢在奥林匹克森林公园多走走，白天其实很不错，跑步的人少，也不怕挡别人的路，晚上都是白领的天下，大家都在这里跑步锻炼。,/Date(1504171516000+0800)/,2,4.283,0,0,0,1,0,0,0,0,0
513,29632160.0,秋天秋高气爽，叶有黄的，这里能锻炼能划船。能看树叶。,/Date(1446247795000+0800)/,0,3.827,0,0,0,0,0,0,0,0,0
514,19499760.0,夏日的奥森，蓝天白云绿树浮萍，三五好友随意走走，心情超级好。不收门票，北京北部的大花园。沉水栈道周边的植物越来越大了，苇子都比人高了。,/Date(1566655165000+0800)/,0,4.266,0,0,0,0,1,0,0,0,0
515,32590051.0,奥林匹克公园内有鸟巢、水立方，旁边还有盘古大观，这里在二OO八年北京奥运会其中分别是开幕式闭幕式和田径比赛主运动场，游泳在水立方进行。,/Date(1555808464000+0800)/,0,3.082,0,0,0,1,0,0,0,0,0
516,88140094.0,奥林匹克公园紧邻奥林匹克森林公园，甚至在奥林匹克森林公园的山顶都可以望到整座奥林匹克公园。奥林匹克公园主要是鸟巢和水立方，还有中轴线。,/Date(1503305772000+0800)/,2,4.285,0,0,0,5,0,0,0,0,0
517,217487102.0,北京奥林匹克公园的中央水池在国庆节期间有喷泉灯光秀表演，每晚两场八点和八点半，人多的无法形容，因距离较远还有栅栏挡着，所以不太好拍。,/Date(1570451168000+0800)/,0,3.317,0,0,1,1,0,0,0,0,0
518,13722867.0,奥林匹克森林公园位于北五环，交通方便，分南园和北园，面积很大，分三公里、五公里、十公里步道，园内有山有水，还不收门票，适合周末休闲。,/Date(1556630469000+0800)/,0,4.275,0,0,0,1,1,0,0,0,0
519,179233985.0,奥林匹克公园位于北四环外，这里原为奧运村，奥运会后改为奥林匹克公园，这里有鸟巢运动场，有水立方游泳馆，还有玲珑塔转播中心，非常漂亮。,/Date(1555671163000+0800)/,0,4.285,0,0,0,2,0,0,0,0,0
520,179233985.0,奥村匹克森林公园，占地面积巨大，有六平方公里，这里充分利用原有水系，修建了一条宽五十米，纵贯南北的龙形水系，并栽种了大量树木和花草。,/Date(1554846881000+0800)/,0,4.275,0,0,0,1,0,0,0,0,0
521,31955072.0,在这里可以看到水立方和鸟巢。水立方的设计者将水的概念深化，不仅利用水的装饰作用，还利用其独特的微观结构。基于“泡沫”理论的设计灵感。,/Date(1546314464000+0800)/,0,4.281,0,0,0,0,0,0,0,0,0
522,2329021.0,奥林匹克森林公园在北京的北部四环外，沿着奥运场馆鸟巢一直向北走。公园面积很大，每天有很多市民和游客前来游玩。多年来一直是免费开放的。,/Date(1540790695000+0800)/,0,4.281,0,0,0,2,0,0,1,0,0
523,5890001.0,北京难得的好天气，秋高气爽，小风嗖嗖，奥森北园里的波斯菊开得好漂酿哦，大家都在各种拍~拍~拍~，今天你拍了没有？,/Date(1506233108000+0800)/,1,-3.989,0,0,0,0,0,0,0,0,0
524,52266936.0,鸟巢，水立方，国家会议中心，组成巨大的奥林匹克公园，来这里可以看到08年盛典的痕迹，夜晚，鸟巢布满灯光与水立方蓝，相互辉映，精彩万分,/Date(1496489770000+0800)/,4,4.239,0,0,0,1,0,0,0,0,0
525,31059698.0,我真是爱死“奥森”了，每隔一段时间，必须来看看。奥森分南园和北园。南园人气旺些。南园里，有几个玩水，喂鱼的地方。小孩子都非常喜欢。,/Date(1575629057000+0800)/,0,2.674,0,0,0,0,0,0,1,1,0
526,32590051.0,奥林匹克森林公园有纵横的河道，茂密的森林，还有大片绿色的草坪，人们在树荫下的草坪上支起帐蓬，享受着森林中的新鲜空气和大树下的荫凉。,/Date(1564177763000+0800)/,0,4.285,0,0,0,1,0,0,0,0,0
527,27827992.0,周围居民真是太幸福了，这么大一个健身休闲遛弯儿的大花园，虽然离的远，每年夏天都要过来看向日葵，还有一大片荷花池，全部走下来需要一天,/Date(1561724206000+0800)/,0,3.352,0,0,0,0,0,0,0,0,0
528,31955072.0,奥林匹克森林公园地质构造为河流冲积平原，主山为“仰山”，仰山海拔86.5米，相对高度48米。“仰山”的建设是利用鸟巢、水立方等周边场馆建设以及公园挖湖产生的土方堆筑完成。,/Date(1546077545000+0800)/,0,4.284,0,0,0,2,0,0,0,0,0
529,45728970.0,公园太大了，感觉半天是逛不完的，可以根据不同的主题，经常去看看主题展。靠近地铁，花草树木，应有尽有，靠近门口也有几家体育用品店。,/Date(1519885562000+0800)/,2,4.122,0,0,0,1,0,0,0,0,0
530,4207619.0,整整十年了，北京奥运会却好像还是昨天的事情，每天都有成千上万的人来到这里，虽然只是和两个重要知名建筑拍照合影留念而已，夜晚更美。,/Date(1508772229000+0800)/,2,-1.187,0,0,0,0,0,0,0,0,1
531,814188.0,今天又去了奥森北园，没和往常一样只是沿着步道走一圈，而是在园里不同的角落里转了转，满园的秋色啊。银杏、枫树…黄的、红的…漂亮啊！,/Date(1508557943000+0800)/,2,4.107,0,0,0,0,0,0,0,0,0
532,4592641.0,一大片都是奥林匹克公园，靠北的是奥林匹克森林公园，旅游的朋友们就可以不去森林公园了，因为都是树…主要是居民休闲的地方了，比较的大,/Date(1489051250000+0800)/,2,4.282,0,0,0,3,0,0,0,0,0
533,8270759.0,这里有鸟巢、水立方，还有一个玲珑塔。导演说鸟巢其实是一个元宝，你看像吗？晚上灯光亮起，满是照相的人，三个建筑的灯光五颜六色不断变换，煞是好看。玲珑塔据说是吃饭的地方。,/Date(1503667434000+0800)/,2,3.716,0,0,0,1,0,1,0,0,1
534,38634902.0,北京2008奥运会核心区的一座公园，奥森里面环境清幽，是繁华大都市中的一片城市绿色景观，而且景色很美还有人工湖泊，野鸭成群,/Date(1575425475000+0800)/,0,4.286,0,0,0,3,0,0,0,0,0
535,88140094.0,奥林匹克公园坐落在北京市朝阳区北四环旁。这个景区是不收取门票的。但是进入场馆参观具体设施，就要收费了哦。奥林匹克公园洗手间很多，对游客是好事。,/Date(1522946039000+0800)/,3,-8.174,0,0,0,2,1,0,0,0,2
536,82860036.0,春天的奥林匹克森林公园鸟语花香池塘里的青蛙呱呱叫，水中的金鱼特别大，坐在游船上观赏周边的风景心情特别舒畅。是休闲的好地方。,/Date(1522642433000+0800)/,2,4.286,0,0,0,2,0,0,0,0,0
537,13336193.0,北京奧林匹克公园的周围有三个重要建筑，鸟巢，水立方和会议中心。因有会议才到这里，公园中心一条很有气势的宽阔大道，下面有下沉广场和购物中心。白天和夜晚是市民的休闲活动中心。夜晚鸟巢和水立方变幻的霓虹更替公园的夜晚增色。公园的小河边还有露天的酒吧和歌手表演。令人扫兴的是小河水散发着污染后的臭味，给高大上的北京抹了黑。,/Date(1568940613000+0800)/,0,4.286,0,0,0,4,0,0,0,0,1
538,15124157.0,北京奥林匹克公园位于北京市朝阳区，地处北京中轴线北端，占地面积11.59平方公里，北部是被众多跑者称之为跑步“圣地”的奥林匹克森林公园，中部是包括鸟巢、水立方、国家体育馆等在内的主要奥运场馆区，南部是奥体中心和奥体文化商务园区。奥林匹克公园作为世界上最大的综合性奥林匹克文化展示区，拥有亚洲最大的城区人工水系、亚洲最大的城市绿化景观、世界最开阔的步行广场。,/Date(1568541103000+0800)/,0,4.286,0,0,0,3,0,0,0,0,0
539,52247929.0,原来奥林匹克公园有两个区域，一块是奥林匹克公园，一块是奥林匹克森林公园，我们当时是为了看鸟巢水立方来的，晚上21：30分就要闭园了，我们到的时候是8：30分，是免费参观的，这边属于南侧的场馆，有著名的鸟巢、水立方、国家体育馆等场馆，作为奥运会的举办地，这里也是北京市著名的地标，很多游客会前来参观拍照。不得不说，晚上灯光一开，真的很漂亮,/Date(1563434231000+0800)/,0,2.071,0,0,0,3,0,0,0,0,0
540,204473975.0,奥森分为南园和北园。南园相对比较大，景点也多，人也多一些，而北园更有野趣一些，人少，也清净。不过七月的奥森北园还是人山人海的，因为花田野趣景区的向日葵正是盛开的时候。百亩的葵花向阳而生，简直壮观极了。而且这里葵花的种类也很多，非常值得一看。,/Date(1563365880000+0800)/,0,4.283,0,0,1,0,0,0,0,0,0
541,589217.0,奥林匹克森林公园北园与南园隔着一条看北五环路，奥林匹克的标志就是五环，正好契合。北园要比南园小的多。那里面垂丝海棠、蒲公英、兰花等等许多花卉竞相开放，非常好，这个季节正好是春天，来这里都是散步。虽然北五环还非常拥挤，非常繁忙，但是这里确实非常的幽静，非常的缓慢，对生活的一种调剂也是很难得的。,/Date(1556755103000+0800)/,0,4.286,0,0,0,1,0,0,0,0,0
542,,北京奥林匹克公园位于北京市朝阳区，地处北京城中轴线北端，北至清河南岸，南至北土城路，东至安立路和北辰东路，西至林翠路和北辰西路，总占地面积11.59平方千米，集中体现了“科技、绿色、人文”三大理念，是融合了办公、商业、酒店、文化、体育、会议、居住多种功能的新型城市区域。2008年奥运会比赛期间，有鸟巢、水立方、国家体育馆、国家会议中心击剑馆等10个奥运会竞赛场馆。北京奥林匹克公园分为三部分：北部是6.8平方千米的奥林匹克森林公园、中部是3.15平方千米的中心区、南部是1.64平方千米的已建成和预留区（奥体中心）。 2018年12月，奥林匹克公园获得“2018中国品牌旅游景区TOP20”称号。,/Date(1555125110000+0800)/,0,4.285,0,0,0,4,0,0,0,0,0
543,66368717.0,虽然离2008年北京奥运会已经过去了10年，但水立方、鸟巢等建筑物留了下来，既然来了北京，就顺便去看一下。奥林匹克公园很大，中间笔直宽敞的一条大道，水立方和鸟巢就在两边。再往里走是购物中心和奥运塔。尽头是奥林匹克森林公园。,/Date(1537625664000+0800)/,0,4.274,0,0,0,2,0,0,0,0,1
544,4592641.0,2008年奥运会比赛期间，有鸟巢、水立方、国家体育馆、国家会议中心击剑馆、奥体中心体育场、奥体中心体育馆、英东游泳馆、奥林匹克公园射箭场、奥林匹克公园网球场、奥林匹克公园曲棍球场等10个奥运会竞赛场馆。,/Date(1534843049000+0800)/,0,4.273,0,0,0,3,0,0,0,0,0
545,171276315.0,2010年8月21日，北京奥运城市发展促进会和朝阳区人民政府共同在奥林匹克森林公园举行了“奥运雕塑园”落成剪彩仪式，在2400余件“北京奥运景观雕塑方案征集大赛”参赛作品中有63尊精品雕塑将落户于奥林匹克森林公园。,/Date(1534074597000+0800)/,0,4.285,0,0,0,2,0,0,0,0,0
546,28501458.0,奥林匹克森林公园位于北京市朝阳区北五环林萃路，东至安立路，西至林萃路，北至清河，南至科荟路。公园占地680公顷，其中南园占地380公顷，北园占地300公顷。公园森林资源丰富，以乔灌木为主，绿化覆盖率95.61[%]。,/Date(1534073875000+0800)/,0,4.286,0,0,0,3,0,0,0,0,0
547,14364523.0,"我和家人周日第一次来到北京奥林匹克公园游玩。
雨后的“小暑”（节气），园内万木吐翠，郁郁葱葱，秀丽多姿，空气清新，漫步其中，一阵阵的幽香，沁人心脾。百亩葵花欣欣向荣，生机勃勃，傲然挺立。
奥林匹克公园坐落于帝都的中轴线上，以“通向自然的轴线”为设计主题。横跨北五环的生态廊道，将公园南、北两大园区自然连接，自然景观浑然一体，游人畅游其中，远离城市喧嚣，匠心设计，必须五星点赞[强]
时光如梭，2008年奥运会的盛况依然历历在目。我和家人10年前还在国际庄工作生活，早晨坐动车来帝都，进鸟巢、水立方看比赛，晚上动车返回，辛苦但快乐。那时儿子还小，抱着他或紧紧攥着他的小手，真怕熙熙攘攘的人流把我们一家三口冲散；中午在麦当劳排长队抢饭吃，清晰的场景，仿佛就在昨日。
这次来公园，我们一家三口沿着步道，徒步10.5公里，用时4小时，纪念2008年北京奥运会，见证我和家人在过去10年中的成长，迎接2022年冬奥会的到来。
有时间我们还会再来。",/Date(1531205229000+0800)/,0,4.286,0,0,0,4,0,0,1,1,0
548,27827992.0,以前都是白天去的，今天是第一次晚上过来，参加重返童年的活动。没想到晚上锻炼的人这么多，跑道上挤满了人，里面还有健身房，人也不少，不得不说这里真是一个设施完善的不错的健身锻炼的地方。,/Date(1527894928000+0800)/,1,4.169,0,0,0,0,0,0,0,0,1
549,86549702.0,到处要摸身，要安检，要是开运动会，还忙的过来吗？需要的时候说一声，我免费服务，为奥运加油，加祖国加油，到时候别忘记喊我啊,/Date(1523622879000+0800)/,0,3.423,1,0,0,0,0,0,0,0,0
550,24821971.0,北京的奥林匹克森林公园就在我家不到一公里的距离，虽然我们的小区绿化和散步的地方也很多很不错，但毕竟旁边多一个这样的森林公园不妨是个好去处，尤其在北京最美的秋季！,/Date(1509899098000+0800)/,2,4.286,0,0,0,2,0,0,0,0,0
551,31955072.0,奥林匹克森林公园一年一次的秋日波斯菊展览，吸引着众多赏花人和摄影爱好者。也为秋季的奥林匹克森林公园增添了欢乐祥和的气氛。,/Date(1507943470000+0800)/,0,4.286,0,0,0,2,0,0,0,0,1
552,4592641.0,夏末秋初的奥林匹克森林公园是很美丽的，周末人会很多，都是附近居民带着孩子去搭帐篷。旅游的朋友们其实可以在南门逛一逛再去别的景点，门口就又地铁站的，也不需要门票。,/Date(1502886406000+0800)/,2,4.24,0,0,0,1,1,0,0,0,0
553,1117346.0,奥林匹克公园占地面积大，水域面积也大，分南园和北园，通常健身的人们都在南院，这里有步道，无论走路，还是跑步，都非常舒适。,/Date(1499909471000+0800)/,0,3.065,0,0,0,1,0,0,0,0,0
554,1524105.0,从鸟巢，水立方的广场穿过去就可以直接走到奥森的南门，右首是入口，左首是出口。一进门有标志性景观牌，两边两块大石头，后面是大草旬和人工湖，湖里有鱼，还有水上项目。然后是环南园的行走步道，五公里十公里一圈，周末人很多，建议走的话早来。,/Date(1493082374000+0800)/,4,-9.578,0,0,0,0,0,0,0,0,1
555,1524105.0,是08年开奥运会时建设的，是门目前离市中心最大的森林公园，面积很大，分南园和北园，从北四环一直跨越五环路，其中南园开发更好些，设施更完备，北园更原生态一些，园内除了鸟巢水立方这些人文景观，自然景观也非常美丽，是个休闲的好去处。,/Date(1491528536000+0800)/,2,4.286,0,0,0,1,0,0,0,0,1
556,102785630.0,奥林匹克公园，里面真的挺大的。天气好的时候，带着孩子和老人来转一转，真的是很不错。踢踢球、跑跑步、再来个野餐，很放松。,/Date(1578188974000+0800)/,0,4.267,0,0,0,1,0,0,1,0,0
557,7137570.0,奥林匹克公园的是2008年北京奥运会配套建立起来的，规模非常的大，和国家体育馆鸟巢，水立方等等都在一起，坐地铁的话会比较方便一些，就在八号线北延段。国家奥林匹克公园站下就可以了。,/Date(1565970809000+0800)/,1,4.278,0,0,0,2,0,0,0,0,0
558,157528016.0,奥林匹克森林公园是一个免费公园，很多市民经常去这里锻炼身体，拍照留影，一年四季都可以游玩。园内有健走的步道。这里植被覆盖率95[%]以上，空气清新，环境优美。,/Date(1557992487000+0800)/,0,4.286,0,0,0,3,0,0,1,0,0
559,897521.0,加上一个森林公园就名符其实了，在这里很静就是树林多，鸟儿多，花多，氧气多，是北京的免费公园，是人们喜闻乐见的休息公园。,/Date(1527005343000+0800)/,0,4.263,0,0,0,3,0,0,0,0,0
560,42480919.0,北京最漂亮的公园，很多景点，特别是鸟巢和水立方！算是北京无人不知的景点了…来北京一定要来这里看看，离颐和园，圆明园也是挺近的！可以一起玩！,/Date(1525345206000+0800)/,1,4.061,0,0,0,1,0,0,1,0,0
561,1118401.0,奥林匹克森林公园是亚洲最大的景观公园，据说其面积比颐和园和圆明园加起来还大。奥林匹克森林公园是北京的肺啊，公园内树木茂密，鲜花盛开，是人们散步遛弯的好地方。,/Date(1495604349000+0800)/,2,4.286,0,0,0,4,0,0,0,0,0
562,40447710.0,适合健身，也适合露营，属于城市公园的类型，和自然环境还有距离。交通便利，周边环境也很好，带着孩子，支起帐篷可以玩儿一天，度周末比较适合。,/Date(1493596207000+0800)/,5,4.284,0,0,0,1,0,0,1,0,0
563,459253.0,这里是向日葵的天下，各种颜色的向日葵，特别美，面积大拍照最佳地方，还有荷花小鱼，整个园林很大，建议大家早去比较凉快,/Date(1530612263000+0800)/,0,4.151,0,0,0,1,0,0,0,0,0
564,28501458.0,站在山顶远观奥林匹克公园的奥运景观大道，很壮观。这么平整的路，除了奥林匹克公园、天安门广场有，哪里还能有啊！天际线也是这么的明显，哪座城市不是高楼林立啊！,/Date(1523765265000+0800)/,2,4.286,0,0,0,2,0,0,0,0,0
565,54369719.0,我国大首都真的值得友友们去看一看，看看中华上下五千年历史文化，奥林匹克公园从08年起就想去看，现在终于体会到了，爱北京，爱国家，加油！,/Date(1490860191000+0800)/,3,4.286,0,0,0,1,0,0,0,0,0
566,31059698.0,又来奥林匹克森林公园北园看叶子了！北园比南园人少很多，也更清净。虽然前几天大风降温，冷了很多，但叶子红的更加惊艳了。红的爬山虎，黄的银杏，多姿多彩的秋。,/Date(1572863862000+0800)/,0,3.872,0,0,0,1,0,0,0,0,0
567,166283303.0,奥运主新闻中心（MPC）、国际广播中心（IBC）、奥林匹克接待中心、奥运村（残奥村）等在内的7个非竞赛场馆，是包含体育赛事、会展中心、科教文化、休闲购物等多种功能在内的综合性市民公共活动中心。,/Date(1525172171000+0800)/,0,-2.049,0,0,0,0,0,0,0,0,1
568,97219517.0,一个免费的5A级景点，在鸟巢和水立方北侧。奥林匹克公园分为南园和北园，南园游人较多，整体自然景色优美，有湖泊，各有五公里健身步道，是个健身休闲的好去处。,/Date(1502630974000+0800)/,2,4.285,0,0,0,2,0,0,0,0,0
569,3957790.0,北京奥林匹克公园曾经承载了无数人的奥运梦想，现在是集办公、商业、酒店、文化、体育、会议、居住多种功能的新型城市区域，每当夜晚奥运火炬台依然熠熠生辉……,/Date(1507815308000+0800)/,2,4.278,0,0,0,1,0,0,0,0,0
570,4592641.0,奥林匹克公园其实就是鸟巢、水立方、玲珑塔集合的公园，以及通往奥林匹克森林公园的沿途。这里大多数人选择看外景，内景对于时间紧迫的人来说，都是可以忽略的。,/Date(1492699542000+0800)/,2,4.286,0,0,0,3,0,0,0,0,0
571,88140094.0,奥林匹克森林公园紧邻奥林匹克公园，奥林匹克公园里有地铁站，所以下了地铁就是了，算是比较方便的公共公园，想看鸟巢的话，可以走进去，不进入场馆，免费的。,/Date(1521909065000+0800)/,2,4.275,0,0,0,4,0,0,0,0,1
572,88140094.0,奥林匹克森林公园的冬天很美。一些树叶，冷冻在冰下，非常美丽。那样的有诗意，让人生出一些想要咱们的意思。这里是不需要花钱的，也暂时不需要刷身份证进入。,/Date(1520439621000+0800)/,2,4.165,0,0,0,1,0,0,0,0,0
573,3595280.0,位于北京北四环，地铁八号线直达，不要门票。外围有一圈10公里跑步道，还有湿地，绿树成荫，有山有水。周围都是标志性建筑，有玲珑塔、鸟巢、亚投行等等。,/Date(1554717037000+0800)/,0,4.283,0,0,0,0,1,0,0,0,1
574,4592641.0,"【景色】现在正是前往奥林匹克森林公园最好的季节，这里有各种各样的花卉树木。
【趣味】即使走一走，也是不错的选择。
【性价比】性价比很高，免费的公园。",/Date(1555575188000+0800)/,0,4.286,0,0,0,3,0,0,1,0,0
575,31625999.0,沿着主干道走过去，水立方、鸟巢、玲珑塔、国家会议中心等都分布在两侧，还有很漂亮的凤尾灯，虽然奥运会已经结束，但这些建筑依旧让人感受到当时的盛况。,/Date(1467303934000+0800)/,4,2.223,0,0,0,0,0,0,0,0,1
