,uid,comment,date,like,sorce,#服务方面#cnt,#导游方面#cnt,#人流方面#cnt,#景色方面#cnt,#价格方面#cnt,#饮食方面#cnt,#娱乐方面#cnt,#儿童方面#cnt,#设施方面#cnt
674,4592641.0,森林公园现在是被广大市民喜欢的周末休息地，空气好，树木多，花多，各种环境设施都不错。厕所也是比较干净环保的。夏天很多人在里面带着小朋友玩,/Date(1490364365000+0800)/,2,4.28,0,0,0,2,0,0,1,0,2
675,4597745.0,平常都是去奥林匹克公园沿湖散步，今天趁着天气不错在奥林匹克塔登高俯视四周，别有一番感觉，整个园区包括鸟巢的规划一览无遗，非常大气，现在是冬季植物还没绿，如果春夏天来一定更漂亮。,/Date(1488016608000+0800)/,2,4.263,0,0,0,1,0,0,0,0,0
676,17640926.0,很大很美，周末的时候人很多，停车很麻烦，关键是5环太赌啦,/Date(1450350205000+0800)/,0,4.232,0,0,0,0,0,0,0,0,0
677,24457964.0,奥林匹克公园是一个免费开放的公园。公园内道路平整，树荫浓密，鸟语花香，园内设施齐全为周围社区居民和市民提供了一个平时休闲娱乐的好去处。,/Date(1556943268000+0800)/,0,4.286,0,0,0,3,0,0,1,0,1
678,85598108.0,挺好的，鸟巢水立方都在里面。都借光看看，踏青的好去处,/Date(1523541783000+0800)/,0,2.565,0,0,0,0,0,0,0,0,0
679,4207619.0,现在的奥林匹克公园已经全面开放给市民娱乐，节假日的时候还是很多旅游团过来，因为这里有水立方和鸟巢，厕所比较不好找，入园需要安检排队。,/Date(1480580497000+0800)/,2,-4.189,0,0,1,1,0,0,1,0,1
680,102785630.0,北京奥林匹克公园，集中体现了“科技、绿色、人文”三大理念，是融合了办公、商业、酒店、文化、体育、会议、居住多种功能的新型城市区域。,/Date(1541501709000+0800)/,0,4.286,0,0,0,1,0,0,0,0,0
681,13788360.0,北京最美时节来到了奥林匹克公园，红衣美女穿着唐装在照相，和周围的景色融为一体，很漂亮，发黄的银杏叶铺满草坪，让你感受到秋的色彩。,/Date(1572859701000+0800)/,0,4.285,0,0,0,2,0,0,0,0,0
682,32679920.0,奥林匹克公园位于北五环外的免费公园，地铁奥林匹克公园站和奥体中心站均可抵达。有地标性建筑鸟巢和水立方，外来游客很多，适合留念打卡。还配有游园小火车。,/Date(1557063023000+0800)/,1,4.264,0,0,0,3,0,0,0,0,1
683,4592641.0,奥林匹克公园位于北京市北四环区域，该公园由奥体中心、鸟巢、水立方，森林公园组合而成。该区域从前是亚运村，所以临近又建造了奥运村。,/Date(1551538224000+0800)/,0,4.258,0,0,0,3,0,0,0,0,0
684,4592641.0,沿着奥林匹克景观大道一直向北走，就是奥林匹克森林公园，今天在公园里赏月的人很多，游客也很会选位置，特别是摄影爱好者，都是喜欢的。,/Date(1537798047000+0800)/,0,4.285,0,0,0,2,0,0,0,0,0
685,171276315.0,奥林匹克森林公园是比较佛系的公园了，不管是什么年龄段的朋友，过去都能找到属于自己的天地，算是比较友善的免费公园了，周末扎满帐篷。,/Date(1530264015000+0800)/,0,4.286,0,0,0,3,0,0,0,0,0
686,602117.0,春意盎然，奥森一曰游。就是有雾霾，景还是很美的！,/Date(1522053000000+0800)/,0,-1.097,0,0,0,0,0,0,0,0,0
687,432693.0,尽管北京又开启了雾霾天气，感觉有些沉闷，不过选个晴朗日子，初冬伊始，在奥森公园走走还是一派清新自然的，奥森南园的冬初依然秋意浓浓，树叶开始掉落也仍有傲立寒冬的一抹亮色,/Date(1479013242000+0800)/,2,0.97,0,0,0,1,0,0,0,0,0
688,34054099.0,挺好的，深秋可以看彩叶。也是休闲娱乐的好去处。,/Date(1478000962000+0800)/,0,3.935,0,0,0,0,0,0,1,0,0
689,97221766.0,奥林匹克公园很大，著名的大家耳熟能详的有鸟巢，水立方，整个公园布局很好，绿化点缀的很不错，场地很大，周边交通便利，游客很多。,/Date(1579203474000+0800)/,0,4.286,0,0,0,2,0,0,0,0,0
690,62421688.0,进去是免费的，不过需要安检，等的人很多，进去之后显得人少一些，里面有十一花车的展览，挺不错的，晚上的灯光也很好，不错的旅行。,/Date(1570173203000+0800)/,0,3.845,0,0,0,0,0,0,0,0,1
691,31059698.0,今天的奥林匹克森林公园让我有些伤感。昨天的一场大风（阵风高达九级），不仅让北京的气温骤降，也让深秋的荷叶，菊花破败不堪了。,/Date(1572321552000+0800)/,0,4.282,0,0,0,1,0,0,0,0,0
692,1726151.0,天气暖和起来以后，该恢复锻炼跑步了。奥森的跑道有多久没有享受了。奥森的风景还是很美很好的，特别是华灯初上的时候，梦幻般的。,/Date(1559035369000+0800)/,0,4.269,0,0,0,1,0,0,0,0,0
693,4592641.0,立冬这一天去了鸟巢，它坐落在奥林匹克公园里。进入公园不需要门票，进入场馆需要门票，票价不便宜，没有选择进去，在广场走了走。,/Date(1541590517000+0800)/,0,3.74,0,0,0,2,2,0,0,0,0
694,28501458.0,奥林匹克森林公园是北京市民周末最喜欢的地点，不算太郊区，乘坐brt快三路就可以到达，公园里允许搭建帐篷，适合带着孩子家庭。,/Date(1535604388000+0800)/,0,4.282,0,0,0,2,0,0,0,0,0
695,6326589.0,深秋的奥森色彩斑斓，很多游人，休闲运动者。,/Date(1509748490000+0800)/,0,-1.142,0,0,0,0,0,0,0,0,0
696,1853736.0,国庆黄金周的奥林匹克公园，可谓是人山人海，不过夜景确实好看，看了，鸟巢 ，水立方，还有景观塔的灯饰，非常不错，且很有新意。,/Date(1570447345000+0800)/,0,4.28,0,0,1,3,0,0,0,0,0
697,116713105.0,北京奥林匹克公园位于北京市朝阳区，总占地面积约11平方千米，是包含体育赛事、休闲购物等多种功能在内的公共活动中心。公园东侧的龙形水域很有特色，总长约2.7千米，南起鸟巢南侧，北至森林公园奥海。也可以带孩子再这里游玩拍照。,/Date(1560002421000+0800)/,0,4.286,0,0,0,3,0,0,1,0,1
698,12337743.0,为2008年奥运会建设的奥林匹克森林公园属温带大陆型半湿润季风气候，四季分明，降水集中。春季干燥多风，昼夜温差较大；夏季炎热多雨；秋季晴朗少雨，冷暖适宜，光照充足；冬季寒冷干燥，多风少雪。初冬的这里另有一翻景致。,/Date(1543123690000+0800)/,0,4.125,0,0,0,1,0,0,0,0,0
699,4592641.0,奥林匹克公园和奥林匹克森林公园，是两个。图一是奥林匹克公园，图二、三是奥林匹克森林公园。紧邻，完全就是出一个，就进一个。,/Date(1521823986000+0800)/,0,4.281,0,0,0,4,0,0,0,0,0
700,4592641.0,奥林匹克森林公园的枫叶已经开始慢慢变红了，现在有波斯菊展，但是由于游客都想亲近自然拍照，被踩踏了不少，有的地方都走秃了…,/Date(1507945637000+0800)/,0,4.284,0,0,0,1,0,0,0,0,0
701,14509029.0,免门票，交通便利，紧邻盘古七星酒店，个人感觉傍晚去合适，夜景很漂亮，而且广场上灯光如昼，拍照也很清楚，也不会显得人很黑。,/Date(1503579022000+0800)/,0,4.286,0,0,0,0,1,0,0,0,0
702,52559583.0,从西站出发坐地铁大概一个小时，我们上午去的自然博物馆，下午应小朋友要求去的，看见鸟巢感觉特别兴奋，不过只从外边拍照，没有进去参观，要门票，好像鸟巢+水立方140,/Date(1488894430000+0800)/,0,4.285,0,0,0,0,1,0,0,0,0
703,25497715.0,"鸟巢——水立方因为游客很少，所以游览起来很节省时间，一圈下来也就一个半小时左右。临近中午菇凉想着鸟巢水立方出发喽！中途换乘的时候还真”护国寺“吃了午饭！
杏仁豆腐的杏仁味很浓厚！当然也少不了菇凉最爱的”豌豆黄“了！其他几样不记得名字了！(=@__@=)——啊~~~~五环，你不四环多一环； 啊~~~~五环，你比六环少一环。 O(∩_∩)O哈哈~——水立方和大龙头",/Date(1453053670000+0800)/,2,-8.438,0,0,0,0,0,0,0,0,0
704,275239570.0,登上去后，没几分钟就看完了，没其他事情就下来了，第二天晚上路过的时候，灯还不错,/Date(1602072394000+0800)/,0,-5.63,0,0,0,0,0,0,0,0,0
705,4532232.0,奥森南园的雨后荷塘，花开正艳，美不胜收,/Date(1500086625000+0800)/,0,-7.131,0,0,0,0,0,0,0,0,0
706,3380031.0,看京城夜景好地方，确实不错！值得一来,/Date(1536887856000+0800)/,0,4.248,0,0,0,1,0,0,0,0,0
707,85598108.0,果然有一种奥运精神，修身养性的好地方,/Date(1512923370000+0800)/,0,3.834,0,0,0,0,0,0,0,0,0
708,15575445.0,位于北京北三环的中心线上，位置超级的好，坐公交的话到北辰桥西走路15分钟左右到达，2、整个公园是免费的，鸟巢与水立方都在这里，还有国家体育馆都在附近，非常有名的建筑盘古大观就在旁边，风景特别的好。,/Date(1498222201000+0800)/,0,4.244,0,0,0,2,0,0,0,0,1
709,52864074.0,2008年北京奥林匹克运动会修建的。,/Date(1497015809000+0800)/,0,-3.782,0,0,0,0,0,0,0,0,0
710,811555.0,植被非常好，公园很大，适合休闲娱乐，跑步锻炼等各项活动。,/Date(1494214859000+0800)/,3,4.275,0,0,0,1,0,0,1,0,0
711,54369719.0,太大了，我从南走到北，快累晕啦，不过很值得去，鸟巢，水立方，国家体育馆都不错,/Date(1472024682000+0800)/,0,4.271,0,0,0,0,0,0,0,0,0
712,36880035.0,不得不说，在北京这重度雾霾的环境下，有这样一片树木繁茂，环境优美的公园真是难得啊。公交、地铁也都特别方便，还没有门票，周围停车收费也不贵简直就是休闲圣地啊,/Date(1486171125000+0800)/,2,4.282,0,0,0,3,1,0,0,0,0
713,672460.0,朝阳不仅有群众，更有这五彩缤纷的景色，秋天的这里大美，是北京最美的公园之一,/Date(1447396880000+0800)/,0,4.276,0,0,0,2,0,0,0,0,0
714,31646040.0,北京的任何建筑都是历史的见证，除了耳熟能详的景点还有周边建筑也是有说法的,/Date(1561426980000+0800)/,2,4.0,0,0,0,0,0,0,0,0,2
715,2982483.0,鳥巢 、水立方都是這個公園的知名建築物，晚上燈景到晚上9:30，之後就滅燈。這個公園蠻適合散步、跑步的運動。,/Date(1537460930000+0800)/,0,-2.979,0,0,0,0,0,0,0,0,0
716,249791008.0,公园挺大的，不建议开车去，没多少地方停车。游客比较多，景色还可以,/Date(1584548783000+0800)/,0,1.842,0,0,0,2,0,0,0,0,0
717,57298279.0,每天过来散散步或跑跑步特别不错的选择。空气非常好。也适合全家周六周日选个好天气过来野餐游玩，秋叶红了，过来观赏观赏吧，香山人太多，这人不多空气好,/Date(1477357414000+0800)/,2,4.286,0,0,2,0,0,0,1,0,0
718,196254102.0,2013年5月28日-6月1日北京参加培训，5月28日下午从北京南站直奔奥林匹克公园，入场的每一个人都要经过安检，可惜时间不够了，没法再去奥林匹克森林公园。游览完毕后赴培训会场报到。,/Date(1538789014000+0800)/,0,-9.98,0,0,0,2,0,0,0,0,0
719,606760.0,这是北京的新景点，是北京奥运会场地，是我国强大的象征之一。,/Date(1561475488000+0800)/,0,4.252,0,0,0,0,0,0,0,0,0
720,44505512.0,在北京众多景点中，奥林匹克公园算是现代气息比较浓的了。除了众所周知的鸟巢和水立方之外，这里还会定期的有各种展览。水立方还是晚上看比较漂亮。,/Date(1492599882000+0800)/,2,4.258,0,0,0,1,0,0,0,0,1
721,54308624.0,这时候去，比较荒野，杂草之类的都有。地方太大，体力不太好，没有走太远，围绕湖走了一小圈，也没有什么出奇的景色和美感。大多森林公园也都如此。,/Date(1472959057000+0800)/,2,2.724,0,0,0,2,0,0,0,0,0
722,210473517.0,位于北京北四环外，分为南北两园，以横跨五环路的生态桥连接，南园以自然山水景观为主，北园则以小型溪涧景观为主。 院内最著名的景观是“仰山”和“奥海”，还有奥林匹克宣言广场，每年都有鲜花盛开，非常美丽。,/Date(1557517481000+0800)/,1,4.286,0,0,0,0,0,0,0,0,0
723,1853237.0,免费开放。南侧的场馆区有著名的鸟巢、水立方等场馆，作为奥运会的举办地，这里也是北京市著名的地标。,/Date(1496665356000+0800)/,0,-0.615,0,0,0,0,0,0,0,0,0
724,1518542.0,"地铁坐到奥林匹克公园，那里其实有个展望台的，我们是之后坐出租车，司机师傅告诉我们的。
可以俯瞰鸟巢水立方，所以要记得噢，其实晚上更美。",/Date(1459948713000+0800)/,0,4.22,0,0,0,1,0,0,0,0,0
725,79467961.0,北京欢迎您。我错过参与北京奥运会，看看北京奥林匹克公园也很有体验感，不愧是首都，公园设计大气磅礴，有幸亲临奥林匹克塔顶眺望整个公园。,/Date(1566035451000+0800)/,0,4.286,0,0,0,3,0,0,0,0,0
726,34514611.0,天暗微寒，风起云动，打卡鸟巢。完全免费的一个运动好地方，周围运动的人很多所以氛围很好，再想想建筑这里的缘由，无限激发了自己运动的动力,/Date(1553755567000+0800)/,0,4.28,0,0,0,0,0,0,0,0,1
727,4592641.0,可以等到最高的地方展望出去，很壮观，但前提是要天气好，不然雾霾是啥也看不到的，那也就不必爬上去了！这里现在是免费的，市民喜爱的公园,/Date(1490018448000+0800)/,0,4.277,0,0,0,1,0,0,0,0,0
728,63911248.0,公园里有很多东西，水立方之类的，但是遗憾的是没有进去看一看，因为是跟团走，能抽出时间买纪念品就不错了，但是很多景色还是值得一看的。,/Date(1474205251000+0800)/,2,4.278,0,0,0,2,0,0,0,0,0
729,1188519.0,奥林匹克森林公园称为北京奥运会的“后花园”，在鸟巢，水立方旁边，已成为北京市民的的一个户外大氧吧，很多运动爱好者都在周末前来健身。,/Date(1446903167000+0800)/,0,4.088,0,0,0,1,0,0,0,0,0
730,170557154.0,整体来说，除了建筑没有什么可以看的，但毕竟很有意义，出来北京的朋友们可以过来打开，进入鸟巢体育馆，水立方，回忆田径场上，碧水池中奥运健儿们的雄姿。,/Date(1555116598000+0800)/,1,4.228,0,0,0,0,0,0,0,0,1
731,53887702.0,春游比较好的选择，比玉渊潭人要少太多，花开的真的很好看，少女心blingbling的,/Date(1459946462000+0800)/,4,4.083,0,0,0,1,0,0,0,0,0
732,19224800.0,面积很大，地铁八号线森林公园站上来可到，很适合带小朋友来玩。可划船、骑多人自行车等。环境很不错，还免费，许多人来着锻炼身体。,/Date(1453000203000+0800)/,2,4.286,0,0,0,2,0,0,1,0,0
733,113113962.0,公园是免费的，出了8号线地铁站就是公园，里面还有一个购物中心，公园里还有双人的共享单车。过了马路就是鸟巢和水立方，值得一看,/Date(1503318776000+0800)/,0,4.278,0,0,0,3,0,0,0,0,0
734,222469819.0,很大的公园，分为南园和北园，南园的人更多一些，北园春天的向日葵花海很美。这里是市民健身的圣地，里面有3公里、5公里、10公里的跑道，经常会有单位在这里组织健身活动。公园里的景色也很美，有一个很大的湖，还有草坪、森林，春天可以野餐，冬天可以玩雪。公园附近就是鸟巢和水立方，还有一个商场，地铁也很方便。,/Date(1562492367000+0800)/,0,4.286,0,0,0,4,0,0,1,0,0
735,115091655.0,"北京奥林匹克公园位于北京市朝阳区，地处北京城中轴线北端，北至清河南岸，南至北土城路，东至安立路和北辰东路，西至林翠路和北辰西路，总占地面积11.59平方千米，集中体现了“科技、绿色、人文”三大理念，是融合了办公、商业、酒店、文化、体育、会议、居住多种功能的新型城市区域，
2008年奥运会比赛期间，有鸟巢、水立方、国家体育馆、国家会议中心击剑馆、奥体中心体育场、奥体中心体育馆、英东游泳馆、奥林匹克公园射箭场、奥林匹克公园网球场、奥林匹克公园曲棍球场等10个奥运会竞赛场馆。此外，还包括奥运主新闻中心（MPC）、国际广播中心（IBC）、奥林匹克接待中心、奥运村（残奥村）等在内的7个非竞赛场馆，是包含体育赛事、会展中心、科教文化、休闲购物等多种功能在内的综合性市民公共活动中心。
2017年12月4日起，北京奥林匹克公园试行实名制入园。",/Date(1526449121000+0800)/,0,4.286,0,0,0,2,0,0,0,0,1
736,120070872.0,位于北京市朝阳区北五环林萃路，东至安立路，西至林萃路，北至清河，南至科荟路。公园占地680公顷，其中南园占地380公顷，北园占地300公顷。公园森林资源丰富，以乔灌木为主，绿化覆盖率95.61[%]的免门票公园，是奥运村附近非常好的健身场所，绿化覆盖面积大，空气尤其清新，公园有100余种共53万株乔木、80余种灌木和100余种地被植物，建筑设计新颖，颇具时代感，公园内亭台楼阁，人造湖等景色很美，是游览，休闲的好去处！,/Date(1523091130000+0800)/,0,4.286,0,0,0,6,1,0,0,0,1
737,7933925.0,奥林匹克森林公园位于北京市朝阳区北五环林萃路，东至安立路，西至林萃路，北至清河，南至科荟路。公园占地680公顷，其中南园占地380公顷，北园占地300公顷。公园森林资源丰富，以乔灌木为主，绿化覆盖率95.61[%]。奥林匹克森林公园是奥林匹克公园的终点配套建设项目之一，而奥林匹克公园是国家AAAAA级旅游景区。,/Date(1516284993000+0800)/,0,4.286,0,0,0,6,0,0,0,0,1
738,1783028.0,色彩斑斓，天空晴朗，空气清新，视野开阔。,/Date(1510721279000+0800)/,0,4.28,0,0,0,0,0,0,0,0,0
739,,奥林匹克森林公园是集旅游观光、休闲娱乐、体育健身等多功能为一体的北京最大的公共公园。其中有一片非常受游客欢迎的人造湿地，在这片湿地上，有着大片的芦苇、香蒲、球穗莎草、菖蒲和美人蕉。沿着小桥在湿地中行走，下桥走500米就可以到达水下沉廊，这条廊道修在水下，步行其中，不但可以近距离观赏到湿地景观，而且在玻璃桥体内还能观赏到湿地内游动的小鱼、植物根系如何净化水质，放入水中的桥体还可以减缓水体流动，使净化水质效果加大。,/Date(1505988561000+0800)/,0,4.286,0,0,0,2,0,0,1,0,1
740,55735390.0,奥林匹克森林公园在贯穿北京南北的中轴线北端，位于奥林匹克公园的北区，是目前北京市规划建设中最大的城市公园—奥林匹克森林公园，让这条城市轴线得以延续，并使它完美地融入自然山水之中。这里被称为第29届奥运会的“后花园”，赛后会成为北京市民的自然景观游览区。,/Date(1505279688000+0800)/,0,4.286,0,0,0,4,0,0,0,0,0
741,67427003.0,它包括鸟巢、水立方和国家奥林匹克体育中心（这个是90年亚运会的主会场）。坐地铁来这里最方便，无论你怎么倒，最终都要换乘地铁8号线（回龙观东大街方向）。来这个公园，大家无非是最想看鸟巢和水立方，所以最好在奥体中心站下车，离上述二者更近（楼主测试过奥林匹克公园站，这个要远一些）。时间推荐大家下午没黑天之前来，这样你就可以用最短的时间看到鸟巢和水立方亮灯与不亮灯两种景观。这附近有很多小贩卖鸟巢、水立方的模型，10元、20元一个（比专卖店里便宜许多），小孩子喜欢的话可以买两个玩玩。,/Date(1500121919000+0800)/,0,4.276,0,0,0,2,0,0,2,1,0
742,1176667.0,交通很方便，15号线和8号线都能直达。公园很大，奥运的一些标志性场馆都包含其中，如果晚上去景色更美。公园分成两个部分，一是奥运场馆，二是森林公园，个人觉得场馆从外观看就可以了，内部的设施基本都大同小异，森林公园的布局不太合理，没有那种绿树成荫的感觉，另外不知为什么公园里车停的特别多，给人杂乱无章的感觉。,/Date(1499635385000+0800)/,0,4.286,0,0,0,6,0,0,0,0,1
743,11452558.0,春季到来万不可错过春花盛开，有“绿肺”之称的奥林匹克森林公园是很多人的赏花首选。每到春光时节，奥林匹克森林公园便会献上精彩的“春花节”，到时游人能观赏到樱花、海棠、丁香、迎春、玉兰、连翘、山桃、杏花、玫瑰等花卉，这鲜花在春季的第一抹微笑别提多动人，赏春色、嗅花香，一片生机勃勃,/Date(1488467870000+0800)/,0,4.286,0,0,0,2,0,0,0,0,0
744,34539668.0,我们在北京找到过一个给孩子拍照的跟拍，他一直推荐这个公园，第一次我们去了颐和园，第二次拍落叶听了他的，这个公园很大，带孩子玩上一天也不会闷，而且到了落叶的季节，真是满树黄叶，很好看，也确实很适合拍照。,/Date(1484350377000+0800)/,0,4.273,0,0,0,3,0,0,1,0,0
745,6317185.0,"北京奥林匹克公园位于北京市朝阳区，地处北京城中轴线北端，北至清河南岸，南至北土城路，东至安立路和北辰东路，西至林翠路和北辰西路，总占地面积11.59平方千米。
北京奥林匹克公园分为三部分：北部是6.8平方千米的奥林匹克森林公园、中部是3.15平方千米的中心区、南部是1.64平方千米的已建成和预留区（奥体中心）。
中心区位于奥林匹克公园中部，科荟路以南，北四环中路以北。其西北角设有奥运村，南部设有各个主场馆，包括国家体育场“鸟巢”、国家游泳中心“水立方”、国家体育馆、国家会议中心（赛时为击剑馆、国际广播中心）等。",/Date(1483394229000+0800)/,0,4.286,0,0,0,4,0,0,0,0,0
746,4138901.0,免费的公园，面积很大，分为南园和北园。南园可以在地铁森林公园南门下车，西门的话地铁林萃桥站，交通很方便。里面有一条塑胶健步道，大圈10公里，小圈5公里。无论是跑步健身还是来北京旅游这里都是不错的选择。,/Date(1480240513000+0800)/,0,4.285,0,0,0,2,0,0,0,0,0
747,35446243.0,由于奥林匹克森林公园是一个免费公园，所以这里是周围很多单位职工锻炼身体的好地方，虽然公园没有什么特殊的绿色植物，但是，绿色是这个公园的主色调。 随着时间的推移，来这里游览者愈来愈多，应该说是一个去锻炼的好地方。,/Date(1453806973000+0800)/,0,4.286,0,0,0,4,0,0,0,0,0
748,30282255.0,冬天去的北园，人多，风景不错，不收费。,/Date(1554952435000+0800)/,0,1.1,0,0,1,1,0,0,0,0,0
749,22027095.0,奥森公园是2008年奥运会新建点免费开发的大型城市绿化景观。里面有湖水，大量的树木。春天赏花，秋天看枫叶。附近居民在此休闲，健身。里面有3公里，5公里，10公里点塑胶跑到。最近又开了网球场和滑雪场。,/Date(1508107252000+0800)/,0,-9.824,0,0,0,1,0,0,0,0,0
750,2172459.0,公园无需买票，公司每年都在公园组织健步走活动，平时天气好也会带孩子来玩，公园被北五环分成南北两个部分，南园可玩性比较强，可以划船，南门还有很多鱼，可以喂鱼。节假日停车位比较紧张。,/Date(1476363365000+0800)/,1,4.265,0,0,0,3,0,0,2,0,0
751,5426300.0,主要有鸟巢（国家体育场）、水立方（国家游泳中心）、国家会议中心、下沉花园、玲珑塔（多功能演播塔）等组成。鸟巢、水立方晚上的灯光非常漂亮，建议晚上去看看。奥林匹克森林公园面积较大，要用一天时间游玩。,/Date(1500268870000+0800)/,0,4.264,0,0,0,1,0,0,1,0,0
752,242021150.0,占地面积特别大，安检特别严格。,/Date(1583935830000+0800)/,0,0.321,0,0,0,0,0,0,0,0,0
753,7972784.0,"奥林匹克公园云集众多体育场地，白天时平淡无奇，但里面众多的体育设施也值得一观。当夜晚降临时，水立方和鸟巢灯光灿烂，令人留连
【景色】",/Date(1567472796000+0800)/,1,4.284,0,0,0,2,0,0,0,0,1
754,53349724.0,从小山村来到这里，很是有意思！,/Date(1465638560000+0800)/,0,4.064,0,0,0,0,0,0,0,0,0
755,14385656.0,完全免费进入，而且春天来了，各种花花草草也开始开花发芽了，越来越美哦,/Date(1489329475000+0800)/,2,4.283,0,0,0,0,0,0,0,0,0
756,16667281.0,不用说了，这里有国家体育场，鸟巢，水立方，到晚上看，霸气又漂亮，随手拍了一张夜景，看图吧,/Date(1486864694000+0800)/,1,4.221,0,0,0,1,0,0,0,0,0
757,38320854.0,冬天雪后的奥森，一片白茫茫的。尤其穿梭在树林中，仿佛到了东北的大兴安岭，美到极致。虽然风很大，吹到脸上很刺骨，但是蓝天白云+白雪的景色，让人流连忘返。奥森的塑胶跑道，也是处绝佳的锻炼场所。,/Date(1486516723000+0800)/,0,4.282,0,0,0,1,0,0,0,0,0
758,2464808.0,奥林匹克公园位于北京市北四环中路的北侧，土豪，大气，不错，环境幽雅。,/Date(1486199067000+0800)/,0,4.286,0,0,0,2,0,0,0,0,0
759,68778379.0,奥林匹克塔夜景外环造型很美，塔很高，坐电梯到塔顶可眺望北京夜景，看到奥林匹克公园的鸟巢和水立方，很美很美。,/Date(1569115674000+0800)/,0,4.286,0,0,0,3,0,0,0,0,0
760,3905570.0,北京奥林匹克森林公园，有南北两个园。公园挺大，设有跑到，是健步走慢跑的有氧运动好去处！公园免费，里面山山水水造就了怡人的环境！,/Date(1479308226000+0800)/,3,4.277,0,0,0,4,0,0,0,0,0
