,uid,comment,date,like,sorce,#服务方面#cnt,#导游方面#cnt,#人流方面#cnt,#景色方面#cnt,#价格方面#cnt,#饮食方面#cnt,#娱乐方面#cnt,#儿童方面#cnt,#设施方面#cnt
1826,152985826.0,在北京的周末里不知道去哪儿，就去长城，任何一段正规开放的长城，任何季节，都是正确的决定。我在过去12个月去了4次，回回都很开心,/Date(1639784993000+0800)/,0,3.677,0,0,0,0,0,0,0,0,0
1827,113544667.0,"不到长城非好汉
我们那天去长城的时候人流量还是相当大的，整个长城分两向是需要走回来的，长城上是单行线，可以坐缆车直接登到北16楼",/Date(1635010886000+0800)/,0,4.279,0,0,0,0,0,0,0,0,0
1828,96118110.0,八达岭长城很不错 带着孩子一起来还看了球幕电影超级震撼 八达岭必须去的长城 赞巴士 真的方便还不用做摆渡 导游也很负责一直叮嘱 好线路推荐,/Date(1623222955000+0800)/,0,4.286,0,1,0,0,0,0,0,0,0
1829,325454535.0,赞巴士无购物，车上环境非常好，车也开得很稳，坐着也很舒服。导游小孙讲解的也非常棒 ，欣赏到了梦寐以求的长城之景，此次旅行非常棒！,/Date(1620460778000+0800)/,0,4.286,0,2,0,1,0,0,0,0,0
1830,315942522.0,在北京自由行，想去长城，翻看了很多资料，最后选择了赞巴士，强子导游非常负责，讲解也很好,/Date(1618470867000+0800)/,2,4.286,0,2,0,0,0,0,0,0,0
1831,192020692.0,赞巴士，来八达岭长城的首选，一站直大，没有购物店，足够的游览时间，看了球慕电影，很满意,/Date(1618386725000+0800)/,2,4.286,0,0,0,0,0,0,0,0,0
1832,181775689.0,早上八点乘坐赞巴士前往八达岭长城，一个小时十分钟左右到达，来回四小时，时间充足，很方便,/Date(1618033644000+0800)/,2,0.407,0,0,0,0,0,0,0,0,0
1833,152534786.0,风景美丽 很好 ！第一次跟团服务也是不错的。虽然人多，但是好不容易一个假期 还是要出来溜达。,/Date(1617528830000+0800)/,2,4.019,1,0,1,1,0,0,0,0,0
1834,20566219.0,总体超赞，性价比高，有趣好玩，景色不错，游览了祖国的大好河山，体验一下不到长城非好汉。人多，车多，景美，一点也看不出疫情影响。,/Date(1615368781000+0800)/,0,4.286,0,0,1,1,0,0,2,0,0
1835,261839066.0,值得一去👋👋👋👋👋👋👋👋👋👋👋👋👋👋👋👋👋👋👋👋👋👋👋👋👋👋👋👋👋,/Date(1661268980000+0800)/,0,0.573,0,0,0,0,0,0,0,0,0
1836,111470434.0,八达岭长城雄伟壮观，位于北京市延庆区军都山关沟古道北口。是中国古代伟大的防御工程万里长城的重要组成部分，是明长城的一个隘口。,/Date(1656053030000+0800)/,0,4.234,0,0,0,0,0,0,0,0,0
1837,1539352.0,蛮好的！！！！！！！！！！！！！！！！！！！！！！！！！！！！！！！！！！！！！！！！！！！！！！！！！！！！！！！！！！！,/Date(1652744485000+0800)/,0,1.304,0,0,0,0,0,0,0,0,0
1838,4911632.0,冬奥会三景，环境优美的旋律，白雪映衬的更美，随处一看，随处一转，美景无限，让人佩服的美，心情开朗，心旷神怡，心境开阔，喜欢。,/Date(1645267630000+0800)/,0,4.286,0,0,0,2,0,0,0,0,0
1839,84865388.0,我心心念念的雄伟壮观的八达岭长城，我来看你了，在蓝天白云的见证下，我们终于约会了，冬日暖阳之下的长城更有一番韵味，魅力四射。,/Date(1639838936000+0800)/,0,4.286,0,0,0,0,0,0,0,0,0
1840,222448474.0,赞巴士直达巴士超赞！集合地点交通便捷，全程高速一站到达，无购物无推销，预留了充足的时间自己游玩，很赞！一家人出行游玩很方便。,/Date(1620193732000+0800)/,0,4.286,0,0,0,0,0,0,2,0,0
1841,254802800.0,五一期间，来到八达岭长城游玩当好汉，今天风和日丽，坐了赞巴士的车，非常好，导游小姐姐很nice，随时来随时走，不误点，真棒。,/Date(1620023187000+0800)/,0,4.271,0,1,0,0,0,0,1,0,0
1842,49489533.0,不到长城非好汉，屈指行程二万！春寒料峭春风和煦，清明时节，人们都出来爬长城踏青赏花，苍茫的长城之上，人流绵延不绝，蔚为壮观！,/Date(1618147963000+0800)/,0,4.285,0,0,0,0,0,0,0,0,0
1843,1054796.0,八达岭长城的风光，集巍峨险峻，秀丽苍翠于一体，是明长城景色中的精华，“不到长城非好汉”很多人都以这里为登临长城的主要选择。,/Date(1659515762000+0800)/,0,4.286,0,0,0,2,0,0,0,0,0
1844,322384558.0,今天乘坐赞巴士去的八达岭长城 车上李导介绍了八达岭长城主要的游玩景点和游玩路线 很贴心 并且是四小时纯玩无购物 赞巴士值得选择👍,/Date(1623907931000+0800)/,0,4.286,0,0,0,0,0,0,3,0,0
1845,320847569.0,特别有意义的一天，终于见到了万里长城，直接坐赞巴士直达特别的方便，导游讲解的特别清晰，不会感觉太累收获满满的，心情棒棒哒！,/Date(1620546393000+0800)/,0,4.285,0,2,0,0,0,0,0,0,0
1846,238144008.0,和几个朋友带父母去北京旅行，去爬长城是他们心中的一个心愿这次去天气清爽，四月的风不冷不热，蓝天白云，人也不是很多，十分完美景色不错，总体超赞，有趣好玩，性价比高，,/Date(1619444726000+0800)/,0,4.286,0,0,0,1,0,0,2,0,0
1847,212904908.0,北京段长城最有名的一段，也是比较惊险的一段，到北京旅游，游览长城必打卡的地方。景色震撼迷人，趣味多样，性价比还是很高的。,/Date(1660605471000+0800)/,0,4.286,0,0,0,1,0,0,1,0,0
1848,175494458.0,第三次去八达岭长城，第一次和老公，只到长城脚下拍个照片，第二次带孩子，只爬到南3楼，这次带父母和儿子爬到了北7楼，是长城最高点，登顶后真的很开心！儿子大声呼喊，自己太棒了！长城环境卫生保持很好，东西价位不高。,/Date(1659622918000+0800)/,0,4.285,0,0,0,1,0,0,0,2,0
1849,25063734.0,"有名的地标建筑 算得上国家脊梁的代表了 
整体上 由于有市郊铁路等搭配 八达岭的人也更多 
作为奥运标志曾经的所在地 也被寄托了更多意义",/Date(1658059308000+0800)/,0,3.28,0,0,0,0,0,0,0,0,1
1850,75682811.0,预约购票很方便，多少年没去过了，这次终于爬到最高的烽火台了。,/Date(1658035020000+0800)/,1,-7.788,0,0,0,0,0,0,0,0,0
1851,44759740.0,八达岭长城在北京延庆区，旅游开发很早，据说是最早向游人开放的长城。现在城际铁路有八达岭长城站，从北京北站坐动车到八达岭非常方便，下车之后走一点路就是长城景区入口。来的时候天气非常好，蓝天白云，适合拍照。不到长城非好汉嘛，所有的游客都努力爬到最高的烽火台，不过有趣的是大部分游客都是往北爬，到北八楼为止，南边的长城人很少。,/Date(1657965392000+0800)/,0,4.273,0,0,0,0,0,0,1,0,0
1852,56429703.0,这里的游乐设施特别齐全，在中国其他地儿都见不到。这里有很多稀奇古怪的美食。还有络绎不绝的人群。唯一的不足就是价格太高了哈,/Date(1655566604000+0800)/,0,4.256,0,0,0,0,1,1,0,0,1
1853,13064549.0,"登八达岭长城，赏锦绣山河。八达岭长城曾经是抵御外敌入侵的屏障，捍卫着我们的国土。在战争中多少好男儿为驱赶鞑虏英勇就义，为国捐躯。八达岭长城不仅是一个旅游景点，更是历史的见证！我们应该向这些抛头颅，洒热血的英雄们致敬！
【景色】雄伟壮观
【趣味】非常有趣
【性价比】高",/Date(1647656729000+0800)/,0,4.286,0,0,0,1,0,0,2,0,0
1854,35453338.0,带女儿来北京，第一天故宫，第二天就是长城。只是暑假长城游客超级多，坐缆车排队都花了挺长时间。不过缆车直接把我们送到北七楼，距离北八楼就一百米。不过好汉坡真的难爬，反正我是没爬上去，女儿自己上去了。下山是走路的，难度不大。八达岭的交通我觉得不方便，幸亏有人接送，真的离市区远。,/Date(1637506768000+0800)/,0,2.197,0,0,1,0,0,0,0,2,0
1855,55338641.0,停第一次去长城，停车场管理人员态度不好。因为按照导航去长城入口，没有提示入口停车场不让停车，在接驳车处有工作人员直接指挥车辆进入停车场，问停车场管理人员，一副不耐烦的样子，并且什么有用的信息都没问到，还是自己跟着游客打听，才知道要做免费接驳车到长城入口。停车场管理人员的小插曲是我们旅途中唯一不完美的地方。,/Date(1634797379000+0800)/,0,-9.998,5,0,0,0,0,0,0,0,0
1856,80573624.0,位于怀柔城关镇西北29公里的黄花城，因仲夏漫山遍野的黄花而得名。该长城建于明永乐年间，距今已有600多年历史。明朝为增加防御力量，在怀柔境内修建了外长城和内长城。黄花城长城就属于内长城，且是怀柔境内长城的最西段，也是明代蓟镇居庸关的最东端。 ,/Date(1634266732000+0800)/,0,4.274,0,0,0,0,0,0,0,0,0
1857,80573624.0,古老的岔道城三面被青山环抱，城中原建有关帝庙、城隍庙、泰山庙、东狱庙等10座庙宇，还有守备衙门、公馆、戏楼等。西城门外有练兵的校场。还有粮秣、武器弹药仓库。城的东北两侧山顶各筑一座堡垒。周围山峰筑有嘹望敌情的烽火台。为加强防御，在西关外还建有土边城垣。,/Date(1633689247000+0800)/,0,4.227,0,0,0,0,0,0,0,0,0
1858,111787290.0,长城景色宜人，虽然是夏天每个人都汗流浃背，但是大家的脸上都洋溢热情，爱祖国爱长城,/Date(1631862115000+0800)/,0,4.284,0,0,0,1,0,0,0,0,0
1859,11332263.0,"八达岭长城，位于北京市延庆区军都山关沟古道北口，中国古代伟大的防御工程万里长城的重要组成部分，明长城的一个隘口。
  我们一早就出发，七点钟就到了。早上凉快，我们一鼓作气爬到了北五楼，孩子们休息一会，最后爬到了北八楼。去的早，不是周末，人还不算太多，天气比较炎热。还好中午十一点我们就下来了。这个景点半天时间就差不多了，看了长城的雄伟，壮观。有一段有一些陡，最后到北八楼坡度有点大，带孩子去要注意安全。
   游玩满意，带孩子感受一下长城的雄伟。",/Date(1629590648000+0800)/,0,4.282,0,0,0,0,0,0,1,0,0
1860,4648443.0,不到长城非好汉呐，来北京当然要求长城看看哇。这一次选择的是八达岭长城，从市区去很方便，有专门的旅游大巴可以往返，这次自己一个带着娃去，坐大巴非常方便。我们选择索道上下，为什么呢？一是因为徒步的游客很多哇，带娃徒步有点寸步难行😂二是索道上去就是半山腰拉，可以不费力气领略长城的气魄和魅力哇。半山腰再往上爬，感受长城的陡峭👍另外，索道上下可以免费拍长城全景（2寸）哦，要放大的照片是需要另外付费的，拍得好看的话也是值得拥有啦,/Date(1628068300000+0800)/,0,4.286,0,0,0,1,0,0,0,0,0
1861,37996869.0,在山下忘记取探索包了，打电话给客服，北四楼也有，就在好汉坡那里，而且从缆车那里下去，从刚修的道走非常快的，保安说40分钟，他大概指的是走长城，实际很快。我们放弃先爬了长城外回来取，工作人员非常好，又给我们单独讲了一次长城的故事，很专业，对长城防御讲得很科学。孩子收获非常大。所以来长城，参加探索者，性价比物超所值，长城地区，册子，帽子等都非常精心制作。,/Date(1627916354000+0800)/,0,4.286,2,0,0,0,0,0,0,0,0
1862,60706318.0,今天天气不错凉快，安排的是早10点在崇文门地铁站集合，张雅彬导游负责，汽车乘车方便，行程安排妥当，可以车上买球幕和缆车的票，进场走团体票快速，张导在车上可以为我们介绍沿途的景区，及长城的攻略，行程结束后还介绍了吃的玩的地方，很开心的一天,/Date(1627296019000+0800)/,0,4.277,0,1,0,0,0,0,1,0,0
1863,82307411.0,1.首先从德胜门出发，有专门线路的公交车877路直达 车票挺便宜10元左右 2.一个多小时后到景区，需要自己走进去，首先就是吃饭的商业区3.上去建议坐缆车，自己走太累。总结：五一出游，全是人，建议坐缆车，比较累上面挺冷的。不过缆车的价格对于几百米而言还是性价比略低，上面景色没有想象中的雄伟壮阔，还是有点遗憾。景色来讲满分💯 我只能打个70吧，意义来讲各位就懂的都懂，心照不宣了！真可谓是上山1小时，山顶10分钟 哈哈哈哈,/Date(1627216603000+0800)/,0,4.286,0,0,0,2,1,1,0,0,0
1864,190419675.0,八达岭长城雄伟壮观，山色秀丽，来游玩的人特别多。北长城的人非常多，南长城的人略微少一些。地铁北土城站的赞巴士直达很方便。,/Date(1627110623000+0800)/,0,4.286,0,0,0,0,0,0,1,0,0
1865,97735095.0,俗话说，不到长城非好汉，其实，大部分人口中的长城都是八达岭长城。长城始建于秦朝，但是现在大家看到的，其实是明代的长城，在历史上抵御外敌起到了重要的作用。现在开放的段都是保存完好的，可以直接爬上去，很安全，也开通了缆车，给不方便爬长城的客人别的选择。,/Date(1626677442000+0800)/,0,4.265,0,0,0,0,0,0,0,0,0
1866,4447686.0,最好工作日去。或者一大早进去。人实在太多，无论在哪个位置拍照都有很多人。但是景色确实非常壮丽，尤其是赶上了好时候，空气很好，天特别蓝，绿树掩映青山壮阔，非常美。缆车大约是最不划算的，短短一段100元/人，还不如徒步下山，其实也没有多远的。,/Date(1625456340000+0800)/,0,4.284,0,0,0,1,0,0,0,0,0
1867,275952031.0,非常开心的一次旅行，带着两岁的宝宝，两个老人，随车导游一路细心的关照，没有推销，如果以后有机会还会选择赞巴士👍👍👍,/Date(1624167783000+0800)/,0,4.285,0,1,0,0,0,0,0,0,0
1868,57150907.0,不到长城非好汉，虽然这块碑已经搬到了居庸关长城，但八达岭长城还是中国人心目中的长城。做索道到7层，还要爬楼走一段45度的斜坡才能达到最高点。建议早去，市内7点半出发，不堵车，到了长城8：30左右，人已经变多，无法照出美美的照片。,/Date(1621946588000+0800)/,0,-9.311,0,0,0,0,0,0,0,0,0
1869,53449636.0,"踩点打卡，分南北两线，北八楼,南七楼，此次南北两条线都走了。北边上升高度400米+，坐滑车下来的，但感觉没 啥必要，趣味有限，下 来有一个熊乐园可以看游客喂8。重整旗鼓上南线，体力消耗相对小，南线.上下共计1个小时。长城门口有很多吃的，没必要带饭啥的，有免费存包景色不错，有趣好玩，",/Date(1621182261000+0800)/,0,-0.722,0,0,0,1,0,0,3,0,0
1870,183715207.0,赞巴士特别方便，直接到景区门口，还帮忙买好票，导游特别热心态度特别好，真是一次特别棒的北京之游，强推赞巴士，太方便了！！,/Date(1621143857000+0800)/,0,4.284,1,1,0,0,0,0,0,0,0
1871,12358520.0,赞巴士很方便，五一假期滚动发车，带家人旅游很方便，导游服务亲切，全程无购物。球幕值得看。再来长城，还选赞巴士！赞赞赞赞！,/Date(1620026008000+0800)/,0,4.286,1,1,0,0,0,0,0,0,0
1872,187406824.0,带着老母亲一块去的，非常方便。坐车到德胜门，877直达长城脚下。直接刷身份证，顺利通行。长城还是该去爬的，感叹下古人的伟大。总体超赞，景色不错，只能到北8，北12封了。得亏15年爬过一次了，不然真该有遗憾。,/Date(1618811479000+0800)/,0,4.282,0,0,0,1,0,0,0,0,0
1873,67232040.0,作为一个土生土长的北京人，最爱的季节就是人间四月天了，给原本色彩单调的都市增添了不少色彩，像是上帝打翻的调色盘，格外美丽。此次行程搭乘北京旅游集散中心大巴车，票价合理，乘坐舒适，匹配优质讲解，回味了一趟儿时的记忆。,/Date(1618803316000+0800)/,0,4.286,0,1,0,0,0,0,0,0,0
1874,26514940.0,可以去爬一段长城。和朋友两人去的，去的时候坐的高铁（清河站-八达岭长城站，19分钟），回去的时候没买到高铁票，做的919路公交，排队排了1小时，开了3小时😭。由于没有提前订票，早上票都没了，清明那天去的，所以只能买下午票。上下长城都是做的缆车🚠，来回一共4分钟，140大洋。上了长城爬了最高的一段路，好陡，不是全部是台阶，有的地段就是陡坡，赶脚有60度以上，瑟瑟发抖。基本只敢扶着栏杆走。然后下来，在平地上呆了一会，乘缆车🚡下去。全程一个半小时左右吧。,/Date(1617938193000+0800)/,0,-10.0,0,0,1,0,0,0,0,0,0
1875,3304531.0,时隔十几年再次来到八达岭，身边多了个娃。***胜门坐877，6元一站直达，最经济实惠！八达岭的风景是最好的！滑车坐上北四楼，完美避开最多人流，带娃会省心些。回程是在居庸关节点堵车约2小时，幸好交管部门及时疏通。,/Date(1617671113000+0800)/,0,4.285,0,0,0,1,0,0,0,0,0
1876,310367999.0,赞巴士非常棒，一站直达，没有购物跟强制消费，出门旅游还是不错的选择，导游态度好，车辆干净整洁，赞👍,/Date(1617166235000+0800)/,1,4.286,1,1,0,0,0,0,0,0,0
1877,262606907.0,年前去的长城，现在想来很是不错的！当天阳光明媚的，没有风，适合爬山。我们是坐都游巴士去的，之前坐过一次，体验很好，这次毫不犹豫就直接定了。我们没有坐缆车或者索道，个人觉得爬长城还是不建议坐索道上去，这样感觉失去了爬山的乐趣。门票我们是提前买好的，到了直接刷身份证就可以进，不用换票，总体来说还是非常不错的&amp;#128513;&amp;#128513;&amp;#128513;,/Date(1610348948000+0800)/,11,4.279,0,0,0,0,1,0,0,0,0
1878,262606896.0,八达岭长城，去北京必打卡的地方，毕竟都说不到长城非好汉，虽然是女生，也要做个女汉子呀&amp;#128514;做了攻略跟着都游巴士一起去的，非常方便，车上还有一个导游，讲解长城历史帮大家买票，特别会调节气氛哈哈哈。这次去八达岭基本上都走遍了，我们先从南长城开始的，为了找好汉碑，走到了南四楼，还遇到了长城上的猫猫，它们也不怕生。后来下了南四楼我们就开始爬北长城，北长城真的比南长城要陡，难爬很多，但是我们坚持到了北12楼，走到最后，一种豪气从心里而生，本来以为做不到的，但是我们做到了！,/Date(1610348198000+0800)/,12,4.286,0,2,0,0,0,0,0,0,0
1879,262606843.0,不到长城非好汉，来北京的第一站就是长城。我们是坐都游巴士去的，这个是一站直达八达岭长城的大巴车，十一月的天气已经很冷了，还好出了太阳。台阶比较陡峭，带着老人没走多远就下来了，站在烽火台上风很大，下来的时候感觉脚都在抖，而且感觉下山的时候还是蛮危险的，带老人和孩子来的一定要小心。对长城的气势磅礴惊叹不已，古代那么落后的条件下，他们却能修出那么壮观的长城！,/Date(1610344815000+0800)/,15,4.286,0,0,0,0,0,0,0,0,0
1880,262606876.0,又起了个大早，到健德门地铁站坐了一个多小时的都游巴士，到达八达岭长城。本打算坐9点那班车，奈何家里老人起的早，执意要7点就出发&amp;#128514;还好都游巴士车次多~我们带着老人选择了坐轨道上去，到了北4以后再爬到北8，越往上越陡，最后我们爬上北8楼，不到长城非好汉，有生之年我也做了回好汉！,/Date(1610343849000+0800)/,15,4.286,0,0,0,0,0,0,0,0,0
1881,262606743.0,终于来长城啦！离得这么近怎么能不来登长城呢，找了一个好天，和同学来登长城！交通是同学订的都游巴士，服务超级好，真不知道她是在哪找的这么一个宝藏大巴车！一定要多穿衣服，风超级大，吹得脸疼，疫情影响游客并不多，正好可以一步一个台阶慢慢爬。一路上走的比较悠闲，古人真的是太伟大了！,/Date(1610092890000+0800)/,17,4.268,1,0,0,0,0,0,0,0,0
1882,262606755.0,俗话说不到长城非好汉~我也是爬过长城的人儿啦  我是提前订的都游巴士  早上坐地铁到健德门  出站就上车啦    在车上还有一个导游  会介绍给大家几种爬长城的路线  因为想好好体验一番  我是自己爬的  感觉从头开始爬下来也没有那么累  建议大家可以体验一次呀  长城风很大很冷  去之前一定要做好保暖工作,/Date(1610090985000+0800)/,19,4.282,0,1,0,0,0,0,0,0,0
1883,262606716.0,放假实在没事干，我和同事早早的就去爬长城了。人们常说不到长城非好汉，我们也到长城转转。做了攻略提前预定了都游巴士的大巴车，网上评价挺高的，体验了一番果然不错。我们是疫情期间去的，人不是特别多，去的当天刮着小风，我们爬到一半就累了，吃了点零食修整了一番，就接着爬上去了，虽然有点累，但是这一天说说笑笑的，特别开心~,/Date(1610090531000+0800)/,20,-3.287,0,0,0,0,0,0,0,0,0
1884,262606653.0,有机会一定要来体验一下，不累而且风景很震撼，古人真的是太厉害了！大家可以坐&amp;#128663;都游巴士直通车来，价格不贵很实惠，而且是包来回的，门票缆车票也可以一起搞定。车上有一个导游跟着走，一路上介绍了沿途的风景和有关长城的要点，告诉大家如何选择怎么爬长城，大概需要多少时间，爬长城的难度还有路线等，非常详尽。❗注意！现在北京爬长城，一定是要有绿码的！如果是爱运动的年轻人可以直接爬上去，如果是带了老人孩子，建议买缆车上下，虽然价格不便宜，但是还是超值的,/Date(1610089638000+0800)/,21,4.286,0,1,0,2,3,0,0,0,0
1885,262603009.0,孩子幼儿园的时候讲到了长城，就一定要来看看。八达岭长城我以前来过了，人非常多，但是现在是淡季，又是冬天，想着人应该会少一点，就定了一日游来这里，果然没有什么人。网上做了攻略，自己来不方便，就定了都游巴士的直通车，上车睡觉下车就玩挺好的，也没有购物推荐啥的，比较成熟了，整个行程都很安逸,/Date(1609401476000+0800)/,12,4.286,0,0,0,0,0,0,1,0,0
1886,262603003.0,每年都要来八达岭长城走一走，有了时间立马就预定了都游巴士直通车，我每次来都坐这个，都认识他们的工作人员了哈哈哈   今年来的比较晚，12月初了，如果再早来两个月看秋景的效果会更好一些。现在看山的颜色已经变成灰的了，树叶也掉光了，还是有一点点小遗憾。明年争取不要再这么晚来了~不过每次来长城都感慨古人的伟大，能在如此崇山峻岭荒无人烟的地方建成如此伟大的建筑！,/Date(1609400960000+0800)/,12,4.166,1,0,0,0,0,0,0,0,1
1887,262603005.0,交通：我们提前做了攻略，在网上预定好了往返大巴，第二天一早坐地铁到健德门地铁站C口，坐上都游巴士直通车，就直接到八达岭长城了。进了长城就可以选择缆车还是步行，我本来是想坐缆车的，但是朋友坚持要靠自己爬上去！只能陪他们一起爬&amp;#128514;感觉要是没有朋友在，我可能爬到一半就不想爬了，太累了，唉，现在想想还好没留遗憾，竟然真的爬到了顶上！都说不打长城非好汉，我们真的做到了！爬到顶上的那一刻还是很激动的，但是！如果下次去，我一定要坐缆车！,/Date(1609400323000+0800)/,12,3.75,0,0,0,0,0,0,0,0,0
1888,262602979.0,非常真切的体验了一句话：不到长城非好汉！有机会来北京，爬爬长城真的是很有必要的一件事！这次有机会，终于在大寒冷的冬天里有机会尝到当“好汉”的滋味。淡季。人流量比之前应该是少了很多。但是一定要注意保暖啊！气温已经够低的了，长城上的风又特别大！感觉整个人都被风吹透了！&amp;#128652;交通：推荐首选【都游巴士】，每天发四班车，发车点就在健德门地铁站门口，东四也有车，很方便，出了地铁站就上车，我是查了攻略知道的这个直通车，体验了一次感觉非常不错。我们是坐的9点发车的那班。❤游玩：实在是太冷了，我们选择了坐缆车往返，下了缆车以后也没有怎么往上爬，因为还带了一个小朋友，实在是爬不动。但是对他来说已经足够了，这一天的时间玩的非常开心。回去一直喊着他也是爬过长城的人了！,/Date(1609392339000+0800)/,15,4.286,0,0,0,0,0,0,2,0,0
1889,262602951.0,第二次爬八达岭长城了，上一次还是16年，对于不能自驾的人来说，去一次很费劲，地铁转公交还要排大队。现在就方便多了，开通了都游巴士直通车，我是朋友介绍知道的，超级方便，价格便宜服务还好。这个季节不是旺季了，人不多，但是风很大，来玩的话一定要注意保暖！,/Date(1609387068000+0800)/,14,-9.902,1,0,1,0,1,0,1,0,0
