,uid,comment,date,like,sorce,#服务方面#cnt,#导游方面#cnt,#人流方面#cnt,#景色方面#cnt,#价格方面#cnt,#饮食方面#cnt,#娱乐方面#cnt,#儿童方面#cnt,#设施方面#cnt
0,458218715.0,"八达岭长城一日游省心游玩就找赞巴士|||话说“不到长城非好汉”。到了北京怎么能不爬长城呢？
我告诉你一个最最最便捷的爬城方法。首选出行交通——赞巴士直通车🚌
《出行时间》🏫有8/10点有两个班次
《集合地点》🚇8号线/10号线北土城站地铁C口。
从站口出来就看到穿着蓝色巴士达马甲的工作人员💃。🚌车内空间宽敞舒适，全程高速一站直达，避开拥堵，车上导游很热情💁，讲解长城的相关历史故事、游览线路及注意事项，给足大家4小时的游玩时间。游玩可以分2种：
①　完全步行  🚶步行上山是最辛苦的一种上山方式，徒步登城太累了。
②　缆车上下 🎢缆车往返票是140，直接能上到北七楼或者南六楼，直接上北八楼这里是必打卡点哦，做了一天的好汉好开心，好充实的一天，超赞👍",/Date(1673660879000+0800)/,8,4.286,1,2,0,0,0,0,3,0,0
1,395524898.0,巴士达超级棒，整个行程完全不用操心，一站式服务从巴士到买票到空中缆车全部由巴士达购票，导游讲解很到位告知怎么游长城景色最美，导游非常热情，来长城首选巴士达！,/Date(1674633038000+0800)/,38,4.286,1,3,0,1,0,0,0,0,0
2,34390112.0,"八达岭长城32
八达岭长城，位于北京市延庆区军都山关沟古道北口。是中国古代伟大的防御工程万里长城的重要组成部分，是明长城的一个隘口。八达岭长城为居庸关的重要前哨，古称“居庸之险不在关而在八达岭”。",/Date(1674562773000+0800)/,0,4.275,0,0,0,0,0,0,0,0,0
3,326673908.0,巴士达-八达岭长城专业接送服务，全程无任何购物，导游服务，讲解都很到位，司机开车很平稳，很耐心，导游热情负责，报名巴士达关注公众号，长城一日游，省时省力,/Date(1672816173000+0800)/,36,4.286,2,3,0,0,0,0,0,0,0
4,433502.0,完美的一天，巴士达工作人员细心热情，去成耐心给我们讲解长城的历史和登程路线注意事项等等，往返会多次确定人数后才出发，会推荐给朋友。,/Date(1675151351000+0800)/,35,4.286,1,1,0,0,0,0,0,0,0
5,34390112.0,"八达岭长城40
中国长城博物馆展示了长城产生和发展的基本脉络；长城的军事防御功能及体系；历史上发生在长城内外的重大战役；长城的建筑结构与布局；长城沿线地区经济开发与繁荣，文化艺术以及长城内外兄弟民族长期共同发展、相互交融的史实；展示解放后长城作为中华民族的象征、世界文化遗产所受到的世界人民的保护以及长城在新中国外交史和旅游事业中的重要作用。",/Date(1675260124000+0800)/,4,4.286,0,0,0,0,0,0,0,0,1
6,34390112.0,"八达岭长城48
北京市郊铁路S2线，简称城铁S2线，该线路是由北京市昌平区黄土店站始发，途经南口站、八达岭站、康庄站、延庆站，终点为河北省张家口市怀来县的沙城站。中国第一条干线铁路——京张铁路就位于S2线上，并在此设立车站（青龙桥站，可惜中间不能下车）；在旅程中，沿途可以看到居庸关长城，感受到百年京张铁路中的人字型铁路（列车先越过八达岭，再在青龙桥站返回八达岭），回程时在青龙桥车站还可遥望到詹天佑的墓和塑像。",/Date(1675955258000+0800)/,3,4.285,0,0,0,0,0,0,0,0,0
7,350768058.0,"下次有谁要来北京玩，问我有啥推荐的地方，我一定说长城。
尤其是从南线走到北线，有种心灵净化的感觉，就是什么杂念都没有了，就很通透，天地间仿佛就剩下你跟长城，尤其是最后坐缆车下山，风一刮，这种感觉达到了到巅峰…就很赞👍🏻",/Date(1680299226000+0800)/,0,4.286,0,0,0,0,0,0,1,0,0
8,194930876.0,三月中旬去的，天气非常好，景色宜人 ，从小就听说过不到长城非好汉 。今天还没去就信心满满 必须要登顶，在路上旅游大姐说最好攀爬北长城 那里景色很好，有八个烽火台。其中第三个到第四个是最陡峭的。攀爬时候被他的雄伟壮观所吸引真的很美。想到这是2000年前的杰作真的很佩服。一个个砖块累积起来的，上到80多岁下到嘤嘤待哺的婴儿，都在路上攀爬。登山远眺真的很舒服,/Date(1680166489000+0800)/,0,4.286,0,0,0,2,0,0,0,0,0
9,34390112.0,"八达岭长城16
【交通】从积水潭地铁B口出来，会有指示标志，跟着箭头走到877公交总站即可。真正的877是可以刷公交卡的，刷公交卡6元，现金12元。来之前一定要确认自己公交卡内是否够往返车费，长城那边没有充值亭，还好手机支付也可以（易通行不行的）要不然就要给12元现金啦。如果交现金，最好备好零钱，有的可能不找零。
如果不堵车的情况下，一个多小时就能到达八达岭。
回程能早尽量早，877班车是5点就是末班车了，如果你赶5点最后一班的话，那站着回来的可能性就大了，再加上路上堵车，那就无望了。一点半就可以选择回来了。回程的877在【前山熊乐园停车场】",/Date(1672932154000+0800)/,2,-10.0,0,0,0,0,0,0,0,0,0
10,34390112.0,"八达岭长城52
其他乘车建议&amp;疑问
1如果是在高峰期搭乘火车的话，建议一定要早点去；如果不能早去，那就得以百米冲刺的速度抢占座位。因为S2火车并不是对号入座，坐过地铁吧，没做过地铁做过公交吧，抢座吧少年！
2心墙裂建议早点去。我们搭乘的最早一趟车，火车不用排队、景区不用安检、长城不会拥挤~当然最好还是有一群狼一样的队友比较好。",/Date(1676286484000+0800)/,1,4.285,0,0,1,0,0,0,0,0,0
11,384489044.0,来北京玩也有十几次了吧。这还是第一次去八达岭长城。从北一楼到北八楼徒步爬，来回一共用了两个来小时。到北八楼好汉坡那一刻还是很开心的。但累也是真的累。,/Date(1677403906000+0800)/,1,3.828,0,0,0,0,0,0,1,0,0
12,73697417.0,3月的长城上冷得让人头疼，在山脚很明智的买了顶帽子。带着老妈还是往返缆车，既可观光还省力。第二次来，景还是那个景，人也不算多。其实到哪儿去不重要，重要的是和谁去。。。,/Date(1679698941000+0800)/,0,4.272,0,0,0,0,0,0,0,0,0
13,242334209.0,长城是中国的奇迹、世界的奇迹，只是去了一次感觉意犹未尽呢，尤其夜长城没能赶上，再加上人实在太多。以后一定要再去一次，长城脚下的农家小院住宿吃饭都很实惠，停车也方便。,/Date(1678966946000+0800)/,0,4.283,0,0,0,0,0,0,0,0,0
14,559089.0,"来的比较晚，从停车场坐交通车到登山入口，交通车上对路线的讲解很不错。时间关系，只到了北十二楼就返回了。
第一次来，挺震撼的。",/Date(1678006238000+0800)/,2,4.25,0,1,0,0,0,0,0,0,0
15,3588993.0,"八达岭长城号称天下九塞之一，风光集巍峨险峻、秀丽苍翠于一体，是明长城景色中的精华。“不到长城非好汉”，很多国人都以这里为登临长城的主要选择。
八达岭长城关城为东窄西宽的梯形，有东西二门。东门额题“居庸外镇”，西门额题“北门锁钥”。关城向北延伸的长城是北长城，有敌楼12处。关城以南是南长城，有敌楼7处。南长城相比北长城的游客人数较少，如果时间充裕，可以先去走南长城，再走北长城。
最佳观赏位置
除了在关城可以登长城外，在南4楼、北4楼、北8楼和北11楼也有登城口，都能登上长城。
其中北8楼是八达岭长城海拔最高的敌楼，又名“观日台”。这里距离关城有1500多米，是俯瞰长城的绝佳地点。
乘坐索道
在南4楼和北8楼处，还建有索道。不想步行的游客，可以乘坐索道直接抵达敌楼，游玩结束再乘坐索道返回。可节省体力，轻松游玩。
周边餐饮
八达岭长城景区设有商业步行街，爬长城累了，下山后可以在此休息进餐。除了高端大气的八达岭饭店（涉外饭店），还有炸酱面、狗不理、饺子馆等老北京风味的餐馆和赛百味、永和豆浆等快餐，可按需选择。吃饱喝足，如果还有精力，不妨逛逛旁边的詹天佑纪念馆、中国长城博物馆。",/Date(1661907134000+0800)/,6,4.286,0,0,0,2,0,1,2,0,0
16,50463782.0,"早上从北京北站坐高铁去爬的，爬到南四楼又返回爬到北四楼。挺累的，吹大风也很冷。
南四楼的风景真的不错，人也少。一路上都有好汉碑可以拍照留念。有学生票，很便宜。",/Date(1674306676000+0800)/,0,3.657,0,0,0,1,0,0,0,0,0
17,60199471.0,一定要坐高铁去，从北京北出发，非常舒服，半小时能到。出站后步行一刻钟就能进入景区，带着老人小孩爬不动，2个小时足够，坐中午返回北京的动车，刚好赶上午餐。,/Date(1680273109000+0800)/,0,3.973,0,0,0,0,0,0,0,1,0
18,98439445.0,万里长城，真的是很壮观，可惜有些地方被损坏了，墙体需要长期修缮，希望大家参观的时候也要保护历史古迹，为能够保存的更悠久，为后人留下可记录的历史文化。,/Date(1677391579000+0800)/,0,4.283,0,0,0,0,0,0,0,0,0
19,394020210.0,不到长城非好汉，到了才知壮观,/Date(1675271088000+0800)/,0,3.711,0,0,0,0,0,0,0,0,0
20,81085938.0,如果可以的话还是建议大家爬长城，坐电梯上去不是必选项，景观就不用多说了，只有身临其境才能感受到长城的雄伟壮观，俗话说的好，不到长城非好汉嘛！,/Date(1674893639000+0800)/,0,2.982,0,0,0,0,0,0,0,0,0
21,328265878.0,南七楼来回一个半小时，往北十二楼爬完后从熊乐园下来花了两个半小时。在北十一楼之前是登长城，之后是才是正经的爬长城。总结下经验，往上爬顺着上，两腿呈直线比较省力，埋头苦爬就是了；往下爬倒着下，扶着栏杆倒，脚尖不累，腿也不会抖，安全且快。,/Date(1667660212000+0800)/,3,-10.0,0,0,0,0,0,0,0,0,0
22,180715161.0,值！！！感受八达岭长城的雄伟壮观，放眼望去感受春风拂面，红包遍山，内心油生中华民族伟大复兴朝我们招唤……，八达岭长城，我来啦！！！,/Date(1679210650000+0800)/,0,4.285,0,0,0,0,0,0,0,0,0
23,260678587.0,网上搜去八达岭的攻略，偶然看到了赞巴士，觉得不用去公交站人挤人，不用担心当天没有火车，挺棒的。来了之后体验确实不错，导游很奈斯，行程很合理，4个小时足够了，下次来还用他,/Date(1678521407000+0800)/,0,4.285,0,1,0,0,0,0,0,0,0
24,370269302.0,得到家人的一致认可，太有成就感了，下次继续来！,/Date(1675334412000+0800)/,0,3.986,0,0,0,0,0,0,0,0,0
25,262046610.0,那天看到现场排长龙购票，好在之前已经订好门票，直接其他身份证进入。非常方便。最近天气很好，三月四月山桃花盛开，别有一番韵味。,/Date(1680344278000+0800)/,0,4.132,0,0,0,0,1,0,0,0,0
26,289537567.0,"适合春日出游和阳康恢复训练，巴士达直接拉到长城脚下就能爬，非常方便。
长城博物馆还没有开放，长城下的纪念品越往山脚下走越便宜。",/Date(1677310915000+0800)/,0,4.257,0,0,0,0,0,0,0,0,0
27,387277358.0,不用做滑车，北边上到8个烽火台，俩老人带一小，3小时轻松搞定，建议不要听877路里工作人员的劝说买滑道票，时间足够用，不用担心，毕竟几个人能省好几大百，土豪随意,/Date(1679925091000+0800)/,0,4.279,1,0,0,0,0,0,0,0,0
28,186722800.0,跟女友一起去的，这是我第四次来八达岭长城了，现在正好春天了花都开了，不过赶上了周末人特别多，尤其是在坡度大的地方人一多很容易摔下去，还有长城有的洞特别窄只能一个人通过，所以好多地方都出现了堵死的现象，没个五分钟过不去。,/Date(1679451517000+0800)/,0,3.078,0,0,0,0,0,0,0,0,0
29,74851624.0,"坐动车去八达岭长城是最快最便捷的交通方式，每天都有十多趟往返北京到八达岭长城的动车，票价20（清河站）和北京北站25元两种，具体车次可以在各种携程，同程，12306等APP上查。
       八达岭长城景区，还可以免费寄存行李到下午16：30分钟。
    南城和北城总共游览时间大概4小时左右。最好上午去南城，照相效果好，下午就逆光了。南城7个楼，游览时间大概1个小时，北城主景点有8个楼，有时间，还可以往别处走走，我是原路返回的",/Date(1677460232000+0800)/,2,4.285,0,0,0,0,0,0,0,0,0
30,84530955.0,不到长城非好汉，到了北京必须看一看，因为在郊区所以长城选择的是一日游，导购非常认真负责，也讲解的很耐心，这一日游的体验感非常不错，长城的风景很美，那天天气也好，除了风大冻脸，其他没毛病，另外就是要吐槽一下缆车，车型第一次见到很独特，收费来回140，但是单程最多就一分钟，感觉如果有时间的，或者没有抱孩子的，就不要座缆车，直接爬就好了也不会太高太累！,/Date(1675144960000+0800)/,0,4.286,0,1,0,1,0,0,0,0,0
31,153502320.0,不到长城非好汉。八达岭长城还是值得一去，不然就只有在教材和网上了解长城了。我去的时候是1月份，属于淡季。我觉得淡季有淡季的好处，比如说人很少，可以自由自在的参观，而不是跟着人流窜动。八达岭长城其实很长，很可惜南段长城和北段长城都两端都有封闭不开放的路段。整个八达岭长城开放路段走完的话估摸1个半小时左右。,/Date(1675125414000+0800)/,0,4.286,0,0,0,0,0,0,0,0,0
32,48796045.0,第二次带妈妈和孩子登长城，虽然这次是坐缆车的，仍然觉得它很雄伟壮观，惊叹古人的智慧，要不是他们哪来现在的我们一次次的攀登,/Date(1674877683000+0800)/,0,4.286,0,0,0,0,0,0,0,0,0
33,157268805.0,外地车辆是可以自驾八达岭的，完全没有压力，没有问题。人少的话可以省时间，人多的话还是挺省钱的。要是做那种公共交通的话，得先去大前门或者北京北三环，光这个都用掉很多时间。当然来北京本来就没开车，那就不说了。,/Date(1674874701000+0800)/,0,-9.282,0,0,1,0,0,0,0,0,1
34,492191024.0,司机技术好，车辆干净，导游热情只买车票也会给讲解，还会提供旅行建议。#巴士达,/Date(1677994022000+0800)/,2,4.06,0,2,0,0,0,0,0,0,0
35,269348599.0,景美，服务美。山险路陡，还会再来！！,/Date(1674718097000+0800)/,0,4.192,1,0,0,0,0,0,0,0,0
36,29150235.0,到德胜门坐的877到八达岭，刷支付宝单趟六块钱。别听车上导游忽悠坐滑道和缆车，如果平常有锻炼，年龄不大的话爬个南北线没有问题。北线现在到第八楼就封住了，转头返回一共用了一个半小时，提供给大家参考。,/Date(1673763303000+0800)/,2,-9.998,0,1,0,0,0,0,0,0,0
37,113192168.0,选择巴士达游长城，方便、快捷，全程无购物，导游小姐姐人特别好。长城雄伟壮观，中华文化之瑰宝。球幕影院晕车人士慎看。,/Date(1679723743000+0800)/,0,4.198,0,1,0,0,0,0,0,0,0
38,485516271.0,山龙**，华夏子孙览瑰宝，沁园春雪唯此处可尽诵尽叹，山舞银蛇。。。原弛蜡象。。。惜秦。。。。,/Date(1677854435000+0800)/,1,4.246,0,0,0,0,0,0,0,0,0
39,262046610.0,今天2023年3月27日 天气不错。八达岭长城视野开阔、全程清晰展现。满山的山桃花要开了。是春天特有的风光。,/Date(1679912734000+0800)/,0,4.286,0,0,0,1,0,0,0,0,0
40,221119861.0,初五跟着杨丽导游逛八达岭 十三陵一日游真是太棒啦  谢谢杨导认真负责的讲解和带队 一路收获美景和知识 杨导更是讲得绘声绘色 引经据典 团里的大家伙都听的入神了 和杨导的缘分也是绝了 在此也做个小提醒 大家需要早晨接的要注意订单选项不同 我之前没注意 先预定了目的地自发集合 之后杨导就很快联系我了 和我说了订单选项不同 我感觉下错了就赶紧退订了 第二次订可以接的 结果负责的还是杨导 她认真跟我说了接和不接的区别 让我不要纠结 根据自己需要选择 最后定了还是要接 杨导很快就安排了 工作高效负责 当时都晚上十一点多了 真的很辛苦也很尽责 第二天早晨七点就安排乘车了 见面后杨导热情接待安排 最重要的是一路上杨导的导游词都太棒啦 什么都介绍的清清楚楚 讲的生动有趣 了解了很多以前不知道的历史知识 从八达岭到十三陵 因为杨导带队少了很多后顾之忧 特别是今年带着妈妈逛北京 她一路跟着都很满意 说我报一日游这个决定做对了 一路上更是对杨导连连称赞 说有能力 讲得好 妈妈平常内向不多说 这次旅程结束的时候 自发为杨导鼓掌 说辛苦啦 还一定要我认真评论夸夸杨导 所以这一天真的是很满意 大家来北京的可以考虑,/Date(1674721588000+0800)/,1,4.286,0,3,0,1,0,0,1,0,0
41,159797221.0,坐空中缆车到北7，爬到北12，再回北1，爬南4，坐地面缆车，旅程结束，用时2➕小时游完长城，刚刚好,/Date(1679890306000+0800)/,0,4.137,0,0,0,0,0,0,0,0,0
42,60567171.0,期待好久的景点终于如愿以偿，用身份证检票很方便。景区设施齐全，环境干净整洁。车放在了停车场乘坐景区免费摆渡车到的索道口，很方便。车上的导游耐心的介绍登城方式和等车地点，很贴心。,/Date(1677041101000+0800)/,0,4.286,0,1,0,1,0,0,0,0,1
43,211190411.0,有了高铁，去长城看雪真的很方便。早上7点出发，下午4点的到家。雪后早到长城的最大好处是，看见别人一个个摔倒，自己也不例外的开心。,/Date(1677030132000+0800)/,0,3.141,0,0,0,0,0,0,0,0,0
44,682637.0,零下十几度，太冷了，帽子手套一定要戴好，坐缆车上山很方便，下来就是好汉坡，人很多风很大，爬了一段就撤了，放眼望去长城上人山人海。,/Date(1674601200000+0800)/,0,3.164,0,0,1,0,0,0,0,0,0
45,205306130.0,巴士达服务好，导游很热情负责！没有强制消费，自费自愿，非常点赞👍。值得向亲友推荐！,/Date(1679907263000+0800)/,0,4.275,1,1,0,0,0,0,0,0,0
46,167323595.0,巴士达车干净，直达八达岭，省时省力，下次还来，五星好评。棒棒哒,/Date(1676267701000+0800)/,5,4.172,0,0,0,0,0,0,0,0,0
47,30676857.0,还行吧，就是景区感觉管理的很混乱，人家的景区都是刷马直接进的，他们还要身份证，而且没身份证的还要人工换票，各种混乱，插队都没人管，哪怕你提供点自助服务我都不想发火,/Date(1674740690000+0800)/,0,-10.0,2,0,1,0,0,0,0,0,0
48,451970072.0,做了大量的攻略后，还是选择报个一日游去长城，自己去的话交通太不方便了，挑挑选选选了一家叫北斗国旅的，一天下来真的很开心，从来都懒得写评论的，但是他们安排的实在是太好了，而且也很便宜，早上在地铁站集合就能看到导游穿着紫色小马甲站在那，根本没有找不到一说，北京本地的，说话口音也听着挺好玩。上了大巴也很干净，我说我晕车导游姐姐也好心的让我坐第一排，还时不时问我要不要喝水啥的，本来都困得我想睡觉，结果导游在车上讲故事给我听精神了，我才知道坐车路过的大楼里都是坐着随时都能在电视上看到的国家领导人，这感觉太神奇了，大概一个半小时到了，下车巨冷，吹的我，直接跟着导游进去，都给买好票了，能坐缆车或者自己爬上去，买缆车就跟导游买就行了，我以为不买会摆脸色呢，没想到人家就是问一下，统计完就去给买缆车票了，我本来就是打算自己爬的，我没买哈哈哈哈哈，不过我还是建议恐高或者腿脚不方便的坐缆车吧，那台阶还挺陡的，而且巨长，真的很累，但是那上面的风景是真的好，都给我爬的满身汗，我爬到7号敌楼就真的不行了，而且再往上就太陡了，不敢爬了，风景是真的好，后面还去了鸟巢和水立方，总之真的是很值的一天！,/Date(1679997271000+0800)/,0,-0.851,0,5,0,2,0,1,1,0,0
49,331723697.0,不错不错不错👏🏻👏🏻👏🏻👏🏻👏🏻👏🏻👏🏻👏🏻👏🏻👏🏻👏🏻👏🏻👏🏻👏🏻👏🏻👏🏻👏🏻👏🏻👏🏻👏🏻👏🏻👏🏻👋🏼👏🏻👏🏻👋🏼👏🏻👏🏻👏🏻,/Date(1679846072000+0800)/,0,4.204,0,0,0,0,0,0,0,0,0
50,261839066.0,非常值得一去👏🏻👏🏻👏🏻👏🏻👏🏻👏🏻👏🏻👏🏻👏🏻👏🏻👏🏻👋🏼👋🏼👏🏻👏🏻👏🏻👏🏻👏🏻👏🏻👏🏻👏🏻👏🏻👏🏻👏🏻👏🏻👏🏻👏🏻👏🏻👏🏻,/Date(1679234567000+0800)/,0,0.573,0,0,0,0,0,0,0,0,0
51,13374944.0,八达岭长城一日游，巴士达旅行服务周到，热情，导游很好！车辆干净，下次还会跟团。,/Date(1679722973000+0800)/,0,4.285,1,1,0,0,0,0,0,0,0
52,6736138.0,翻翻旧疫情前的手机照片，回看那年北京之行，万里长城是我国古代的一项壮举 ，不到长城非好汉，我也当了一回好汉。也感慨我国前人的伟大，,/Date(1676250168000+0800)/,1,4.286,0,0,0,0,0,0,0,0,0
53,486550639.0,南四楼有不到长城非好汉的好汉碑过了南四楼就可以做索道，北四楼有好汉石，北四楼可以做滑道下去或者爬到北六楼下去到北七楼做索道，我建议再爬到北八楼最高点打卡下来做缆车走,/Date(1677078716000+0800)/,1,3.826,0,0,0,0,0,0,0,0,0
54,3673254.0,虎年的年29，后天就是兔年初一了，过年和疫情刚开放的关系，人很少，不过就是太冷，北楼索道不开放，只能做地面缆车到南四楼，有好汉碑，也还不错。下次来，春秋天来，山景色彩绚丽，应该会更好。,/Date(1674209418000+0800)/,0,4.281,0,0,0,1,0,0,0,0,0
55,4572617.0,八达岭长城宏伟壮观，在这里我们可以近距离触摸到长城基座。基座材料取自当地花岗岩杂岩体，经手工加工成条石，筑就了长城基座。中国古人就地取材，更是早就了享誉全球的世界文化遗产—八达岭长城。,/Date(1673442487000+0800)/,0,4.257,0,0,0,0,0,0,0,0,0
56,325790766.0,雄伟壮丽，不到长城非好汉，全程徒步亲身体验感受这座伟大的古建筑,/Date(1677065430000+0800)/,0,3.668,0,0,0,0,0,0,0,0,1
57,16705528.0,八达岭长城是整个长城中修筑的最好，最典型也是最坚固的地段。所以他的知名度是最高的。八达岭长城，就取“四通八达”之意，交通是 非常方便的。公交车，火车，市郊铁路，旅游专线巴士均可以到达。,/Date(1676198515000+0800)/,0,4.28,0,0,0,0,0,0,0,0,0
58,408419202.0,不到长城非好汉 雄伟壮观 索道上山每人100自愿 下山40自愿 我是索道上山滑轮车下山每人80 切记滑轮车是下到长城后山 八达岭公交车站点进北京市内的 我又走了1.9公里到前山坐景点返程车😒,/Date(1675514520000+0800)/,0,4.283,0,0,0,0,0,0,0,0,0
59,85499348.0,爬长城是绝对的体力事儿，景区很好，天气很好，游客很多。这次是徒步，没坐索道。,/Date(1679213426000+0800)/,1,1.078,0,0,0,0,0,0,0,0,0
60,270960763.0,八达岭长城是北京长城文化带里面最有名气的，也是规模最大的一个长城。相对来讲八达岭长城的攀爬难度比较小，适合大家去攀爬，我建议大家有机会去八达岭长城感受下长城文化带的魅力，推荐。,/Date(1674908623000+0800)/,0,4.286,0,0,0,0,0,0,0,0,0
61,270514261.0,八达岭长城，位于北京市延庆区军都山关沟古道北口，中国古代伟大的防御工程万里长城的重要组成部分，明长城的一个隘口。八达岭长城为居庸关的重要前哨，古称“居庸之险不在关而在八达岭”。,/Date(1673582108000+0800)/,0,4.221,0,0,0,0,0,0,0,0,0
62,49787133.0,心血来潮带孩子去爬长城，周四人不是很多再过一阵风景应该更好。交通也方便，有免费的摆渡车就是下午五点就停了，如果可以时间再长点就好啦。,/Date(1678090981000+0800)/,0,4.072,0,0,0,1,0,0,0,0,0
63,108978317.0,就还挺好的，人也不算多～天气很好，不是很冷，坐缆车很方便❤️总的来说是一次不错的旅行还行喜欢的，返程一定到鸟巢水立方下车，不然太堵了,/Date(1676992321000+0800)/,0,4.22,0,0,0,0,0,0,0,0,0
64,40732499.0,赞一下北京的交通便民，直通大巴到景点6元，景点玩法多样选择比较透明，游玩的体验不错，到了长城体验古人的耐力与坚决，让自己也加加油,/Date(1677987731000+0800)/,0,4.285,0,0,0,0,0,0,2,0,0
65,201800587.0,感觉非常震撼，很难想象古人的智慧，建造如此宏伟庞大的万里长城，不到长城非好汉，这次时间紧迫所以用了索道，下次试试徒步走完全程。,/Date(1677921879000+0800)/,0,4.285,0,0,0,0,0,0,0,0,0
66,193761689.0,景色很美丽，交通也方便，人也不少。雄关不独北国有。千百年来，祖辈先民构筑了数不清的城防设施和军事要塞，以之抵御入侵，保境安民。,/Date(1677195193000+0800)/,0,4.285,0,0,0,1,0,0,0,0,1
