,uid,comment,date,like,sorce,#服务方面#cnt,#导游方面#cnt,#人流方面#cnt,#景色方面#cnt,#价格方面#cnt,#饮食方面#cnt,#娱乐方面#cnt,#儿童方面#cnt,#设施方面#cnt
811,31970241.0,"请大家一起跟着我解锁🔓八达岭的交通问题！

在北京爬长城，☝️首先需要解决的就是交通的问题了，其实对于爬长城这件事儿，只要解决了交通，其他的就不是什么问题，而且随着时代的改变，以前那种起早贪黑🥱的跟团旅游已经是过去时了，自助游或者半自助游才是咱们真正需要的。💪八达岭长城交通：（按推荐指数排名）1，🌟🌟🌟🌟🌟乘坐👍 赞 巴 士🚎景区直通车：北京这两年刚刚兴起的交通方式，北土城C口发车，7:30-8:00/9:30-10:00两个班次，价格不贵80/人，3岁以下的孩子免费，在景区留给大家的游览时间4个小时，也足够了，车上配备一名导游，可以给大家讲解长城历史，车上快速购票等等，一站直达，不费脑子😌，性价比高，回程经停鸟巢，属于自助游，没有传统跟团游的那种进商店的套路。但是需要提前预订📱💻，不能跟公交车似的去了就坐。
2，🌟🌟🌟🌟自驾🚗+高德导航🧭，很自由，时间自己掌握，回程还可以去八达岭奥莱转转🛒🍔，如果赶上旅游旺季，一脚油门一脚刹车也是够烦的。
3，🌟🌟🌟S2小火车🚄，黄土店火车——八达岭站，坐火车是比较快的🚀，火车不堵车，但是他这个火车，怎么说呢。。。不太稳定，📣建议去之前先查一查有木有班次，先要从你住的地方，坐地铁🚇，到霍营，然后出地铁站，去黄土店，火车站上火车。这个火车可以刷一卡通💳，去之前一定要再查查列车表。5，	🌟🌟大巴🚌：德胜门大巴站——八达岭站，大巴有两个都是从德胜门上车的，919和877，建议坐877，走高速中间不停车，比较快，919太慢了🐌

📣📣📣觉得有帮助的给点个赞👍呗😊🙏",/Date(1621323350000+0800)/,164,4.285,0,2,0,0,1,0,0,0,0
812,205975363.0,"很多人在纠结八达岭和慕田峪应该去哪个，看到网上五花八门的解说，在这里谈一下个人观点，本着实事求是的原则，希望可以帮助到正在纠结的你。我是当地人，两段长城都去过很多次，有时候是带着家人爬长城玩，有时候去周边住两晚，换换心情，这两段长城各有千秋，无法简单的评论哪个更好。距离：两段长城都距市区（天安门广场为）大概70公里，八达岭位于北部偏西，慕田峪位于北部偏东，正常乘车时间大概在1.5-2小时人数：有人说慕田峪人少，八达岭人多，这个说法对，但是不准确首先，八达岭之前那种游客大喊“我要回家”却转不了身的场面已经没有了，现在限流，和故宫一样，就是为了能让大家能够玩好。其次，非五一，十一，这种旅游旺季，八达岭的人数确实比慕田峪多，因为他出名，当年毛主席的六盘山一诗中的“不到长城非好汉”就是说的八达岭，“好汉碑”也在此，更是接待国无数国外元首的一段长城。但到了旺季，要我说，哪段长城人都多，八达岭的入口多，可以分散人流，慕田峪只有2个入口，排出大几百米的队很正常，如果旺季来游览长城，不要考虑哪个人少，唯一可以避开高峰的办法就是错峰出行，要么早起，要么中午再去景色：站在两段长城的最高点，你都可以看到长城像巨龙一样在山间盘旋。其实爬长城我认为爬的是情怀，景色好点就是树多点，所谓的景色不好就是山多，树少，又有谁爬长城是为了看树呢？看树的话去香山或者植物园，那里的花花草草更好看交通：八达岭有直通的公交877和S2小火车，慕田峪没有公交直达，要坐到市区然后打车到景区，现在有景区直通车，可以解决这个问题，景区直通车就是贵一点的公交车，80元每人往返，3岁以下免费，要预约上车，都有座，车上配有导游给大家讲长城历史，帮助大家做攻略，在线买票，现在直通车品牌不少，质量上参差不齐，个人觉得👍“赞 巴 士”🚎这个品牌的性价比最高，选他家的原因是他家的发车点离高速很近，最大程度上节省了市区拥堵，无任何隐性消费和套路，在景区给留的时间足够，导游素质也高，还有小礼物赠送，有需要的朋友可以尝试。综上所述，我认为大家不要去纠结于哪段长城人的多少了，多的时候都多，少的时候也多不到哪去，给大家打个比方，你想吃火锅，奔着“海底捞”（八达岭）去的，你等位的时间会超过1小时，但还是愿意等，如果你不是非它不可，边上也有类似的火锅店（慕田峪），不用等位，那么你就会去不用等位的这家，毕竟吃饱了就行了。懂了？",/Date(1620984876000+0800)/,92,4.286,0,3,1,4,0,0,2,0,0
813,205968846.0,"清明小长假，跟随🚎赞巴士👍一起去八达岭踏青喽！
来北京必去长城，其中名气最大的，必然是八达岭长城，毕竟那是咱毛爷爷亲自带货的长城，没有不去的道理。
去长城的交通问题，可能是大家最关心的了，实测后，负责任的告诉大家，选择👍赞巴士景区直通车是性价比最高+最省心的！
查了一下，目前北京去长城的直通车有很多家，基本都大同小异，该有的都有，该优惠的都优惠，没有太大的区别，其实选择来选择去，无非就是首要解决交通，至于其他的衍生品，我个人觉得其实无所谓，自由行的意义就是自由，不被洗脑，不被安排是最重要的。
选择🚎赞巴士👍的原因是他家的发车点选择的非常好，周边地铁公交很多，上车后真的是10分钟上高速，假期出游最怕的就是堵车，这点赞巴士确实很有优势
车上的导游也很友善，他们不把自己叫导游，叫“小赞同学”车上就能帮没有预定门票的同志们把票的事情处理好，下了车直接进景区，不浪费一点时间。
赞巴士还给大家准备了登山包，做的还不错，不是那种十块八块的一次性的，反正我装了4瓶矿泉水，还有点别的东西一点压力也没有，这个登山包带回家平时买个菜，去个超市还是很好用的，据景区的工作人员介绍，他家动不动就送一些礼品给客人，说是取之于民，用之于民，算是业界良心了。
您问怎么爬长城？还能怎么爬，坐缆车上去，然后就靠父母给的双腿呗，其实爬长城无非就是参与一下，你到了最高点，好汉坡，吟几首诗，拍拍照片，发发朋友圈。
本人亲测，👍赞巴士给的4小时的游玩时间足够，可以把长城玩个痛快。",/Date(1617774236000+0800)/,188,4.286,1,2,0,0,3,0,2,0,0
814,63065815.0,"来北京当然故宫，长城必不可少了，切记故宫一定要避开周一，并且要提前预定门票，现场过去可是进步去的呢，交通很方便的，地铁到前门或者天安门东西下都可以的，但是需要走一点路。
去长城呢，路途有点远，自己去确实不方便，跟团吧，又会有各种不放心，推荐大家坐赞巴士，去慕田峪在地铁5号线的和平西桥站B出口集合上车，八达岭集合点在地铁10/8号线的北土城站C口，每条路线每天分别有2班车，早班车8点出发，中班车10点出发，可以各个网站提前一天预订，这种新兴的巴士自由行，很适合当下旅游，只是含交通和门票，景区都是自己玩，没有导游束缚，市区往返交通也搞定了，不用担心黑车当道，也不用担心给你拉去购物店。",/Date(1617772093000+0800)/,35,4.286,0,1,0,0,2,0,1,0,0
815,262595092.0,交通：现在交通比以前方便多了，有了都游巴士直通车，到健德门地铁站上车就可以，一个多小时就到八达岭了，车上还有个导游，会在车上讲解一些重要景点和注意事项，挺贴心的。大概有4个小时的游玩时间，足够玩了。推荐理由：没有什么额外的理由，不到长城非好汉，这一条就足够了。八达岭又是所有长城中最经典的代表，所以来这里准没错。tips：风真的很大，冬天去的朋友们一定要做好防护措施，尽量都带个手套，有些地方还是很陡的，需要扶着铁栏杆，零下的温度不带手套真的扛不住。到景区再买也可以，但是质量一般，价格也不便宜。,/Date(1609124739000+0800)/,139,4.286,0,2,0,0,1,0,2,0,0
816,268831957.0,"八达岭长城上特别冷，而且基本风都挺大的。   所以一定记得多穿衣服保暖。最好带个手套、带个帽子

去八达岭前一天注意休息好，因为爬长城一天会很累

因为八达岭景区早上9点才开门，所以不用太着急去。类似巴士达Busda这种直通车，现在都是早上八点一班，早上十点一班，像我这种比较懒的，就坐早上十点那班，不用着急，而且那会也不是特别冷了。一小时到景区，然后玩4个小时，下午四点左右就回来了。一天不用特别赶，回来之后在鸟巢附近吃个饭，晚上看看夜景。

游玩路线南楼有八楼，最现在只开放最远到南4，北楼12楼，最高只开放到北8。上面有滑车和缆车。也可以步行。",/Date(1608601737000+0800)/,365,-9.805,0,0,0,1,0,0,2,0,0
817,17500000.0,不是很必要，有孩子的可以考虑购买，缆车就5分钟左右，下来需要做还得提前安排时间，春节排队人超级多，可以选择爬，缆车上下,/Date(1674746981000+0800)/,0,2.544,0,0,1,0,0,0,0,0,0
818,218602499.0,北京工作之余和舍友一起去八达岭长城逛逛，体验一下长城的伟岸景色，真不错。出行我直接选的巴士达，旅游导游服务还是不错的，坐车的感觉也很好，下次有机会会再次选择的,/Date(1658640144000+0800)/,184,4.286,1,1,0,1,0,0,0,0,0
819,1301414.0,中国最著名的旅游景点——万里长城。说到长城一般来说是指八达岭长城。以前的京八高速现在的G6京藏高速，直达八达岭长城！,/Date(1666532615000+0800)/,0,4.266,0,0,0,0,0,0,0,0,0
820,287638238.0,很好！不到长城非好汉，长城弯延，望眼处绿意苍茫，景色秀丽，人文环境舒适安全。,/Date(1662954434000+0800)/,0,4.285,0,0,0,2,0,0,0,0,0
821,34836950.0,中国著名的旅游景点之一，月球上可见,/Date(1678769974000+0800)/,0,3.393,0,0,0,0,0,0,0,0,0
822,109783399.0,八达岭长城风景区是应该去看看...,/Date(1674920052000+0800)/,0,0.782,0,0,0,1,0,0,0,0,0
823,417549325.0,万里长城万里长，展现宏伟，让人钦佩,/Date(1667794510000+0800)/,0,4.056,0,0,0,0,0,0,0,0,0
824,70762235.0,景色绝美，值得一来！小妹来北京的第一站，一起爬长城，虽然很累，但是很值得。,/Date(1662701062000+0800)/,0,4.251,0,0,0,1,0,0,0,0,0
825,241225691.0,第一次去的话确实不熟，不懂逛哪里,/Date(1677590706000+0800)/,0,-5.746,0,0,0,0,0,0,0,0,0
826,76198261.0,全世界所公知的旅游景点，祖先军事防御工事的极致之作。一道封闭的墙束缚了中华民族，失去了走向文明富强的大航海时代！,/Date(1666914012000+0800)/,0,4.286,0,0,0,0,0,0,0,0,0
827,57583438.0,一家三口，一致肯定张老师讲解，讲解清晰，风趣幽默，照顾周到，谢谢张老师！,/Date(1664856482000+0800)/,0,4.286,0,2,0,0,0,0,0,0,0
828,873873.0,世界著名景点，不到长城非好汉。,/Date(1677937997000+0800)/,0,4.214,0,0,0,0,0,0,0,0,0
829,740994.0,可能是因为人少，目前只开了北边的缆车，缆车上山直接到北7的烽火楼，再爬一会就到了最高点北8烽火楼，从北7沿着长城一路下山，感觉如果有老人或小孩，建议买缆车上山，山不高，大概是香山一半的路程。,/Date(1662815819000+0800)/,0,-5.732,0,0,0,0,0,0,0,1,0
830,160381953.0,步行感受长城的历史气息，感受着经历了几千年风霜的长城，这感觉很神奇。,/Date(1672105104000+0800)/,0,4.285,0,0,0,0,0,0,0,0,0
831,100748906.0,不到长城非好汉！壮丽河山！,/Date(1675598363000+0800)/,0,3.872,0,0,0,0,0,0,0,0,0
832,465629801.0,值得游玩一去，小孩免费,/Date(1674597503000+0800)/,0,3.273,0,0,0,0,0,0,1,1,0
833,917446.0,很壮观，一个冬天去参观的，风很大，绵延不绝，很多人游玩，很不错,/Date(1673795838000+0800)/,0,4.285,0,0,0,0,0,0,1,0,0
834,212285577.0,到过长城的人无不惊叹它的磅礴气势、宏伟规模。长城是一座稀世珍宝，是中华民族的骄傲，也是整个世界的骄傲。,/Date(1668266620000+0800)/,0,4.286,0,0,0,0,0,0,0,0,0
835,2834497.0,去的时候人不多，全程走路，景色壮观，风景优美，不上长城非好汉。,/Date(1667465218000+0800)/,0,4.272,0,0,1,2,0,0,0,0,0
836,45282561.0,相隔17年再次来八达岭,/Date(1664977109000+0800)/,0,-6.231,0,0,0,0,0,0,0,0,0
837,1999506.0,最经典，最有名的长城段，多少个人的梦想就是爬一次长城，当一名好汉，这里是做好的选择，坚持，加油，享受！,/Date(1663248459000+0800)/,0,4.285,0,0,0,0,0,0,0,0,0
838,268829528.0,去八达岭长城坐的巴士达Busda直通车，很棒！直通车还有导游带着一路欢声笑语，大家很高兴。长城风景秀丽，不拥挤。游览玩毕， 人满就发车特别棒。下次带朋友来，专门搭乘巴士达，性价比很高。,/Date(1652409731000+0800)/,596,4.286,0,1,0,1,0,0,1,0,0
839,351908022.0,周导一路讲解真心不错,/Date(1675666306000+0800)/,0,4.263,0,1,0,0,0,0,0,0,0
840,18735764.0,不到长城非好汉，这里是中国最伟大的人类奇迹，古人花费了大量的心血修建抵御外敌，非常壮观，一定要去看看,/Date(1665155156000+0800)/,0,4.285,0,0,0,0,0,0,0,0,0
841,16462313.0,比较独特，但是总体来看，还是创意不足。与票价相比，很是不值。,/Date(1663038731000+0800)/,0,4.232,0,0,0,0,0,0,0,0,0
842,8760078.0,长城必打卡的景点之一,/Date(1662986167000+0800)/,0,2.127,0,0,0,0,0,0,0,0,0
843,393719401.0,"不到长城非好汉，来北京，长城是一定要去的。
 
&amp;#128344;【开放时间】： 八达岭参考开放时间：早上06:30开门，
 
&amp;#128180;【门票价格】： 门票参考价格，旺季40元/成人；淡季35元/成人。优惠人群要具体看情况哦。
 
&amp;#128652;【交通攻略】： 都游巴士直通车或者是换乘公交，自驾，包车等
 
&amp;#128073;【线路安排】：先到北八楼去打卡，这里的视野特别棒，而且早点去人少一些。——之后走左侧路往下走，不要沿着上北八楼的路走！咱们会找到一个【无人拍照点】。这里的风景也特美。视频中有。然后大家接着走就会看到休息的林荫处，可以歇一歇。之后往北六楼这边溜达溜达，逛一逛。长城拍拍照之后呢，
&amp;#128073;下来咱们可以去中国长城博物馆，这个是免费开放的。这里展示了长城产生和发展的基本脉络；长城的军事防御功能及体系；历史上发生在长城内外的重大战役；
&amp;#128073;带小朋友的推荐去看球幕影院。这是立体动感影院。会有身临其境之感，座椅会根据情形的急缓情况高低情况实时变化。用视觉特效技术“再现”长城烽火传递、长城修建以及长城攻防等震撼场景。挺棒的。
&amp;#128073;之后可以在长城吃个饭，休息休息就准备返程了。
 
&amp;#129505;【行前准备】： 
&amp;#128073;人均带两瓶矿泉水，带一个面包，一块巧克力，一包饼干，湿巾纸巾，一个垃圾袋～
&amp;#128073;游览完可以去长城下面吃个饭，东西正常价格。
&amp;#128073;穿的话冬天不用说了，夏天半截袖外面套个薄外套就行，长城上风挺大，主要还是看天气阴天多穿，晴天必须里面穿个半截袖！要注意防晒防晒。",/Date(1651545285000+0800)/,3,4.286,0,0,0,1,6,0,0,0,0
844,161878986.0,很不错的地方，已经去了很多次了。非常好,/Date(1663894547000+0800)/,3,3.619,0,0,0,0,0,0,0,0,0
845,162165340.0,走的太累了，而且天气很热，疫情的原因，排队排了好长时间啊,/Date(1669990619000+0800)/,0,-9.512,0,0,1,0,0,0,0,0,0
846,50174508.0,自然风光与古代长城的完美结合，雄伟壮观，祖国山河处处美景,/Date(1669822466000+0800)/,0,4.284,0,0,0,2,0,0,0,0,0
847,16813992.0,北京必去的景点之一，还有颐和园和故宫，第一次来的只要不是特别热的天气都应该去走一走。快去看看吧。,/Date(1662649341000+0800)/,0,-1.592,0,0,0,0,0,0,0,0,0
848,36536927.0,对于赶时间的朋友是个快速登顶的好选择，另外景区大门和索道完全是两个相隔万里的距离，请特别注意！,/Date(1673422449000+0800)/,0,-0.698,0,0,0,0,0,0,0,0,0
849,66392403.0,冬天太冷 但是别有一番威严 秋天的华丽 春天的盎然 都值得一登,/Date(1669500460000+0800)/,0,4.048,0,0,0,0,0,0,0,0,0
850,421282236.0,"万里长城今犹在  不见当年秦始皇
雄伟壮观 真是不到长城非好汉",/Date(1666677565000+0800)/,0,3.059,0,0,0,0,0,0,0,0,0
851,310832191.0,不到长城非好汉，北京旅游一定会去，这里可以感受到古人的吃苦耐劳的精神，见证他们的伟大，不错不错,/Date(1662851679000+0800)/,0,4.284,0,0,0,0,0,0,0,0,0
852,18735764.0,不到长城非好汉，北京旅游一定都会去的地方，这里是中华民族的精神象征，古人的辛苦付出真的很伟大！,/Date(1661690765000+0800)/,0,4.285,0,0,0,0,0,0,0,0,0
853,310832191.0,这是世界八大奇迹啊，非常壮观，如此险要的山势，建造这样大规模的防御工事真的很不容易，推荐去看看,/Date(1661356814000+0800)/,0,4.284,0,0,0,0,0,0,0,0,0
854,169350828.0,八达岭长城今天人很少，乘坐巴士达来景区也很方便，一站直达，游玩时间有四个小时最主要没有任何购物环节，车上工作人员也很耐心！再来还选择.,/Date(1648280299000+0800)/,431,4.283,1,0,0,0,0,0,1,0,0
855,209168485.0,冬季的八达岭，风很大，但人也不少，都是不畏严寒的好汉,/Date(1673914409000+0800)/,0,3.124,0,0,0,0,0,0,0,0,0
856,47359277.0,宏伟的建筑！体验就是：不到长城非好汉，到了长城一身汗,/Date(1673861944000+0800)/,0,3.728,0,0,0,0,0,0,0,0,1
857,18735764.0,不到长城非好汉，这里能能感受到祖国的大好河山，不经赞叹古人的勤恳吃苦耐劳，去北京一定要去看看,/Date(1663057454000+0800)/,0,4.061,0,0,0,0,0,0,0,0,0
858,119532635.0,八达岭长城位于北京市延庆境内。,/Date(1671234066000+0800)/,1,-3.726,0,0,0,0,0,0,0,0,0
859,201979593.0,八达岭景区以其宏伟的景观、完善的设施和深厚的文化历史内涵而著称于世，是举世闻名的旅游胜地。,/Date(1668353928000+0800)/,0,2.605,0,0,0,0,0,0,0,0,1
860,118225033.0,值得去旅游景点之一，长城雄伟壮观，建造风格非常独特，历史沿革悠久文化遗产保护力度非常不错。,/Date(1666879574000+0800)/,0,4.285,0,0,0,0,0,0,0,0,0
861,310832191.0,不到长城非好汉，这里是北京著名景点，是旅游打卡必去的景点，这里也是中华民族的精神象征，推荐,/Date(1662292609000+0800)/,0,4.282,0,0,0,0,0,0,0,0,0
862,115180505.0,不到长城非好汉，有一段还是挺累的，不过值得一去。,/Date(1670592971000+0800)/,0,3.729,0,0,0,0,0,0,0,0,0
863,368711682.0,是一辆新车 开起来感觉很好 店家来回取车 服务态度很赞,/Date(1670077760000+0800)/,0,1.046,2,0,0,0,0,0,0,0,0
864,27135471.0,长城在中国乃至世界都是一项伟大的壮举，标志着中国的无限力量，八达岭就是其中一段，值得游览,/Date(1666135882000+0800)/,0,4.286,0,0,0,0,0,0,0,0,0
865,295561181.0,北京八达岭长城，到北京游玩一定要去打卡的地方八达岭长城以雄伟装观古代人的智慧之高超赞一个,/Date(1665847273000+0800)/,0,4.202,0,0,0,0,0,0,1,0,0
866,18735764.0,北京长城是人类历史上最伟大的杰作，非常壮观的，不到长城非好汉，去北京一定要去走一走，推荐,/Date(1662466910000+0800)/,0,4.286,0,0,0,0,0,0,0,0,0
867,153426680.0,不是很难爬，上北12楼稍微有点累。很雄伟壮观。,/Date(1674042149000+0800)/,0,-4.87,0,0,0,0,0,0,0,0,0
868,221802606.0,"【景色】世界奇迹！
【趣味】不错！
【性价比】高！",/Date(1671894865000+0800)/,0,4.286,0,0,0,1,0,0,1,0,0
869,112977576.0,停车场离登长城口还有2公里，可以做免费摆渡车还是很方便的。除了名气大其他一般，从1号到12号北楼走一圈不用回头路，一个半小时。,/Date(1667991535000+0800)/,0,-9.86,0,0,0,0,0,0,0,0,0
870,35299796.0,八达岭长城世界知名地标建筑，万里长城永不倒，不到长城非好汉，有机会来北京一定不要错过！,/Date(1666839947000+0800)/,0,4.231,0,0,0,0,0,0,0,0,1
871,9302125.0,八达岭是著名景点了，不到长城非好汉，八达岭是几个长城景区里面比较方便到达的，也有索道。,/Date(1666097109000+0800)/,0,3.407,0,0,0,0,0,0,0,0,0
872,18735764.0,不到长城非好汉，北京旅游打卡必去之处，非常壮观的建筑啊，有生之年一定要去的地方，推荐啊,/Date(1661929744000+0800)/,0,4.226,0,0,0,0,0,0,0,0,1
873,20928016.0,八达岭长城位于北京市延庆区军都山，是保存得非常好的一段长城，极目远眺，犹如一条巨龙。,/Date(1664121878000+0800)/,0,4.186,0,0,0,0,0,0,0,0,0
874,5342169.0,人不多，景色好，推荐坐缆车或者观光小火车。,/Date(1673757257000+0800)/,0,4.218,0,0,1,1,0,0,0,0,0
875,463980621.0,挺好的。孩子玩的挺开心,/Date(1673221823000+0800)/,1,4.204,0,0,0,0,0,0,1,0,0
876,92335921.0,八达岭长城人真心的多，已经不是最佳观景处了,/Date(1671455028000+0800)/,0,3.542,0,0,0,0,0,0,0,0,0
877,7391125.0,很适合周末和朋友们一起来呀，度过一个快乐周末！体验感一级棒，总之非常推荐各位来打卡,/Date(1664200686000+0800)/,0,4.285,0,0,0,0,0,0,0,0,0
878,267892208.0,还行吧，就是坐车919的一定要坐到八达岭站,/Date(1663304335000+0800)/,0,2.657,0,0,0,0,0,0,0,0,0
879,3388898.0,中华五千年文化的结晶，劳动人民的血汗和心血，万里长城蜿蜒在重山峻岭中特别值得敬佩,/Date(1666447196000+0800)/,0,4.286,0,0,0,0,0,0,0,0,0
880,119247994.0,不到长城非好汉，去过好多次的长城真的是太壮观！希望再去打卡！,/Date(1665222173000+0800)/,1,4.034,0,0,0,0,0,0,0,0,0
881,407544517.0,"天高云淡，望断南飞雁，不到长城非好汉，屈指行程二万。六盘山上高峰，红旗漫卷西风。伴着毛主席的这首《清平乐·六盘山》我就徒步从八达岭长城的北一楼一路爬到北八楼，其中地势险峻，错综复杂我就不说了，单说长城的风景是真好，游人也乐在其中仿佛忘记了登城一般，其中之妙处只有你自己亲身体会，我就不说了，在这里给你出一四字成语，能回答的出来的，欢迎留言回答

最后下城我下到北四楼，不知道滑车是什么梗，我就坐了个滑车，你以为这个我能告诉你吗？🤣",/Date(1659743304000+0800)/,0,4.285,0,0,0,1,0,0,0,0,0
882,327396751.0,早上七点多从德胜门出发，做877或者919的公交车出发，九点到达八达岭长城脚下。如果体力可以的话建议不要坐滑车或者缆车，尽量从北一上去爬到北八，只有这样体验才能感受到古人的伟大。才能体验祖国的大好河山！,/Date(1657286505000+0800)/,0,4.199,0,0,0,0,0,0,0,0,0
883,393599975.0,之前去过八达岭长城，选择的都游巴士直通车很方便，导游服务热情周到，介绍也很好，很给力！他们的车是免摆渡车的，而且到了八达岭长城后就自己玩了，比较自由。相当于就是提供了直通车和门票的服务，而且有需要的就跟工作人员说，他们都会帮忙办理的，很贴心。总体超赞，性价比高，体验很棒，服务很好。回来我们在鸟巢附近就下车了，我带着爸妈又去鸟巢水立方逛了逛拍拍照，一天很充实。感谢。,/Date(1651402469000+0800)/,2,4.286,4,1,0,0,1,0,1,0,0
884,98049898.0,五月一号第一天，带两老一小来八达岭长城一日游，没来过北京，选择赞巴士包车来回，北土城地铁站集合，到地点后自由行，车上可以购置门票缆车票，票价和景区一致，老人小孩优惠票，票价与景区一致，这个方式很好很省心,/Date(1619850051000+0800)/,12,4.285,0,0,0,0,2,0,0,1,0
885,28940897.0,"【景色】不错
【趣味】不错
【性价比】好！",/Date(1669218242000+0800)/,0,4.284,0,0,0,1,0,0,1,0,0
886,67267054.0,长城的威严壮观，不是通过照片能看的出来的，一定要站到场景下，自己亲身体会一下。,/Date(1667356038000+0800)/,0,4.221,0,0,0,0,0,0,0,0,0
887,846480.0,到了北京八达岭长城是一定要去打卡的，尤其是秋天登上长城嘹望四周，那真是美极了。,/Date(1663340348000+0800)/,0,4.171,0,0,0,0,0,0,0,0,0
888,421109129.0,非常感慨！赞叹古人的修建能力之伟大啊！,/Date(1662271629000+0800)/,0,4.047,0,0,0,0,0,0,0,0,0
889,4006055.0,最有名的名胜古迹之一，去北京的比去之地，去过才知道什么叫“不到长城非好汉”。,/Date(1668690864000+0800)/,0,3.797,0,0,0,0,0,0,0,0,0
