,uid,comment,date,like,sorce,#服务方面#cnt,#导游方面#cnt,#人流方面#cnt,#景色方面#cnt,#价格方面#cnt,#饮食方面#cnt,#娱乐方面#cnt,#儿童方面#cnt,#设施方面#cnt
1020,56874303.0,真的好漂亮有山有水、还有鱼、风景还特别美……,/Date(1463368144000+0800)/,0,4.207,0,0,0,1,0,0,0,0,0
1021,1324440.0,虽然在整修，但是不影响游玩。这次终于超越了自己爬了上去，不容易,/Date(1564271870000+0800)/,1,-3.829,0,0,0,0,0,0,1,0,0
1022,145634.0,春夏秋冬都有不同的景色，距离不算太远，爬山看鱼赏花赏红叶，还有滑道可以玩，十分点赞,/Date(1555197336000+0800)/,0,4.149,0,0,0,1,0,0,1,0,0
1023,158761279.0,评论晚了，去年和一个姐姐一起去烧香拜佛的。,/Date(1554889942000+0800)/,2,-6.349,0,0,0,0,0,0,0,0,0
1024,9283459.0,很有名的景点，当地和外地来的人都很多，最好不要节假日去，你懂的,/Date(1495754737000+0800)/,1,0.168,0,0,0,0,0,0,0,0,0
1025,89528149.0,景区挺不错的。庙不大后面就是爬山。整体可以,/Date(1492875209000+0800)/,2,3.579,0,0,0,0,0,0,0,0,0
1026,89497208.0,景区服务很到位，景色真的很好看，空气质量不错，登山远眺，雁西湖尽收眼底，很值得一去,/Date(1492858369000+0800)/,0,4.286,1,0,0,2,0,0,0,0,0
1027,103673269.0,总体而言，还是比较有意义的，最高峰景色宜人，还能看到怀柔水库。观音和罗汉惟妙惟肖。,/Date(1492555061000+0800)/,0,4.278,0,0,0,1,0,0,0,0,0
1028,18407142.0,男拜雍和宫，女拜红螺寺，从东直门坐公交两个小时，到景区门口，挺方便。进去一路从观音路拜到最上面，又向上爬了景区的山，出了一身汗，舒服，下来走罗汉道，整个一遍。好。,/Date(1474896070000+0800)/,0,4.253,0,0,0,0,0,0,0,0,0
1029,54695710.0,"景色很美，爬山锻炼身体，里面烧香都是免费的，门票有点贵，去观音寺路途有点陡,还可以",/Date(1466267564000+0800)/,0,4.283,0,0,0,1,1,0,0,0,0
1030,47585397.0,不错就是爬山敬佛，天气好阳光明媚，空气好。,/Date(1464067981000+0800)/,0,3.121,0,0,0,0,0,0,0,0,0
1031,46146255.0,滑道很刺激，以前没有的，小心脏有点承受不了，还好坚持了下来，孩子很兴奋，总之还满意,/Date(1445846971000+0800)/,0,4.285,0,0,0,0,0,0,0,0,0
1032,48617566.0,景区干净整洁，山上干净整洁，服务热情周到 ，风景如画，有山有水，让人心旷神怡，很舒服,/Date(1445769235000+0800)/,0,4.286,1,0,0,1,0,0,0,0,0
1033,21050714.0,景点里头很多维修的地方，跟景区门口写的牌子不一样，牌子上只写了一个地方维修，可实际至少有3个地方，害的女儿爬了好几百级的台阶去看观音庙，结果人家维修，啥也没见着，你在山底下倒是标注一下啊，弄的女儿不高兴。,/Date(1563157896000+0800)/,2,-10.0,0,0,0,0,0,0,0,2,0
1034,50266370.0,爬爬山，没有什么特别的景点，主要就是寺庙古一点，心诚则灵吧！门口的古树雌雄银杏对我映像深刻！适合随便走走，竹林还可以的！,/Date(1506164294000+0800)/,0,4.13,0,0,0,0,0,0,0,0,0
1035,93684845.0,景色不错，唯一缺点就是山上卖水的太少，半山腰唯一的一家，一瓶农夫山泉居然要价6块,/Date(1495284018000+0800)/,4,-9.655,0,0,0,1,0,0,0,0,0
1036,91556461.0,春季和家人到郊外一游，放松心情，其乐融融,/Date(1494149916000+0800)/,2,2.0,0,0,0,0,0,0,1,0,0
1037,88754931.0,红螺寺还挺好玩儿的，还可以拜拜观音，赏赏景，爬爬山。但秋天可能花更多，更好看吧。,/Date(1492325068000+0800)/,0,-1.182,0,0,0,1,0,0,1,0,0
1038,25980706.0,现场买票也是54，开始还以为网上买票打9折，有个返现10元算是优惠了，景区人不少,/Date(1492298158000+0800)/,0,-9.927,0,0,0,0,1,0,0,0,0
1039,109119631.0,红螺寺还是不错的，三面环山，景色优美，烧香的人很多，烧完香往后山登山的人络绎不绝,/Date(1491834547000+0800)/,0,4.274,0,0,0,1,0,0,0,0,0
1040,41695881.0,很不错，在春暖花开的时候，全家人出去转转，还是挺好的。就是没有爬到山顶，有点可惜,/Date(1490594784000+0800)/,0,4.28,0,0,0,0,0,0,0,0,0
1041,15970018.0,素有“京北第一古刹”之称的红螺寺景区位于北京怀柔城北4公里处，在人们心中是求姻缘最灵验的寺庙，景区很干净，人也不太多，附近农家院也很多，吃住都方便，有时间还去。,/Date(1475154500000+0800)/,0,-2.599,0,0,0,0,0,0,0,0,0
1042,736825.0,没正确认识到红螺寺的规模，应该安排多半天的时间游览。红螺寺的竹林在北方真是少见。,/Date(1467769367000+0800)/,0,-4.999,0,0,0,0,0,0,0,0,0
1043,10511764.0,出票很快，换票不排队，在检票口旁边换！非常方便！后面山很好！我们只爬到了观音庙！,/Date(1466061279000+0800)/,0,-9.898,0,0,1,0,0,0,0,0,0
1044,2510826.0,网上预定门票使用方便，只是宣传中说你的梅花开放日期有误，没有看到很是徒劳失望。,/Date(1547618887000+0800)/,0,-9.45,0,0,0,0,1,0,0,0,0
1045,115660172.0,红螺寺，我希望大家能够享受大自然的美丽乐趣。        希望大家不要破坏大自然的一草一木。,/Date(1536420299000+0800)/,0,4.277,0,0,0,0,0,0,0,0,0
1046,12327551.0,红螺寺很美，观音路上的观音像让人内心温暖平静 。去的时候中午了，青龙山就没有登 。,/Date(1495162350000+0800)/,0,4.286,0,0,0,0,0,0,0,0,0
1047,109160435.0,上次是两年前去的，这次重游红螺寺还是给了我好多惊喜，整体上又比原来上了一个台阶,/Date(1493913571000+0800)/,0,2.89,0,0,0,0,0,0,0,0,0
1048,89363952.0,景好，环境也好，景区也干净，出游的首选,/Date(1492763641000+0800)/,2,4.247,0,0,0,1,0,0,0,0,0
1049,90663031.0,到了景区门口很多人排队买票，还好机智的预定了电子票，直接到检票口兑换门票很方便,/Date(1492265809000+0800)/,0,-3.488,0,0,1,0,1,0,0,0,0
1050,109125247.0,到了景区门口很多人排队买票，还好机智的预定了电子票，直接到检票口兑换门票很方便,/Date(1492265747000+0800)/,0,-3.488,0,0,1,0,1,0,0,0,0
1051,23492672.0,特别喜欢去的一个地方，空气好，环境优，还可以爬山锻炼身体,/Date(1555366214000+0800)/,1,4.226,0,0,0,1,0,0,0,0,0
1052,178872511.0,我的感觉是寺庙没有僧人，都是工作人员！所以就跟一般旅游景点没多大区别，如果不是求子，没什么好去的了！加上这时间去的也不是时候，风景也很一般，应该秋天会好点吧！门票相对比其他寺庙贵点，地方也小了点！,/Date(1529298922000+0800)/,0,-8.484,1,0,0,1,1,0,0,0,0
1053,20723802.0,香火旺盛，这个季节银杏叶满地，非常漂亮！坐滑车感受美丽的山中景色，美不胜收！,/Date(1509840589000+0800)/,0,4.284,0,0,0,1,0,0,0,0,0
1054,3397203.0,红螺寺是经常来的地方，特别舒服的感觉,/Date(1503626154000+0800)/,0,0.161,0,0,0,0,0,0,0,0,0
1055,11044755.0,很方便，也比较快，进门左手边就可以取,/Date(1502199240000+0800)/,2,-1.696,0,0,0,0,0,0,0,0,0
1056,40757098.0,好地方，非常舒服，订票方便取票也方便,/Date(1492930357000+0800)/,0,-8.54,0,0,0,0,0,0,0,0,0
1057,87960515.0,不错，据说求子特别灵，我是去求姻缘的,/Date(1491791010000+0800)/,2,0.003,0,0,0,0,0,0,0,0,0
1058,14775888.0,红螺寺很大 可以玩一天 从山道爬到观音寺要有点儿体力 四月寺里玉兰和杜鹃都开了 很美,/Date(1491023448000+0800)/,0,3.359,0,0,0,0,0,0,1,0,0
1059,5729110.0,滑道不是很刺激 适合老人小孩一起玩 基本都是寺庙 随便溜达溜达 吸收一下负氧离子 开心,/Date(1472863780000+0800)/,0,3.795,0,0,0,0,0,0,1,1,0
1060,39741992.0,环境超好 风景很美 早晨早点来人少安静 很喜欢这个地方 以后有时间还会再来的 呵呵呵呵,/Date(1469854039000+0800)/,0,4.223,0,0,0,2,0,0,0,0,0
1061,36383022.0,哈哈，红螺寺还是前几年去的，不过红螺这个名字却被征用了,/Date(1530693039000+0800)/,1,-6.812,0,0,0,0,0,0,0,0,0
1062,852445.0,人不是很多，带孩子来转转挺不错的。,/Date(1501466038000+0800)/,2,4.133,0,0,0,0,0,0,0,0,0
1063,6065019.0,很有名的寺庙，在怀柔，北京的东北部,/Date(1496947395000+0800)/,2,-2.42,0,0,0,0,0,0,0,0,0
1064,35596666.0,玩的地方人很多很多的！风景区很好看,/Date(1492995104000+0800)/,0,3.978,0,0,0,2,0,0,1,0,0
1065,89363952.0,环境比较好，服务态度也好，出游首选,/Date(1492764047000+0800)/,2,3.877,2,0,0,1,0,0,0,0,0
1066,105142654.0,一家人一起去的，比预期的要好，山里空气很好，人也不多，是周末游玩的好去处。,/Date(1492345721000+0800)/,0,3.96,0,0,0,0,0,0,1,0,0
1067,7340851.0,环境优雅 人不是很多 紫藤和牡丹还没开 ,/Date(1492243465000+0800)/,0,4.165,0,0,0,1,0,0,0,0,0
1068,83926059.0,很愉快的一次旅行，都说红螺寺的观音庙很灵验，和老公带着诚心去的，希望接好孕,/Date(1491985654000+0800)/,0,-2.116,0,0,0,0,0,0,0,0,0
1069,103989983.0,环境很好，空气清新，观音路很有特点,/Date(1491796500000+0800)/,2,4.044,0,0,0,1,0,0,0,0,0
1070,86776025.0,儿子四岁第一次来，没想来自己爬到了观音寺，之后做缆车下山，儿子意犹未尽……,/Date(1491715973000+0800)/,0,4.11,0,0,0,0,0,0,0,2,0
1071,20290584.0,第一次来，还不错，很多竹子和花草。,/Date(1491640134000+0800)/,2,4.033,0,0,0,0,0,0,0,0,0
1072,27290918.0,去过两次了，很灵验，风景在秋季很美,/Date(1487055306000+0800)/,2,4.236,0,0,0,1,0,0,0,0,0
1073,26161524.0,红螺寺位于怀柔，坐公交车可以到达，这里是我国最大的佛教园林，这里也很凉快。,/Date(1470703019000+0800)/,0,4.285,0,0,0,1,0,0,0,0,0
1074,68556232.0,玩的不尽兴！有很长的路因为施工封路了，没法再往上爬，慢慢走1小时就到顶了,/Date(1534080441000+0800)/,0,-6.603,0,0,0,0,0,0,1,0,0
1075,30724396.0,红螺寺在北京也算是个很有名儿的景点了，不为拜佛只是去游玩一下也是挺好的。,/Date(1529026596000+0800)/,0,2.476,0,0,0,0,0,0,1,0,0
1076,50922377.0,挺好的，一家三口我还得好开心呀。,/Date(1502461916000+0800)/,2,2.72,0,0,0,0,0,0,0,0,0
1077,67665888.0,好评，推荐，值得去的景点，推荐去,/Date(1498552435000+0800)/,2,2.846,0,0,0,0,0,0,0,0,0
1078,57442915.0,非常完美的一天，早上在携程订票，上午到了省去排队时间，直接兑换进寺，赞！,/Date(1492858969000+0800)/,0,-7.521,0,0,1,0,0,0,0,0,0
1079,107962729.0,天好，心情好，觉得景色也好，噢耶,/Date(1492833628000+0800)/,0,3.276,0,0,0,1,0,0,0,0,0
1080,48941082.0,还不错，两个小时多能结束，很干净,/Date(1491372669000+0800)/,0,3.467,0,0,0,0,0,0,0,0,0
1081,49712549.0,很好效率好高，可以坐车上去，下来比较刺激！！！下次还去，回来腿疼哈哈！,/Date(1567136933000+0800)/,0,2.932,0,0,0,0,0,0,0,0,0
1082,161737221.0,Goooooooood!!!!,/Date(1539514227000+0800)/,0,-2.857,0,0,0,0,0,0,0,0,0
1083,1316645.0,很方便，直接在景区入口处验证换票即可！如果价格方面再有点优惠就更好了！,/Date(1522166053000+0800)/,0,3.022,0,0,0,0,2,0,0,0,0
1084,60627603.0,游玩很好，对红螺寺很满意满意。,/Date(1500728668000+0800)/,2,3.806,0,0,0,0,0,0,1,0,0
1085,60203868.0,还算可以的！就是体力感觉跟不上,/Date(1496707792000+0800)/,2,-0.392,0,0,0,0,0,0,0,0,0
1086,89903727.0,还不错，爬山要早点去，环境不错，带宝宝去的话要选好路线，要不然会很累!,/Date(1493193107000+0800)/,0,4.281,0,0,0,1,0,0,0,0,0
1087,14787279.0,网上购票很方便，在门口直接取票入园，人不多，做滑道直接上山也挺安全的。,/Date(1492918433000+0800)/,0,3.907,0,0,1,0,0,0,0,0,0
1088,52798072.0,天气好，心情好，怀着虔诚的心来到红螺寺，著名景点，身心受益，景色优美。,/Date(1492074986000+0800)/,0,4.285,0,0,0,1,0,0,0,0,0
1089,67980702.0,挺不错的，不用排队，直接到检票口左换电子票就可以。始终觉得爬山真是享受,/Date(1491011250000+0800)/,0,2.296,0,0,1,0,0,0,0,0,0
1090,19774480.0,红螺寺是最适合春游的地方，不仅风景好，还有滑道可供我门选择，方便登山。,/Date(1490455312000+0800)/,0,4.207,0,0,0,1,0,0,0,0,0
1091,2163246.0,山峰很高，不过爬上去四周雾蒙蒙,/Date(1465462934000+0800)/,0,-3.673,0,0,0,0,0,0,0,0,0
1092,496801.0,北京有名的寺庙，非周末人比较少,/Date(1460699701000+0800)/,0,1.09,0,0,0,0,0,0,0,0,0
1093,12854837.0,人不多，红叶还没红，山景漂亮,/Date(1579261500000+0800)/,0,3.186,0,0,1,0,0,0,0,0,0
1094,24809960.0,这里比之前有所改变，增加了很多景点，可以拍些照片，依山傍水的景色不错,/Date(1567157089000+0800)/,0,4.258,0,0,0,1,0,0,0,0,0
1095,3168138.0,千年古刹！南有普陀，北有红螺。佛教圣地。非常好！,/Date(1533716694000+0800)/,1,4.18,0,0,0,0,0,0,0,0,0
1096,32275046.0,千年古刹，还是值得一游，最好是在半阴天去最好玩的,/Date(1495810029000+0800)/,1,3.63,0,0,0,0,0,0,1,0,0
1097,1035258.0,红螺寺在北京也算是香火很盛的一座庙宇，经常会有人专门从城里赶去进香。对于不是拜佛的人来说，意思不大，没有太多人文的东西。不过，秋季的风景还是不错的。,/Date(1484318592000+0800)/,0,4.236,0,0,0,1,0,0,0,0,0
1098,76678204.0,就在怀柔家门口，也是去过很多次，据说香火很灵验的,/Date(1481939036000+0800)/,1,-0.538,0,0,0,0,0,0,0,0,0
1099,239584110.0,不虚此行吧，景色非常棒，一点都不热，好多人都是来求子的，瀑布好看，,/Date(1572179019000+0800)/,0,3.406,0,0,0,2,0,0,0,0,0
1100,34546044.0,去看红叶，结果红叶没怎么红，风景不错，也不是很高，爬起来毫无压力。,/Date(1563094498000+0800)/,0,4.1,0,0,0,1,0,0,0,0,0
1101,86625987.0,出票很快，很方便的。景点很好很喜欢，景色很美，游人很多。下次还来。,/Date(1553399342000+0800)/,0,4.284,0,0,0,1,0,0,0,0,0
1102,97767377.0,来过好几次了，烧香拜佛的人很多，景色也不错，可以玩的娱乐项目也有。,/Date(1493008423000+0800)/,0,4.126,0,0,0,1,0,0,2,0,1
1103,46904415.0,还不错，过去很方便，扫一下就入园，避免排队，好好好！携程就是方便。,/Date(1492488746000+0800)/,0,4.061,0,0,1,0,0,0,0,0,0
1104,81064247.0,值得一去，不要自带香火，寺内香火可随心捐投后自取敬上，真是佛光普照,/Date(1492352307000+0800)/,0,4.252,0,0,0,0,0,0,0,0,0
1105,33766727.0,值得去看看。很古老的禅寺。门前二棵银杏树年头有几百年。历史悠久。,/Date(1556354529000+0800)/,0,4.286,0,0,0,0,0,0,0,0,0
1106,868214.0,红螺寺不只是一座寺庙，也有山和竹林，还有最有意思的滑轨，很好玩的,/Date(1555203171000+0800)/,0,3.786,0,0,0,0,0,0,1,0,0
1107,4382130.0,下雨人不多，上山后人就在云彩里了。对面的山若隐若现。就是太闷了。,/Date(1531259975000+0800)/,0,-4.413,0,0,1,0,0,0,0,0,0
1108,64836710.0,既可以烧香拜佛又可以去游览，走台阶上去，然后坐滑道滑下来，挺好。,/Date(1504017761000+0800)/,0,2.024,0,0,0,0,0,0,0,0,0
1109,27094007.0,经过一夜秋雨的清洗，红螺寺的翠竹青翠欲滴。网购的门票直接扫二维码入园无需再换纸质票，既快捷又环保太棒了！,/Date(1502457090000+0800)/,2,-6.902,0,0,0,0,1,0,0,0,0
1110,3379254.0,很好的一处既能拜菩萨又能爬山的景点，山上古树参天，夏天去很凉快。,/Date(1498101867000+0800)/,0,4.281,0,0,0,0,0,0,0,0,0
1111,2042694.0,红螺寺景色很是不错，山也不高，很适合踏青，携程上定的取票很方便。,/Date(1492953113000+0800)/,0,3.728,0,0,0,1,0,0,0,0,0
1112,109135903.0,总体感觉很好，电子票验证很方便，景区景色很美，适合这个季节游玩！,/Date(1492940410000+0800)/,0,4.283,0,0,0,1,0,0,1,0,0
1113,85677625.0,每年都去，今年发现携程居然还有打折票。兑换很方便，就在景区门口。,/Date(1491899635000+0800)/,0,-9.757,0,0,0,0,0,0,0,0,0
1114,62954687.0,自古有南有普陀，北有红螺之说，1御竹林，2紫藤寄松，3雌雄银杏。,/Date(1486909492000+0800)/,0,2.854,0,0,0,0,0,0,0,0,0
1115,4292700.0,北方大寺，香火很旺，具说是求子的好地方。以前不知道，去了才知道寺之大，香火之旺。山很高很大，整个走下来要一天的时间。五百罗汉，观音之路都很热闹。,/Date(1480817423000+0800)/,0,1.99,0,0,0,0,0,0,0,0,0
1116,66514157.0,总体还行，风景挺好 就是山不是很好爬哦！我和朋友上山下山总共花了6个小时，感觉好累，特别是下山，那个腿上肌肉紧的不能再紧了，朋友说以后再也不爬了！,/Date(1446005084000+0800)/,0,-2.062,0,0,0,1,0,0,0,0,0
1117,190842676.0,网上购票十分方便，不用窗口排队等候了，真的很不错，还会再去的。,/Date(1565702615000+0800)/,0,-0.239,0,0,1,0,0,0,0,0,0
1118,82467875.0,园里环境不错，空气新鲜环境优美，一进门就是竹园幽静小路很惬意。,/Date(1505187297000+0800)/,0,4.286,0,0,0,2,0,0,0,0,0
1119,7167129.0,非常方便，不用排队，直接进去。红螺寺环境优美，值得一去，推荐。,/Date(1498568001000+0800)/,0,0.422,0,0,1,1,0,0,0,0,0
1120,109132394.0,非常棒的一天旅程，登山跟锻炼人的，非常好咯，大家一起，很有意义,/Date(1492746170000+0800)/,0,4.278,0,0,0,0,0,0,0,0,0
1121,27907175.0,是个值得一游的地方，爬爬山还能锻炼身体，吹吹山风一身轻松！！！,/Date(1492309330000+0800)/,0,-6.673,0,0,0,0,0,0,0,0,0
1122,25973659.0,红螺寺在怀柔，在东直门有公交车直接到，这里古树很多，也很凉快，,/Date(1470190453000+0800)/,0,4.212,0,0,0,0,0,0,0,0,0
1123,42455664.0,今天人不多景色不错门票54元略贵了点，红螺寺是北京著名京区。,/Date(1519654725000+0800)/,0,3.762,0,0,1,1,1,0,0,0,0
1124,154520302.0,我的目的性很强，如果灵验我还会回来还愿的,/Date(1511995034000+0800)/,1,-2.873,0,0,0,0,0,0,0,0,0
1125,31302081.0,人不是很多，清净，景色优美，就是南天门在修，最高只能到长廊了,/Date(1494064167000+0800)/,0,-4.411,0,0,0,1,0,0,0,0,0
1126,89682916.0,红螺古寺，曲径通幽，红螺湖水，波光粼粼，红螺高山，仰之而上。,/Date(1493007379000+0800)/,0,-8.526,0,0,0,0,0,0,0,0,0
1127,29408311.0,风景优美，非常不错。风景优美，非常不错。风景优美，非常不错。,/Date(1492936461000+0800)/,0,4.286,0,0,0,3,0,0,0,0,0
1128,74011233.0,红螺寺位于北京怀柔区，不错的寺庙，人气很旺，是怀柔著名景点,/Date(1567089861000+0800)/,0,4.24,0,0,0,0,0,0,0,0,0
1129,29018125.0,红螺寺在山顶上，需要爬一段很陡峭的台阶，上面的景色很不错。,/Date(1529026821000+0800)/,0,4.244,0,0,0,1,0,0,0,0,0
1130,55852368.0,非常有名的景点，山不算太高，景色很美！,/Date(1516323372000+0800)/,1,4.15,0,0,0,1,0,0,0,0,0
1131,90944722.0,非常值得去，推荐携程购买，入口左侧入寺,/Date(1512560265000+0800)/,1,-4.781,0,0,0,0,0,0,0,0,0
1132,64836710.0,风光不错，可以走一段很高的台阶上山，寺庙在山上，香火很旺。,/Date(1509637192000+0800)/,0,4.274,0,0,0,1,0,0,0,0,0
1133,6168383.0,到了景区门口现团的门票，非常方便，下完订单之间去检票口兑换即可。红螺寺还是平时去人会少一些，喜欢爬山的朋友可以考虑走青春路，相对会累一些。,/Date(1493991418000+0800)/,0,4.242,0,0,0,0,1,0,0,0,0
1134,8321073.0,环境很好，绿化率高。带着父母没有爬山，只在山脚溜达了一圈。,/Date(1492483843000+0800)/,0,1.661,0,0,0,1,0,0,0,0,0
1135,58438811.0,环境优美，祈福圣地，俯瞰雁栖湖。道路台阶需进一步修缮...,/Date(1492336129000+0800)/,0,4.003,0,0,0,1,0,0,0,0,0
1136,53945430.0,公园环境很好，电子票的方式也很方便，买完以后即可领票进公园,/Date(1491701174000+0800)/,0,4.252,0,0,0,3,0,0,0,0,0
1137,45638559.0,从携程上订票非常方便，景点风景不错。下次选秋天过来看红叶。,/Date(1490711971000+0800)/,0,3.067,0,0,0,1,0,0,0,0,0
1138,7114527.0,天然氧吧，前一天下雨，空气里泥土的气息，我喜欢，有机会在来,/Date(1490437452000+0800)/,0,3.671,0,0,0,0,0,0,0,0,0
1139,172102802.0,好的地方要用心体会和想受，收获很好的,/Date(1562716574000+0800)/,1,4.188,0,0,0,0,0,0,0,0,0
1140,11766513.0,第一次带娃来，粑粑抱着娃，麻麻背着包爬到了山顶，风景不错,/Date(1493132744000+0800)/,0,-0.27,0,0,0,1,0,0,0,0,0
1141,99268723.0,网上买票方便，取票方便，不用排队，可以享受速度超级便利！,/Date(1492833804000+0800)/,0,-6.131,0,0,1,0,0,0,0,0,0
1142,23342250.0,第一次去红螺寺，孩子爬山很棒，在观音路上也学了好多知识。,/Date(1491733639000+0800)/,0,4.074,0,0,0,0,0,0,0,0,0
1143,12190522.0,这个是建了快有1000多年了非常非常古老但是建筑是后休的,/Date(1482551021000+0800)/,0,1.564,0,0,0,0,0,0,0,0,1
1144,51490181.0,在观景台可以看见雁栖湖、日出东方酒店和会议中心。风景很赞。500罗汉神态各异，12生肖也挺不错~,/Date(1461405058000+0800)/,0,4.27,0,0,0,1,0,0,0,0,0
1145,179897631.0,"感觉不错挺平静的说实话我还差七个字
",/Date(1540974319000+0800)/,1,3.659,0,0,0,0,0,0,0,0,0
1146,13074262.0,每年都来红螺寺拜一拜，红螺寺景色宜人，人不多，很清静。,/Date(1510242827000+0800)/,0,4.149,0,0,1,1,0,0,0,0,0
1147,34279354.0,红螺寺之行体验很好。很纯粹的寺庙体验。电子门票兑换方便,/Date(1491920818000+0800)/,0,4.039,0,0,0,0,1,0,0,0,0
1148,91135909.0,我觉得红螺寺真的是一个非常美和宁静的地方，仿佛世外桃源,/Date(1491658700000+0800)/,0,4.26,0,0,0,0,0,0,0,0,0
1149,6995753.0,比较喜欢的一个寺庙，虽然地方大，但是我略微缺了一点灵性,/Date(1487724661000+0800)/,0,-1.649,0,0,0,0,0,0,0,0,0
1150,12190522.0,烧香拜佛的好地方门口有一大片的竹林这个是建了很久很久了,/Date(1482883262000+0800)/,0,1.83,0,0,0,0,0,0,0,0,0
1151,42436901.0,很棒，很值得去，就是爬山有点累，一半罗汉一半观音棒棒的,/Date(1461256516000+0800)/,0,4.282,0,0,0,0,0,0,0,0,0
1152,30221599.0,山顶的风景很美丽，爬了山，拜了菩萨，希望愿望可以实现,/Date(1527657487000+0800)/,0,4.278,0,0,0,1,0,0,0,0,0
1153,10677039.0,去烧香的，都讲红螺寺求姻缘好灵的，求我的姻缘早点到。,/Date(1499943453000+0800)/,0,-0.771,0,0,0,0,0,0,0,0,0
1154,35373321.0,不错的景区，带父母去的，就是选择爬山的话必须一大早去,/Date(1493181887000+0800)/,0,1.87,0,0,0,0,0,0,0,0,0
1155,70362258.0,门票非常方便，甚至不用去买票窗口，直接去检票那就行。,/Date(1492999991000+0800)/,0,-2.713,0,0,0,0,1,0,0,0,0
1156,109126153.0,还是挺好玩的，值得一看。但可能秋天去更好吧，花更多。,/Date(1492324950000+0800)/,0,4.207,0,0,0,0,0,0,1,0,0
1157,34849329.0,周末陪麻麻爬爬山看看花，来一趟静心之旅。玩的很开心。,/Date(1491724039000+0800)/,0,2.51,0,0,0,0,0,0,1,0,0
1158,109116828.0,整体感觉还是不错的，人不是特别多，风景很好，香火鼎盛,/Date(1491665756000+0800)/,0,4.204,0,0,0,1,0,0,0,0,0
1159,7222546.0,始建于东晋咸康四年（公元338）年，原名“大明寺”。,/Date(1479184326000+0800)/,0,0.799,0,0,0,0,0,0,0,0,0
1160,6808707.0,空气好，环境好，非常适合锻炼求佛,/Date(1472362947000+0800)/,1,3.511,0,0,0,1,0,0,0,0,0
1161,15357162.0,南有普陀北有红螺，北京最有仙气、香火最旺的寺庙之一。,/Date(1463817875000+0800)/,0,0.256,0,0,0,0,0,0,0,0,0
1162,51025223.0,很好 风景好 建议旅游 红螺寺我去过好几回了 感觉真心不错的,/Date(1455423939000+0800)/,0,4.105,0,0,0,1,0,0,0,0,0
1163,21119218.0,景区其实很大，红螺寺本身很快就能逛完，也是比较庄严壮观的，然后就是爬山了，一边是观音寺一边是罗汉林，建议先从罗汉林上山，观音寺下山,/Date(1564375303000+0800)/,0,4.277,0,0,0,0,0,0,0,0,0
1164,7016633.0,很快，取票方便，南普陀北红螺。,/Date(1534721173000+0800)/,1,3.502,0,0,0,0,0,0,0,0,0
1165,3454522.0,跟男朋友去的，山上很多观音像。,/Date(1518055312000+0800)/,1,4.168,0,0,0,0,0,0,0,0,0
1166,82727964.0,方便快捷，节省时间，真的不错。,/Date(1514875333000+0800)/,1,2.277,0,0,0,0,0,0,0,0,0
1167,21194219.0,那里很有特色，有种古韵，里面也挺好玩的，值得一游。,/Date(1498801968000+0800)/,0,3.785,0,0,0,0,0,0,1,0,0
1168,35552763.0,很好，值得一去！网上购票很方便,/Date(1495768291000+0800)/,1,3.114,0,0,0,0,0,0,0,0,0
1169,40802145.0,不错，挺好的，春季出游的好地方，风景不错，空气清新,/Date(1492491368000+0800)/,0,4.273,0,0,0,1,0,0,0,0,0
1170,86643308.0,网上订票很方便，省不少排队买票时间，景区景色也很美,/Date(1490867716000+0800)/,0,-0.178,0,0,1,1,0,0,0,0,0
1171,12742111.0,红螺寺，可以参观到百年银杏树，周边山美水美风光好!,/Date(1486210277000+0800)/,0,4.277,0,0,0,1,0,0,0,0,0
1172,63667813.0,怀柔红螺寺是规模比较大的佛教寺院，周围风景也不错！,/Date(1476074675000+0800)/,0,4.247,0,0,0,1,0,0,0,0,0
1173,37622170.0,拜佛好地方，古树银杏和紫藤好珍贵！可以拜佛，可以爬山。山脚下农家院的菜口味还可以，不便宜。,/Date(1472052246000+0800)/,2,4.243,0,0,0,0,0,0,0,0,0
1174,19055755.0,出票速度快 进门换票方便 很实惠,/Date(1570029395000+0800)/,1,2.976,0,0,0,0,0,0,0,0,0
1175,13678181.0,跟好姐妹一起去红螺寺，网上订票很实惠又快捷方便。,/Date(1528504780000+0800)/,0,-1.636,0,0,0,0,0,0,0,0,0
