,uid,comment,date,like,sorce,#服务方面#cnt,#导游方面#cnt,#人流方面#cnt,#景色方面#cnt,#价格方面#cnt,#饮食方面#cnt,#娱乐方面#cnt,#儿童方面#cnt,#设施方面#cnt
599,26047847.0,市区内5A景点，非常热门，游客络绎不绝。携程预订，实时出票，刷码入馆，避免排队购票，和其他很多景点购票一样，非常方便，值得推荐。,/Date(1663308194000+0800)/,0,-8.032,0,0,1,0,0,0,0,0,0
600,54904702.0,一般，讲解内容按部就班，没有乐趣。不值500多,/Date(1677186412000+0800)/,0,3.717,0,1,0,0,0,0,0,0,0
601,115986100.0,节假日期间就别去了，什么意思都没有 全是看人头！,/Date(1675041654000+0800)/,0,-1.954,0,0,0,0,0,0,0,0,0
602,160162077.0,廉政教育基地，还是值得去看看，北海公园也在附近,/Date(1664033861000+0800)/,0,3.471,0,0,0,1,0,0,0,0,0
603,116293179.0,9位于西城区的胡同里，这里还可以，可以去看看,/Date(1662986791000+0800)/,0,-0.322,0,0,0,0,0,0,0,0,0
604,14198301.0,很不错的地方，绝对是皇家园林的典范，瑰宝级别,/Date(1662115787000+0800)/,0,-0.986,0,0,0,1,0,0,0,0,0
605,53126869.0,原清朝贪官和珅的府邸，现为北京廉政教育基地。,/Date(1661608833000+0800)/,0,4.016,0,0,0,0,0,0,0,0,0
606,4999993.0,"一年四季，四景色，这里就是恭王府，春花，夏树，秋叶，冬雪，你来到拍照就是最美的画面！
了解清王朝历史，就从恭王府开始，“一个恭王府，半个清朝史”说它很重要一点不为过！",/Date(1654580489000+0800)/,2,4.286,0,0,0,1,0,0,0,0,0
607,154703552.0,没什么意思门全部都关闭着 逛了十分钟就出来了,/Date(1676604020000+0800)/,0,-9.396,0,0,0,0,0,0,0,0,0
608,299846457.0,位于北京市东城区，是清朝时期恭王爷的王府。,/Date(1667560711000+0800)/,0,3.376,0,0,0,0,0,0,0,0,0
609,4187961.0,"【景色】非常漂亮
【趣味】很强
【性价比】较高",/Date(1662475566000+0800)/,0,4.284,0,0,0,1,0,0,1,0,0
610,118225033.0,值得去旅游参观，历史沿革悠久，必须去看看,/Date(1666447467000+0800)/,0,4.217,0,0,0,0,0,0,0,0,0
611,12490154.0,北京最好的园林，设计精巧，游人络绎不绝。,/Date(1665729627000+0800)/,0,4.061,0,0,0,1,0,0,0,0,0
612,465750.0,恭亲王，就是改革失败，在菜市口被砍头那个,/Date(1662372660000+0800)/,0,4.275,0,0,0,0,0,0,0,0,0
613,957081.0,景区北常好！！！！！！！！！！～～～～～～～～～～！！！！！！！！！！！！！！！！！！！！！！！！！！！！！！！！！！！,/Date(1661394409000+0800)/,0,-1.529,0,0,0,0,0,0,0,0,0
614,34390112.0,"百年历史看天津,千年历史看北京————夏天，12日暴走津京
北京第一天18-恭王府67
如果说恭王府中其他景点都没记住的话，那么这块镇府之宝“福字碑”就必须要看了，在后花园的假山之中，穿过不算太长的小路，便可到达，只可以这里不允许拍照，而且可以停留的时间很少，所以基本只能有一面之缘。
观看福字碑也是很有将就的，石碑外面覆盖了一层厚厚的玻璃，玻璃之外可供游人抚摸。摸福字要用右手从福字上方康熙大印这里开始，一路向下。寓意接福到家，全家安康",/Date(1647271458000+0800)/,0,2.729,0,0,0,0,0,0,0,0,0
615,33894421.0,清明假期去的，人太多，本来想请个讲解员结果没请上，只能自己跟着人群走，蹭讲解了！讲解器比故宫贵，30/个！5人以里的讲解员是200！5人以上是40/人！人多走不起来，体验不太好，只转了一半，就出来了！“天下第一福”不让拍照！1987太难吃了！不推荐！,/Date(1617717549000+0800)/,13,4.261,0,4,2,0,0,1,0,0,0
616,214105155.0,恭王府，这里环境超级好，绿化造型很漂亮,/Date(1669031322000+0800)/,0,4.223,0,0,0,1,0,0,0,0,0
617,2767969.0,到北京去恭王府是不错的选择，景色不错。,/Date(1668757062000+0800)/,0,4.257,0,0,0,1,0,0,0,0,0
618,65498569.0,什刹海边的清代王府，之前曾为和珅府邸。,/Date(1668405049000+0800)/,0,2.516,0,0,0,0,0,0,0,0,0
619,195612074.0,和珅曾经的住处，在北京二环里，园子不小,/Date(1668232972000+0800)/,0,-5.571,0,0,0,0,0,0,0,0,0
620,25991350.0,清代恭王府邸，保护得很好，占地面积很大,/Date(1667254290000+0800)/,0,4.249,0,0,0,0,0,0,0,0,0
621,160745780.0,距离北海公园很近的一个景区，很值得一游,/Date(1666329773000+0800)/,0,4.0,0,0,0,1,0,0,0,0,0
622,73672599.0,在北京二环里，和珅的府邸，很美的院子～,/Date(1664550708000+0800)/,0,3.062,0,0,0,0,0,0,0,0,0
623,154662348.0,真心非常非常不错的地方👍很有文化底蕴,/Date(1662140344000+0800)/,0,4.179,0,0,0,0,0,0,0,0,0
624,1510765.0,北京恭王府是北京市最著名的旅游景点之一,/Date(1661491194000+0800)/,0,-1.188,0,0,0,0,0,0,0,0,0
625,70931907.0,"【景色】不错
【趣味】不错
【性价比】不错",/Date(1661416473000+0800)/,0,4.285,0,0,0,1,0,0,1,0,0
626,39334263.0,非常不错的有名的地方，风景非常还可以,/Date(1668527315000+0800)/,0,3.889,0,0,0,1,0,0,0,0,0
627,40886370.0,交通便利，古色古香，胡同旅游好去处。,/Date(1668336250000+0800)/,0,3.416,0,0,0,0,0,0,0,0,0
628,41418293.0,这里值得去，景色不错，性价比很好的了,/Date(1668071667000+0800)/,0,4.284,0,0,0,1,0,0,0,0,0
629,11038288.0,北京历史悠久，保存较完整的清代王府。,/Date(1668068163000+0800)/,0,4.188,0,0,0,0,0,0,0,0,0
630,233442707.0,这里值得去，景色秀丽自然，性价比很好,/Date(1667789829000+0800)/,0,4.283,0,0,0,1,0,0,0,0,0
631,401219971.0,恭王府里面的景色还是不错的，值得一去,/Date(1666098822000+0800)/,0,4.22,0,0,0,1,0,0,0,0,0
632,69760437.0,和珅不亚于任何王爷的府邸，厉害的角色,/Date(1666059914000+0800)/,0,1.145,0,0,0,0,0,0,0,0,0
633,260398732.0,秋天的恭王府是最美的季节，颜色丰富。,/Date(1665700530000+0800)/,0,3.626,0,0,0,0,0,0,0,0,0
634,3887225.0,非常的好，就是人太多了，三这里好累。,/Date(1664468142000+0800)/,0,-2.352,0,0,1,0,0,0,0,0,0
635,7946451.0,恭王府比较小，听讲解可能会比较好玩。,/Date(1662208235000+0800)/,0,4.143,0,1,0,0,0,0,1,0,0
636,1711934.0,不错的，听听故事，感受一下震撼的故事,/Date(1662197465000+0800)/,0,4.279,0,0,0,0,0,0,0,0,0
637,286229404.0,北京的遗址不亲民，基本只能走马观花,/Date(1679266704000+0800)/,0,-0.583,0,0,0,0,0,0,0,0,0
638,2065110.0,恭王府景点，非常不错，可以去看看。,/Date(1667486126000+0800)/,0,2.65,0,0,0,0,0,0,0,0,0
639,203696729.0,景色非常不错的地方，环境优美，推荐,/Date(1664812531000+0800)/,0,4.251,0,0,0,2,0,0,0,0,0
640,13206020.0,很有古代气息，也很大气。值得去看看,/Date(1664636768000+0800)/,0,4.265,0,0,0,0,0,0,0,0,0
641,194978942.0,和珅的宅子到底不一样，200块钱的讲解还行 能了解一些大概  讲解姑娘可能走的多了 池塘那边都边上看了一眼没过去  总体值得去,/Date(1664541284000+0800)/,0,4.285,0,2,0,0,0,0,0,0,0
642,17524332.0,很美的一个园子，和珅的府邸确实富有,/Date(1663557924000+0800)/,0,3.818,0,0,0,0,0,0,0,0,0
643,4207023.0,十分值得一逛，历史文化底蕴深厚哦！,/Date(1663077726000+0800)/,0,4.282,0,0,0,0,0,0,0,0,0
644,7139694.0,和珅的府邸，园子很大，真心值得参观,/Date(1662855193000+0800)/,0,3.885,0,0,0,0,0,0,0,0,0
645,4867892.0,王府的水景设计真的很独特特别漂亮！,/Date(1662449977000+0800)/,0,3.804,0,0,0,0,0,0,0,0,0
646,72113557.0,很值得去的地方，不过不太适合小朋友,/Date(1662048272000+0800)/,0,0.955,0,0,0,0,0,0,0,0,0
647,1623217.0,和珅的府邸！很豪华！必打卡的地方哦,/Date(1661954253000+0800)/,0,-0.429,0,0,0,0,0,0,0,0,0
648,370520824.0,去北京的恭王府有多条线路公交车。,/Date(1668949035000+0800)/,0,2.603,0,0,0,0,0,0,0,0,0
649,98000668.0,恭王府之所以出名还和珅天下第一贪,/Date(1667723453000+0800)/,0,3.708,0,0,0,0,0,0,0,0,0
650,111942711.0,古代的王府，建筑布局很讲究，不错,/Date(1666246236000+0800)/,0,4.061,0,0,0,0,0,0,0,0,1
651,251234019.0,恭王府打卡，了解历史，以史为鉴。,/Date(1665113667000+0800)/,0,4.075,0,0,0,0,0,0,0,0,0
652,475921.0,交通还方便，整体来说环境还不错。,/Date(1664459368000+0800)/,0,4.22,0,0,0,1,0,0,0,0,0
653,201979593.0,恭王府为清代规模最大的一座王府。,/Date(1662390947000+0800)/,0,1.413,0,0,0,0,0,0,0,0,0
654,250882582.0,环境优美，人很多，来北京值得一去,/Date(1662205422000+0800)/,0,3.97,0,0,0,1,0,0,0,0,0
655,199122416.0,景区负责引导的工作人员引导的很不错，也可以免费两小时寄存行李，感觉很好！,/Date(1662029807000+0800)/,0,4.201,1,0,0,0,0,0,0,0,0
656,231966706.0,值得！可以！可以！还会再来的！！,/Date(1661920703000+0800)/,0,-2.689,0,0,0,0,0,0,0,0,0
657,284635873.0,气势雄伟壮观 保护力度非常大👌,/Date(1668665467000+0800)/,0,1.07,0,0,0,0,0,0,0,0,0
658,205792206.0,景色宜人，趣味性强，性价比高！,/Date(1667650817000+0800)/,0,4.229,0,0,0,1,0,0,1,0,0
659,55929862.0,大王府气派，皇家园林，尘封记忆,/Date(1666392760000+0800)/,0,-0.972,0,0,0,1,0,0,0,0,0
660,21879112.0,不错的地方，干净整洁，环境优美,/Date(1664285529000+0800)/,0,4.25,0,0,0,1,0,0,0,0,0
661,13059821.0,恭王府，这个应该是文物古迹了吧,/Date(1664002181000+0800)/,0,1.63,0,0,0,0,0,0,0,0,0
662,10354091.0,和珅的家，历史文化氛围非常浓厚,/Date(1661524640000+0800)/,0,4.117,0,0,0,0,0,0,0,0,0
663,66508029.0,秩序乱，讲解员也没有😡😡,/Date(1676115191000+0800)/,0,2.388,0,1,0,0,0,0,0,0,0
664,280041946.0,一般，指示牌不是很明确,/Date(1679658510000+0800)/,0,-2.935,0,0,0,0,0,0,0,0,0
665,785594.0,没有以前那种感觉了，,/Date(1677993535000+0800)/,0,-0.048,0,0,0,0,0,0,0,0,0
666,78000280.0,多少江湖事都在笑谈中,/Date(1673928367000+0800)/,0,3.685,0,0,0,0,0,0,0,0,0
667,40095236.0,大戏楼真豪华，不愧是和珅和大人，带老妈游玩，订票方便也不贵。,/Date(1665036963000+0800)/,0,3.556,0,0,0,0,0,0,1,0,0
668,355999116.0,只有走进恭王府，才能对和珅的贪婪和才华有更加深刻的认识和不一样的了解。他的聪明才智，让他三年时间就从一个赶车的侍卫变成了一品大员；他的贪婪无度，让他成为清朝第一大贪（也为清朝积蓄了财富），最终也葬送了他的性命。,/Date(1631891343000+0800)/,5,4.286,0,0,0,0,0,0,0,0,0
669,228666047.0,最好春夏秋去，北方的冬天光秃秃。,/Date(1673444564000+0800)/,1,-6.156,0,0,0,0,0,0,0,0,0
670,51942662.0,还不错，适合逛俩小时，不过我没租讲解，走马观花吧，想深度了解还是租个讲解或者请个导游。,/Date(1665062030000+0800)/,0,4.253,0,3,0,0,0,0,0,0,0
671,417948175.0,来北京必须来这边，值得推荐的一个地方，人还行，挺凉快！快来打卡吧,/Date(1664792205000+0800)/,1,4.133,0,0,0,0,0,0,0,0,0
672,328537942.0,内容丰富，景区干净，工作人员引导积极负责。,/Date(1673511811000+0800)/,0,0.65,1,0,0,0,0,0,0,0,0
673,27461151.0,听听和珅的故事，值得一去，讲解人员挺有必要,/Date(1662188368000+0800)/,0,4.241,0,1,0,0,0,0,0,0,0
674,20529448.0,恭王府曾经是和珅的府邸，建筑布局讲究，不过很多建筑都有所损坏，后来进行了重建。最精华的地方是后花园，南北方园林的特色非常明显，景观建筑亭台楼榭布局得当，值得欣赏。,/Date(1655673057000+0800)/,4,3.735,0,0,0,1,0,0,0,0,3
675,150426840.0,"正值五一期间，去转转，恭王府是一个具有历史气息的古建筑，是清代规模最大的一座王府，保存到现在还是很完整的，去那里的门票也不是很贵，只需要40元，60岁以上的只需要20元。很值得游客们过去游玩。
恭王府历经了清王朝由鼎盛而至衰亡的历史进程，承载了极其丰富的历史文化信息，故有了“一座恭王府，半部清代史”的说法。在周恩来、***和李岚清三代国务院领导人的关心下，恭王府腾退修缮工作历28年完成，使之成为当时中国唯一一座对公众开放的清代王府。",/Date(1651323637000+0800)/,2,4.286,0,0,0,0,1,0,1,0,1
676,261022220.0,这是第二次来恭王府，上一次没逛完，太累偷懒了，这次辗转反侧又来到了这里，想想象中这里会很大，逛起来其实还好，这次来的时候人也不少，虽然疫情期间，还是抵挡不住国人对恭王府的建筑向往参观，里面介绍每个馆都有历史资料详细阐述，还是很值得来一趟的，疫情期间外出游玩一定的做好防护措施,/Date(1648704883000+0800)/,0,4.263,0,0,0,0,0,0,1,0,1
677,3349318.0,"还是第一次有时间来恭王府好好逛逛。天气很好，游人也不算少。不愧是中国第一豪宅，占地面积够大，布局讲究，非常气派。整体分为府邸和花园这两部分。
到了恭王府一定要沾沾喜气，据说恭王府里有一万个福字，所以又称万福园。印象最深的是大戏楼，建筑是全封闭式的，据说扩音效果特别好。",/Date(1630056770000+0800)/,4,4.286,0,0,0,0,0,0,0,0,1
678,245593331.0,值得一去，感受一下古建筑所带来的震撼。,/Date(1664124117000+0800)/,0,3.789,0,0,0,0,0,0,0,0,1
679,13103505.0,作为一个私人宅邸私人园林，已经很好了,/Date(1663109770000+0800)/,0,-1.343,0,0,0,1,0,0,0,0,0
680,2147345.0,好久没去过恭王府了。上一次去恭王府开放的只有花园部分，现在前面也开放了。因为带了孩子，请了门口的导游，门口找的10几个一起攒的。因为是假期，园子里的人还是比较多的，最后1800元还买了个福字字帖。,/Date(1629362653000+0800)/,4,2.234,0,1,0,0,0,0,0,0,0
681,295158406.0,一开始逛府邸的部分时，还觉得不是很大。后来才知道，原来还有一个同样的花园。,/Date(1661357495000+0800)/,0,-0.306,0,0,0,0,0,0,0,0,0
682,429266.0,恭王府还是来北京旅游必须去的景点,/Date(1671788824000+0800)/,0,-2.881,0,0,0,0,0,0,0,0,0
683,47508206.0,方便，刷身份证进入即可。恭王府里真是有巧思，不愧是一个恭王府，半部清代史,/Date(1665541962000+0800)/,0,4.004,0,0,0,0,0,0,0,0,0
684,163409679.0,原来不觉得恭王府有什么特别的，听完讲解，增加了不少知识，讲解员讲得不错！,/Date(1664854635000+0800)/,0,4.285,0,2,0,0,0,0,0,0,0
685,35546121.0,和珅和恭亲王奕欣先后住过的地方。,/Date(1661435563000+0800)/,2,4.117,0,0,0,0,0,0,0,0,0
686,41569788.0,国庆期间带着小朋友亲子游，挺不错的体验，门票购买方便使用方便，给个赞,/Date(1666395840000+0800)/,0,3.997,0,0,0,0,1,0,0,0,0
687,187397774.0,很多房间都关着，展品不多。,/Date(1673572298000+0800)/,0,-7.44,0,0,0,0,0,0,0,0,0
688,200081840.0,"恭王府有几处值得参观的地方: 1.和珅建造府邸时采用的金丝楠木;2.康熙御赐的福字碑;3.府中的参天古木;4.屋脊六兽还有原始的琉璃瓦

恭王府的福字碑旁边的石头都盘出来包浆了…真是太厉害了",/Date(1622293609000+0800)/,4,-8.253,0,0,0,0,0,0,0,0,0
689,176184251.0,环境好，卫生干净，景色宜人。特别适合游玩放松心情，还特别安静！,/Date(1663563694000+0800)/,0,4.248,0,0,0,2,0,0,2,0,0
690,162545985.0,来北京两次都去，人还是挺多的，园内每个地方，每个角落都有它的故事，人太多了，疫情原因不能逗留太久，下次还是会来的。当然啦，顺便带点“福”气回去,/Date(1661925886000+0800)/,0,3.661,0,0,1,0,0,0,0,0,0
691,296946665.0,一座恭王府 半部清代史 精致 奢华 恭王府不愧是和大人府邸，富贵于言表,/Date(1661522187000+0800)/,0,4.284,0,0,0,0,0,0,0,0,0
692,369708292.0,不错，下次和朋友再去,/Date(1671786816000+0800)/,0,2.314,0,0,0,0,0,0,0,0,0
693,188874986.0,挺好的，是个旅游的好地方，人多去了好玩，大家一定要去打卡哦！,/Date(1664030699000+0800)/,0,1.766,0,0,1,0,0,0,1,0,0
694,253059937.0,"恭王府位于北京内城西北部什刹海的北岸，风水俱佳的宝地，距离南锣鼓巷，北海，景山公园，都比较近，恭王府始建于清乾隆年间，拥有两百多年的历史，是清代规模最大的也是中国现存保存最完整的一座王府建筑，它历经了清王朝由鼎盛而至衰亡的历史进程，承载了极其丰富的历史文化，故有“一座恭王府，半部清代史”的说法。恭王府第一绝：后罩楼位于府邸和花园的衔接处，111间房屋连成一排，达180多米长，后罩楼是国内王府类建筑中最长的楼，被形容为“99间半房子”，为恭王府三绝之一。第二绝：西洋门，恭王府花园又称“萃锦园”，进入园内参观，首先要经过一道汉白玉石拱门，又称西洋门。这道门并不是和坤建园子时留下的，而是恭亲王建造的。这座具有西洋建筑风格的汉白玉石拱门处于花园的中轴线上，是花园的正门。门额上外刻“静含太古”四字，内刻“秀挹恒春”四字，意为享太古之幽静，拥满园之春色，体现了深邃浑厚沉雄苍古的意境，蕴涵着道家的思想理念，据说这种门当时在北京只有3个，如今却只有此门流传下来，因此成为恭王府的一处“绝妙之笔”，堪称一绝。
第三绝：大戏楼，位于邀月台东部，占地面积约700平方米，可以容纳200余人，据说是清朝南方的官员为讨恭亲王的欢心，特聘请南方的能工巧匠精心建造的。
一宝：这块福字碑本是紫禁城的镇城之宝，老谋深算的和珅不知用何手段将其从紫禁城中偷了出来，藏于自家的山洞中，作为镇宅之宝。福字碑位于秘云洞内，福字碑是由清圣祖康熙皇帝的御笔刻成的福字碑。康熙帝书法造诣颇深，但很少题字，所以此“福”字极其珍贵。而且此福字苍劲有力、颇具气势，可分解为多田多子多才多寿，构思巧妙，堪称天下第一“福”。因此常聚集不少游客用手触摸，都希望沾点福气把福气带回家！！！
游览路线：一宫门→二宫门→多福轩→银安殿→葆光室→嘉乐堂→锡晋斋→后罩楼→西洋门→独乐峰→福池→沁秋亭→垂花门→大戏楼→蝠厅→升官发财路→邀月台→秘云洞→澄怀撷秀→秋水山房→出口
交通路线：恭王府博物馆位于北京市西城区前海西街17号。恭王府博物馆周边地区停车位极为有限，建议您选择公共交通出行乘坐地铁6号线，北海北站下车，B东北口出",/Date(1640680936000+0800)/,3,4.286,0,0,0,1,0,0,0,0,4
695,276174836.0,环境非常好，适合周末和家人一起去，大概一上午可以玩完,/Date(1663306722000+0800)/,0,4.089,0,0,0,1,0,0,1,0,0
696,206101811.0,很不错，金丝楠木一根1.8亿，要听讲解不然没意思,/Date(1668174289000+0800)/,0,4.242,0,1,0,0,0,0,0,0,0
697,250994482.0,环境及有关内容介绍都不错。只是有些关闭不能尽兴！,/Date(1663026297000+0800)/,0,3.603,0,0,0,1,0,0,0,0,0
698,2671333.0,目前保留的北京最大的王府，尤其以和珅住过闻名。,/Date(1668767329000+0800)/,0,-9.379,0,0,0,0,0,0,0,0,0
699,15162656.0,已经去过两次了，清代建筑工艺的典范，值得慢慢品,/Date(1664888452000+0800)/,0,4.275,0,0,0,0,0,0,0,0,1
700,79254620.0,得到家人的一致认可，太有成就感了，下次继续来！,/Date(1662260989000+0800)/,0,3.986,0,0,0,0,0,0,0,0,0
701,1154827.0,休闲，挺好的，，，，，，，，，，，，，，，，,/Date(1666416990000+0800)/,0,2.926,0,0,0,0,0,0,0,0,0
702,279455195.0,"【景色】来过北京很多次，没有预约上门票，这回约上了，开心
【趣味】最讲究的府邸，里面很多学问的，包括风水等，值得回味
【性价比】记得找一个电子讲解，要不看不懂里面的学问",/Date(1650700420000+0800)/,0,4.286,0,1,0,1,1,0,1,0,0
703,28940897.0,"【景色】不错！
【趣味】不错！
【性价比】高！",/Date(1668956821000+0800)/,0,4.284,0,0,0,1,0,0,1,0,0
704,117136694.0,北京值得一去的地方，摸摸大福字，粘粘福气。,/Date(1665660367000+0800)/,0,-7.359,0,0,0,0,0,0,0,0,0
705,3837133.0,北京一个比较小众的景点，有导游讲解会更好。,/Date(1664439698000+0800)/,0,3.84,0,2,0,0,0,0,0,0,0
706,3808510.0,带朋友去游玩，值得信赖，值得推荐，值得去。,/Date(1664330668000+0800)/,0,4.281,0,0,0,0,0,0,1,0,0
707,6202774.0,购票有啥可评价的 都给五分还不行 非得写几个字,/Date(1663490967000+0800)/,0,-7.758,0,0,0,0,0,0,0,0,0
708,117884809.0,恭王府，曾经大清国的豪宅，给后人留下观赏。,/Date(1663383860000+0800)/,0,4.268,0,0,0,0,0,0,0,0,0
709,1866913.0,恭亲王府原是和珅的家，最后一任主人是恭亲王爱新觉罗·奕。园内的西洋门、福字碑、室内大戏楼并称王府三绝。,/Date(1650409317000+0800)/,1,4.281,0,0,0,0,0,0,0,0,0
710,430460283.0,讲解员刘海艳值得推荐，讲解到位，态度很好,/Date(1665483191000+0800)/,0,4.285,1,2,0,0,0,0,0,0,0
711,221802606.0,景色优美！古色古香！很气派！古董多！！！,/Date(1663257261000+0800)/,0,4.266,0,0,0,1,0,0,0,0,0
712,264600734.0,花园式建筑，过去的王爷居住地，免费参观。,/Date(1661829244000+0800)/,0,1.642,0,0,0,0,0,0,0,0,1
713,81085938.0,"在交通方面，出了地铁沿着胡同走不远就到了。
这一次去租了解锁机，但是感觉用处不大，有的地方解说不出来，后来在百度地图上选择讲解功能，能可以对景点进行详细的介绍。
景点来说，还是值得参观的，有几个地方摆装的非常精美。",/Date(1660388503000+0800)/,0,3.912,0,2,0,0,0,0,0,0,0
714,3654611.0,大概是疫情限流原因，第一次看到人这么少的恭王府，懒得做地铁，从宾馆打车出来到恭王府10元钱，正好在检票口下车，超级棒！而且人少，在携程上订的门票，直接扫身份证进入，非常方便。恭王府自不必说，有时间一定要来逛一逛的✅,/Date(1658961149000+0800)/,0,-8.259,0,0,0,0,0,0,0,0,0
715,275404220.0,"横贯半个清朝历史，两位影响历史进程的主人恭王府就是这么一座皇城根下写满大清王朝历史故事的私家宅邸。
  它历经了清王朝，由鼎盛而至衰亡的历史进程，故北京人常念叨：“一座恭王府，半部清代史”。
  恭王府前半部是富丽堂皇的府邸，后半部为幽深秀丽的古典园林，总占地面积将近六万平方米！
  其府邸建筑庄重肃穆，尚朴去华，明廊通脊，气宇轩昂，仅次于帝王居住的宫室。",/Date(1658545128000+0800)/,0,4.286,0,0,0,1,0,0,0,0,1
716,27025856.0,"地铁站下来还需要走过一段胡同，交通还算方便。
恭王府是清代规模最大的一座王府建筑群，历经了清
王朝由鼎盛而至衰亡的历史进程，承载了极其丰富的
历史文化信息，故有了“一座恭王府，半部清代史”。
而恭王府之所以能历史变革中保留住，源于它的风水。恭王府位于北京水龙脉上。共有99间半屋子。有届满即溢之意。1000个福里有天下第一福的福字碑。一定要去沾沾福气。恭王府每一处钉瓦砖檐都有它的讲究。",/Date(1657183355000+0800)/,0,4.286,0,0,0,0,0,0,0,0,1
717,5118731.0,"恭王府作为大名鼎鼎的国家级5A景区，坐落在是什刹海附近，里面出乎想象得到，在携程订的门票，成人40一张，刷身份证入园。
目前保存最完整的对外开放的清代王府，由府邸和花园两部分组成，其中府邸中轴布局左右对称，汇集了南北方建筑精华；花园面积也超级大，春天的美好时节身处其中太美了。",/Date(1648884517000+0800)/,0,4.283,0,0,0,0,1,0,0,0,1
718,377639501.0,北京的5A旅游景区，祈福的胜地！我还花了25元买了个许愿牌挂在了龙王庙，工作人员还另外给我送了个福字牌项链。再走走我们就来到了密云洞前，见到了福字！然后我又进了恭王府商店里看到了天下第一福，康熙御笔！多子，多才，多田，多寿，多福！我买了几个恭王府纪念币和个天下第一福字挂件！！！来北京了恭王府有机会一定要去逛逛哦！！,/Date(1646792882000+0800)/,0,-5.898,1,0,0,0,0,0,0,0,0
719,787564.0,一座恭王府，半部清朝史。恭王府由府邸和花园两部分组成，总占地面积六万余平方米，占地3.2万余平方米的府邸为三路五进院落，建筑规模精湛而宏伟。花园占地2.8万余平方米，大于故宫御花园。我上一次来是到戏楼看京剧演出；游客排队为了摸福字。最后一张的墙是里面是空的，当年用来藏和珅收罗的各种珍宝。,/Date(1620678950000+0800)/,2,4.286,0,0,1,0,0,0,0,0,1
