,uid,comment,date,like,sorce,#服务方面#cnt,#导游方面#cnt,#人流方面#cnt,#景色方面#cnt,#价格方面#cnt,#饮食方面#cnt,#娱乐方面#cnt,#儿童方面#cnt,#设施方面#cnt
1027,6586663.0,"门内一棵槐，不是招宝就是进财。进去后先是看到银安殿，比照着故宫的金銮殿，和故宫一样的歇山顶，绿色琉璃铜瓦，无一不是亲王地位的象征。清代王府文化展现在就在这里。
嘉乐堂是神殿，比较故宫的坤宁宫，萨满教的神殿祭祀场所。2021年海棠雅集主题展就在这里。
俗说后罩楼99间半，实际上并不是。这里现在有福文化展览。祈福溯源，祈福习俗，万福之源
这里是府邸和花园的分水岭。
越走越逛越发现这里的格局之大布景之妙设计之巧，十年前来这里的时候还没有太大的感觉，就仿佛逛了一个公园，十年后再来这里，看看恭王府再看看自家的男人，不得不一巴掌拍下去：你看看别人，人家再看看你的家……唉😔
三绝的戏楼，造型到音响，营造最佳音响。装饰也是独树一帜，宫灯漂亮的不输水晶灯！旁边就是听雨轩，也就是会客厅，茶几上的扇贝呀，枣糕呀，沙琪玛呀，驴打滚啊，豌豆黄啊！原来和我们现代人零食也没差太多！
方塘水榭旁边，我发现了一些已经结了果子的花，查了一下，居然是中华猕猴桃？也不知道这个东西能不能吃。
纵然美轮美奂纵然宫深似海，也抵不过昆虫对娃的吸引力，简直是∞！",/Date(1621158031000+0800)/,0,4.286,0,0,0,1,0,0,0,0,1
1028,100682091.0,有趣好玩，景色不错，性价比高，总体超赞，和珅和大人的家果然与众不同！附近景色也很棒，就是五一期间人太多了！喜欢！！！！！,/Date(1620113501000+0800)/,0,4.286,0,0,1,2,0,0,2,0,0
1029,103758295.0,"春天里没有沙尘暴的北京真是美美哒，恭王府的海棠花美得不可方物，可惜相机拍不出来。
总体超赞，1. 内容介绍的那些文字很棒，还带图表，太方便俺这种文科渣渣了。
2. 花园比故宫的御花园美多了。
3. 厕所是我在北京见过管理最好最干净的厕所了，最差是南锣鼓巷的厕所。
4. 性价比评分给的低是相对故宫60元给的，而且60岁以上老年人居然不是免费。",/Date(1620054366000+0800)/,0,4.257,1,0,0,0,0,0,0,0,3
1030,107455405.0,北京的恭王府还是很值得一去的，了解些清末的历史。直接坐地铁方便，到北海北下，门票40元，建议一个网上购买，刷身份证进去。,/Date(1618119794000+0800)/,0,-9.202,0,0,0,0,1,0,0,0,0
1031,249273175.0,一座恭王府，半部清朝史，还真是这样，又大又阔气有讲究。佩服古人的智慧的同时，也敬佩和珅的能力。历史虽然对和珅以贬为主，但我还是觉得他值得钦佩,/Date(1617262340000+0800)/,1,4.286,0,0,0,0,0,0,0,0,0
1032,93738240.0,一直想去恭王府，终于有时间过去参观游览了，作为国内唯一现存的王府，占地面积很大，差不多走了3个小时，还有部分没有转到，了解到了很多东西，建议过去游览的时候租一个讲解器，方便更好了了解这座王府。唯一的美中不足就是现在季节不太对，夏天的时候景色应该会更好一些。,/Date(1615204321000+0800)/,0,4.273,0,1,0,1,0,0,0,0,0
1033,21217447.0,"☘️闻名遐迩的恭王府值得一去，该府曾为和珅宅邸。

☘️恭王府规模宏大，占地约6万平方米，前半部是富丽堂皇的府邸，后半部为幽深秀丽的古典园林，布局讲究，气派非凡。

☘️花园水雾漫岸，荷花垂柳，仙桥鹊路，透出一股人间仙境般的惬意和小桥流水一样的恬淡。

☘️康熙一生酷爱书法，虽然他的书法极佳，却很少题字，一字千金。康熙御书的福字碑藏在花园的假山内。游客排队摸福字，我不但摸了一下，还抓拍了一张。

☘️恭王府实在太大了，一个下午感觉逛不完，游客也络绎不绝，想要在标志性景点拍一张没有游客的照片实在太难了，只能下次再来了。",/Date(1596021689000+0800)/,4,4.286,0,0,1,1,0,0,0,0,0
1034,116582242.0,秀才说刘秀才带我们浏览了602年的故宫紫禁城，里面住了24个皇帝，给刘秀才点赞,/Date(1660461047000+0800)/,0,4.28,0,0,0,0,0,0,0,0,0
1035,33331965.0,一座恭王府，半部清朝史。喜欢历史遗迹，以史为鉴，学史明理，学史增信，学史崇德，学史力行。听了很多主播现场讲解很有趣味。,/Date(1642338195000+0800)/,0,4.286,0,1,0,0,0,0,1,0,0
1036,88346093.0,恭王府为清朝贪官和珅的***，提起和珅第一印象是富可敌国，贪得无厌。他在世的时候享尽了荣华富贵，去世后留下了自己的宅子以供后人游玩。不论别人如何看他，也许他的一生在他自己的价值观里是自洽的，是圆满的。,/Date(1626928681000+0800)/,0,4.286,0,0,0,0,0,0,1,0,0
1037,189647984.0,来的时候天气有点阴天，最好赶在有晴天的日子来，拍出的照片效果会更好，王府面积不小，花园那块景色真的不错！值得一游！,/Date(1617352205000+0800)/,0,4.24,0,0,0,1,0,0,0,0,0
1038,5946413.0,秀才说的刘导，人美声甜，历史内涵丰富，讲解细致，带两位小朋友来听得津津有味，虽以前来过多次，但今天听得最好。刚好因疫情人少，还享受了VIP待遇，超级棒！,/Date(1629878857000+0800)/,0,4.285,0,1,0,0,0,0,0,0,0
1039,292806783.0,春天百花盛开，去恭王府看到了很美的🌸🌸。四月花开阳光正好，恭王府的公益讲解员一路走一路讲，讲的小知识也很有意思，福字碑摸过了希望可以顺顺利利一整年。,/Date(1624887058000+0800)/,0,4.286,0,1,0,0,0,0,0,0,0
1040,32915510.0,恭王府在一个不太起眼的地方 如果不留意可能就滑过去了 但其实进到这里才发现一个全新的世界 世外桃源 有沉重的历史厚重感,/Date(1658838060000+0800)/,0,4.282,0,0,0,0,0,0,0,0,0
1041,9302125.0,恭王府是北京很著名的景点了，原来是和珅的旧宅，里面的建筑、归置、布局都很有讲究，很适合喜欢传统文化的人去游览。,/Date(1654993519000+0800)/,0,4.278,0,0,0,0,0,0,0,0,1
1042,87906016.0,王府真的太大了，6公顷的占地面积，转了两个多小时还没有转完，实在太累了，出来了。很是遗憾，还有好多景色都没拍到，下次一定要好好看看景色不错，总体超赞，,/Date(1622892137000+0800)/,0,4.275,0,0,0,3,0,0,0,0,0
1043,205479826.0,恭王府的布局讲究，气派非凡，这里原本是和珅的府邸，历经了清王朝由鼎盛至衰亡的历史进程，整体分为府邸和花园两部分，西洋门、大戏楼和后罩楼一定不要错过。,/Date(1647706530000+0800)/,0,4.286,0,0,0,0,0,0,0,0,0
1044,184769654.0,和珅的旧宅 经历了岁月的变迁 还能保留这么完好 也是为后人留下的宝贵财富 不建议请里面的导游讲解 最后就是为了卖东西,/Date(1627486844000+0800)/,0,4.217,0,2,0,0,0,0,0,0,0
1045,199467261.0,景色不错，有趣好玩，太好了！体会到建筑的人真伟大！给我们一个幸福的生活！感谢你们！人民永远爱你门！记得你们,/Date(1619703419000+0800)/,0,4.286,0,0,0,1,0,0,2,0,1
1046,184965983.0,最奢华的王府，值得一游,/Date(1659600019000+0800)/,0,-2.298,0,0,0,0,0,0,0,0,0
1047,217745114.0,环境非常不错，很出片，推荐想拍照的姐妹来游览。环境很考究，看出来有精心设计过，让人眼前一亮，别具一格。,/Date(1649351115000+0800)/,0,4.286,0,0,0,2,0,0,0,0,0
1048,68708711.0,特别值得一游，福字冰棍也特别吃，看到了清朝曾经的繁华和强盛！,/Date(1660696017000+0800)/,0,4.081,0,0,0,0,0,0,0,0,0
1049,85473124.0,恭王府及花园，位于北京市西城区前海西街17号，为清代规模最大的一座王府，曾先后作为和珅、永璘的宅邸。,/Date(1659628100000+0800)/,0,4.056,0,0,0,0,0,0,0,0,0
1050,53126869.0,北京著名保存完整的四合院建筑，设计轻巧，雕梁画栋，清乾隆年间贪官和珅在此居住，现为北京廉政教育基地。,/Date(1653626418000+0800)/,0,4.285,0,0,0,0,0,0,0,0,1
1051,337255555.0,这就是以前和珅住的地方，老爸如果以后赞不绝口。景色啥的还行，主要是厚重的历史沉甸甸的！距离地铁口也近，很适合家庭亲子游玩！门票也不贵就是了。,/Date(1635229645000+0800)/,0,4.284,0,0,0,1,1,0,1,0,0
1052,8139180.0,恭王府府邸虽比不上故宫宏大，但是格局规整，逛起来不算累。而且康熙爷的福字，和珅的戏楼都带着故事，逛起来很有意思。庭院设计有巧思，想苏州园林。,/Date(1629375789000+0800)/,0,4.286,0,0,0,1,0,0,0,0,0
1053,589217.0,恭王府是我国保存最完整的清代王府代表作，是我国王府文化的最高水准，恭王府顾名思义是恭亲王奕忻居住过的地方，最早的主人是和珅，恭亲王只不过是第三代主人，和珅被嘉庆皇帝打到后，恭王府给了其胞弟僖亲王永璘，所以历史学家曾评价说，一座恭王府，半部清朝史。这里拍摄过宰相刘罗锅，雍正王朝和还珠格格。恭王府名声很大，这座北京最大的四合院位于后海边上，门票40元。,/Date(1588294588000+0800)/,3,4.286,0,0,0,0,1,0,0,0,0
1054,26475540.0,值得期待哦，景色宜人美不美 池中水。能感受到不一样的感觉。乾隆皇帝赐的福在假山里。园中走一走心情舒畅，可以带孩子父母一起来参观旅游。孩子喜欢老人更喜欢💕。一家人一起开心游园涨知识,/Date(1660884976000+0800)/,0,4.286,0,0,0,1,0,0,0,0,0
1055,20928016.0,恭王府位于北京市西城区前海西街，乾隆年间，和珅奉旨建府，咸丰皇帝将此府邸赐予恭亲王，故得名恭王府。,/Date(1656605934000+0800)/,0,4.214,0,0,0,0,0,0,0,0,0
1056,986686.0,乘着中秋放假前，工作日来到恭王府游览，果然人少，乾隆皇帝的福字居中，带来节前的祝福，恭王府的房屋布局，充分体现了中国建筑风水学，堪称宝地。,/Date(1632274549000+0800)/,0,4.278,0,0,0,0,0,0,0,0,1
1057,1890911.0,恭王府，原名“和第”，1776年前后，清朝军机大臣和珅相中了一块四周萦水，遥接西山，而且又离“皇上家”不远的风水宝地，遂以高价购买下这里的多处房产，建造成了这大名鼎鼎的豪华宅第。,/Date(1629159396000+0800)/,0,3.447,0,0,0,0,0,0,0,0,0
1058,59437937.0,景色不错，性价比高，门票40元，走进清代王府建筑，感受历史变迁，喜欢红楼梦的朋友还会发现意外之喜。,/Date(1620924562000+0800)/,0,4.286,0,0,0,1,1,0,0,0,1
1059,111563281.0,景色不错，总体超赞，有趣好玩，庭院是真大 性价比高，春夏季去玩应该不错。现在都是发芽阶段 花草还没有,/Date(1615904719000+0800)/,0,4.286,0,0,0,1,0,0,3,0,0
1060,13403419.0,王府，一般般吧，没什么特别的地方吗？,/Date(1676298809000+0800)/,1,-8.257,0,0,0,0,0,0,0,0,0
1061,51184543.0,一个恭王府，半部清朝史，恭王府地处什刹海附近，周围风景很好，胡同小巷很多，饮食丰富。到北京旅行，到恭王府了解王府文化，名人故居很有意义。,/Date(1626442234000+0800)/,0,4.286,0,0,0,1,0,1,0,0,0
1062,234217206.0,真是气派，想想住在这真是一种享受呀。不知道古人当时的心态，在那个等级分化严重的时期那些人怎么生活,/Date(1618180041000+0800)/,0,4.27,0,0,0,0,0,0,0,0,0
1063,1890911.0,恭王府不愧是三个大臣居住过的，其府邸建筑庄重肃穆，气宇轩昂，萃锦园则衔水环山，古树参天，曲廊亭榭，富丽天然，实为中国园林建筑的典范。是北方园林景观的代表作品，与江南园林有得一比,/Date(1591146115000+0800)/,4,4.278,0,0,0,3,0,0,0,0,2
1064,218767104.0,恭王府是某个皇帝的儿子居住在此，后来和坤也在此居住过。,/Date(1653266139000+0800)/,2,-4.032,0,0,0,0,0,0,0,1,0
1065,221267670.0,恭王府是北京建地面积最大，规格最豪华的一座王府，府内格局和设施基本保存完好，每一个景点都有历史典故，很适合带着家人朋友们一起来参观祈福，是北京绝佳的景点。,/Date(1625534618000+0800)/,1,4.259,0,0,0,0,0,0,0,0,1
1066,247917897.0,邀请导游听一些故事会更有意思些，自己观看不过是一片房子而已，不如去故宫天坛颐和园，票价更划算。,/Date(1625357025000+0800)/,0,4.162,0,1,0,0,0,0,0,0,0
1067,2938532.0,在东路多福轩门口看到宣传“恭王府博物馆”的官方微信公众号，***以后里面有各处的语音讲解，根本不需要花30元钱再租用讲解器了，特别方便！,/Date(1619245772000+0800)/,2,3.869,0,2,0,0,0,0,0,0,0
1068,394371949.0,这里环境景色宜人是人们旅游度假娱乐度假娱乐度假娱乐度假娱乐度假娱乐度假娱乐度假娱乐度假好地方,/Date(1658492408000+0800)/,0,4.114,0,0,0,2,0,0,7,0,0
1069,275309234.0,"【景色】不错，保存的比较完好
【趣味】听说挺灵的，具体啥灵，分人
【性价比】还可以，北京必看景点",/Date(1657949084000+0800)/,0,4.283,0,0,0,1,0,0,1,0,0
1070,811591.0,这里值得一游。常常觉得有点奇怪汉族被满人征服然后满人比汉族还要讲究汉族的规矩。豪华可见一斑。,/Date(1651145715000+0800)/,0,-0.597,0,0,0,0,0,0,0,0,0
1071,261203720.0,推荐大家早晨来早点 人少特别安静 王府园区不大 相比较而言 可以很快浏览完毕。挺美挺好玩的。后花园景色不错。这种景点吧房屋其实都是千篇一律的,/Date(1632077475000+0800)/,0,4.274,0,0,0,1,0,0,1,0,0
1072,45384781.0,景色秀丽，建筑设计和家具风格非常漂亮古朴，值得一看。,/Date(1622201074000+0800)/,0,4.281,0,0,0,1,0,0,0,0,1
1073,44481055.0,感觉非常值得一去，有句话说的好“一座恭王府，半部清朝史”。毕竟现在能参观的王府不是很多，，，,/Date(1620521133000+0800)/,0,4.216,0,0,0,0,0,0,0,0,0
1074,47250719.0,交通方便，味道不错，服务态度很好，下次有机会再去一次，就是建议大家一家子最好一起活动，有什么看法和意见可以一起出来，免得众口难调。,/Date(1661146215000+0800)/,0,2.104,2,0,0,0,0,0,0,0,0
1075,222421895.0,里面还是挺大的，可以体会古建筑的雄伟，了解古人的故事，夏天去的话湖里会有荷花，应该会更漂亮,/Date(1640494522000+0800)/,0,4.037,0,0,0,0,0,0,0,0,1
1076,8345994.0,和珅王府，可可爱爱，一看就是个对江南式庭院痴迷的人，到处都是假假的山，潇湘竹，还有满堂荷叶,/Date(1633873569000+0800)/,0,4.275,0,0,0,0,0,0,0,0,0
1077,151124711.0,曾经的世界首富庭院，如今普通人也可以进去参观，看过和中堂的画像总不由自主的和王刚老师对比😓，有意思的是，不管自己是否有信仰，大家都去摸那个天下第一福总体超赞，性价比高，,/Date(1620368224000+0800)/,0,4.286,0,0,0,0,0,0,0,0,0
1078,46253046.0,很典型的王宫风格，历史感很强，有富丽堂皇的感觉，值得去体验一下下，感受过去王府官员的风范,/Date(1659516370000+0800)/,0,3.466,0,0,0,0,0,0,0,0,0
1079,81444931.0,适合找导游讲解…一个人玩发现不了有趣的东西哈…只会胡乱跑…不知道哪里是值得玩的…哪里又发生过什么历史事件…建筑物的由来和历史背景,/Date(1659093026000+0800)/,0,4.277,0,2,0,0,0,0,3,0,1
1080,54615591.0,恭王府，在柳荫街旁，是和珅府邸，里面环境好，更有很多故事，福字更有含义，很不错的园林花园,/Date(1634885595000+0800)/,0,4.283,0,0,0,2,0,0,0,0,0
1081,13660467.0,带着孩子来的，走走看看听听，三个人逛起来不累，听讲解器讲解，有时候也偶尔可以听到讲解员讲故事，基本差不多，很值得逛一次，处处有风景，如果是我一个人来，应该会逛得很久一点,/Date(1627902853000+0800)/,0,4.286,0,3,0,1,0,0,0,0,0
1082,176539479.0,恭王府周一周二闭馆，平时有志愿者带领讲解，讲得非常好，进门时可以问一下时间，本来只是简单逛一下，在志愿者带领下参观了两个多小时。,/Date(1627825953000+0800)/,0,-9.607,0,1,0,0,0,0,0,0,0
1083,187414744.0,性价比高，总体超赞，有趣好玩，景色不错，价格还算实惠，了解中国历史是每个中国公民的义务！,/Date(1619014597000+0800)/,0,4.286,0,0,0,1,1,0,2,0,0
1084,35299796.0,恭王府，北京知名景点之一，紧邻北海公园，传说晚上闹鬼哦……有机会来北京一定记得去看看！,/Date(1649303488000+0800)/,0,4.225,0,0,0,1,0,0,0,0,0
1085,63674300.0,购票方便快捷，震撼人的智慧设计和财富积累，一注哦园林很美丽，建议带着欣赏的眼光参观，否则会心生贪婪，干扰出游目的，发现美的眼界,/Date(1639438588000+0800)/,0,4.286,0,0,0,1,0,0,0,0,0
1086,193677497.0,没有讲解员或者租用讲解设备，就是有点走马观花。很大，走了挺久，基本都走了一下。其中有个像进山洞，摸福字的地方，我建议就不去排队了。真的就是排了长队，摸了一下就完事了。,/Date(1634639806000+0800)/,0,4.261,0,2,1,0,0,0,0,0,1
1087,175447746.0,到北京后时间关系选择的第一站。让我惊叹到北京文化。一下子喜欢上北京了。整个行程开心😃,/Date(1622820769000+0800)/,0,4.174,0,0,0,0,0,0,0,0,0
1088,5335899.0,北京的恭王府是我在北京众多景点里特别挑选的 位置方便 意义深刻 在繁忙的行程中去走走 很值得,/Date(1660106237000+0800)/,0,4.281,0,0,0,0,0,0,0,0,0
1089,40335391.0,历史故事很有意思，和珅的电视剧看了很多，这次来他的家看看，很有意义，买了冰箱贴和纪念品，导游服务态度也很好，还会再来旅游的。,/Date(1656313490000+0800)/,0,4.269,2,1,0,0,0,0,0,0,0
1090,230868303.0,景区是保存最完整的古代官员府邸，有较高历史和中华传统古建筑价值，服务人员态度很给力！,/Date(1631501865000+0800)/,0,4.276,2,0,0,0,0,0,0,0,1
1091,227334770.0,对得起价格，景色不错，值得一游，对得起价格，景色不错，值得一游对得起价格，景色不错，值得一游对得起价格，景色不错，值得一游,/Date(1632927154000+0800)/,0,4.286,0,0,0,4,4,0,0,0,0
1092,31943488.0,一部清代史，半部恭王府，带孩子学习历史的好地方。拍古装汉服也很不错，抓住假期的尾巴来学习历史文化，来怕古装汉服照片，清净。,/Date(1630283842000+0800)/,0,4.279,0,0,0,0,0,0,0,0,0
1093,296218413.0,高大上的旅游景点之一！伟大的祖国！伟大的首都！伟大的人民！我们热爱生活！热爱祖国！遍览祖国大好山河！继承祖先优秀传统！耶！,/Date(1625268907000+0800)/,0,4.286,0,0,0,0,0,0,0,0,0
1094,75157538.0,非常不错，值得一看，就是人太多了，旅游团非常多，恭王府里边景色不错，花园很大，看天下第一福要排队，每个人只能隔着玻璃摸一下,/Date(1621147787000+0800)/,0,4.235,0,0,2,1,0,0,0,0,0
1095,39793295.0,景色不错，总体超赞，请了导游讲解，边走边看边听，既了解了历史又欣赏了美景，一举两得。看到了福字摸到了福，相信会把福气带回家,/Date(1620565320000+0800)/,0,4.286,0,2,0,2,0,0,0,0,0
1096,309939629.0,值得一去，景色不错。恭王府非常大，一般逛三个小时就可以了，听导游讲解挺有意思。恭王府是必去打卡点，有趣好玩，不过人挺多的。,/Date(1619443367000+0800)/,0,4.286,0,2,0,1,0,0,2,0,0
1097,114542820.0,交通方便，环境优雅，酒店环境整洁，房间布局堪称完美，优雅又不失情调，服务周到，让人无比舒心。给我营造了一种家的感觉，无论大处到小处都是那么无懈可击，价格也很合理。,/Date(1617772457000+0800)/,0,4.286,0,0,0,1,1,0,0,0,0
1098,84339302.0,冬天过去湖面都结冰了，别有一番风味，人也不多，到处拍拍照没有人头抢镜很不错，不过就是太冷了太冷了太冷了，走一圈冻得脚疼😂,/Date(1615868643000+0800)/,0,-8.651,0,0,0,0,0,0,0,0,0
1099,67016534.0,低评价和景区无关，实在太多人，在门口犹如春运，既然要管理预约那么为什么不做好限流。很多老人和小孩要注意安全隐患？？？？！,/Date(1674888875000+0800)/,0,-9.957,1,0,0,0,0,0,0,1,0
1100,339131319.0,清朝规模最大的一座王府，位于北京市西城区，全国重点文物保护单位，国家5A级景区。,/Date(1660142055000+0800)/,0,3.948,0,0,0,0,0,0,0,0,0
1101,57289554.0,这里原来是和坤的宅邸，是清代规模最大的王府。恭王府历经了清王朝由鼎盛而至衰亡的历史进程，承载了极其丰富的历史文化信息，故有了“一座恭王府，半部清代史”的说法。其府邸建筑庄重肃穆，尚朴去华，明廊通脊，气宇轩昂，仅次于帝王居住的宫室。府后的萃锦园则衔水环山，古树参天，曲廊亭榭，富丽天然；其间景致之变化无常，开合有致，实为中国园林建筑的典范。,/Date(1634802348000+0800)/,0,4.285,0,0,0,1,0,0,0,0,2
1102,7933925.0,恭王府，位于北京市西城区柳荫街，为全国重点文物保护单位，中国国家一级博物馆，国家AAAAA级旅游景区，是清代规模最大的一座王府建筑群，曾先后作为清乾隆时期权臣和珅、清嘉庆时期庆僖亲王爱新觉罗·永璘的宅邸，咸丰元年（1851年）清廷赐封此宅邸于恭亲王爱新觉罗·奕欣，恭王府的名称也因此得来。,/Date(1634399544000+0800)/,0,4.286,0,0,0,0,0,0,0,0,1
1103,105317905.0,确实要听导游讲解才有意思，了解半部清代史！到了恭王府一定要请一幅天下第一福回家！,/Date(1633252638000+0800)/,0,3.7,0,2,0,0,0,0,0,0,0
1104,271022940.0,"开封市旅游资源非常丰富，有大宋王朝的深厚历史底蕴。我们慕名而来，收获满满。在开封府和清明上河园玩得很尽兴。看点多多，惊喜不断。我很兴奋，特别是晚上清明上河园里的演出更是令人心动。非常值得观看。
导游林林讲解细致，知识丰富。给导游点赞👍。",/Date(1631777823000+0800)/,0,4.286,0,3,0,0,0,0,1,0,0
1105,109520980.0,恭王府对面的稻香村不要去买，是坑店，100块三包的，里面只有表面看到的几包，还用胶带固定，全是吸塑泡壳，总共不超过10包,/Date(1627783228000+0800)/,0,-9.999,0,0,0,0,0,0,0,0,0
1106,27048297.0,"恭王府（Prince Kung&#39;s Mansion），位于北京市西城区柳荫街，为全国重点文物保护单位，中国国家一级博物馆，国家AAAAA级旅游景区，是清代规模最大的一座王府建筑群，曾先后作为清乾隆时期权臣和珅、清嘉庆时期庆僖亲王爱新觉罗·永璘的宅邸，咸丰元年（1851年）清廷赐封此宅邸于恭亲王爱新觉罗·奕訢，恭王府的名称也因此得来。
恭王府规模宏大，总占地面积6万平方米，分为府邸和花园两部分，拥有各式建筑群落30多处，历经了清王朝由鼎盛而至衰亡的历史进程，承载了极其丰富的历史文化信息，故有了“一座恭王府，半部清代史”的说法。",/Date(1625981016000+0800)/,0,4.286,0,0,0,0,0,0,0,0,2
1107,107901608.0,历史上的和珅，大家都知道，这个货的家，用现在的话说是太奢侈了，皇帝有的他有，皇帝没有的他也有，人才啊，这个府邸，我从进去到出来，没有三个小时你出不来，可想而知得多大，也不得不佩服他的魄力。大家没来过的可以去看看，来北京一是天安门，二是故宫，三是恭王府,/Date(1623227135000+0800)/,0,3.103,0,0,0,0,0,0,0,0,0
1108,42511864.0,这是第三次去恭王府了，正所谓一座恭王府，半部清朝史，王府历代主人中最出名的当属和珅了，王府很大很气派，后花园的部分比故宫的御花园还要大，其中最出名的当属后花园的福字碑了，为康熙御笔，一定要摸一下沾沾福气。其实清朝王爷们挺可怜的，虽然位高权重但不能出北京城。恭王府是北京必游景点之一，门票40元，略有小贵。,/Date(1622973123000+0800)/,0,4.286,0,0,0,0,1,0,0,0,0
1109,120359268.0,别人家就是大。面积挺大的，游玩的人也挺多，逛的挺累的！有很多历史文化知识科普，不了解的和带小朋友的可以学习一下。最好不要带婴儿和婴儿车，王府门槛比较好，每次都得抬着婴儿车。有个男的一个人太，还挺不方便的，我还给搭了把手。景色不错，,/Date(1621167493000+0800)/,0,4.286,0,0,0,1,0,0,1,0,0
1110,68028807.0,"【景色】恭王府（Prince Kung&#39;s Mansion），位于北京市西城区柳荫街，为全国重点文物保护单位，中国国家一级博物馆，国家AAAAA级旅游景区，是清代规模最大的一座王府建筑群，曾先后作为清乾隆时期权臣和珅、清嘉庆时期庆僖亲王爱新觉罗·永璘的宅邸，咸丰元年（1851年）清廷赐封此宅邸于恭亲王爱新觉罗·奕訢，恭王府的名称也因此得来。[1][2]

恭王府规模宏大，总占地面积6万平方米，分为府邸和花园两部分，拥有各式建筑群落30多处，历经了清王朝由鼎盛而至衰亡的历史进程，承载了极其丰富的历史文化信息，故有了“一座恭王府，半部清代史”的说法。",/Date(1620646588000+0800)/,0,4.286,0,0,0,1,0,0,0,0,2
