,uid,comment,date,like,sorce,#服务方面#cnt,#导游方面#cnt,#人流方面#cnt,#景色方面#cnt,#价格方面#cnt,#饮食方面#cnt,#娱乐方面#cnt,#儿童方面#cnt,#设施方面#cnt
1755,172544717.0,景色超美，引人入胜。众所周知，恭王府是大贪官和珅宅邸。乾隆四十年前后，在皇帝面红得发的和珅，相中了这块四周萦水，遥接西山，又离皇上不远的水宝，遂以高价购买下这里的多处房，建造成大名鼎鼎的“和第”。前半部是富丽堂皇的府邸，后半为幽深秀丽的古典林，总占地面积将近六万平方米。的确是大得可以！如果全都走到了，绝对一万步开外！如果没有导览图，绝对会迷路！大戏楼是最棒的所在，不容错,/Date(1604544596000+0800)/,0,4.286,0,0,0,1,0,0,0,0,0
1756,258550446.0,"非常值得一去的地方,故事好听景真的不错，很震撼。古人当时纯手工制作的一些东西，画的画，雕刻的石头真的能让人感受到我们中华民族的智慧，和技艺的精湛。房子的格局数量，物件摆放的位置都是非常有讲究的。在封建王朝下，既不触犯天子，也能显示出自己的高贵，充分感受到古人对礼仪的重视不禁感叹到我们现在把老祖宗传下来的东西没有传承下去的遗憾景色不错，有趣好玩，性价比高，总体超赞，",/Date(1603962593000+0800)/,0,4.286,0,0,0,1,0,0,2,0,0
1757,284355189.0,值得推荐，最好是跟导游一起边游园边听讲解，否则真的不知道园子里的建筑有啥意义或者来头。而且有的景点居然没看见，也是转晕了。不过里面的精致真的不错，故宫没约上的可以先来恭王府逛逛。游完恭王府可以再到后海转转，晚上在后海边上吃吃饭，泡泡吧还是蛮惬意的。,/Date(1602951976000+0800)/,0,4.286,0,2,0,0,0,1,0,0,1
1758,51080841.0,恭王府（Prince kung&#39;s Mansion）是清代规模最大的一座王府建筑群，曾先后作为清乾隆时期权臣和珅、嘉庆时期庆僖亲王永璘和清末恭亲王奕訢的府邸，恭王府的名称也因此得来。恭王府规模宏大，分为府邸和花园两部分，历经了清王朝由鼎盛而至衰亡的历史进程，承载了极其丰富的历史文化信息，故有了“一座恭王府，半部清代史”的说法。,/Date(1598937055000+0800)/,4,4.286,0,0,0,0,0,0,0,0,1
1759,1212655.0,"“一座恭王府，半部清代史”
恭王府位于北京的风水宝地什刹海地区，占地6万多平方米，有“99间半”之称的后罩楼拦腰将之隔为府邸和花园。
在王府、贝勒府扎堆的前后海，恭王府以其富丽而被称作“城中第一佳山水”，都说堪比故宫的府邸，确实值得一来。
Tips：
1）恭王府的热度确实很高，人流非常多，建议尽量避开周末节假日高峰。
2）周一闭关不开放。
3）可提前下载电子版介绍，或者扫码加入恭王府官微，可现场收听各个景点介绍，也有详细地图，很方便",/Date(1588235087000+0800)/,0,4.286,0,0,0,0,0,0,0,0,0
1760,37269493.0,外地来京可以来此旅游，有很多熟悉的场景,/Date(1660741635000+0800)/,0,-0.842,0,0,0,0,0,0,0,0,0
1761,31329328.0,老牌经典经典，十年前来过一次，故地重游,/Date(1659838258000+0800)/,0,3.795,0,0,0,0,0,0,0,0,0
1762,74444762.0,挺好的，看看人家咋**这么多钱的，不还主人还没事呢，这都是大智慧，建议各地官员学习学习，前车之鉴，爱国爱民，别****,/Date(1659633245000+0800)/,0,4.189,0,0,0,0,0,0,0,0,0
1763,38205383.0,这个地上，仅次于北京紫禁城。真是不错！,/Date(1655394866000+0800)/,0,0.811,0,0,0,0,0,0,0,0,0
1764,2822076.0,确实很好的地方，有文化有历史，提醒大家尽量不要上手，保护历史，给子孙留点东西。,/Date(1630920156000+0800)/,0,4.218,0,0,0,0,0,0,0,0,0
1765,796745.0,吕玉明导游的讲解非常细致、全面。值得大家选择他带领的行程。,/Date(1626318244000+0800)/,1,4.083,0,2,0,0,0,0,0,0,0
1766,219518237.0,出票迅速操作简单，刷身份证入园也很方便，难得的园林景观，很赞。还在携程订了本次旅程的长城和高铁，服务都很到位，这点必须表扬携程，服务可能是国内相关行业最好的了,/Date(1624351018000+0800)/,0,4.261,2,0,0,1,0,0,0,0,0
1767,7502693.0,"恭王府，和珅的府邸，

【性价比】值得一去",/Date(1620271095000+0800)/,0,3.815,0,0,0,0,0,0,0,0,0
1768,222680442.0,这个地方值得一去看看，交通非常便利。,/Date(1652447440000+0800)/,0,3.728,0,0,0,0,0,0,0,0,0
1769,31597801.0,疫情期间，但人还是很多，了解一下历史,/Date(1652424539000+0800)/,0,1.721,0,0,0,0,0,0,0,0,0
1770,23228959.0,以前是和珅的府邸，建筑工程宏伟壮观。,/Date(1646054004000+0800)/,0,2.101,0,0,0,0,0,0,0,0,1
1771,6508139.0,恭王府依然只保持在原来的风貌，可以来这里参观游览，了解了一下当年的那段历史。,/Date(1641778834000+0800)/,0,4.272,0,0,0,0,0,0,0,0,0
1772,2329188.0,和绅府第，去得比较匆忙，但老妈觉得挺好，下次还要三人，说是要玩一天，慢慢看。,/Date(1624277327000+0800)/,0,-2.472,0,0,0,0,0,0,1,0,0
1773,329215049.0,周末去人挺多的，很多导游讲解，我也顺便听了一下下，收获很多知识！买了个属相！景色不错，性价比高，总体超赞，有趣好玩，,/Date(1623043038000+0800)/,0,4.286,0,2,0,1,0,0,2,0,0
1774,120111557.0,中国唯一一个保存完整的王府，值得一看,/Date(1622017956000+0800)/,0,2.113,0,0,0,0,0,0,0,0,0
1775,60339688.0,恭王府还是值得一去的，这里是清朝和珅的故居。园子里景色宜人，和珅在里面藏了很多的宝贝。还有里面康熙大帝提的福字。福字景色不错，有趣好玩，总体超赞，寓意深奥。,/Date(1620693393000+0800)/,0,4.286,0,0,0,2,0,0,2,0,0
1776,91208212.0,恭王府还是比较保存完整开发的，可惜这次忘了租讲解器，带的小老太太出行对历史文化不太了解，但她也对里面的建筑和布局感觉非常美😂景色不错，总体超赞，性价比高，,/Date(1619771734000+0800)/,0,4.286,0,1,0,1,0,0,0,0,1
1777,14214459.0,"【景色】很漂亮
【趣味】一定要带讲解，没有讲解少了一大半乐趣
【性价比】价格合理",/Date(1616025681000+0800)/,0,4.286,0,2,0,1,1,0,1,0,0
1778,7351630.0,高官府邸旧日繁华似锦，今日游人如织,/Date(1659828600000+0800)/,0,2.478,0,0,0,0,0,0,0,0,0
1779,157532354.0,北京恭王府一定要去的，和珅的老宅！,/Date(1658895690000+0800)/,0,-6.208,0,0,0,0,0,0,0,0,0
1780,1154827.0,景色不错，，，，，，，，，，，，，,/Date(1658299002000+0800)/,0,3.982,0,0,0,1,0,0,0,0,0
1781,6709480.0,皇家园林，保存完整，面积很大，不错,/Date(1654830623000+0800)/,0,2.637,0,0,0,1,0,0,0,0,0
1782,31099184.0,导游有点少，游客不是很多，在这很好,/Date(1653120797000+0800)/,0,-4.55,0,1,0,0,0,0,0,0,0
1783,,地理位置挺好的，周边环境也挺好的！,/Date(1652889366000+0800)/,0,4.219,0,0,0,1,0,0,0,0,0
1784,157532354.0,和珅曾经的府邸，三绝一宝名不虚传！,/Date(1651807338000+0800)/,0,3.107,0,0,0,0,0,0,0,0,0
1785,76257813.0,不错很有气势，建筑很气派，战地很大,/Date(1648222195000+0800)/,0,4.24,0,0,0,0,0,0,0,0,1
1786,6508139.0,恭王府，很多影视剧当中都有王府的建筑，来这里看看当年真正的王府建筑特色吧。,/Date(1641220621000+0800)/,0,-0.631,0,0,0,0,0,0,0,0,2
1787,60751854.0,国家重点文物保护单位，为清代规模最大的一座王府。先后作为和珅，永璘的宅邸，1988年，恭王府花园对外开放。2008年恭王府从府邸修缮工程后，全面对外开放。,/Date(1638762231000+0800)/,0,4.033,0,0,0,0,0,0,0,0,0
1788,6377788.0,景色不错，性价比高，总体超赞，推荐,/Date(1622600667000+0800)/,0,4.285,0,0,0,1,0,0,0,0,0
1789,49222640.0,质量非常好，客服态度非常非常赞，有问题及时给解决了完美，产品很惊艳，性价比合适，希望用的长久！😃大品牌！值得信赖！效果超级好！贵有贵的道理！很棒的商品！,/Date(1620127474000+0800)/,0,4.286,2,0,0,0,0,0,0,0,0
1790,213519290.0,来的是恭王府，了解的却是和珅的前世今生，由衷感叹一句，和珅真不愧是大贪官，府邸富丽堂皇，建筑巧夺天工，真令人赞叹。总体超赞，性价比高，有趣好玩，景色不错，,/Date(1619952967000+0800)/,0,4.286,0,0,0,1,0,0,2,0,1
1791,76654336.0,这个季节的景色不错哦。建议租讲解器,/Date(1618477976000+0800)/,0,4.078,0,1,0,1,0,0,0,0,0
1792,165852411.0,这里值得游览，只是最后一排房子有人把守只让导游带着的人参观，不让本地散客进，没有参观到，比较遗憾！对你们表示不满，提出意见！希望改进。,/Date(1618385714000+0800)/,1,-4.593,0,1,0,0,0,0,0,0,0
1793,61480236.0,5A级景区，春天去景色伊人，前府后园，别有洞天。五近院落，三绝一宝，江南花园，大气磅礴，有皇家之气。有些是后罩楼和福字，看看和坤和恭亲王的住所，不负此行。,/Date(1617557217000+0800)/,0,3.222,0,0,0,1,0,0,0,0,0
1794,38205383.0,感觉是北京市区内除了故宫，必去的地方之一。北京景区票价都不高，去过两次了。,/Date(1615335927000+0800)/,0,0.817,0,0,0,0,0,0,0,0,0
1795,35359894.0,北京市的著名景点，欢迎大家来玩。,/Date(1659915645000+0800)/,0,0.567,0,0,0,0,0,0,1,0,0
1796,53764213.0,里面真得很大，绕来绕去都快绕晕了,/Date(1657852582000+0800)/,0,-9.748,0,0,0,0,0,0,0,0,0
1797,264600734.0,周边环境不错，到底是王爷的王府。,/Date(1652347907000+0800)/,0,-0.14,0,0,0,1,0,0,0,0,0
1798,235653029.0,恭王府在北京西城区，保存非常漂亮,/Date(1648645268000+0800)/,0,2.614,0,0,0,0,0,0,0,0,0
1799,6709480.0,和珅以前的府邸，非常完整，有特色,/Date(1646618698000+0800)/,0,2.601,0,0,0,0,0,0,0,0,0
1800,167714258.0,非常漂亮的府邸，里面还有介绍清史的厅，文创店，而且门票随买随退当天买票就行，特别方便。地理位置还很好，旁边就是南锣鼓巷什刹海，游玩都在一条路线，非常推荐,/Date(1642677797000+0800)/,0,4.269,0,0,0,0,1,0,1,0,0
1801,269138071.0,权倾朝野的恭亲王府邸，太值得了！,/Date(1642155830000+0800)/,0,4.185,0,0,0,0,0,0,0,0,0
1802,250794144.0,美丽壮观精致的和坤宅院，值得一去,/Date(1631006278000+0800)/,2,4.211,0,0,0,0,0,0,0,0,0
1803,45587401.0,很有历史教育意义的一个景点，会让你对和珅有更加全面的认识。里面很多展馆，墙上会有好多文字的内容会让人收获很多。需要耐心去阅读。从不同人的描述去认识和珅。,/Date(1626337489000+0800)/,0,4.284,0,0,0,0,0,0,0,0,0
1804,340121968.0,到处都能闻到金钱的味道……好地方,/Date(1626259484000+0800)/,0,-6.607,0,0,0,0,0,0,0,0,0
1805,197262458.0,超级值得去，虽然里面不是很大，但是超级富有的感觉!皇宫的都不一定比不上！,/Date(1626191704000+0800)/,0,2.832,0,0,0,0,0,0,0,0,0
1806,18198767.0,排队等进园的时候，招呼对面的小商店老板买了根冰棍和一瓶矿泉水，好像才5元。冰棍很好吃。。。园区不算太大，建筑的很不错，参观一下还是可以的。地铁可以直达。,/Date(1625981532000+0800)/,0,-9.945,0,0,1,0,0,1,0,0,1
1807,82614275.0,一座恭王府，半部清朝史，值得一看,/Date(1625484338000+0800)/,0,4.224,0,0,0,0,0,0,0,0,0
1808,226998158.0,清代著名的王府宫邸，非常大，非常壮观，值得游览，可以了解学习清朝的历史哦,/Date(1623680852000+0800)/,0,4.286,0,0,0,0,0,0,0,0,0
1809,7155619.0,和珅的府邸果真不同凡响，四九城除了故宫和颐和园，应该就数恭王府有排面了，值得一看。而且取票什么的都很方便，不要排队，就说节假日人多了点，但是这也没办法。,/Date(1623123303000+0800)/,0,-0.136,0,0,2,0,0,0,0,0,0
1810,20243989.0,占地之广，好大，都快赶上故宫了哟有趣好玩，性价比高，景色不错，总体超赞，,/Date(1621519091000+0800)/,0,4.286,0,0,0,1,0,0,2,0,0
1811,176433801.0,走进恭王府，不仅感叹古代皇亲贵族的气派建筑，也领略了名门王族的历史文化，走在偌大的庭院，听着讲解还是能让人浮想联翩的，喜欢历史的朋友，还是可以去逛逛的。,/Date(1621221358000+0800)/,0,4.286,0,1,0,0,0,0,0,0,1
1812,78558653.0,在体验过颐和园和故宫之后，整体体验显得较为一般了，进去之后属于走马观花一般的游览了，没有太多能让你留下脚步的地方。但如果你没有玩其他景点，确实值得一去。,/Date(1620940475000+0800)/,0,4.273,0,0,0,0,0,0,1,0,0
1813,625549.0,跟以前相比，改了很多，新修了好多,/Date(1619231494000+0800)/,0,-2.418,0,0,0,0,0,0,0,0,0
1814,23245480.0,和珅真有钱，我也体验了一把和珅的生活！！！性价比高，总体超赞，有趣好玩，,/Date(1615988307000+0800)/,0,4.283,0,0,0,0,0,0,2,0,0
1815,108546307.0,携程买片很方便，带着身份证就可以入园，方便快捷。进去之后好玩的地方不少，最吸引我的地方是介绍“福”字由来，起源，寓意等等，两个人一起玩悠哉一下午很舒服。,/Date(1615034012000+0800)/,0,3.89,0,0,0,0,0,0,2,0,0
1816,357116926.0,你好，问一下，没去不给退钱吗？由于时间不够用了，没去上，为什么不给退钱,/Date(1677813585000+0800)/,0,-9.997,0,0,0,0,0,0,0,0,0
1817,22779113.0,暑假人好多，路口的交通越来越堵,/Date(1660530462000+0800)/,0,3.892,0,0,0,0,0,0,0,0,0
1818,300992864.0,恭王府的景色非常优美，适合约会,/Date(1660488960000+0800)/,0,4.048,0,0,0,1,0,0,0,0,0
1819,8865913.0,非常棒的景点，文化底蕴丰富无比,/Date(1660111431000+0800)/,0,4.223,0,0,0,0,0,0,0,0,0
1820,400386044.0,很多游客非常热衷的北京著名景点,/Date(1658713106000+0800)/,0,3.685,0,0,0,0,0,0,0,0,0
1821,3999921.0,环境不错，很有历史底蕴的地方。,/Date(1658154196000+0800)/,0,4.242,0,0,0,1,0,0,0,0,0
1822,6024436.0,值得一看的选择地方，不错的地方,/Date(1657959335000+0800)/,0,3.596,0,0,0,0,0,0,0,0,0
1823,235653029.0,恭王府非常漂亮值得一看，不错。,/Date(1657722524000+0800)/,0,4.219,0,0,0,0,0,0,0,0,0
1824,150898050.0,非常有名的皇家府邸，挺大的呢。,/Date(1657552622000+0800)/,0,-5.461,0,0,0,0,0,0,0,0,0
1825,279344104.0,很有历史性和文化性，很值得观赏,/Date(1655121432000+0800)/,0,4.28,0,0,0,0,0,0,0,0,0
1826,65544672.0,值得一去看看的选择地方，不错的,/Date(1654678135000+0800)/,0,3.61,0,0,0,0,0,0,0,0,0
1827,231966706.0,可以！要得！值得！会再来一次！,/Date(1653310669000+0800)/,0,-0.931,0,0,0,0,0,0,0,0,0
1828,194771501.0,购票跟方便快捷，很值得去的地方,/Date(1650813514000+0800)/,0,0.002,0,0,0,0,0,0,0,0,0
1829,150898050.0,非常有名的北京的王府啊，挺大的,/Date(1649581836000+0800)/,0,-2.439,0,0,0,0,0,0,0,0,0
1830,163649092.0,景色还不错的，建议可以去玩一玩,/Date(1640221180000+0800)/,0,4.148,0,0,0,1,0,0,2,0,0
1831,17305631.0,遗憾，疫情期间园内不提供导游。,/Date(1638546299000+0800)/,0,-4.606,0,1,0,0,0,0,0,0,0
1832,12507119.0,无论什么时候过去，一步步探索，一点点深入了解，真是个充满各种故事的地方,/Date(1627055322000+0800)/,0,4.217,0,0,0,0,0,0,0,0,0
1833,162702321.0,来北京旅游，必须要去的景点之一,/Date(1623466312000+0800)/,0,-3.577,0,0,0,0,0,0,0,0,0
1834,56439119.0,总体超赞，有趣好玩，景色不错，,/Date(1623074485000+0800)/,0,4.285,0,0,0,1,0,0,2,0,0
1835,308599508.0,和珅故居，地处龙脉，聚财福地！,/Date(1622623863000+0800)/,0,-2.477,0,0,0,0,0,0,0,0,0
1836,1915104.0,很有故事，请个讲解你就明白了。,/Date(1622618209000+0800)/,0,4.13,0,1,0,0,0,0,0,0,0
1837,180839327.0,个人觉得很值得去的一个地方。,/Date(1660981850000+0800)/,0,2.709,0,0,0,0,0,0,0,0,0
1838,256137410.0,景色不错，方便快捷，非常好用,/Date(1660829943000+0800)/,0,4.023,0,0,0,1,0,0,0,0,0
1839,113923527.0,思绪万千，清政府瓦解的见证！,/Date(1659826214000+0800)/,0,4.133,0,0,0,0,0,0,0,0,0
1840,223337376.0,还可以吧，妈妈妻子儿子来玩。,/Date(1658495884000+0800)/,0,4.066,0,0,0,0,0,0,1,1,0
1841,10574476.0,很好，填补了我的一个旅游空白,/Date(1655948053000+0800)/,0,2.668,0,0,0,0,0,0,0,0,0
1842,170942501.0,园子很大，很豪华，逛睡着了。,/Date(1652855902000+0800)/,0,1.898,0,0,0,0,0,0,0,0,0
1843,37194175.0,进门租了讲解器，信号跟不上，边逛边看景色很好，但是对历史信息了解不够,/Date(1651334203000+0800)/,0,4.038,0,1,0,1,0,0,0,0,0
1844,50151531.0,不愧为中国代表性的清代建筑。,/Date(1649150633000+0800)/,0,4.274,0,0,0,0,0,0,0,0,1
1845,183550806.0,除了讲解不太走心，别的都很好,/Date(1648302571000+0800)/,0,3.333,0,1,0,0,0,0,0,0,0
1846,13529598.0,值得一去，请个讲解会更有意思,/Date(1646371499000+0800)/,0,4.245,0,1,0,0,0,0,0,0,0
1847,37992332.0,人生，过的不是心情，而是心态,/Date(1646349334000+0800)/,0,2.685,0,0,0,0,0,0,0,0,0
1848,222318782.0,恭王府，北京必打卡地。周边很大，可以逛很久，推荐做黄包车，每个地方都走到了，谅解有很到位，如果步行估计走不了太远很累。不是第一次来了，说不出的情怀。,/Date(1626881425000+0800)/,0,4.13,0,0,0,0,0,0,0,0,0
1849,64358332.0,恭王府是之前和珅的官邸，非常大气和漂亮，来北京必须要打卡的景点之一。,/Date(1624075368000+0800)/,0,4.18,0,0,0,0,0,0,0,0,0
1850,184535677.0,北京打车可能真的很贵，我打了5公里的车，花了35块钱，下次一定坐地铁，就跟普通的公园一样，没啥特别的乐趣，一般吧！可以陪老人来！景色一般，有待改进，,/Date(1618750990000+0800)/,0,4.199,0,0,0,2,0,0,0,0,0
1851,284418896.0,带着孩子去玩的，恭王府以前是和珅的府邸，感觉很大，孩子玩的很开心😃,/Date(1618561972000+0800)/,0,4.241,0,0,0,0,0,0,2,0,0
1852,41346406.0,出差空闲去的景点。值得一去,/Date(1653225365000+0800)/,0,3.723,0,0,0,0,0,0,0,0,0
1853,68712515.0,值得游览，虽然到访过很多次,/Date(1648116069000+0800)/,0,1.866,0,0,0,0,0,0,0,0,0
1854,4849628.0,可以，租个讲解器可能会更好,/Date(1634977509000+0800)/,0,3.574,0,1,0,0,0,0,0,0,0
1855,30825068.0,经典的景区，经典的福字，去过好几趟了，就是奔着康熙大帝的福字来了。,/Date(1634352122000+0800)/,0,4.269,0,0,0,0,0,0,0,0,0
1856,58353816.0,恭王府，一个太监居住的房子，可以大的超乎你想像,/Date(1626600995000+0800)/,1,-2.917,0,0,0,0,0,0,0,0,0
1857,50229851.0,纵横清朝历史，文化的传承，“福”字的神奇魅力，非常不错的历史博物馆,/Date(1625149384000+0800)/,0,4.286,0,0,0,0,0,0,0,0,0
1858,47401943.0,没等到人工的讲解，只能够租个电子讲解，缺乏了一点生动性，但是孩子玩打卡游戏也很起劲，康熙的福字是至宝，吧福气带回家，给自己、家人、国家都带来好运！,/Date(1621091954000+0800)/,0,4.286,0,2,0,0,0,0,1,0,0
1859,286849436.0,总体超赞，景色不错，性价比高，有趣好玩，很棒，值得一去，目前人不多,/Date(1617893427000+0800)/,0,4.286,0,0,1,1,0,0,2,0,0
1860,59651334.0,景色不错，值得推荐，体验很好，有趣好玩，整体感觉很好，和大人不是一般的有实力，这大宅子让他修的，要不然恭亲王咋么就能那么羡慕？和大人真不是一般人！,/Date(1600609660000+0800)/,2,4.286,0,0,0,1,0,0,2,0,0
1861,190303786.0,讲真的：服务一般，环境最差，票价最高，还不如外面的自然风光景色。,/Date(1679121968000+0800)/,0,2.419,1,0,0,3,0,0,0,0,0
1862,222181494.0,很不错，买了两幅幅字画。,/Date(1661253183000+0800)/,0,2.813,0,0,0,0,0,0,0,0,0
1863,116191714.0,郭导游很认真，讲得很详细,/Date(1660376962000+0800)/,0,3.404,0,1,0,0,0,0,0,0,0
1864,24800226.0,非节假日 游客较少 体验不错,/Date(1660265201000+0800)/,0,3.321,0,0,0,0,0,0,0,0,0
1865,23757379.0,游客太多了 人挤人感觉一般,/Date(1660110479000+0800)/,0,-4.839,0,0,0,0,0,0,0,0,0
1866,84885519.0,这里真好看   一定要来吧！！,/Date(1659275905000+0800)/,0,-2.85,0,0,0,1,0,0,0,0,0
1867,182095681.0,很不错的经历，玩得很开心,/Date(1658926941000+0800)/,0,4.205,0,0,0,0,0,0,1,0,0
1868,94224979.0,建筑布局讲究，富有特色。,/Date(1658061152000+0800)/,0,3.2,0,0,0,0,0,0,0,0,1
1869,172733899.0,很好很值得去的一个景点！,/Date(1657465842000+0800)/,0,3.814,0,0,0,0,0,0,0,0,0
1870,20456387.0,取票方便快捷，非常满意。,/Date(1656428869000+0800)/,0,-5.648,0,0,0,0,0,0,0,0,0
1871,335264172.0,可以去逛逛，最好配个导游,/Date(1653614337000+0800)/,0,0.523,0,1,0,0,0,0,0,0,0
1872,120797383.0,一座恭王府，半部清代史。,/Date(1650982831000+0800)/,0,-2.141,0,0,0,0,0,0,0,0,0
1873,3207951.0,富可敌国的和珅老家必须去,/Date(1649823462000+0800)/,0,0.581,0,0,0,0,0,0,0,0,0
1874,173378010.0,了解一下清朝的一些历史。,/Date(1648841213000+0800)/,0,4.119,0,0,0,0,0,0,0,0,0
1875,60162583.0,网上预定，出行还是很方便,/Date(1645880642000+0800)/,0,-2.693,0,0,0,0,0,0,0,0,0
1876,16736185.0,去过一次了，这次和家人一起去的，人少参观的更细致些，感觉很好👍,/Date(1640887857000+0800)/,0,3.493,0,0,0,0,0,0,0,0,0
1877,40344710.0,一处历史文化名胜古迹，留给我们后人很多关于清朝的历史故事和文化。,/Date(1635958079000+0800)/,0,4.285,0,0,0,0,0,0,0,0,0
1878,2053546.0,在后海一带逛着逛着就离恭王府不远了， 买票入场感受一下王府的奢华。,/Date(1635131550000+0800)/,0,-6.909,0,0,0,0,0,0,0,0,0
1879,172942961.0,和珅和恭亲王府邸，汉白玉大门的后花园，足足是故宫御花园的两倍多。,/Date(1633791382000+0800)/,0,3.856,0,0,0,0,0,0,0,0,0
1880,104863083.0,如果说故宫可比作为一大家闺秀，那恭王府就是小家碧玉。但小家碧玉不是说不够气派，而是恭王府就是私宅。很讲究，很玄学的设计和建筑。很适合旅游去逛逛！,/Date(1632402238000+0800)/,0,4.286,0,0,0,0,0,0,0,0,1
1881,33415968.0,恭王府，值得带家人来逛逛,/Date(1628644373000+0800)/,0,3.975,0,0,0,0,0,0,0,0,0
1882,23342098.0,明清建筑典范，值得一看。,/Date(1625819024000+0800)/,0,3.497,0,0,0,0,0,0,0,0,1
1883,34793391.0,对风水学感兴趣的朋友可以去恭王府看一看，恭王府就是所谓的风水宝地，院落布局、庭院、花园里的湖等处处都有不同的寓意。游玩之后确实感觉恭王府是福院。,/Date(1624711487000+0800)/,0,4.286,0,0,0,0,0,0,1,0,0
1884,38205383.0,感觉是除了北京故宫，最应该去的。王府的巅峰。,/Date(1623339768000+0800)/,1,2.649,0,0,0,0,0,0,0,0,0
1885,21412001.0,有讲解知道不少知识。感受与现代不同的感觉。下次可以带孩子来一趟。,/Date(1622978280000+0800)/,0,4.27,0,1,0,0,0,0,0,0,0
1886,70994561.0,过年期间带父母去的，园子很大，景致也不错，就是人多了点，不过值得一去。我们还带回了一个福字，寓意很好，准备春暖花开后再去一次，挑个人少的时候去啊,/Date(1620392022000+0800)/,0,4.286,0,0,1,0,0,0,0,0,0
1887,11778217.0,五一期间，带孩子来北京旅游，预定的下午场，3点到仍排队进，时间还好。福字碑，长长的排队队伍，但是每人都很快，时间长还好。总之比预想的排队时间短。,/Date(1619976731000+0800)/,0,2.387,0,0,3,0,0,0,0,0,0
1888,237154806.0,非常值得一去，要了解清朝历史、建筑、人文必须到恭王府。福字、福地、福到了......,/Date(1606296279000+0800)/,1,4.282,0,0,0,0,0,0,0,0,1
1889,26784578.0,很不错，洗手间满分💯,/Date(1660913759000+0800)/,0,2.121,0,0,0,0,0,0,0,0,1
1890,402756128.0,司机师傅服务非常周到。,/Date(1660427262000+0800)/,0,-1.221,1,0,0,0,0,0,0,0,0
1891,1606258.0,蛮值的，有的看，可以去,/Date(1660404664000+0800)/,0,-3.418,0,0,0,0,0,0,0,0,0
1892,245419664.0,景色宜人，值得去的地方,/Date(1659942225000+0800)/,0,3.815,0,0,0,1,0,0,0,0,0
1893,77654899.0,可以一去，但是比较单一,/Date(1659622217000+0800)/,0,-3.424,0,0,0,0,0,0,0,0,0
1894,410480913.0,太惊艳于院子里的的奇绝,/Date(1659079761000+0800)/,0,2.224,0,0,0,0,0,0,0,0,0
1895,1080770.0,忙里偷闲，感觉穿越一样,/Date(1652203886000+0800)/,0,-0.585,0,0,0,0,0,0,0,0,0
1896,,学习一下中国历史挺好的,/Date(1649830172000+0800)/,0,4.234,0,0,0,0,0,0,0,0,0
1897,52818729.0,一座恭王府，半部清朝史,/Date(1649355191000+0800)/,0,4.071,0,0,0,0,0,0,0,0,0
1898,186247143.0,12年重整营业，内部的景观和历史信息非常不错，京城王府的精品。,/Date(1644891912000+0800)/,0,1.19,0,0,0,0,0,0,0,0,0
1899,115098449.0,价格堪比故宫，但确实值得一去！最好找讲解员讲解一下，故事太多！,/Date(1641636229000+0800)/,0,4.284,0,2,0,0,1,0,0,0,0
1900,300560992.0,来北京必须要打卡的景点,/Date(1639407899000+0800)/,0,-2.429,0,0,0,0,0,0,0,0,0
1901,218609809.0,还是值得一逛的……推荐,/Date(1639316093000+0800)/,0,3.416,0,0,0,0,0,0,0,0,0
1902,91516290.0,很有底蕴的地方，里面有很多讲解。记得是六月份去的，也不会很热。,/Date(1639232399000+0800)/,0,4.23,0,1,0,0,0,0,0,0,0
1903,7946451.0,恭王府比起故宫真的小太多太多，但是门票却是它的一半，有点不值。,/Date(1634998135000+0800)/,0,-2.323,0,0,0,0,1,0,0,0,0
