,uid,comment,date,like,sorce,#服务方面#cnt,#导游方面#cnt,#人流方面#cnt,#景色方面#cnt,#价格方面#cnt,#饮食方面#cnt,#娱乐方面#cnt,#儿童方面#cnt,#设施方面#cnt
1344,66665772.0,"南锣鼓巷是一条胡同，位于北京中轴线东侧的交道口地区，北起鼓楼东大街，南至平安大街，宽8米，全长787米，与元大都同期建成。是北京最古老的街区之一，至今已有740多年的历史。也位列规划中的25片旧城保护区之中。因其地势中间高、南北低，如一驼背人，故名罗锅巷。到了清朝，乾隆十五年(1750年)绘制的《京城全图》改称南锣鼓巷。

它是北京最古老的街区之一，是我国唯一完整保存着元代胡同院落肌理、规模最大、品级最高、资源最丰富的棋盘式传统民居区，也是最赋有老北京风情的街巷。周边胡同里各种形制的府邸、宅院多姿多彩，厚重深邃。南锣鼓巷及周边区域曾是元大都的市中心，明清时期则更是一处大富大贵之地，这里的街街巷巷挤满了达官显贵，王府豪庭数不胜数，直到清王朝覆灭后，南锣鼓巷的繁华也跟着慢慢落幕。

2016年4月25日，南锣鼓巷暂停接待旅游团队，并取消国家3A级景区资质。",/Date(1571457739000+0800)/,1,4.286,0,0,0,0,0,0,0,0,0
1345,171315704.0,值得去的地方，非常有老北京风味，美食随处可见，但是要吃到好的还是要去小巷里自己找，纪念品非常多，还有黄包车夫带你去后海玩，人有点多，总体还好,/Date(1525089641000+0800)/,0,4.281,0,0,0,0,0,1,1,0,0
1346,33309428.0,"南锣鼓巷简直商业到不行。与中国其他地方的小吃街没什么大不同。‍♀️很是失望--可谓是不来后悔来了更后悔
但是可以由南锣鼓巷这条街向四处发散 寻找小胡同里的京味儿 ‍♀️值得一提的是网红店：文宇奶酪 确实好吃",/Date(1500306530000+0800)/,3,4.183,0,0,0,0,0,2,0,0,0
1347,4821899.0,说实话，同质化的东西太多，没有特点，成了祖国各地商品大荟萃,/Date(1598506690000+0800)/,2,-7.722,0,0,0,0,0,0,0,0,0
1348,20343788.0,再游南锣鼓巷，由于到达的时间较晚，所有的商铺都开始营业了，人气十分旺盛，不像我上次是一早过来的，还拍到了较为空旷的小巷风景照。南锣鼓巷曾经是不少名人的居住地，人文气息浓厚，现在也是知名度颇高的名巷。,/Date(1567308089000+0800)/,1,3.684,0,0,0,1,0,0,0,0,0
1349,62675251.0,很有风趣的一条主街，胡同里各色小吃需要你慢慢寻觅，这里绝对满足味蕾的同时大饱眼福，非常适合情侣旅游,/Date(1490514481000+0800)/,2,2.003,0,0,0,0,0,1,0,0,0
1350,62337747.0,"各种小吃、小店很多，东西平均来讲也不贵，虽然谈不上什么风景，不过去逛逛还是挺不错的。
人也挺多，在有的店里买东西需要排队。
话说可百尼尼那家店的香草味马卡龙好好吃！！印象挺深的。",/Date(1468676969000+0800)/,4,4.251,0,0,1,1,0,2,0,0,0
1351,393917.0,值得去，是一个很少能够看到的事事在在的意见老北京。保留了很多原来的风貌。有各种风味美食可以品尝，既有原来历史上就有的，也有后来引进的，种类繁多，值得去看看。,/Date(1509524803000+0800)/,5,4.285,0,0,0,0,0,1,0,0,0
1352,5496152.0,和后海以及烟袋斜街都在一起，可以顺道一起游览。有几条地铁线直达，交通绝对方便。走在胡同里，喝着老酸奶，北京味十足啊！清晨的南锣鼓巷最美。,/Date(1505286571000+0800)/,4,4.286,0,0,0,0,0,1,0,0,0
1353,814188.0,中国唯一保存着的最富有北京特色的街巷。位于北京中轴线东侧的交道口地区。北起鼓楼东大街，南到平安大街，长不到800米，宽8米。至今有700多年历史。街两边王府豪宅很多。值得一游。,/Date(1488291244000+0800)/,2,3.006,0,0,0,0,0,0,0,0,0
1354,44039954.0,真的是吃货的天堂！ 文艺青年的聚集地  不过记得备好钱包出发！,/Date(1445956542000+0800)/,0,4.252,0,0,0,0,0,0,0,0,0
1355,1439822.0,北京城那么大，找小吃不容易？就来南锣鼓巷吧，搭个地铁或者公交就可以快速达到目的，而且车费很便宜。这里南北小吃都有，是吃货爱来的聚散地！想吃啥都可以尽情享受，不多说了，吃起来吧,/Date(1499725402000+0800)/,2,4.285,0,0,0,0,0,2,0,0,0
1356,38783394.0,"南锣鼓巷新近整修的，整个里巷干净整洁。游人特别多，有特色的东西很多，小吃，小玩具,，别具特色小店铺。当然还有两边古朴的建筑，这里是很多名人的故居，有的建筑还保存完好可以参观。",/Date(1488262181000+0800)/,2,4.286,0,0,0,0,0,1,1,0,2
1357,1188519.0,锣鼓巷是北京最古老的街区之一，整条街文艺气息都很浓厚，找美食，找主题书店，餐吧都很容易，街上还能淘到一些有特色的小玩意，非常值得一去！,/Date(1445927571000+0800)/,4,4.276,0,0,0,0,0,1,1,0,0
1358,7933925.0,南锣鼓巷，既有老北京的特色胡洞文化和地道的老北京小吃，又有涌入的外来文化和国外美食，这两者完美融合让来这里参观游玩的游人们一起体会。,/Date(1573917111000+0800)/,0,4.284,0,0,0,0,0,2,1,0,0
1359,30940497.0,各种小吃，小小古迹，玩具纪念品应有尽有，游人如织，给儿子买的拼装积木，给媳妇买的杯子，个人买的烤鸭…等等，感觉不错，下次带媳妇一起去,/Date(1535727010000+0800)/,0,2.519,0,0,0,0,0,1,1,1,0
1360,1529681.0,纯粹就是看看北京的老建筑吧，除了南锣鼓巷这条主路人比较多，其他的支路人都还是比较少，总体感觉一般般，就是一条条破旧的小路，房门开着的，里面都是破烂的小院子，就像回到了。,/Date(1566475800000+0800)/,2,-7.561,0,0,0,0,0,0,0,0,1
1361,32590051.0,南锣铜巷是北京东城区一条近年开放的古街，它北起鼓楼东大街，整个街道呈蜈蚣状，南至地安门大街，巷中有许多名人故居和达官贵人的府坻。,/Date(1513982092000+0800)/,2,3.271,0,0,0,0,0,0,0,0,0
1362,965225.0,南锣鼓巷成鱼刺形。南锣鼓巷为中心骨，沿街都是具有地方特色的小店铺包括北京烤鸭，吹糖人，炸酱面以及传统手工工艺品。两边刺骨都是胡同，包括齐白石等名人古居，具有老北京风貌。,/Date(1506494075000+0800)/,2,4.159,0,0,0,0,0,0,0,0,0
1363,48398068.0,可以的，来走走，各类小吃小玩意都有，来北京来逛逛,/Date(1495602630000+0800)/,4,2.921,0,0,0,0,0,1,1,0,0
1364,81359011.0,非常热闹的地方，很多人慕名而来，至于是否值得，就是不一样的感觉啦！,/Date(1600250194000+0800)/,1,-2.904,0,0,0,0,0,0,0,0,0
1365,5564757.0,友人推荐，携女友逛鼓巷，下午游人如织，不畏烈日，兴致勃勃，边聊边逛。既有传统的民族文化，又有现代时尚小店，老少皆宜，物品丰富。,/Date(1535016997000+0800)/,0,4.158,0,0,0,0,0,0,0,0,0
1366,27764765.0,南锣鼓巷很有意思的胡同，位于北京中轴线东侧的交道口地区，北起鼓楼东大街，南至平安大街，宽8米，全长787米，于元大都同期建成。,/Date(1502672978000+0800)/,2,-0.946,0,0,0,0,0,0,0,0,0
1367,4260283.0,南锣鼓巷这里真的人山人海啊，这里本来是北京最著名的胡同现在已经商业化的很厉害了啊，已经是到处都是小商店但是来玩玩还是不错的。,/Date(1577531611000+0800)/,0,4.248,0,0,1,0,0,0,2,0,0
1368,248151958.0,胡同不长，好吃的很多。有特色的也很多。东西不算贵。附近超市，价格很实在。周围胡同里住宿也不贵，出行方便，真的不错。强烈推荐！,/Date(1570806069000+0800)/,0,2.817,0,0,0,0,1,1,0,0,0
1369,198061436.0,每个城市都有那么一条街，南锣鼓巷很有江南巷子的感觉，店面装修的都很漂亮很文艺，有很多卖吃的的地方还有卖很多纪念品小玩意儿的店,/Date(1540816727000+0800)/,0,4.228,0,0,0,0,0,0,1,0,0
1370,19733585.0,南锣鼓巷，我觉得来北京必到的地方之一，老北京的味道，有京胡同，北京炸酱面，还有黄包车，而且人流也是不少的，就在故宫附近，乱打乱撞，18分钟就可以步行到我们祖国的故宫,/Date(1472193021000+0800)/,2,4.255,0,0,0,0,0,0,0,0,0
1371,6175020.0,好玩又好吃的地方，暖暖的文艺范儿，值得一去哟,/Date(1452499312000+0800)/,0,4.268,0,0,0,0,0,1,1,0,0
1372,897521.0,尝诺我们的北京或者上海也有租用旗袍的商店，在什刹海的大街小巷也会出现很多身穿旗袍的各色女士徜徉在街头，也是一个风景不是吗？,/Date(1541130192000+0800)/,0,3.91,0,0,0,1,0,0,0,0,0
1373,113310412.0,南锣鼓巷是商业步行街，四通八达胡同，有很多食品店和饭店，各种各样美味食品，吃东西很方便，早上我去了恭王府参观，出来搭地铁到南锣鼓巷一个站很方便。南锣鼓巷里面还有中央戏剧学院也可以看。,/Date(1530080526000+0800)/,1,4.286,0,0,0,0,0,0,0,0,0
1374,6163901.0,去一次就可以了，有些胡同没必要去看，门口好多三轮黄包车，忽悠你说带你逛胡同，反正我们是没有坐。如果在前门大街和南锣鼓巷之前选择，建议来这里吧！,/Date(1518272828000+0800)/,3,-9.927,0,0,0,0,0,0,0,0,0
1375,49867477.0,南锣鼓巷蛮热闹的，而且连结各个巷弄，巷内的店家很多，蛮有北京特色的，购物，吃东西都很方便，景色也还不错，适合出行逛逛，推荐,/Date(1511633633000+0800)/,4,4.286,0,0,0,1,0,0,0,0,0
1376,14991005.0,夜游南锣鼓巷，天气很好，就是太冷了太冷了太冷了。一定要多穿衣服，买吃的都要排队，人都很多。现在这条街维修，所以有很多铁门。,/Date(1484401965000+0800)/,6,-9.378,0,0,1,0,0,0,0,0,0
1377,66930428.0,南锣鼓巷已经是一条非常有名的胡同了，因为中央戏剧学院的存在，给这条街增色不少，这是年轻时尚人群喜欢流连的场所。该过年了，喜庆的装扮又给这条街增添了浓浓新年气息。,/Date(1579573911000+0800)/,0,4.286,0,0,0,0,0,0,0,0,0
1378,36218441.0,就是一条比较有京味的街道，牌坊可是很显眼，两边都是商铺，游客比较多，本地人基本很少，街道比较拥堵，都跟着三轮车抢道，街道曾经是达官显贵的居所，现在也是大门紧闭了，白天和晚上是不一样的景色，小玩意挺多的，随便看看也是比较有意思。,/Date(1572579903000+0800)/,0,4.224,0,0,0,1,0,0,1,0,0
1379,214620465.0,充分感受老北京胡同文化，各个胡同穿梭其中就像迷宫一样，走了一万多步感觉只是个皮毛，各色小吃一应俱全，老北京的、西式的、网红的也夹杂其中，让人应接不暇，只是我在吃上面比较挑剔，没敢吃什么东西，进了一个糖果店给女儿买了礼物，心情不错的！,/Date(1569498536000+0800)/,0,4.286,0,0,0,0,0,1,0,1,0
1380,195852267.0,南锣鼓巷，北京打卡景区，人很多，很热闹各种小吃，个人觉得文宇奶酪味道不错，没有很浓的香料味道，奶味纯正，喜欢，咂摸的面条和豌豆黄不如想像中好吃，没有我大沈阳的面条好吃，但是价格不菲呀。老北京的胡同很多，还有很多住家呢,/Date(1563966178000+0800)/,4,4.284,0,0,0,0,1,3,0,0,0
1381,4546661.0,南锣鼓巷是北京有名的巷子，在携程攻略上看到介绍就去了，十分的热闹啊，晚上9点多店铺还生意兴旺，一路逛吃的节奏，甚是开心啊,/Date(1551858147000+0800)/,0,4.21,0,0,0,0,0,0,0,0,0
1382,102785630.0,南锣鼓巷是一条胡同，位于北京中轴线东侧的交道口地区，北起鼓楼东大街，南至平安大街，宽8米，全长787米，于元大都同期建成。是北京最古老的街区之一，已有740多年的历史。今天的南锣鼓巷特别热闹，人来人往，人气旺旺啊！,/Date(1546666933000+0800)/,0,4.218,0,0,0,0,0,0,0,0,0
1383,3221963.0,"这次客栈就在南锣鼓巷里
客栈接机直接穿越到胡同里面
客栈出门就是这条商业气氛浓烈的街道
有句话说的对
凡是有旋转土豆和轰炸大鱿鱼的地方
就一定是条商业街了
两侧都是买买买吃吃吃的铺子
卖土特产和纪念品的小店
基本上每晚回客栈都会溜达一圈
看看吃吃买买
巷子的起头就是地铁站
每晚都是游人如织",/Date(1544943419000+0800)/,0,-9.998,0,0,0,0,0,0,0,0,0
1384,46567140.0,每次都去这，它是北京最古老的街区之一，是我国唯一完整保存着元代胡同院落肌理、规模最大、品级最高、资源最丰富的棋盘式传统民居区，也是最赋有老北京风情的街巷。周边胡同里各种形制的府邸、宅院多姿多彩，厚重深邃。南锣鼓巷及周边区域曾是元大都的市中心，明清时期则更是一处大富大贵之地，这里的街街巷巷挤满了达官显贵，王府豪庭数不胜数，直到清王朝覆灭后，南锣鼓巷的繁华也跟着慢慢落幕。,/Date(1543050005000+0800)/,0,4.286,0,0,0,0,0,0,0,0,0
1385,179493196.0,大晚上的太想逛街于是去了南锣鼓巷-.-今天人超多，整条街都是行人，很有过节的气氛^O^这里商品很多让人看的眼花缭乱会忍不住想买，而且除了吃其他东西都不不太贵。唯一让我有点失望的是好多游客吃完的竹签和餐盒纸巾什么都乱扔，环卫工人门在挤满了人的巷子里艰难的清扫垃圾，希望游客们能长点心别乱扔垃圾了，万分感谢,/Date(1538574215000+0800)/,0,-9.994,0,0,0,0,0,1,0,0,0
1386,86720650.0,"出地铁南锣鼓巷站口，稍微一转，就来到了传说已久的南锣鼓巷，两边是传统的北京民居，中间较为宽阔的街道，构成了南锣鼓巷的主体风貌。
        步行街的内容似乎都是千篇一律，免不了被各色的商业气氛极致渲染，南锣鼓巷也未能免俗，只不过两侧向里面延伸的街道里，老住户们早已习以为常，摆动着手中的蒲扇，戏说家长里短。",/Date(1531897940000+0800)/,0,4.286,0,0,0,0,0,0,0,0,0
1387,39839280.0,南锣鼓巷，名不虚传～很喜欢～携程推荐的小吃基本都去吃了^ω^,/Date(1528369630000+0800)/,3,4.174,0,0,0,0,0,1,0,0,0
1388,33394928.0,久闻此巷大名，终于在周日抽出时间逛了一下。或许在南方生活多年，安徽、浙江的古镇古村去的多了，古街巷走的多了，对于50开外的老人家来说，真心不觉得此巷有多么的有意思。商业气氛过浓，像僧王府那几个四合院均铁锁把门，有人居住的四合院又不好意思打扰，无法欣赏四合院之美，那也就是无特色的仿旧小街。当然对谈情说爱的年轻人另当别论，可以进入街边小店吃喝及买些小东西！,/Date(1515663951000+0800)/,2,4.286,0,0,0,0,0,1,0,0,0
1389,3223733.0,北京市一处人气很高的历史古巷。北起鼓楼东大街，南至平安大街，宽8米，全长约800米，至今已有740多年的历史。因其地势中间高、南北低，如一驼背人，故名罗锅巷，到了清朝乾隆改称南锣鼓巷。我走了整条街，现在都是商铺和酒吧，夜晚许多驻唱歌手在此献艺，这就是“北漂”的真实写照。这里是最赋有老北京风情的街巷。明清时期则更是一处大富大贵之地，这里的街街巷巷挤满了达官显贵，王府豪庭数不胜数，直到清王朝覆灭后。所以要体验老北京民情，来这里没错的。,/Date(1512354671000+0800)/,4,4.286,0,0,0,0,0,0,0,0,0
1390,95121746.0,"人满为患，上火车前临时去的，只是走马观花了一下，胡同都是大同小异，跟当地人聊天，得知其实，想吃正宗的小吃，这里其实是没有的，地铁A,B口出，其实，其实过马路就到对面了，因为看了地图要在D口出以为近一些，结果在地铁站里面转了几个圈……",/Date(1503221075000+0800)/,2,3.558,0,0,0,0,0,1,0,0,0
1391,84716566.0,去年第一次去的时候，还没有被要求整改。这次去商家明显少了很多，还有很多在装修出兑。有很多店铺撤出了，不过一些网红店还是很多人排队。推荐吃尼积小栈面包，10元一个，相对不贵，又很好吃。灌汤包看着好玩，吃着很普通，皮也很厚。建议错峰出行，虽然整改，游客还是不少。有的店铺要在十点后开店，比如文宇奶酪店。,/Date(1492078126000+0800)/,4,-9.78,0,0,1,0,0,1,1,0,0
1392,18186698.0,恰好住的酒店附近6号地铁一车到达南锣鼓巷出了地铁口不足百米就是小巷入口巷子不算很长但是纵穿嘞若干有名的胡同儿让巷子名气大增像是帽儿胡同菊儿胡同等等巷子中间的胡同里还坐落嘞中央戏剧学院文宇奶酪都一处老北京炸酱面,/Date(1489819022000+0800)/,2,4.212,0,0,0,0,0,0,0,0,0
1393,32316747.0,"我们来看看趙宝宝在南锣鼓巷吃的小吃吧||||图一：血糯米糕，蘸着白砂糖还蛮好吃的， 全进去我肚子里图二：年糕，味道很不错，辣辣的好吃图三：爆肚，因我不吃牛肉，所以没有去品尝，听姐姐说味道一般般图四：冰糖葫芦，在决定去北京后，我几乎天天都想着北京的冰糖葫芦，嘻嘻
小时候吃的一些小零食，现在老贵了。图一：牛蛙面，炒鸡好吃，姐妹三个吃一碗，很快就消灭光光图二：串串（味道一般般）",/Date(1461774394000+0800)/,0,4.271,0,0,0,0,0,4,0,0,0
1394,15858453.0,"其实北京我来过好几次了，每次都想去锣鼓巷，可是每次都是因为时间不够，就去不上了，这次一定要专程看看！一出地铁站，那人，乌央乌央的，瞬间就有了旅游景区的感觉！可是我们实在不喜欢这样的感觉，于是乎，钻进了胡同，还偶遇到老北京人讲解四合院宅子的故事。
这个四合院，乍一看，感觉好像挺普通的，就只有两个门当，这个门当是很有讲究的呢，是可以看出这户的官员等级，两个门当的找两个门当的，这样才是门当户对，不然就是高攀或者下嫁。还有上面的雕刻，也都是富有意义的，图中手指的上方三幅图都各有寓意，只记得中间的图意思是马上封侯（老爷骑着马，后面跟着个仆人，前面是个猴子，所以取名为“马上封侯”），这个宅子绝对是低调奢华有内涵！
路上我们还遇到很多像这种老北京人讲解的都会驻足停下听一听（虽然记不全，哈哈，但是听着很有意思的）
南锣鼓巷里有很多条胡同，每条胡同都有自己的故事，也有很多特别小资的那种青旅，非常有feel！",/Date(1459183231000+0800)/,0,4.286,0,2,0,0,0,0,0,0,0
1395,28645610.0,"南锣鼓巷是一条胡同，是北京最古老的街区之一。这里是我来的最多的地方，人口密度相当大。不过平时的晚上来到，会相对安静清闲。我觉得每一个来北京游玩的人，无论呆的时间长短，都会来这里走上一程吧。
这里我前前后后去了大概四五次了，包括逛街或者偶然经过。
感觉这才是北京中心的枢纽站啊。。。
夜晚总是散发的独特的味道。当时到达已经是晚上九点多，工作日的南锣鼓巷游人少。可以安安静静的把每一个角落逛完。。零零散散的人流，呵气成霜的冰冷，以及开不完的奶茶店鸡排店饰品店。。
其实，这里也并不是那么寒冷，暖暖的色调总是充满整一条街，大家安静的经过，安静的交谈，安静的错过。",/Date(1457711546000+0800)/,2,4.282,0,0,0,0,0,0,1,0,0
1396,12858454.0,"一条开发过度管理不足的商业小街，一星给的是分叉出来的小胡同，走走还是很有看头的，尤其听说四合院里面几千平都是私有财产的时候……我……
2号boss，叫炒肝，不知道这个正宗否，因为我吃猪肝也吃大蒜，所以觉得好好吃啊……",/Date(1456805775000+0800)/,0,4.147,1,0,0,0,0,1,0,0,0
1397,25497715.0,"地铁6号线，一站地从北海出来，就直奔南锣鼓巷了，因为菇凉要去觅食了，是在是太饿了！
南锣鼓巷里面有好多名字奇特的店铺，菇凉只拍了一少部分，请看下面：——手工剪纸，价格还可以接受，菇凉买了2条小龙十元！
南锣鼓巷菇凉真真的是怀念巷子里的美食啊！没办法，谁让菇凉是个吃货嘞！所以离开之前菇凉又来觅食了！O(∩_∩)O~",/Date(1453053670000+0800)/,0,-9.998,0,0,0,0,1,1,0,0,0
1398,48264642.0,来北京必逛的地方，有美食小吃，适合带礼物,/Date(1451489360000+0800)/,0,4.129,0,0,0,0,0,2,0,0,0
1399,672460.0,它是中国唯一完整地保存着，是最赋有老北京风情的街巷。周边胡同里各种形制的府邸、宅院多姿多彩，厚重深邃。南锣鼓巷及周边区域曾是元大都的市中心，明清时期则更是一处大富大贵之地，这里的街街巷巷挤满了达官显贵，王府豪庭数不胜数，直到清王朝覆灭后，南锣鼓巷的繁华也跟着慢慢落幕。,/Date(1445916647000+0800)/,2,4.286,0,0,0,0,0,0,0,0,0
1400,186574891.0,南锣鼓巷，不想说那些人尽可知的景点，我认为更能留在记忆中的是某个不经意的拐角，某个不经意间的所见所闻所想，日后怀念，某时某刻某人某地，久久铭记于心，不能忘记。,/Date(1534682187000+0800)/,0,4.278,0,0,0,0,0,0,0,0,0
1401,50361540.0,一般吧，临时去转转的，里面酒吧一条街，但是时间有限，没进去，就在外面走走，美食比较多，好玩的也有，各种胡同，还有有趣的店名，就是时间太赶，不然真的要好好转转。,/Date(1481870637000+0800)/,2,2.689,0,0,0,0,0,1,2,0,0
1402,69748812.0,南锣鼓巷是北京比较有特色的小巷，还有胡同，四合院，后海也在这附近，还有恭王府等，逛完了南锣鼓巷就到后海吃各种特色小吃，去酒吧听听音乐!逛逛小胡同，看看四合院!,/Date(1475243328000+0800)/,2,4.285,0,0,0,0,0,1,0,0,0
1403,4747329.0,北京南锣鼓巷美称是北京著名的步行街。但是，去过了以后感觉上与别的城市的步行街差别很大！景色一般，也沒什么特色，北京市特色小食也见不到，真不如王府井步行街！,/Date(1492575355000+0800)/,2,4.274,0,0,0,1,0,0,0,0,0
1404,25976129.0,南锣鼓巷，最近那个80后，的小店！无童年，不入内。找到了很多很多小气候的东西！特意买了一堆，给同学们，回忆小时候。,/Date(1464632036000+0800)/,0,4.283,0,0,0,0,0,0,0,0,0
1405,17917307.0,熙熙攘攘的人群，天南海北的人潮，各式各样的小店，密密麻麻的小巷，在这里体会老北京的胡同文化和各地美食，体会传统与现代的融合发展，给你皇城脚下的非凡体验！,/Date(1566785670000+0800)/,2,4.281,0,0,0,0,0,1,0,0,0
1406,2671333.0,近几年开发出的一处旅游景点，以胡同游的方式为特色！,/Date(1601511920000+0800)/,1,2.454,0,0,0,0,0,0,0,0,0
1407,119461896.0,"小吃，洋货一条街，有吃有喝有玩儿！晚上去景色更美！适合摄影爱好者前往！！！
小吃，洋货一条街，有吃有喝有玩儿！晚上去景色更美！适合摄影爱好者前往！！！",/Date(1521267409000+0800)/,2,4.285,0,0,0,2,0,4,2,0,0
1408,81359011.0,熙熙攘攘的街道总是会觉得特别吵，没有感觉到特色，总有一些人造的味道。,/Date(1603776977000+0800)/,0,2.769,0,0,0,0,0,0,0,0,0
1409,1085255.0,北京游中，我最期待的胡同游就是南锣鼓巷，坐公交前往南锣鼓巷的途中，看到了很多名人故居。下车之后就直接被巨大的写有南锣鼓巷四个大字的牌楼所吸引，精美绝伦的牌楼很有气势喔～,/Date(1572072948000+0800)/,1,4.286,0,0,0,0,0,0,0,0,0
1410,3206886.0,南锣鼓巷是北京最古老的街区之一，是我国唯一完整保存着元代胡同院落肌理、规模最大、品级最高、资源最丰富的棋盘式传统民居区，也是最赋有老北京风情的街巷。,/Date(1520045949000+0800)/,2,4.286,0,0,0,0,0,0,0,0,0
1411,55542740.0,原先的胡同，现在胡同里开上了各色的店，有点像各个旅游地常见的小吃街，但又不完全一样，也有北京的特色。坐地铁或公交都可到达，很方便,/Date(1510709068000+0800)/,3,4.21,0,0,0,0,0,1,0,0,0
1412,45841436.0,里边有很多特色店 而且在南锣鼓巷靠边有中央戏剧学院 夜晚走在这条街人还有很多  小吃也很多 服装店也有  好玩的特色的童年店  来北京来这里逛一逛吧  地铁站下来就是很近,/Date(1498383278000+0800)/,2,4.286,0,0,0,0,0,1,1,0,0
1413,50001024.0,南鑼鼓巷的內涵是溫潤順口的，不像是喧嘩吵鬧那種，值得慢慢回味、細細品嚐，有點像鬧中取靜的小巷，一進入就讓人流連忘返，不想離開..,/Date(1486554556000+0800)/,3,-6.643,0,0,0,0,0,0,0,0,0
1414,57945321.0,很商业化的一条巷子，各种小吃琳琅满目，价格就稍微贵了一点，值得一去，人很多，略微拥挤，不算太长，从头走到尾也就不到半小时，建议下午去，晚上人超多！,/Date(1504065673000+0800)/,2,-9.099,0,0,0,0,1,1,0,0,0
1415,5383811.0,今年我在我在厦门的街头捡到了一个相见恨晚恨晚的好朋友！七月我去沈阳八月她来北京找我！我就带她逛地道的北京城！把她要去的什么长城故宫香山的都给否了！带她去雍和宫敬香南锣鼓巷逛街大栅栏拍照！,/Date(1479630536000+0800)/,2,4.286,0,0,0,0,0,0,0,0,0
