,uid,comment,date,like,sorce,#服务方面#cnt,#导游方面#cnt,#人流方面#cnt,#景色方面#cnt,#价格方面#cnt,#饮食方面#cnt,#娱乐方面#cnt,#儿童方面#cnt,#设施方面#cnt
1950,344912.0,"由于我们要去南锣鼓巷，所以只是看了看，没有拍照。从北门出来后，对面就是后海，即什刹海，往右（东面）走大约1000米就是南锣鼓巷，在那里可以看到老北京的建筑，不过说句实在话，商业气息太重了。建议大家不只是走商业街，多到居民区走走，但不要进去打扰别人。说句实在的，在外面看好像很新，但应该是翻新的，里面的屋有很多已经很旧了。如果肚子饿了，可以在这里找点吃的，当然，这里也有KFC。
南锣鼓巷居民区南锣鼓巷居民区走完了南锣鼓巷，北京行程也差不多了，细心的朋友可能会问不是恭王府很著名吗，为什么没有去，原来我们来得不是时候，那里正在大修，不开放。整个北京行程，给我最大的印象是大，随便一个公园都可以让你走上半天，甚至一天。北京还有很多景点我们没有去，那也是值得去的地方，如果大家有时间，可以在那里玩上半个月，慢慢体会这座城市。",/Date(1454520779000+0800)/,0,4.284,0,0,0,1,0,0,1,0,1
1951,2869919.0,"南锣鼓巷算是很有北京地方特色的一条巷子，且由于跟后海，鼓楼等景区相连，四季游客也是络绎不绝. 街上可以看到各种地方小吃，当然还是以本地特色为主，比如老酸奶等.
巷子也算是比较长的，从头走到头要1公里的样子.",/Date(1449193625000+0800)/,0,4.217,0,0,0,0,0,1,0,0,0
1952,50885572.0,里面的小东西太漂亮了，美得我都不想离开,/Date(1456583045000+0800)/,0,2.173,0,0,0,0,0,0,0,0,0
1953,1467570.0,烂大街的地方，只要有了介入都没意思了，明明是民间发起的，偏要强加管理没意思了,/Date(1660614222000+0800)/,0,-9.872,1,0,0,0,0,0,0,0,0
1954,20781346.0,这里藏着很多好吃的美食，有时间看看。,/Date(1495427344000+0800)/,2,3.45,0,0,0,0,0,2,0,0,0
1955,51353529.0,没什么意思的景点，强烈建议不要在主街上走，去旁边的小胡同看看，超爱中戏旁边的蓬蒿剧场，传说它在亏本，但是这个剧场感觉特别好，还承办国际戏剧节，票也都超便宜的,/Date(1490010181000+0800)/,2,3.769,0,0,0,0,0,0,0,0,0
1956,58321375.0,还不错，只是有的东西有点小贵，但是南锣鼓巷后面就是后海哦,/Date(1480524251000+0800)/,1,-0.351,0,0,0,0,0,0,0,0,0
1957,52416361.0,还可以吧。就是一条比较文艺的小巷子，里面东西有的很贵，有的性价比也还算合适。在一条胡同里逛趣味小店也确实感觉很文艺。,/Date(1459693302000+0800)/,2,4.284,0,0,0,0,0,0,1,0,0
1958,52805049.0,东西有点贵，也没什么特别的东西可以看，如果说为啥觉得这里好，那也许是因为人吧,/Date(1457992655000+0800)/,0,-8.953,0,0,0,0,0,0,0,0,0
1959,61798473.0,和全国所有的古镇古街道一样，没什么新意，店铺也好，卖的东西也好，都没什么创新，千篇一律的。还不如随便走走两边的胡同，找找老北京的感觉。,/Date(1529923465000+0800)/,1,-9.661,0,0,0,0,0,0,0,0,0
1960,5222621.0,跟全国其他类似街道一样，商业化太严重，商品同质化严重，要不是偶尔见到卖烤鸭卷和一些烤肠什么的，真跟在上海没啥区别。,/Date(1521851337000+0800)/,0,-4.38,0,0,0,0,0,0,0,0,0
1961,6065019.0,南锣鼓巷坐落在北京的城中心，不知从哪年开始就成人们旅游的景点之一了。以前的学校就在附近，也没有听说️这样的旅游景点,/Date(1495150421000+0800)/,0,3.691,0,0,0,0,0,0,0,0,0
1962,53951307.0,很商业化的胡同，似乎每个城市都需要有的商业化一条街... 很吵，多人，贵，商店千篇一律，反而走到胡同里小街更有意思，有旧又有历史的房子。,/Date(1493638559000+0800)/,1,4.274,0,0,0,0,0,0,0,0,0
1963,68732670.0,里面有很多特色小吃，靠近鼓楼，尽头就是簋街，晚上很热闹，什刹海也在附近了。,/Date(1476421438000+0800)/,0,4.218,0,0,0,0,0,1,0,0,0
1964,58879606.0,去了得有四五次了跟好盆友在南锣鼓巷一路逛一路吃住在巷子里晚上出来觅食遇到一个卖炒粉的可好吃了再买一杯酸梅汤特别享受,/Date(1465696158000+0800)/,0,2.871,0,0,0,0,0,1,0,0,0
1965,50429620.0,就是人多，不过很有老北京的感觉，赞,/Date(1455266353000+0800)/,0,3.833,0,0,1,0,0,0,0,0,0
1966,81394537.0,南锣鼓巷人太多，尤其是过年的时候,/Date(1579141847000+0800)/,0,-1.148,0,0,1,0,0,0,0,0,0
1967,27362774.0,老北京，原汁原味四合院，没有被过度开发，要有老北京导游，方可知晓其历史。,/Date(1497364186000+0800)/,2,-0.03,0,1,0,0,0,0,0,0,0
1968,71741636.0,南锣鼓巷其实是个胡同群，里面遍布酒吧，小吃，老北京的工艺品。晚上的夜市很好玩，有很多北京的小吃，味儿正价格不贵。,/Date(1491581585000+0800)/,0,4.201,0,0,0,0,1,2,1,0,0
1969,54549556.0,临近后海这有一家螺狮粉，味道不错,/Date(1475457026000+0800)/,2,3.369,0,0,0,0,0,0,0,0,0
1970,47549101.0,南锣鼓巷也是具有老北京特色的一个地方了，里面人流很多，也哟偶很多的小吃和比较有特色的小玩意，可以买回去纪念纪念。,/Date(1455289039000+0800)/,0,4.252,0,0,0,0,0,1,1,0,0
1971,218810117.0,全是人，跟平常景区的小街小巷差不多，就是价格更贵一些，贴个手机膜300,/Date(1659146776000+0800)/,0,-1.308,0,0,0,0,1,0,0,0,0
1972,21755791.0,非常好的购物选择值得推荐一下！,/Date(1583197920000+0800)/,0,3.868,0,0,0,0,0,0,0,0,0
1973,2701148.0,一条巷子，逛了整整一个下午，很多当年大人物的故居，边走边逛，人文和现代结合得很好，适合年轻人，比烟袋斜街更舒服,/Date(1566463867000+0800)/,0,4.285,0,0,0,0,0,0,0,0,0
1974,69946550.0,北京非常有名的一条，胡同，很商业化，但是也能感受一下老北京的特色，里面有一家叫文宇奶酪的特别好吃，价格也是小贵,/Date(1530877622000+0800)/,0,3.375,0,0,0,0,1,1,0,0,0
1975,35865654.0,不是很长的街巷，一会就能走完，商业气息重，跟其他地方的仿古街差不多。有的小店很有特色，文宇奶酪店一定要去，美味,/Date(1517654083000+0800)/,0,3.52,0,0,0,0,0,0,0,0,0
1976,30575031.0,古色古香的一条街道非常棒的旅行,/Date(1511261037000+0800)/,0,4.269,0,0,0,0,0,0,0,0,0
1977,7234574.0,商业气息较浓，去过两次，人很多，店有好多重复的，除了胡同看着有些感觉，其他只能是去吃吃喝喝，感受一下潮的气息。,/Date(1478999395000+0800)/,0,4.033,0,0,0,0,0,2,0,0,0
1978,60784607.0,南锣鼓巷不算很长，但是因为两边都是小店，还有很多特色的商品、小吃，外地游客往往会把这里当做游玩北京的必选去处。,/Date(1467365846000+0800)/,0,2.515,0,0,0,0,0,1,1,0,0
1979,35394597.0,和朋友在这逛了一下午，感受了下胡同的气息，老旧的感觉还有，只是多了现代气息，好多小吃，吃了文宇奶酪，真心不错。,/Date(1460998260000+0800)/,0,4.273,0,0,0,0,0,1,0,0,0
1980,35402098.0,很商业化的一条步行街，两旁的胡同还能看看，有些名人故居也还可以，街上的小店没啥特殊的，小吃不多，价格昂贵，个人感觉不如烟袋斜街。,/Date(1533023764000+0800)/,1,3.773,0,0,0,0,1,1,0,0,0
1981,167847189.0,还可以吧 商业化的一条古街 卖的小东西很敷衍 小吃一条街 贵不说不好吃 没什么特色 就是老北京胡同的感觉 总觉得是被炒作火的 反正离天安门近 一趟线 九点之后商家才开门,/Date(1525766270000+0800)/,0,-9.997,0,0,0,0,0,2,0,0,0
1982,53874329.0,确实挺商业化的，但是里面一些小店也不乏特色，价格嘛，能接受，如果离酒店近还是推荐逛逛的。,/Date(1497251980000+0800)/,1,4.244,0,0,0,0,1,0,0,0,0
1983,59130118.0,这里没有嘈杂的叫卖声，都是一家家创意、个性的小店;比如“火柴语录”“创口贴”“肚脐眼”等等，听这名字就很奇特,/Date(1480526015000+0800)/,0,3.313,0,0,0,0,0,0,0,0,0
1984,67007518.0,好多地铁口，方便坐车，还有文宇奶酪好吃，奶酪饼也好吃，小吃一条街真赞,/Date(1474041935000+0800)/,2,4.272,0,0,0,0,0,3,0,0,0
1985,6999720.0,"人啊，哪哪都是人，最坑大香肠要15.好多油,文宇奶酪也没想象那么好吃",/Date(1468753968000+0800)/,0,-8.656,0,0,0,0,0,1,0,0,0
1986,14469153.0,一条大道到处都有小胡同通往各处，两边都是特色小店，人很多，拍拍照不错,/Date(1447417974000+0800)/,0,3.495,0,0,0,0,0,0,0,0,0
1987,930883.0,很好玩的地方，喜欢那里最好吃的有名的南锣鼓巷里的羊肉爆炒，美味极了！,/Date(1445266184000+0800)/,0,1.896,0,0,0,0,0,1,1,0,0
1988,66907463.0,就是专坑外地游客的购物一条街。和曾经的王府井美食街一样的臭名昭著。,/Date(1649809351000+0800)/,0,-9.026,0,0,0,0,0,1,0,0,0
1989,108271274.0,到北京这里怎么也来逛逛，哪怕什么都不买，其实这里就是一条胡同，因为比较古老所以很多人来，旅游哪里的古街都是人气旺，人来人往的。,/Date(1563711241000+0800)/,1,3.646,0,0,0,0,0,0,0,0,0
1990,3686760.0,"太過商業化！
成了一條毫無特色的純商業步行街！",/Date(1508838369000+0800)/,1,-9.741,0,0,0,0,0,0,0,0,0
1991,6545634.0,南北向一条全新装修的巷子，两旁都是商铺，各种吃的主要是小吃饮料甜点，银器铺子不少，称小锤子敲了1000年。,/Date(1507873641000+0800)/,0,2.074,0,0,0,0,0,1,0,0,0
1992,63060564.0,可能是不大适合我，感觉一般， 没有我想象的那么好玩、好看。文宇奶酪还是不错的，感觉原味就不错，红豆有点太甜了,/Date(1473226210000+0800)/,0,4.266,0,0,0,1,0,0,1,0,0
1993,50625322.0,很有意思！来北京不去可惜了，里面有很多小吃。适合吃货，而且还有一些比较隐蔽但是很赞的店，已经去过好几次了。,/Date(1459351006000+0800)/,0,3.755,0,0,0,0,0,1,0,0,0
1994,2549622.0,下午过去的，巷口的风有点冷，入巷口缺乏设计感，也不是原生态，进入巷子里面倒是有老北京特色。晚上灯亮起来的时间有点晚，7点钟离开的时候巷子里都没有灯，全靠两边商铺的灯照明，总体感觉黑黢黢的,/Date(1456889088000+0800)/,0,-9.998,0,0,0,0,0,0,0,0,0
1995,49034227.0,这里有特别多的小店，但是如果你是在旅游季去的话可就惨了，太挤人了，会被踩死的。但是这里面有许多传统的东西。,/Date(1452502411000+0800)/,0,3.233,0,0,0,0,0,0,0,0,0
1996,2389105.0,仿古建筑、比较有北京特色的建筑！就是商业化气息比较浓，过节人巨多！,/Date(1446998359000+0800)/,0,3.804,0,0,1,0,0,0,0,0,2
1997,80312614.0,南锣鼓巷，这里有北京年代比较久远的胡同。这里已经成为了一个商业街区，南锣鼓巷的人非常的多，多得要钱前脚踢后脚跟的那种。商业化太过于重了！不过这里还是有很多北京特色的商店的。逛逛也不妨！,/Date(1585927505000+0800)/,0,4.276,0,0,0,0,0,0,0,0,0
1998,77771929.0,现在这里是步行街。许多各具风格的小胡同，装修别致的咖啡厅和小酒吧，还有北京当地各色的零嘴小吃，这里的繁华和包罗万象已经成为了北京城的地标性场所。,/Date(1563804962000+0800)/,0,4.121,0,0,0,0,0,1,0,0,0
1999,27790192.0,如今这里开起了风格百变的个性店铺，各种精巧时尚的私房小馆，老北京胡同与小资情调结合，成为北京的时尚地标。游客居多。随便走走。,/Date(1534904235000+0800)/,1,4.283,0,0,0,0,0,0,0,0,0
2000,31953433.0,不花门票就可以逛上一整天的好地方，特色小吃和各种小玩意儿一家挨着一家的，值得一逛呦！,/Date(1509674849000+0800)/,1,0.953,0,0,0,0,1,1,1,0,0
2001,,去北京玩了2天，在南锣鼓巷找到老北京气息，人也不是特别多，小物件也挺好，休闲好去处！,/Date(1501732838000+0800)/,1,4.171,0,0,0,0,0,0,1,0,0
2002,6465414.0,南锣鼓巷本身是有些商业化，和其他城市步行街并没有多少差异，但周边的小胡同真是另有乾坤，建议多花点时间细细走访。。距离后海也非常近，整体值得一逛。,/Date(1474782811000+0800)/,0,4.266,0,0,0,0,0,0,0,0,0
2003,66376205.0,人山人海，比较有特色，整条街都是卖吃的，工艺品等等，反正我去了两次，自己去感受一下吧,/Date(1471823292000+0800)/,1,-4.528,0,0,1,0,0,0,0,0,0
2004,25466850.0,2月29日晨观看雨儿胡同，齐白石纪念馆，只能在门外看看，很古老的胡同，早五点多，只有散步的老人，很清静。,/Date(1471658377000+0800)/,0,4.282,0,0,0,0,0,0,0,0,0
2005,162080354.0,南锣鼓巷 颜值高高的一条学生街，夜色降临，十二分美丽，有好吃的，也有很多文创产品，靠近中央戏剧学院的缘故这里热闹非凡~推荐大伙在傍晚时候来游玩。,/Date(1536213541000+0800)/,0,4.285,0,0,0,0,0,1,1,0,0
2006,27675128.0,正如评价所写，双皮奶确实好吃，其他的小吃都还可以，就是比较贵，一趟吃下来随便100多。很有特色的一条街，可以慢慢逛，只是跟孩子和老人不适合。年轻人慢慢逛吧，旁边很多小胡同都可以去走走,/Date(1501912999000+0800)/,0,4.286,0,0,0,0,0,2,0,0,0
2007,61996423.0,街上有些店是骗人的 如果你抽奖抽中东西了还要你加钱的一定不要信 哪有中奖还有出钱的 那都是骗人的 东西都是假的,/Date(1483406140000+0800)/,0,-9.993,0,0,0,0,0,0,0,0,0
2008,2058178.0,南锣鼓巷是北京东城的一条胡同。是保存完整的胡同院落。最富有老北京风情的街巷。每次游览都有不一样的感受。,/Date(1480052657000+0800)/,0,4.136,0,0,0,0,0,0,0,0,0
2009,58175563.0,"那儿物价略贵
文青必去
离什刹海后海酒吧街也很近
夜景很不错貌似傍边有个北京戏剧学院
年轻男女比较多吧",/Date(1465311291000+0800)/,0,4.286,0,0,0,1,0,0,0,0,0
2010,6090940.0,挺有特色的老胡同，里面充满热闹和喧嚣，各种特色小店和古老的胡同完美结合在一起，可以去逛逛，感受一下。,/Date(1559321072000+0800)/,0,4.284,0,0,0,0,0,0,0,0,0
2011,77915363.0,北京唯一一个保存完好的四合院非常有老北京的特色，而且有很多特色的创意小吃，值得去,/Date(1523363864000+0800)/,1,4.278,0,0,0,0,0,1,0,0,0
2012,6840583.0,北京的小吃街，古色古香 人来人往，游客居多，离后海也很近，步行可到。如果多一些北京的特色小吃就更好了。,/Date(1509796152000+0800)/,0,4.274,0,0,0,0,0,2,0,0,0
2013,76971431.0,真心觉得南锣鼓巷没有想象中的要好，可能是因为旅游的发展商业气息很浓，可以走走看看，但是没有特别多可以逛的地方，小店也和大多数商业旅游区差不多,/Date(1492333920000+0800)/,2,4.278,0,0,0,0,0,0,0,0,0
2014,81370455.0,很不错，就是冬天去太冷了，可以找个暖和点的季节去玩，挺不错的,/Date(1486014170000+0800)/,2,3.971,0,0,0,0,0,0,1,0,0
2015,59130118.0,南锣鼓巷南北走向，长约800米，东西各有8条胡同整齐排列。凭借较为完好的元代里坊格局、明清名人府邸。,/Date(1479223224000+0800)/,0,3.895,0,0,0,0,0,0,0,0,0
2016,26319130.0,很多很特色的小店，小吃很多，主街两旁都是一些小胡同，有酒吧和咖啡馆，进去坐一坐也文艺一次吧。在南锣鼓巷除了看兔爷之外就是吃，倒字烤翅，卤肉的饼，咖喱鱼蛋，文宇奶酪，还有抹茶的大泡芙,/Date(1478830453000+0800)/,0,4.281,0,0,0,0,0,1,0,0,0
2017,3642120.0,掩映在古建筑群里的商业街，现代商业模式，希望能最大限度的保留古风建筑，让游客在休闲中欣赏古建筑风采！,/Date(1478127539000+0800)/,0,4.126,0,0,0,0,0,0,0,0,3
2018,3957790.0,挺窄的小巷，两边都是卖东西的，和小酒吧餐馆，太多了也看不出啥特殊了，偶尔在哪个屋角房檐找寻到一点老房子的印象，仅此而已，人挺多挺热闹，而且从胡同能直接穿到什刹海，有时间遛遛也不错！,/Date(1466214455000+0800)/,0,4.242,0,0,0,0,0,0,0,0,0
2019,72038151.0,晚上去的，有一些店铺，东西比较符合帝都特色，比较贵，但是有一些很有意思的小店。整体还是很有感觉的。,/Date(1528730023000+0800)/,0,4.209,0,0,0,0,0,0,0,0,0
2020,104798004.0,我去的时候是赶上节假日，不过人稍微多点，但是那里有很多我爱吃的小吃，还是很喜欢,/Date(1518954748000+0800)/,1,4.186,0,0,0,0,0,1,0,0,0
2021,35280962.0,到北京不能不去一次南锣鼓巷，看一看特色店铺，尝一尝特色小吃。游人如织，估计都是和我们一样慕名前来。,/Date(1508679218000+0800)/,0,0.731,0,0,0,0,0,1,0,0,0
2022,29440147.0,人满为患，人头攒动的一个地方。周末和节假日期间，可以比肩地铁站里的状况。老北京歺饮酒楼和个性小店很多，吃东西还可以。风景就是什刹海和胡同。,/Date(1505809486000+0800)/,0,3.274,0,0,0,1,0,0,0,0,0
2023,18548616.0,这条老北京古街，真实热闹的不得了，人挨人怎一个“亲切”了得~如果你爱玩，爱吃，爱文艺，都是首选啊~,/Date(1480484305000+0800)/,0,4.286,0,0,0,0,0,0,1,0,0
2024,55274504.0,离鼓楼和后海很近，小资和小清新的混杂地，个性创意小店铺很多，中央戏剧学院在其中，就是现在人太多了。,/Date(1475853761000+0800)/,0,4.26,0,0,1,0,0,0,0,0,0
2025,70144299.0,很好，就是人太多，东西价格太高了，有卖鞋的，大多都是正品。,/Date(1474791248000+0800)/,2,3.67,0,0,1,0,1,0,0,0,0
2026,60211893.0,很有老北京感觉的一条巷子，很多特色小吃店，一路走一路吃，虽然巷子补偿，但这样吃吃走走也够喔逛的了。,/Date(1468460978000+0800)/,0,-1.778,0,0,0,0,0,1,0,0,0
2027,38866771.0,这个喜欢小吃的更应该去了，而且交通很便利，就在地铁口附近。,/Date(1457825620000+0800)/,2,4.226,0,0,0,0,0,1,0,0,0
2028,50760115.0,就跟济南的芙蓉街一样。都是当地的小吃店和特色商品店。有几家店还是很棒的，有个性，有脾气。值得一来！,/Date(1455209576000+0800)/,0,3.6,0,0,0,0,0,1,0,0,0
2029,4288176.0,如果是初到北京又爱吃的人。这里很适合你。这里的东西可能不地道，但很全面。往北走还有风景更美的什刹海,/Date(1451792072000+0800)/,0,4.284,0,0,0,1,0,0,0,0,0
2030,42929436.0,是北京最古老的街区之一，也是北京传统民居群。东西两边各有8条胡同。两边还故居、王府等几个旅游点，,/Date(1565876348000+0800)/,0,1.612,0,0,0,0,0,0,0,0,0
2031,207843108.0,每次去北京必逛的地方。一路从南锣鼓巷逛吃到后海，去下恭王府，晚上再在酒吧街坐一坐听听歌，不错的。,/Date(1547563232000+0800)/,4,4.285,0,0,0,0,0,0,0,0,0
2032,26463817.0,去的时候很冷，冷到不行，去服装店买了件衣服，五六百一件衣服，网上同款一百多，没办法太冷了，吃的特别好吃，周围就有饭店,/Date(1519102039000+0800)/,1,-9.925,0,0,0,0,0,1,0,0,0
2033,58039537.0,就是个多宝巷，有各种各样有意思的小玩意，就是让你各种买买，当然不买只看看也挺有意思，东西都挺贵。,/Date(1489756936000+0800)/,0,3.785,0,0,0,0,0,0,1,0,0
2034,28340949.0,文艺青年的聚集地，很有情调的一个胡同。各种小商品琳琅满目，悠闲地走在古巷中，有一股老北京的味道。,/Date(1471066842000+0800)/,0,4.136,0,0,0,0,0,0,0,0,0
2035,3803569.0,这里越来越火爆了，尤其节日时人山人海，只能夹在中间走路，还是人少时来吧，兴许能领略些独特的风景。,/Date(1446388835000+0800)/,0,2.912,0,0,1,1,0,0,0,0,0
2036,152056449.0,全是人，哪怕冬天，除了糖葫芦就是马迭尔冰棍、冰酸奶、银器跟全世界一样样的义乌小商品，北京小吃大排档绝对难以下咽，卤煮臭豆腐最坑不要尝试,/Date(1516446448000+0800)/,2,-8.717,0,0,0,0,0,1,0,0,0
2037,874669.0,闲着遛跶的好地方。有的吃，有的看。齐白石旧居纪念馆，矛盾旧居，都可以去看看,/Date(1508341676000+0800)/,1,3.881,0,0,0,0,0,0,0,0,0
2038,,"內行看門道, 外行看熱鬧, 沒有解說, 整個就像大外行, 不知在湊熱鬧什麼... 有了講解, 整個很有深度",/Date(1506471262000+0800)/,0,-9.867,0,0,0,0,0,0,0,0,0
2039,40180879.0,人特别多，东西卖的很贵，太商业化了，那些吃的基本上全国各地的景点都有。可以去两边的胡同里看看，有很多名人故居，中戏也在这里，不过不能进,/Date(1497510046000+0800)/,0,-3.459,0,0,0,0,0,0,0,0,0
2040,76707283.0,一条古老的街巷，小小的街道里有这一个又一个的店铺，商品很多，这里每到旺季人口巨多，适合年轻人来,/Date(1482367174000+0800)/,0,3.858,0,0,0,0,0,0,0,0,0
2041,10640875.0,是一条胡同，从鼓楼到平安大街，有好多小店，一般都很有特色，很时尚，还有一些小吃，现在去人很多，,/Date(1473233489000+0800)/,0,3.867,0,0,0,0,0,1,0,0,0
2042,10640875.0,现在越来越商业化了，人非常多，有很多小店，像银饰品店了，文化衫了，丝绸服装店，小吃也非常好吃的,/Date(1469604440000+0800)/,0,3.896,0,0,0,0,0,2,0,0,0
2043,30273604.0,每次都去品尝文宇双皮奶，香浓入口红豆甜甜，吃不够吃不胖,/Date(1455274381000+0800)/,0,3.921,0,0,0,0,0,0,0,0,0
2044,6044893.0,传统与现代的结合典范，既有古典建筑，又有现代经营，交通方便，经营规范，是外地游客必选景点之一。,/Date(1445469057000+0800)/,0,4.078,0,0,0,0,0,0,0,0,1
2045,28940897.0,环境优雅，舒适，安静，口味好，菜式多，服务周到，拥挤，实用的东西没有，逛就是个感觉！像庙会。,/Date(1575161918000+0800)/,0,4.286,1,0,0,1,0,0,0,0,0
2046,5450322.0,逛一逛，买点儿小商品挺不错的地方,/Date(1529486592000+0800)/,1,3.783,0,0,0,0,0,0,0,0,0
2047,11586345.0,10月份去住在南锣鼓巷，第一印象就是人比较多，卖的东西很贵。倒是那些小巷子可以转转，很有特点,/Date(1513349056000+0800)/,0,-3.387,0,0,0,0,0,0,0,0,0
2048,82467875.0,南锣鼓巷地处北京的市中心，是一条集小资情调和老北京韵味为一体的胡同，也是北京的时尚地标之一。,/Date(1512719458000+0800)/,0,4.285,0,0,0,0,0,0,0,0,0
2049,11340652.0,去北京都会去逛的一个地方，感受老北京的气息以及现代的热闹。出行也很方便。,/Date(1507507335000+0800)/,1,4.244,0,0,0,0,0,0,0,0,0
2050,5930807.0,推荐的酸奶和酸梅汤，以及宫保鸡丁披萨，感觉都没有那么好吃。还是本土小吃和工艺品更对我的胃口。,/Date(1500041380000+0800)/,0,4.249,0,0,0,0,0,2,0,0,0
2051,101514042.0,小糖人和独特的风景，胡同里的精彩,/Date(1498821504000+0800)/,1,-1.799,0,0,0,1,0,0,0,0,0
2052,3834575.0,南锣鼓巷地处北京的市中心，是一条集小资情调和老北京韵味为一体的胡同，也是北京的时尚地标之一。,/Date(1484779185000+0800)/,0,4.285,0,0,0,0,0,0,0,0,0
2053,53947832.0,值得去哦！小吃的特别多而且好吃，下次去的话还会再去的,/Date(1460039183000+0800)/,0,3.393,0,0,0,0,0,2,0,0,0
2054,1470145.0,走在铜锣古巷，慢慢感受时光流逝，古代的格局还有些痕迹与现实重叠，可安逸，可热闹，建议从南往北,/Date(1445521098000+0800)/,0,4.286,0,0,0,0,0,0,0,0,0
2055,236008886.0,卑微拔草，平凡的路边摊小吃全部三十起，卖相和价格让人失去胃口，商店货物没有明码标价感觉随时被砍，窄窄的巷子人山人海，白色外套被老阿姨背的小孩踢了一脚，永远不会推荐朋友去，除非谁和我冤仇大很。,/Date(1601641987000+0800)/,1,-10.0,0,0,1,0,1,1,0,1,0
2056,17052112.0,古色古香，但是翻新了不少，保持着原样，少了一丝丝陈旧感，有些作为了酒吧，带来了不少时尚元素,/Date(1574980024000+0800)/,0,4.265,0,0,0,0,0,0,0,0,0
2057,19913055.0,很喜欢的一条卖东西的巷子，尤其是在晚上没有事的时候，可以和朋友一起逛逛，还有很多好吃的东西,/Date(1564100405000+0800)/,0,0.682,0,0,0,0,0,1,0,0,0
2058,105912337.0,基本上是商业街了，并不是古色古香，吹糖人有些吹的不咋好，不要买，拍照也不是很适合，人很多，小吃比较贵，商品倒是玲琅满目，不推荐去。,/Date(1504276486000+0800)/,0,-1.541,0,0,0,0,0,1,0,0,0
2059,31893407.0,很热闹，很多小店，卖什么的都有，最主要的小吃美食很多呀，不能停的节奏。,/Date(1502505117000+0800)/,1,4.149,0,0,0,0,0,2,0,0,0
2060,84946109.0,商业化严重但店铺名还是很有趣滴,/Date(1490448746000+0800)/,1,3.392,0,0,0,0,0,0,1,0,0
2061,49049814.0,近年来开发的一条特色商业街，人气还不错，居住过许多达官贵人、社会名流天气不错所以总的来说好,/Date(1454397267000+0800)/,0,4.259,0,0,0,0,0,0,0,0,0
2062,3126075.0,适合自拍的地方，店铺没什么特色，和西塘什么的古镇差不多，要说特色还是里面人流比较少的胡同里去细细品味会比较好。,/Date(1445565637000+0800)/,1,3.575,0,0,0,0,0,0,0,0,0
2063,25015685.0,这里很有老北京古色古香的感觉，四通八达的胡同也很值得一逛，美食很多，只是节假日人也会很多。,/Date(1445393348000+0800)/,0,4.286,0,0,0,0,0,1,0,0,0
2064,243526242.0,非常商业化的胡同，两边全都是网红小吃和纪念品。窄窄的小巷子人潮涌动，游人如织。适合拍照。,/Date(1570341279000+0800)/,0,0.194,0,0,0,0,0,1,0,0,0
