,uid,comment,date,like,sorce,#服务方面#cnt,#导游方面#cnt,#人流方面#cnt,#景色方面#cnt,#价格方面#cnt,#饮食方面#cnt,#娱乐方面#cnt,#儿童方面#cnt,#设施方面#cnt
760,18295354.0,南锣鼓巷 吃喝玩乐攻略 旅游打卡 赞👍,/Date(1659851439000+0800)/,0,4.221,0,0,0,0,0,1,1,0,0
761,25991350.0,京城胡同游必到之处，很有特色的地方,/Date(1659332487000+0800)/,0,3.548,0,0,0,0,0,0,0,0,0
762,41418293.0,这里值得去，景色秀丽，性价比很好的,/Date(1659271612000+0800)/,0,4.279,0,0,0,1,0,0,0,0,0
763,204385791.0,第一次来这个地方，挺震撼的感觉真好,/Date(1659244834000+0800)/,0,3.337,0,0,0,0,0,0,0,0,0
764,214105155.0,南锣鼓巷，到北京去旅游的必去之地！,/Date(1658762377000+0800)/,0,1.502,0,0,0,0,0,0,0,0,0
765,42513031.0,每年都会去溜达一圈 感受下热闹的氛围,/Date(1658632160000+0800)/,0,3.278,0,0,0,0,0,0,0,0,0
766,7051662.0,南锣鼓巷还是不错的，就是人很多的呀,/Date(1658587259000+0800)/,0,3.971,0,0,0,0,0,0,0,0,0
767,11038288.0,京城最具代表性的古文化商业街之一。,/Date(1658547203000+0800)/,0,4.231,0,0,0,0,0,0,0,0,0
768,75646189.0,这里是北京城中心地区的一处商业街。,/Date(1658272638000+0800)/,0,2.958,0,0,0,0,0,0,0,0,0
769,5075255.0,还好吧，商业气息太浓了，转转也还行,/Date(1658064172000+0800)/,0,2.424,0,0,0,0,0,0,0,0,0
770,177110942.0,不错不错非常好的地方可以去看看玩玩,/Date(1657954632000+0800)/,0,4.191,0,0,0,0,0,0,2,0,0
771,21879112.0,不错的地方，没事逛逛还可以，还行吧,/Date(1657546430000+0800)/,0,3.994,0,0,0,0,0,0,0,0,0
772,304852710.0,南锣鼓巷，到北京来旅游一定要去看看,/Date(1657204041000+0800)/,0,-0.199,0,0,0,0,0,0,0,0,0
773,74038814.0,北京很有特色的胡同，很有生活气息。,/Date(1656223055000+0800)/,0,4.216,0,0,0,0,0,0,0,0,0
774,22651745.0,很有历史感的一个名字，同时活力十足,/Date(1655874351000+0800)/,0,4.027,0,0,0,0,0,0,0,0,0
775,219605985.0,不错的地方，大家有时间可以过去看看,/Date(1654676143000+0800)/,0,1.981,0,0,0,0,0,0,0,0,0
776,300992864.0,很有趣的北京地道景点，生活气息浓厚,/Date(1652696310000+0800)/,0,4.274,0,0,0,0,0,0,1,0,0
777,226163730.0,商业气氛太严重了，很多吃的很糊弄人,/Date(1652513282000+0800)/,0,-2.837,0,0,0,0,0,0,0,0,0
778,314776984.0,其实没什么可去的，很一般。很商业化,/Date(1652486057000+0800)/,0,2.063,0,0,0,0,0,0,0,0,0
779,23620513.0,北京逛胡同的好地方，小吃网红店很多,/Date(1652110070000+0800)/,0,0.013,0,0,0,0,0,1,0,0,0
780,150554580.0,北京胡同，历史古城，回味历史文化。,/Date(1652009628000+0800)/,0,4.23,0,0,0,0,0,0,0,0,0
781,13206020.0,人很多，很热闹，各种吃的玩的都有。,/Date(1652000990000+0800)/,0,4.01,0,0,0,0,0,0,1,0,0
782,37269493.0,热热闹闹的地方，总有些小店出人意料,/Date(1651920119000+0800)/,0,2.963,0,0,0,0,0,0,0,0,0
783,4769272.0,文化遗产，古香古色，大人孩子都喜欢,/Date(1651653070000+0800)/,0,4.191,0,0,0,0,0,0,0,0,0
784,272819135.0,古街古巷，来品味不一祥的民风民俗啊,/Date(1651651362000+0800)/,0,2.665,0,0,0,0,0,0,0,0,0
785,41418293.0,这里值得去，景色秀丽，性价比很好！,/Date(1650873590000+0800)/,0,4.279,0,0,0,1,0,0,0,0,0
786,13059821.0,这些年一下子就成了一个很火热的景点,/Date(1650464770000+0800)/,0,-0.288,0,0,0,0,0,0,0,0,0
787,168187879.0,在这里寻觅老北京的足迹，值得一去。,/Date(1650427315000+0800)/,0,4.123,0,0,0,0,0,0,0,0,0
788,57964753.0,特别有意思的老北京胡同，去过很多次,/Date(1648643696000+0800)/,0,3.171,0,0,0,0,0,0,0,0,0
789,15161509.0,【景色】古香古色，优雅大气，美美哒,/Date(1648559398000+0800)/,0,4.286,0,0,0,1,0,0,0,0,0
790,21879112.0,不错的地方，景色不错，能理解的不多,/Date(1648473763000+0800)/,0,4.214,0,0,0,1,0,0,0,0,0
791,288107997.0,每天人都非常多，里面买什么的都有。,/Date(1648346718000+0800)/,0,-1.4,0,0,0,0,0,0,0,0,0
792,7391125.0,景色不错，趣味性很好，性价比较好。,/Date(1648220709000+0800)/,0,4.28,0,0,0,1,0,0,1,0,0
793,66163879.0,就是贵，不过小商品的样子还是很多的,/Date(1647776938000+0800)/,0,0.46,0,0,0,0,0,0,0,0,0
794,2069849.0,当时的南锣鼓巷还没有这么网红，自已也不是为了偶遇中戏的明星而前往，只是为了尝一下大名鼎鼎的文宇奶酪。而如今，这里已是人流如织，人头攒动，应该也不会再去了。,/Date(1644071754000+0800)/,0,3.324,0,0,0,0,0,0,0,0,0
795,5872902.0,很有北京风味，吃的、喝的东西很丰盛,/Date(1622280792000+0800)/,0,4.122,0,0,0,0,0,1,0,0,0
796,216468321.0,就是一个胡同，没什么可去的，吃的也少，玩的啥也没有，真不知道是怎么出名的,/Date(1677812187000+0800)/,0,-0.884,0,0,0,0,0,0,1,0,0
797,221024107.0,南锣鼓巷不错大家有机会可以去看看,/Date(1660557142000+0800)/,0,3.988,0,0,0,0,0,0,0,0,0
798,13059821.0,南锣鼓巷是这些年兴起的网红旅游地,/Date(1660032987000+0800)/,0,1.5,0,0,0,0,0,0,0,0,0
799,4301847.0,去过的地方啊，非常热闹的地方啊。,/Date(1659363298000+0800)/,0,1.486,0,0,0,0,0,0,0,0,0
800,2804634.0,很好的地方，值得来一趟，拍照好看,/Date(1658977726000+0800)/,0,3.584,0,0,0,1,0,0,0,0,0
801,2068886.0,真的很不错，真的很不错 真的很不错,/Date(1657954176000+0800)/,0,4.282,0,0,0,0,0,0,0,0,0
802,60494570.0,不错的地方，老北京胡同网红打卡地,/Date(1657013396000+0800)/,0,1.151,0,0,0,0,0,0,0,0,0
803,475921.0,景色还不错，整体来说环境还不错。,/Date(1656816659000+0800)/,0,4.282,0,0,0,2,0,0,0,0,0
804,98000668.0,北京的南锣鼓巷，鼓楼什刹海都很近,/Date(1656733130000+0800)/,0,3.533,0,0,0,0,0,0,0,0,0
805,39334263.0,人非常不错的的多而且很喜欢逛逛迟,/Date(1656425605000+0800)/,0,4.076,0,0,0,0,0,0,0,0,0
806,268924348.0,很有名的景点，之前是5A级风景区,/Date(1654090323000+0800)/,0,1.802,0,0,0,1,0,0,0,0,0
807,5626552.0,坐落在一片老房子中，充满文艺气息,/Date(1653613516000+0800)/,0,4.254,0,0,0,0,0,0,0,0,0
808,250882582.0,环境优美，很多小吃，年轻人的最爱,/Date(1653402832000+0800)/,0,4.253,0,0,0,1,0,1,0,0,0
809,166810675.0,南锣鼓巷现在已然发展成为商业街了,/Date(1652603109000+0800)/,0,4.239,0,0,0,0,0,0,0,0,0
810,90332906.0,大家一起和家人来南锣鼓巷逛街逛吧,/Date(1652486789000+0800)/,0,3.752,0,0,0,0,0,0,0,0,0
811,14198301.0,很不错的地方，随便看看还是挺好的,/Date(1651816869000+0800)/,0,3.366,0,0,0,0,0,0,0,0,0
812,13653736.0,北京胡同，小吃和小玩意的集散地。,/Date(1651418431000+0800)/,0,-4.395,0,0,0,0,0,1,1,0,0
813,79980496.0,南锣鼓巷是北京最古老的街区之一。,/Date(1650797426000+0800)/,0,0.901,0,0,0,0,0,0,0,0,0
814,1785464.0,有很浓郁的人文风情，确实值得一去,/Date(1650458948000+0800)/,0,4.245,0,0,0,0,0,0,0,0,0
815,4508381.0,人群熙熙攘攘的，商业化气息浓厚。,/Date(1650413718000+0800)/,0,4.135,0,0,0,0,0,0,0,0,0
816,214105155.0,到北京的必去打卡地，这里热闹非凡,/Date(1650065534000+0800)/,0,-0.686,0,0,0,0,0,0,0,0,0
817,1823533.0,很有特色的地方，各种小店都很不错,/Date(1649943861000+0800)/,0,3.943,0,0,0,0,0,0,0,0,0
818,106263909.0,南锣鼓巷的美食非常多，值得一去。,/Date(1649425442000+0800)/,0,3.776,0,0,0,0,0,1,0,0,0
819,41418293.0,这里值得去，景色不错，性价比超高,/Date(1648465973000+0800)/,0,4.286,0,0,0,1,0,0,0,0,0
820,281874565.0,南锣鼓巷步行街，好看，好逛，好吃,/Date(1648426374000+0800)/,0,3.841,0,0,0,1,0,1,0,0,0
821,370520824.0,南锣鼓巷商家林立，古今中外都有。,/Date(1648081147000+0800)/,0,-1.274,0,0,0,0,0,0,0,0,0
822,70994561.0,逛吃逛吃的哈哈哈哈哈哈哈哈哈哈,/Date(1660444118000+0800)/,0,4.263,0,0,0,0,0,0,0,0,0
823,13206020.0,很有意思的街道，晚上去更漂亮。,/Date(1660310944000+0800)/,0,4.212,0,0,0,0,0,0,0,0,0
824,2428880.0,古老的街巷，现代商业氛围浓厚…,/Date(1660133454000+0800)/,0,3.158,0,0,0,0,0,0,0,0,0
825,642947.0,这里是网红打卡的必来之地之一。,/Date(1659484419000+0800)/,0,-4.821,0,0,0,0,0,0,0,0,0
826,121095545.0,非常不错的地方，值得一来游玩。,/Date(1659454601000+0800)/,0,1.758,0,0,0,0,0,0,1,0,0
827,10354091.0,非常值得去逛的地方，值得逛逛街,/Date(1659436831000+0800)/,0,4.113,0,0,0,0,0,0,0,0,0
828,23100062.0,"【景色】还可以吧
【趣味】一般般",/Date(1659426638000+0800)/,0,3.591,0,0,0,1,0,0,1,0,0
829,177465767.0,环境优美，景色宜人，值得推荐。,/Date(1659180208000+0800)/,0,4.224,0,0,0,2,0,0,0,0,0
830,443802.0,著名的美食街，重点为游客服务。,/Date(1658367647000+0800)/,0,3.519,1,0,0,0,0,1,0,0,0
831,89729349.0,热闹的一条步行街，游客很多呢。,/Date(1658243499000+0800)/,0,2.789,0,0,0,0,0,0,0,0,0
832,2673173.0,景色不错，环境不错，值得推荐。,/Date(1658060859000+0800)/,0,4.278,0,0,0,2,0,0,0,0,0
833,40121619.0,适合外地游客过来游玩的好地方。,/Date(1657944397000+0800)/,0,-6.395,0,0,0,0,0,0,1,0,0
834,401219971.0,南锣鼓巷确实是个非常好的去处哎,/Date(1657643132000+0800)/,0,3.048,0,0,0,0,0,0,0,0,0
835,203696729.0,这里非常热闹，周末和朋友去不错,/Date(1657120796000+0800)/,0,4.136,0,0,0,0,0,0,0,0,0
836,281874565.0,南锣鼓巷，好玩的地方，大家去玩,/Date(1656983561000+0800)/,0,3.386,0,0,0,0,0,0,2,0,0
837,182226263.0,年轻人来北京逛一逛，值得打卡。,/Date(1656894048000+0800)/,0,3.97,0,0,0,0,0,0,0,0,0
838,57964753.0,去过很多次的地方，很有特色的。,/Date(1656852082000+0800)/,0,1.959,0,0,0,0,0,0,0,0,0
839,8613827.0,就是一条老街 全国街道都差不太多,/Date(1656373805000+0800)/,0,2.722,0,0,0,0,0,0,0,0,0
840,46524352.0,位于北京市东城区，交道口街道，,/Date(1656168430000+0800)/,0,0.854,0,0,0,0,0,0,0,0,0
841,370520824.0,南锣鼓巷那里，吃喝玩乐都有呀。,/Date(1656167472000+0800)/,0,2.936,0,0,0,0,0,1,1,0,0
842,401217774.0,吃喝玩乐 应有尽有 年轻人的好去处,/Date(1656048841000+0800)/,0,4.185,0,0,0,0,0,1,1,0,0
843,69088988.0,北京游玩必去打卡的地点之一。。,/Date(1654691084000+0800)/,0,0.611,0,0,0,0,0,0,1,0,0
844,34812327.0,里面有很多特色突出的小商品店铺,/Date(1654410794000+0800)/,0,1.117,0,0,0,0,0,0,0,0,0
845,5450322.0,很繁华，地方不大，人群熙熙攘攘,/Date(1654311019000+0800)/,0,1.193,0,0,0,0,0,0,0,0,0
846,186410849.0,一个不错的地方，可以去看看的。,/Date(1653561455000+0800)/,0,1.582,0,0,0,0,0,0,0,0,0
847,33092106.0,不错的选择可以推荐去看一下吧！,/Date(1653343169000+0800)/,0,3.484,0,0,0,0,0,0,0,0,0
848,91592118.0,环境不错，东西齐全，值得购买，,/Date(1653059662000+0800)/,0,4.247,0,0,0,1,0,0,0,0,0
849,108062002.0,交通便利，四通八达，价格还行。,/Date(1652745564000+0800)/,0,4.219,0,0,0,0,1,0,0,0,0
850,203696729.0,非常喜欢这种地方，周末去很热闹,/Date(1652626894000+0800)/,0,3.909,0,0,0,0,0,0,0,0,0
851,52349895.0,现在应该属于一个打卡的地点吧。,/Date(1652506896000+0800)/,0,-1.481,0,0,0,0,0,0,0,0,0
852,212285577.0,南锣鼓巷是北京知名的旅游景点。,/Date(1652111761000+0800)/,0,-0.124,0,0,0,0,0,0,0,0,0
853,201979593.0,南锣鼓巷是北京著名的旅游景点。,/Date(1652029911000+0800)/,0,3.07,0,0,0,0,0,0,0,0,0
854,159173144.0,古街古巷，适合溜达，流连忘返。,/Date(1651650604000+0800)/,0,3.852,0,0,0,0,0,0,0,0,0
855,182326811.0,老北京景点很多，这是目的地之一,/Date(1651574372000+0800)/,0,1.087,0,0,0,0,0,0,0,0,0
856,121095545.0,很不错的地方啊，值得一来游玩。,/Date(1651498107000+0800)/,0,2.802,0,0,0,0,0,0,1,0,0
857,29944893.0,环境不错，味道很棒，价格小贵。,/Date(1650416345000+0800)/,0,3.923,0,0,0,1,1,0,0,0,0
858,75914327.0,逛逛就得了，其实也没啥好玩的。,/Date(1650025457000+0800)/,0,2.754,0,0,0,0,0,0,1,0,0
859,8230220.0,总体很漂亮，是个令人放松的地方,/Date(1649470747000+0800)/,0,4.233,0,0,0,0,0,0,1,0,0
860,75646189.0,这里是京城一条京味浓厚的商业街,/Date(1648911334000+0800)/,0,4.229,0,0,0,0,0,0,0,0,0
861,53277194.0,非常喜欢这个地方真的是太好看了,/Date(1648692407000+0800)/,0,0.458,0,0,0,1,0,0,0,0,0
862,2673173.0,风景不错，环境很好，值得一去。,/Date(1648560847000+0800)/,0,4.24,0,0,0,2,0,0,0,0,0
863,98000668.0,北京网红打卡地，历史文化老胡同,/Date(1648531476000+0800)/,0,2.517,0,0,0,0,0,0,0,0,0
864,716975.0,北京的风情街，人啊叫一个多啊。,/Date(1648473568000+0800)/,0,2.202,0,0,0,0,0,0,0,0,0
865,111942711.0,近几年新兴的热点旅游景点.推荐,/Date(1648398378000+0800)/,0,3.149,0,0,0,0,0,0,0,0,0
866,46524352.0,位于东城区交道口附近，人很多，,/Date(1648214605000+0800)/,0,2.533,0,0,0,0,0,0,0,0,0
867,74038814.0,北京很有特色的胡同，还会再来。,/Date(1648156895000+0800)/,0,1.913,0,0,0,0,0,0,0,0,0
868,284635873.0,游客很多 吃的逛的店也多 还不错,/Date(1657850586000+0800)/,0,1.095,0,0,0,0,0,0,0,0,0
869,258584251.0,车水马龙好热闹 人来人往人气旺,/Date(1652313239000+0800)/,0,3.215,0,0,0,0,0,0,0,0,0
870,418444.0,"南锣鼓巷是北京几条胡同的统称。
去过好几次了，里面有一些说得出故事的老宅子。
其他的就是商业，比如酒店和餐饮。",/Date(1657679208000+0800)/,0,-1.058,0,0,0,0,0,0,0,0,0
871,1224871.0,一条变味儿的胡同  过于商业化,/Date(1653948445000+0800)/,0,-0.846,0,0,0,0,0,0,0,0,0
872,385551110.0,二十多岁就经常去 觉得那地方 如诗如画 下小雨时候更惬意 但是现在我去过上百次了 麻木了😅光逛 不要钱可以去 去过后可以去后海 什刹海逛逛感觉不错 都没有门票,/Date(1645447656000+0800)/,0,4.252,0,0,0,0,1,0,0,0,0
873,893688.0,"南锣鼓巷刚出名的几十年年前就去打卡过，那时候就觉得太一般了。是有很多名人故居，但是人家也不让你进去啊！
后来有一次会议安排在巷子里的酒店，于是又来来回回走了好几趟，感觉那里的商店都是为了游客而开，反倒是土著居民买柴米油盐倒不方便了。
要说景色，北京有的是这样的巷子，真的没有必要特意去。当然可以选择去了就带着眼睛，所以也就是这个算是性价比还可以吧",/Date(1667112082000+0800)/,1,-9.505,0,0,0,1,0,0,0,0,0
874,1931821.0,一条有渊源有文化的巷子，名声在外，适合难得一去时的照相打卡，你说有啥可玩的当然是另一回事了,/Date(1655509379000+0800)/,0,-3.051,0,0,0,0,0,0,1,0,0
875,85758230.0,这个地方真是适合各种场景，之前跟爱人一起来，现在带小孩一起来，每一次都有新的体验，非常棒,/Date(1648534382000+0800)/,0,4.242,0,0,0,0,0,0,0,1,0
876,85600231.0,老北京特色的街道之一，也是游客必到的景点，古色古香，还有各种地方特色美食小店，值得逛逛,/Date(1650638660000+0800)/,0,4.279,0,0,0,0,0,1,0,0,0
877,25919976.0,春节期间去的南锣鼓巷，还是挺热闹的，哈哈。各种商品琳琅满目，吃喝用度是应有尽有啊。一种小吃最受孩子们欢迎，吉事果，冰激凌加上泡芙的味道，是孩子们对南锣鼓巷的记忆。,/Date(1614034086000+0800)/,0,4.286,0,0,0,0,0,2,0,0,0
878,36975524.0,北京生活的人很少或者说不会去南锣鼓巷吧，这是我的看法啦，游客味道太浓郁了没啥意思,/Date(1655989652000+0800)/,0,-2.323,0,0,0,0,0,0,0,0,0
879,3563502.0,不是很淳朴 但也不算商业 感觉挺小资的一个地方 去的话 一定要走一下边边角角的胡同 别有一番风味 说不定还碰到一位素描的画家给你画像,/Date(1642054241000+0800)/,0,3.913,0,0,0,0,0,0,0,0,0
880,34722569.0,北京最古老的街区之一，是我国唯一完整保存着元代胡同院落肌理、规模最大、品级最高、资源最丰富的棋盘式传统民居区，也是最赋有老北京风情的街巷。周边胡同里各种形制的府邸、宅院多姿多彩，厚重深邃。南锣鼓巷及周边区域曾是元大都的市中心，明清时期则更是一处大富大贵之地，这里的街街巷巷挤满了达官显贵，王府豪庭数不胜数，直到清王朝覆灭后，南锣鼓巷的繁华也跟着慢慢落幕。,/Date(1623448693000+0800)/,0,4.286,0,0,0,0,0,0,0,0,0
881,2397824.0,"南锣鼓巷以前是北京中心的一条普通的小胡同，我曾经从这里路过无数次，从没有感到她的存在。可现在却成了红极一时的旅游打卡地。据说这是由于一个喜欢中国老物件的外国人的缘故，老外的名字我没有记住，这是南锣鼓巷一个叫做创可贴的商铺女店员告诉我的，这个外国人就是这家店铺的老板。老板的事我可是依稀记得的。
　　从南锣鼓巷南门进入时需要扫北京健康码，还有下载南锣鼓巷的微信小程序。如果从北门进则一切皆不需要。
　　南锣鼓巷主要是一些文创小店，就如同各个城市常见的文创小店一样，可以买到一些老物件、新颖稀奇产品、当地特产、各种小吃。当然你也可以走出商业街，到相连的小胡同一游，体验一下北京老胡同的味道。
　　南锣鼓巷位于市中心地带，公交线路很多，有地铁6号线、13路公共汽车等线路。
现在携程点评不知道为什么贴不了照片了，也没处反映，只好不贴了。",/Date(1620008257000+0800)/,0,4.286,0,0,0,0,0,1,0,0,1
882,1649913.0,南锣鼓巷全免费，疫情期间需要预约，在现场预约也可以 要求不严。有很多精品店可逛，巷尾有家炸酱面还行，25一碗，据说是网红店,/Date(1614699572000+0800)/,0,-8.005,0,0,0,0,0,0,0,0,0
883,233903584.0,"去自行车🚲来的网红景点之一南锣鼓巷。
其实来的时候就没有抱很大的期望，其实就是来看看而已，实事也是如此，商业化太重，没有古街古巷应有的格调。
因为疫情原因，旁边的很多巷子都没有开放，所以街头街尾走一走，就结束了行程。",/Date(1602775495000+0800)/,2,-2.968,0,0,0,0,0,0,0,0,0
884,48298747.0,北京还是挺不错的，由于我去的比较仓促没有时间去别的玩，我就去了南锣鼓巷，非常的热闹很多小吃，我最喜欢吃的爆肚25块钱一份特别好吃，当然我也吃了别的好吃的，但是酷爱爆肚，我还吃了北京的涮锅都不错，三里屯的酒吧也不错，我就不一一上传照片了,/Date(1451262292000+0800)/,34,4.285,0,0,0,0,0,3,1,0,0
885,41652302.0,南锣鼓巷，曲曲折折的都是北京的老胡同，黄包车、红灯笼、灰墙、青瓦、蓝天、白云...越是寒冷，越是满满的老北京味道。现代化与古香古色的小商铺相映生辉，北平冬日的寒冷与路边小店新鲜食物的热气腾腾交汇，来一只糖葫芦，整个冬天都满足。,/Date(1449210345000+0800)/,48,2.918,0,0,0,0,0,1,0,0,0
886,42964429.0,这里的小吃很多哦，我觉得这里的环境和小吃都要好于王府井哦！我在这里淘到很多东西，也给家人买了一些东西。这里离后海什刹海很近的。超级好玩，，，我建议在这里玩两天哦！先去南锣鼓巷，然后去逛逛胡同，晚上再去后海。。。很棒的。,/Date(1447406880000+0800)/,56,4.286,0,0,0,1,0,2,2,0,0
887,18768670.0,这里最好避开节假日吧，因为人多，当然人多有人多的好处，比如热闹阿，里面有很多文艺小店，小酒吧，可以三五朋友在夜幕降临的时候坐在里面谈天说地阿，很是惬意的，最主要的就是感觉很棒，最推荐的就是如果住的近最好步行过去，那里走着到后海也很近的，到簋街就得坐车了，但是簋街的小吃街很大部分是饭店，玩到很晚了的话可以坐三轮车回去，夏天的话很凉爽，可以欣赏夜景，赶觉很棒的。尤其是下过雨之后。,/Date(1446532605000+0800)/,26,4.286,0,0,3,1,0,1,1,0,0
888,32852905.0,对于南锣鼓巷印象最深的是一家小酒馆儿、那是一次说走就走的旅行、朋友说来啊、我就忽然买了票又忽然就到了北京、她家门口是一辆大摩托、又一块小黑板上面写着愿你有酒有肉有姑娘、能贪能笑能干架、这肯定是一个很豁达很随性的老板、我个人是小公举类型的喜欢甜甜的腻腻的那种、她为我调了一杯百利甜、给弟弟来了一瓶深粉象、她家不像后海那种乱哄哄的、而是放着自己喜欢的音乐随意聊聊的那种、让一个都市外乡人找到了可以安定落脚的地方、,/Date(1446015377000+0800)/,51,4.286,0,0,0,0,0,0,0,0,0
889,33785593.0,以前第一次去北京的时候，还是有点意思。,/Date(1679404043000+0800)/,0,-2.936,0,0,0,0,0,0,0,0,0
890,418444.0,"南锣鼓巷是老北京的一条胡同，两边分布着大大小小的好多胡同。
交通非常便利，地铁六号线有一站就是南锣鼓巷。
不过现在商业氛围太浓重了，都是卖东西的，而且价格比较高。",/Date(1649815443000+0800)/,0,3.087,0,0,0,0,1,0,0,0,0
891,255713466.0,相比王府井能吃的东西很多，价钱也合适，有意思的是条条外伸的胡同，烟袋斜街就在这里。溜达着去后海也不错。看了鬓边不是海棠红后，对这里更有感觉了，锣鼓巷头和锣鼓巷尾住着两个相爱的人。,/Date(1588896995000+0800)/,1,4.285,0,0,0,0,0,0,0,0,0
892,6255115.0,北京核心区的胡同景点，离什刹海恭王府什么的不远，北边奥林匹克，南边故宫王府井,/Date(1652780861000+0800)/,0,4.14,0,0,0,0,0,0,0,0,0
893,31091595.0,真的很值得去，原汁原味的老北京胡同市井气息，平常去最好，不要赶上节假日，人少可以照相逛胡同，很美,/Date(1630238119000+0800)/,1,4.283,0,0,0,0,0,0,0,0,0
894,114353704.0,感觉现在的南锣鼓巷成了一个纯粹的夜市小吃街，没啥特色了,/Date(1660049966000+0800)/,1,-0.611,0,0,0,0,0,1,0,0,0
895,35546121.0,作为曾经在这里长年居住的老居民，只能告诉你们这里的一切都是后来人工制造的。,/Date(1650628034000+0800)/,0,-7.484,0,0,0,0,0,0,0,0,0
896,26549414.0,原来就是很小的一条胡同儿，现在北开发成一条北京风情的商业街，还不错可以看到老北京的民居四合院儿，有点老北京的意思！,/Date(1621561880000+0800)/,0,4.285,0,0,0,0,0,0,0,0,0
897,2169465.0,北京的民俗老街，因为有了地铁站现在人流如潮，也更加商业化了。人一多，味道就变了，尤其跟原先这里所标签的文艺范儿反差太大。餐饮和小店也越来越大路，越来越贵。人少的早晨还能去看看，其他时间不推荐。,/Date(1476175803000+0800)/,38,4.271,0,0,0,0,0,0,0,0,0
898,6911091.0,北京热门景区，紧邻什刹海，不过就是商业气息太严重了，而且商品同质化！,/Date(1652283740000+0800)/,0,3.717,0,0,0,0,0,0,0,0,0
899,17693442.0,南锣鼓巷是北京最有名气的一个老北京风情街，有北京最有特色的胡同文化，但是商业气氛太浓了。,/Date(1641504745000+0800)/,1,3.71,0,0,0,0,0,0,0,0,0
900,339131319.0,是北京的最古老的街区之一，也是保存最完整，规模最大的元代建筑群。,/Date(1659610683000+0800)/,0,2.768,0,0,0,0,0,0,0,0,1
901,235565.0,这种以酒吧，小商品和各色餐饮组合在一起的地方，其实已经失去了传统文化底蕴，本来是供游客浏览老北京特色风俗的地方，换成中西合璧，也就没有了味道,/Date(1659837666000+0800)/,0,4.28,0,0,0,0,0,0,0,0,0
902,17322407.0,环境优雅，交通方便，价格合理，服务周到，配套齐全，味道正宗。,/Date(1659766534000+0800)/,0,4.284,1,0,0,1,1,0,0,0,0
903,55017115.0,为她准备的竹简书，戒尺，木梳，发簪，突然发现自己越来越喜欢中国传统文化了，最近买东西都是中国风🇨🇳 以前总觉得古色古香的东西有些老成，在这座城市生活快十年了，被他的魅力深深吸引住了。逛了个南锣感觉莫名去了上海[偷笑],/Date(1614261777000+0800)/,1,4.286,0,0,0,0,0,0,0,0,0
904,36595844.0,"南锣鼓巷北起鼓楼东大街，南至平安大街，宽8米，全长787米，于元大都同期建成。是北京最古老的街区之一，已有740多年的历史。因其地势中间高、南北低，如一驼背人，故名罗锅巷。到了清朝，乾隆十五年（1750年）绘制的《京城全图》改称南锣鼓巷。
它是北京最古老的街区之一，是我国完整保存着元代胡同院落肌理、规模最大、品级最高、资源最丰富的棋盘式传统民居区，也是最赋有老北京风情的街巷。周边胡同里各种形制的府邸、宅院多姿多彩，厚重深邃。南锣鼓巷及周边区域曾是元大都的市中心。现在各种特色小店，不胜喜欢。",/Date(1598966145000+0800)/,1,4.286,0,0,0,0,0,0,0,0,0
905,3802296.0,曾几何时—这里只有低矮的破平房和基本上每天都不会有什么客人的过客酒吧，后来被改造成了商业区之后基本上没有了一点北京的味道,/Date(1597989740000+0800)/,1,4.199,0,0,0,0,0,0,0,0,0
906,85600231.0,老北京的特色街市，南锣鼓巷也是游客的必到之地，可以慢慢逛吃,/Date(1658587846000+0800)/,0,3.667,0,0,0,0,0,0,0,0,0
907,1467570.0,自从被接手后就变的像三线城市那种破烂的街道了，从小在这里长大，看着他逐渐成为网红后成了一条烂街。,/Date(1673579451000+0800)/,2,3.613,0,0,0,0,0,0,0,0,0
908,264600734.0,其实本是北京一条普通的胡同，后来网络炒红了变成了商业街。,/Date(1656928292000+0800)/,0,0.87,0,0,0,0,0,0,0,0,0
